subreddit,title,selftext,num_comments,score,created_utc,stock/sector,neg,neu,pos
ecommerce,Las jugueteras no se lanzan al comercio electrónico,,0,1,2011-01-03,ECOM,0.041423339396715164,0.9086269736289978,0.049949705600738525
ecommerce,Las tiendas virtuales más visitadas en Navidad,,0,1,2011-01-04,ECOM,0.030493494123220444,0.9241257309913635,0.045380786061286926
ecommerce,How etailers can make January sales easier for customers,,0,1,2011-01-05,ECOM,0.026063885539770126,0.8731749057769775,0.10076117515563965
ecommerce,"Internet, el canal perfecto para comprar regalos de Reyes y revenderlos",,0,1,2011-01-05,ECOM,0.02852538973093033,0.9146188497543335,0.05685577541589737
ecommerce,Mobile commerce takes off over Christmas,,0,1,2011-01-06,ECOM,0.027134936302900314,0.9222603440284729,0.050604771822690964
ecommerce,Making upgrades easier | NETELLER Blog,,0,1,2011-01-10,ECOM,0.020565034821629524,0.7522355914115906,0.22719937562942505
ecommerce,How VIP fees work | NETELLER Blog,,0,1,2011-01-10,ECOM,0.04592385143041611,0.9261635541915894,0.0279125664383173
ecommerce,EEUU bate su récord de venta online en Navidad,,0,1,2011-01-10,ECOM,0.03717402368783951,0.90300452709198,0.05982137471437454
ecommerce,Buy online with your Net+ card and win | NETELLER Blog,,0,1,2011-01-11,ECOM,0.020963089540600777,0.9072343111038208,0.07180260866880417
ecommerce,"More languages, more options, more ways to use NETELLER | NETELLER Blog",,0,1,2011-01-11,ECOM,0.025047240778803825,0.940840482711792,0.034112244844436646
ecommerce,Addis Network crea la tienda virtual de diamantes Diamantisimo.com,,0,1,2011-01-11,ECOM,0.026559798046946526,0.9326474666595459,0.04079269617795944
ecommerce,Deposit money instantly into your NETELLER eWallet from Russia  | NETELLER Blog,,0,0,2011-01-11,ECOM,0.02597646601498127,0.9317964315414429,0.042227111756801605
ecommerce,practical and bespoke software development,,0,1,2011-01-12,ECOM,0.03274144232273102,0.9354062080383301,0.031852297484874725
ecommerce,Las marcas se hacen fuertes en las redes sociales,,0,1,2011-01-14,ECOM,0.022082636132836342,0.9111221432685852,0.06679517775774002
ecommerce,De l’aide pour nos membres NETELLER parlant français | NETELLER Blog,,0,1,2011-01-17,ECOM,0.037231724709272385,0.9069032073020935,0.055865105241537094
ecommerce,How to Track Ecommerce Transactions With Google Analytics,,0,1,2011-01-18,ECOM,0.03692110627889633,0.9300209879875183,0.03305785357952118
ecommerce,Compagnie de Provence brought to the U.S. by Rain Collection,,0,1,2011-01-20,ECOM,0.029995931312441826,0.8956690430641174,0.0743349939584732
ecommerce,"12 Volt TV - Great for RVs, Trucks and Boats",,0,1,2011-01-20,ECOM,0.02359682135283947,0.9127954244613647,0.06360773742198944
ecommerce,Internet: el principal medio de reserva para 2 de cada 3 hoteles,,0,1,2011-01-21,ECOM,0.024088330566883087,0.8764440417289734,0.09946760535240173
ecommerce,Online Business Marketing Plan,,1,1,2011-01-24,ECOM,0.031644951552152634,0.9427938461303711,0.02556120604276657
ecommerce,How to make your shopping cart suck less,,0,2,2011-01-25,ECOM,0.5156953930854797,0.45997095108032227,0.024333683773875237
ecommerce,Do Your Users Have Shopping Cart Abandonment Issues? (Infographic),,0,1,2011-01-26,ECOM,0.08910249918699265,0.8884684443473816,0.022429117932915688
ecommerce,Patio Umbrellas,"Online store with huge collection of **patio Umbrellas**, market umbrellas, offset umbrellas, umbrellas stand and other accessories with free and safe shipping.",0,1,2011-01-27,ECOM,0.015329089015722275,0.9340702891349792,0.050600580871105194
