subreddit,title,selftext,num_comments,score,created_utc,stock/sector,neg,neu,pos
Ebay,Urgent advice needed regarding retracted bids,"Hey guys, Basically someone has retracted a bid twice today with one hitting my reserve price. I'm new to eBay and stumped as to what to do. The item for sale ends in about 6 hours time",5.0,3,2013-07-21,EBAY,0.07501596957445145,0.9008597731590271,0.024124253541231155
Ebay,What do i list this laptop as?,"Hi,
I'm going to list a laptop on eBay later tonight. Everything on it works as it is supposed to except the battery. Should i just take good pictures and leave a clear description, and make it clear the battery doesn't work? And is it okay to list it as USED?",9.0,2,2013-07-21,EBAY,0.028908222913742065,0.9283530116081238,0.04273875430226326
Ebay,How do buyers get away with this? Does eBay care at all?,"http://i.imgur.com/oTPPRE9.jpg

We just got a negative feedback for someone saying they didn't get their item and we ignored their attempt to contact us.

First of all, the item shows as delivered. Second of all, the buyer NEVER contacted us. My email, ebay link to contact us, and phone # is plastered all over the place. They are 110% bullshitting and did NOT attempt to rectify the issue.

I am a one-man shop, there is no chance someone ""else"" picked up the phone, etc. There are no messages from this person or emails at all, nothing.

I have a flawless record on eBay, I sell about 300 items a month and literally ship same day ALWAYS. I reply to emails within minutes if at a computer, if not it's never more than a few hours.

Not only that, I re-ship items for FREE if people say they didn't get them, even if it shows as ""delivered"" (we all know the USPS sucks, and to maintain our excellent ratings this is just another thing we do to cover our ass).

What do I do? I already responded to the buyer very politely mentioning that we had received 0 contact and would love an opportunity to fix the issue.

Does eBay care at all about these bullshit feedback remarks?



**[Update]**

Just an update, as expected, eBay chose to do absolutely nothing with regards to this matter. Despite paying them thousands of dollars a month in fees and subscriptions, they simply don't care. They were nice on the phone, but they are not willing to assist.

The buyer is unresponsive and has not replied to any contact (still). Also, even after explaining how the buyer left multiple negative feedback for multiple sellers saying the same things (no reply, item not delivered), they still refused to assist me as a seller.

So the answer is (as expected), **Nope! eBay could care less about your reputation being damaged by bullshit buyers.**

They'll apologize for the issue, since they're paid to do so, but they won't actually fix it. Not really sure why I wasted my time trying. This is no surprise to me, given the horror stories I've discussed with peers as well as here on Reddit.",8.0,1,2013-07-21,EBAY,0.09238076955080032,0.8777909278869629,0.02982834354043007
Ebay,new to ebay auctions and have a problem with the shipping cost,"I think this is some sort of mis-understanding and i would just pay the higher shipping but it totals up to be more than my prepaid card has on it. ($20)

http://imgur.com/a/HUSov",9.0,1,2013-07-21,EBAY,0.03041515313088894,0.8397821187973022,0.12980271875858307
Ebay,I just realised I've bought &amp; paid from a new user who has a Nigerian name.. how do I get my money back?,"I saw something I wanted to buy at a great price so I clicked buy it now, commit to buy and paid.

Then I noticed the guy had 0 feedback. I googled his name from the PayPal email and turns out it's Nigerian.

I have dealt with about 6 or 7 nigerian people whilst selling on eBay and Amazon and all of them have tried to scam me. 

Is there anyway I can withdraw the PayPal payment?",6.0,0,2013-07-21,EBAY,0.03118693269789219,0.910534143447876,0.058278888463974
Ebay,Keep getting burned by fake bidders?,"I'm trying to sell my old iPhone 4 and I've already had to relist it twice and open unpaid items cases to get my FVF back.

Each time I will be getting legitimate bidders but always at the last minute they are outbid by someone with 0 feedback and an account that's hardly a month old. Even now the 3rd time it's listed I've already got 2 accounts like this, one even showing his location as China, and they are outbidding legitimate bidders. I've tried 2nd chance offers, and they aren't accepted.

This is incredibly annoying that I'm almost a month in trying to sell something. What can I do beyond just blocking people with 0 feedback when they bid?",14.0,7,2013-07-22,EBAY,0.07067440450191498,0.8972141742706299,0.03211137279868126
Ebay,Buyer has requested invoice 22 times in the last 20 minutes. [Question],"About a week ago I had a buyer buy 3 items, 2 from one of my accounts and 1 from my other account. After 2 days of not paying I opened an unpaid item case on all 3 items. The buyer requested an invoice with updated shipping information (he/she sent 11 requests that day &amp; the items were all free shipping). The buyer in Australia so I pointed out that my listings all say ""ships to United States"". Today the buyer has sent me 22 invoice requests in a span of 20 minutes. The only difference between any of these requests is that one was sent from a different user name. I have no idea how someone can send a request from an ID that did not purchase the item. Has any one experienced this? And how exactly do I proceed? I don't want to pay a final value fee on these items. The buyer did go ahead and pay for 1 item and I promptly refunded the money.",15.0,6,2013-07-22,EBAY,0.03006584383547306,0.9288716912269592,0.04106247425079346
Ebay,"If a seller adds photos and/or adds to the description for a fixed price listing (after a purchase had been made), is there a note in the listing saying its been revised?",,3.0,4,2013-07-22,EBAY,0.032957155257463455,0.946700394153595,0.020342448726296425
Ebay,"I'm desperately trying to buy this product from the US from Australia and I've turned to eBay, can anyone with experience let me know that this is too good to be true?",,5.0,4,2013-07-22,EBAY,0.02193342335522175,0.8765953183174133,0.10147124528884888
Ebay,Having Trouble Accurately Calculating Final Value Fee After Top Rated Seller Discount,"Hello everyone, I'm trying to figure out how the top rated seller discount works and so I went to the link here http://www.fees.ebay.com/feeweb/feecalculator to try and estimate my FVF before and after the top rated seller discount. When I estimate it on a purchase that totals $187.45 it says the FVF would be $11.21 before the discount, and then $9.10 after the discount. When I calculate 20% off I am getting $8.97. I know this is very minimal however I hate looking up my FVF's for each and every item I sell an item. I would much rather have my excel sheet automatically calculate the fee after the discount however my numbers are not matching up. wtf?",2.0,3,2013-07-22,EBAY,0.08861815184354782,0.874504029750824,0.036877863109111786
Ebay,What does sending payment to incorrect paypal do?,a,2.0,3,2013-07-22,EBAY,0.02540586329996586,0.9179338216781616,0.05666033551096916
Ebay,Question about selling price,"Say I sell something starting out at .99, someone bids that and that's my only offer. Do I have to sell it to them for .99? 

If you have had this question before - *sorry*! I'm new to this.",9.0,3,2013-07-22,EBAY,0.03219737857580185,0.9292936325073242,0.03850901871919632
Ebay,Sold printer/fax to buyer. Now buyer is saying fax part doesn't work. She opened a case. Is ebay gonna screw me over?,"In the description we said ""Well-taken care of. Tested. Good working condition. No returns on this item. Selling as is""

We had tested the printer portion to make sure it worked and it did. We did not test the fax but the fax had been working previously.

We've never had a case like this opened against us. We are a business selling off our old equipment. Does anyone have any experience with this? If ebay sides with the buyer, are we going to lose the printer and the money? I really think this is a case of the buyer not knowing how to use the fax correctly.",5.0,2,2013-07-22,EBAY,0.06233065575361252,0.8936384916305542,0.044030796736478806
Ebay,Confirmed Paypal Buyer but only 1 Feedback... any scam possibility?,"I have a multiple-item, fixed-price listing. Buyer purchased 2 separately but only pays for one. Buyer only has 1 feedback (though it is positive) from a purchase made in 2011. I send an ebay message asking if the double was a mistake and they respond yes and clarify that they only meant to purchase one.

In the past few hours, I've sent an email to the Paypal address asking they confirm their purchase and sent a cancellation request for the item purchased in error. They have yet to respond to either, but it's been less than a day.

The transaction is eligible for seller protection and their Paypal address is confirmed. Is it safe to send the item?",3.0,2,2013-07-22,EBAY,0.05596086382865906,0.9051281213760376,0.03891097754240036
Ebay,The Real Schindler's List For Sale On EBay: My Thoughts,,0.0,1,2013-07-22,EBAY,0.016304755583405495,0.9286874532699585,0.055007774382829666
Ebay,My ebay business has been crippled by repeated non paying bidders. What can I do?,"In the last few weeks the bulk of my auctions have been won by non paying bidders.  Today, one of my biggest auctions in weeks was won by another non-paying bidder whose feedback shows serial non-paying-bidding in recent weeks.  

What can I do?

It really feels like there's nothing eBay will do to help me, and everything is working against me here.  

I relied on this income, but now I'm afraid to list anything because it will just get tied up for two weeks in a worthless auction and subsequent non paying buyer case.  

EDIT:  I'm kinda of a jerk for posting this when there was another post just like this on the front page.  My mistake, shouldn't have posted angry.",24.0,8,2013-07-23,EBAY,0.3836817443370819,0.5898981094360352,0.026420220732688904
Ebay,"Buyer wants to meet to pick up my item but still pay me via PayPal. What is my protection as a seller in this scenario? I can have them sign a receipt, even take a picture of them with my item.","~~I'm having trouble finding the official paypal/ebay stance on item pickup. [This is regarding the post I made yesterday](http://www.reddit.com/r/Ebay/comments/1it7os/just_completed_my_first_large_scale_auction_as_a/).~~

~~I'm looking at taking a 6 hour each way roadtrip to meet the buyer of this item. A lot of money is involved, so I really don't mind making the trip. I'll insist on still charging the $120 I had listed for shipping in the auction to pay for my delivery of the item. And I'll insist that he complete the paypal transaction before the trip occurs (he hasn't paid yet while we've been discussing this delivery option). If he doesn't like any of that we can just stick with shipping the item.~~

~~But what risks am I taking with ebay or paypal for delivering an item myself? Like I said, I can get him to sign a recipt~~

EDIT: After reading several warnings online about Paypal pickup, I sent the buyer a message saying that I would go ahead and stick with the original shipping option that I had stated in my auction. No need to make a 12 hour drive and risk getting screwed.",6.0,5,2013-07-23,EBAY,0.07832476496696472,0.8796666860580444,0.04200854152441025
Ebay,Alternative Auction sites,Hi all are there any auction sites that i can sell my Paintballing Gear on. Ebay UK wont allow you to sell markers,3.0,4,2013-07-23,EBAY,0.048886481672525406,0.9033811092376709,0.0477323979139328
Ebay,Ebay Now Home Delivery Service Is Now On Desktop,,0.0,4,2013-07-23,EBAY,0.014719733037054539,0.907437801361084,0.07784245163202286
Ebay,Some Packaging and Shipping Questions,"I have a few more questions for everyone...

1. Can you only use priority mail boxes from usps.com for priority mail? Probably a dumb question and I'm assuming so, but just checking.

2. On http://uspssupplies.ebay.com/ there is an eBay Shoebox
Box Dimensions: 7 1/2 "" X 5 1/8"" X 14 3/8"". Is this suitable for books, and could I send this as media mail? If not, where would I find boxes to send for media mail? Any tips to safely package books so they arrive okay at a low cost?

3. Where do you get your boxes from? I already have a stock of priority boxes and envelopes from usps but whenever I order things from ebay I never receive priority packages so are most people against this?

4. Last question - pertaining to delivery of said boxes. I heard there is a limit to how many packages you can ship through usps at any given day. How do big sellers get past this limit, and how much is it? Also is arranging a usps pickup for my packages a smarter move than dropping them off at the post office?

Thanks.

Edit: Oops, one more question. I've never had to really weigh what I've sold before because I've exclusively sold trading cards, so I just got my scale and I'm curious as to how everyone uses theirs. Do you weigh the whole package? Or only what is inside and then add a few ounces for the package itself?",15.0,3,2013-07-23,EBAY,0.029619157314300537,0.9261631369590759,0.04421766847372055
Ebay,Dimensions necessary for ebay labels parcel post?,"I just started using the ebay labels and at first didnt know there was a place to put in box dimensions. Some of my packages are oddly shaped or irregular sized and over 12x12. I always get the weight pretty much dead on, but havent been inputting dimensions. Will the post office ever not deliver or return to sender because of this after i drop the packages off at the post office?",7.0,3,2013-07-23,EBAY,0.04395698755979538,0.9264912009239197,0.02955183945596218
Ebay,Hard drive listed as wrong type,"So I was browsing for hard drives on ebay and when you do so you can filter the various types of drives you are looking for.  I filtered for only SATA and SSD drives.  I came upon a very good deal for a 7200RPM 4TB drive and the seller had great feedback so I purchased it.  When it came, I saw that it looked in good order and left positive feedback as I always do, but in this case I did so a bit prematurely.  Yesterday when I got around to trying to install the drive, I realized that the pin structure was slightly different.  After googling the model number, I discovered that it was in fact an SAS drive instead of what the seller had listed it as.  This is a very small niche of drives used only for servers and enterprise storage solutions.  On the one hand, it means I got an even better deal because the drive is worth more being an SAS drive, but on the other hand it means I have to install a separate controller card for it to work in my system.  I went to Fry's and they didn't even know what an SAS drive was.  I was able to locate a controller card with cables on ebay for $25, which I ordered yesterday.  I messaged the seller alerting him to the issue and politely requested he compensate me for the $25 as a) he listed the drive in the wrong category and b) did not specify the drive as SAS in either the title nor description.  He messaged me back saying it was an ""obvious"" error because the picture of the drive he uploaded showed an SAS configuration.  I'm here to tell you guys, no one would be able to tell that based off of a quick glance, and like I said SAS drives are a very, very small niche of users so it's ludicrous to think the picture alone would have been enough.

I think I am pretty sound moving forward with a case if he decides not to refund me $25.  I asked him what his final intentions were and if he refuses to refund me I will indeed open a case.  My question to you experts is a) given the facts, do you think I am being unreasonable?  I chose the cheapest card with cables available, as these cards can get up to $400 pretty quickly.  b) will ebay allow me to request a partial refund instead of returning it?  I don't want to return the drive, as that would result in a $10 shipping charge for me and then waiting for the time to ship to him and then for me to purchase another drive.  As it stands now I'll have a working drive in my system on Friday when the controller card comes.  

So yeah sorry it's a fairly technical problem, but at the heart of it lies a product that was listed in the wrong category, I made the mistake of buying it due to that, and in my due diligence I was able to right the wrong or ""make myself whole"" as far as the transaction is concerned for a much smaller price than it would have cost to return the drive.  I politely requested the seller compensate me for this and offered to show him the auction I had purchased to prove I wasn't trying to screw him, and his first reaction was to completely disregard me.  Your advice would be greatly appreciated.

*Update*

Well thankfully this had a quick resolution.  The seller sent me  the $25 partial refund along with a nasty message that I should be more responsible as a buyer and to never purchase from him again.  I thanked him, copy/pasted the message into the case file, closed it and let him keep his positive feedback.  In the end I am happy with the resolution.",29.0,0,2013-07-23,EBAY,0.0803905799984932,0.8898063898086548,0.029802976176142693
Ebay,Get up to 90% OFF on Electronics Deals at eBay,,0.0,0,2013-07-23,EBAY,0.014108957722783089,0.8375256061553955,0.14836545288562775
Ebay,Scumbag seller please help report to eBay,,27.0,9,2013-07-24,EBAY,0.020378543063998222,0.9373175501823425,0.042303889989852905
Ebay,eBay Fall Seller Update: Expanded Feedback Removal Policies,,10.0,8,2013-07-24,EBAY,0.03318706154823303,0.9252115488052368,0.04160139709711075
Ebay,"Hey guys, I just wanted some advice on how I should auction my Uncle's large Star Wars Collection","Hi guys, my Uncle left my family a plethora of Star Wars action figures, models, memorabilia and lightsabers, and I was wondering what would be the best way to sell it all from people who have had experience with selling items such as this. 

Sadly most of it is newer stuff, from the three latest movies with the oldest items being from 1997. I don't think we can get much more than what he paid for, so I was wondering if there are ways of making it a more appealing bid, such as grouping the whole set of figures together,  selling them individually or making a large auction of a large set of the items. 

There is around 400-500 different items, ranging from Episode 1 unopened collectable card boxes, to Hasbro lightsabers to a large amount of action figures.

If there are communities that would be interested in this sort of stuff, that I could show the collection to that would be useful as well. that would help as well. I don't really want to try to take it to a convention to sell, since I'm out of town when the bigger ones take place. 

Most if not all is in decent condition and are in their original packaging so I don't think that will be an issue either. I can provide specifics on what sets I have for specific recommendations as well. 

So please share your tips or experience in selling this collection please.

Thanks in advance!",12.0,4,2013-07-24,EBAY,0.013971010223031044,0.8970170021057129,0.08901198953390121
Ebay,Brother Selling Wedding Ring (Help needed),"So my little brother is attempting to sell a very large item on Ebay and has no idea what he is doing.  Sadly, due to her infidelity, the wedding was called off and now he is left with a 5,000$ ring and the pawn shops are not offering him nearly enough.  

Can you experts look at his posting and give any advice on changes that could be made??


http://www.ebay.com/itm/300938787362?ru=http%3A%2F%2Fwww.ebay.com%2Fsch%2Fi.html%3F_from%3DR40%26_sacat%3D0%26_nkw%3D300938787362%26_rdc%3D1",8.0,3,2013-07-24,EBAY,0.016873463988304138,0.8913230299949646,0.09180349856615067
Ebay,Suggestions for selling jewelry.,"Background:  I want to sell a diamond and gold bracelet.  Similar pieces go for ~$2,600 retail in jewelry stores.  I would be happy to get even half of that but nobody is biting on my ""make an offer"" listing.  I don't have any certification forms.  

Does anyone have experience selling jewelry?  Is a certification essentially required for bids?  Will it go for close to retail with a certification?

Is there a better route for selling jewelry than ebay?  

Thanks in advance!",3.0,3,2013-07-24,EBAY,0.020978054031729698,0.917568564414978,0.06145339459180832
Ebay,Sell a phone with Cyanogenmod? Should I take it down?,"I've got an older phone on ebay (Samsung Epic 4G) i had put Cyanogenmod on it, so I decided to sell it like that.  So far I only have 1 bid on it. I have another Epic 4g im selling, and i've got a few bids on it.  Should I take the modded phone down, revert it back to stock, and put it back up?  Would I get more hits?  What does the community think?  [Here](http://www.ebay.com/itm/321169979830? ssPageName=STRK:MESELX:IT&amp;_trksid=p3984.m1555.l2649) is the listing if you are interested in looking at it. [Here is the stock one.](http://www.ebay.com/itm/321169880081?ssPageName=STRK:MESELX:IT&amp;_trksid=p3984.m1555.l2649) How big of a deal is it to cancel an auction before its over?  Do you get big negative hits?",6.0,2,2013-07-24,EBAY,0.026045259088277817,0.9107762575149536,0.06317855417728424
Ebay,"Bought an item that is clearly refurbished, when it was only marked as used. What would you do?","I won an auction for a DS that was listed as Used. Upon arrival, I made a note that several points on the device had been tampered with. If you're interested they are as follows:

- top part's screw covers are after-market rubberised lugs that don't sit well
- bottom screen has been replaced but is sitting askew
- bottom slot dust cover is the typical after-market cheap replacement that doesn't sit comfortably

All in all, I doubt this would be picked up by many other people. It's a very well done refurbishment, aside from the bottom screen. I am very experienced with buying and selling of refurbished items, and can spot them a mile away. 
However I'm not sure how to proceed. I've sent an email to the seller politely informing them that I've found it to be refurbished and not factory original. I'm not sure that I'll get a reply however. 
I'm not sure if I should just leave positive feedback and sell the item myself as refurbished, or raise a claim. 
Either way, I'm not pleased that this item isn't what I originally thought I was purchasing, and will not be keeping it. 

What would you do in this situation?",8.0,2,2013-07-24,EBAY,0.04421553388237953,0.8929458856582642,0.06283851712942123
Ebay,Lost case and buyer gets to return item.. But hasn't after 7 days how long to wait until I call up paypal?,,4.0,2,2013-07-24,EBAY,0.05047798156738281,0.9076713919639587,0.04185068979859352
Ebay,I think this guy overpaid for his raffle ticket today....,,8.0,16,2013-07-24,EBAY,0.0366695411503315,0.9263052940368652,0.037025127559900284
Ebay,You would think the postage could at least be free [Ebay],,0.0,1,2013-07-24,EBAY,0.01661749556660652,0.7774857878684998,0.20589680969715118
Ebay,Sometimes as a buyer I can see the number of watchers. Why? Am I the only one?,"I've noticed that my account will seem to go into a mode where I am able to see the number of watchers on each item page. I think it might be a bug. Has this happened to anyone else?

[See this example](http://i.imgur.com/uGST5Py.jpg)

Just to be clear that isn't my item. Right now I can see similar info on pretty much every item with watchers. This happened about 6 months ago and lasted for a few days. It can be a pretty handy feature (or minorly handy, at least) as a buyer.",10.0,9,2013-07-25,EBAY,0.05902276188135147,0.914225161075592,0.026752108708024025
Ebay,Quick question regarding PayPal,"I recently started using ebay over the past few months with little to no problems. I use prepaid Visa gift cards for all my purchases, but I have been thinking about getting a PayPal to order stuff from out of the country. I tried to use PayPal a while back using a MoneyPak, but they kept asking for my SSN and I'm not comfortable giving that out. If I get a new PayPal and link it to a bank account, would I still need to give out my SSN, DOB, or any other personal info? I don't plan on selling, I'm just a consumer.",9.0,5,2013-07-25,EBAY,0.03008786030113697,0.9285721778869629,0.0413399264216423
Ebay,Buyer left false feedback. Will ebay do anything?,"I had a pair of shorts listed that stated in the description there was a light spot on the back (about the size of a pencil eraser). It wasn't really visible except up close and they are a brand that people want so I went ahead and listed them for $4.50. They were purchased and the buyer messaged me to say there was a *dark* spot on them. There wasn't. I offered twice to give a refund upon return of the shorts. She declined then left negative feedback saying I wouldn't refund the item. I reported it to ebay. Is it possible that ebay will remove it? Since they can see in our messages I offered twice to refund the item?

Edit Update - Talked to CS twice. They could see that the buyer was getting refunds on *all* her purchases except for a couple where the seller demanded the item be returned before refund, those sellers got negs. CS was also notified, by a seller I know, that the buyer sent a message saying ""refund or I have to leave a neg"". The buyer wasn't quite as overt with me. They are ""investigating"". How long does this type of thing usually take?",9.0,4,2013-07-25,EBAY,0.0819263830780983,0.8917649388313293,0.026308676227927208
