subreddit,title,selftext,num_comments,score,created_utc,stock/sector,neg,neu,pos
Ebay,Abundance of phone/ipod problem listings?,"Having been subscribed to /r/ebay for about 4-8 weeks now, I've noticed that the majority of NAD cases seem to be leveled against phone/ipod purchases. As a video game seller, I don't have near this many problems. 

Is the lesson here to stay miles away from phone and ipod sales?",12,5,2013-06-20,EBAY,0.1637161523103714,0.8131348490715027,0.023149017244577408
Ebay,Question about shipping (might have made a mistake...new),"So I listed some items, playing cards, only valued from $0.99 to $9.99, but most (5/7) being &lt;$2.00.  I was planning to ship them in envelopes using regular First Class mail.  It's going to cost me ~$1.00 each so that's what I set the shipping cost at.


I just realized that I can't get confirmation/tracking on that though.  Upgrading to parcel would be $2.00 or more, which is silly for such a cheap item.  My concern is, can I still ship them the way I was intending?  Does Ebay require some sort of confirmation that I sent the item once I sell it?  I would hate to sell a $2.00 card just to pay at least that much in shipping.  I'm panicking here thinking that I made some mistake...I can't really afford to ship them at a loss.",7,5,2013-06-20,EBAY,0.04524431377649307,0.9171594381332397,0.03759625926613808
Ebay,Sold a broken 4th gen Ipod touch for parts on an as is sale. Now I have a case open against me.,"I'll try to explain this as best as I can. On the 16th I sold a 4th gen Ipod touch. It was broken at the time of sale and was held together with tape. I listed it as an as is sale in description and said no returns in the return option.

Here is the exact description:
&gt;Selling this broken Ipod touch. This is the 4th gen model and has 8gb of memory. The screen does not display anything but everything else seems fine. It connects to the computer with no issue (I factory reset it). Not sure of what gone on inside this ipod, it appears to be held together with tape.

&gt;As is sale because of its condition.

&gt;This is for the Ipod only.

Well the buyer received it on the 19th and complained that there was damage on the inside of it. (Should have been obvious the screen is smashed I made sure to show photos). He also claims the item was ""fake"". 

Basically I responded to the case politely and calmly talking about what he said and how I made sure to list it as correctly as possible and sent that to him. I'm just worried that if Ebay makes me refund him and he returns the item that it will be damaged even more than how it started as.

(I have 120 total feedback 100% and this isn't the first item I've sold)

Is there anything else I should do to protect my self?",19,5,2013-06-20,EBAY,0.06784016638994217,0.8800613284111023,0.05209851264953613
Ebay,Some sort of listing application needed. What do you recommend?,"I have been using an HTML template a friend coded for me and just using eBay.com to list auctions and host pictures, but while it's been fine for my sales so far I want to dramatically increase my listings and sales.
What do you use?",3,5,2013-06-20,EBAY,0.10574311763048172,0.38076579570770264,0.513491153717041
Ebay,"""Doesn't match description"" Case - Just a little question, when you read my ad, do you think I'm selling one or two?","I just got a ""Doesn't match description"" case against this item.  Based on his message, he's saying its not the same item that he bought, as he bought a new set in the box, this one is missing pieces, used, and the main thing is he though he bought two pairs... 370830680776

Now, I don't know if this is just a NY thing but, ever since I can remember, whenever I need headphones, I ask for a pair of headphones... If that makes any sense. I told the guy, if I was selling two pairs, I would have made sure to mention ""two pairs"" or ""two sets.""  

I just don't want to be stuck on the losing end because of a technicality.  Thanks",17,4,2013-06-20,EBAY,0.03260073810815811,0.9286043643951416,0.0387948676943779
Ebay,1 Year eBay seller here. Any general advice to get my stores back to top rated selling standards?,"I have been selling on eBay for about a year. Now between 5 stores we make between 30K-60K a month which sound like a lot but is not cutting it due to fees, shipping and various overhead. For awhile we would receive negative feed back for not having thorough eBay descriptions. It would cause problems since we are in the autoparts business and if I have learned one thing people do NOT like waiting for replacement parts for their vehicle. I have listed a lot of loss leader items that are very simple and are always accurate. Any other practices I use??",3,3,2013-06-20,EBAY,0.15967823565006256,0.806385338306427,0.03393644466996193
Ebay,Can anyone clarify something about Ebay's 50 free insertion fees per calendar month?,"I'm a new seller. As I understand it, I get 50 listings per calendar month with no insertion fee. Is this correct or is it that I get 50 listings with no insertion fees only for my first calendar month?",3,3,2013-06-20,EBAY,0.027339739724993706,0.9394210577011108,0.03323924541473389
Ebay,Worried about a seller...,"So I won an auction on Saturday for a Chromebook. I immediately paid with PayPal. The seller, after looking through history, has never sold anything before but has a 100 positive for buying. He listed as will ship within 2 business days of payment clearing. So on Monday I message him asking if the shipping company requires a signature on delivery so I should make sure someone was there to sign. Tuesday comes, no answer yet. Message again asking him to please reply soon. Wednesday same deal, another message from me to him. Today is supposed to be ebay's estimated delivery date, yet the listing shows it has still yet to ship. I contacted ebay over this who said to wait till Saturday and if situation still hasn't resolved I can file a report. Is it possible for the seller to ship it but just not update ebay listing to give a tracking number or say it's shipped ? Is this common amongst non commercial sellers? I was really excited to get this ultrabook but seems to be causing more grief then anything. Any advice or opinions for a ebay newbie in a crappy situation?",13,3,2013-06-20,EBAY,0.050086859613657,0.9195942878723145,0.030318906530737877
Ebay,Can I accept buyers' offer after I've counter-offered it?,"I have some stuff to sell before I got off to France for a month next week, and I really needed to sell this $300 item. I wanted $275 so when I got a $250 offer, that's what I countered. Now I wish I had just taken the $250. Assumedly, I can't take back the $275 and just take the $250 can I? I flip stuff on eBay and I got this airsoft gun in a trade for a huge profit, but the problem is selling the damn stuff.",6,2,2013-06-20,EBAY,0.1491660326719284,0.8105859160423279,0.04024805873632431
Ebay,Negative feedback AFTER an item was returned and refund was given. Anything I can do?,"I sold a camera lens to a person in Israel and she claimed it had two cracks in the front. The item I shipped had no cracks in it, so I assumed the item was damaged in shipment. I offered a refund and she returned the item to me. I gave the refund and she left negative feedback today, 4 days after the refund was given with, ""Lens of low quality, did not want to retun the money."" First negative in 12 years, is there anything I can do?",5,9,2013-06-21,EBAY,0.8296075463294983,0.14185985922813416,0.028532687574625015
Ebay,Anyone seen or use this yet? Report buyer.,"You are now given the opportunity to report a buyer by eBay. I could have used this last year.
http://i.imgur.com/kivXr3w.png",16,7,2013-06-21,EBAY,0.024469703435897827,0.9225403666496277,0.05298986658453941
Ebay,Buyer says he never received his package. Tracking information says otherwise.,"I knew sooner or later I would run into a problem like this.  My buyer says he has not received his item and has opened a case against me.  My USPS tracking information shows that the package has delivered to his residence.  I even messaged the buyer to confirm that it was shipped to his correct address. 

The item only sold for 5 dollars so I obviously didn't put any insurance on it.  If my tracking information says that it has been delivered.. is he lying or did it really not show up at his house?  How can I prevent this in the future?

I appreciate any help I get!",14,7,2013-06-21,EBAY,0.05796211585402489,0.890630304813385,0.05140754580497742
Ebay,Offered a refund via the Resolution Center but buyer hasn't returned the item,"A buyer opened a not as described case against me and I've agreed to refund the cost once the item is returned and this was two weeks ago. The buyer hasn't returned the item yet and they aren't responding to messages. My question is, when can I/Ebay shut the case?",14,6,2013-06-21,EBAY,0.06548750400543213,0.891230583190918,0.04328188672661781
Ebay,"First time encounter with a fraud. Was suppose to get Rush Hour 2 in Brand New condition, and this is what i got!",,13,6,2013-06-21,EBAY,0.03616464510560036,0.8782733082771301,0.08556200563907623
Ebay,Buyer returned an item to me that should have gone to a different seller,"Well, this is a first.

Today I received a return for an item I didn't sell! I've sold items to this buyer before but not this particular item.

I've sold a lot of these and recently a few have had problems. When he asked to return it I told him no problem and forwarded full return instructions. It never occurred to me that someone would try to return something to me that they hadn't bought from me...!

I've sent the buyer a note and explained the situation. Now I await his reply. I think I know who he bought it from and that seller doesn't accept returns. It's going to be interesting to hear what the buyer has to say...",4,5,2013-06-21,EBAY,0.12228374928236008,0.8427324891090393,0.03498376905918121
Ebay,LOTS of requests to end and auction early with people asking me for a price,"Anyone else come across this, I am not a major ebay user so maybe this is normal etiquette.

Since I listed my item I have had 3-4 different people each ask how much I would be willing to end the auction early for, to me it seemed quite bizarre as its an auction situation so to end it early is likely to cause me to lose out unless I ask for quite a bit more.

So is this normal or should I be reporting to ebay or something?",5,3,2013-06-21,EBAY,0.07727645337581635,0.8876283168792725,0.035095248371362686
Ebay,How do you manage the coordination between printed labels and their respective item?,"It's very easy to print labels for every item that needs to be shipped.  However, doing all labels at once with a variety of items makes it difficult to get labels onto the right items, especially if they are similar items.  Does anybody have any tips for making this process easier?",8,3,2013-06-21,EBAY,0.03364144265651703,0.926642656326294,0.03971589356660843
Ebay,Buyer claims I shipped completely different item,"I recently sold a Blackberry to someone that was using a forwarding service in Miami.  The confirmed Paypal address was an Aeropaq shipping service address.  I have shipped Blackberries in the past to shipment forwarder type addresses and haven't had a problem.  The problem is the buyer claims I sent him a pack of pens instead of a phone.  He took a picture of my package with the pens and a receipt from Aeropaq stating I shipped a box of pens.  There wasn't anything I could do but refund his money.  I am assuming the switch came from Aeropaq, but I don't know.  Does anybody know if Aeropaq or similar type services actually open up the packages before they forward them on?  Has anybody else had a similar problem?",8,3,2013-06-21,EBAY,0.0716148316860199,0.8967666625976562,0.031618572771549225
Ebay,How long does it take for a purchase to be charged to my bank account?,"I bought some headphones from a South Korean seller. The item has already been shipped and I have a tracking code. 

Paypal says:

&gt;Add Funds from a Bank Account - Completed - 

&gt;Order Status:	
	Shipped (Jun 20, 2013)

However, my bank account does not say anything about this transaction. Paypal is using the correct account as well. The sale was completed on the 19th (yesterday) and has yet to show up.

I just did a Humble Bundle purchase before this purchase and used paypal and it's there. 

So why isn't it showing up on my bank statement?",2,2,2013-06-21,EBAY,0.03175049275159836,0.9271629452705383,0.04108649492263794
Ebay,The Marketplace Fairness Act: Should You Join The Fight to Defeat It? - Forbes,,0,1,2013-06-22,EBAY,0.032691020518541336,0.7359659671783447,0.23134298622608185
Ebay,Fucked up eBay auction.,,1,0,2013-06-22,EBAY,0.032349735498428345,0.8580451607704163,0.10960512608289719
Ebay,Feedback extortion question.,"How fine of a line is it for someone to avoid a feedback extortion complaint if they never mention that they will leave a negative? 

Primarily due to this message ""If you want this purse back I would expect to be reimbursed for the cost to return it. I was going to leave feedback about this, but I was told to message you first and wait and see what if anything you wish to do to fix this issue.""",14,0,2013-06-22,EBAY,0.09507542848587036,0.8757295608520508,0.029195047914981842
Ebay,"We would like 5 people to beta test our ebay application-- Item Alert, officially launching in fall 2013.",,11,0,2013-06-22,EBAY,0.013969356194138527,0.9328824877738953,0.05314816161990166
Ebay,Combined shipping costs higher than expected,"I bought 11 items (coins) which had $1.62 shipping each. The seller explicitly said that they do combining shipping on multiple items and they didn't mention anything about the shipping costs.

I received the consolidated invoice from the seller with a $14.27 shipping cost. I expected the shipping to be closer to the $1.62 than to 11 x $1.62 and if I would have known that it was $14.27, I wouldn't have bought them. On my previous purchases (from other sellers), the combined shipping costs were the same as the price for one unit.

What are my options?",17,3,2013-06-23,EBAY,0.05393031984567642,0.9054895043373108,0.040580131113529205
Ebay,"Buyer states that item isn't as described, help.","So my buyer bought a pair of shoes shown in this listing http://www.ebay.com/itm/111087385081?ssPageName=STRK:MESOX:IT&amp;_trksid=p3984.m1559.l2649. The buyer complained that 

&gt;I received the corks and noticed that the right shoes was tried on and there is a crease and dirt on the bottom of the shoe? I thought these were new?

He provided with the following proof of said complaints

*http://pic100.picturetrail.com/VOL1057/4391911/23975900/407035617.jpg
*http://pic100.picturetrail.com/VOL1057/4391911/23975900/407035618.jpg

So my question to you Reddit, is if I should refund this guy. I stated multiple times that they are indeed 100% new and the pictures he provided shows no dirt on soles, and no crease lines but rather imperfection of the shoe by Nike manufacturing; especially because it's a shoe made with cork material. How should I respond to him Reddit? 

P.S. sorry if formatting is bad, first time posting.",8,3,2013-06-23,EBAY,0.02687416784465313,0.8983893394470215,0.07473655045032501
Ebay,Anyone have some good free ebay template sites?,,2,3,2013-06-23,EBAY,0.03536731004714966,0.9310961961746216,0.03353649005293846
Ebay,"If I have been outbid, why is it under buying and can I back out?",,21,2,2013-06-23,EBAY,0.02579614520072937,0.8333471417427063,0.1408567577600479
Ebay,Hawkeye #1-10 For Sale on Ebay,,0,1,2013-06-23,EBAY,0.031776316463947296,0.8878545761108398,0.08036907762289047
Ebay,Why can't I leave negative feedback after opening a payment not received case?,"Had this happen twice in a month..on the same item. When I go to leave feedback my options are Positive, Report Buyer, and I'll Leave Feedback Later. One case is closed and one is still open. It's not right that I can't leave negative feedback to warn other sellers.",10,0,2013-06-23,EBAY,0.3444017171859741,0.629547119140625,0.026051146909594536
Ebay,Payment problems,Yesterday I sold a set of bike cranks on ebay. Foolishly I sent them off before recieving payment. I have contacted the buyer and he has asured me that he has paid for them. If he has I still havent recieved payment and im wondering if this is an internal error or if i was just scammed?,4,0,2013-06-23,EBAY,0.4510149359703064,0.5234975814819336,0.02548750303685665
Ebay,Question regarding Buy It Now.,"Hi! Just had a question on how this works.

I put my item up and someone bought it via Buy It Now. They hadn't paid after several days, and I emailed them in regards to when they were going to send their payment. They replied and said they no longer wanted the item. 

I submitted one of the Unpaid Item reports or whatever, but I'm unsure as to how this resolves. Someone explain it like I'm five?",9,0,2013-06-23,EBAY,0.05756006017327309,0.9061827659606934,0.03625718131661415
Ebay,This is why Ebay is such a nightmare to try and use....,"TV repair shop buys internal video card for a TV.  Installs it in TV, it worked (they admitted this in email).  45 FORTY FIVE days later the customer comes back to them saying it is now bad.

They are now filing a case that I should refund them.

They sold an item to a third party AND tested it...  after a month and a half they want me to be responsible for what that third party did to the card.  Now after 48 hours I get the joy of calling Ebay and getting a non-English speaking person and trying to explain to them the story or they are going to default rule in his favor like they always do.

I swear there are so few courteous buyers even left on Ebay it is hardly worth it.  If you aren't getting conned you are getting scammed, and if you aren't getting scammed someone is trying to make you responsible for their business.  If someone isn't trying to make you responsible then they are lying and trying to force a partial refund.

Already lost ALL my discounts due to liars and scammers because I refuse to give partial refunds.  Lost my ""rating"" for 6 months because Ebay uses a bullshit system that says 2 liars are more important than 164 people telling the truth.  Now I am having to put up with shit like this twice a week.

So welcome to the wonderful world of selling on Ebay.",18,8,2013-06-24,EBAY,0.16843317449092865,0.8024052977561951,0.029161525890231133
Ebay,k2b-bulk.ebay? what is it?,When i go onto my eBay(.co.uk) and go to my summary page the address it goes to is http://k2b-bulk.ebay.co.uk is this just ebay? i recently opened a store but i have never noticed the address before.,3,5,2013-06-24,EBAY,0.051577746868133545,0.9166028499603271,0.031819406896829605
Ebay,Buyer paid but doesn't want me to ship item until two weeks from now,Buyer has good feedback.  Should I be worried,8,4,2013-06-24,EBAY,0.019116226583719254,0.7707710266113281,0.21011270582675934
Ebay,Global shipping program questions...,"My most recent set of auctions I opted to choose to use the global shipping system. My auction was won by a user from France, but it does not list France as a shipping option on the GSP. 

Is France not a valid option for the GSP? If not, why would eBay allow them to win the auction?

I am already regretting trust eBay's ""It's sooo easy"" line for this program...

Anyone had experience with this? Where do I even ship if it is a valid option? I can't see the address, or print shipping labels, until he pays and he is asking what shipping costs will be prior to paying.",8,2,2013-06-24,EBAY,0.024758657440543175,0.9380314350128174,0.037209898233413696
Ebay,eBay running ads for knock-off clothing site above my auctions for the real thing,Anyone else seen this.  I sell clothing and have a real authentic Lacoste Polo shirts up for sale.  eBay is now running several ads above my listing for a fake clothing site in China...wtf?,3,2,2013-06-24,EBAY,0.02477671578526497,0.9364181756973267,0.03880517929792404
Ebay,"Shipping for my listing is only for within the US, but getting international bidders","I'm really worried about a lot of the bidders that have been showing up on the bid history for my item.  I'm selling an iPad mini and a lot of the bids are by people with no feedback history or have ever purchased on ebay before.  Which makes me a little hesitant, but hey, you gotta start somewhere.  But these accounts also have their location has Cambodia, Australia, Russian Federation, etc.  I DO NOT want to ship outside of my country.  I have already planned to use the USPS flat rate shipping and this is just a huge inconvenience.  Should I contact eBay customer service in the morning?  Will they be able to do anything about it?",6,2,2013-06-24,EBAY,0.021794356405735016,0.9169759750366211,0.06122972071170807
Ebay,Having trouble registering my account,"I created an account with half.com, but I didn't register the email and the password is not working. I went to the page to request to re-send the registration email, but I got a ""we are experiencing technical difficulties"" message at the top. I can't find a customer support number, nor when I go to ask them they require me to login. It's so frustrating, why does eBay do this? Anyone else have this problem?",1,1,2013-06-24,EBAY,0.5512167811393738,0.429239958524704,0.01954316906630993
Ebay,I can't bid on an item... and I can't message the seller.,"Went to bid on an item and it told me I couldn't because I had 2 non-pay cases in the last 12 months (both times the sellers were charging more than the auction stated). My score is 376 with 100% positives, that seems a tad unreasonable but okay.

Okay, maybe I can message the seller and work something out.

Nope. Won't let me message them. There are no bids on the item but I can't even get into contact with the seller.

Isn't that great for both me and the seller? They want to sell a product that no one is bidding on. Ebay is blocking people from bidding on it AND blocking people from even contacting them.

Essentially there are two people who want to make a transaction and ebay is standing in the middle holding them apart.

Thanks ebay for doing the exact opposite of what you are even about.

EDIT: Here's the item number (310690623088).

If anyone can get into contact with the seller I really want this particular item.",8,0,2013-06-24,EBAY,0.04866491258144379,0.9207116961479187,0.030623415485024452
Ebay,Concerned about my purchase,"Just now I bought a brand new Nexus 4 off Ebay for $280 Australian dollars. The seller is in China, the seller has 0 feedback and joined Ebay on 01-Jun-13. The seller provided 1 photo of the box, I have searched around google images and I can't seem to find the photo on there so that is good. The seller was also selling a number of solar panel items too. Do you think this is legit? Attached I will put a number of screenshots for help.

http://imgur.com/gallery/2kjrA/new",14,0,2013-06-24,EBAY,0.016587253659963608,0.8994264006614685,0.08398638665676117
Ebay,Anyone use the USPS home pickup service?,I was looking into it and noticed that I need to sent them using an expedited service to qualify. My questions were if I ship out say 30 or 40 items via first class and ship 1 of them Priority will that work? How long ahead of time do you have to schedule the pickup? Anyone ever had any problems using this service?,5,4,2013-06-25,EBAY,0.06256591528654099,0.9042268395423889,0.033207233995199203
Ebay,"Have not shipped item but buyer left feedback already ""Received the item; absolutely love it"". Should I be skeptical and report it?","The item in question sold for over $250, I have not yet shipped the item but the buyer has already left feedback saying that they ""Received the item; absolutely love it"". Should I be skeptical and report it?",6,2,2013-06-25,EBAY,0.16095349192619324,0.8105222582817078,0.02852419950067997
Ebay,"In Search of Tech Cred, eBay Builds a New Engine for a New Identity",,0,1,2013-06-25,EBAY,0.014149799942970276,0.8174014687538147,0.16844871640205383
Ebay,Buyers that click buy it now multiple times,"These are on items that have multiple quantity. I have at least one of these buyers every couple days.I am not sure exactly what goes down, but I would assume they can't figure out how to pay for the item so they go back and click buy it now again and again. I have had buyers click buy it now up to 7 times on the same item. Most commonly it is 3 times. Of course 90% of the time they never end up paying or answering messages. I wish ebay had some kind of fix for this.  

Yes, I know I can do immediate payment required, but that doesn't work for me for other reasons.",7,1,2013-06-25,EBAY,0.0441369004547596,0.9233312010765076,0.03253192454576492
Ebay,Secrets to eBay Success,,0,1,2013-06-25,EBAY,0.030344342812895775,0.8664290904998779,0.10322656482458115
Ebay,Ebay Store Photo Tutorial: What Kind of Photos Should I Shoot?,,1,1,2013-06-25,EBAY,0.02704416960477829,0.9400144219398499,0.032941337674856186
Ebay,I bought an item without knowing the shipment price and now it's 63 dollars. Can I return it?,"I'm new to ebay. Yesterday I ordered an item which costs 34 dollars and didn't see the cost for the shipment. When I logged in today I saw that the shipment had been updated and the price for it was 63 dollars. 

Is there a possibility to return this item?",15,1,2013-06-25,EBAY,0.05191359296441078,0.9099346995353699,0.03815173730254173
Ebay,Secrets to eBay Success,,3,0,2013-06-25,EBAY,0.030344342812895775,0.8664290904998779,0.10322656482458115
