subreddit,title,selftext,num_comments,score,created_utc,stock/sector,neg,neu,pos
Ebay,This will be my eBay fodder for the next several months. I'm as excited as I am overwhelmed,,15.0,7,2013-07-01,EBAY,0.04395752772688866,0.9064034223556519,0.04963906109333038
Ebay,"Concerned by my bidder's feedback. He has 15 Positive feedback but on closer inspection 2 of them are actually Negative. Both the Neg feedbacks are for high value furniture items, which is also what I'm selling... Why are the negative feedbacks dressed up as positives?",,9.0,7,2013-07-01,EBAY,0.4696257412433624,0.4225643277168274,0.10780994594097137
Ebay,"Am I victim to an attempted scam? This is a strange one, would like some experienced insight. Chat transcript with seller.","So I purchased a MacBook Pro last Thursday from a member with a 51 score. I actually did not win it, the winning big went up to $2200 and my max was about $1750. I got a 2nd chance offer and went ahead with the purchase. A few hours later I got an email from eBay saying that the item was removed and no longer available, so I sent the seller a message.

***So I just got a message that says: The listing you're interested in is no longer available. What's up? Are you going to send the item? This concerns me since I already sent payment. Thanks***


He responds: 


***Dude check my feedback rating, this is why you got the message!!!! (the person that won the initial auction is a fraud and his account is no longer there so they ebay cancelled the actual item. Compare yourself, don't be so quick to open cases like that, take it easy) I am not sure what that means, got your My ebay and you'll see the item you paid for. And yes I plan to ship the notebook right after work.***


He then says a follow up message

***Now paypal reversed the transaction, you are a bad ebayer. Seriously?***


PayPal did not reverse the transaction. My response: 

***You're kidding me right? I sent the payment to you and am waiting for you to send the laptop. What the? I did nothing at all. I'm just trying to buy a retina macbook. Accusing me of being a bad ebayer? Right. I pay for everything on time. They probably think you're a scammer since you removed the item from eBay. Listen, if you are legit then I have no idea what's going on.*** 


He says: 

***Understood, your macbook will be on its way today or early morning tomorrow and I will update the tracking number, thank you! Apologies for overreacting but I thought it was the case when its not. Feel free to send me a message if you have any other questions. Thanks***


Me: 


***Just message me the tracking number once it gets sent, since I cannot access the listing anymore from eBay to grab it. Thanks***



---------------------------------

Now it's Monday and he is not responding to my messages. I sent one on Saturday and one today asking for the tracking number.  I mean, the only way I could see this being a scam is if someone stole this guys ebay account but even then it would be a pain in the ass to get the money. Or maybe this guy is telling the truth, I don't know. If it was a scam why would he be so communicative? Even though he had kind of a short fuse and was spitting nonsense... As of right now I figure I will give it a day or 2 and then open a dispute if I don't hear back. The listing is removed from eBay but I did save a PDF file of it since I always do when I buy pricier items.",7.0,3,2013-07-01,EBAY,0.06452935189008713,0.9095199704170227,0.025950737297534943
Ebay,So I have a bit of an issue with a purchase and looking for insight,"I ordered an item on e-bay, it's an MTG card, a rather expensive one (over 50 bucks,) the seller stalls shipping for a week. Yesterday I receive an e-mail stating, ""oh, the card is damaged, give me your e-mail and I'll refund you,"" I know this is wrong on E-Bay, and I respond with, ""you can refund me through e-bay if you like, I'm not sending you this information through mail, we're doing this through e-bay"" he doesn't respond but then marks the item as shipped.

What is the next step I should take?",13.0,3,2013-07-01,EBAY,0.049473803490400314,0.9178429245948792,0.032683271914720535
Ebay,Do you sell other people's stuff or run a store? What are your rates and how do you get customers?,"I want to run an ebay store, but am starting out in my garage.  What is a reasonable rate to charge people for selling their merchandise?  Is that percentage before or after shipping and before or after ebay fees?  How do you get customers?

Thanks in advance, any suggestions are greatly appreciated!",4.0,3,2013-07-01,EBAY,0.015415414236485958,0.8460180163383484,0.13856656849384308
Ebay,Anyone help with a worthpoint account that could help me out?,"Hi guys I need to know the value of this item that I have and really couldnt anything on it besides this page on worthpoint, anyway I dont have an account and I figured that someone on here would have one. 

http://www.worthpoint.com/worthopedia/volant-stainless-steel-skis-162cm-129428628",6.0,3,2013-07-01,EBAY,0.016597911715507507,0.902570366859436,0.08083175122737885
Ebay,How much time does a buyer officially have to pay for an item on ebay?,"I won an auction yesterday, but currently do not have the funds available in my paypal account. How much time do I get before the buyer can take any action?",8.0,2,2013-07-01,EBAY,0.024649176746606827,0.9222770929336548,0.05307375639677048
Ebay,Buyer paid for shipping but ebay is telling me also to pay for shipping. Help?,"I sold an item for $8 and had the shipping calculated by buyer location. Shipping method is USPS Priority. The item sold, and ebay tells me that the purchaser paid $8.65 for shipping. When I go to print a shipping label, the only option it's giving me is to purchase a shipping label for $7.48. This can't be right. The buyer already paid for the shipping. I've never sold anything on ebay before. How do I proceed? What do I do?",1.0,2,2013-07-01,EBAY,0.023697122931480408,0.9360277056694031,0.0402752123773098
Ebay,First Time Broke Shipper Need Help!,"Posted and sold a bunch of crap from my closet on eBay. I've gotten payments but don't know where to even start to ship it out. Is flat rate the cheapest way to ship it? I also was planning on using the money from the sell to pay for shipment but it's pending on paypal...what do i do? I'm like dirt broke hence why I was selling stuff.

random: where can i get boxes to ship this stuff?",10.0,2,2013-07-01,EBAY,0.05101979896426201,0.9125152230262756,0.03646497055888176
Ebay,Ebay Store Photo Tutorial: Practical Advice to Shoot Awesome Photos,,1.0,1,2013-07-01,EBAY,0.02968630939722061,0.9219179749488831,0.04839576780796051
Ebay,"""I'm not refunding you until you close the Item not received report/case""","Can someone tell me if this is proper? I am relatively sure if I close this case it will screw me, but I want to confirm that the appropriate action is to leave the case open. 

Thanks for the help guys. This whole situation seems scammier every day.",6.0,8,2013-07-02,EBAY,0.040648531168699265,0.8971987962722778,0.06215263530611992
Ebay,Is this buyer trying to scam me?,"Sorry in advance for the wall of text.

I had a porcelain figurine listed at $130 as best offer for a while. I got a message from someone with no feedback asking if they could do a local pickup (they were in NJ and I'm in CA), but I said I would make sure it arrived safely. They asked if it was damaged, and then how low of a price I would take ($115). The next day, I got an offer from them of $100. I countered with $115 and reminded them of our discussion. They accepted it, I packed it up carefully, bought insurance and sent it out. A few days later, I got several poorly written messages complaining about how the piece was broken. I told them to send me pictures. They said they didn't know how to take pictures and that their friend would do it the next day. The pictures came in the next day (along with a message asking for their money back), and sure enough there were a few pieces broken. I asked for pictures of the box, and then said I'd file a claim in a few days and they could send it back to me. They sent more pictures, and the box looked undamaged. They then said they would just keep the figurine for a discounted price. This all sounds like a scam to me, but I'd like a second opinion before I lodge a complain. Sorry for the wall of text, and thanks.",6.0,8,2013-07-02,EBAY,0.06519344449043274,0.9032803177833557,0.03152620419859886
Ebay,"Won auction, seller says item no longer available and just forgot to remove listing","Paid with Paypal already. Seller contacted me by email ( and not through ebay message )with offer to refund or upgrade item ( to something I'm not interested in). I replied both through email and sent a couple of messages to them through ebay messaging asking for refund. Haven't heard anything back. Worried about being scammed. What can I do?


Update - Seller contacted me and issued a refund through Paypal. Seems like a decent enough seller, hopefully just a glitch with my situation.",13.0,5,2013-07-02,EBAY,0.020101919770240784,0.8705831170082092,0.1093149334192276
Ebay,Can someone explain how the 'Global Shipping Program' works? What has your experience with it been?,Do I end up only paying to ship it to the shipping center? Or do they tack on a fee afterwards? Is there any reason not to use it?,6.0,4,2013-07-02,EBAY,0.017551252618432045,0.9284974932670593,0.05395127460360527
Ebay,How can i get people to read the auction description?,"I listed a perfume i got from my aunt (in a box of stuff she willed to me) so i listed it on ebay. the perfume was in the box and it looked full but it was previously owned so i listed it as used. in the description i wrote ""this is listed as used as it was previously owned""

i also started the bidding at 9.99 and took several pictures of the box, bottle and cover.

then i got this message http://imgur.com/oAkGiUH

i'm banging my head against the wall, how can i get these people to read what theyre bidding on?",16.0,4,2013-07-02,EBAY,0.03406091406941414,0.921610951423645,0.04432809725403786
Ebay,Asking for postcards after transaction.,"Like right after you pay and they tell you they're shipping it soon, and you ask for a postcard of wherever they live.

Do you think this is too much?
Does it annoy people?",15.0,4,2013-07-02,EBAY,0.03510385379195213,0.9205669164657593,0.0443291962146759
Ebay,"What would you do here, the buyer has paid in full but there is this:",,11.0,3,2013-07-02,EBAY,0.03903674706816673,0.8796874284744263,0.08127577602863312
Ebay,Any advice on organizing sales tax,"Looking for any tips on organizing sales tax. My cpa says I should do it twice a year. I don't charge sales tax on my listings but I figured eBay would have an option to separate sales done on Florida. If anyone has any tips, it would be much appreciated. 

Also, do I pay sales tax on shipping? Most of my listings are free shipping

Thank you to those that take the time to keep this subreddit full of great info :)",5.0,3,2013-07-02,EBAY,0.024438366293907166,0.9306016564369202,0.04495996609330177
Ebay,Question about sorting results on ebay,"First of all, sorry for this dumb question. So, down to business...

http://imgur.com/iEMrfnl

""postage not specified"" = 99% doesn't ship internationally (I'm from EU but not from UK)
""postage ..."" = ship here 100%

How do I filter out items without international shipping? Pretty please?",2.0,1,2013-07-02,EBAY,0.02489030733704567,0.9133234024047852,0.06178627908229828
Ebay,How To Find Items To Sell On eBay,,0.0,1,2013-07-02,EBAY,0.02689993567764759,0.9250597953796387,0.04804025962948799
Ebay,When will MY views on MY item not show up under the views displayed on my dashboard? Is there a way around this?,,4.0,6,2013-07-03,EBAY,0.027345234528183937,0.9417857527732849,0.03086904250085354
Ebay,'Dropshipping',"There are a lot of posts on the Gumtree jobs section in my area for this (I think it's the right term)
One particular guy wants me to list a rolex worth a few thousand.

What are the risks involved for me here?",6.0,5,2013-07-03,EBAY,0.04526717588305473,0.9145621061325073,0.04017065092921257
Ebay,DAE just get an MC010 Account Security Notice?,"I just received an email saying,

&gt;Dear [.....],
&gt;
&gt;We're writing to notify you that the password for your eBay account has been compromised. As a result, we have scrambled your password to prevent unauthorized activity.

I'm in IT, so not really a n00b... just checking to see if eBay had a breach and a bunch of people had their credentials reset or what.",11.0,5,2013-07-03,EBAY,0.06488455832004547,0.9104089140892029,0.024706494063138962
Ebay,"Ok so this guy requested a chargeback, the item was delivered weeks ago. Doesn't respond.","This crap is getting me really mad. I've sold about 30+ items no problem in the last 2 months, now this guy did some chargeback nonsense PayPal and now the funds are put on hold. I sent PayPal proof of delivery about 7 days ago and nothing has happened. And the buyer won't respond to messages leading to believe he's scamming me.

Has this happened to anyone else?  what else can I do to fight this?",6.0,3,2013-07-03,EBAY,0.08737000077962875,0.8869577646255493,0.025672247633337975
Ebay,Chinese sellers posing as UK sellers,"Is there any way report my competition where something will actually get done about it or is this an issue ebay ignores?

Obviously competition is competition and you must just get on with it but when a seller sells the same items as you then has one of those Chinese shipping tables in their listing and states ""I do not responsible for import taxes"" whilst listing the item is in the UK it's pretty annoying. Also their address on business seller information is a HK  address, not UK.

They have their advantage of cheap chinese prices and shipping, I have my advantage of living in the UK, but this is taken away from me by their lies.

So did anyone else have success in getting something like this done properly or should I just not waste my time with this?

Thanks",5.0,3,2013-07-03,EBAY,0.0595548115670681,0.8983694911003113,0.04207572713494301
Ebay,Can buyers return anything within 45 days?,"I'm debating on selling my MacBook Air and an iPad within the US on eBay because of the 45 day return policy.

I have a scenario that is running through my head: What if I sold a computer in flawless condition, then 30 days later the buyer decides to return it because he/she no longer wanted it, and it's returned scratched up a bit? Can I complain to eBay saying that it wasn't returned in the original condition?  Case closed?",4.0,3,2013-07-03,EBAY,0.08413619548082352,0.8838483095169067,0.03201545774936676
Ebay,My items have been up a few days and they all have less than 5 views.. what's going on?,"I sold dresses last summer, and they typically did not get many views, but they sold. I've started up this summer, and it's as though my listings are invisible.

They're at competitive prices, and the titles are loaded with keywords. The shipping is one-day handling and free. What could be going on?",9.0,2,2013-07-03,EBAY,0.034985918551683426,0.9280142784118652,0.036999765783548355
Ebay,My first time using eBay bucks...,"So, it said my certificate would be issued on todays date. I've been waiting to purchase a new gun holster. Price was $39.00 + $3.50 shipping. I had $13.79 in eBay bucks. I clicked purchase and went about my checkout. It showed that $13.79 was going to be deducted from the payment and I would only be paying $28.71. I click submit. $42.50 is deducted from my paypal account... I go back and check eBay bucks and it still says I have $13.79 and that ""It's on the way!""

Did I fuck up? I already had my eBay bucks gift certificate code before purchase. What did I do wrong?",6.0,2,2013-07-03,EBAY,0.033799394965171814,0.9344760179519653,0.03172462806105614
Ebay,Why can't we upload multiple images at once?,,2.0,1,2013-07-03,EBAY,0.05821017175912857,0.9141803979873657,0.027609463781118393
Ebay,Misspelled eBay Treasures,,0.0,1,2013-07-03,EBAY,0.0368981808423996,0.8990095853805542,0.06409228593111038
Ebay,Scammed with a Fake Galaxy S4 via eBay- Pictures &amp; Details Inside (x-post r/Android),"Just got scammed with a fake Samsung Galaxy S4 GT-I9500 via eBay. A bit below market value, similar to /u/fuckeduphere and his story [here](http://www.reddit.com/r/AndroidUsers/comments/1h39aq/bought_a_very_good_fake_galaxy_s4_heart_broken/). The listing looked legit, the person had close to a hundred positive ratings, and there were no classic warning signs that I had noticed. It came in an open but branded box, branded plastic on the screen, and plastic over all the other glass, with two extra branded batteries, charger/usb cable, and branded earbuds.  

I've never had a genuine S4, so the experience is relative, but the build is pretty solid - the things that tipped me off were all via the software -the lack of GPS, no ""Smart"" features (Air Scrolling, etc.), and a 4.2.2 version with a build named ""GINGERBREAD.zskj6"".

The [Genuine Samsung app](https://play.google.com/store/apps/details?id=com.hotdog.truth&amp;hl=en) was an extra confirmation tool.    

Photos here: [http://imgur.com/a/AVaXU](http://imgur.com/a/AVaXU)

I paid via Paypal and am hoping that the dispute resolution is a fairly painless process.

**Updated**: 
Photos with software shots and what it looks like with the branded plastic here: [http://imgur.com/a/f5HND](http://imgur.com/a/f5HND)

**Update**: Can't install CPU-Z due to a parsing error but install a similar program called Android CPUZ to get some more hardware/software data. [Hardware Info](http://i.imgur.com/eQThnFG.png) - [System Info](http://i.imgur.com/9VKcOPE.png)",0.0,8,2013-07-04,EBAY,0.024385342374444008,0.9280708432197571,0.047543805092573166
Ebay,Just a tidbit on how Ebay likes to treat people who aren't giant Chinese junk sellers....,"So I get a scammer and a liar leaving me negatives.... nothing I can do about it.  In total that gives me 4 out of 170+ sales with low ""as described"" ratings.  2 I know are bullshit, the others I have no idea.

So this month I decide to start fresh and do a more business oriented account.  I started a new seller account (MANY people have multiple accounts) and start selling under it...  totally accepting the restrictions.  It is with all my info and linked to my Paypal, no tricks or hiding.

I run into the category listing limit of TWO items.  I call customer service.  In the course of that call I am told I am not good enough to sell on EBay, that I don't pay enough in fees, that I don't ""try hard enough"" since I got some low ratings and on top of all that the rep flaunts it that HE can see who left the low DSR ratings and I can't.

So I demand a manager....  all I wanted was increased limits based on my 8+ YEARS of selling on my other account, the last 2 spent as a TRS.

What do I get?  Some 20 year-old snot telling me that not only will he not raise the limits but he is going to suspend all selling on my new account until the low DSR's clear off my old account.  So fuck them, nothing I can do.

So I go back to selling on my now crippled old account that has no limits.  Now, today, I get an email from Ebay saying that because my new account I just registered (remember, it is now suspended from selling because of THEIR actions) is suspended that they are going to limit my linked account (the old one) and only allow me to sell a few items a month and it can only be reviewed after 90 days.

That is how Ebay treats people that pay them hundreds in fees every month, has been selling for years and has simply ran into a few bad buyers.

What amazing service they provide.  I paid them more last year than I paid for my CAR PAYMENTS in fees, and all I get is little punishments doled out by snotnose little children that aren't even old enough to have experienced selling on Ebay themselves.

Oh, and it is real convenient that this happens soon after sending in a complaint about how I was treated on the phone when Ebay themselves asks me to do a survey.

Now I get to make another call and spend forever on hold just to talk to some kid to try and explain they are limiting one account because of the limitations put on another account caused by the first account to begin with.

Fuck, it is so sad they have such a monopoly that there is just nowhere else to go.

Does anyone have corporate numbers for Ebay?  I am about done dealing with the little shits in customer service that pretend to be ""managers"" and think I need to start making this into more of a corporate level issue and ruffling some feathers.",11.0,7,2013-07-04,EBAY,0.09205805510282516,0.878739595413208,0.02920234203338623
Ebay,Every time I try to buy something online,,12.0,55,2013-07-04,EBAY,0.028574200347065926,0.9267891049385071,0.04463675618171692
Ebay,Sellers: Are you costing yourself money by offering free shipping?,"I sell a lot of stuff and have experimented with offering free shipping vs charging shipping. I see many people suggesting using free shipping, and I do this a little bit, but I feel like I've had better luck selling items for a higher price with a purchase price plus shipping rather than lumping it in with item total.

For instance: I'll go to sell a video game. The going price is about $15, and many are selling for about $15 with free shipping. Rather than price mine at $14.50 with Free Shipping, I've found if I list it at $13 +$3 shipping it sells just as fast, but nets me $1.50 more.

Similarly for larger, and more expensive items I've sold a few things for say, $74 +$5 shipping when many items are selling for ~$75 with free shipping. 

I guess I'm saying that so many buyers just look at the asking price and don't factor the shipping into the equation that, at least in my experience, you might be hurting yourself by offering free shipping.

Anyone else have any thoughts on this, or evidence to change my mind? With eBay prices ever increasing I'm always looking to get the max for my items.",11.0,5,2013-07-04,EBAY,0.03831224516034126,0.9187107086181641,0.042977072298526764
Ebay,I think we can all relate to this guy,,7.0,5,2013-07-04,EBAY,0.04566072300076485,0.9165219068527222,0.03781738504767418
Ebay,Buyer leaves positive feedback with a negative comment?,"I've heard that this is against eBay policy. Is this true? If so, can I remove it? Should I?

Pretty new to this, any advice would be appreciated.",9.0,3,2013-07-04,EBAY,0.037511393427848816,0.8701820373535156,0.09230659902095795
Ebay,Im new to eBay. How do I calculate a fair shipping price so as not to put off potential buyers?,Im not really interested in making money off shipping but my current listing just say 'postage to be calculated'  or something to that effect.  When i see that as a buyer I'm a little hesitant to bid as i don't want to be saddled into an exorbitant shipping cost.  How do you calculate a fair price for all potential buyers?,16.0,3,2013-07-04,EBAY,0.022432968020439148,0.9245753884315491,0.0529915988445282
Ebay,Question about Paypal changing payment method of eBay invoice,"I'm new to eBay. I have my invoice payment set up to automatically come out of Paypal. The 1 month went by fine. The second month, the entire amount of funds available did not cover the total invoice so they zeroed out my Paypal and took the rest from my bank account. No problem.
This third month I knew I was about $2-$5 short in of funds available so I thought they would do the same as last month. However, this time, they converted the payment to an echeck and withdrew the entire amount from my bank account (causing me to overdraw). I spent 90 minutes on the phone with them trying to understand what happened. I felt like every time I tried to reiterate what I thought they were saying, they changed it. 
Has anyone else had this happen? If so, what was the outcome? I don't think I can keep enough in my Paypal and bank account to cover the invoice, trying to guess where the payment will come from.",3.0,2,2013-07-04,EBAY,0.05402674898505211,0.9130018353462219,0.032971400767564774
Ebay,"/r/ebay, can I have your advice on a bad purchase?","I purchased an Apple Computer via eBay this past week. I not only purchased a replacement key for the keyboard but also purchased a 30 dollar (including shipping) operating system because the previous owner had wiped the hard drive for security purposes. This totaled about 37 dollars for me ultimately.

I receive the computer this morning, to find it poorly packed. It definitely had LOTS of room to move around in the box while it was shipped and, not surprisingly, the disc drive on the computer did not work despite the description saying that the computer ""ran great"". Not only that, but upon calling Apple support while trying to troubleshoot the computer, I found out that the computer was a 2006 model even though it had been advertised as a 2007 model.

I contacted the seller and let them know that I would need to return the item and was expecting a refund. They told me that they would refund me when I received the item. How do I go about handling this? Do I simply send back the item? Do I open up a ""item not as described"" case? Should I mention the year model discrepancy? How should I discuss the seller paying for return shipping? (I only think it is fair since I have already spent 30+ dollars on a computer that I do not actually own anymore)

/r/ebay, I've really come to respect everyone's opinion here so I really appreciate any advice that you all will give me. Thank you all so much.",10.0,2,2013-07-04,EBAY,0.04382713884115219,0.8910583853721619,0.06511448323726654
