subreddit,title,selftext,num_comments,score,created_utc,stock/sector,neg,neu,pos
Ebay,"If someone makes a counteroffer, and I decline, can they then accept my first offer?","I made an offer on something, and they made a counteroffer. Now I don't want it anymore (I found something cheaper). Is there any danger that he'll click a button and make me pay my first offer?",5,2,2013-06-11,EBAY,0.027232971042394638,0.9258172512054443,0.046949733048677444
Ebay,I need a bit of advice regarding a large package.,"I've got an item that is worth $150 new, so I thought I could get somewhere around $100 for it used. Problem is, the item weighs around ten pounds and is 16 x 10 x 2.5 inches . I tried calculating shipping through USPS, and it told me it would come to somewhere around $50 which is pretty bad?

Anyone here have experience with larger packages? Any advice you an give me?",11,2,2013-06-11,EBAY,0.03077598661184311,0.9166254997253418,0.05259857326745987
Ebay,"Just put up my first listing. After reading some horror stories, I have a couple of questions:","I am selling a video game, and if this all works out well, I would like to continue selling.  Here are my Q's:

1.  Assuming someone bids on the game, how do I include a tracking number with my shipment?  I saw that without a tracking number, a buyer can claim they have never received the shipment.

2. Ebay takes a percentage of the final sale, although they were very good at hiding the information regarding how much.  Anyone know?

3.  Once my paypal is credited, can I transfer that money to my bank account for free... or is that subject to 2.9% and .30cent fee per transfer?  

4.  In anybody's opinion/personal experience, what percentage of your sales go bad?  For example, buyer doesn't pay, claims didn't receive item, etc.
  
Thanks for any input!",8,1,2013-06-11,EBAY,0.03950396180152893,0.9168340563774109,0.04366195574402809
Ebay,Did not receive purchased item as advertised. What can I do?,"So I bought a copy of Pokemon Heartgold that was advertised as the North American version. I received it today and it was the french version. I don't speak or read french so this is an issue for me.

The seller does not take refunds, and I have messaged him. I've also filed a dispute with paypal about the purchase. And I'm also going to dispute with ebay. Is there anything else I can do or need to do? Or does ""no refund"" completely protect the seller?",9,1,2013-06-11,EBAY,0.051981616765260696,0.9150071740150452,0.03301123529672623
Ebay,Best time to list something on eBay?,"The most bidding happens in the last minute(s) of the auction.  So usually I list things when I know people are more likely to be around their computer during the last minutes of an auction.  So usually around 10PM EST (so it's still 7PM on the west coast).  

But what day is a good day for an auction to end?  Monday or Tuesday when people's paychecks are often posted?

This is just my obscure thought process.  I'd love to hear what you guys have to say!",7,1,2013-06-11,EBAY,0.09267139434814453,0.8822827935218811,0.025045841932296753
Ebay,Using Quickbooks online to sell on eBay?,"The company I work for has hundreds, maybe thousands of automotive items to sell.  Stuff like floormats, bugshields, etc.  We are about to start using Quickbooks Online Plus (the cloud based point of sale &amp; bookkeeping software) for our financial and sales tracking.

Are any of you using QBO to list?  I've used turbolister and Blackthorne in the past to list but we had a custom, in house database that could sync with them in order to track sales.  That database is obsolete, so we're moving to QBO and we need to not only list, but have the ability to import sales info.

Thanks!",0,1,2013-06-11,EBAY,0.02060459367930889,0.9439601898193359,0.0354352630674839
Ebay,Prime Power Incomes - Powerseller Report - June 2013,,2,1,2013-06-11,EBAY,0.051399946212768555,0.9067133069038391,0.04188667982816696
Ebay,eBay doesn't care about sellers. I'm done selling on eBay.,"After going through my first dispute with a buyer it's clear that eBay doesn't care about sellers.  The buyer finally submitted the case to eBay and within 10 minutes they were awarded the case.  eBay did nothing to investigate and is simply telling me to refund them when the buyer clearly is in the wrong.

I understand that the Buyer Protection policy is meant to stop sellers from scamming buyers.  Why, then, does the Seller Protection do *NOTHING* in terms of stopping buyers from submitting false cases?

It's ridiculous.  I'm done with eBay.",56,16,2013-06-12,EBAY,0.47493264079093933,0.49267783761024475,0.03238951042294502
Ebay,Sold a phone. buyer has no clue how to use it.,"I sold an unlocked phone. The buyer has been giving me nothing but trouble since. This won't work, that won't work and they refuse to answer any of my questions when I try to help. 

Right off the bat the person was telling me that I did not say the SIM card I included was for tmobile only (completely untrue) and that because I included a tmobile SIM card the phone was locked to tmobile. It took several days to explain why that wasn't the case. They would not answer who their provider was after asking a dozen times. 

They were silent for a week then said they finally got it working but now they can't set up email or get it online. Which is strange because they're messages recently switched from saying ""sent from my android"" to ""sent from my iPhone"".

Of course every problem is only barely explain and no details are given. The phone works exactly as advertised but this person just doesn't know how. What do you do when a person buys chopsticks from you and has no idea how to use them? Am I at the mercy of this persons incompetence for the next month when the dispute window closes?",7,3,2013-06-12,EBAY,0.05660177022218704,0.9165775775909424,0.02682063728570938
Ebay,Item sent to Latvia ages ago - Case opened.,"Please look at the dates given on the screenshot.

http://imgur.com/54EK7qM

24th February purchase so I shipped on 25th February. It's been around 100+ days since the date of purchase.

Am I right in saying there is nothing the buyer can do against me? because of the timeframe (I don't have tracking as it wasn't cost effective).

I thought this but in the screenshot you can see it says ""the buyer could escalate to customer support for a decision"" followed by  ""if you don't respond they could resolve this in favour of the buyer""

So is my best response just to say something along the lines of ""it has been a ridiculous amount of time now"" and then just wait for them to escalate or close it?

I thought there was",7,2,2013-06-12,EBAY,0.029197026044130325,0.9183886647224426,0.05241430178284645
Ebay,Sold prices are gone? Also feed's aren't working?,"I search sold prices all the time to list my buy it now prices... it appears you can't search by sold prices anymore?

What kind of shit is this?",3,2,2013-06-12,EBAY,0.04967617243528366,0.9248329997062683,0.025490809231996536
Ebay,Ebay Auction Bargain Site LastMinuteAuctionBargains.com Improves Website Response Times,,0,1,2013-06-12,EBAY,0.05128873139619827,0.9273378252983093,0.02137349359691143
Ebay,Is this a scam? treadmills for £20,"**edit: the seller is ""No longer a registered user"". Obvious scammer is obvious**

Please let me know if i'm posting to the wrong subreddit. 

I was looking for a treadmill, and I stumbled upon this seller: http://www.ebay.co.uk/sch/dillonisgod164/m.html?_nkw=&amp;_armrs=1&amp;_from=&amp;_ipg=&amp;_trksid=p3686

He's selling treadmills which are usually worth 500+ euros for around 20 GBP. 

Surely this is some sort of scam. I just don't understand how exactly he's trying to scam buyers.
I went through his feedback, it's all positive. The purchasers seem to be real individuals. The products are listed in the correct category, there's a ''buy now'' button. 

I wanted to click ''buy now'', because, you know, 20 GBP - fuck it. But could it be some kind of phishing scam?

Also, I noticed that all the descriptions and pics are copied from aliexpress (another online market site). 

Tell me what you think.",11,1,2013-06-12,EBAY,0.050855882465839386,0.9234942197799683,0.02564982697367668
Ebay,How should I go about selling a PS4 preorder on eBay?,"Hey guys, I want to sell the preorder, but I'm afraid that the auction will complete and won't be able to ship until November-ish. What do you guys recommend?",16,1,2013-06-12,EBAY,0.029506685212254524,0.9076875448226929,0.06280572712421417
Ebay,T-HUB vs Webgility. Anyone have experience with either?,They both seem to do the same thing. Anyone have experience with either (good or bad)?,0,0,2013-06-12,EBAY,0.028284193947911263,0.9058761596679688,0.06583969295024872
Ebay,I have finally lowered my buyer's remorse return rate significantly using this very easy method...,,12,26,2013-06-13,EBAY,0.05999760702252388,0.5413972735404968,0.3986051082611084
Ebay,"[UPDATE] Ugh, buyer is trying to scam me. Now have to deal with Paypal. Thoughts?","About three weeks ago, I posted this thread:

[Ugh, buyer is trying to scam me. Now have to deal with Paypal. Thoughts?](http://www.reddit.com/r/Ebay/comments/1exxxs/ugh_buyer_is_trying_to_scam_me_now_have_to_deal/)

In short, an international buyer used a forwarding service (I don't ship internationally), and immediately filed a SNAD dispute with Paypal when the tracking showed the forwarder had received the package. He then bought a watch for $6.99 from another Ebay seller and had it shipped to me, uploading the tracking number for the watch to Paypal as confirmation of his ""return.""

At that time, I called Paypal and had the first representative agree with me that the timing was fishy (the ""return"" was shipped back the same day from California that it was delivered in Florida, right?) and promised me that not only would the buyer not get his money back, but the close would be closed within 24 hours.

Nope.

A few days later, Paypal emails me to let me know the case had been closed against me. I immediately called and spent another half hour on the phone with another representative, who could only open an appeal for me. Ok, fine. I submitted my affidavit, photographs, and other documents in support of my claim. Paypal subsequently offered me a 75% refund, and I was supposed to respond within 3 days whether I accepted the offer or not. I immediately called again; this time the rep promised that she would look into why I was only offered 75% and she would call me back, and suspend the time for response. 

Nope. That was last Friday.

Lo and behold, I logged in today and discovered the appeal had been closed and Paypal had not refunded anything. No notice, nothing. The log indicated they had sent me an email on 6/10, but I checked spam, junk, trash, everywhere, and had not received a single thing. I called them again, furious, and spent another 45 minutes on the phone with them today. I had them review the call logs (which showed how many times I had called), I had them review the documents I had submitted on appeal, and I had them escalate to a supervisor. After all of this, they have FINALLY agreed to refund 100% of the transaction and have provided me confirmation of the refund as well as contact information for the individuals involved today. 

This has been the most frustrating ordeal. If my work had not been so busy the past few weeks I would have been able to stay on them. What I've learned for the future:

1. CALL THEM EVERY DAY! Despite what they promise, they will not call you back! Get names for everyone you speak to, as well as employee ID numbers. Get confirmation numbers for everything.

2. GET IT DONE BEFORE APPEAL! I am lucky that this may work out for me, but the son of a bitch buyer got away with his refund and my phone. If it had been resolved in my favor prior to the appeal (which had been promised to me by a representative, remember?) the buyer wouldn't have gotten his money back.

3. ESCALATE! If I had pushed at the beginning, I might have saved myself from grief. This really goes hand-in-hand with #1 above, but if I had called back and insisted that the resolution be pushed through that day, and spoken to a supervisor with the authority to do it, things would be different.

Anyway, still have to see the refund come through, but I am hopeful.",4,11,2013-06-13,EBAY,0.05225186422467232,0.9104721546173096,0.03727598860859871
Ebay,Just found this gem in my feedback...,,7,9,2013-06-13,EBAY,0.03928876668214798,0.8379773497581482,0.12273388355970383
Ebay,Possible buyer wants to pay via money order,Is this something that Ebay will allow if the buyer requests the specific type of payment to be a money order?  Or should I pass on this?,4,8,2013-06-13,EBAY,0.01798393204808235,0.9381382465362549,0.043877821415662766
Ebay,Advice - Used Android phone turns out to be slightly broken?,"Sometimes when I attempt to unlock the phone the back-light comes on, but the **lock screen doesn't appear**, and I can't access the phone until I let it lock itself again, after which I try again to unlock the phone and the lock screen appears as it should do.

This is very frustrating when I need to check the time, or look up a map, or whenever I need to use the phone quickly as I have to wait 30 seconds for the phone to lock again before the lock screen will appear as it should do, after trying to unlock the phone a second time.

Is this phone sufficiently faulty to ask for a **refund?** On the listing it said that the phone was in ""**perfect working order**"", which is certainly not correct. 

I am worried that if I post it to the seller, when he receives it he may not think it is actually broken or is not able to reproduce the issue if he only tries a couple of times. The phone only seems to malfunction in the aforementioned way ~15% of the time I try to unlock it, but when it does happen it is *extremely* irritating.

**Do you think these are grounds to ask for a refund?** Even though the phone was listed as used, the description did say it was in ""perfect working order"".

Thanks in advance for any advice.",9,3,2013-06-13,EBAY,0.0481460839509964,0.9083399772644043,0.043513912707567215
Ebay,"Hey, just wanted to say thanks for your help.",,2,2,2013-06-13,EBAY,0.0288196112960577,0.8046220541000366,0.16655829548835754
Ebay,"New eBay photo policy, will this apply to books and DVDs?",The primary photo for items in used condition can't be a stock photo.,6,1,2013-06-13,EBAY,0.021261990070343018,0.9482137560844421,0.03052428551018238
Ebay,What would you offer?,"I'm considering selling a couple of items through ebay as part of a set, but I'd like to figure out a range of what I can get before I put it up. Does anyone know of a website/subreddit that'll do evaluations?",1,1,2013-06-13,EBAY,0.02096685953438282,0.9247375726699829,0.05429557338356972
Ebay,Prime Power Incomes - Keep It Simple,,0,1,2013-06-13,EBAY,0.035830058157444,0.866132915019989,0.09803705662488937
Ebay,Custom eBay Store Design,,1,1,2013-06-13,EBAY,0.023123208433389664,0.9280152320861816,0.0488615557551384
Ebay,"What are the pro's and con's of selling an item as ""auction"" vs. ""buy it now""?","As a new ebay seller, I've been experimenting a bit with selling video games.  Some are listed as ""auctions"", and others as ""buy it now"".  I can't really figure out which one is more appropriate.

-Which one is more profitable?

-Which one do buyers tend to choose more often?

-Are there any other things to consider when choosing between buy it now and auction?

Thanks for any input!",13,8,2013-06-14,EBAY,0.02784844860434532,0.9328022003173828,0.03934931010007858
Ebay,So.. feeds are gone? All I see are suggested items based off searches.,Mine weren't working right last week and now they seem to be gone. Am I the only one?,7,6,2013-06-14,EBAY,0.8110353350639343,0.1730969101190567,0.015867818146944046
Ebay,How do I avoid buyers who don't pay? It's been happening too much lately.,"I know this is sort of an unanswerable question, but recently I've been getting buyers who buy first, ask questions later, then decide they don't want it and refuse to pay. I understand some people have a change of heart, but at least ask your question before you buy it and then decide. Just today, I got a buyer who bought it first then asked if I could save it and sell it her them in September?!? This is really ridiculous and I'm wondering if eBay could implement a way of discouraging buyers from securing an item if they don't want to pay. For context, this month I have $920.98 received and **$549.98** not received that I most likely will never see. I have lots of watchers on these items and it sucks to have to relist and gain views and watchers all over again. I mean that is a serious chunk of money, especially if you Buy it Now on a 2-300 dollar item and then just change your mind. Perhaps this is more of a rage, but if anyone has done something about this, please let me know, it's just tiring.",22,6,2013-06-14,EBAY,0.05420323461294174,0.9143953323364258,0.03140145167708397
Ebay,"Long term ebay sellers, how do you boast or up sell your experience of selling during job interviews and new employers","I have been selling on ebay for 5 years and now working to get a job of sorts. But realized that no employers seem to care about my years of work on ebay or amazon.

This can be troubling because all of these years would be worthless if I can't prove experience from them.

Any one that sells knows there is a lot of work between shipping, dealing with customers, finding new product, and making a profit that employers should see its worth.",8,4,2013-06-14,EBAY,0.04189359024167061,0.8979116082191467,0.06019476056098938
Ebay,Buyer is requesting a refund on return shipping,"I sold a Bissell spotbot carpet/upholstery cleaner. In my listing I state that the buyer is responsible for return shipping. Buyer gets it, after a week, claims its not dispensing the cleaner solution. The thing was used once by me (purchased for $150, sold for $60 w/ free shipping) and this thing worked perfect! So she sends it back and of course it works right out of the box. I refunded her the $60 right away. I spent $21 shipping it to her and she says it cost $34 to ship it back. 

How would you other sellers handle this? Part of me wants to refund get money to avoid feedback, but I feel as if she just borrowed my machine to clean her sofa and returned it after. 

She never opened a case and I never agreed to refund return shipping",10,3,2013-06-14,EBAY,0.054908230900764465,0.9071748852729797,0.0379168838262558
Ebay,Confusing situation...,"So I recently ordered a RockBand Drum kit from a seller on eBay. The cost was $40 and the expedited shipping was $30. I didn't mind because it was still a pretty good deal used and all. But two weeks went buy and nothing, no tracking info, no feedback from the seller on the status of the package other than that he was sending it and it should be there in two days. This message came after 6 days of the 14 i waited. So I opened a case against the guy and eBay sided with me and refunded my money. 

Heres the kicker, the seller contacts me directly and says he shipped the drums and i shouldn't have opened a case against him. He finally gives me a tracking number that DOES indeed proof he shipped the item, the day OF eBay deciding in my favor. and it will arrive here at my apartment in one week. Which is odd since expedited shipping would only be like 2-3 days right? What should I do?",6,2,2013-06-14,EBAY,0.026094308122992516,0.9167322516441345,0.057173483073711395
Ebay,How long should media mail take for shipping from 1 state away,Does media mail still take 7+ days even if it's traveling to one state away? (Illinois to Michigan) The seller told me it would only be 2-3 days since we're so close but that was last Wednesday.,1,1,2013-06-14,EBAY,0.06249690800905228,0.9006511569023132,0.03685196116566658
Ebay,"Seller is trying to back out of a transaction, I have declined his cancellation, but what is the best course of action now?","I was extremely lucky, and was the only bidder on an item and won it for half it's retail price. The seller then attempted to cancel the item; His reason was: "" Buyer purchased item by mistake or changed mind.""

In the additional information, he included: ""Was selling in order to partially fund purchase for new keyboard, but don't have the extra money to put down for one right now, and this is the only keyboard i have for my desktop. sorry.""

I declined the transaction (It is his responsibility to follow through with the transaction whether it inconveniences him or not, that is what can happen when you list something on ebay), but I'm wondering if there are any other steps I should take to ensure I receive my purchase. 

It has only been two days since I won the bid, and the cancellation request was made and denied today. Should I go about filing a claim? And if so, at what point should I do so?",14,0,2013-06-14,EBAY,0.06537492573261261,0.9075894355773926,0.027035614475607872
Ebay,How rational are online buyers?,"I always sell my items fixed price, slightly cheaper (including postage) than the cheapest other fixed price listing, hoping that buyers are at least smart enough to sort their search from the cheapest to the most expensive. Yet everybody I know personally doesn't seem to rationally seek out the best price. As an example of buyer irrationality, I have a friend who is an avid collector of anime and manga. He once paid $250+ for a single out of print manga volume on Amazon which - if he was smart - he could have got for a mere $12 on AbeBooks. Another example: When a hardcover Zelda art book was released earlier this year it rocketed near the top of Amazon's best sellers. I found it for like $35 including postage on The Book Depository but sorted by completed listings on eBay and saw that ten or so copies were selling every day for about $70.",2,0,2013-06-14,EBAY,0.026534972712397575,0.9142011404037476,0.059263892471790314
Ebay,Why isn't ebay putting a stop to PS4 preorders?,"It seems like the absolute easiest scam in the book. Sell a ""preorder"" for a PS4, and by the time the PS4 is released, the following have expired: 

* Ebay buyer protection
* Paypal buyer protection
* Credit card charge backs. 

Honestly, if I had no compunction, I'd be selling 400 PS3 pre-orders. Why are people being so stupid to buy something that obviously is a scam? Why is ebay allowing preorders at all?",7,4,2013-06-15,EBAY,0.030272072181105614,0.9347028732299805,0.035025060176849365
Ebay,Quick question about payments,"When paying for an item, can I use my friends Paypal account with my own eBay account? I don't have a credit card and my friend usually places orders for me but he has given me his Paypal details because he's too lazy to place the order himself.

I know that eBay and Paypal are owned by the same company so I can imagine that this would be a problem.

Also, if this is possible, will the eBay item details be visible on the Paypal profile?

If this is not possible I'll just get my friend to do it.",1,3,2013-06-15,EBAY,0.05349893867969513,0.924618124961853,0.021882984787225723
Ebay,"New eBay Seller Tool for ""Item Titles"" (Best-Match) in Any Language! (Free)",,2,2,2013-06-15,EBAY,0.024697039276361465,0.9277828335762024,0.04752008989453316
Ebay,Too good to be true? How well does Ebay protect buyers?,"Kids really want an iPod and I regularly look on ebay for a deal.  [This popped up this morning](http://www.ebay.com/itm/190856078938?item=190856078938&amp;viewitem=&amp;vxp=mtr#payId) and looks too good to be true. Is it worth the risk, does ebay protect buyers financial information, is this some type of scam I should avoid?",3,2,2013-06-15,EBAY,0.01659235917031765,0.9133752584457397,0.07003241032361984
Ebay,Ebay Desktop Question,Does anyone use this anymore? Ebay don't even seem to offer it on their website anymore. Are there any good third party pieces of software that do a similar job?,1,1,2013-06-15,EBAY,0.039438582956790924,0.9330175518989563,0.027543816715478897
Ebay,How much should i sell my Xbox 360 slim 250gb for? (including 6 games),"games are:

Call of Duty: Black Ops 1 &amp; 2
Borderlands 2
Hitman: Absolution
FarCry 3
Assassins Creed 3

sorry if i shouldnt post here but i suck at ebay.",2,0,2013-06-15,EBAY,0.03724493458867073,0.8529228568077087,0.10983222723007202
Ebay,Mistake made when selling. HELP.,"I shipped the wrong thing and the thing that was supposed to be shipped got sent to someone else. i know, stupid of me, please dont talk trash. I asked on the ebay forums and everyone was rude to me. The buyer created a case today, and I am unable to refund him because I am very low on cash and already spent the money he paid (even dumber, I know) anyway, how long do I have to get the money to him before I start getting in trouble legally? Can I pay back money while its in an Ebay Customer Support? How long do I have? I'm trying to get the money back but im afraid I wont have it within three days as requested when an ebay case is made. Also, will making my paypal balance equal to zero (its negative right now because of the ebay problem) get me out of legal issues? Thanks guys.",0,0,2013-06-15,EBAY,0.1544201821088791,0.8013550639152527,0.04422473534941673
Ebay,Marketplace Fairness Act: Where are the Mom &amp; Pop Stores?,,2,9,2013-06-16,EBAY,0.02360512502491474,0.9264401793479919,0.04995470494031906
