subreddit,title,selftext,num_comments,score,created_utc,stock/sector,neg,neu,pos
Ebay,Type of PalPal account for eBay use.,"When I go to sign up for PayPal I get 3 options, can I use the Personal account or do I have to use Premier or Business?",3.0,2,2013-07-17,EBAY,0.022188521921634674,0.9466217756271362,0.03118974342942238
Ebay,"Dear Ebay-redditors, do you know any proxy sites or could you help?",Hello. I hope it is fine posting this here. I want to get a clip on for my spectacles but the seller refuses to ship out of the states and i am in germany. do any of you know any proxies or could you help?,8.0,1,2013-07-17,EBAY,0.012428930960595608,0.843488872051239,0.1440821886062622
Ebay,"What is the best way to respond to best offers that are, well, absurd?",I'm selling a $1000 bill that my grandpa gave to me when I was 4 years old. Someone just sent me a best offer of $500. I'm not sure how to respond without hammering out a string of obscenities. How do you respond to these absurd messages?,1.0,1,2013-07-17,EBAY,0.042355041950941086,0.8944169878959656,0.06322798877954483
Ebay,The Queen - ACEO Original Watercolor Painting by Cindy Williams,,0.0,0,2013-07-17,EBAY,0.038277700543403625,0.9236075282096863,0.038114774972200394
Ebay,"[PayPal] Wife was charged ~$90; disputed within half an hour, PayPal took the money ~40 hours later","Sunday night I got a message from my wife (I was at work) that somebody had used (hacked?) her PayPal to send themselves about $90. Since she was up, she got the email and filed a dispute with PayPal; they said they'd stop it and would contact her with more information. She changed her password on both PayPal, and our bank to be safe.

Nothing happened yesterday, but just today PayPal withdrew the funds from our checking account, and told her they were holding it pending investigation.

I'm really not familiar with PayPal. Way I see it, an online entity has fraudulently taken funds out of our bank account, which is a felony, though there may be (probably is) something in PayPal's terms that gets them out of that. In any case, I think we should be able to solve the problem with the bank. Wife wants to deal with PayPal.

I looked at my wife's email, and as far as I can tell, it was a simple direct money transfer to a Hotmail account. Nothing she bought equals (or comes close) to that amount.

All the horror stories I've heard about PayPal come out in the buyer's favor. Buy a laptop, pay with PayPal, say the laptop never arrives? PayPal gives the buyer his money back. I don't mean to slight PayPal unfairly; that's just what I've heard. In any case, we're not selling (i.e. getting paid by PayPal), we're the buying party (i.e. paying with PayPal) (even though we didn't actually buy anything) and buyer protection is the big thing with these (also Google Wallet, which I use).

Just wondering if anyone here has any advice. I know next to nothing (go ahead and assume I know nothing) about PayPal; my wife knows a little more, but for the sake of argument, assume she knows nothing as well. What would y'all recommend?",0.0,0,2013-07-17,EBAY,0.07675118744373322,0.8987911343574524,0.024457715451717377
Ebay,Selling phone numbers on eBay,Hopefully someone can help me with this thing that's been bugging me. I used to sell 212 (Manhattan) area codes on eBay and everything was fine. One day I decide to call eBay regarding a issue and mention that I am selling 212 are codes. The rep informs me that selling phone number is not allowed on eBay and continues to remove all my listings. My question is why are there still hundreds of listings of phone numbers on eBay? I even reported some of them to see if eBay takes any action - but none. Was I unfairly targeted or its just that they enforce the rule on whoever they are able to catch?,10.0,8,2013-07-18,EBAY,0.04840374365448952,0.9154533743858337,0.03614283353090286
Ebay,How many times can a buyer have an unpaid item case oped against them before ebay stops letting them buy? Or does ebay even do anything about it?,"Before I blocked this (non)buyer, they had started purchases on both of my ebay accounts only to not pay. I've opened 3 unpaid item cases against them. I'm just wondering if they can keep continuing to do this to other sellers that don't have things set up so they *have* to complete the purchase.",10.0,6,2013-07-18,EBAY,0.06704084575176239,0.898844301700592,0.03411488980054855
Ebay,"Selling new but expired ink, today I get this gem of a message from a ""potential"" buyer...","""What the Fuck do you mean BRAND NEW???????? are You Brain Dead???

something 10 fucking years old isnt NEW Your an IDIOT

I have No Idea why Ebay lets morons like You Sell""",11.0,6,2013-07-18,EBAY,0.039213649928569794,0.9105178117752075,0.05026856064796448
Ebay,"A seller sent me the wrong order, and are asking me to mail it for them to the rightful buyer.","I bought something really small and cheap for my macbook and was accidentally sent a protective case package that cost way more then what I wanted. I emailed them offering to send it back and they responded with that they would send me my item immediately but if I could go ahead and mail the item i received to the rightful buyer, they would pay me back for the shipping.

This is just a little weird for me. I was too tired to linger on how inappropriate it felt so i asked for the address. They sent it to me today but is this normal?

Should i mail it or tell them i'd rather just mail it back directly to them in Hong Kong?",12.0,5,2013-07-18,EBAY,0.09588048607110977,0.879158079624176,0.024961447343230247
Ebay,Does this seem fishy? Should I go for it? It's an insane deal...and with returns accepted..,,16.0,5,2013-07-18,EBAY,0.0407697819173336,0.8863874077796936,0.07284285873174667
Ebay,Is the site now charging sales tax on California sellers' transactions?,I noticed a deep dropoff in sales from my half.com account last month. I think people are buying from other states.,2.0,4,2013-07-18,EBAY,0.940038800239563,0.048505768179893494,0.011455517262220383
Ebay,Return item or get seller to ship remaining pieces?,"I purchased a set of brake pads for the front of an Audi S4. The thing about this setup if you are not familiar is there are 8 smaller pads (4 to each axle) instead of 4 larger ones (2 to each axle). The listing was posted with the condition ""new."" When I received the order I only received 4 pads (enough to do one axle), so I did some looking and they are sold everywhere else as a complete front axle set of 8. (A side note, I have never seen brake pads sold in sets that couldn't accommodate both wheels [either front or back] as it isn't considered safe to replace one at a time.)

I am asking for them to ship the remaining parts that should have came in the box. They are offering to allow me to return them. I have linked them to another retailer selling the same part number where it clearly states that MKD912 is a complete set for the front axle. They then linked me the the manufacturers page (not the product page, the home page) stating that it should validate their point. Looking on the product page it clearly shows 8 pieces belong in the box as I assert, I sent them this link. 

Should I continue to push for the correct items or is it a losing fight and I should accept the refund?

The same seller has more of the same item listed, if I win a dispute will ebay do anything concerning the other items that are being sold as the same thing (I am buying item 1 of 5) as they are waiting to be bought as new, but are not?

**edit: The seller was convinced to contact Bendix and they were informed that I was correct and are shipping the missing brake pads no charge to me. Thanks for the advice!**",8.0,3,2013-07-18,EBAY,0.03882377967238426,0.9159448742866516,0.04523136839270592
Ebay,Am I allowed to sell vintage bubble gum?,"Hello all, I'm looking at ebay's [list of prohibited/restricted items](http://pages.ebay.com/help/policies/items-ov.html) trying to figure out if I am allowed to list a tube of The Real Ghostbusters Sllimer bubble gum I found at my parents house during a remodel. It's circa 1986ish, totally full of uneaten green gum, and I know stuff from that series is collectible. Is ancient bubble gum considered food, which is governed by all these rules, or is it a collectible item and therefore ok to sell? Thanks everyone!",3.0,3,2013-07-18,EBAY,0.021066991612315178,0.9225416779518127,0.05639135092496872
Ebay,"Bought a tablet for parts to repair my current tablet, the item arrived water damaged and parts completely unusable. What should I do?","So I just got the item I ordered from a seller with 10k feedback. I open up the item so that I can take a connector from it that I need to repair my current tablet and I find that the entire inside of the item has been corroded due to water damage, rendering all parts unusable.

The thing is, the item was sold as ""For parts or not working"", and the seller described it as non-functional, wont turn on, with the internal components untested and some residue on  the inside of the glass on the screen. It was being sold as is.

From what I found eBay states that For Parts is defined as: 
&gt;""An item that does not function as intended and is not fully operational. This includes items that are defective in ways that render them difficult to use, items that require service or repair, or items missing essential components. ""
The thing is this item is completely nonoperational, and is beyond repair or salvage.

Is there anything that I can do, or is buying an item ""for parts"" means that you might end up buying complete garbage? 

There is no mention of returns or no returns. Is contacting the seller and asking them for a return reasonable?

Thanks.",14.0,2,2013-07-18,EBAY,0.08704045414924622,0.8810577392578125,0.031901806592941284
Ebay,Help with seller,"I recently bought a lot of 8 Sdxc cards. the total price with shipping about a little over 400 dollars. I paid for this last week on the 11th the guy still has yet to provide me with shipping info. Then didn't reply to my messages for 4 days. eBay said I was not eligible for buyer protection, so with the guy not responding to me I put a dispute out on PayPal this Monday to get a response from him. First he tells me he will ship it on or before Wensday. Then he gets the email from pay pal and  tells me he will ship it with in 2 days of me closing the dispute on PayPal. No he says he there is. No ""funny buisness"" by Friday he might ship them that morning.  He keeps THREATING a  Refund and says he will just relist the auction. He's said this twice. Once the week I paid and then this week when I put out the dispute. I feel he's being rude, and he claims I am harassing him, because of the dispute on PayPal. Thing is the the cards are worth about 100 a piece. Since I got 8 of them I ended up getting them for a little under 60 a piece. And I suspect he thinks he could have got more for the auction. this guy has been a reall hassle and I wanted to know if it's really worth it. Because I'm thinking about just asking for my money back. His service is terrible and i feel like he's being a dick bag. And now I'm thinking he might try and cheat me on the lot and not send all 8 Sdxc cards I purchased. What preventive steps can I take to prevent this. Or like I asked, is it not worth it. 
I have had my account since 2008, and my PayPal for longer Than that with a confirmed address and only positive feedback.",9.0,1,2013-07-18,EBAY,0.039672791957855225,0.9236449599266052,0.03668225556612015
Ebay,New eBay seller with a couple questions.,"So I just sold my first item on eBay. Just want to know how to tell when I get paid for it, and how to go about the shipping for it?",3.0,6,2013-07-19,EBAY,0.026190029457211494,0.9252806305885315,0.04852929711341858
Ebay,New seller in UK - Buyer left positive feedback and I still can't access the money.,"It is still pending which I do not understand, I don't know why I can't have my money since it is established I have not scammed the buyer...",8.0,5,2013-07-19,EBAY,0.02859874814748764,0.8873042464256287,0.08409705013036728
Ebay,Worst month for sales?,I sell around 10g's of month of clothing and for me the summer June-July is pretty slow. Off by 10-20% compared with the rest of the year.,12.0,5,2013-07-19,EBAY,0.18689069151878357,0.7191949486732483,0.09391439706087112
Ebay,Question about returns on ebay (from seller's perspective),"So I just had to give my first refund.  I noticed that paypal refunded me the paypal fees I had originally paid, but I was curious if ebay will refund your 10% ebay fees?  It was a 200$ computer that I sold, so the 20$ fee is significant.  Ebay makes it tough to sift around their website for this information.  

Thanks for any insight.",9.0,5,2013-07-19,EBAY,0.01972343400120735,0.9090254902839661,0.07125113159418106
Ebay,"Scammed on eBay, they are unwilling to help because of the Data Protection Act. Is there anything I can do?","Hi All,

In the last couple of weeks my father has been scammed. He bought a rather expensive item from somebody (~£4000), but instead of paying through PayPal, did a bank transfer - reason given by the seller was to ""save costs"". Obviously this was the wrong thing to do, but it was such a great deal and all the information on the item seemed to be correct, as well as photos being provided for extra requests. The account had +100 rep, no negative feedback and has been active for about 3 years. The police are also unwilling to do anything, as are both the banks.

As you can imagine, as soon as the payment went through communication from the account went quiet. After realising this was indeed a scam, we contacted eBay who said as we hadn't used PP there was nothing they could do in terms of reclaiming money (which is understandable). However, they won't even provide an address, name or email address associated with the account (which they obviously have) because of the already mentioned Data Protection Act. This seem a bit disingenuous of them, as it's clearly a fraudulent listing (the description and images were part of a listing from 3 years ago in the US), which means the seller never even had an item with the intent to sell it.

The account is still active, as in it's bought items since we have been scammed - which is mad; this person must be a very stupid individual.

What we do have (through past people he has bought from, is a name and an address). The name is likely to be false, but the address is in a small town where this is likely the right place. As we also have bank details, are there any legal actions we can take that anyone might have experienced/used before?

Does anyone have any advise on what action we may be able to take with eBay, maybe to pressure them into giving us more information on the _active_ user? I know it's a bit of a long shot, but any advise would be greatly appreciated.

Thanks",13.0,3,2013-07-19,EBAY,0.07410895824432373,0.8974557518959045,0.028435269370675087
Ebay,"As a seller, I haven't been receiving ""ship notifications"" via e-mail by half.com. Anyone know why?",,0.0,2,2013-07-19,EBAY,0.10338535159826279,0.8734517693519592,0.023162880912423134
Ebay,"Just wanted to share, sold 1500 worth of items in 4 days.","I've always owned an ebay account, but ive never been a real seller, i was mostly on there as a buyer looking for deals. Recently my friend showed me how much he was making selling phones, he was making close to 40k a year doing it part time while as a student. I started doing what he did, scrounging around for used phones, fixing them, and listing them on ebay, and I already have 1500 dollars of sales in 4 days. Also still have more than 2000 dollars listed for sale in my store. Feeling pretty good, and just sharing another mini success story for you sellers out there.",13.0,1,2013-07-19,EBAY,0.020324718207120895,0.8687219619750977,0.11095327138900757
Ebay,"I bid on and item and won, but seller said my winning bid is too low and relisted. Is that allowed?","I was the only bidder for a shirt with a low starting price. I was willing to pay even more for it, but no one else was interested! That's not really my fault. Seller relisted the item for the same low price-- no reserve bid. What should I do about it? I don't want to stir up too much trouble.",0.0,1,2013-07-19,EBAY,0.13208428025245667,0.8372023105621338,0.03071345016360283
Ebay,"The time listed for when an auction ends, is that EST?",,2.0,0,2013-07-19,EBAY,0.13326312601566315,0.8482784628868103,0.01845843531191349
Ebay,Is international shipping covered by the buyer and when do I get the ShipCover insurance? Offer tips please.,"This is my first time selling an item and for shipping I put down:

""Shipping: $5.80-$11.25 paid by buyer — USPS Priority Mail (2 to 3 business days)""
&amp;
""International shipping: Destination: Worldwide — — UPS Worldwide Saver"".
 
Is international purchase shipping covered by the buyer? Once I get a confirmation of someone buying the product, how do I ship it? I'm assuming I just go to a post office and give it to them there along with some confirmation sent by ebay? How then do I get shipping insurance and paypal delivery confirmation?",3.0,0,2013-07-19,EBAY,0.020038699731230736,0.9352076649665833,0.04475367069244385
Ebay,What's up with the crazy new shipping costs?,"I live in New Zealand and in the past few days I have been noticing insane shipping costs on items, for example, $499 for an iPhone, $65 for a lava lamp, $45 for headphones (I have noticed a lot of $45 shipping for items.) Personally I think this is ridiculous, and was wondering if anything has changed?",6.0,5,2013-07-20,EBAY,0.07041959464550018,0.9032325744628906,0.026347845792770386
Ebay,Hefty Trash Bag of Baseball Cards.,"So I was at a yard sale looking for things to maybe sell on eBay. It was an older couple having the garage sale. I found a trash bag full of baseball cards from the late 80's early 90's, made by topps, upper deck, Donruss, and fleer. I am guessing it was their kids collection and he is probably unaware his parents threw all of his cards into a trash bag with a piece of tape on the bag saying $10.00. 

I bought it and with about 85% of the cards in great condition only to find out most of the cards from that era were so largely produced you can purchase entire sets and unopened original wax boxes for less than $10.00. The newest cards in the trash bag are topps 1995 with only about 100 of them. I went through most of the cards and it appears the person that owned them pulled most of the good players and high value cards. The bag had maybe 2K-3K of baseball cards and I have only been through about 600 and have not found any big player rookies or rare. I wanted an opinion on the best way to sell these cards. I was thinking on doing random lots of 20 with the same brand and year of card for about $1.00 bid no buy out and no reserve.",10.0,5,2013-07-20,EBAY,0.030758056789636612,0.9332987070083618,0.03594324365258217
Ebay,Please help! I had a case open against me and I am not sure what to do.,"I had put my 160 slim ps3 and 5 games up for sale. Was able to sell it for $250. Everything was going fine and then today 
I open up Ebay to see that I have a case opened against me for that item. They said the item was not as described because apparently it stopped working after 3 days. I can swear to you that I used this ps3 for months with absolutely no problems. It ran great, was quiet and never froze or anything. I'm beginning to think maybe they just wanted to play the games (one of which was the last of us) and then return it. I replied saying that I used that thing with no problems and if it worked for 3 days I fail to see how it was my doing if it suddenly stopped working. What can I do about this? Also forgot to add that I shipped it very securely in a box with bubble wrap and newspaper.",11.0,3,2013-07-20,EBAY,0.15526403486728668,0.8145155310630798,0.03022046759724617
Ebay,Wait for an Unpaid Item or Relist?,"A user with 0 rating bought an item from me for $17, under the buy it now option, and I'll have to wait a good while for a [refund.](http://i.imgur.com/4JYY5DZ.png) Am I better off relisting the item or waiting it out? Do these users get any sort of penalty for doing this? Seems like some sort of spam-bot account that ruins auctions.",4.0,3,2013-07-20,EBAY,0.0480392687022686,0.9111562371253967,0.040804531425237656
Ebay,Received new item from seller. Very low quality and has oxidation. I left neutral feedback and now seller has been contacting me wanting it changed...,"The first contact was via eBay messages offering me a few bucks back for my inconvenience. Just got an email (not through eBay) offering a 100% refund if I change my neutral feedback to positive. I am not in a habit of leaving negative or neautral feedback so this is the first time this has happened to me. 

What do I do? Reply to sender directly? Ignore it? 

I appreciate any input here.",4.0,3,2013-07-20,EBAY,0.05108468234539032,0.9126779437065125,0.0362374410033226
Ebay,Couple of questions.,"I just won an item on ebay. This item in its listing(title) said new. I bid on it and eventually won, When I when to read the description it says used(still says new in title) and I contacted the seller and he said it was a mistake, I really was bidding on a new item imho. Do I have a leg to stand on to back out? I have looked though the resolution center and there seems to be nothing to help me with this situation.",6.0,2,2013-07-20,EBAY,0.045836515724658966,0.8716413378715515,0.08252221345901489
Ebay,Listing not showing up,So as the title suggests my Ebay listings are not showing up. I have two listings that show up in my Ebay account however when I searched to see where my item stood in the listings I could not find it. I thought maybe it just hadn't shown up due to the search not being exact. So I searched using the exact title and it still didn't show up. I did the same with my second listing and it showed the same results. For whatever reason Ebay is not showing the listings to anyone other than me. So my question for you is what could be causing this and if for some reason it is a temporary thing what can I do to make my listings better. Thanks in advance,2.0,2,2013-07-20,EBAY,0.024747082963585854,0.8968387246131897,0.07841415703296661
Ebay,Claim disputed over SD card.,"Foolishly, I mailed an SD card without tracking. I've done letter mailing with numerous other items just because I was blind to the consequences.

Anyways, today is that day that someone took a bite with my trust. I sent an SD card to someone, and since they had 1K+ rating, I didn't bother to second guess them.

They paid on the 11th of this month, and I sent the SD card through letter mail on the 12th. A week later -- today, the 19th -- I was told that a dispute was opened.

This person never contacted me before opening the dispute, and I'm not exactly sure where to go from here.

I've noticed a couple of things with this person and the whole dilemma, though -- for one, my shipping method states that the average arrival time would be August 2nd. &amp; secondly, the person's payment name wasn't the same as the shipping address name.

I really don't think there's anything I can do about this, since I didn't get tracking, but if there's any advice I could get on possibly getting a chance to counter this, then I would be much thankful.

Only thing I can think of is contacting the buyer &amp; asking why.",3.0,2,2013-07-20,EBAY,0.04426205903291702,0.9234551787376404,0.03228276968002319
Ebay,How To Make Money On eBay | Ways To Make Money Working Online,,0.0,1,2013-07-20,EBAY,0.02573607861995697,0.9079838991165161,0.06628008186817169
Ebay,"so i bought an item awhile back, had to send back to seller, and never got my item back. its been over 45 days so no ebay buyer protection","so what are my options? i payed with paypal, and havent gotten a response from the seller in the past 10 days. i had to send the item back because it was defective to get a replacement. my item shipped there and i never got a response from them about it other than them asking for a serial number and what a shipping address to send to.",6.0,0,2013-07-20,EBAY,0.13249242305755615,0.842278003692627,0.025229576975107193
Ebay,"Just got below standard, help please","I am reading that it's really bad.  I've been running a very sucessful ebay store for several months now and i got a 4th bad DSR.  

I have over 1,000 transactions in the past few months but only 400 people have bothered to leave feedback, so only those are counted towards my DSR percentage total.  I've gone through and sent a email message begging every happy customer i have who has not left good DSR to do so.  

I just think its crazy that i got below standard for only 1.5% bad dsr, and the max limit is 1%?  I'm fine ffor right now but paypal is already placing holds on my funds making it impossible to source.  I'm rreeally afraid of getting banned because I have literally invested my life savings into my physical inventory and ebay is 80% of my income. so no ebay store means no food and no home.  I'm already literally starving as i write this because the 21 day hold means a month in no payments, and returns and refunds trying to satisfy customers are still being charged to my bank account throwing me into massive debt because of overdraft fees, I haven't had a neg since my first month (3 all-time which is nothing compared to the volume), and in good standing account since 2007.

Please help, This single bad DSR this month could cost me my home.  What do i do?",13.0,3,2013-07-21,EBAY,0.07363347709178925,0.8858004212379456,0.04056615009903908
