subreddit,title,selftext,num_comments,score,created_utc,stock/sector,neg,neu,pos
Ebay,Shipping a large and heavy metal sculpture from Alaska. What's the best way to proceed?,"My father-in-law is planning on auctioning metal sculpture pieces that he made. They're large steel fire pits (about 3 feet in diameter). He's in Craig, AK, but would like this auction available to people in the lower 48.  Do you guys have any advice on the best way to ship these?",5,5,2013-06-01,EBAY,0.018892761319875717,0.92617267370224,0.054934557527303696
Ebay,Even eBay 3rd party developers can't pay for stock photos.,,4,5,2013-06-01,EBAY,0.1343761384487152,0.840645968914032,0.024977847933769226
Ebay,Box of ebayables stolen out of car. Any recourse when the show up on eBay?,"I lost a big box of stuff out of my trunk and a few other things like an old GPS. I have a feeling the stuff will inevitably show up on eBay, probably after secondary buyers find it at a flea market. It was mostly $10-30 pieces, new in box collector toys etc. I'm setting alerts to watch for pieces I know were taken, but even if they do show up, I don't have any recourse at all, do I?",8,4,2013-06-01,EBAY,0.030020898208022118,0.9288252592086792,0.04115389660000801
Ebay,I need some selling advice regarding reselling a self-refurbished iPhone.,"So i'm a fairly new seller on eBay, and I have had, so far, what I would consider to be moderate success.  

I found a local craigslist ad for an iPhone 3g for $20.  Long story short, unbeknownst to me, it was water damaged.

After taking it apart/testing it, it appears that after all is said and done, the main board is absolutely fine, but both the battery and LCD screen need to be fixed.  I checked the IMEI, and it is clean.  

Here is my question.  As long as I fully disclose what ""refurbished"" means in this context, will I have any problems selling it?  The water damage sensors will be red, but that will be nothing more than evidence that at one point, the sensors detected water.  Outside of that, it will be a perfectly working iPhone 3g.  

Am I missing anything?  Suggestions?  Thoughts?",4,0,2013-06-01,EBAY,0.04790348932147026,0.8979570865631104,0.054139409214258194
Ebay,"Seller took over a week to ship an item and overcharged shipping, what do I do?","I purchased a record May 20th, and didn't hear from the seller for a while. He said he had midterms then he was going away for the weekend and he would ship it out on Monday. That Monday was Memorial Day. I messaged him on Tuesday, didn't answer until I sent another more strongly worded message on Thursday. 

He said he was in the hospital and then ""bed ridden"" following his weekend. He apologized and said it would be sent that day with a bonus record. Today I received a message that it was sent, but he did not provide a tracking number and the item hasn't been marked as shipped.

I paid over ten dollars for expedited shipping as that was the only option. This seller also has a 80% feedback rating. I feel bad for the guy being in the hospital but he should have sent it before his trip, or sent me a message while he was bedridden.

So what is the proper procedure? Do I give him a positive, neutral, or negative feedback? Do I just give him 1 star in the shipping and communications category?",18,0,2013-06-01,EBAY,0.05594582483172417,0.913888692855835,0.0301655400544405
Ebay,Need advice with proper communication / Refund,"So I bought 2 pairs of jeans from a 2nd hand stockist. I thought that they had lots of good feedback after just reading the description, but I didn't look for a detailed view with revealed 100s of negative feedback in the past month... I'm waffling, fast forward. When I got the jeans, they were both the wrong size.

I pressed the contact the seller button on eBay and followed the instructions, clicking that I wanted a refund and filled in my notes in the box provided. It opened a case and I was emailed by the automated eBay reply.

It's been 2 days since I did that and the seller has contacted me with direct, separate emails for both items saying ""Hi, I'm namehere, I placed your order and wanted to know if everything was ok"" ""The fastest way to get answers from us is to email ebay@company.gg"" ""If everything was good, please rate us 5 stars"".

I've paraphrased that, but it seems they're ignoring my case and wanting them to email directly. Is this fishy? I shouldn't even bother with that, right because there'll be no record of it? Am I likely to claim this back with a dispute? What are they doing?

Thanks.",10,8,2013-06-02,EBAY,0.0409562811255455,0.9185560345649719,0.04048771783709526
Ebay,Account restricted and listings removed.,"I am new to selling on ebay. I just made 2 new listing and linked them with my verified paypal account. This took about 2 weeks to sort out but that is anohter story. I am selling hand painted van Gogh paintings (obviously replicas). I sell a lot of paintings online through my website. 

So as I said. I opened two listings, 1 for Starry Night and the other for Starry Night over the river Rhone. These paintings are being sold by other ebay members, there are a good few listings for both paintings. Within an hour they were taken down and my account has been restricted. No explanation was given. I was just given a link to an ebay page where i am told to ring a number. I am not given the option to email. The telephone number i was given does not work. I am Irish but I live in Thailand. 

**Does anyone have an email or a clue of why I got restricted and my listings were taken down.** 


[
Here is the listing that I made. Is there something wrong with it?](http://box17studio.com/Rhone/index.html)",12,4,2013-06-02,EBAY,0.13627302646636963,0.8409338593482971,0.022793132811784744
Ebay,"Introducing Item Alert. The only service that provides immediate email notifications and browser 'pop-ups' for new listings on ebay. Reddit, please tell us if this sparks your interest.",,20,4,2013-06-02,EBAY,0.02343214862048626,0.9446993470191956,0.03186853975057602
Ebay,Exporting basics?,"Hello r/Ebay,
Do any of you have any links as to how to look into exporting via eBay? 

What sorts of rules/regulations do I have to follow if I were to export, say branded articles of clothing to Europe? If I were to sell second hand items to Europe, would I have to have the permission of the brand to export them? 

If exporting via USPS, can I still use the Priority Mail home pickup options? Or do I have to go to the post office?

Thanks so much in advance for whatever help you all can give me.",2,2,2013-06-02,EBAY,0.016607215628027916,0.904524564743042,0.07886821031570435
Ebay,"Feedback on ""HTC Evo 4g + Accessories"", please.",,0,1,2013-06-02,EBAY,0.0386013388633728,0.9275549054145813,0.03384378179907799
Ebay,New ebayer here. Would you be kind enough to provide feedback on my first posting?,"THANKS for your time.
Here is a link to my first listing:  [item](http://cgi.ebay.com/ws/eBayISAPI.dll?ViewItem&amp;item=190850243373)",10,0,2013-06-02,EBAY,0.015769580379128456,0.9376145601272583,0.046615827828645706
Ebay,Buyer trying to switch on my,"I just sold a phone to someone and they are claiming that it is not working. The issue they describe isn't something I've seen in the three years I've had it and it was working fine moments before I packaged it. 

The problem is I can prove to myself if they switch it, I put marks in it. But there's really no proof on the listing itself. I have photos of the marks but they're not in the listing. Is there anything I can do?",3,0,2013-06-02,EBAY,0.046928901225328445,0.9134102463722229,0.03966087847948074
Ebay,Help to improve my listing?,,0,0,2013-06-02,EBAY,0.027543945237994194,0.7198212146759033,0.25263485312461853
Ebay,The fears of selling on Ebay?,"Friend had a bad experience, he sold a laptop, the person then smashed it and sent it back and still got his money back. Screwed my friend out of a laptop, is this common?",12,5,2013-06-03,EBAY,0.11298421025276184,0.7731390595436096,0.11387670785188675
Ebay,"Buyer has private feedback, after some research my instincts tell me its a scam. Help?","Today I listed a very high quality photo printer for $200 dollars BIN.  It is unopened and in original retail packaging, but there is a rip in the box near the handle on one side (ordinary retail stockroom minor damage) but the printer is undamaged.  Several hours later the printer is bought by a user with 1900 feedback at 100%, but their feedback is private and they only buy obviously.  After some research I found that they are a very active seller on amazon.   They happen to sell the same printer that they bought from me, and have 8 for sale at the moment.  .They sell it for 80$ more than I just did.  What my instincts are telling me is that this buyer will swap out his broken printer for the new one I will send him, and demand a refund for a ""broken product.""  What can I do?  Can I simply refund his money and relist the item without being penalized?",24,5,2013-06-03,EBAY,0.03275563195347786,0.9354587197303772,0.03178573027253151
Ebay,Top Rated Seller Discount Question,"So this past month I have finally gotten my 20% discount on FVF's. When I go to my account to check on the fee's I am not seeing a reduction in FVF's even though I meet the criteria (14 day return + 1 day handling).

Do they give a credit at the end of the month?",2,5,2013-06-03,EBAY,0.4227157235145569,0.4808195233345032,0.09646481275558472
Ebay,Item not received.,"I recently listed, sold and posted an item under £20. Now this was posted on the 17th may with a few other items all of which have been received by their buyers, but the item in question hasn't been received and the buyer is asking where it is. 

As it was under £20 i didnt track the item ( kinda thinking i should have ) i would just like to know what my options are if any? do i just have to refund the person and be done with it?

 I have also asked the buyer to contact the local post office sorting depot to see if they have it but i am yet to get a reply.",6,4,2013-06-03,EBAY,0.042528118938207626,0.9251596927642822,0.032312147319316864
Ebay,annoying issue when replying to messages,"I've been having this issue for a very long time. It's nothing major but it can get annoying at times.

I list all of my items on ebay.ca but when I reply to a question or message about one of my items I get redirected to ebay.com. I type my reply on ebay.ca, but when I hit submit I get redirected to ebay.com. The url is exactly the same (aside from the .ca). The annoying part is that the site will prompt me to log in again when I get redirected. All of the messages are sent correctly and recipients are getting them, so there's no major issue there.

Has anyone else ever seen this? My account was created in 1998 when there was only .com so maybe that has something to do with it?",5,3,2013-06-03,EBAY,0.11025159060955048,0.8680403232574463,0.021708117797970772
Ebay,What is your definition of vintage?,Many people settle on 20 years but I've heard other opinions as well.,8,3,2013-06-03,EBAY,0.04736732691526413,0.8964456915855408,0.05618693679571152
Ebay,buyer saying item not received,"I sold something that was $17, it ended 04/14/13
 and I shipped it out the next day, sent it parcel with tracking. Two days ago the buyer is claiming he has not received it. I check the tracking, USPS claims after 30 days it goes to archive so I cannot view the tracking information. However, they show it was received on the 22nd. 

I still have the receipt showing the time, day, and city + state it was going to with the tracking for this specific item.

What do you all think I should do in regards to this? Do i leave it up to the buyer to work it out with USPS? Am I responsible for refunding? I want to do the right thing here but I did my part by shipping the item with tracking and calling USPS for the buyer.

Thank you!",10,2,2013-06-03,EBAY,0.0381501168012619,0.9189955592155457,0.04285435378551483
Ebay,Can I have 2 ebay accounts on the same Paypal?,Just wondering,7,1,2013-06-03,EBAY,0.021770723164081573,0.9304148554801941,0.047814492136240005
Ebay,Closed my PayPal account...,"I closed my paypal account and tried to list something on ebay.

It asked me if I wanted to open a paypal account and I said no so then ebay asked for my credit card number so they could add money to my credit card each time I made a sale.

So, the question is am I skipping out on paying the paypal fees, or have the paypal fees now become ""ebay fees""?",2,1,2013-06-03,EBAY,0.08229999989271164,0.8931110501289368,0.024588970467448235
Ebay,Anybody frequently ship media mail?,"I'm planning on selling items that qualify as media mail. I've read the USPS policies on what contents qualify as media mail, but I haven't found anything regarding the packaging itself. There is a strict policy against putting advertising in media mail, but can I put my company name or logo on the boxes I use for shipping?",4,1,2013-06-03,EBAY,0.04254981875419617,0.9340624213218689,0.023387810215353966
Ebay,"Sold a (mostly) brand new, unopened rare videogame collectable box set, but buyer opened a case against me and eBay ruled in their favor. If the item comes back unsealed or ruined, what can I do?","I recently sold a pretty unusual item - a complete-in-box copy of the Lunar: Silver Star Story Complete game set for Playstation 1. These box sets are highly sought after by many videogame collectors (like me), so finding a set where the disc-case was still sealed with the original factory seal is extremely unusual.

I listed the set on eBay with 12 photos and an exceedingly clear description, in which I stated that the box had some wear (which I detailed) and that the CD case was obviously shrink-wrapped but the (highly important) Sony factory seal was still entirely intact.

After they received the game, the buyer immediately contacted me to complain that the set was ""obviously resealed"" and that the outer box was trashed, both of which are false. After some (civil) back-and-forth, I encouraged the buyer to open a case with eBay, and they promptly sided with the buyer despite this being a (to my mind) obvious case of ""buyer's remorse.""

My two principal questions:

* If the game comes back trashed and/or unsealed (thus devaluing it significantly), what can I do? I have tons of pics showing the condition I shipped it in, but who would I even complain to?
* To me, the most frustrating thing about this whole experience is that as best I can tell, *I did everything right and eBay still ruled against me.* Even worse, I have no line of communication with whoever at eBay ruled against me, so I can't even request that they state where I went wrong with my listing! 

I'm so frustrated and turned off from selling on eBay again, and I don't have any guidance. Here's the item # if you're curious: 161026377476 

Can anyone shed some light on what I should do in the future to avoid being in this position again? Do statements like ""no returns accepted"" or ""all sales final"" even matter on eBay?",19,6,2013-06-04,EBAY,0.05435122177004814,0.913133442401886,0.032515302300453186
Ebay,Todays ebay glitch:Tracking number is already in use for another transaction,"I have been getting this ebay error message on 3-4 items this morning.  None of which are sharing tracking numbers and they are all fresh labels printed from stamps.com. Ebay forums are reporting the same errors.  Only solution so far is to refund/reprint label.  How many weeks / months will ebay take to fix this one?

""Tracking number is already in use for another transaction and cannot be applied for this transaction.""",4,4,2013-06-04,EBAY,0.20677024126052856,0.7669651508331299,0.026264624670147896
Ebay,Shipping heavy items to Europe?,"Hi guys, just a quick question. I would love to get some electronics (mainly cisco routers &amp; switches) from ebay, however I live in central Europe. The problem is that nearly everything is shipped from US, and given the fact that the weight of the items is at least 15lbs the shipping cost is always 4+ times higher that the price of the product itself.

Is there any way to get it here cheaper? I tried finding sellers in Europe, however this went without luck.",5,3,2013-06-04,EBAY,0.021330341696739197,0.39380407333374023,0.5848655104637146
Ebay,"An ebay seller of 10+ years, ask me anything.",I know alot of people are curious about ebay... what/how to sell... or even needing help when it comes to buying. Here's an opportunity to pick my brain.,36,3,2013-06-04,EBAY,0.017670171335339546,0.8995676040649414,0.0827622264623642
Ebay,Listing 10-disc set of classical cds. Missing 1 disc. Ok to include flac cd-r backup of missing disc?,,8,2,2013-06-04,EBAY,0.33251574635505676,0.6493211388587952,0.018163198605179787
Ebay,Makeup sales... What should I do...,"So my sister bought some MAC makeup on eBay a little bit ago, and it when she got it, it was fake. Now she didn't pay much for it, and the quality was still pretty good so she kept it and uses it. She then showed me this wholesale website that sells the same stuff (fake Mac makeup). Now my question is, how bad am I if I do what others already do? I have a lot of his fake makeup, and I'm not gonna lie, I have already made profit on some of it. However, should I feel bad that I'm doing it? Does anyone have any suggestions on where else I could sell this stuff? I really don't have a use for it since, we'll I'm a guy just looking to turn a profit. Comments? any ideas appreciated !",11,0,2013-06-04,EBAY,0.052542977035045624,0.8958461880683899,0.05161083862185478
Ebay,Is selling ebay vouchers moral?,"I've been noticing ebay hasn't been given the best of rep lately. At the same time my friend has a bunch of ebay vouchers worth $12.45 each. Now what he as done is devised a plan where person A would list an item for $12.50. Person B would then buy the item with the vouchers and the money would go to person A who would give a percentage to B and keep a bit for himself. Sounds great right?

Only thing is my friend obtains these vouchers through some less-than-decent ways. Everytime these transactions occur. Ebay loses about $10? Now this is a fabulously easy way to make money. However as I said above, ebay is the one taking the hit. However I console myself by saying Ebay deserves it in a way? 

What's your view on this?",13,0,2013-06-04,EBAY,0.03180326148867607,0.9181565642356873,0.05004018172621727
Ebay,"Finally, Ebay is focusing more on seller protection.",,1,0,2013-06-04,EBAY,0.01974412053823471,0.8449963927268982,0.1352594643831253
Ebay,For those who have done well in life. 'Parking Ticket which I cannot afford'.,,5,8,2013-06-05,EBAY,0.043165795505046844,0.5636059045791626,0.39322829246520996
Ebay,"'Fishy' problem with a Laptop Sale, need advice please!","So today I put a Gaming Laptop I own on Ebay for $1100 buyout (first time using ebay) I got an email from the buyer asking for an invoice and such for the required payment. The weird part is that the buyer offered $1300 instead of the $1100 I was selling it for? What is going on here, and how should I respond? Thanks! Last thing, I checked the users history, they have 100% positive feedback and have been using ebay since 2003.",19,6,2013-06-05,EBAY,0.01853923685848713,0.8996254801750183,0.0818352922797203
Ebay,"Trouble with my purchase, Unclaimed payment and relisting","Hey guys I need some help. Last Thursday I purchased [this product](http://www.ebay.com/itm/Air-Jordan-Military-4-/330928475112?_trksid=p2047675.l2557&amp;ssPageName=STRK%3AMEWNX%3AIT&amp;nma=true&amp;si=iCOxMlHDmIG7ndYhijqwgbNf6UM%253D&amp;orig_cvip=true&amp;rt=nc) and paid on Paypal within a day. The seller never claimed my payment (my side of the transaction was completed and his side was not). On Paypal, it says the recipient of this payment is Unregistered. I've tried contacting the seller through Ebay and his gmail account twice with no response, and tried calling his phone where I got a message that his inbox was full so I couldn't leave a message. Today I found out that the seller [relisted]  (http://cgi.ebay.com/ws/eBayISAPI.dll?ViewItem&amp;item=330934519251) this exact product. I called Ebay and they made a report about it, and said they were taking it to an ""account specialist"" whatever that means. Basically I want to know what I do now? It's a big mess and I should have never bought from someone with little feedback. I really don't even want the product anymore, can I cancel and be okay or what?",5,5,2013-06-05,EBAY,0.0868220254778862,0.8873780369758606,0.02579992450773716
Ebay,Best shipping option?,I am new to selling on eBay and looking for the best shipping option or the generalized used ones. Most of my stuff is no bigger than an Xbox and probably would not weigh more than 15-20 lbs? All suggestions welcome here.,7,5,2013-06-05,EBAY,0.012702344916760921,0.8106608390808105,0.17663684487342834
Ebay,"Had really great experience with buying vehicles on eBay in the past, never a car though. Does this listing raise any red flags?",,6,4,2013-06-05,EBAY,0.01555537898093462,0.7714926600456238,0.21295194327831268
Ebay,"Tracking Shows Delivered, but Not Received?","Hi, I recently bought a 2 items from different sellers on Ebay and both came with delivery tracking/confirmation. Both tracking numbers say that they were delivered at 11:29 am on Jun 1. However, I have yet to see either of the items and have sent both sellers emails which neither has responded to. What am I suppose to do in this case? Should I file a case? Am I out of luck? CHargeback? I'm starting to freak out that my money has gone straight to the drain...

Edit: Small typos",15,4,2013-06-05,EBAY,0.07847321033477783,0.8835299611091614,0.03799678012728691
Ebay,My rating just dropped a point for no reason,"I had a 184 yesterday, and now I have 183. I checked my feedback profile and I don't have a single neutral, negative, or revised feedback. My percentage is 100% too. What gives?",6,3,2013-06-05,EBAY,0.2926211655139923,0.6670843958854675,0.04029451683163643
Ebay,Am I missing something here...?,"So: on Friday I won an auction for a bike with a bid of £170 (~$250). I'm arranging collection of the boxed-up bike myself via a courier. I haven't made payment yet as the seller messaged to say he was having paypal issues -

""hi paypal promise, solve my problem in 1day.haha!we are will be see, but that not problem if my paypal account will be unsettled i've got my son paypal account.""

I replied to say I'd like to arrange pickup by the end of this week, and got back:

"" hi if my paypal account not will be reinstate very soon don't worry just send courier and pay late anyway we are will be solve this problem. your bike are ready for pick up any time.""

So he seems to be willing to send the bike off to me before receiving payment which is what has aroused my suspicion - but if it is a scam I can't see what he stands to gain! Is he just very trusting and I'm a horrible cynic? (i do plan to pay him of course!) He does have 297 feedback at 100% positive which inclines me to trust him - but then again I'm a very, very infrequent user of eBay and have 0 feedback within the last year which makes it seem odd that he would blindly trust me!

Any advice? Should I go ahead and set up the parcel collection or is something fishy?

(apologies for any autocorrect errors, posting from phone...)",9,2,2013-06-05,EBAY,0.048109907656908035,0.9162797331809998,0.03561035543680191
Ebay,Your seller performance is below standard...,"under the US seller performance standards program...

 Ebay has sent a threatening email to me that starts off with this and then tells me my money may be held, yet the link they provide is to a page that's no longer up.  I've got a 100% seller rating.  What is going on with this?  Should I be concerned?",21,2,2013-06-05,EBAY,0.02923469804227352,0.8706333637237549,0.10013199597597122
Ebay,Is there a way to have ebay automatically take out their fees before the money gets into my Paypal account?,"Obviously if you have less money sent to you from eBay into your Paypal acct then the Paypal fee is going to be just a smidgen less.

I feel like this should exist, however eBay is all about making profit so I could see this not be available.",3,1,2013-06-05,EBAY,0.0353839136660099,0.9211618304252625,0.04345422610640526
Ebay,Buyer wants to pay through paypal on local pick up.,Basically what my title says. Buyer wants local pick up but wants to pay through paypal. Is there anyway I can protect myself from a Item Not Recieved with this method. I have told him that I would only accept cash on local pick up but thought I would ask someone with more experience than me. Any help is much appreciated.,12,7,2013-06-06,EBAY,0.020260822027921677,0.9197253584861755,0.06001384183764458
