subreddit,title,selftext,num_comments,score,created_utc,stock/sector,neg,neu,pos
Ebay,Crazy buyer...,"Sold a video game cord on eBay for less than $10, free shipping. Guy bought it, and paid instantly while I was at work. At some point about 3 hours later, while I'm still at work, he decides he no longer wants it. 

Before I get home, he sends me 6 eBay messages saying he doesn't want it and wants to cancel the transaction. Many of them sent about a minute apart. So I send him a cancellation request and he accepts. 

He messaged me thanks and i thought it was over. However, I didn't know, and neither did he apparently, that this didn't automatically refund his paypal. Today while I was at work, 2 days after the cancellation, he freaks out that he hasn't gotten his paypal back. In a 15 minute window he proceeds to send 5 more messages asking for the paypal refund, and then pulls my info and calls me TWICE within half an hour of sending the first message. 

I break my own rules and use work computer for paypal/ebay and refund him his money and say sorry for the mistake.

A few minutes later he leaves positive feedback: ""Exactly as described good seller""

Ahhhh!",5,6,2013-06-16,EBAY,0.0817440003156662,0.8857252597808838,0.03253079205751419
Ebay,"Product is now damaged, buyer says I did not ""Describe accurately"". How screwed am I?","The item in question can be found [here](http://cgi.ebay.com/ws/eBayISAPI.dll?ViewItem&amp;item=181155072378&amp;ssPageName=ADME:X:AAQ:US:1123)

I'm a private seller (not business) that sold an iPhone 5 recently as a buy it now auction. Fellow paid up (Being ""Held"" by paypal right now) and I shipped it. The phone was in great condition when it left, not a scratch on it. Well, today the phone is delivered and I get a message about a ""large dint on the top steal band"". He wants me to refund his money, pay for him to return it to me, and the phone is now damaged.

How screwed am I? What options do I have?",17,2,2013-06-16,EBAY,0.30800119042396545,0.6502397656440735,0.041759029030799866
Ebay,Do I have access to pending paypal funds?,"I just sold something on eBay on my new account, and it's my first time managing paypal. So it says I have $200 pending but it adds it to my paypal balance. Does this mean I can use it, or do I have to wait the 21 days it says incase the buyer isn't happy? It says my available balance is $254 while my pending is about $200 but my total is $450. Can I spend $450?",2,2,2013-06-16,EBAY,0.04491652548313141,0.9081828594207764,0.04690062627196312
Ebay,"Touchscreen failed after 7 days. eBay closed case saying ""item as described"" without looking at proof. Even though i provided tracking number for return and have not received replacement. Planning to give this video as feedback to seller and use it in the Appeal case. What are your thoughts?",,34,0,2013-06-16,EBAY,0.17914210259914398,0.7916050553321838,0.029252832755446434
Ebay,"Anybody have a more detailed breakdown of Ebay's sales than here? Looking to find information on what products sell, so I can begin to bargain hunt.",,0,0,2013-06-16,EBAY,0.03769668564200401,0.917137086391449,0.04516627639532089
Ebay,"I recently purchased an item, I have paid and the seller has accepted my money but is now demanding more money. Help. (description in comments)","I recently bought a pair of shoes and i have paid and the seller has accepted my payment. He then messaged me claiming he didn't expect the item to go for so little but surely it's against Ebay rules to decline to then send it to me! He currently wants me to pay him more money but I don't want to, I won the item fair and square... Is there anyone who can help me?

(UPDATE) After a lengthy and somewhat idiotic argument on his behalf, he has decided that it is a ""joke"" that i cannot accept the extra charge and so he is refunding me. I am blasting him with negative feedback once the deal is done. Thank you everyone for your help!",13,9,2013-06-17,EBAY,0.045237377285957336,0.8958015441894531,0.05896114557981491
Ebay,"Help me a little, can you verify if this is a scam?","So my uncle was looking to buy a car and he got this email. From the looks of the ""From"" email, it looks like it is a scam. Can anyone confirm or deny this?

http://imgur.com/a/LjEvX",3,5,2013-06-17,EBAY,0.020888250321149826,0.9277905225753784,0.051321253180503845
Ebay,How long do I wait? Wondering if seller is even alive..,"I bought an item from a seller in Poland last Monday and I know it would take a while to ship to the US. However he hasn't marked it as shipped yet. (Which is weird to me, because as an eBay seller I ship same business day/next business day) I sent him a message three days ago asking when/if it had shipped and haven't heard back. 

It's kind of weird, I checked his feedback and there are lots of US based buyers that say fast shipping/etc, but no [new feedback at all since May 28th,](http://myworld.ebay.com/strefamilitarna) even though he has quite a few items listed right now.

So I'm not really sure what do to. I buy and sell on eBay a lot and this is the first problem I've really had. I don't normally buy internationally but he had good prices and supposedly good reviews. Any advice? Thanks.",8,4,2013-06-17,EBAY,0.02351195551455021,0.8775313496589661,0.09895668178796768
Ebay,Maketplace Place Fairness Act – The Real Impact of an Internet Sales Tax,,3,4,2013-06-17,EBAY,0.03420752286911011,0.9361181259155273,0.02967436984181404
Ebay,Is this person trying to scam me? Help?!,"I bought a copy of tomb raider '13 from shop-ideology on 14/6/13. The paypal transaction has 'not been claimed' and the dude has not dispatched the game. I messaged him about it and he replied with http://imgur.com/9Vxc1Nz
What on earth does this mean? What can i do about it? What happens if he finally sends it and it isnt the 'final hours edition' as advertised (which includes an art booklet)?",5,2,2013-06-17,EBAY,0.031270239502191544,0.9315507411956787,0.03717896714806557
Ebay,"0 feedback seller, low price","Hi, I was looking for a certain PS3 videogame and it seems like I found a good deal. Maybe too good to be true?  
How it looks:  
* He's selling multiple units, 15 already sold, 35 to go  
* 30€ instead of the average 70€ of physical stores  
* 0 feedback  
* Account is a few weeks old  
* Paypal only (buy now)  
* Free shipping  
I don't have much experience with ebay but it seems quite shady. Should I risk it? Is paypal going to refund me like it says if anything goes wrong?  
EDIT: [Link](http://www.ebay.com/itm/THE-LAST-OF-US-PS3-PAL-ITA-NUOVO/161047261645)",8,2,2013-06-17,EBAY,0.03529496490955353,0.920764148235321,0.04394087940454483
Ebay,Mitchell &amp; Ness Vintage Pro Bowl throwback jersey Fake or Real?,,3,1,2013-06-17,EBAY,0.04964201897382736,0.8965287804603577,0.05382918566465378
Ebay,Galaxy Tab/Galaxy Note DataCable :: Fine Quality,,0,1,2013-06-17,EBAY,0.02013779617846012,0.9304599165916443,0.04940231889486313
Ebay,TIL: How to properly respond to an item not described case.,"I sold an item last week, and received an item not as described case from the buyer today. I had no other contact from them before that point. The original item and shipping was $118. The case was requesting a refund of $30. I responded immediately, approving the $30 refund. When I went to ship my other items and checked paypal, I realized ebay took the entire $118 out of my account. I called, and ebay said that once you offer any refund, they automatically take the entire amount including shipping out of your paypal, until the buyer approves your refund approval (!!??). Even if it was a $1000 item, and they were requesting $10, the entire $1000 still gets a hold. The representative said the only way to avoid that, is to do a basic text response to the case, and offer the refund in the text, then go to paypal and manually refund it. She said ebay only takes the entire amount if you formally offer any sort of refund through the case. It still doesn't make any sense, but it could save sellers some headaches if they know beforehand.",16,1,2013-06-17,EBAY,0.04210461303591728,0.918975293636322,0.03892006352543831
Ebay,Shipping rates to Israel from US.,"Hello,

I'm from Israel, and I've started bidding on a used PC video card. The seller is in California, United States. Ebay says shipping would cost $40. Isn't that too expensive? 
Ive checked the size of the item in amazon, and it is:

Product Dimensions: 9.5 x 2.9 x 11.8 inches ; 3 pounds

Shipping Weight: 3.4 pounds

This is the size of the box. The seller sells without the original packaging, so it should be even smaller.

Ive checked how much it would cost me to send this item to the US, and its about $10. I understand shipping rates are different in each country, but is international shipping really that expensive in the US?

Even if shipping boxes is expensive, I think it should be possible to send it in a parcel.

If its indeed possible to ship the item for less, how do I ask for a different shipping price?

Thank you.",13,1,2013-06-17,EBAY,0.025779051706194878,0.9209972620010376,0.053223706781864166
Ebay,Charged an additional fee on a purchase.,"I let my wife bid on some cheap clothes on my ebay account. She's been getting some good deals but I'm looking at an auction she won and the invoice doesn't make sense.

* Winning Bid: $1.75
* Shipping: $3.77
* Seller has charged an additional fee: $5.52
* TOTAL = $11.04

I read the auction carefully, it doesn't mention about the seller just throwing in fees for the hell of it. It isn't international shipping so I don't know what it's for. The seller just took the total amount I owed them and doubled it.

Is there some new ebay policy that if you get a good deal on an auction the seller can just decide they want to tack on a bunch of hidden fees? Cause if so I'd like to take advantage of it when I'm selling.",8,10,2013-06-18,EBAY,0.02475479245185852,0.918393611907959,0.056851595640182495
Ebay,Will I get an automatic refund if I revise my feedback?,"Seller's message:

&gt; Hello, I am very sorry you were not happy with your purchase. If you would be kind enough to remove this negative feedback, you will automatically be refunded. We want our customers to be happy with the service they receive. Regards

I ask because the seller has a lot of negative feedback about failing to fulfil refund promises.",25,5,2013-06-18,EBAY,0.0852024182677269,0.8775603175163269,0.0372372604906559
Ebay,Newest eBay mobile update won't allow me to require immediate payment... it's clusterfuct my whole operation,"Version 2.3.0.25 recently auto updated. I want to remove the update from my android phone or figure out how to require immediate payment using the app. Anyone else have this issue? I now have a bunch of items selling with no payments and the added headache of opening cases. I'm hoping there is someone that knows a solution...

Anyone else screwed over with the update?",4,4,2013-06-18,EBAY,0.09596958011388779,0.8776202201843262,0.02641027420759201
Ebay,Ebay Listing Templates,Does anyone know where i can find nice free quality ebay HTML listing templates? I am trying to update my auctions to make them more modern. I have very basic HTML knowledge.,2,4,2013-06-18,EBAY,0.015045246109366417,0.9106712341308594,0.07428355515003204
Ebay,"Come check out /r/ebaytreasures - A place to post and find vintage, unique, and rare ebay items!",,2,4,2013-06-18,EBAY,0.019322700798511505,0.9056728482246399,0.07500449568033218
Ebay,Paypal money sent as a gift?,Correct me if i am wrong but is i true that paypal does not offer buyer protection when money is sent as a gift? Some sellers request that money be sent as a gift? Does papal protect against this in anyway. Could they do anything if someone scammed you and got them to send you money as a gift and never sent the item. Would would paypal do?,2,3,2013-06-18,EBAY,0.047011084854602814,0.9118227362632751,0.041166190057992935
Ebay,Best Way to Unload Slow Moving Inventory?,"I have several items that aren't moving too quickly. I am getting 1 sale every other week or so. Things slowed down since Christmas, and I am getting tired of having the stuff in my way. 

Would I be better off listing everything individually with a $1 starting price and free shipping, and then hoping for the best, or list 1 auction for a ""wholesale lot"" and get rid of everything together?",4,3,2013-06-18,EBAY,0.030154021456837654,0.920121431350708,0.04972454905509949
Ebay,I know it's my fault but please just let me vent!,"I know it's my fault but please just let me vent. 

Made a mistake and thought I had sent two items to the one buyer but hadn't. Completely my fault. Realised two weeks after when she opened a case against me. Again, completely my fault. 

I apologise, I sent &amp; I refunded the money as I didn't think she deserved to pay for it after being stuffed around (wasn't much - around $25).

I'm expecting negative and low DSR for shipping time, maybe even communication but she gives me 1 star for everything. Two items. Eight low DSR's.

Worst part is I discover she sells under a different profile and of course sells similar things. She's relisted my items as being in ""excellent condition"" yet gives me 1 star for item as described. I usually undercharge postage a couple of dollars so she pays less than the actual postage cost yet gives me 1 star. 

Neg feedback a little harsh but I own it. Same with postage time DSR. But the others were just done out of anger and/or opportunity. Grrr!",19,3,2013-06-18,EBAY,0.06672558933496475,0.8919349312782288,0.041339512914419174
Ebay,E-bay and PayPal hefty fee question,"So, recently I sold an iPhone 5 on e-bay. The fixed price was $495 with free shipping but I accepted an offer of $480. After the buyer made the payment e-bay charged me a $48 Final Value Fee and PayPal another $20. That is roughly $70 less than what I sold the item from. I thought e-bay lowered their Final Value Fee to compete with Amazon but I still got charged a hefty 10%. PayPal's fee were supposed to be 2.9% + $.30 which in my case equals to $14.22, but I got charged $20. Does anybody know why are the fees so much?

UPDATE: The package made to the domestic address which happens to be a re-shipper. USPS says that it was delivered to the address at around noon today. If the re-shipper doesn't screw up and if the buyer is honest I should not have a problem, but if any of the the two entity don't do the right thing I will be in trouble because the money is pending for 21 days. Also, when the buyer finalized the payment, I got an e-mail from PayPal with the address and name of buyer. I used that exact address to ship that package. I later checked PayPal and after some digging I realized that on their's website the shipping address has an extra code-like phrase next to the buyer's name. It began with two letters and followed by 5 digit of numbers. This was nowhere to be seen in the e-mail from PayPal that commanded me to ship the package ""Now."" The inconsistency by PayPal is upsetting. This transaction still has quite a bit of potential for turning disastrous. Anyways, thanks to all for their input. I will put another update in the future regarding the pending fund. 

UPDATE 2: The pending fund on PayPal cleared through. I have the money now. 

EDIT: Grammar",24,2,2013-06-18,EBAY,0.03767609968781471,0.924968421459198,0.03735552355647087
Ebay,25 dollar ebay gift card for fathers day. What should I get???,"Like the title says I got a 25 dollar ebay gift card for fathers day. I have a couple ideas on what to get, but I love random things. So if you know or find anything random on ebay that is less that 25 bucks post it here so I can have the opportunity to pick something random and fun!!!!",3,2,2013-06-18,EBAY,0.024316297844052315,0.9231613874435425,0.052522290498018265
Ebay,Well I got scammed.,"I sold an Amazon giftcard for $50, sent it by email after buyer paid when the auction ended, two days later I see that they opened a dispute saying someobody made a purchase on their account.  Yep, we all know how this ended, the money was given back and I was out a $50 code.

Feel so stupid. 

Any tips on what to do next time I want to sell a code?",10,9,2013-06-19,EBAY,0.06356298923492432,0.8928801417350769,0.04355689510703087
Ebay,Need advice on case I submitted.,"I won an auction for what was described as ring with a  ""Natural Alexandrite"" stone that came with an ""Appraisal"".  Well when I received the ring the appraisal was obviously a fake, so I took it to a local jeweler to get the ring checked out and they confirmed it was a lab created gem not ""natural"" as stated in the auction.  So I opened up a case for a refund and everything was going smoothly.  Seller actually bought the ring some time back on eBay and never had it checked out.  So they told me to ship it back and they would make sure it wasn't tampered with and refund me my $450.  I shipped the ring back to the seller, put the tracking # in the case and now I haven't heard back from the seller since I shipped it on 6/14.  I sent another message on 6/17 when the USPS tracking shows it was delivered asking the seller to confirm that they've received the ring back.  I still haven't heard back.

My question is, should I wait or go ahead and escalate to eBay and have them handle it from here?  Seemed like everything was going to be fine but then the lack in communication worries me.

Thanks!",18,5,2013-06-19,EBAY,0.033762868493795395,0.9021249413490295,0.06411223113536835
Ebay,"Hi, could anyone please assist me with my first (and hopefully last) case opened against me?","Hi, I sold an item a few weeks ago. [Here is a link to the listing](http://cgi.ebay.com/ws/eBayISAPI.dll?ViewItemVersion&amp;view=all&amp;item=140979535821&amp;tid=0&amp;ssPageName=ADME:X:CPSOS:US:1123). It was a Futurama dvd set in a digipack. I should have taken pictures, but for some reason I did not for this listing (huge mistake). The digipack was bent on the front and crushed throughout. I noted this in the item description which can be seen in the listing that I linked to. The buyer opened a damaged item case against me. Here is the whole message and details.

***The case details:
The buyer says the item doesn't match the description.
The buyer paid on Jun 10, 2013.
The item is damaged
Additional information:
""This item is packaged in a cardboard digipak. You shipped the item in a padded mailer. The digipak was totally and completely crushed. I cannot display this item in my collection with the good ones now. I can't believe you would ship like that. Please consider discounting for this error on your part.""
The buyer requested:
A replacement item***

Now, I had never even heard of a digipack mailer, and I always send games and dvd's in a bubble mailer and they have all arrived fine. Either way, it seems that the damage is consistent with what I described in the listing. Also, I did note that the item should not be bought if the buyer wanted a mint condition item, so why would the buyer expect a bent and crushed item to look good on display with his/her other items? Further, the buyer requests a ""replacement item"", but in their message they request a discount. I am not sure how I should respond to this buyer, and would appreciate some help. My ideal outcome would be for ebay to side with me, but since I don't think that will happen, I would like to just refund them, get the item back, and sell it to someone else with pictures and even more details. Thanks for your help.",5,4,2013-06-19,EBAY,0.04096268489956856,0.9073182344436646,0.05171910673379898
Ebay,"I reported a great seller on ebay by accident, will he get in trouble?","I bought an audio component from a seller and it broke within a few months so he sent me another one free of charge. That broke again so I asked him recently to give me another item (better designed but does same thing. if it breaks I can replace the part myself) for a good price. The item costs $40 + $15 shipping but he decided to give it to me for $25 shipped. What he did is send me an email with a picture of his paypal email in text and told me to pay him there ans give him my address again, which I did. Now by mistake I clicked on the ""Do these photos violate eBay policies?"" link by accident and got a message that said this seller has been reported. I know what he was doing was probably against ebay policy as you cannot sell outside of ebay. Will he get in trouble for this? He is a good seller and has helped me out greatly. Anything I can do to reverse this?",11,3,2013-06-19,EBAY,0.25170809030532837,0.7137044668197632,0.034587468951940536
Ebay,Paypal holding funds pending investigation,Paypal has started a case with a buyer of mine. The funds are being held while they investigate. Does my buyer know this? I haven't shipped the item yet. How long do these investigations typically take?,24,3,2013-06-19,EBAY,0.23294571042060852,0.7467019557952881,0.020352322608232498
Ebay,TRS admitting to selling fake items in their descriptions.,"I've recently found out one of our biggest competitors is openly admitting to selling fake products. We've reported the seller to ebay, but considering their history of doing very little about our reports in the past, I'm sceptical anything will be done this time either.

We're based in the UK, so we'll be contacting trading standards, but I'm just wondering if anyone has any other suggestions for getting this pernicious thorn off of ebay before they do any more damage to the reputation of the legitimate TRSs that sell in the same category.",11,3,2013-06-19,EBAY,0.06700624525547028,0.89570552110672,0.037288207560777664
Ebay,A vent post about freight shipping.,"Ugh, freight can be so problematic.  I sell used IT equipment (including 400lb/95"" High server racks, some servers, copiers) and use freight a fair amount.  I cringe so hard when I get a not as described case out of the blue because of shipping damage.  The ""I can offer you a full refund once the unit is delivered back and inspected."" line seems so uncaring, which is 100% not the case.  I feel so bad for the buyer, because I know the process can take so long :(.  

Any 'Today I Learned""'s from the eBay sellers here that utilize freight?
Anyone have any horror stories to share in the pain?",4,3,2013-06-19,EBAY,0.05634111911058426,0.9030280113220215,0.04063094034790993
Ebay,Questions From a Brand New Seller,"I am about to make my first listing and I hope I can get some help. I've done a few hours of research and still feel nervous and confused. Not only am I oblivious to eBay, but I'm oblivious to mailing. I would hopefully like to change that though with some hands on experience.

I am selling a Magic: The Gathering card to test the waters. I have not made the listing yet but here are my concerns thus far:

1. How do I send it? I'm planning on selling this card for a $1 (which is about a dollar or so less than average) but I'm sure the buyer will still want it to arrive in mint condition. If I plan on selling this without charging for shipping, what options do I have that will not make me go in the negatives? I was thinking of using a normal white envelope as that is all I have, and then put the card in the envelope, with a protective card holder on the card. Will that be enough to ensure the card will more than likely arrive at the destination unbent?

2. This is going to seem like a very ignorant question but I am not very smart. I have never mailed anything in my LIFE. As far as I know, you go to the post office to weigh your package, pay the fee, and then they ship it. Is this how it works for eBay sellers? And in my case, as for an envelope, if I put it in the mailbox for the mailman to pick up (I guess that is a thing in the USA, no need to go to post office!), what would I put my delivery as? Under my package option in my listing, it says ""Service"" and is followed by a bunch of UPS and Fed Ex options. What would I pick for simply putting a letter in my mailbox to be delivered?

3. Last question that I can't figure out, I measured my envelope to be 9.5 inch length and 4.5 inch width, but I have no idea what to put for the depth. How do I find the depth of an envelope?

Any help and tips would be greatly appreciated. I love you all! LOVE!",4,3,2013-06-19,EBAY,0.02159811183810234,0.9169711470603943,0.06143074855208397
Ebay,How long has PayPal had the $250+ for signature confirmation?,I feel like it's been forever and I really want them to raise this so that I can offer items in this price range internationally on eBay with USPS shipping. I tried searching but I wasn't able to find any information on what year they started at $250.,9,2,2013-06-19,EBAY,0.041511714458465576,0.907444953918457,0.0510433167219162
Ebay,Too good to be true?,"There is a product I bid on that has two more days left on it. The price of it at the store is around $240, but my bid was $20 ad nobody else seems to be bidding. Is this real?",12,2,2013-06-19,EBAY,0.02659693919122219,0.8893869519233704,0.0840160921216011
Ebay,"""Your shipping is so high!""","I've been hearing this a lot lately, and it drives me crazy.  I'm not trying to make money off the shipping, but I don't want to loose money there either.

I weigh and measure the item, and enter the info into the shipping section when I create the listing. Then get bombarded with shipping questions.

Any tips on how I can avoid these complaints would be greatly appreciated.",17,6,2013-06-20,EBAY,0.04253862798213959,0.9117498397827148,0.04571152105927467
