subreddit,title,selftext,num_comments,score,created_utc,stock/sector,neg,neu,pos
Ebay,Is this guy trying to beat me out of $200?,"Hey guys,

I recently bought a used Phone off eBay, for around $200 and some change, but that's not really here nor there, I contacted the guy and told him that I would pay him Late Wednesday/Early Thursday, and the money didn't come in at the time I expected so I contacted him to organize pay on delivery, and of course I had already checked out with pay on delivery, so paypal was already not an option at this point (because I had already checked out with pay on delivery).

The guy wasn't going for it so, we organised to pay through paypal, I paid him, and around that same time he stopped responding to my messages (which was on Friday), i've only sent him two (one to let him know that i've paid him and i'll leave positive feedback in lieu of the problems we encountered and one to ask him when he was going to post it), then I figured i'd give him the weekend, things get busy, might be a party guy, might have a family and he may not have had time to respond, so now I'm at this point,


I've contacted him with the confirmation email that I've paid him (as i'm writing this), from Paypal and now, I'm going to wait til' about this time tomorrow to see if he either a) posts it or gets back to me or b) ignores it

If B, should I be contacting Paypal with all of this information? (I also have screen shots of the receipts from the purchase) and all of our messages back and fourth 


Am I going about this the right way? 










**TL;DR Version:**

Bought Phone off eBay


Made agreement with seller when i'm gonna pay


Money didn't come in in time so I tried to push for pay on delivery, of which he declined to do so, 


Had already checked out with Pay on delivery so couldn't go proper paypal route.


Paid him money directly through paypal


Guy hasn't responded to any of my messages since then (which is 3, 2 of which where sent on friday and one just now)



Wanting to know if I should make attempts to recoup money.",0.0,0,2013-07-08,EBAY,0.061250630766153336,0.912453830242157,0.026295509189367294
Ebay,Selling in specific areas.,"First off I understand the risk, and I only plan to do this a few times a year to keep it low key. I do not plan on buying handfuls of clothing and red-flag myself. 
I work for an upscale clothing store in America and I have access to clearance stuff before it goes to the floor. I am allowed to buy it as an employee, and was curious about reselling it to a country that likes this brand of clothing.

i.e. Buying an abercrombie shirt in America for $15.00 and reselling it on eBay only in Italy for $25.00.",6.0,4,2013-07-09,EBAY,0.019420146942138672,0.9259329438209534,0.054646965116262436
Ebay,"Ebay store, time to take the plunge?","I am a top rated bronze power seller.  Already getting a 20% discount.  I average about 150-200 items available for sale with about 40-50 sales a month averaging about $30 (anywhere from $7-200 per item). These are my numbers for the last 1-2 years and I only see an increase in inventory happening. The past couple months I have considered opening the lowest tier store for the $16-20 per month cost.  Based on their calculators and the dozens of scenarios, I can save anywhere from $10-50 a month opening a store but with the promotions the last couple months of free listing fees, I have had no need to open a store

The benefits of opening a store are the extra 100 free listings and the 
discounted FVF for some categories.  You get a 150 free listings a month.

My question is can I have say 500 items in my ebay store and not have to pay a listing fee?  I'm under the impression that you can just keep items for sale in your store section, but they do not receive any type of promoting at ebay and are pretty hard to find, unless someone sees one of my other auctions and wants to find similar items that I am selling and they dig down into my store and make a purchase that way. Currently I have about 100 albums that I have yet to list as I have found with cds it sometimes takes months for the right buyer to come along.  So I want to get these records listed for sale, but I do not want to have to pay the 5 cent listing fees over and over each month if they take 6 months to sell on average and they're only $10 albums

If you have any pros and cons to opening an ebay store or answers to my questions please reply.",6.0,4,2013-07-09,EBAY,0.04016128554940224,0.9195215106010437,0.04031720384955406
Ebay,Does this look fishy to you?,,7.0,3,2013-07-09,EBAY,0.03921811655163765,0.8857510685920715,0.07503079622983932
Ebay,I think someone may be trying to scam me,"I have a broken Samsung Galaxy Note 2 on ebay. The glass is broken, and the ESN is bad. I created an auction on ebay today, I got a message from someone wanting to buy it with a direct paypal payment instead of waiting for the auction to end. 

I'm hesitant giving him any information. How can I make sure I'm safe?",3.0,3,2013-07-09,EBAY,0.11413079500198364,0.8369497060775757,0.048919521272182465
Ebay,I'm close to filing against a seller. Things just keep getting stranger.,"I have purchased close to 200 items on Ebay and never had a problem before. Ten days ago (June 26th) I purchased about six items from one seller. They sent me an invoice. They forgot to add shipping. They did not contact be about this issue until July 6th. I had assumed during this time my items had been shipped. On July sixth they sent me an message explaining things. I was irritated it had taken so long to contact me, but stuff happens. I asked them about sending me a corrected invoice. They responded last night, July 8th. The first email stated $8. I guess they had messed that up , as a I got a second email saying $10. Followed by a third asking me to make a payment through paypal, without an invoice. They could not figure out how to send a corrected invoice.

I have read ebays rules, as far as I can tell this is not allowed? I would feel to be protected if something was to go wrong?

Original estimated shipping time frame was 5 days. It has been almost two weeks. I do understand things happen, but why ask me to pay outside ebays rules?

The seller has a 99% approval rating. Almost no negative feedback. They have been selling since 1998, but I have been screwed over by sellers before because I was stupid and trusted them. 

I do want the items, but at this point it doesn't seem worth it.",6.0,2,2013-07-09,EBAY,0.11565585434436798,0.8516876697540283,0.03265650197863579
Ebay,How to cancel out bids?,Just wondering how to cancel out bids for buyers that have low feedback.,4.0,2,2013-07-09,EBAY,0.5855072736740112,0.391031414270401,0.023461388424038887
Ebay,"Finally hit 100, feels good.",,1.0,1,2013-07-09,EBAY,0.0189282838255167,0.5993887782096863,0.3816829323768616
Ebay,Does this look suspicious to you?,,0.0,1,2013-07-09,EBAY,0.03143155574798584,0.9263119697570801,0.04225652292370796
Ebay,How does Make An Offer work on eBay,,0.0,1,2013-07-09,EBAY,0.018158217892050743,0.9097742438316345,0.07206753641366959
Ebay,"Starting a Successful Ebay Business From Scratch, an ebook by joe hilton at Smashwords",,0.0,1,2013-07-09,EBAY,0.0245786365121603,0.9264520406723022,0.04896930232644081
Ebay,"Scammed by buyer, Paypal reverses their charges on me","Recently I sold a $100 Amazon Gift Card on ebay. A couple days after shipping, the buyer disputed the charges on Paypal (they haven't even recieved the card yet). Very shortly after, Paypal reversed the charges for the scammer.

Is it really that easy to scam buyers out of products?

What possible steps can I take?",7.0,6,2013-07-10,EBAY,0.018618326634168625,0.9179905652999878,0.06339114159345627
Ebay,Selling a laptop for parts. Dismantle or sell as one unit?,"I have an old laptop. a mab ppc G4 laptop. I upped the ram on it. Should I take it apart and sell the parts? Or sell as one unit, spares and repairs? I'm looking for the best price, I don't mind the extra work. Thanks  in advance for your suggestions :)",3.0,4,2013-07-10,EBAY,0.016703356057405472,0.8673816919326782,0.1159149780869484
Ebay,First neutral feedback in over a year,"Still no negs in a couple years, but got my first neutral in the last 18+ months. 

This is what he said:
Extremely Slow Shipping. But Product Was As Described So Neutral.

He purchased it at 1:30pm, I got home from work at 5:15, printed the label at 5:30 and dropped it off at the post office at 5:45 on the way to dinner. Tracking shows it was accepted by the PO same night and was dispatched.

Item was a $12 computer game in a DVD type case with free shipping. I mailed it 1st class. I mailed it Thursday (day of purchase) it got there following Wednesday, 6 days including the weekend.

Guy has 35 feedback, his username starts ""KKK"" and the 21 feedback he's left, 5 have been neutral or negs. Awesome day!",16.0,4,2013-07-10,EBAY,0.0920121893286705,0.8779718279838562,0.030015945434570312
Ebay,Am I a feedback extortionist?,"Earlier this year I made my first ebay transaction. After losing out on a few auctions. I just went ahead and used BIN for a item in a shop by a well-known camera shop. I paid immediately and I got the item just fine.

What I knew/know about ebay I learned from TV and movies and always thought that your feedback was important. So I was surprised that the shop I bought my camera never rated our transaction and I was really looking forward to it. When I didn't get a rating or even so much as a ""thanks"" on my first ever transaction it felt like a letdown. So I never went back and provided feedback for the seller.

Now months later, I find myself pouring over the threads here wondering if I'm petty and should have provided feedback for the seller even if they never bothered to acknowledge our transaction and the fact that I, as a n00b, pretty much rocked.",10.0,3,2013-07-10,EBAY,0.04128076881170273,0.9065058827400208,0.05221334099769592
Ebay,Taking pictures of clothes,"I sell mostly clothes in my store and am looking to boost my store to the next level by increasing the quality of the pictures. I've seen an item sell for $5 and right under it was the same item with a much better picture sold for $45, so it really can make all the difference.

I already have a picture area equipped with 2 lights, a white background.

I am looking to buy 2 mannequins: one male torso and another male legs. On top of that there are light reflectors that are supposed to increase light and decrease shadows in your picture. I am looking for as much information on these as possible. Where can I find them for a good price, what size/type or reflectors work the best? etc.

Any information will help me out. Thanks reddit.",6.0,3,2013-07-10,EBAY,0.016472775489091873,0.8519459962844849,0.13158126175403595
Ebay,Ridiculous eBay Promotions For Sellers,"40,000 Free Insertion Fees for Fixed Price Items from 7/8-7/12?

Wow, gee whiz.  Thanks so much eBay.  Now I can finally list those 40,000 Fixed Price Items that I was just sitting around mulling over.",12.0,3,2013-07-10,EBAY,0.01823633722960949,0.937000036239624,0.044763583689928055
Ebay,Buyers remorse and my no return policy,I sell electronics and triple check everything before it goes out. Someone has purchased a phone from me but the carrier has a weak signal at there house. Now they want to switch carriers and return the phone. I have a clearly stated no return policy should I stick to my guns? I'm sure I could win the case as the have e-mailed me that they like the phone but wish the carrier signal was stronger.,6.0,3,2013-07-10,EBAY,0.042769718915224075,0.8837102651596069,0.07352007180452347
Ebay,In case you were wondering how easy it is to buy from the eBay mobile app...,,11.0,2,2013-07-10,EBAY,0.03023114800453186,0.9251728653907776,0.04459594562649727
Ebay,Just sold my first gaming console on ebay. Any tips for shipping it?,I was planning on just putting it in two layers of boxes with lots and lots of bubble wrap. Is there anything else I should do?,10.0,2,2013-07-10,EBAY,0.020040152594447136,0.9305486679077148,0.049411121755838394
Ebay,Good Guy Buyer doesn't blame child for cancelling sale,,1.0,1,2013-07-10,EBAY,0.045050542801618576,0.8863198757171631,0.0686296597123146
Ebay,Some have recommended to have a seperate account for buying and another for selling. Why is that?,"I've read on a message board that many ""experienced"" sellers will tell you to have seperate accounts for different activities. Even if you have a long standing account the only reason I could think of is because you don't want others to see what you're buying for privacy reasons, but I don't care. 

I do about 12-20 sales a month does the above recommendation mainly pertain to stores or also the casual buyer/sellers as well? 

Are there any other reasons other than the privacy thing for why I should do this?",6.0,5,2013-07-11,EBAY,0.034128449857234955,0.9331452250480652,0.03272629156708717
Ebay,Social Network Marketing,"I recently started up a Facebook and Twitter account to start promoting my eBay store to my customers and get repeat business. Does anybody else do this, if so, how we'll does it work?",7.0,3,2013-07-11,EBAY,0.02477012760937214,0.9034459590911865,0.07178392261266708
Ebay,Questions about becoming a top rated seller,"From looking over my eBay account, the only thing I can see that keeps me from becoming a top rated seller, is that my items didn't qualify for 1 day shipping. Most of the time, I ship the same day as the purchase (I only have this luxury because I live practically next to the USPS). But when I look at my listings, they all say 2 day shipping or something to that effect. I thought I had gone in and changed it to 1 day so I'm not sure if that's something I have to change on each listing or if the change occurred when I cancelled my store. So my questions are:
1) Is there any great advantage to being a top rated seller? For instance, do you notice your items selling better because they supposedly have a better ranking in search results? And does the FVF discount make any considerable dent in your invoice each month?
2) Is it stressful, irritating or difficult to keep a top seller rating?",12.0,3,2013-07-11,EBAY,0.06985880434513092,0.8351773619651794,0.0949639156460762
Ebay,30 day limit on categories you've sold previously,"I'm getting a notice saying that I have a 30 day limit on a specific category that I've sold 2 item in. 

My account is only 60 days old. Does this have to do with the 90 day account min? I've gotten 1 negative review in an unrelated category from an extremely needy buyer. 

But they're just clothes, I thought clothing was not as restricted?",2.0,3,2013-07-11,EBAY,0.1935378760099411,0.7803325653076172,0.02612956613302231
Ebay,Sometimes I wonder. [Silly eBay Related Picture],,2.0,2,2013-07-11,EBAY,0.12521758675575256,0.844822347164154,0.029959993436932564
Ebay,"Item description doesn't match title, anything I can do?","So, I bid on some shoes. The title and item specifics say they are new size 7, so I figure it's pretty safe and bid. I was on mobile so the rest of the description wasn't visible, I didn't click on that (stupidly). 

So just now I go back and look at it, and it says ""They are marked size 8.5, but run incredibly small. I would recommend size 7... Incredibly cute!!!"" 

I have shoes in this brand and am definitely a size 7. I haven't won the auction yet but I'm pretty sure I will. What should I do?

I have made less than 5 ebay purchases so I'm sorry if this is a stupid question. Thanks!",2.0,2,2013-07-11,EBAY,0.04154958575963974,0.907065212726593,0.05138526111841202
Ebay,How do i hide the exact amount of items selling for multiple quantity item listings?,x,3.0,2,2013-07-11,EBAY,0.07607590407133102,0.9016921520233154,0.022231953218579292
Ebay,Selling on eBay in other countries - what are the paypal fees incurred?,"Hi I am looking to list an item on the eBay of another country in their local currency, and was wondering whether Paypal will charge me me this (https://www.paypal.com/uk/webapps/mpp/cross-border-and-conversion-fees) currency conversion fee to convert the money back into my currency?  Sorry, I'm just a bit confused - I would have posted this is /r/paypal  but it's dead over there!",5.0,1,2013-07-11,EBAY,0.028479376807808876,0.9101198315620422,0.061400800943374634
Ebay,Should I leave negative feedback?,"I think I'm an overly nice person, and thus reluctant to leave negative feedback.

 But the other day I ordered a radio for my car (KDC 252u). I checked it out, and the crutchfield.com website said it would fit. Instead the company(or person?) sent me the KDC 255u. I checked this out on crutchfield and it said it would fit, but protrude about an inch out of the dash. Honestly though, I am fine with this. I opened a claim to see if he just mistakenly sent me the wrong radio. Keep in mind I did not open the package. I calmly asked for an exchange if he had one. He replied with terrible and unprofessional sentences with assumptions. This is his response

""hello why you open a case without sending us a message??? the 255 and 252 is exactly the same size! same radio the 255 is just the newer version. here is a link to metra web site that will show you which kit your car takes. http://www.metraonline.com/vfg please close the case that you open""

He pretty much ignored that I asked him if he had the one I ordered. And didn't listen to what I said about already seeing if it would fit.

I went back to crutchfield, and it now says that both radios will protrude (before It said the 252u would fit perfectly). I am 99% sure it has been updated since i looked it up because the reason I choose the 252u over the 255u was because it fit better.

Anyways, I responded that if it was the same size then everything should be fine. 

He replied telling me to get a dash kit to make sure it fit... so i guess he isn't fully reading my replys.

//// TL:DR /////

Reason the leave negative feedback:
They sent me the wrong radio, they didn't apologize or even offer to take it back, they barely read my claim and didn't respond appropriately. And most importantly, the radio is still listed, which means they are still selling 255us as 252us. 

Reason to leave Positive feedback: The products are essentially the same, except the one they sent me is probably slightly better.",6.0,1,2013-07-11,EBAY,0.057840410619974136,0.909666895866394,0.032492633908987045
Ebay,"""This item isn't located in the US""?","I was listing a new item just now, and on the preview page just before you finalize the item, I got this message:

""You can list this item, but we don't support sending it to the US shipping center. Learn more
The item isn't located in the US.""

I've never had it before, and I had listed using ""Sell a similar item"" and just changed the clothing size. When I posted the item, the location was accurate as always, and showed my town and state. 

I'm in the US, and I never ship outside of the country anyway, so I don't think this is going to be a problem for me, I just thought it was a little weird and wondered if anyone else has had it, or knows if it's an error or what. 


EDIT: I'm listing more items, and this hasn't happened again.",1.0,1,2013-07-11,EBAY,0.06632161885499954,0.9025997519493103,0.031078632920980453
Ebay,What is with people bidding and not paying?,"I sold 3 different items within the past week. Two of the items had winners who had JUST signed up to ebay within the last few days and have zero feedback. The other winner is from Argentina (I specifically note in my ad ""US Bidders Only"". And its been 3-4 days now with no payment and they are not responding to my emails. Is this something new that people do? Just bid on things without actually planning on buying/paying for the items? Is 10 days a good amount of time to give them (even though I specifically state in my ad that payment is required within 48 hours of auction end) before I relist my item?",6.0,6,2013-07-12,EBAY,0.025551732629537582,0.9291282296180725,0.045320022851228714
Ebay,Giving a negative rating for the first time in years. Questions about leaving it.,"I had posted before concerning a buyer who had messed up and forgotten to charge me shipping. They waited ten days to even bring it to my attention. I paid immediately for my purchases. They wanted me to pay additional shipping through PayPal. Outside of eBay,  I messaged them twice stating I would not pay without an eBay invoice.  They went ahead and sent me an invoice directly from PayPal anyway. 

They have a 98% approval rating and over 800 sales. 

Since the original invoice that has been paid since June 26th included 9 items, eBay customer service told me I had to file nine individual cases.

Now comes the part I am unsure about. I am leaving negative feedback for the seller because of their poor comninication and for never sending me items I rightfully won and paid for.

I have the option to leave feedback for each of the nine items. Part of me wanted to leave negative feedback for each item, but it seems like that would be an asshole move on my part, but then again the seller screwed me over. I really wanted the items, but was tired of them changing the amount they wanted for shipping after already being paid. First it was $8, then $10, then $16.

Right now all cases are pending. 

Just wondering how many negative ratings would be fair to give. As much as I want to do it for every item, it seems it would be more fair to do it for one.",16.0,6,2013-07-12,EBAY,0.11275526136159897,0.8501616716384888,0.03708309307694435
Ebay,All these scam stories are scaring me...,"I've been looking through this subreddit and a few other eBay-based boards and sites and I've come across some crazy scam nightmare stories. I'm a relatively new seller with 25 Positive feedback in about 65 sales. I generally sell cheap, common items, and scam's haven't been my main focus. After all, the most I'd lose if i got scammed on most of my items is a couple bucks. I'm trying to step it up, and start selling larger items, but I want to be as careful as possible. Here's where the questions begin:
TLDR: New ebay seller, here's my questions:

* Would it be useful for me to record/photograph my packaging and shipping process? I saw a guy at the post office today ask for his boxes back after the postage stickers and bar codes were placed on the boxes. He photographed these stickers and gave the items back to the teller.

* What else can I do, any hints?",30.0,5,2013-07-12,EBAY,0.03184255585074425,0.9242078065872192,0.04394964128732681
Ebay,Selling an obscure item that is worth money but gets almost no attention or interest,"I have for sale an [MSA Airline Filter](http://www.ebay.com/itm/130943899755?ssPageName=STRK:MESELX:IT&amp;_trksid=p3984.m1555.l2649). It is a piece of equipment that filters to extremely high standards. They can cost over $500 new and this one is never used with some surface rust. I have had it on Ebay for over 6 months. I relist and relist and relist. I have done 7 day, 10 day, buy it now. I started at around $300, then 280, 250, 180 and it will get about 10 total views per listing. I have it at $20 right now and there is zero interest. I think the amount of people in the market for this is very very small. there are a couple of similar items up now for around $300. Is there any way I can get this to sell for close to what it is worth -- or even sell it at all?",8.0,5,2013-07-12,EBAY,0.02125932089984417,0.921251654624939,0.05748901143670082
Ebay,Worth it to sell from HI?,"I'm fairly new to Ebay, and I was wondering if it will be much more difficult for me to sell products based on shipping being higher than living in the states? I'm probably going to be selling smaller items like video games, clothes, and any old toys/objects in my house.",5.0,4,2013-07-12,EBAY,0.030079662799835205,0.9146845936775208,0.05523580312728882
Ebay,How do I see how long it took a completed post to sell?,"I'm trying to price my items, and I can't figure out how long it took specific items to sell. How would I do that?",3.0,3,2013-07-12,EBAY,0.03785363584756851,0.9239127039909363,0.038233682513237
Ebay,Noob question. Should I accept payment by bank transfer?,"I know the benefits of PayPal over bank transfer for buying,  but eat about selling?  Am I likely to encounter any problems?",5.0,3,2013-07-12,EBAY,0.6858418583869934,0.29352861642837524,0.020629506558179855
Ebay,Need Help with Printing Shipping Label,"So I'm sort of in a rut and need help pretty quick.

I bought shipping and printed my shipping label, but the label prints bigger than my package. I'm using a 4x8 kraft bubble mailer (first time sending anything other than an envelope) and the label I print is slightly bigger than the package itself. Is there any way to fix this? I paid for postage and it automatically set my item as shipped, but then I ran into this problem and I cannot ship it without a label and my post office closes in about an hour and a half.

Also, I'm sending it as first class, once I do overcome this problem (if I do), do I just hand this package to a person, or can I drop it off at the same place as envelopes? Many thnx.",2.0,2,2013-07-12,EBAY,0.05315351113677025,0.9039233922958374,0.04292311519384384
