subreddit,title,selftext,num_comments,score,created_utc,stock/sector,neg,neu,pos
Ebay,Sold a 4-year old laptop (MacBook Air). Buyer is saying battery is defective. What am I responsible for?,"After 1 week of use, the buyer is getting a ""Service Battery"" message, which says that the battery should be replaced. The cost to have Apple replace the battery is $129 and the buyer is asking me to chip in.

What would be a fair response?

Edit: Thanks for your help guys. I offered to refund the buyer $25, which is roughly the depreciated value assuming a 5-year expected life and a $129 replacement cost. I'll let you know how the buyer responds.

Edit2: The buyer accepted my proposal of a $25 refund. Case closed. Thanks again guys.",9,6,2015-08-23,EBAY,0.17884129285812378,0.7756820321083069,0.045476656407117844
Ebay,Negative feedback bs,"Hi, 

I recived a negative from a buyer before he even got the item, because my shipping was to high. crappie thing is I used calculated shipping for the exact cost. Is there anything I can do about this or am I just screwed. 

Most annoying part is he had the nerve to message me asking if I had anything else to sell

I'm so frustrated, there goes my 100%...",13,6,2015-08-23,EBAY,0.09859436750411987,0.8674428462982178,0.03396273031830788
Ebay,"I screwed up returning an item, what are my options?","I'll make the story short.

- Bought item for ~250 from China on June 8th, but was defective
- Bought another one immediately from same seller because he usually sends me quality items
- Sent back the defective one with 8-10 days shipping, cost 50$ but no tracking.
- It's now been 21 working days and the seller claims he still has not received it.

Now I'm thinking I'm pretty screwed, do I have any options?",5,5,2015-08-23,EBAY,0.5397058725357056,0.4292650818824768,0.031029047444462776
Ebay,"Seller said item has ""shipping problem"" 7 days after purchase and prompts me for a full refund. I accepted but seller is not responding. What should I do?",,3,5,2015-08-23,EBAY,0.034027792513370514,0.9334447979927063,0.03252739459276199
Ebay,"What is recommended when your ""one cent"" listing looks like it will sell for one cent?","I still haven't been able to work up the nerve to list something for one cent, hoping it will be bid up as some books recommend. 

What do you do when your item worth say, $150, is still at one cent and about to be sold at that price?

Thanks for any advice.",6,3,2015-08-23,EBAY,0.03147657588124275,0.8875603675842285,0.080963134765625
Ebay,"Sold something date restricted on eBay, the payment is pending.","I sold festival tickets on eBay as I can no longer go. Paypal has held the payment (almost £500) but the festival is on Friday so I need to get them posted ASAP. 

It does say it takes up to 24hrs to clear the payment but I looked at another link that said it can take up to a week which is too late. I don't want to send the tickets without cleared payment but I don't want the buyer to miss the festival either. 

Can anybody shed some light?",2,3,2015-08-23,EBAY,0.14621233940124512,0.829097330570221,0.024690350517630577
Ebay,Do I lose money when I refund someone via PayPal?,"Buyer paid $50, then changed his mind. Will it cost me to refund him. Because that's how PayPal seems to explain it here: https://www.paypal.com/us/cgi-bin/webscr?cmd=_account-refund-fee-popup

In the example I am credit $96.80 but then debited $97.10, which is more. So I am paying .30 every time because someone changed their mind.",3,3,2015-08-23,EBAY,0.07145371288061142,0.8799663186073303,0.048580020666122437
Ebay,"Buyer asked to cancel, changed his mind.","Buyer made an offer.
I accepted.
He didn't pay, then later sent a message saying he can't buy it.
So started the cancel procedure and chose ""The buyer asked to cancel the order, or there's an issue with the buyer's address"". 
He messaged me back saying that he changed his mind, he felt bad, and wanted to buy the item.
He sent full payment, however the cancellation procedure is still lingering.
I am afraid if I send the item, he will accept the cancel and be refunded automatically(?) and also keep the item. 
Is this the case?",5,2,2015-08-23,EBAY,0.1419292539358139,0.8323723077774048,0.02569846622645855
Ebay,Global Shipping Program and signature upon delivery,"I send any purchases over $250 with signature required upon delivery. I know ebay requires it with $750 and above, but paypal requires it for items over $250. Most of my sales fall well below this amount, but recently I have been selling more expensive items. Here's my question:

If I send an item to the Global Shipping hub in KY, does it still require a signature upon delivery to the GSP hub or does this signature requirement carry over and the item will be eventually signed by the buyer? I can't seem to find any info that would answer this question. Thanks!",6,8,2015-08-24,EBAY,0.03878325968980789,0.90212082862854,0.05909591540694237
Ebay,Is this person trying to scam me?,"I recently sold an item on ebay a few days ago. I've been awaiting payment ever since. Today, he told me he sent payment to my paypal account. I haven't received anything in my paypal account, or my email confirming this. 

Then a few hours later, I get this message:

""Thank you for the message. I want you to know that your money has been deducted from my paypal account and paypal are waiting for the shipping confirmation before your account can be credited, so all you need is to make sure you get the item sent today and send the shipping number to paypal customer service am sure your account will be credited as soon as paypal receive the shipping notification. Await to hear from you as soon as the item has been send. Regards.""

This seems like a scam to me, as I've been told never to ship before the money is in my paypal account. As I said, there's nothing in my paypal account activity, no email, and it hasn't been paid on ebay, either. What steps should I take to end this so I can relist my item?",10,8,2015-08-24,EBAY,0.048526614904403687,0.9284464120864868,0.023026928305625916
Ebay,Should I sell?,I'm trying to sell a ps4 with two controllers and a game for £220 and out of nowhere I got offered £300 plus £50 for shipping? It's to Greece and the person has no review history and their account was created today. Should I sell?,8,7,2015-08-24,EBAY,0.01377092581242323,0.9220044016838074,0.06422466784715652
Ebay,Deactivating Immediate Payment on BIN?,"I've run into a concerning problem. 

I list using TurboLister, and usually take advantage when eBay lets me list a bunch of stuff BIN for no fees... I have a customer right now who wants to buy multiple items, but is apparently being forced to pay immediately. I do not have this function enabled via TurboLister on the listing page. How could this have been triggered, and more importantly, how can it be deactivated. I sell many low-value items, and large combined lots are kinda my bread and butter.

Any help would be appreciated.",8,5,2015-08-24,EBAY,0.0379367358982563,0.9192140698432922,0.04284921661019325
Ebay,[Ask /r/Ebay] What are the best and worst parts of eBay?,"Hi /r/Ebay, 

**tl;dr**  
In your opinion and experience, what are the _best_ and _worst_ features of eBay?   
- What keeps you on the platform?  
- What makes you want to leave it?  
- What features couldn't you live without?  
- What features would you sell your left kidney to be implemented or improved?  
- How significant are listings fees to the ordinary and power sellers out there?

**Background/Context**  
I'm a developer working on an e-commerce project and we really want to learn from this community what makes a great platform for **both** _buyers and sellers_.",23,5,2015-08-24,EBAY,0.022474069148302078,0.8982823491096497,0.07924360036849976
Ebay,Question about collection in person.,"I have sold an item, auction method, the buyer wants to pick up instead, on the 19th Sept, so he can be sure the item will not be damaged in the post. Which makes sense since it's a very rare and large item. I did not include a collection-in-person option on my eBay listing though.
What's the safest payment method? And how can I avoid any potential scams?
So far I have figured that cash in hand is safe, so there is no proof of the buyer sending the money through PayPal and thus they cannot use that info it against me, if he we're to claim the item was not delivered. I must know all my options first before making a decision.",6,5,2015-08-24,EBAY,0.04369764029979706,0.9181991815567017,0.038103148341178894
Ebay,Bulk editing handling time,"Hello,

I am going on a 3 day vacation, and am having a hard time figuring out how to bulk edit my handling time.

I have set my vacation mode on, but do not want to get dinged for not shipping within 1-day handling.

When I try to use the bulk editor tool, handling is not an option. 

Any thoughts?",7,4,2015-08-24,EBAY,0.029891695827245712,0.9352485537528992,0.0348597913980484
Ebay,Anyone had experience with insurance claims? USPS Vs. Shipcover?,"Anyone filed a claim before, how did that go?

Please say if you used USPS, shipcover, or a different 3rd party.  

I sell jewelry, my primary concern is loss not damage.  I have never had an insured item disappear, but one item looks like it might have been lost.  Curious others' experiences &amp; which one to use, and if there are any loopholes where they don't actually pay.",10,4,2015-08-24,EBAY,0.2766016125679016,0.7029594779014587,0.02043887786567211
Ebay,Is this enough of a disclaimer for used Lego sets?,"I've been selling my lego collection over the past couple months with mostly positive results. I've kept the sets fairly separate from each other and believe most to be 95%+ complete, if not better. I make an effort to more specifically show pictures of the minifigures involved since I know many people are interested in that, but I'm not interested in spending my time counting each and every piece vs. the manual so I price my sets accordingly and generally write something like this in the item description:

""Used (set name), including manuals and box. I will disassemble for shipping. I do not guarantee that the set is complete, but it was assembled once has all obvious visible peripherals (list main parts of set). Previous buyers of items I've sold similar to this have been pleased. Thanks!""

I've had a couple eBay newbies express confusion that they set is not complete. If they're polite, I'll send em a couple sympathy bucks with the understanding that that will resolve the issue. However, now I've got a message from a very experienced buyer/seller demanding that I provide the remainder of the pieces (about 30 pieces out of 2300). I figure such an experienced eBayer would know to read the item description. Just wondering if my bases are covered.",7,3,2015-08-24,EBAY,0.022012760862708092,0.926781177520752,0.05120600759983063
Ebay,I bought something (paid and it was listed as shipped) but now it says listing not found. Did I just get screwed?,"Did I get screwed? Should I report it to paypal and/or ebay? Is it possible it was shipped? What do I do? Lol

Thanks in advance

Edit: I have no clue who I purchased it from. His username isn't showing up",2,3,2015-08-24,EBAY,0.05526617914438248,0.9186214804649353,0.026112373918294907
Ebay,Bought an item from India and they sent the wrong item. I looked online and it states that it's pretty expensive (much more than 30 dollars) to send the item back.,"Am I screwed or do I have any options?

The item I bought is worth 30 dollars.",19,7,2015-08-25,EBAY,0.07007566094398499,0.8748713135719299,0.05505304038524628
Ebay,Are there any current ways to bypass the 21 day wait?,"I recently transferred all of my funds into a new PayPal account, to be more specific, a business account. I was unfamiliar with the layout of the business account, so I sent my old personal account a invoice for all of the funds inside of it ($140 to be exact),  and now I am stuck waiting 21 days to access my own money. Are there anyways to bypass the wait?",5,6,2015-08-25,EBAY,0.0444541797041893,0.9226803183555603,0.03286546841263771
Ebay,What would you do in this situation?,"Ok, to begin, I unknowingly bought a counterfeit product from China. Once I found out it was counterfeit, I messaged the buyer telling them the situation and politely asked for a refund. They then told me, ""This loss is very serious to me, The goods need not return, I just want to give you half the money back?"" I then politely asked for a full refund again, and they replied with, ""OK Please delete (Product was Counterfiet, buyer please beware.) Delete the bad feedback I will refund you."" I am know stuck, what should I do exactly?",3,6,2015-08-25,EBAY,0.15349328517913818,0.8062712550163269,0.040235485881567
Ebay,"stamps.com, is it significantly cheaper?","I print most of my labels through pp, ebay, or the usps website.

I can't imagine stamps.com being able to provide any significant pricing discounts to make me switch over when I feel like pp, ebay, and usps offers an already convent way to print labels.


Does anyone have any experience?",4,5,2015-08-25,EBAY,0.011732897721230984,0.8610766530036926,0.12719039618968964
Ebay,Messed up and shipped item before it was paid for.,"I can't believe I did this. I was printing out a bunch of labels and shipping multiple items, and somehow I sent out an item that hadn't been paid for yet (it was a Buy it Now). The buyer purchased it on the 21st, and the item was delivered yesterday (24th). I sent her two invoices and no response. She has 400+ transactions and a couple of complaints against her as a seller. I guess if she doesn't pay, I'm just SOL on this, right? I've pretty much accepted that since it was my mistake. My main question is when to open an Unpaid Buyer case?",10,5,2015-08-25,EBAY,0.04956556856632233,0.8993980884552002,0.05103630572557449
Ebay,Combining shipping for items purchased by the same buyer and paid for separately?,"I had a buyer purchase 2 different items from me today at different times, paid for both instantly at time of purchase. I couldn't combine shipments on the ""Print shipping label"" page, but went through the selling manager and combined the two, printed one postage label. My concern is, no tracking barcode printed on the priority label (a tracking number was uploaded, same for both items), and the postage amount printed on the label (I never show postage). Is there an easier way to do this? 

Ebay was advising me to cancel the purchase, refund the buyer, contact the buyer and get them to purchase again but not pay until I send an invoice. This sounds like a major inconvenience for the buyer, and opens the door for a lost sale (if they decide not to purchase from me because I asked them to cancel the sale and refunded them) and negative feedback. Forget that. 

I was thinking that I could just weigh the items together, mark one under the ""change status"" dropdown as paid and shipped, print the postage for the other item, and just manually enter the tracking number in the first one. Am I complicating things unnecessarily? Thanks!",9,4,2015-08-25,EBAY,0.047359563410282135,0.92132169008255,0.03131871297955513
Ebay,"I have a complaint and the seller keeps saying ""after talking with ebay""... This sounds like BS, is it?","Bought an item, it came. And it was sold as ""great condition"", the mechanical parts don't work in ""great condition. Asked for a refund, but its over $40 to ship it. I've tried talking with this person, twice about perhaps a reduction in price since I'd have to go get this fixed somewhere. I'm sure its an over used gear. Both times, they come back and say ""after talking with ebay"". Ive sold upward of 200 items but they are in a 10000 range. Does ebay consult with higher profile sellers?


Otherwise I plan on waiting till the ""ask ebay to step in date""(tomorrow)",5,4,2015-08-25,EBAY,0.03978446125984192,0.916510283946991,0.04370522499084473
Ebay,Technical Trouble Resulting in Incorrect Address - Help!,"I'm having some troubles with a recent purchase and as a relative noob to eBay, feedback would be appreciated. If anything important is missing I will edit to include those points. Here goes:

I recently purchased a manufacturer refurbished DSLR from a somewhat reputable company through their eBay storefront. As I had purchased from eBay in the past, during the checkout process there was a default address on file for my account. **On the final page before submission I deliberately changed this address to reflect my new living arrangements. After clicking submit, the confirmation page reflected the old address - still associated with the eBay account, but certainly different than that used on the order.**    

Immediately following the submission of this order (&lt;10 minutes later), I canceled the order and contacted the seller via eBay's messages informing them of the mistake. Additionally, the following morning I contacted their phone support number to inform them of the issue. During this phone conversation, I was told that the item was ""on the truck"" and there was no way to reroute the order, but they could have the package returned to the sender by the carrier to be processed for a refund. I agreed with this suggestion and waited a few days for the tracking number to reflect the changes discussed.    

After forgetting about it for a few days, I was notified on Saturday evening that the item in question was delivered to the old address and left immediately outside the garage. Initially, I thought this would be great news, but as I pulled up to the house to check (I now live around the corner), the package was nowhere to be found.    

I've now spoken to eBay a number of times. My most recent conversation ended with the customer service agent and her supervisor insisting that I open an INR against the seller. As this all started with what I believe to be an eBay issue, I don't want the seller to be held liable for what should be made right by eBay. As I was told that an INR is literally the only path forward, I reluctantly agreed to begin the process of contacting the seller.

**Additional notes:**

* To complete the transaction, I used a combination of eBay credit and PayPal (via credit card).
* The new residents of my old address said that they saw no packages over the weekend
* The sellers have agreed to give me the same price on the camera after processing the refund - not sure where this currently stands


**A few questions:**

* Am I missing something about the way that eBay handles delivery addresses? Is what happened during checkout an expected outcome?
* Without proof that I updated the address on my side before submission, am I screwed?    

**TL;DR:** Updated my address during checkout but it was not honored and item is now lost after attempts to cancel/reroute. A few questions directly above - any help, feedback, or constructive criticism would be greatly appreciated!

Edit: It is stated above that I only messaged the seller upon noticing the issue. At the same time, I also canceled the order officially.",6,4,2015-08-25,EBAY,0.1588597595691681,0.8165014982223511,0.02463873289525509
Ebay,Help please!,"RESOLVED

I received a phone from ebay but I can't activate it because the device is still be financed by the owner. T-Mobile told me as long as a device is still being financed, no one but the owner can use it. So I opened up a case for a refund online and just got word today that I'm not getting a refund. Wtf? The first time I talked to ebay on the phone and explained the situation the lady told me I'm definitely guaranteed to get my money back. What should I do?!",7,3,2015-08-25,EBAY,0.01938604563474655,0.8520886898040771,0.1285252422094345
Ebay,Bidding early vs Sniping?,"Hi there,

I was discussing with a friend who is a big ebayer about when to bid on an item.

 I have always thought sniping your max bid at 3 seconds was the best way as eBay differs from an actual auction as there is a count down timer and then the auction ends.


My friend says bidding your max early is best as it deters others, how can this make sense as every time another eBayer bids the price increases purely because you bid your max?

Thoughts?",3,3,2015-08-25,EBAY,0.03039679490029812,0.9173620343208313,0.05224113166332245
Ebay,"eBay has had my back lately, fo sho","The greys are successfully appealed defects.  

[Defect report](http://i.imgur.com/j2YXAxd.png?1)

The most recent event was this morning.  I described an item very clearly as ""YO ITZ BROKE AS SHIZ"".  Buyer opens mean return case: ""THIS SHIZ BROKE!"" *and* already left a negative feedback.

eBay rep reads through everything, compliments my fine documentation of the damage, &amp; tells me they will remove the feedback and the defect once the return case is closed.  He obliged my request to put a note on my account to do just that, so when I call back it's not a new defense.

Compared to last year, I'm feeling a lot more sensibility coming from the call center.


**Edit** Is this being down-voted for relevance?  Or is it because eBay forums are only for whining and complaining?

**Edit 2** - Someone mentioned how fast they were helped, and I have had that experience lately too.  And I should mention -- Last week, I was told they would call me back, *and they actually did*.  That was a first as well!",27,27,2015-08-26,EBAY,0.08405184000730515,0.8719106316566467,0.044037528336048126
Ebay,Buyer filed for return today. Item was sold on 7/8. What should I do?,"This was an electronic item.  Buyer claims he's been working with technical support since he received the item to get it working.  He never messaged me.

Today his return states his reason for the return is that it's a counterfeit or fake item.  Obviously, that's not the case, he just wanted to file a return where I have to pay for return shipping and because it's after 45+ days since he bought it he couldn't say the item was SNAD.

What are my options?  I'd prefer not to refund him obviously.  Can he still leave feedback or is it too late for that?",5,7,2015-08-26,EBAY,0.10321589559316635,0.8610354661941528,0.03574863448739052
Ebay,"PSA-EU: Never buy vehicles, or high value electronics from e-mail contacts that request wire transfers.","Recently there's been a lot of scams going around once again, targeting Craigs List / ebay / Amazon users which request the buyer to transfer funds to an ""eBay"" account either located in Poland or Denmark ( Possibly more ).

I understand the majoirty of you won't fall for this as from experience theres a lot of high volume sellers here, however if this post can help even 1 potential victim I'll be happy.

More information:

https://community.ebay.com/t5/Motors/Craigslist-Scams-and-Fraudulent-Use-of-Vehicle-Purchase/td-p/1445320

https://www.scamwarners.com/forum/viewtopic.php?f=34&amp;t=88073

Catherine Law seems to be the pseudonym they use a lot.

Once again, apologies if this is useless for the majority of you, however as this is coming back in to fashion again it helps to warn at least a handful of users.",2,7,2015-08-26,EBAY,0.033038727939128876,0.9088699817657471,0.05809127166867256
Ebay,eBay one day handling question. Is it next day or 24 hours? Scanning or Printing?,"So let's say I sell something at 10:30am on Wednesday.

Do I have until 10:30am Thursday to ship it or do I have until end of day Thursday?

Does the act of printing the label suffice or is it having the Post office scan it in?

Trying to make those Top Rated Seller goals.",11,7,2015-08-26,EBAY,0.011898012831807137,0.8682937622070312,0.11980816721916199
Ebay,Buyer says item hasnt arrived / Paypal Problem,"Hi all, I think I may have made a rookie mistake, so two questions!


Sent an item to a suspect address and the buyer didnt ask for tracking. The package went from Australia to America.

A month later he is saying it hasnt arrived. I have the Aus Post receipt number of the transaction and I took a photo of the box before sending. 
Will this be sufficient to prove that it's been sent? Or am I going to get royally screwed on this?

The money cleared with Paypal (500) - and I withdrew that money to my bank account as I'm currently on exchange and needed the money.

Now my paypal account says -500 (withdrawl) and pending -515 (For the ebay dispute).
Is there a reason I'm being charged double by Paypal? 

Cheers!",9,6,2015-08-26,EBAY,0.05854174122214317,0.9069358706474304,0.03452242538332939
Ebay,"Listing is in wrong category, why does it cost me 1 dollar to change it?","Hey guys, I have been having some trouble recently.

So basically I have been selling some Yu-Gi-Oh! cards online and everything has been fine. However, today I realized that my listings don't show up through a default Ebay search because they are in a slightly different category. When I attempt to change the category to the correct one it says it will cost me 1 dollar to do so.

Why?

If I make a new listing and use the correct category from the start it says the listing fee won't cost me anything.

The correct category is: 

All &gt; Toys &amp; Hobbies &gt; Trading Card Games &gt; Yu-Gi-Oh! 

While the category I have been using is:

All &gt; Collectibles &gt; Trading Cards &gt; Animation &gt; Yu-Gi-Oh! &gt; Individual Cards 

I really really don't want to relist 30 items when all I want to do is change them to a different category without getting a 1 dollar ""gallery"" fee.

EDIT: Hell, if I do a ""sell similar item"" listing that is under the correct category, it is also free. None of this makes any sense.",5,6,2015-08-26,EBAY,0.04691113159060478,0.9222047924995422,0.030884115025401115
