subreddit,title,selftext,num_comments,score,created_utc,stock/sector,neg,neu,pos
Ebay,Does anybody use the international shipping option? Pros/cons? Thinking about going worldwide!,"Edit:  Yes, the international shipping program is what I'm looking at.

Most of my items are small and easy to ship, so I've been thinking about getting in on the international sales.  I have some questions that research on eBay hasn't really answered WELL yet, so does anybody have experience with this?  Right now, my biggest hang-up is returns - if it's a case where I have to pay shipping, am I paying shipping back from eBay's domestic dropoff address, or from Iceland or wherever?  What do you think of it, those that use it?",7,6,2015-08-08,EBAY,0.018143532797694206,0.9266801476478577,0.055176351219415665
Ebay,"Sold a PS3, buyer now claims it doesn't work..","Hey, so I sold a PS3 on the 2nd of august. just about 6 days ago...

It was in perfect working condition, and came with a ton of games, I sold it for around 150$ and in the description, I wrote out the only problem which was the included HDMI cable..

I said it's sorta wonky and doesn't work at times, but if you just move it a bit it works.

He accepted the terms and purchased the ps3, I ship out same day.

He gets it 3 days later, and leaves positive feedback saying ""It works great! Just as described! Fast shipping! Thanks""

Now he messages me, it's hasn't been working for the past 3 days. Which is weird because he received it the 5th. And he left feedback the next day..

So I'm curious, should I be worried the buyer is trying to return a non-working ps3, I think it might be worst nightmare I wish I'd never had to deal with..

I have 100% positive and have sold over 40 items in the past month. 

I shipped the PS3 extremely well, and it worked for him fine, but now he has buyers remorse and might be trying to scam me through ebay's buyer protection.

Any tips are greatly appreciated, I responded with this message..

""I'm sorry to hear you're having issues, the PS3 system was tested and checked the day it was sent out, and it was operating perfectly.

Just that the HDMI cable wasn't working perfectly, but it does work.

Have you tried connecting it to another TV? Or just keep using the old HDMI cable? If not that's my suggestion.

There were no issues when the ps3 was shipped and when you received it, so it's weird that have them now.""

was this ok?",9,5,2015-08-08,EBAY,0.05920116603374481,0.8722330331802368,0.06856581568717957
Ebay,Can't find transaction on Paypal - how to ask for a refund?,"I bought an item on Ebay, it was never delivered, the seller is bullshitting about asking neighbors etc. I want to get a refund, Ebay sends me to PayPal, I paid by card when I was not logged in, so I can't find the transaction in my PayPal account. How can I open a case for a refund in this situation? I'm lost, Ebay keeps sending me to PayPal but there it's just not possible to file a complaint.",12,5,2015-08-08,EBAY,0.04653463140130043,0.9221916198730469,0.0312737338244915
Ebay,ShipSaver claim/refund dilemma and not wanting a defect. Please help!,"I Sold a pair of vintage USA made Chuck Taylors for a total, including shipping, of about $125. I shipped the package on July 9th to Thailand using USPS First Class and insured it with ShipSaver, which I have been using for just over a year but have never had to file a claim.  


The buyer sent me a message on July 26th saying that it hasn’t left the US. I checked the the package was last scanned in Chicago on July 12th, but it’s an arrival scan not a departure scan. 


I sent him a message letting him know it can take time arriving because customs ect. We have a few exhanges since then and he seems to want a refund. Yesterday (29 days after shipping the item) I started a claim with ShipSaver and sent him over the Thai affidavit page to him, but then noticed that ShipSaver allow a claim until 40 days after an item has been shipped. 


I sent the buyer a message explaining I am happy to give him a refund be we need to wait 11 more days before we can file the claim with insurance. Today His response was “Can I please have a refund”.


I don’t want him to open a INR case with eBay, but I also don’t want to be on the hook for $125 and not get a refund from ShipSaver because he might not sign the affidavit. 


My ebay account has 132 100% positive feedback, Above Average and a Bronze level Powerseller (whatever that even means) and I’m very close to being Top Rated.


I have 1 defect currently (1 out of 109) 0.92% for a previous INR case which was opened and later that day the item was delivered and closed by the buyer, from earlier this year (could i get that removed? haha)


Has anyone else been in this situation before or a similar one. What is my best course of action? 

-
TL;DR - Will ShipSaver payout if I refund via Paypal before the 40 day requirement?",15,5,2015-08-08,EBAY,0.04545259848237038,0.920519232749939,0.03402816876769066
Ebay,Sold a pair of shoes for 113 (including shipping) and I only got 109 instead. I am confused.,So I had a listing of Timberlake shoes that sold for 113 (95 for shoes plus shipping) and I only got 109 dollars from the buyer. Is there anything from eBay that takes a percentage before I get the money?,5,4,2015-08-08,EBAY,0.015742452815175056,0.9048765301704407,0.07938098907470703
Ebay,"eBay ""Undeliverable as Addressed""","I purchased an Xbox one on eBay from a seller. It was shipped off fast. However, yesterday it said ""Notice Left"" at about 12:30. I didn't actually receive my mail til about 2:30 that day. So I went online and did the re-delivery thing. Nothing came today and instead says ""Undeliverable as Addressed"". Another thing I noticed is that the package is a ""First-Class Mail"" which is only 13 ounces or less. Far to little for an Xbox one. If I open a case can I win this or do I need to do something differently since it came to my town of residence as Undeliverable?",4,4,2015-08-08,EBAY,0.042009223252534866,0.9177760481834412,0.04021477699279785
Ebay,Buyer Protection questions,"Hey guys I recently bought a pair of shoes on eBay for $330. The description for the shoe says ""100% authentic"" so if I find out the shoes are fake upon inspection when I receive it, am I covered eBays buyer protection scheme?",5,3,2015-08-08,EBAY,0.04591113701462746,0.9149059653282166,0.03918296471238136
Ebay,How would you respond to this?,"I'm a pretty knowledgeable eBay seller, but I figure tap the hive mind to make sure.

I'll start from the beginning, I was selling a very expensive (~$1500) BNIB GPU. Some 0 feedback bought it, with overnight shipping to CA IIRC. I sell a lot of expensive stuff &amp; 99 times out of 100, this situation is a scammer. Before I had a chance to ship I had the money pulled for an unauthorized use claim. So I cancelled the sale, relisted, blocked the buyer and went on with my day. During this time I was also talking to another eBayer who was interested, at some point he stated he was the same person trying to buy it from the 0 account. So when I relisted the item I gave him the item number and he purchased it from the second account. (after I had blocked his first account) 

The shipping this time was to South Africa. I sent it and that's all I've heard about it until yesterday when I received the message below from him. 

Just to note, sale date was 7/7, delivery date was 7/16.

Couple questions: 

Because he mentions feedback, what are the chances if I just ignore his question &amp; he leaves me a neg I can have it removed for feedback extortion? 

 Because he bought it from another account after I blocked his first account and I have him saying as much in messages can I have a neg removed or block a return?


The message: 

""I would like to know where the driver CD is for the card before I rate you. This should hve been part of the box contents, but there is nothing.

It cost me $540.00 just to get the card working corrctly seeing that it was overheating every time I played a game. That cost me my on board sound not to function any more. So I had to get a new board, new ram, new cpu and a cpu cooling system to assist with the card's heat. My board had a 1155 sockt which has been discontinued and the new board was an 1150, that is why I had to get a new cpu as well.

If I had the driver/utility CD none of this would have ever happened and I would have been able to set the card accordingly.""

Also, note, this was brand new and sealed so of course anything like documentation of cds would be included in the package.",11,3,2015-08-08,EBAY,0.04694776609539986,0.9210770726203918,0.031975120306015015
Ebay,"Fedex Dilemma, advice?","So, I purchased a pair of Nike's on eBay a few days ago. The seller sent them via Fedex Ground, with adult signature (21+) required, don't know why but yeah. However, I'm only 20 y/o so when the delivery guy shows up on Friday he says he can't give them to me and that I'll have to wait until he comes next time (he said tomorrow, Saturday, but in reality it would be Monday because Ground doesn't deliver on Saturday) to have someone older sign for the shoes. I obliged and took the door tag he gave me which showed he tried to deliver it at 3:21PM. Then an hour later, the tracking page for my package claims the item was delivered and signed for by someone NOT me at 4:45PM and presumably delivered to the wrong address when on the same page it shows that an hour before that there was ""delivery exception, customer not available"" at 3:21PM because I wasn't old enough to sign for the package. I called Fedex and they say yeah it was delivered to my address yet I have a doortag and the tracking page even shows it wasn't delivered to me when he came (at 3:21). So, now I've had to open an investigation (which I won't be hearing back from for another 5 days) for a package that was literally in my hands but denied to me because I wasn't old enough (though I had ID that the package was addressed to ME) and now in the hands of someone not me, but hey at least they were 21, right? I messaged the seller about the situation but he has yet to respond. 

Tracking: http://i.imgur.com/6Irjatb.png

Any advice on this situation? I kinda doubt they can get my package considering they claim it was delivered to my address so they can't tell where it was actually delivered. I've read some similar stories about buyers getting a refund from the seller then letting them deal with Fedex? Idk...",3,3,2015-08-08,EBAY,0.058766450732946396,0.9134731292724609,0.027760442346334457
Ebay,Tips for getting stuff to move,"As in, needed..
I've been a casual flipper/reseller for years. Most I've ever made was a few hundred dollars within a couple months selling bigger ticket items like electronics and music instruments. Slower moving items tend to be things like books and 99c store items (mostly as Seen on TV stuff). But I always see others pushing them rather handily, often at lower prices, and I often find I pay too much if I reduce the asking price. Part of it may be that I've had to start a new account since the one with almost 900 positives is permanently attached to a Paypal account that I shared at one time. 22 feedbacks aren't indicative of a long history. But I tend to do a lot better with ""quality"" items like electronics.

TLDR; I basically have a bunch of crap that is sitting too long and I wanna get rid of it lol",2,2,2015-08-08,EBAY,0.03525073453783989,0.902715265750885,0.062033966183662415
Ebay,Can I issue a refund and tell the customer not to return the item?,"I sold a (brand new) item on eBay, and the customer says it's defective. It was packed well, so I'm guessing the manufacturing company just made it cheaply. I'm obviously going to refund them their money, but I was wondering if I could issue a refund and just ask the customer to get rid of the item instead of mailing it back. If so, how would I do this? I'm somewhat new to eBay. 

EDIT: Thanks!!",6,7,2015-08-09,EBAY,0.042620450258255005,0.814922034740448,0.14245745539665222
Ebay,Put my item up with no international shipping - Guy from Australia submits me an offer - How?,"Get an offer from a guy in Australia.  Item has option selected ""No International Shipping"".

I think, sure I'll send it to Australia if he pays for it, whatever.

Go to my ad to change it to international shipping and the item cannot be changed.

What happens if I just accept the offer?  Will the shipping calculator be accurate?",5,7,2015-08-09,EBAY,0.024901434779167175,0.9357098340988159,0.03938872739672661
Ebay,Change in eBay billing due date - anyone else???,"Just had my eBay bill deducted today - well attempted to be deducted (grumble, grumble). I've had the 15th as my due date for as long as I can remember, and of course have funds there to cover the deduction from PayPal. 

Then I looked at my account page, and they had indeed moved it up a week, giving me a 7 day period from billing to deduction. 

Anyone else? Maybe I should day, *HEADS UP!*",4,7,2015-08-09,EBAY,0.036618154495954514,0.9226937890052795,0.04068800434470177
Ebay,Not Getting Item Sold Emails?,I have a few items listed on eBay and twice now I haven't gotten an email from eBay. The first email I didn't get was that some sent me an offer for an item and the second was that an item sold. The first I noticed when I randomly logged in to check my account and the second I got an email from Paypal. I went to check my account settings (Account &gt; Communication Preferences &gt; Seller &gt; Item Sold) and it says I will get Real Time emails. But I haven't. Does anyone have any ideas about what's going on/how to fix this?,3,6,2015-08-09,EBAY,0.037940967828035355,0.9322558641433716,0.02980317920446396
Ebay,Anyone else's shopping cart being a real pain lately?,"My cart just randomly empties out of everything I put in it, except for sold listings, which survive for some ungodly reason.

I know what's missing hasn't ended, as I can find them again and add them to the cart. Where they will stay until they end or the system decides ""I'll reset again because I know how much it angers you!""

I've sent eBay feedback. I imagine it will be read and ignored.",1,6,2015-08-09,EBAY,0.0722142681479454,0.8946421146392822,0.03314368426799774
Ebay,"Seller sent me an empty box, claims they made sure the item was in there and immediately told me I'm a scammer. What to do?","*new update*
Seller still not willing to refund but says they will file a theft and package tampering report to the post office,  says mail fraud is a serious crime to both of us,  also says they will be filling a police report and tells me I should cooperate with the authorities.   That's fine and dandy and all, but it doesn't really help me and I'm highly dubious that police work hard over a 20 dollar item that passed across the country.   

Do I wait it out our just get ebay to intervene at its earliest? 

*update*
I checked the packaging again, it looks like the seller just didn't seal the bag properly so the contents were accessible without having to open it.  I guess they aren't trying to scam, just poor packaging and someone at the post office stole it.  Or maybe they did try to scam, but now there's reasonable doubt.  In the case of inadequate packaging, allowing it to get stolen, who's responsible for eating the loss in this case?  At least I can trust people again, although my faith in people doing the job properly is still lacking :/
*end update*

Bought a item recently on ebay, opened the package and there was nothing inside the case. (the one time I don't video the unboxing, 'doh) I actually went back through the listing just to make sure I didn't stupidly fall for one of those 'box only, nothing inside but booklets' listings, but it didn't look that way. I started a refund and informed the seller there was no game in the case and I'd like a refund or the item, preferably the item.

I've browsed through r/ebay and it seems like the buyer is usually the actual scammer in these instances, and I actually worried quite a bit this would happen to me when I was selling a lot last year, but it didn't, so I guess I didn't think this would happen.

This seller only had 1 feedback at the time and no photos of the actual item, just stock, but I gave them the benefit of the doubt. Looks like it bit me in the butt though. They did use tracking and it shows as delivered.  The package is very light and the missing item is also very light so weight discrepancy would be hard to argue.


I said I would return what I got, but they refused to refund unless it came with 'all the items in the case, and case.' Which is the problem, since I didn't receive my item and just the case, and if I did, I wouldn't want a refund.

It'll be a few days until I can escalate, but I'd prefer to not to deal with that. I did tell the seller that I know sometimes mistakes happen, maybe someone was using it and they didn't know when they packaged the case. They just directed me to try contacting USPS and ""sorry for your trouble.""

So, what are my chances and choices here?  I was polite and understanding, but their first response was hostile, then after I said that I would like to resolve this amicably, that I've had this happen before, and I would have to escalate but would prefer to just have the game, they became polite but stated their ""policy"" and ""sorry for your trouble.""",25,6,2015-08-09,EBAY,0.1456538438796997,0.826156497001648,0.028189698234200478
Ebay,Buyer Says Fake Bidding Happened?,"I already cancelled the order, but wanted to see if this person was trying to scam me/changed their mind about the item.

I was selling a beauty face mask, in auction mode, starting at $0.99. This buyer who sent me a message earlier in the week had a bid of $1.81. A couple more bids from others happen throughout the week, and then the original $1.81 bidder bid $4.29.

They send me a message that sounded very confusing, and I had to clarify. To me, they were either asking if the item was fake or if I was having people fake bid. Turns out, the person did not make the bid of $4.29 (so they say) but they won the auction. They told me they would like me to cancel their order since they can't pay for the item.

Is it possible that there was a glitch in the eBay system for this to happen? Is there a setting a buyer can have to one up bids if someone bids higher then them? Or did this buyer bid and then quickly change their mind?",7,5,2015-08-09,EBAY,0.13548468053340912,0.8367020487785339,0.02781333588063717
Ebay,"Can someone please explain the defect system for closed cases, I can't find a definitive answer.","Hi,

Two scenarios.

Buyer claims INAD and requests return, later changes their mind or receives replacement, closes the case. Is this a defect?

Buyer claims INR and opens a case, item arrives, closes the request. Is this a defect?

Case times out - pretty sure this is a defect?


I was under the impression if it's closed by the buyer then there isn't a defect but from reading some forums it seems that is incorrect.

Edit: Also forgot to add, are all of these defects weighted to the same amount? Example, is an INR the same as an INAD and are these the same weight if closed by buyer etc.",7,5,2015-08-09,EBAY,0.2118709683418274,0.7616575360298157,0.02647155523300171
Ebay,Someone marked my item as paid without actually checking out.,"Someone marked my item as paid without actually checking out. I know this is a pretty common scam tactic, so I'm not going to send it out until I know for sure that the money has transferred. Last night as soon as the auction ended, I sent a friendly message congratulating them on winning the auction, and explaining that I'd take the package to be shipped today or monday morning if they checked out quickly. Now I'm stuck waiting.

How long is reasonable to wait before I message them again, or take it up with ebay? What would you do?",8,5,2015-08-09,EBAY,0.0411657840013504,0.8780093789100647,0.0808248445391655
Ebay,I got a defect while trying to provide excellent customer service...anyway to get this removed?,"A buyer had initially bought an item from me, and communicated that she would like it before the 10th of July.  I shipped it and responded that according to tracking, it will be there by July 9th.  At this same time, I noticed that the buyer bought the same item twice.    

I sent several e mails inquiring if they meant to buy two items, and explained that I don't want to open an UPI case against them, since we are already doing business, and if they can confirm that it was indeed a mistake and that I would just cancel the order.

After a week, I still had not heard from the buyer and decided to cancel the order.  Lo and behold, I got a defect because of it.  I called Ebay and they said they could not remove the defect.    

It seems like I am being punished here for trying to help a buyer out.  Am I stuck with this defect?",7,5,2015-08-09,EBAY,0.2496131807565689,0.7064040899276733,0.04398268088698387
Ebay,Users be leavin' feedback like,,14,46,2015-08-10,EBAY,0.042761802673339844,0.8999438881874084,0.05729435384273529
Ebay,Can someone explain this for me?? 3 bids of the same amount by the same person.,,6,5,2015-08-10,EBAY,0.029773904010653496,0.9348881244659424,0.035337988287210464
Ebay,ebay's latest hurdle for sellers / an attempt to reduce resolution center call volume? : Change Your Date of Date Birth - The Resolution Center will no longer assist you unless you send them your PII (Personally Identifiable Information),"Greetings fellow ebayers,

This past week I encountered a new issue with ebay's resolution center.
eBay's latest hurdle for sellers: Their helpdesk will not assist you until you give them your ""correct birth date"" during their initial verification process. They should already have this information on file I thought. Ok, I'll just go into my settings and edit it. Not so fast, you must send them a copy of your PII (FAX only no emails) to update this info. Here's the email I got:

Hello b0nesawisready 

Thank you for your email. In order for us to change your date of birth on your account, we'll need a little bit more information that we need to receive by fax only. 

The contact information on the documents you send us needs to match the information on your eBay account. If it doesn't, you'll need to let us know in writing why there are differences. If your address on eBay is your work address, you'll need to send us proof in writing so we can confirm that.

Be sure to include the username and email address of your account on the submitted documents. If the fax doesn't contain this information, we won't be able to process it.

Please submit the following documents: 

One identity proof document 

    * Driver License (copy of both front and back)

    * Passport

    * Military ID

    * National/Federal ID card

One address proof document

 

    * Bank statements, including loan/mortgage statements

    * Credit card statements

    * Utility bills (phone, power, water, etc.)

    * Insurance bills and statements 

Your information will be treated with care. Please remember we are only asking for this information in order to keep our site safe for all buyers and sellers.

    * If you are sending a bank statement please black out the bank account number.

    * If you are sending a credit card statement please black out all but the first and last four digits of the card.

Where to Fax:

eBay

Attn: Account Information Change (DOB Change)

US number: 1-877-349-1798

International number: 001-877-349-1798 

In order to avoid delays:

    * Be sure to include the username and email address of the suspended account on all documents.

    * Do not Photoshop your username onto any documents.

    * Be sure your submitted documents are current, valid, and legible.

Once you've faxed your information we should be able to get back to you within a maximum of 7-10 days, we appreciate your patience while we get this done.

Thanks,

eBay

Yes I know it is eBay's sandbox and we are just playing in it, etc. BUT hopefully this thread will help other sellers who are being shut down by the resolution center by letting them know why or at least get a conversation going. Is this just ebay putting an obstacle out to reduce call volume to their resolution center? Is this just the theory of a madman? If anyone else has some ideas I'd be curious to hear. 

Anyways, good luck and hope everyone's summer sales pick up soon!",7,4,2015-08-10,EBAY,0.03971608728170395,0.9311321973800659,0.02915177121758461
Ebay,"Bought a PS2 on eBay, seller won't finish sale, and I haven't received refund.","Hello, I recently bought a PS2 on eBay for $20 with around $11 shipping, so $30 total. It had been roughly 5 days and I hadn't heard anything from the seller about a shipment, so I contacted him. He said that he canceled the sale because ""20 dollars is too low"" However, he didn't set a reserve on the auction so it is not my fault that bidding didn't go as well as he hoped. He also claimed eBay sent me a refund, but I read on eBay that they would notify me if this happened. I have received no notification and the payment is still there. So the guy now said that he didn't get a payment, but both eBay and Paypal say I have sent the payment, it is just pending and waiting for him to accept it. Also, when I check my eBay account, under ""Awaiting Feedback"" it still has the PS2 awaiting shipment. I feel like I am being cheated out of something I won for a decent, but not ridiculously low price. Is there anything eBay could do if I got them involved? I don't now how to handle this because this is the first auction I have ever won on eBay. Thanks in advance.",8,3,2015-08-10,EBAY,0.0636914074420929,0.8926504850387573,0.04365808889269829
