subreddit,title,selftext,num_comments,score,created_utc,stock/sector,neg,neu,pos
Ebay,"I sent out an item, the buyer claims it is damaged but won't send any images. Now eBay have sided with him in the return.","Hi r/ebay! 
I sold a minidisc player on eBay last week in an effort to get rid of some old stuff and get a bit of money.  I sent the item to the buyer who asked for quick delivery and a more expensive delivery option, which I complied with. I sent the parcel his way and thought that was that. After he received the item he sent a very rude email my way complaining it was broken, I asked for details of the fault but he did not listen, continually insulting me over the messaging system. It took two days to get the nature of the fault out of him. I then sent him a message asking for an image of the damage for proof, and that I had insurance on the item from the shipping. Therefore if it was damaged in shipping I could refund him and get the money back myself as he claims a shipping error. He refused to send any images, apart from one, in which he is too far to see any detail in the minidisc player and has his middle finger up swearing at me. He then refused to contact me for the remaining time.

At the correct time I opened an appeal with eBay, who then promptly sided with the buyer. I now have to pay return shipping, which will leave me losing money of more that half the cost of the item, and leaves me with a broken player, and outside of the time frame in which I can make a claim against the shipping company. 

This is where I am asking for your help. Is there anything I can do in this situation besides losing money? Any help would be greatly appreciated. Thanks!",17,10,2015-08-01,EBAY,0.035791438072919846,0.9102027416229248,0.05400580167770386
Ebay,Why do Ebay coin sellers charge 2 or more for shipping when it can just go regular mail?,"I'm genuinely curious. The only coins I ever sold were high end silver coins, and I usually shipped them first class. 

Now I want to sell some low end coins, and I was wondering why people don't just ship them regular mail, or are they doing that and making more?",9,5,2015-08-01,EBAY,0.03051305003464222,0.9401177763938904,0.029369184747338295
Ebay,"Buyer has invalid address, and isn't responding to any of the messages.","Buyer has already paid for the item, but I can't ship the item with that address. What should I do?

The address doesn't really make much sense, and I don't want to take a chance guessing it.",3,4,2015-08-01,EBAY,0.13297195732593536,0.8446047902107239,0.02242329530417919
Ebay,Error 5014: Blocked buyer - how to resolve this?,"im a niche collector, and a seller who frequently sells things I'd like apparently has me unable to buy. I've never bought from him, because this has always occurred when trying. I'm a regular ebayer, with no issues or negative feedback. I have messaged the seller twice, inquiring as to the reason, but no response. Should I just get a friend to bid and buy and pay them back? It's frustrating, and I don't know what else to do aside from driving across the country and going into their brick and mortar shop. Advice appreciated",6,3,2015-08-01,EBAY,0.1329272836446762,0.8360164165496826,0.031056253239512444
Ebay,What should I do? Ship the item or Cancel or Wait?,"I sold a pair of brand new sneakers where buyer paid additional for express shipping. I didn't realize until packing that there was a stain on the sole, but it was pictured in the listing. I immediately contacted the buyer twice in the last 24 hours about this and to see if he wanted to cancel or go ahead with shipping. But I have not heard back since. 

I have since cleaned the stain myself, but its not pictured in the listing. Which makes me worry.

Contacted ebay and was told to call the buyer myself. But I don't think its a good idea as whatever we say can not be documented if the buyer decides to file a INAD case.

Whats the best plan of action here?",3,2,2015-08-01,EBAY,0.07331480085849762,0.8980437517166138,0.02864140272140503
Ebay,Buyer has not picked up item from post office and wants a refund.,Hello! I sold a item to someone  this month and I shipped it to a PO box with tracking and it was delivered to the buyers post office. For 6 days the buyer has not picked up the item. Ive messaged the buyer 2 times and called to let them know the item is ready to be picked up without a reply until today. The buyer said that they dont want the item anymore and that he/she is going to ship it back and that to give them a refund. They STILL have not picked up the item and im pretty much getting mad. Im thinking that the buyer is waiting for usps to ship back my item for a refund. I have no intention of giving a refund if that happens but i wanted to make sure that if the buyer starts a claim and loses because they dint pick up the item i dont have to give a refund back right? And i can relist the item again?,10,2,2015-08-01,EBAY,0.07957810908555984,0.8873559832572937,0.03306589275598526
Ebay,"Wanting to become a seller, what do i need?","Hello people, this is my first time using this sub so this is my formal first welcome and question.

I want to start as a seller, selling clothes, toys, and whatever i can get my hands on through Ebay. I already have a good computer, Do i need a printer, scanner, shipping boxes? Can anyone point me in the right direction?

I was thinking of using the priority boxes from the USPS and selling clothes, my brother told me i need to get a printer that prints labels? Just looking for some basic help here, thanks guys!",1,2,2015-08-01,EBAY,0.018873602151870728,0.8946870565414429,0.0864393562078476
Ebay,"Issues with ""revise listing"", (in Chrome browser) anyone else? TIA","Issues with ""revise listing"", spinning, spinning, keeps on spinning. (in Chrome browser, haven't tried anything else yet)

anyone else?

TIA",3,2,2015-08-01,EBAY,0.02696620486676693,0.939552366733551,0.033481415361166
Ebay,"Buying my first item, a rather expensive one at that","Okay, so a person (private seller) in germany is selling my grail watch. I have never bought from ebay before. He seems pretty credible, has sold a few expensive watches before, has 100% feedback etc.

So my question is, whats to stop him from sending me the watch box with a rock inside?

He can just claim he sent the item and that I'm lying about not recieving the item. It's not like dhl checks the contents of the box at their office, to verify that theres a watch inside, not a rock.

Im really paranoid, as since i have no feedback, that ebay will side with him, if he decides to do this...


I've read all about the buyers protection etc and i know that buyers always right etc, etc. 

The payment would be via paypal, he is not accepting refunds etc.

Please help :x",8,2,2015-08-01,EBAY,0.023955212906003,0.922563910484314,0.05348086729645729
Ebay,How long before I can open an unpaid item case?,"I've looked around eBay for this but they seem to just say ""after a reasonable time"" which is far too vague to be of any real use. 

Basically, I sold a laptop/tablet on eBay on 29th July. The person I sold it to has 100+ feedback, 100% positive, has been a member for 3/4 months.

It's now the 1st of August and, despite sending an invoice (I didn't need to, but I did as a reminder to them sort of thing) on Thursday night, and then sending an email asking if anything was wrong on Friday night, it's now Saturday evening and I've still had no payment and no communication whatsoever from the ~~seller.~~ buyer

What's confusing me is their feedback. He's only been a member for 3 months but still that, along with their feedback, still seems unusual and too much effort for a scammer. So part of me is giving them the benefit of the doubt, but the other part of me is saying they never intend to pay because they haven't communicated. 

I really need the money at the moment so I need to either relist this asap, or have him pay asap. I can't go on waiting.

Should/can I open a case?",7,2,2015-08-01,EBAY,0.05158638954162598,0.9133476614952087,0.035065874457359314
Ebay,selling my iPhone 6. Will be the biggest ticket item I'm selling ever. Can the buyer easily fuck me over and get away with it?,"I'm including delivery confirmation + signature on the winning bid.

Also made shipping only in canada + USA.

Is there still a way a buyer can scam me ? What can I do to prevent this?",22,12,2015-08-02,EBAY,0.015530169010162354,0.7802068591117859,0.20426300168037415
Ebay,Refund at the last day,"I bought an item and it is still sealed, they give full refund at a certain date. Will I still get a full refund if I ship it out with one day left. For example last day is Aug 4 and I go to USPS on Aug 3 and the item might take a 4 days to get to them.

Thanks",2,5,2015-08-02,EBAY,0.030918341130018234,0.8909640908241272,0.07811752706766129
Ebay,Seeking advice about a purchase that hasn't shipped,"I bought a upgrade kit for a scooter on eBay yesterday. After purchase, I looked at the kit and realize I bought the wrong one. I immediately contacted the seller explaining that I purchased the wrong kit, and asked how can we fix it. The seller hasn't responded and I'm getting nervous. I'd rather swap the kit and pay any difference before it gets shipped. Once shipped, I have no use for that kit because it won't fit my scooter. That means returning it, then buying the correct one. 

Do I need to cool my jets, or should I be concerned the seller hasn't contacted me yet? I thought in this day and age, a seller would be quick to handle problems. Especially one so easily fixed before shipping. The only difference in the kits is the size of the wrist pin for the piston. All other parts are the same. Any advice would be helpful.",7,4,2015-08-02,EBAY,0.06178629398345947,0.8935129642486572,0.0447007492184639
Ebay,Paypal money request after refund,"I just won an auction for a $2k camera. The seller had zero feedback. After I won. I clicked pay now, and paid through paypal. The next morning, I was refunded my money through paypal. The selling said that he was out of town and didn't want to hold on to my money and that he will send an invoice in a few days when he got back into town. Well he just sent me a paypal money request. With a note describing the camera package I am paying for.  Does this seem legit or should I tell him to send invoice through ebay? What is the best way to handle this?

UPDATE: I contacted paypal, and asked if I would be covered under their protection if I sent him money. They said to make sure to send him money as ""pay for goods"" and in the description, write what you are buying. Do this, and I would be covered, if I do not receive, or item not as described. Since I would never find this camera at this deal again, I am taking my chances. Will update when/if I receive the item. Thank you guys!",10,4,2015-08-02,EBAY,0.034147799015045166,0.9342666268348694,0.03158562630414963
Ebay,"Usually, ebay sales are immediately credited to my paypal. But after 6 hrs, nothing, anyone else see this?",,5,3,2015-08-02,EBAY,0.026460722088813782,0.9432479739189148,0.030291328206658363
Ebay,Seller demanding I remove negative feedback on a recent purchase,"I recently won a bid on a mechanical keyboard which the seller was selling as new. It arrived dirty with hair in the keys and several other keys were strewn about inside the box. At about day 50 of 60 for the feedback period I left Negative feedback while scoring the other metrics neither accurate nor inaccurate.

The seller messaged me immediately after demanding that I remove the negative feedback. Am I safe to leave it up? I did not have a positive experience and don't want to be pressured into leaving a positive score for this seller.

Is my identity safe from this person? They know my address so I am worried they are going to escalate the threats. I do not want to put my safety at risk for an ebay score..even though they didn't earn it. Any help is greatly appreciated.",42,2,2015-08-02,EBAY,0.15539145469665527,0.7823524475097656,0.062256164848804474
Ebay,"How does the ""buy it now"" function work from the sellers perspective?","What should I expect to happen on my end? 

I work at a book store and I managed to get a steal on some children's books in bulk that were being discontinued. I have 150 of two different books, 100 of a third book, and 50 each of 3 other books. Got them all for $50, which was nice.

I don't want to be constantly waiting to see if there's a higher bid. I'm happy to sell them at $2 each plus shipping, so the ""buy it now"" option seems attractive.

So, what can I expect to happen? I've never sold on eBay before. Can I sit back and wait for eBay to notify me by email when something sells? I really only want to be contacted if someone buys the book and I'm paid for it. Any suggestions? Does the buy it now option force a person to immediately pay? That's what I'd like.

Also, what are the fees if I sell something for $2 each?",5,2,2015-08-02,EBAY,0.03131138160824776,0.9135971665382385,0.05509144067764282
Ebay,Payments through PayPal outside of eBay?,Hi there. I'm selling my bike through eBay and I've barely used it before and haven't had the time to properly research and get to grips with It. Someone has messaged me privately saying he will use the buy it now price but wants to do it through PayPal directly to avoid charges. The way he writes is spurious but could be legit. Is if safer to go though eBay?,7,2,2015-08-02,EBAY,0.030186470597982407,0.9080220460891724,0.061791498214006424
Ebay,Should I close unpaid item dispute?,"Hello. I sold an item on eBay a week ago today. I opened up an unpaid item dispute after 72 hours. The buyer has initiated an echeck payment today through paypal, which shows pending. I won't ship the item until it has cleared. My question, however, is whether or not I should close the unpaid item dispute? He is requesting I close the dispute immediately so that he avoids a strike. Should I close it now, or wait until the payment clears? Thanks!",3,2,2015-08-02,EBAY,0.12022166699171066,0.829369068145752,0.050409212708473206
Ebay,"If I do not hit the reserve price when bidding, it doesn't show my max bid?","I was bidding on an item with a reserve.

I put in a max of 1000 bucks. To my surprise, the item ended with the final bid showing up as 620 under my name. I'd like to determine if this is because I entered the wrong max bid amount, or that the reserve price was above 1000, and thus wasn't shown since it wasn't met.",1,2,2015-08-02,EBAY,0.2444048374891281,0.729802131652832,0.025793025270104408
Ebay,"[PLEASE HELP- NEW TO SELLING] Sold a tethered jailbroken iPod touch 4g. Apparently the buyer turned it off, (tethered, cough-cough) and then messed it up. Now wants a refund.","We had a conversation, and the buyer did confirm that it worked great when he got it. But now he says there's no power, and the screen is black and it won't power on. Now he filed a return request, and after I tried to discuss with him why didn't he at least ask me a question about how to fix it, he just tells me that ""EBay will take care of it"" and now doesn't respond AT ALL... From what I see it seems like he messed it up himself and now is looking for an easy way out to get his money back. I'm sorry if this is too common, but I am fairly new to selling on ebay, and I'm really scared what the ""ebay will take care of it"" means. Will ebay just take the paypal money they ""held"" and let the guy keep my iPod?? Cause I dont even see the option of asking him to legit return it and then refund him. I can only give him the money back and say bye-bye to the iPod... TF is this?

P. s. I literally just saw his newest listing and he posted a lot of ipodes and one of them is mine, I can tell by the cracks and parts broken off. I messaged him about it, he goes Caps on me.... 

http://m.imgur.com/a/rXGXZ judge for yourself. 

P. p. s. I just realized that if he is to retune me my iPod, then it has to be original condition and it already isn't because he opened it. Can I use it as evidence to have the refund case closed in my favor?

EDIT: JUST CALLED EBAY CUSTOMER SERVICE, for some reason the guy actually WAS helpful, and he was able to tell that yeah, I can see and like i don't need to worry because when the deadline come i'll have evidence that he opened the ipod and he's no longer eligible for a money back guarantee... Not sure if this is good, but I got my hopes up at this point :)",40,8,2015-08-03,EBAY,0.04279443621635437,0.9098694920539856,0.04733605310320854
Ebay,"Purchased a product that was ""new with tags"" but was actually used and pre-owned.","The product is a watch tool repair kit ($27). I just received the product, opened it and saw that the tools were dirty and looked used. There were scratches and abrasions on the tools. There was an ointment that clearly looked like somebody scooped their finger into it. The seller claims the product is new so I contacted them. They said that sometimes customers return their slightly damaged items and those get sold eventually. They are currently offering me a $5 refund if this problem does not affect usage.
Should I accept this offer, try get a full refund, return the product for a new one or just leave it alone?",6,7,2015-08-03,EBAY,0.04883541911840439,0.8973684906959534,0.05379601567983627
Ebay,"Buyer left low DSR for ""Item as Described"" but I haven't even sent the item yet","I had a buyer win one of my auctions for a video game console. I had to open an unpaid item case because they didn't pay for two days, but eventually did the day before the case closed.

For some reasons they already left feedback for me, and left me a low DSR for ""Item as Described."" The problem is, there's no way they could already have the item because I still haven't shipped it, since they had just paid for the item.

Is there anyway I can dispute this? I will still make Top Rated since my defects is still under 2%, but it's very annoying that it happened in the first place.",7,7,2015-08-03,EBAY,0.10925102978944778,0.8094896078109741,0.08125940710306168
Ebay,[Buyer Question] Ebay motors invoice question.,"So, I inquired about a car I saw on Craigslist and talked to a lady who claimed she had recently gone through a divorce and was selling her very nice pick up for a very low price to get rid of it as it was her ex-husbands car. She told me that Ebay had it in one of their lots and that I would be able to request to see it free of charge and be able to use/drive it for 5 days before making the payment final. Apparently this is a redily used Ebay policy but I can't find any info on it at all. I need to know if Ebay will be expecting the money up front before they will let me see the car or if i can actually pay later. Second, the seller said they would be giving me an invoice but didn't say what would be on it at all. I'm just worried about this being fake or there being unexpected charges, a link to the dull policy would be amazing. Thanks!",5,3,2015-08-03,EBAY,0.029070090502500534,0.912725567817688,0.0582042895257473
Ebay,Seller has different address listed on Ebay than the one they shipped from,I purchased a game off of ebay that turned out to be counterfeit. I messaged the seller about it and they issued me a refund. The address listed on ebay is different from the address they shipped from and I'm not sure which one to ship the item to. The two addresses are in completely different states.,9,3,2015-08-03,EBAY,0.057958465069532394,0.9226294755935669,0.01941210776567459
Ebay,Is eBay glitching?,"I'm trying to list some items but everytime I click ""continue"" it takes me back to the initial page I clicked ""continue"" on...",4,3,2015-08-03,EBAY,0.05665309354662895,0.9235894083976746,0.01975751854479313
Ebay,Help with a return. eBay and PayPal not helping at all.,"Ok, so this is a long one.

I bought a laptop and the seller *said* they did not receive the funds, even though they were out of my account. The seller said they would not dispatch, but had already falsely marked it as dispatched. eBay and PayPal verified they were lying and that the funds had gone through. I opened a PayPal dispute for 'goods not received', so the seller panicked and admitted they could not dispatch until next week due to not having the laptop ready to dispatch.


Fast forward to when I receive the laptop, and it is in slightly worse condition than advertised (more screws missing etc) but nothing major. Then, about a week later, it begins to freeze more and more, until it cannot even boot.

I contact the seller, they accept the return, but want it through eBay so they don't lose the seller fees (apparently over £100). I can't process a refund via eBay because I previously opened a case through PayPal...bit weird if you ask me. I contact eBay, but they don't budge. They ask me to re-open the case through PayPal, but I can't, because I previously filed for a 'goods not received' case.

Now, I don't know where to turn. eBay are basically saying that if I'm screwed over once, I'm not allowed help if I'm screwed over again.

What is the best course of action? Is there any possible way to get a refund where the seller does not lose their fees?",2,3,2015-08-03,EBAY,0.11743832379579544,0.856326699256897,0.026234963908791542
Ebay,"""Minus China"". Ebay searches return no results when - (minus) operator is used with the word ""China""","I use the ""Within 100 miles of"" checkbox when I want to get purchase ""locally"" (so I get it faster), but I've found lately, even when it's checked all the top results are still ""From China"". 

Well, that blows.. let me use the minus operator since 'China' is a field which should be searchable in the item page. 


This works properly: 

    lenovo e420 adapter -china

This however does not, and just returns the header of the page

    lenovo e420 adapter oem -china


Proof of concept:

[first](https://i.imgur.com/Uy3YXDH.png)

[second](https://i.imgur.com/M9IzU5K.png)

This is a real problem. 

If someone wants to order from China, I have no issue, but it is when all the top ""within 100 miles"" results are from f'ning CHINA, and you can't even strip it out as a keyword, something nefarious is going on. 

Edit:  To see the actual 'From China' search results, you must be logged into your account to perform the search.",5,3,2015-08-03,EBAY,0.028317268937826157,0.9250364303588867,0.046646229922771454
Ebay,Global Shipping Program -- how's it work if you offer Free Shipping?,"Does it mean that I get to pay the cost to the US-based shipping center, AND the cost for international shipping?

If so, no thanks.",9,2,2015-08-03,EBAY,0.012595334090292454,0.9235107898712158,0.0638938620686531
Ebay,Potential Dispute Question,"New Ebay Seller here,

Relevant facts:  Sold an item new in box that contains a glass piece essential for functionality.  Item shipped without issue, 4 days after receipt the Buyer (limited history) claims glass came cracked and would like a replacement glass piece.  

It seems likely to me that the item arrived intact and the piece was broken at somepoint in the last few days.  Cost to replace the piece is slightly higher than my profit on the item.  

My Question is what is my best path.

(1)Replace and take the (L) 

(2)Offer a partial refund or some other consideration 

(3)Deny that the item arrived broken and let Ebay handle the dispute.

Regarding 3, are their financial consequences to taking this approach and losing outside of the replacement piece?  Any thoughts on the likely hood of a decision in my favor given the facts?

Any thoughts are appreciated, Thanks!",3,2,2015-08-03,EBAY,0.05192955210804939,0.8573142290115356,0.09075623005628586
Ebay,"Seller claims to have never received package, tracking says otherwise","I have been selling casually on eBay for almost ten years, just things I no longer need, but I've never had any problems and I have 100% feedback. I recently sold a dress, printed a shipping label through eBay (so tracking was automatically sent to buyer), dropped it at the post office, and thought nothing else of it. 

Now, two weeks later, buyer opens a dispute with me saying they never received the item. When I check tracking, it says it was delivered 2 days after I sent it and left in/at mailbox. She is being amicable, but she basically expects a refund from me. What recourse do I have? I know eBay does nothing to protect sellers, and I don't necessarily think she's scamming me (maybe someone took it from her box?), but I don't see why it is my responsibility to refund her.

I'm SOL, right?",5,6,2015-08-04,EBAY,0.06805016845464706,0.9020549654960632,0.02989484742283821
Ebay,"First International Sale to Australia - Thoughts, Concerns, Shipping Methods?","Firstly, I usually uncheck international shipping for all my items, but apparantly I missed this one.  It is not a global shipping program item, it was just purchased by someone in Australia. 

I noticed the item had sold but was not yet paid for, so I went to send an invoice.  Am now presented with some unfamiliar intl shipping options.  

The item is small (just a few oz), total sale was $17 bucks.   I wouldn't even be too concerned about losing the item, just don't want to lose real money.  

Thanks in advance for your input. 

Edit:  The thought occurred to me to just contact the buyer and see if he wants to temporarily cancel the sale so I can put it in global shipping program.  Seems like it would be easier (&amp; probably cheaper) on both of us.  Any opinions on that idea?",5,5,2015-08-04,EBAY,0.07387486100196838,0.8811696171760559,0.04495548456907272
Ebay,Shipping Question: Best way to ship a light product in a big box?,One of my products is 4 pounds but requires a 24 x 18 x 18 box.  Fedex ground is quoting $49...is there any other way?  Please help a rookie out!,9,3,2015-08-04,EBAY,0.024174075573682785,0.877643346786499,0.09818261861801147
