subreddit,title,selftext,num_comments,score,created_utc,stock/sector,neg,neu,pos
Ebay,[Help!] Buyer has opened case against me because they won't pick up their item?,"I recently sold a package very quickly after listing it. Great! I start packing it up for shipping when I see a message sent before the listing ended that said they'd have a day off tomorrow and could it arrive then? Well of course they didn't select the slightly more expensive one day shipping, so I just sent a polite message that with the shipping that had been selected it was unlikely.

Of course they are not in when it arrives (two days after despatch, pretty good for the service), so a ""we attempted delivery but you weren't in"" slip is left for them.

A couple of days later I get a message asking where the item is. I point out the tracking number which can be viewed on eBay (I put it in my message too) and check tracking myself, and pass on what it shows - that delivery was attempted on date X and it's likely gone to the sorting office.

Well here's where it starts getting shifty. I've been checking the tracking on and off and it shows the location of the item at their nearest post office (sorting office perhaps?) and they've still not collected. I check my messages this morning and they've opened a fecking case against me about ""item not received"" (why the hell can't the seller open a case of ""stupid buyer hasn't picked it up""?! /vent) saying that they appreciate it's ""not my fault"" (gee, real big of you!) but they weren't prepared to wait much longer and that the post office supposedly hadn't left a slip.

My reply via that system is polite but direct, basically explaining that as a seller I have done everything I can and pointing out that they have the means to pick up the package without the slip. I again check the tracking myself and show them where the item is, and say that all they need to do is take some info (that they have) and collect it.

Sigh. This is causing me a lot of stress. Basically, can the buyer touch me (they have threatened to escalate if they don't receive it) if eBay get involved? The buyer bought the item and knowingly selected a postage that was very unlikely to deliver while they were in, and is now seemingly refusing to pick it up. Ugh.",7,4,2015-08-13,EBAY,0.04541032761335373,0.9203742146492004,0.03421545773744583
Ebay,How do I verify my email address with eBay?,"When I signed up, I was expecting to be sent an email for me to verify my email address.  

&gt; ""Thanks for signing up to eBay, please click the link below to verify your email address.""  

I have not received this email, even though I have received other emails from eBay just fine.

Why did I not receive it, and how do I verify my email now?",0,3,2015-08-13,EBAY,0.025544453412294388,0.9434515833854675,0.03100401908159256
Ebay,Curious - is there any chance of being unsuspended?,"I had an account for about two years upon which I only bought; never sold. I was suspended permanently with an MC113 notice quite a bit ago and gave up on Ebay after calling in and being met with a rather antagonistic and evasive set of reps. 

One curiosity in this case was that I had been suspended through EBay India for being associated to a restricted account from there; I have no ties to India save for having bought a few items from Ebay stores based there. 

If there's anything that can be done, I have e-mail records and the account username at hand.",2,3,2015-08-13,EBAY,0.09908642619848251,0.8745560050010681,0.026357591152191162
Ebay,"Listing Buyitnows from old unsold auction listings. But some i can only list for 7 &amp; 10 days, not 30. Why?",,1,3,2015-08-13,EBAY,0.07919761538505554,0.9016827344894409,0.019119666889309883
Ebay,Say hello to my blocked bidder list...,,9,25,2015-08-14,EBAY,0.09520350396633148,0.8679386377334595,0.03685779869556427
Ebay,"Echeck is a complete joke. Many days ago Paypal informed me that the payment did not go through. However ebay's system disagrees, and wont let me open an unpaid item case, saying that they did pay for the item. Messaged the buyer no reply, ebay now wants me to call them to demand the money myself..",Its a lot of effort to just sell off some old games.,6,7,2015-08-14,EBAY,0.042762238532304764,0.9162240028381348,0.04101371765136719
Ebay,Got Scammed Because I Was Stupid,"Okay, so I sell a LOT of stuff on ebay. It's so common that I often don't think about it. I usually don't allow Best Offers, either. Which is why I didn't notice that when Ebay emailed me saying my item had ""sold"" via best offer, I hadn't actually been paid. The next morning I dropped off my package on the way to work and didn't think about it for a couple days. 

Then I noticed I never got paid. I'm an idiot. 

So, I've got zero support from Ebay, but I DO have this guys full name and home address.... What can I do? I've messaged him multiple time with no response.",8,5,2015-08-14,EBAY,0.060281701385974884,0.9157693982124329,0.02394886501133442
Ebay,Should I trust this buyer? he has identical ratings from different people...,,8,4,2015-08-14,EBAY,0.058416299521923065,0.9098846912384033,0.03169899806380272
Ebay,Changes To INAD Defects Are Coming,"I have been informed by several American CSR's that changes to INAD defects are on the horizon. I have received little information other than ""things are going to get better"" and a couple of reps have implied that management has noticed that INAD abuse is rampant and that the nature of how these are scored could change. I am wondering if anyone else has gotten any tidbits similar to this, and also if anyone has gotten anything more in-depth. 

I sell in a category where many would consider TRS to be unattainable, but have managed to keep it every month by a slim margin. To do this, I am essentially on the phone with eBay every single day for defect-removal and I am constantly having to probe buyers for information that would allow me to demonstrate to CS that their claims are bogus. 

Approximately 70% of my INAD defects are buyer's remorse, without these my actual defect rate is around 0.6%. I can tell you without a doubt that the original intention of the defect system was to get that 20% discount back. 

If INAD defects were removed or the system was altered for fairness I would be pleased with the direction of eBay in general.",4,4,2015-08-14,EBAY,0.04759925603866577,0.9100402593612671,0.042360495775938034
Ebay,"Would like some advice, might be getting scammed","So I put my xbox one up on ebay and it sold after about a week, I was happy because it was the price I wanted. After I sent it the buyer told me his wife made purchases without his knowledge and he would have to pay me a few weeks or he could send it back. I told him he could keep it and just pay me when he gets the money. The day comes and he says his paypal is ""messed up"" and he will send me a check in the mail and asked for my address. I asked him what was wrong with it and I would like to be payed on paypal. 

He hasn't responded but I'm starting to get worried, I opened up a unpaid item case just to make sure I'm safe but any advice?",13,4,2015-08-14,EBAY,0.09379420429468155,0.8715060353279114,0.03469982370734215
Ebay,"Would a seller use a ridiculously high reserve price, then cherry-pick off the top bidders?","Is it a viable tactic to say, start a desirable item (e.g. a Ming vase, a rare baseball card) at $1, but set an impossibly high reserve of 100k or more.

Seller lets the auction ends, judges the price of the item from the top few bidders, then contacts each of them and offers to sell it at his desired price.

Asking because this just happened to me:

Item starts at $1, with unknown reserve. I set a sniper for $1050. Item ends with me as top bidder, but my bid was $740 and I did not hit reserve. I contacted seller, who then told me he set his reserve at $1000, and would be willing to sell if I paid ""a little extra"" off that. I offered $1050 and he sold it to me.",1,3,2015-08-14,EBAY,0.024198634549975395,0.9194897413253784,0.056311607360839844
Ebay,"Item delivered, buyer claims not received, wants a refund. Who fills out insurance claim?","The buyer says that he was expecting my item and one more, but his mailman left it on the porch of his apartment complex and it was stolen (his assumption).  He opened a refund case and wants me to fill out the insurance claim so I can get reimbursed.  (I paid Priority Mail for a $50 item which includes the $50 shipping)   


The tracking shows that the item was delivered.  When I look at the USPS claim form online, there is an option to select the mailer or receiver of the package as the one filling out the form.


Who is responsible for filling out this form?   As the seller, I think I'm covered under seller protection, since the item was delivered on the tracking page.  I think he should be the one to fill it out and wait for the refund, not me.  The delivery address also does not contain any unit numbers, which also seems fishy to me.",5,3,2015-08-14,EBAY,0.035208169370889664,0.9364339113235474,0.028357939794659615
Ebay,I've never sold anything on Ebay before. I've got a couple of unwanted shirts.,"I bought some shirts in recent months and I'm finding 2 of them are really difficult to iron for some reason. How would I go about selling them on Ebay (they cost about $20 Australian each)? I've never bought or sold anything on Ebay before.

I live in Australia.",4,2,2015-08-14,EBAY,0.18965980410575867,0.7859309315681458,0.024409275501966476
Ebay,how to proceed with a buyers remorse customer trying to force return. SELLER Q,"So I had someone buy a cheaper one of my items. I'm still new and don't accept returns... 

A buyer sent me a message saying that he can't use the item and that he has more feedback then me (I only started selling 2 months ago have 20 feedback) and that I need to accept a return and pay for return postage.  

What should I do? I'm afraid to ask him if there's something wrong with the item because it seems people may damage it to force the return. The buyer doesn't seem nice he is very hostile so I wouldn't put it past him. I was told that if I can show buyer's remorse I can win the case. I don't want to accept a return because it will be counted as a defected item. Him threatening that he has more feedback than me to intimidate new sellers is this considered feedback extortion?",8,2,2015-08-14,EBAY,0.3347505033016205,0.6416531801223755,0.02359628863632679
Ebay,2.01% defect percentage. I swear to god if this makes me lose TRS i'm gonna flip. Didn't they add a grace period to get under 2% or something like that?,,23,13,2015-08-15,EBAY,0.049087025225162506,0.8772960305213928,0.07361698150634766
Ebay,Do sellers usually get offended if buyer gives neutral/poor feedback without communicating with the seller nor asking for a refund?,"I've been using ebay for years and only once have I given neutral feedback and it was because the seller shipped a collectors edition item in its original box (which wasn't supported on the inside) wrapped in brown paper and arrived with the box crushed but the product still in working condition. I left the feedback explaining what happened but didn't ask for a refund or anything because I could live without keeping the box in pristine shape and the seller flipped out on me over messages, something like, ""Why should it matter if the box is crushed so long as the contents made it??!!"" among other things that showed he didn't get it.

Anyway, I recently bought a video game described as good and ""good disc condition, only a few surface scratches, plays perfectly"". Got the item and the disc should have been rated as acceptable because it was one of the poorest looking discs that I've ever seen. I would have written, ""many many scratches"" not ""a few."" Seller doesn't accept refunds and I haven't tested the disc yet to see if it actually works (left home after it arrived) but I probably won't file a claim unless it actually doesn't work. I ordered two other games from the same seller that were described as ""very good"" but I would probably have rated them as ""good"" though the quality is far better than the first disc and the descriptions more accurate. If the games work I'll rate these positive because the seller refunded some of my shipping since they shipped together.

My question is, should I contact the seller at all before leaving my feedback as neutral? I don't really have anything to say to them unless I'm seeking a refund for a non working disc but I would like to avoid getting harassed by another seller who's upset about their feedback percentage.

Edit: Thanks for the advice everyone. I really do mean it. Sorry if I offended the sellers here but I really did want to know how to deal with it. It may seem obvious to a lot of you but it isn't to someone who casually buys things. Also please don't jump down the throat of the next buyer who posts here. This subreddit seems very unwelcoming.",39,9,2015-08-15,EBAY,0.07880271971225739,0.8882426619529724,0.032954633235931396
Ebay,Sold a house on eBay but buyer refuses to pay,"I listed a great home on eBay. After about three days and some new positive feedback for myself, a certain eBayer chose to buy the home. As it was almost the end of the business day I contacted him the next morning to congratulate him on his purchase and get his information. Real name, mailing address, phone number. I gave him two options: the standard eBay quit claim plus proof of current ownership or we could take the long expensive way and use a title company but he pays all fees. Both good, reasonable options right? Unfortunately this guy replied that ""This is a scam. I refuse to pay."" Uh... What? How is going through a title company a scam? I hate this guy. A $40,000 deal down the drain. I have his name address and phone number now so I called an attorney in his state. He said I have to call someone where the home is located. I'll do that Monday. In the meantime I have a useless non-paying buyer case open.",9,7,2015-08-15,EBAY,0.03733512759208679,0.9320517182350159,0.030613170936703682
Ebay,Insane money going for fifa 16 beta codes.,,2,2,2015-08-15,EBAY,0.0346071794629097,0.9000288248062134,0.06536403298377991
Ebay,What is your policy on non-paying bidders.,"I have not sent anything yet to the bidders but the invoice.  How long do you normally wait until sending a friendly reminder, doing a second chance, or just relisting?",6,2,2015-08-15,EBAY,0.04039599373936653,0.8986896276473999,0.06091443821787834
Ebay,"How do I make the buyer pay me directly into the debit card, and not this fucking paypal that takes like 30% of whatever I make...",,0,1,2015-08-15,EBAY,0.04994601383805275,0.9202342629432678,0.029819732531905174
Ebay,eBayer chose to buy the house I listed but refuses to pay.,,0,1,2015-08-15,EBAY,0.0253740306943655,0.9370203614234924,0.03760567680001259
Ebay,Not sure if i go here but you guys seem to have the experience,"I need help with a problem that i bought a game off ebay and it already reached my shipping address, im just out of town to retrieve it but was going to get it in 2 days but the seller cancelled my payment, what happens now, do i buy another, does the package get reposessed, or if i had to order it again would i have to wait for it to ship again pls help me im so confused and if this is the wrong sub then pls direct me to obe that could help",4,1,2015-08-15,EBAY,0.21217197179794312,0.7498623132705688,0.037965670228004456
Ebay,"Feedback for item not received ""on time""?","Hey, I'm just looking for some advice and thought maybe you guys could help out. I tried to google this without much success.

I bought an item on 8/7 with an 'estimated delivery date' of 8/13. Seller messaged me on 8/10 saying she was having trouble with printing a shipping label and asked if I wanted to wait for that to work or if I'd be okay with first-class mail &amp; no tracking. I said the latter would be fine and I received the item today (8/14).

I went to give feedback and anticipated giving ~~4~~ 5 stars for everything, but I'm wary of the ""Did item arrive by or before Thursday August 13th?"" question. I'm 100% not upset at all about it being one day late, especially since she kept me in the loop about it. Admittedly, I have wondered if she was just feeding me a line about the labels, but even so, I'm not upset about that enough to want to screw anyone over. She's an unexperienced seller who currently has 100% feedback. 

So my question is, how does a ""no"" to that question affect the seller? Does it factor into overall feedback score? I only have a rudimentary understanding of the eBay feedback scoring, but I work retail so I understand that 'customer survey' BS where anything less than a perfect score = failing. So if saying 'no' is gonna majorly dick her over, I'd rather avoid that.

Thanks in advance.

edit: 5 stars, not 4. derp.",8,1,2015-08-15,EBAY,0.03872246295213699,0.9051417112350464,0.05613582581281662
Ebay,Ebay Verification,,0,1,2015-08-15,EBAY,0.0295284241437912,0.8936087489128113,0.0768628641963005
Ebay,"Your Ebay saved searches are all set to public as ""interests"" on seller's info page for the world to see.","I'm seeing posts everywhere about this except here on reddit.  Does anyone have a way to set saved searches back to private?  If not,  heads up.  The things you watch are now public information. 

I can set each individual search to private but it goes right back to Public immediately.  I've deleted all of my searches. Thanks eBay.",3,10,2015-08-16,EBAY,0.031134825199842453,0.9354881048202515,0.033377110958099365
Ebay,I just started and business is picking up. What were some things you wish you knew when you first started?,,9,8,2015-08-16,EBAY,0.03672122582793236,0.9160341024398804,0.04724465310573578
Ebay,I think I'm getting scammed. (First time buyer and seller),"So I am selling (or sold) a ring on eBay. The guy bought it and I woke up this morning to a text asking for very close pictures emailed to a yahoo address. I sent the pictures and the invoice over. 

Then the guy told me he'd like it shipped to another address because it's a gift (made me pause) and he also asked me to confirm my paypal address. 

So I called eBay because it didn't feel right and they told me to never ""verify my paypal"". I told the guy what eBay said and to just pay via the invoice and he said ""okay, no problem, I'll do that."" 

Essentially, he could just be a first time buyer, like I am a first time seller, but apparently I can't get my money until this guy approves of the product and let's ebay know he's satisfied. What if he lies and says I never shipped it?

I'm not going to ship it until I get the invoice email from eBay saying he paid. And I'm going to ship it to the label eBay offers me to print off. (I'm going to tell him that after he pays though, because I don't want him backing out.) 

Is there anything else I can do to make sure I don't get scammed?",6,7,2015-08-16,EBAY,0.03024650365114212,0.9351418018341064,0.03461170196533203
Ebay,Is it against policy to sell things like virtual trading cards on Ebay? [see link for example],There are some iphone/android apps that have collectible [virtual cards](http://www.starwars.com/news/topps-star-wars-card-trader-app-now-available-exclusive) and was wondering if it was okay to sell them on Ebay. I searched and found things pointing to both yes and no. Any help would be appreciated. Thanks.,8,5,2015-08-16,EBAY,0.012511846609413624,0.7625178694725037,0.224970281124115
Ebay,basketball display stand,"where can I find a cheap basketball display stand from China? Just a simple round plastic ring that can keep the ball in place when it is placed on a shelf:

https://s-media-cache-ak0.pinimg.com/736x/c4/72/cc/c472cc73d6177f0c66a3049f06a983ec.jpg",1,4,2015-08-16,EBAY,0.01529624406248331,0.9122601747512817,0.07244361937046051
Ebay,0 feedback new member just purchased a $300 item,"I am selling GTX 970 graphics cards for $300, and a new buyer with an account made literally yesterday with 0 feedback just purchased it from the ""buy it now"" option (I have buy it now or make best offer). Anyways, I have heard about people getting scammed, and would like to prevent this. What measures and precautions should I take? I should also mention that he HAS paid already, and the balance is already in my Paypal.",7,3,2015-08-16,EBAY,0.037454038858413696,0.8906235694885254,0.07192239165306091
Ebay,Do you ask for a postage refund when you get a faulty item?,"I bought a ipod of eBay, seller stated it worked perfect, it arrived and half the spin button does not work meaning I can't skip songs. I had to pay for tracked postage which was £8. Not a great desk of money but feel I should be refunded considering the seller stated the ipod was in perfect condition. 

He also had to ipod down as used rather than refurbished. I checked his feedback and most of the items he's bought is ipod parts. He seems pretty dishonest to me.",1,2,2015-08-16,EBAY,0.05126455798745155,0.8976696729660034,0.051065843552351
Ebay,Can i pay for an item on eBay using my debit card through Paypal?,"when i didn't have the money for paying the shipping label Paypal took the remaining fee out of my account (it wasn't more than a $1 though so it's fine). I tried adding $40 to pay for an item i bid on Ebay but the transfer failed. So i have my debit card/bank account linked to Paypal, if i end up winning the item (and i'm hoping i don't to avoid trouble) will Paypal take the money i currently have in my Balance and take what's left i need to pay out of my Bank Account? Or can i pay all of it using Paypal which would use my Bank Account?

the seller's accepted payment is Paypal only (i think) but it also has the ""credit or debit through Paypal"" which makes me think i can pay for it using my debit card through Paypal?",5,2,2015-08-16,EBAY,0.03676953911781311,0.9184091687202454,0.044821325689554214
Ebay,Negative paypal balance,"I sold a camera for 700~ the buyer is returning it, I accepted the return 2 days ago and right now I have a negative balance on paypal double the amount that I sold the camera for.  Is this something that will fix after I receive the camera and refund the money?",4,2,2015-08-16,EBAY,0.04818582534790039,0.8907364010810852,0.06107782572507858
Ebay,Shipping small cheap items...cheaply?! Shipping is just as much as the items cost.,I have purchased small parts ect. from sellers on eBay for $0.99 with free tracking number. (although it only actually updated once it was delivered) How is this even possible? I have some small parts I am trying to get rid of and the lowest It seems I can get tracked shipping for is $2 for 1oz First-Class. The shipping cost more then my parts do. What is the cheapest possible way to ship a very light small bubble mailer?,5,2,2015-08-16,EBAY,0.027368249371647835,0.9210396409034729,0.05159205570816994
Ebay,"This has got to be a scam or typo, right?",,5,7,2015-08-17,EBAY,0.026049623265862465,0.9169240593910217,0.057026371359825134
Ebay,Buyer Wants to Return Item a Month Later,"Hi Reddit,

I'm in a delima right now. A buyer of mine wants to return a bad ESN phone that he purchased from me. In the listing title I wrote ""see notes"" and I explained that the phone has a bad esn. Even after he bought the phone I messaged him asking him if he wanted the phone even with a bad esn. He answered yes and so I shipped it.

A month goes by and he messages me on eBay telling me that the phone won't activate. I then explain to him that he purchased a bad esn phone and I even pulled up our messages 30 days before to confirm it.

He wants to return the phone back even though my policy says no returns and my listing even explains that the phone has a bad esn. The return started was listed as ""item wasn't as described"". 

What can I do in this situation? It's been over 30 days.",4,7,2015-08-17,EBAY,0.5407894253730774,0.43892109394073486,0.020289411768317223
Ebay,I live in the UK. Buying a laptop from US with GSP shipping... I'm confused!,"So I'm looking at a laptop on eBay to purchase that is in the US. I live in the UK, so I know that I have various fees I'll have to pay such as customs, taxes, VAT and so on. However, I'm a bit confused. The item's page says that it is sent using the Global Shipping Programme, which is going to cost around $70/£40.  (http://puu.sh/jF2QZ/9c87a7376d.png)  
When I hover over the question mark, it tells me that this fee will cover ""...applicable customs duties, taxes, brokerage and other fees. This amount is subject to change until you make payment.""  
Does that mean it will cover all import taxes/customs fees/etc? Or will I still have to pay money on delivery? The ""Learn More"" page tells me that those fees are in *addition* to any country import taxes? http://puu.sh/jF3kF/180e5ce1d9.png  
So I'm being told that I won't have to pay any money on delivery, and then that I will have to?  
Help!

**TL;DR**  
Will I have to pay ANY taxes/fees on delivery for a laptop from US -&gt; UK with the Global Shipping Programme?",4,5,2015-08-17,EBAY,0.05273421108722687,0.9190083742141724,0.028257427737116814
