subreddit,title,selftext,num_comments,score,created_utc,stock/sector,neg,neu,pos
technology,I want a Kinect alarm clock that makes me do 10 jumping jacks before turning off.,"Also, it comes back on if it sees me get back in bed.  Now by order of the Reddit Code that I just made up, if anyone gets rich off this idea they have to hook me up.",121,289,2010-12-14,TECH,0.04129227250814438,0.9047563672065735,0.05395132675766945
technology,Ever wonder how Comcast screws over Netflix and other content providers? Here's how,,86,212,2010-12-14,TECH,0.03159978613257408,0.9358923435211182,0.03250788524746895
technology,"Possible backdoors in the OpenBSD-developed IPSEC stack, financed by... the US government?",,48,134,2010-12-14,TECH,0.0458674430847168,0.9198289513587952,0.03430357947945595
technology,Voyager 1 near the edge of the Solar System. That's 17.4bn km (10.8bn miles) from Earth.,[deleted],67,100,2010-12-14,TECH,0.020040804520249367,0.9022278785705566,0.07773129642009735
technology,The new Jag is more like a road-bound spacecraft. Want. Hard.,,90,74,2010-12-14,TECH,0.047729771584272385,0.865886390209198,0.08638384193181992
technology,"Disconnect - A browser extension that stops major third parties and search engines 
from tracking the webpages you go to and searches you do",,9,58,2010-12-14,TECH,0.06584391742944717,0.9139156937599182,0.020240407437086105
technology,How a quartz watch works,,207,1566,2010-12-15,TECH,0.029566984623670578,0.934155285358429,0.03627767041325569
technology,Google introduces 'Chrome for a Cause' extension - Promises to make donations to worldwide non-profits for every tab you open between Dec. 15 - Dec. 19,,269,923,2010-12-15,TECH,0.019428184255957603,0.9091347455978394,0.07143710553646088
technology,Ebook buyers ripped-off by publisher’s prices - agency pricing has made many ebooks more expensive than paperbacks and hardbacks,,224,235,2010-12-15,TECH,0.9035463333129883,0.07582999020814896,0.020623620599508286
technology,RepRap can print transistors.,,89,217,2010-12-15,TECH,0.03582993522286415,0.9342430830001831,0.02992696687579155
technology,New FCC data shows that 68% of U.S. broadband connections don't meet the minimum requirements for broadband,,37,208,2010-12-15,TECH,0.9526661038398743,0.03699042275547981,0.010343464091420174
technology,Former contractor says FBI put back door in OpenBSD,,56,205,2010-12-15,TECH,0.08151363581418991,0.8642387390136719,0.05424761772155762
technology,"A look at the ""World's Simplest Phone""",,63,97,2010-12-15,TECH,0.04673326015472412,0.8644837737083435,0.08878304809331894
gadgets,DICK TRACY WRIST RADIO,,36,72,2010-12-15,TECH,0.07449303567409515,0.8910345435142517,0.03447240591049194
technology,"The Navy's 'sci-fi' super gun: a guide. The U.S. Navy has created the world's most powerful cannon, which can fire a 23 pound bullet at seven times the speed of sound.",,78,56,2010-12-15,TECH,0.012274631299078465,0.814029335975647,0.17369608581066132
technology,"USAF blocks access for computers on its network to NY Times, the Guardian, and at least 23 other websites carrying WikiLeaks documents",,38,52,2010-12-15,TECH,0.0382574088871479,0.9310658574104309,0.030676746740937233
technology,Phone-Wielding Shoppers Strike Fear Into Retailers,,942,974,2010-12-16,TECH,0.16882291436195374,0.8089883923530579,0.022188706323504448
technology,I can't wait for somebody to invent computers and the Internet so this can happen immediately,,151,686,2010-12-16,TECH,0.1696016788482666,0.8073097467422485,0.023088565096259117
gadgets,Dan Kaminsky has created a fix for color blindness.,,125,449,2010-12-16,TECH,0.026759088039398193,0.8951855301856995,0.07805540412664413
technology,"We HAVE to keep fighting for Net Neutrality, no matter what happens at upcoming FCC meeting.",,89,304,2010-12-16,TECH,0.09416796267032623,0.852946937084198,0.052885111421346664
technology,"This is bloody awesome. Type in a word or phrase in one of seven languages (English, French, German, Spanish, Hebrew, Russian, Chinese) and see how its usage frequency has been changing throughout the past few centuries. Addictive.",,185,292,2010-12-16,TECH,0.06217823550105095,0.9079392552375793,0.029882537201046944
technology,Google body.  Its a google earth of the body.,,60,233,2010-12-16,TECH,0.02991516888141632,0.9453101754188538,0.024774620309472084
gadgets,First retail dual core cell phone!,[deleted],133,205,2010-12-16,TECH,0.008866728283464909,0.8408864736557007,0.15024670958518982
technology,The Top 50 Gawker Media Passwords,[deleted],118,170,2010-12-16,TECH,0.025988440960645676,0.937839150428772,0.03617245703935623
gadgets,The new Commodore 64 :),,42,116,2010-12-16,TECH,0.02594035677611828,0.9007822871208191,0.07327736914157867
technology,Amazon'ss WikiLeaks Response Threatens Cloud Computing - Tech Europe - WSJ,,33,111,2010-12-16,TECH,0.02856108546257019,0.912128746509552,0.059310201555490494
technology,Google: Governments shouldn’t have a monopoly on Internet governance,,408,1296,2010-12-17,TECH,0.07095617055892944,0.901957094669342,0.027086693793535233
technology,This man is going to change the world (Best use of Kinect I can imagine),,211,588,2010-12-17,TECH,0.04124225676059723,0.915579080581665,0.043178658932447433
gadgets,Real-time WRITTEN Language Translation via Augmented Reality. Holy shit.,,115,398,2010-12-17,TECH,0.05479148402810097,0.9066857099533081,0.03852282091975212
technology,Word Lens is the coolest app yet. Translates text with the iPhone camera in real time.,,87,255,2010-12-17,TECH,0.018895842134952545,0.9224007725715637,0.058703336864709854
technology,Hell yes! California's First Molten Salt Energy Plant Approved.,,57,183,2010-12-17,TECH,0.00989062525331974,0.8389387130737305,0.15117065608501434
technology,"Microsoft Security Essentials 2.0 arrives with heuristic scanning, network traffic inspection",,54,125,2010-12-17,TECH,0.03296748921275139,0.9399881958961487,0.027044298127293587
technology,The Anonymous WikiLeaks protests are a mass demo against control by Richard Stallman,,38,92,2010-12-17,TECH,0.04626257345080376,0.9132723212242126,0.040465135127305984
gadgets,Defending the White House: What a special forces guard wears when he's protecting the president,,95,80,2010-12-17,TECH,0.02042989991605282,0.9123386144638062,0.06723149120807648
technology,Yahoo finally shuts down AltaVista.,,25,69,2010-12-17,TECH,0.34544187784194946,0.6145257949829102,0.04003231227397919
technology,"Facebook defends its geolocation service: ""There's this idea that using Facebook Places puts you at risk of being burgled, but this would only be true if your friends are likely to rob you!""",,39,46,2010-12-17,TECH,0.0634092390537262,0.8913511037826538,0.04523967579007149
technology,"Woot.com actively warning users in Gawker compromise, giving Discount",,159,960,2010-12-18,TECH,0.17061972618103027,0.8053331971168518,0.024047117680311203
technology,"""[Intel's] Sandy Bridge processors will implement security features that include the ability to remotely disable a PC or erase information from hard drives without permission from the current operator of the PC...  The commands can be received through 3G signals, ethernet, or internet connections.""",,156,240,2010-12-18,TECH,0.028681069612503052,0.9434564113616943,0.027862465009093285
gadgets,iPod nano watch kits nab almost $1 million on Kickstarter,,108,232,2010-12-18,TECH,0.02433226816356182,0.8936474919319153,0.08202026784420013
technology,Your Apps Are Watching You — A Journal investigation finds that iPhone and Android apps are breaching the privacy of smartphone users,,22,205,2010-12-18,TECH,0.4772227108478546,0.48991838097572327,0.03285883367061615
technology,"Mobile Carriers wet dream: charging you by the page, with extra fees for various popular services. Basically, DPI-powered parasitism.",,45,79,2010-12-18,TECH,0.024168863892555237,0.9414300918579102,0.03440100699663162
technology,Approximately 62 days until there are no IpV4 addresses left.,,73,78,2010-12-18,TECH,0.02885914407670498,0.9483673572540283,0.02277347445487976
technology,On a plane when the pilot collapses and the flight crew asks if there's anybody on board that can land a plane? There's an app for that.,,36,36,2010-12-18,TECH,0.03701816871762276,0.9358842968940735,0.027097539976239204
gadgets,Many smartphone apps are spying on you,,0,35,2010-12-18,TECH,0.014811288565397263,0.9206972718238831,0.06449149549007416
technology,Yahoo: We're not shutting down Delicious,,6,29,2010-12-18,TECH,0.5125409364700317,0.46470630168914795,0.02275273948907852
technology,The clock is ticking on encryption,,11,28,2010-12-18,TECH,0.28188183903694153,0.6387686729431152,0.07934944331645966
technology,My browser crashed :(,[deleted],259,1373,2010-12-19,TECH,0.6503556370735168,0.3260054290294647,0.023638950660824776
technology,"Fun Fact: 4 years ago, reddit had data theft similar to Gawker. Passwords in reddit's database were actually stored in plaintext.",,335,971,2010-12-19,TECH,0.06201121211051941,0.9162008762359619,0.02178785391151905
gadgets,Guy's got his own RC A-10 that's the size of a drone,,58,204,2010-12-19,TECH,0.021213341504335403,0.8818920850753784,0.09689459204673767
technology,Firefox to offer a 'Do Not Track' feature early next year.,,26,106,2010-12-19,TECH,0.02003379538655281,0.9366746544837952,0.043291572481393814
technology,A Glimpse Inside a Facebook Server Farm - Photo Essays - TIME,,25,73,2010-12-19,TECH,0.0300589706748724,0.9351085424423218,0.03483252227306366
technology,UK broadband firms urged to block sex websites,[deleted],31,66,2010-12-19,TECH,0.7615032196044922,0.22082798182964325,0.017668766900897026
technology,"Bank of America has cut off services to WikiLeaks, a move that comes amid speculation that the site is about to release information about the bank",,10,53,2010-12-19,TECH,0.5140116214752197,0.454143762588501,0.03184467554092407
technology,20 Most Amazing Microscope Shots Pictures,,6,49,2010-12-19,TECH,0.02503739297389984,0.921990692615509,0.05297193303704262
gadgets,Apple iPad and Microsoft Kinect are the fastest selling gadgets of all time,[deleted],44,43,2010-12-19,TECH,0.01847720332443714,0.8310948610305786,0.15042786300182343
technology,What does Reddit think of seasteading?,,48,39,2010-12-19,TECH,0.026561392471194267,0.9272871017456055,0.04615152254700661
technology,"Goodbye, net neutrality! Wireless industry looking into levying separate/different rates per 3rd-party app/site while keeping their own stuff free.",,309,719,2010-12-20,TECH,0.024705782532691956,0.9079887270927429,0.0673055499792099
technology,"Interview with one of the two Dutch teenagers arrested for DDoS - ""would do it again""",,137,354,2010-12-20,TECH,0.670234739780426,0.3079516589641571,0.021813534200191498
technology,"Nine years after the terrorist attacks of 2001, the United States is assembling a vast domestic intelligence apparatus to collect information about Americans, using the FBI, local police, state homeland security offices and military criminal investigators...",,113,326,2010-12-20,TECH,0.10338230431079865,0.8758130073547363,0.020804712548851967
technology,How do you fight for user privacy on the Web? Quit your job at Google and write a browser extension to kill widgets and trackers.,[deleted],61,298,2010-12-20,TECH,0.12762176990509033,0.8444704413414001,0.027907729148864746
gadgets,A new way to recycle paper,,134,291,2010-12-20,TECH,0.05089617893099785,0.9162229895591736,0.03288082405924797
technology,Microsoft quietly shuts down Office Genuine Advantage program,,120,287,2010-12-20,TECH,0.8935884237289429,0.0927034541964531,0.013708059675991535
technology,"TIL that Tron started an amazing special effect called ""Perlin noise"".",[deleted],71,237,2010-12-20,TECH,0.021590324118733406,0.8921012878417969,0.08630838990211487
technology,The US has fallen behind Romania in broadband performance and only one percent of American communities meet the global broadband benchmarks.,,88,121,2010-12-20,TECH,0.056303396821022034,0.41519540548324585,0.5285012125968933
technology,The End of the Internet Fast Approaches: Commerce Department and FTC pushing ahead with the “reorganization” of the decentralized Internet into a more centralized government program,,58,96,2010-12-20,TECH,0.020838750526309013,0.9350839257240295,0.044077303260564804
technology,Undue process: how Uncle Sam seized BitTorrent domain names,,3,82,2010-12-20,TECH,0.07528205960988998,0.9028400182723999,0.021877897903323174
technology,Google's safety notice for the cr-48. Google has a sense of humor.,,312,1262,2010-12-21,TECH,0.039195697754621506,0.9369417428970337,0.02386261522769928
technology,"Netflix CEO: ""The cost of sending or retrieving a gigabyte of data has fallen every year for at least 30 years."" So why has broadband access not improved in the last decade?",[deleted],308,963,2010-12-21,TECH,0.01565997675061226,0.05506021901965141,0.9292797446250916
technology,An open letter to the FCC from Steve Wozniak on net neutrality,,121,902,2010-12-21,TECH,0.022434869781136513,0.9420000314712524,0.035565104335546494
technology,"WikiLeak cables to Spanish newspaper El Pais confirm that the US bullies Spain into proposed controversial website blocking law, and unleashing the fury of Spanish Internet users",,176,890,2010-12-21,TECH,0.20007503032684326,0.7682650089263916,0.031659968197345734
gadgets,Awesome : A 360 degree video that can be seen at any angle that we desire !!!,[deleted],130,482,2010-12-21,TECH,0.014023983851075172,0.8920497298240662,0.09392626583576202
technology,The Worst Ideas Of 2010: Ping.,,81,245,2010-12-21,TECH,0.7389686703681946,0.23974113166332245,0.02129027433693409
technology,My Blackberry Is Not Working! [video],,12,225,2010-12-21,TECH,0.046444110572338104,0.8996741771697998,0.05388167127966881
technology,It's here: FCC adopts net neutrality (lite),,38,187,2010-12-21,TECH,0.023717263713479042,0.936606228351593,0.03967651352286339
technology,"""Apple doesn't like sharing, thus, it is difficult for them to build a social network.""",,46,175,2010-12-21,TECH,0.43966954946517944,0.5361538529396057,0.024176588281989098
technology,Bank of America registers BrianMoynihanBlows.com and BrianMoynihanSucks.com...Wikileaks?,,68,142,2010-12-21,TECH,0.037318021059036255,0.9175226092338562,0.045159436762332916
technology,"Thank goodness - FCC: Yup, we're going to stop paid prioritization on the 'Net",,293,1059,2010-12-22,TECH,0.07616731524467468,0.8929691314697266,0.030863629654049873
technology,Skype Goes down,,323,512,2010-12-22,TECH,0.03889120742678642,0.8733002543449402,0.08780848234891891
gadgets,Living in the future is awesome!,"I'm on a train.  I googled ""samsung moment tether"" on my phone, which gave me an app name.  I found it in the Android Marketplace and downloaded it.  It told me I needed to install software on my computer as well, but it could download this for me onto the micro SD card of the phone.  I then transferred it through the USB cable.  Moments later, I was tethered and online on my laptop.  It may not seem like much, but holy crap we have amazing gadgets now.  It felt like I did something out of a movie.  I love the future!",248,344,2010-12-22,TECH,0.017488565295934677,0.9006277322769165,0.0818837359547615
technology,WTF?  FCC: We didn't impose stricter net neutrality regulations because Android is open,,36,183,2010-12-22,TECH,0.049012135714292526,0.9195693731307983,0.03141845017671585
technology,"CNET failure trifecta: Fair Use = Piracy, their 'Top 5' is actually 4 items, and a story about McAfee uses Norton graphics?  Bravo!",,60,176,2010-12-22,TECH,0.01660139113664627,0.9340897798538208,0.04930880665779114
technology,"Homeland Security Presents ""Evidence"" For Domain Seizures; Proves It Knows Little About The Internet - Or The Law | Techdirt",,28,160,2010-12-22,TECH,0.05200342833995819,0.8881487250328064,0.05984791740775108
technology,B of A snaps up $EXECNAMEsucks domains prior to Wikileaks blowout,,38,118,2010-12-22,TECH,0.03833944723010063,0.9179796576499939,0.04368087276816368
gadgets,"Tired of friends and family asking you for recommendations on the best gadget? Me too. So I made a simple little site that curates the highest rated, bestselling and most reviewed items on Amazon.com. Now I just hand out the URL.","Site: http://www.hiddngems.com

It's still a work in progress and I've heard about some browser compatibility issues but it serves its basic purpose well enough. 

I'm not a developer so I had to use Amazon's widgets to keep the prices and ratings up-to-date, but I did put a good chunk of time into tracking down the items shown. They all represent the holy trinity of feedback - 4.5 or 5 star rating, reviewed at least 50 times, and sold a lot.

As gadget enthusiasts I figure you all might find it handy. Any suggestions or questions, let me know.

PS: No shame in admitting that the products have affiliate links, mostly because an affiliate account is required to use the widgets. Their affiliate program doesn't pay well enough for it to matter to me or to you, though. I'm not even breaking even on the hosting.",41,110,2010-12-22,TECH,0.017926078289747238,0.8675771951675415,0.11449678987264633
technology,The Harrier's recently declassified flight manual shows just how extraordinary it is.,,20,80,2010-12-22,TECH,0.021149471402168274,0.916290283203125,0.06256024539470673
gadgets,A brief history of gadgets,,11,62,2010-12-22,TECH,0.038269106298685074,0.9340959787368774,0.027634860947728157
technology,"Wikileaks Mirror Taken Down: User mirrored Cable documents on his website but host SiteGround suspended his account. Host, under pressure by upstream SoftLayer, told him to get rid of the folder containing the Wikileaks cables to re-enable his account",,248,994,2010-12-23,TECH,0.04824579134583473,0.9271267652511597,0.02462747134268284
technology,Pwned by the Owner: What Happens When You Steal a Hackers Computer (Filmed at Defcon-18),,214,848,2010-12-23,TECH,0.14666244387626648,0.8314180970191956,0.021919408813118935
technology,It only takes one bad Apple - Apple's recent removal of a WikiLeaks application from its itunes App Store could lead to a product boycott.,,148,336,2010-12-23,TECH,0.05461594834923744,0.8935572504997253,0.051826853305101395
technology,Bank of America wants to buy BANKOFAMERICASUCKS.COM - but it CAN'T as it's taken!,,112,326,2010-12-23,TECH,0.01977924257516861,0.9299553036689758,0.05026540160179138
technology,Now *this* is how you demo a website. (See if you can spot spez in the video - it's his new startup),,138,156,2010-12-23,TECH,0.025294676423072815,0.9197248220443726,0.05498041957616806
technology,"Bruce Sterling's brilliant essay on Wikileaks, ""Cypher-punks, the sad fate of Bradley Manning and more...""f the Internet was walking around in public, it would look and act a lot like Julian Assange. """,,26,145,2010-12-23,TECH,0.08683531731367111,0.8767380118370056,0.03642675653100014
technology,How WikiLeaks killed Spain's US-Bullied anti-P2P law,,9,138,2010-12-23,TECH,0.03055865876376629,0.9121131300926208,0.05732821673154831
gadgets,These watches were featured on Engadget some time ago. They're now accepting preorders. I really want one...,,78,92,2010-12-23,TECH,0.02995171770453453,0.9278886318206787,0.04215967282652855
technology,Home Internet with Anonymity (Tor) Built In,,20,62,2010-12-23,TECH,0.03446446731686592,0.9236807227134705,0.041854824870824814
technology,Bioengineered singing mouse developing language,,33,44,2010-12-23,TECH,0.02548312209546566,0.9232848882675171,0.051232077181339264
technology,"Show your relatives what Net Neutrality means 
without arguing about it for an hour with this 
helpful website.",,376,1383,2010-12-24,TECH,0.021413912996649742,0.9318109750747681,0.04677506163716316
technology,"If anyone wants to read the actual text of the Net Neutrality Order, here it is [PDF]",,55,270,2010-12-24,TECH,0.025373341515660286,0.9469704627990723,0.02765619568526745
technology,"Digg, worth $170 million earlier in the year, is now valued at just $102 million",,112,138,2010-12-24,TECH,0.018795214593410492,0.9009171724319458,0.0802876427769661
gadgets,World's smallest lighter,,36,96,2010-12-24,TECH,0.06344074755907059,0.8363145589828491,0.1002446785569191
technology,"Wikileaks exposes internet's dissent tax, not nerd supremacy",,6,63,2010-12-24,TECH,0.02128741331398487,0.9362220764160156,0.04249051958322525
technology,13 Year old girl sues Apple over moisture sensors,,46,62,2010-12-24,TECH,0.3369702100753784,0.49774014949798584,0.16528961062431335
technology,"Please, stop the Mark Zuckerberg love train",,28,59,2010-12-24,TECH,0.062000300735235214,0.8624414205551147,0.07555826753377914
technology,"For years, Nokia effortlessly dominated the cell phone market. But then Apple and Google muscled in on its turf and changed the game forever. The Finnish company is pinning its hopes on a new operating system, but it might be too little, too late.",,22,25,2010-12-24,TECH,0.04070814326405525,0.5815361738204956,0.37775564193725586
gadgets,Sleep Mask + Sunrise Clock = LUMI - Cool startup project via Kickstarter,,15,25,2010-12-24,TECH,0.013794957660138607,0.8460605144500732,0.14014455676078796
technology,Porn site: publicizing takedown notices is copyright infringement,,2,22,2010-12-24,TECH,0.18434418737888336,0.7975062727928162,0.018149573355913162
technology,Cambridge university refuses to censor student's thesis on chip-and-PIN vulnerabilities,,294,2185,2010-12-25,TECH,0.03596493601799011,0.9292407035827637,0.03479432687163353
gadgets,"I am an amputee. I can't get up a ladder to change light bulbs, so my brother made me one of these for a Christmas present.",[deleted],150,565,2010-12-25,TECH,0.020871037617325783,0.9057833552360535,0.07334566116333008
technology,Extremely life-like (behavior and movements) Nao humanoid robot with a bit of a sense of humor demoed. :-),,164,438,2010-12-25,TECH,0.028676282614469528,0.9335939884185791,0.037729762494564056
technology,4chan is currently being surveyed; click for the results you were expecting,,114,143,2010-12-25,TECH,0.20618438720703125,0.7504209280014038,0.04339471831917763
technology,"God dammit Firefox, those are wasted pixels!",,111,81,2010-12-25,TECH,0.1371888816356659,0.8232577443122864,0.03955339267849922
technology,Facebook Overthrows Yahoo To Become The World’s Third Largest Website,,29,31,2010-12-25,TECH,0.016273818910121918,0.8157291412353516,0.16799698770046234
technology,IBM racetrack memory enters home stretch,,5,23,2010-12-25,TECH,0.014279792085289955,0.89201819896698,0.093702033162117
technology,Impressive technology. Record your own voice. Website adds the instruments in the musical style you want,,7,16,2010-12-25,TECH,0.009512756019830704,0.7860912680625916,0.20439594984054565
technology,Mobile Surveillance Towers coming to a town near you. Surveillance society.,,3,14,2010-12-25,TECH,0.027572520077228546,0.9304198026657104,0.0420076958835125
technology,XPS vs PDF,,22,13,2010-12-25,TECH,0.0487455315887928,0.8343268036842346,0.1169276311993599
technology,"Mommy, why is there a server in our house?",,94,339,2010-12-26,TECH,0.033115044236183167,0.9273072481155396,0.039577681571245193
technology,This guy's 17-year-old son built him a working prosthetic electric claw out of scrap metal and old printer parts. More info in comments.,,41,300,2010-12-26,TECH,0.04009745642542839,0.9314134120941162,0.02848917618393898
gadgets,Logitech said to be halting Revue production until Google TV software revamp -- Engadget,,42,58,2010-12-26,TECH,0.02510186657309532,0.9255934357643127,0.049304649233818054
gadgets,redsn0w 0.9.7b1 brings Untethered jailbreak for iOS 4.2.1,,11,50,2010-12-26,TECH,0.05729323998093605,0.8851413726806641,0.057565368711948395
technology,Learn about thorium and molten salt reactors in 16 minutes. A video for short attention spans,,21,42,2010-12-26,TECH,0.03949929401278496,0.9237605929374695,0.03674013540148735
technology,"Goodbye Internet, we hardly knew ye? The Internet, as we once knew it, will be under renewed attack next year",,9,33,2010-12-26,TECH,0.15607094764709473,0.8154563903808594,0.028472689911723137
gadgets,I got an IOU for noise-canceling headphones for Christmas. There are so many choices available. Can anyone give me some guidance?,"One of the primary uses of these are going to be for studying. I live in a noisy household (five college guys... go figure), and I'd love to be able to use these as an alternative to the library. Price really isn't all that important, but obviously I'd rather not spend [my parents'] money if it isn't necessary.

Any help is very much appreciated. Thanks!

edit: it's likely that i will be wearing these for long periods of time, so comfort is a very important factor.",120,29,2010-12-26,TECH,0.023380562663078308,0.9069836139678955,0.06963584572076797
technology,Leaked Presentation Shows How Carriers Can Deliver Tiered Internet Services,,5,29,2010-12-26,TECH,0.011744082905352116,0.9228376150131226,0.06541823595762253
technology,Deepwater Horizon's final hours,,3,27,2010-12-26,TECH,0.10029373317956924,0.8461058139801025,0.05360036715865135
gadgets,"Weezer, the rock band performs world's largest voice search using Google Voice",,3,24,2010-12-26,TECH,0.014381056651473045,0.870070219039917,0.1155487596988678
technology,Space-saving furniture blows my mind - technology meets sleek design,,334,1438,2010-12-27,TECH,0.018101707100868225,0.8646607995033264,0.11723747849464417
technology,"Putin Loves Linux, Orders Government Transition to Open Source",,260,857,2010-12-27,TECH,0.018652960658073425,0.9236721992492676,0.057674895972013474
gadgets,"Not your typical gadget, but the first consumer-grade thing I've made from scratch: I made my uncle a bullet-counter for Christmas",,253,541,2010-12-27,TECH,0.027762580662965775,0.9251059293746948,0.04713146761059761
technology,Why Macs are not as popular outside the USA?,,1230,424,2010-12-27,TECH,0.011226239614188671,0.8363145589828491,0.15245921909809113
