subreddit,title,selftext,num_comments,score,created_utc,stock/sector,neg,neu,pos
technology,Wikileaks kicked out of Amazon's cloud,,793,1425,2010-12-01,TECH,0.020947808399796486,0.9225558042526245,0.05649644508957863
technology,"Hey Reddit: between Comcast's shenanigans, the website closures, and the threat of a wikileaks shutdown, now is a great time to donate to the Electronic Frontier Foundation","It's really important that we get internet law right, and right now is the time when it's being decided. If you've never donated before, this is a great place to start. Any amount helps.

[Link](https://w2.eff.org/donate/index.php?s_src=http://www.eff.org/front&amp;s_subsrc=donate)

[The kind of stuff they do](https://www.eff.org/victories/)",143,1322,2010-12-01,TECH,0.014814196154475212,0.8772635459899902,0.10792223364114761
technology,"Google: ""Being bad is, and hopefully will always be, bad for business in Google’s search results"" due to new algorithm",,115,364,2010-12-01,TECH,0.7263394594192505,0.252717524766922,0.020943036302924156
gadgets,"The Nook Color has been rooted. $250 for a 7"" tablet with multi-touch IPS LCD, 800mhz CPU, and a battery that gets 10 hours of usage.",,76,198,2010-12-01,TECH,0.013221770524978638,0.7895690202713013,0.1972091943025589
technology,Go Japan: Japan's bid is a plan to broadcast entire World Cup to stadiums on the other side of the world in what appears to be life-sized holograms.,,38,125,2010-12-01,TECH,0.018689054995775223,0.9076356887817383,0.07367526739835739
technology,BBC to name ISPs that purposively slow down iPlayer traffic,,60,123,2010-12-01,TECH,0.03485393896698952,0.9292045831680298,0.03594149649143219
technology,F.C.C. chairman will outline a framework for broadband Internet service that forbids both wired and wireless Internet service providers from blocking lawful content,[deleted],24,120,2010-12-01,TECH,0.30402645468711853,0.6736188530921936,0.02235468290746212
technology,"Xbox Modding Judge Berates Prosecution, Puts Trial on Hold",,7,63,2010-12-01,TECH,0.10366439074277878,0.8575992584228516,0.03873633220791817
technology,Mystery Air Force Spacecraft to Return to Earth,,33,47,2010-12-01,TECH,0.0652739405632019,0.8867738246917725,0.047952208667993546
technology,Understanding the Level 3-Comcast spat (FAQ) - This cleared up things for me,,23,43,2010-12-01,TECH,0.028012843802571297,0.8999966979026794,0.07199046015739441
technology,Prosecutors Dismiss Xbox Modding Case Mid-Trial,,165,626,2010-12-02,TECH,0.4876208007335663,0.46470776200294495,0.047671396285295486
technology,Congress - pass the CALM Act this week to finally ban TV ads that blare louder than the programs they interrupt.,,263,498,2010-12-02,TECH,0.23239991068840027,0.710338294506073,0.05726182460784912
gadgets,How illegal is this tour of NYC in a RC plane?,,170,351,2010-12-02,TECH,0.15415403246879578,0.8233339786529541,0.022512024268507957
technology,Former wikileaks staff creating another whistlerblowing website - free from the autocracy (and egocentrism) of Julian Assange,,109,251,2010-12-02,TECH,0.038287606090307236,0.9066371917724609,0.05507514998316765
technology,"""My girlfriend cheated on me, so I rated her movies..."" story now hits the MSM",,89,203,2010-12-02,TECH,0.06478311866521835,0.5622161030769348,0.3730008006095886
gadgets,This is now on your Christmas list,,26,133,2010-12-02,TECH,0.12274783849716187,0.846984326839447,0.030267877504229546
technology,Cables.wikileaks.org now hosted in France !!!,,32,124,2010-12-02,TECH,0.03120860457420349,0.9247675538063049,0.04402387514710426
technology,"""Broadband providers’ misleading use of ‘up to’ speeds in advertising should be done away with""",,98,90,2010-12-02,TECH,0.03616926074028015,0.9363398551940918,0.027490822598338127
technology,"Sensing Danger, Demonoid BitTorrent Tracker Ditches .COM Domain",,63,86,2010-12-02,TECH,0.060766883194446564,0.9148771166801453,0.024355992674827576
technology,Fuck the RIAA: Google is bending into pressure from the music industry,,25,77,2010-12-02,TECH,0.15834221243858337,0.7923274040222168,0.04933031648397446
technology,"God bless the Swedes. Despite political attacks from Joe Lieberman and other free speech haters, WikiLeaks' Swedish host won't budge.",,222,1330,2010-12-03,TECH,0.07558391988277435,0.845416247844696,0.0789998397231102
technology,FCC Abandoning Net Neutrality,,347,979,2010-12-03,TECH,0.11595609784126282,0.8603335022926331,0.02371041104197502
technology,WIKILEAKS is down again because of DNS issues. #Cablegate material can still be found at http://46.59.1.2 :) Enjoy CatchUspifUcaN haha,,176,704,2010-12-03,TECH,0.031239045783877373,0.9206173419952393,0.048143599182367325
technology,"Did the FCC just bless a capped, two-tier Internet?",,55,205,2010-12-03,TECH,0.023504776880145073,0.9006036520004272,0.07589160650968552
technology,"China's unmodified, conventional passenger train hits 300 mph. The country plans to cover 8125 miles of track by 2012 and 10,000 by 2020.",,94,134,2010-12-03,TECH,0.016260938718914986,0.8183621168136597,0.1653769612312317
technology,Lieberman Introduces New Censorship Bill In Kneejerk Response To Wikileaks,,32,105,2010-12-03,TECH,0.0345170795917511,0.9085942506790161,0.05688871815800667
gadgets,NYU proffesor installs camera in the back of his head....wait what?,[deleted],88,94,2010-12-03,TECH,0.06524939835071564,0.9034428596496582,0.03130769357085228
technology,"It's the Russians Wikileaks should really be worried about. After threatening to reveal what is assumed to be massive corruption among its leaders, the FSB are already closely monitoring Wikileaks and will be ruthless in stopping the outfit, an NSA source said.",,47,90,2010-12-03,TECH,0.4071606695652008,0.5570980906486511,0.03574126586318016
technology,The future officially scares the shit out of me.,,49,88,2010-12-03,TECH,0.5399932861328125,0.40497687458992004,0.05502990260720253
technology,Is it time for DNS to go out of the control of a single Government?,,46,71,2010-12-03,TECH,0.02706778421998024,0.9217824935913086,0.051149651408195496
technology,"First the Pirate Bay, now Wikileaks. It's Time For A Decentralized DNS System.",,439,1417,2010-12-04,TECH,0.024595098569989204,0.930575430393219,0.04482944309711456
technology,Grooveshark new Javascript/HTML interface,[deleted],233,517,2010-12-04,TECH,0.03387773036956787,0.9273844957351685,0.03873779997229576
technology,Why the fuck do websites hijack the back button? Its fucking annoying,"Not being a web developer I will appreciate it if some one can explain. 

Many big sites do it. They obviously cannot think they are making the users happy. Also they cannot obviously keep the user forever on that page. So why do they do it? Is it a technical limitation on their part? Do they get to count the ads multiple times if the page is refreshed there by doubling or tripling their revenue from my single visit?",166,391,2010-12-04,TECH,0.2527996897697449,0.728329062461853,0.018871262669563293
technology,China spending $511 billion to build up to 245 nuclear reactors,,429,318,2010-12-04,TECH,0.013183212839066982,0.7047448754310608,0.28207188844680786
technology,Can we all just donate at least $10 to wikileaks and not spam the front page with useless rage posts anymore?,,103,227,2010-12-04,TECH,0.03443853184580803,0.9346979260444641,0.030863577499985695
gadgets,Christmas tree powered by electric eel,,34,165,2010-12-04,TECH,0.019275229424238205,0.9235993027687073,0.05712546408176422
technology,Sens. Olympia Snowe (R-Maine) and Mark Warner (D-Va.) introduced legislation on Friday that would require all public federal buildings to install WiFi base stations in order to free up cell phone networks.,,53,159,2010-12-04,TECH,0.02083885483443737,0.887798011302948,0.09136317670345306
technology,Home-made backscatter,,31,135,2010-12-04,TECH,0.040683697909116745,0.9069085717201233,0.05240768566727638
gadgets,Leaked footage of Sony's upcoming 'PlayStation Phone',,49,120,2010-12-04,TECH,0.0634847953915596,0.9100769758224487,0.02643827721476555
technology,Groupon Declines Google's $6 Billion Offer,,62,73,2010-12-04,TECH,0.022272584959864616,0.870217502117157,0.10750991851091385
technology,Mass-mirroring Wikileaks,,596,2291,2010-12-05,TECH,0.03773096576333046,0.9093267321586609,0.05294228717684746
technology,"DAE think that it should be illegal for companies to advertise ""Unlimited Internet"" for wireless devices when it is truly limited to 5GB/month?","I was using t-mobile's 'unlimited' 4G internet this month on my new phone and got a horrific text - something like ""You have exceeded your bandwidth limits for the month and will be downgraded to 3G speed for the remainder of the billing period per Terms of Service."" I've been pretty upset about this ever since and wonder why they haven't gotten slammed for a truth-in-advertising violation. I feel that it is blatantly deceptive. Am I alone here?

edit: A few things

1. sorry I'm such a whiner

2. I would actually pay more if I had the option for a truly unlimited plan

3. I'm okay with the way T-mobile does things with regard to high consumers of bandwidth, its a tough solution to a sticky problem. I just wish they did a better job of disclosing the limits throughout their marketing materials. AKA I have no beef with the policy (mostly) but I definitely have one with the contradictory messaging. 


exhibit a: http://imgur.com/PAL5c.png


ps. thanks reddit, I'm glad to see I'm not the only one",258,882,2010-12-05,TECH,0.06430599838495255,0.888257622718811,0.047436416149139404
technology,[Paypal] 17 Paypal alternatives for easier e-commerce. Including some *very* good ones that deserve to be mentioned more.,,38,229,2010-12-05,TECH,0.02129388228058815,0.8466947674751282,0.13201135396957397
gadgets,Why didn't I think of this?,,78,226,2010-12-05,TECH,0.06427270919084549,0.8624379634857178,0.07328939437866211
technology,Microsoft develops Photoshop for video... two years ago,,30,110,2010-12-05,TECH,0.01769927144050598,0.9358903765678406,0.046410396695137024
technology,"Hey Reddit, let's buy a satellite. Seriously.",,38,80,2010-12-05,TECH,0.017557045444846153,0.9141548871994019,0.06828803569078445
technology,Dear Reddit: Captain Crunch needs your help,,11,54,2010-12-05,TECH,0.11837831884622574,0.8432279825210571,0.038393717259168625
gadgets,Wired completely botches the boxee review. Written by someone who has no idea what local media is.,,29,43,2010-12-05,TECH,0.038332100957632065,0.9261669516563416,0.035500988364219666
technology,Once the distribution is underway the only way to shut it down will be to shut down the Internet itself,,6,34,2010-12-05,TECH,0.7522880434989929,0.22628776729106903,0.021424222737550735
technology,No More Helmets! Watch the video.,,33,30,2010-12-05,TECH,0.029783613979816437,0.93842613697052,0.03179027885198593
technology,"""The U.S. government is grabbing domain names to prevent users from reaching content it views as illegal. Not content that has been adjudicated illegal... content that is alleged to be illegal...We should give up pretensions of American exceptionalism for information controls.""",,123,1361,2010-12-06,TECH,0.31772103905677795,0.6658074259757996,0.016471482813358307
technology,THIS is our call to arms for Net Neutrality.  Free Press is calling on the members of Reddit to make their voice heard.  Are we up to the task?,,99,1211,2010-12-06,TECH,0.04729747399687767,0.9243281483650208,0.028374331071972847
technology,Consumer reports ranks AT&amp;T as the WORST U.S. Wireless Carrier,,361,1082,2010-12-06,TECH,0.9464653730392456,0.028908682987093925,0.024625977501273155
technology,"Pirate Bay founder proposes the creation of a ""shadow internet"" to host WikiLeaks.",,167,781,2010-12-06,TECH,0.018824588507413864,0.9280412197113037,0.0531342551112175
gadgets,"Google Nexus S plug for reddit! Plus, this phone looks pretty great.",,83,208,2010-12-06,TECH,0.009351415559649467,0.14875347912311554,0.8418951630592346
technology,Google announces the Nexus S,,136,192,2010-12-06,TECH,0.03493186831474304,0.9332904815673828,0.03177763149142265
gadgets,"Kinect becomes history’s fastest selling gadget, leaves iPad eating the dust...",,289,161,2010-12-06,TECH,0.13010644912719727,0.730831503868103,0.13906212151050568
technology,Google announces Google eBooks - More than 3 million titles from your choice of booksellers &amp; devices,,93,154,2010-12-06,TECH,0.01747095212340355,0.8960621953010559,0.08646689355373383
technology,There seems to be some misunderstanding of how DNS works. Here's a diagram I made showing a reddit.com DNS lookup,,46,91,2010-12-06,TECH,0.038015738129615784,0.8990875482559204,0.06289669126272202
technology,"EFF: ""Amazon had an opportunity to stand up for its customer's right to free expression. Instead, Amazon ran away with its tail between its legs. It's readers lose out on their First Amendment right to read the information WikiLeaks publishes""",,24,81,2010-12-06,TECH,0.0512026883661747,0.9110490679740906,0.037748269736766815
technology,"Facebook issues statement saying that it will NOT ban content from WikiLeaks: ""[It] does not violate our content standards nor have we encountered any material posted on the page that violates our policies.""",,255,1737,2010-12-07,TECH,0.7409694790840149,0.24253104627132416,0.0164994727820158
technology,"Google Chrome notebooks won't have a caps lock key ""this will improve the quality of comments across the web.""",,537,1210,2010-12-07,TECH,0.013063285499811172,0.7253977060317993,0.26153895258903503
technology,"Why do Wikileaks supporters propose designing distributed DNS, instead of just using Freenet?  (an anonymous, decentralized, encrypted Internet within the Internet)  Special bonus: it exists already!",,319,505,2010-12-07,TECH,0.017241686582565308,0.9409956932067871,0.04176262021064758
gadgets,People always give me grief about my trackball. This is why I think trackballs are awesome.,[deleted],561,381,2010-12-07,TECH,0.03961104154586792,0.9126684069633484,0.04772056266665459
technology,Online Seller Who Scared Customers Is Arrested - NYTimes.com,,102,331,2010-12-07,TECH,0.3117717504501343,0.662999153137207,0.02522910386323929
technology,How is this not a thing?,,123,178,2010-12-07,TECH,0.03601944446563721,0.8793349266052246,0.08464561402797699
technology,How the first transistor worked,,17,142,2010-12-07,TECH,0.01919294148683548,0.940330445766449,0.04047657921910286
technology,"Android to get Virtualization • Allowing a single phone to run two operating systems, one for business use and one for personal use • The phone will have two numbers",,25,111,2010-12-07,TECH,0.020515764132142067,0.9470457434654236,0.0324384942650795
technology,Chrome OS Laptop announced - The CR-48 Chrome Notebook,,43,106,2010-12-07,TECH,0.018835900351405144,0.9126530885696411,0.06851102411746979
gadgets,First Chrome OS laptop unveiled by Google,,37,50,2010-12-07,TECH,0.018961599096655846,0.8238888382911682,0.15714959800243378
technology,Mastercard DDOS'd.,,1393,2094,2010-12-08,TECH,0.04324241355061531,0.9292698502540588,0.027487730607390404
technology,Visa DDOS'd.,[deleted],946,1166,2010-12-08,TECH,0.036701738834381104,0.9313982725143433,0.03189999982714653
technology,Truly decentralized BitTorrent has arrived.,,74,236,2010-12-08,TECH,0.03635984659194946,0.9185550212860107,0.04508513957262039
technology,"Oh cool, I've always wanted to know how CDs are 
made.... wait....WTF?",[deleted],42,183,2010-12-08,TECH,0.04069403558969498,0.9153892397880554,0.04391665384173393
technology,The Wikileaks scandal is more than just a diplomatic scuffle; it’s a war for the future of the Internet,,11,148,2010-12-08,TECH,0.043393589556217194,0.9202958345413208,0.036310531198978424
technology,PayPal admits US pressure over WikiLeaks account freeze,,25,136,2010-12-08,TECH,0.03818335384130478,0.9162484407424927,0.04556819051504135
gadgets,Google makes available 3 million e-books - Video,,41,119,2010-12-08,TECH,0.011445083655416965,0.9250488877296448,0.06350600719451904
technology,Wikileaks Irony: US State Department to Host World Press Freedom Day.,,17,117,2010-12-08,TECH,0.027517635375261307,0.9285839200019836,0.04389839246869087
gadgets,The USB Typewriter,,43,108,2010-12-08,TECH,0.023940065875649452,0.9320220947265625,0.04403788596391678
gadgets,"Make your iPhone look like a tasty snack, in Japan",[deleted],15,88,2010-12-08,TECH,0.0174484234303236,0.9299824237823486,0.052569177001714706
technology,What happens if you stop assuming prosthetic arms have to look like human arms?,,491,1027,2010-12-09,TECH,0.036014534533023834,0.936644434928894,0.02734108828008175
technology,Paypal DDOS'D,,366,591,2010-12-09,TECH,0.05263037234544754,0.9153981804847717,0.03197144344449043
gadgets,hey reddit! look what i found while clearing out my gadget cabinet!,,391,547,2010-12-09,TECH,0.03520646691322327,0.8909189701080322,0.07387453317642212
technology,Anti-piracy lawfirm tries to get court to issue default judgments against individuals who offered no defense; gets bitch-slapped by judge.,,20,382,2010-12-09,TECH,0.10786844044923782,0.8588614463806152,0.03327010199427605
technology,"""Declaring Wikileaks and the Operation Payback guys as terrorist organization...could radicalize the IT community.""",,155,357,2010-12-09,TECH,0.0590781606733799,0.9056206345558167,0.035301242023706436
gadgets,Got My Chrome OS Laptop In The Mail!,,268,313,2010-12-09,TECH,0.02100275084376335,0.883767306804657,0.09522990137338638
technology,"Classic Scott Adams (Dilbert creator) on Wikileaks, Sweeden and hot chicks!",,122,308,2010-12-09,TECH,0.02227538824081421,0.9151601791381836,0.0625644326210022
technology,Anonymous have successfully taken down Paypal.com,[deleted],105,208,2010-12-09,TECH,0.027006445452570915,0.8976627588272095,0.07533082365989685
technology,"Student protesters in London use Google Maps to outwit police ""kettling""",,43,180,2010-12-09,TECH,0.06582426279783249,0.9100155234336853,0.024160215631127357
technology,A virus could increase lithium battery capacity by 10x,,41,117,2010-12-09,TECH,0.008853567764163017,0.0793185904622078,0.911827802658081
technology,Facebook deletes pro-WikiLeaks hackers' account,[deleted],289,797,2010-12-10,TECH,0.03135579824447632,0.9364961385726929,0.032148029655218124
technology,FCC report finds 68 percent of US broadband connections aren't really broadband -- Engadget,,104,527,2010-12-10,TECH,0.07793334871530533,0.8963382244110107,0.025728467851877213
technology,Blockbuster laughed at Netflix partnership offer in 2000,,73,303,2010-12-10,TECH,0.008288438431918621,0.6800597310066223,0.3116518557071686
technology,Just as a reminder that the future is upon us even in smaller things.  The safe circular saw.,,126,292,2010-12-10,TECH,0.019065843895077705,0.5605115294456482,0.42042261362075806
technology,"We could LOSE Net Neutrality at the FCC meeting on Dec. 21st.  But Reddit, we can do something!",,15,271,2010-12-10,TECH,0.7974634170532227,0.18629927933216095,0.016237344592809677
gadgets,"Gorilla Glass, the Smartphone Unsung Hero",,108,230,2010-12-10,TECH,0.024540113285183907,0.9103975892066956,0.06506232172250748
technology,Is steel from scuttled German warships valuable because it isn’t contaminated with radioactivity?,,43,159,2010-12-10,TECH,0.027685312554240227,0.9206448197364807,0.0516698993742466
technology,"Google hid MENSA puzzle in Chrome OS video, geek wins Cr-48 figuring it out",,35,145,2010-12-10,TECH,0.023019924759864807,0.5474653840065002,0.42951467633247375
technology,Poor Google Chrome notebooks....,,119,112,2010-12-10,TECH,0.17479906976222992,0.7383772730827332,0.08682364225387573
technology,"Ex-WikiLeaker Daniel Domscheit-Berg explains his spinoff group, OpenLeaks",,57,96,2010-12-10,TECH,0.030388809740543365,0.928651750087738,0.040959469974040985
technology,"Reddit now creates the news -- the CIA-psytek.net rumor started by a reddit comment, promulgated by a reddit submission, poisons Google's algorithm, so that searches seem to confirm initial (false) rumor",,213,730,2010-12-11,TECH,0.12327784299850464,0.8553345203399658,0.021387655287981033
technology,"Today I learned Chrome 8 can use GPU accelerated compositing by enabling it in about:flags.  Thanks, Microsoft!",,154,298,2010-12-11,TECH,0.01923392154276371,0.9159035086631775,0.06486257910728455
gadgets,"If anything could persuade me to buy a GPS, it would be this",,99,241,2010-12-11,TECH,0.01553276926279068,0.7914459109306335,0.1930212825536728
gadgets,"I'd show this off to my friends and say ""Like a boss""",,56,169,2010-12-11,TECH,0.03949052467942238,0.905659556388855,0.05484996736049652
technology,"Patent trolling begins:  Intellectual Ventures drops facade, begins litigation.",,44,134,2010-12-11,TECH,0.03880617395043373,0.9183773994445801,0.04281637817621231
technology,Canon camera encryption cracked,,21,117,2010-12-11,TECH,0.05495169386267662,0.9239770174026489,0.021071264520287514
technology,No Caps Lock on Google Chrome OS Computer: It&amp;'s More Significant Than You Think,,125,114,2010-12-11,TECH,0.08900392800569534,0.8464927673339844,0.0645032450556755
technology,"""Oops"" tweets the guy who posted reddit's CIA-psytek.net rumor to boingboing",,21,86,2010-12-11,TECH,0.037898484617471695,0.9054799675941467,0.05662155523896217
technology,CIA's honeypot Wikileaks mirror readily reveals it was set up by CIA - Boing Boing,,132,78,2010-12-11,TECH,0.023641565814614296,0.9051056504249573,0.07125282287597656
technology,"Gee, what a surprise: Reports on Wi-Fi and sick trees were off the mark",,8,62,2010-12-11,TECH,0.3855701684951782,0.5719775557518005,0.04245225712656975
technology,"Anonymous hacks Gawker, Gizmodo, &amp; Lifehacker in response to Gawker posting a one-line link to President Obama calling WikiLeaks ""deplorable.""  1.5 million usernames, passwords, &amp; emails stolen.",,526,1053,2010-12-12,TECH,0.022639337927103043,0.9284124970436096,0.04894818738102913
technology,I invented chicken steadicam technology and posted it to reddit.  It was on engadget 2 days later.  Cool huh?,,201,825,2010-12-12,TECH,0.021769000217318535,0.9028505086898804,0.07538053393363953
gadgets,Kinect Hacked to Act Like Minority Report UI | Gadget Tech,,55,265,2010-12-12,TECH,0.057394761592149734,0.9114213585853577,0.031183898448944092
technology,"Ridiculous ALERT: Euro Telecoms want to charge use-fees to popular sites/companies like Facebook, Apple, Google despite them being the original cause for higher profits (per MB) for said Telecoms.",,106,146,2010-12-12,TECH,0.047094281762838364,0.7494665384292603,0.20343917608261108
gadgets,Chinese bullet train sets 300-mph speed record: Why Doesn't America want to compete?,,178,141,2010-12-12,TECH,0.03493307903409004,0.9121326804161072,0.0529341958463192
technology,"EFF: Information is the Antidote to Fear: Wikileaks, the Law, and You",,7,130,2010-12-12,TECH,0.04210915043950081,0.9201304912567139,0.03776036947965622
technology,"Gawker media hacked - database, online accounts, and source code",,60,117,2010-12-12,TECH,0.07622600346803665,0.9051545858383179,0.018619384616613388
gadgets,HighTechDad Flies the Parrot AR.Drone,,32,56,2010-12-12,TECH,0.04448307678103447,0.9134858250617981,0.04203106462955475
technology,Bullet physics demonstrated against a model high rise.,,27,47,2010-12-12,TECH,0.01628223806619644,0.1379624456167221,0.8457553386688232
technology,"So like, the Navy wants to show us their new Rail Gun",,151,46,2010-12-12,TECH,0.010944945737719536,0.8689619898796082,0.12009301781654358
technology,"Author slams eBook piracy, but her son outs her as a music pirate",,773,1747,2010-12-13,TECH,0.22771669924259186,0.7522661685943604,0.020017126575112343
gadgets,"BendDesk, A Desk For The Future",,67,241,2010-12-13,TECH,0.03482222929596901,0.9225128889083862,0.04266485944390297
technology,"""Under the ruling, if hardware manufacturers adopt Omega’s legal tactics, it might be copyright infringement to re-sell your used computers, mobile phones and tablet computers produced in China."" and Obama took Omega's side.",,33,85,2010-12-13,TECH,0.3762947916984558,0.5966368317604065,0.027068382129073143
technology,Industry Expert believes Amazon's choice of cutting off WikiLeaks could threaten Cloud computing,[deleted],40,81,2010-12-13,TECH,0.90860515832901,0.07768704742193222,0.013707855716347694
technology,"Former Googler Launches Disconnect, Browser Extension That Disables Third Party Data Tracking",,12,74,2010-12-13,TECH,0.03726615384221077,0.9385178089141846,0.024216050282120705
technology,Is asphalt outdated? What about a solar panel roadway?,,99,69,2010-12-13,TECH,0.14350467920303345,0.8240033388137817,0.03249198943376541
technology,Rogers’ BitTorrent Throttling Experiment Goes Horribly Wrong,,14,63,2010-12-13,TECH,0.4912053644657135,0.4599602520465851,0.04883434996008873
technology,Two Major Ad Networks Found Serving Malicious Ads,,13,55,2010-12-13,TECH,0.9312023520469666,0.05441061034798622,0.014387073926627636
technology,Cars That Drive Themselves Get Tested In Europe,,13,40,2010-12-13,TECH,0.01635386236011982,0.8510144948959351,0.13263162970542908
technology,FCC: 68% of US broadband connections aren't broadband.,,2,37,2010-12-13,TECH,0.13795626163482666,0.835611879825592,0.026431908831000328
technology,Breaking News on EFF Victory: Appeals Court Holds that Email Privacy Protected by Fourth Amendment,,158,1424,2010-12-14,TECH,0.043394241482019424,0.9143686294555664,0.042237114161252975
technology,Google's ChromeOS means losing control of data - Richard Stallman,,540,1022,2010-12-14,TECH,0.7422022819519043,0.23922626674175262,0.018571414053440094
gadgets,Uh... No. Aren't ebooks supposed to be the cheaper alternative?,,358,562,2010-12-14,TECH,0.02559325098991394,0.7617382407188416,0.2126685380935669
technology,Waterless washing machine on the way - existing manufacturer offered the company big bucks to go away!,,222,427,2010-12-14,TECH,0.024797260761260986,0.8603314757347107,0.11487121134996414
