subreddit,title,selftext,num_comments,score,created_utc,stock/sector,neg,neu,pos
technology,The World's First Aircraft Carrier [Pics],,46,232,2010-12-27,TECH,0.01717972569167614,0.7608713507652283,0.22194896638393402
technology,NASA must spend $500 million on canceled rocket program due to Congressional inaction,,39,107,2010-12-27,TECH,0.21943610906600952,0.7536839842796326,0.026879888027906418
technology,Expedia Buries American Airlines Listings,,43,98,2010-12-27,TECH,0.028109515085816383,0.934206485748291,0.03768395632505417
technology,"FCC breaks Obama's promise, allows corporate censorship online with fake Net Neutrality [HuffPo]",,37,93,2010-12-27,TECH,0.1481890082359314,0.798355221748352,0.05345579609274864
technology,Man charged with hacking after snooping on wife's emails,,87,88,2010-12-27,TECH,0.1887325942516327,0.78212970495224,0.02913770265877247
technology,Fuck you Facebook. 3 weeks of trying to remove my cell phone number and it's still not working.,,77,82,2010-12-27,TECH,0.346271276473999,0.6325766444206238,0.021152129396796227
technology,4chan Has Been DDOSed - all the boards are down,,777,940,2010-12-28,TECH,0.059086646884679794,0.9078691005706787,0.03304427117109299
technology,"Digg makes CNN's top 10 biggest tech 'fails' for 2010 (along with iPhone 4, iTunes ""Ping"", and Google ""Buzz"")",,423,746,2010-12-28,TECH,0.015152103267610073,0.807934582233429,0.176913321018219
technology,"ISP won't reveal names of alleged porn pirates: Time Warner Cable, one of the nation's largest Internet service providers, has refused to turn over customers accused in a lawsuit by Larry Flynt Publishing",,59,314,2010-12-28,TECH,0.5429721474647522,0.43159857392311096,0.025429286062717438
technology,US Navy achieves '100 mile' hypersonic railgun test shot - Electro-hypercannon could bring back the dreadnought era,,232,149,2010-12-28,TECH,0.035007577389478683,0.8937478065490723,0.07124464213848114
technology,Ford to add automatic engine shut-off to all vehicles,,292,120,2010-12-28,TECH,0.18274740874767303,0.7349252104759216,0.08232742547988892
gadgets,"A horizontal clinostat, used to cancel out the effects of gravity on plant growth",,40,96,2010-12-28,TECH,0.03902294114232063,0.9344620704650879,0.026515020057559013
technology,"Hey r/technology, I found this beast at a local flea market and thought I would share.",,40,61,2010-12-28,TECH,0.01794751174747944,0.8183145523071289,0.16373787820339203
technology,Flaws in Tor anonymity network spotlighted,,16,51,2010-12-28,TECH,0.028551151975989342,0.9138050675392151,0.057643815875053406
technology,Biometric security coming to Android .. The app uses Army-grade algorithms for face modeling when doing facial recognition and even has blink detection and pupil dilation to prevent someone from merely using a photo of you,,16,36,2010-12-28,TECH,0.056023117154836655,0.9198659658432007,0.02411089465022087
technology,Apple Pounded With Lawsuit Over Apps Handing Over Personal Information to Advertisement Entities,,12,35,2010-12-28,TECH,0.2779219150543213,0.693573534488678,0.02850455977022648
technology,Today's $60 1TB drive would have cost $1 trillion in the '50s,,465,805,2010-12-29,TECH,0.02329496294260025,0.911491870880127,0.06521320343017578
technology,"WikiLeaks clones popping up in Europe and beyond - The perceived successes of WikiLeaks have catalyzed would-be whistle-blowers to launch their own crusades for transparency. The most recent is PirateLeaks.cz, launched by the Czech Pirate Party.",,83,639,2010-12-29,TECH,0.0185545701533556,0.8886995911598206,0.0927458256483078
gadgets,Mini Fridge Beer Cannon. WANT.,,121,416,2010-12-29,TECH,0.028756482526659966,0.9345555305480957,0.03668801859021187
gadgets,Just the fact that they're conceptualizing tech like this blows my mind away. Meet the Nokia Morph,,181,283,2010-12-29,TECH,0.04713016375899315,0.908953845500946,0.0439159981906414
technology,Cambridge Refuses To Cave To Banker Demands To Censor Paper Which Exposes Card PIN Hack,,5,130,2010-12-29,TECH,0.11685575544834137,0.8489605188369751,0.03418373689055443
technology,Everything I learned about Photoshop I Learned Here,,17,117,2010-12-29,TECH,0.0246573518961668,0.9163856506347656,0.058957040309906006
technology,One day in the 60′s a Bell Labs employee Lawrence Luckham brought a camera to work.,,71,114,2010-12-29,TECH,0.03984513133764267,0.8911839127540588,0.0689709261059761
technology,"I tried out my own version of a chicken powered steadicam, with comparisons to other forms of stabilizing",,22,76,2010-12-29,TECH,0.024808991700410843,0.9035316109657288,0.07165934145450592
technology,"Seriously, the Nintendo 3DS Will Destroy Children's Eyeballs",,70,56,2010-12-29,TECH,0.04133717343211174,0.9165931344032288,0.0420696958899498
technology,The Next Big DDOS Attack May Come via BitTorrent,,17,35,2010-12-29,TECH,0.0645221397280693,0.9066189527511597,0.028858914971351624
technology,Finally! Keeping a smartphone fully powered could soon be easier as manufacturers back the micro-USB standard for chargers,,740,974,2010-12-30,TECH,0.011096182279288769,0.29666009545326233,0.6922436952590942
technology,"Hacker makes the 1st DSLR photographic camera to record video in massive 4k resolution (4096x2304). He will release the hacked firmware on the web on January 1st 2011, 11:11pm EST",[deleted],162,205,2010-12-30,TECH,0.024903250858187675,0.9155787229537964,0.05951801687479019
technology,WTF? China declares Skype as illegal,,77,161,2010-12-30,TECH,0.02633589133620262,0.9082280993461609,0.06543604284524918
gadgets,Phone manufacturers move closer to a single phone charger for all phones.,,36,118,2010-12-30,TECH,0.03411209583282471,0.8047376871109009,0.16115020215511322
technology,Russia to adopt Linux as national operating system,,25,98,2010-12-30,TECH,0.011341415345668793,0.8831684589385986,0.10549009591341019
technology,"Someday, each song in your digital music collection will be hundreds of megabytes in size.",,178,84,2010-12-30,TECH,0.042288243770599365,0.9080125093460083,0.04969928041100502
gadgets,STOP! 8 sweet stoplight redesigns,,39,78,2010-12-30,TECH,0.05102041736245155,0.8678998351097107,0.08107970654964447
technology,Banks 'trying to hide chip and pin flaw' - Yahoo! UK &amp; Ireland Finance,,3,66,2010-12-30,TECH,0.35609471797943115,0.6168650388717651,0.027040306478738785
technology,"Intel unveils itsy-bitsy, teeny-weeny SSD's.",,35,56,2010-12-30,TECH,0.04273291677236557,0.9002122282981873,0.05705483630299568
technology,New poll: 1 in 5 of Americans want 'Net regulated like TV,,80,50,2010-12-30,TECH,0.014531116001307964,0.8930540680885315,0.09241478890180588
technology,"The odds of being killed from a terrorist attack = 1:30 million... which are the same odds of getting cancer from the new, TSA body scanners.  BOTTOM LINE:  By passing through the scanners, you are doubling your chance of dying from ""terrorism"".",,577,2097,2010-12-31,TECH,0.04322313144803047,0.9165403246879578,0.04023653641343117
gadgets,A true work of art,,99,702,2010-12-31,TECH,0.026569128036499023,0.8736695647239685,0.09976137429475784
technology,REVEALED: This is the guy who runs IMDb. - The world's biggest movie website is run by a 'self-confessed technology geek' from a house in Bristol.,[deleted],163,433,2010-12-31,TECH,0.028634492307901382,0.9144822359085083,0.05688319727778435
technology,/r/technology is being successfully blogspammed by Redditor 'DimitriMar' (also known as Alexandros Maragos).,[deleted],12,77,2010-12-31,TECH,0.04226507991552353,0.9288152456283569,0.028919687494635582
technology,Court Refutes Claim that Photos on Twitter Are Free For the Taking: AFP (and anyone else for that matter) does not have open rights to content you post to Twitter or photos you post to Twitpic,,7,65,2010-12-31,TECH,0.030130155384540558,0.9424945712089539,0.027375251054763794
technology,FBI raids Texas server farm in 4chan DDoS probe of Anonymous actions against PayPal,,27,57,2010-12-31,TECH,0.3438010513782501,0.6351399421691895,0.021058976650238037
gadgets,Convert Text to Braille,,31,56,2010-12-31,TECH,0.04007263481616974,0.9396522045135498,0.020275108516216278
technology,Google Helps Seized BitTorrent Site to Regain Lost Traffic,,7,56,2010-12-31,TECH,0.24748598039150238,0.7293973565101624,0.023116691038012505
technology,Corporate espionage? The very first RED EPIC was stolen last night in Europe. The 5k camera is considered as the most sophisticated and capable camera ever engineered and built.,[deleted],39,49,2010-12-31,TECH,0.012729494832456112,0.623441755771637,0.3638288080692291
technology,"Android still has horrible text messaging bugs that'll get you fired, busted, or otherwise embarrassed -- Engadget",,32,47,2010-12-31,TECH,0.8614563941955566,0.12343459576368332,0.015108990482985973
