subreddit,title,selftext,num_comments,score,created_utc,stock/sector,neg,neu,pos
gadgets,"I want to buy a Nook, but I live overseas.","So my questions are:

Can I charge solely via USB, and never touch a powerpoint? (There's presumably no difference with USB power between nations.)

Can I load up my unprotected ePubs and PDFs and just read them from SD card/built-in memory, and never bother with the store? (Which presumably blocks international folks.)

Do I need a B&amp;N account to do anything?",32,48,2011-06-12,TECH,0.02170318178832531,0.9350453615188599,0.04325150325894356
technology,U.S. Underwrites Internet Detour Around Censors Abroad - NYTimes.com,,15,44,2011-06-12,TECH,0.03639517351984978,0.9222347736358643,0.04137003421783447
technology,"Wisconsin's ""WiscNet"" provides affordable network access to the state's schools and libraries, but it is fighting for its life: Governor Scott Walker and big ISPs want to kill it off",,223,1402,2011-06-13,TECH,0.012542244046926498,0.8838982582092285,0.1035594567656517
gadgets,Why I Love and Hate Having a Smartphone,,110,804,2011-06-13,TECH,0.2960669994354248,0.6697162985801697,0.034216657280921936
technology,"No pulse. No heartbeat. Flat EKG. Yet, still alive. Behold: the turbine artificial heart.",,243,526,2011-06-13,TECH,0.035846978425979614,0.8248258233070374,0.13932719826698303
technology,Bento Laptop... This. Is. Awesome.,,190,323,2011-06-13,TECH,0.027519814670085907,0.9063836932182312,0.06609652936458588
technology,US Congresswoman Mary Bono Mack (R-CA) is proposing legislation to make it mandatory for companies to disclose when they've been hacked within 48 hours of the incident,,42,184,2011-06-13,TECH,0.02939070761203766,0.8744050860404968,0.09620413929224014
technology,LulzSec releases data taken from Senate.gov,,45,145,2011-06-13,TECH,0.042721688747406006,0.9303178191184998,0.02696043625473976
technology,"First challenge filed against US ICE domain seizures; ICE has been seizing domain names over the past year based on bad evidence, even leading to the ""accidental"" seizure of 84,000 sites",,3,116,2011-06-13,TECH,0.6589301228523254,0.30084148049354553,0.04022843763232231
technology,Facebook usage drops in Britain and US,,43,104,2011-06-13,TECH,0.9435242414474487,0.043516792356967926,0.012958903796970844
technology,MIT students develop liquid fuel for electric cars — Autoblog Green,,20,75,2011-06-13,TECH,0.012019489891827106,0.8946526050567627,0.09332792460918427
technology,Facebook Users drops in the US and Canada. Is this the beginning of the end? Another Myspace in the making?,,47,75,2011-06-13,TECH,0.7367235422134399,0.2466062605381012,0.016670212149620056
technology,"AT&amp;T, if you are going to cap my data, at least have the decency to keep track of it for me. People don't exceed their data because they're AFRAID of going over, not because they don't want to use it.",,432,1144,2011-06-14,TECH,0.24982480704784393,0.7277079820632935,0.022467227652668953
technology,Amazon ends its affiliation with websites in Connecticut and Arkansas rather than pay sales tax,,275,452,2011-06-14,TECH,0.142168790102005,0.8359556794166565,0.021875541657209396
technology,AT&amp;T subscribers: call *3282# and get a data usage text. Just FYI,I use it all the time. Never gone over.,137,351,2011-06-14,TECH,0.03881002217531204,0.9325320720672607,0.02865787409245968
technology,comcast already violating conditions of nbc merger. this is jack's lack of surprise.,,58,341,2011-06-14,TECH,0.9143484830856323,0.07329390197992325,0.01235760934650898
technology,Bye bye tineye?,,100,308,2011-06-14,TECH,0.05335668474435806,0.8563546538352966,0.09028862416744232
gadgets,Transparent vintage car up for auction soon [pics],,12,297,2011-06-14,TECH,0.01638704724609852,0.8796683549880981,0.1039445772767067
technology,Airbus unveils its 2050 flying vision - in pictures,,220,225,2011-06-14,TECH,0.020250855013728142,0.9250378608703613,0.05471126735210419
technology,Forging a pattern-welded sword (start to finish),,59,208,2011-06-14,TECH,0.029958808794617653,0.9292142391204834,0.04082692041993141
technology,"US, Canada, New Zealand, Sweden, and others at UN condemn ""three strikes"" Internet laws as violating human rights",,14,149,2011-06-14,TECH,0.6586800813674927,0.3051051199436188,0.03621479496359825
technology,"""CTRL+ALT_BERNANKE""- Anonymous takes swing at Federal Reserve",,71,101,2011-06-14,TECH,0.09026381373405457,0.8765152096748352,0.0332210473716259
technology,"Proposed ""ten strikes"" law would make streaming copyrighted material a felony punishable by jail time - EVEN IF YOU'RE JUST SHARING A VIDEO FROM KARAOKE NIGHT AT YOUR FAVORITE BAR.",,415,2085,2011-06-15,TECH,0.14008291065692902,0.8337147831916809,0.02620234340429306
technology,"China's Cyberassault on America: If the US discovered Chinese explosives laid throughout our national electrical system, we'd consider it an act of war. The threat posed by China's digital bombs is just as grave.",,273,347,2011-06-15,TECH,0.02596271224319935,0.8960637450218201,0.07797359675168991
gadgets,"DIY Warfare: Libyan Rebels create anti-aircraft battery from fallen jet machine gun, RPG from a damaged missile tube, unmanned machine gun turret, and a R/C machine gun. Holy shit",,20,162,2011-06-15,TECH,0.20253825187683105,0.7613174319267273,0.036144379526376724
technology,"""If you embed a YouTube video that turns out to be infringing, and more than 10 people view it because of your link... you could be facing five years in jail.""",,16,140,2011-06-15,TECH,0.1339169442653656,0.8078659176826477,0.058217164129018784
technology,"Person leaves $500,000 on their front porch, and is devastated upon finding it missing.  Oh wait, I meant to type ""left a gigantic bitcoin wallet on a daily-use workstation connected to the Internet"".",,61,129,2011-06-15,TECH,0.16632458567619324,0.8148789405822754,0.018796512857079506
technology,"Reddit Hits 1.2B Monthly Pageviews, More Than Doubles Its Engineering Staff",,27,117,2011-06-15,TECH,0.03781859576702118,0.9359949827194214,0.026186352595686913
gadgets,Samsung Phones To Come With Flexible AMOLED Displays Starting 2012,,70,103,2011-06-15,TECH,0.014765105210244656,0.916064441204071,0.0691705271601677
technology,"Senator Al Franken (D-MN) unveiled a bill Wednesday that would require firms (Apple, Google) and developers to obtain consent before collecting or sharing consumers' location data on phones",,12,96,2011-06-15,TECH,0.034260764718055725,0.9236311316490173,0.04210817813873291
technology,How Browsers Work,,16,93,2011-06-15,TECH,0.028596432879567146,0.9309878945350647,0.04041566699743271
technology,"Facebook Disconnect blocks all traffic from third-party sites to Facebook servers, but still lets you access Facebook itself.",,16,77,2011-06-15,TECH,0.05601422116160393,0.9218183755874634,0.022167393937706947
technology,"Apple patents mobile camera that other people can shut off: tremendous boon to policemen who shoot unarmed subway riders, despotic armies putting down revolutions as well as anyone else who is breaking the law or exercising coercive power.",,453,1794,2011-06-16,TECH,0.08540327847003937,0.881727397441864,0.03286929428577423
technology,Cable Companies Finally Realizing They Might Have Priced Themselves Out Of Reach Of Many Customers,,536,938,2011-06-16,TECH,0.04584513604640961,0.33117544651031494,0.6229794025421143
gadgets,"Apple patents mobile camera that other people can shut off: tremendous boon to policemen who shoot unarmed subway riders, despotic armies putting down revolutions as well as anyone else who is breaking the law or exercising coercive power.",,108,526,2011-06-16,TECH,0.08540327847003937,0.881727397441864,0.03286929428577423
technology,"Boxee reports every show you watch, when you watch it",,208,434,2011-06-16,TECH,0.037769731134176254,0.9317432045936584,0.030487049371004105
technology,"""The only way to control your content is to be the best provider of it."" If you do it right people will come to your official publish point and you’ll end up with more control. Example: South Park Studios",,42,303,2011-06-16,TECH,0.08490452915430069,0.8872417211532593,0.02785377949476242
technology,"Thanks, Ars...",,55,281,2011-06-16,TECH,0.027186987921595573,0.7290555834770203,0.2437574416399002
gadgets,Coolest ways to recycle Altoids Tins,,44,175,2011-06-16,TECH,0.03728853538632393,0.9097099900245667,0.05300147458910942
technology,USB pot can charge your cell phone over a fire,,13,70,2011-06-16,TECH,0.01717914640903473,0.9347090721130371,0.048111796379089355
technology,Hit the deck: LulzSec and Anonymous start trading blows,,56,57,2011-06-16,TECH,0.021957339718937874,0.919318437576294,0.058724258095026016
technology,"Facebook has silently enabled facial recognition software without your permission under the benign tag ""Suggest photos of me to friends."" Even if you choose to disable the option, Facebook still will have the technical ability to connect your name with your image",,19,53,2011-06-16,TECH,0.027310525998473167,0.9369166493415833,0.03577288240194321
technology,"Sen. Al Franken introduces new bill: ""... to close current loopholes in federal law to ensure that consumers know what location information is being collected about them and allow them to decide if they want to share it.""",,179,2098,2011-06-17,TECH,0.01619953103363514,0.8858657479286194,0.09793470054864883
technology,"ICANN about to approve ""brand name"" top level domains like ""*.coke"" or ""*.apple""",,348,808,2011-06-17,TECH,0.02620348520576954,0.941031813621521,0.03276468440890312
technology,Don't let anyone get the last LuLz. Put this in your wallet and change all of your passwords!,,163,290,2011-06-17,TECH,0.052050791680812836,0.9184020161628723,0.02954716607928276
technology,AOL Hell: An AOL Content Slave Speaks Out,,62,256,2011-06-17,TECH,0.036835554987192154,0.9254582524299622,0.037706244736909866
technology,ISP Wrongfully Sent 300 “First Strike” Letters To Innocents,,21,198,2011-06-17,TECH,0.03033427707850933,0.8986714482307434,0.0709942877292633
technology,TechCrunch's MG Siegler exposes Facebook PR's ominous strategy to alienate him over his article,,18,126,2011-06-17,TECH,0.03738982230424881,0.9239122867584229,0.03869786113500595
gadgets,Why is no one talking about webOS?,"I think this is one of the best smartphone os' that i have used. It is way way ahead of its time for multitasking. Palm ,now HP, pretty much nailed it in terms of os. But that might change since google picked up the old palm gui(?) Guy. I just feel as if no one is giving hp/palm the credit they deserve. I would hate to see such a great os ignored because it is different. Opinions? Thoughts?",195,109,2011-06-17,TECH,0.03690376877784729,0.9234952330589294,0.03960097208619118
technology,"RIM may be in trouble, announces layoff plan",,43,64,2011-06-17,TECH,0.7513774633407593,0.21188011765480042,0.03674248605966568
technology,"We did it! Deluged with calls, Wisconsin state legislators take ""WiscNet"" off death row",,2,52,2011-06-17,TECH,0.2575211524963379,0.7229695320129395,0.019509345293045044
technology,"The United States government is building its own ""scale model"" of the internet to carry out cyber war games.",,24,45,2011-06-17,TECH,0.020537564530968666,0.930070698261261,0.049391791224479675
technology,"I pay for 50megs down and 5 up.  I get, at 4am, 24 down and 3 up at best.  How is this legal.","What the shit is with this Comcast?

I connect through a router with cat5.  Modem is Arris TM722

Also, thanks for the vast amount of learning in this thread.",779,1361,2011-06-18,TECH,0.012101544998586178,0.8814017176628113,0.10649672150611877
technology,"Lulzsec is ""taking the weekend off.""  Meanwhile, this other guy called th3j35t3r is blowing their cover.",,777,1276,2011-06-18,TECH,0.029674239456653595,0.9155013561248779,0.054824430495500565
gadgets,Why aren't these in every airport?,,131,787,2011-06-18,TECH,0.05721595510840416,0.9069933295249939,0.035790711641311646
technology,"Now with modems, faxes, and car phones... [pic]",,13,115,2011-06-18,TECH,0.019540933892130852,0.9370256662368774,0.04343344271183014
technology,"Weather satellites lose funding due to Federal budget cuts - likely to reduce warnings of tornados, blizzards etc",,25,101,2011-06-18,TECH,0.9404538869857788,0.04970594868063927,0.009840140119194984
technology,Mediacom monitors for 404 errors and then inserts a javascript snippet into TCP stream to redirect browser. NN violation?,,27,49,2011-06-18,TECH,0.06399450451135635,0.9021683931350708,0.03383713215589523
technology,Time Warner Cable Considers Usage-Based Internet Billing: Heavy users of Netflix may find themselves paying more,,33,42,2011-06-18,TECH,0.07921633124351501,0.8751248121261597,0.04565884917974472
technology,"Firefox 5 slips out ahead of schedule, gets official June 21st",,25,36,2011-06-18,TECH,0.6467734575271606,0.32921546697616577,0.024011097848415375
technology,Senators Unconcerned About Massive Unintended Consequences Of Criminalizing People: For Embedding YouTube Videos or just putting up YouTube lip synching videos,,7,35,2011-06-18,TECH,0.0534396655857563,0.9149119257926941,0.031648412346839905
technology,Kindle Store awash with auto-generated crap 'books' • The Register,,7,31,2011-06-18,TECH,0.07943422347307205,0.897060751914978,0.02350500226020813
technology,"Why does the DOJ pretend US Copyright Laws apply in the UK? The DOJ attempt to extradite Richard O'Dwyer, a UK student who ran TVShack.net and TVShack.cc, both of which were seized by ICE",,438,1371,2011-06-19,TECH,0.026345117017626762,0.9391903877258301,0.03446454554796219
gadgets,The NY Post blocks iPad's access to its website and expects iPad users to buy their app instead.,,156,652,2011-06-19,TECH,0.027748191729187965,0.9410640001296997,0.031187832355499268
technology,"500k Bitcoins traded in 1h, Mt.Gox market hacked + crash",,483,533,2011-06-19,TECH,0.052579302340745926,0.8905690312385559,0.05685169994831085
technology,"Facing Prison, PS3 Hacker Tells Sony: You'll Have to ""Kill Me"" to Silence Me",,88,308,2011-06-19,TECH,0.1956864893436432,0.7656065821647644,0.038706954568624496
technology,uTorrent / BitTorrent Sued For Patent Infringement,,54,237,2011-06-19,TECH,0.14856469631195068,0.8251623511314392,0.026272984221577644
technology,Microsoft to malware: your AutoRunning days on Windows are numbered,,32,156,2011-06-19,TECH,0.04783054068684578,0.9129082560539246,0.03926124796271324
technology,US Congress halts progress on Navy's Railguns and Free Electron Laser programs.,,55,118,2011-06-19,TECH,0.019942522048950195,0.9235241413116455,0.056533362716436386
technology,"Map of Undersea Cables, 1901",,9,94,2011-06-19,TECH,0.02221393957734108,0.9380497932434082,0.03973625972867012
technology,RIM braces for ‘the big reset’,,30,40,2011-06-19,TECH,0.01786196045577526,0.7484237551689148,0.233714297413826
technology,Dammit AT&amp;T!,,71,35,2011-06-19,TECH,0.028462078422307968,0.9102572798728943,0.061280593276023865
technology,It begins: NY Post blocks access to its website on iPads to drive app purchases,,342,1899,2011-06-20,TECH,0.01838589832186699,0.9425420165061951,0.039072029292583466
technology,"The Secret $8 Billion Wireless Scam: Verizon and AT&amp;T have gamed the system, using regulations designed to foster competition to snatch up more of the wireless spectrum",,415,1852,2011-06-20,TECH,0.012602334842085838,0.8920394778251648,0.09535824507474899
technology,"Japan Criminalizes Cybercrime: Make a Virus, Get Three Years in Jail",,68,434,2011-06-20,TECH,0.22527749836444855,0.7462121248245239,0.028510386124253273
technology,New Japanese supercomputer is more powerful than the next five fastest computers combined,,97,383,2011-06-20,TECH,0.014313564635813236,0.823567807674408,0.16211864352226257
technology,Escape your search engine Filter Bubble by DuckDuckGo,,52,193,2011-06-20,TECH,0.06345824897289276,0.8964418768882751,0.04009989649057388
technology,Sad Obsolescence,,31,160,2011-06-20,TECH,0.09683782607316971,0.8466145992279053,0.05654755234718323
technology,Netflix sued by deaf group over lack of subtitles,,152,117,2011-06-20,TECH,0.8342776894569397,0.13230744004249573,0.0334148071706295
gadgets,Awesome clearance deal on the old Nook...,,31,106,2011-06-20,TECH,0.01227533258497715,0.8418035507202148,0.14592106640338898
technology,"FTC approves employee background check company that stores Facebook photos, tweets, blog posts, and other public social data for seven years",,24,82,2011-06-20,TECH,0.05278215929865837,0.9269416928291321,0.02027619257569313
gadgets,"Leaner, less power-hungry PS3 debuts in Japan",,31,60,2011-06-20,TECH,0.02933291345834732,0.8200406432151794,0.15062643587589264
technology,I am about fed up with this situation,,876,1146,2011-06-21,TECH,0.045561473816633224,0.9119967222213745,0.04244176670908928
technology,Fibre optic cables: how they work,,113,1019,2011-06-21,TECH,0.019698331132531166,0.9381794929504395,0.04212213680148125
technology,Dropbox comments on the authentication bug that left all of its 25 million user accounts UNLOCKED for 4 hours. Anyone could access your data using any password.,,147,588,2011-06-21,TECH,0.21603666245937347,0.7638198733329773,0.020143460482358932
technology,"""I figured out that I wouldn't look back as an old man and wish I had spent more time on Facebook""",,84,426,2011-06-21,TECH,0.05598130822181702,0.7867921590805054,0.15722647309303284
technology,"F.B.I. Seizes Web Servers, Knocking Sites Offline - NYTimes.com",,59,326,2011-06-21,TECH,0.6145047545433044,0.36302071809768677,0.022474540397524834
technology,"Here we have bitcoins, purportedly a quasi-anonymous, crypto-currency that is intended to bypass any and all government interference.
Yet suddenly, as soon as an exchange faces trouble, the site administrator thinks he should take the case to the FBI?",,182,318,2011-06-21,TECH,0.4927063286304474,0.45867350697517395,0.048620160669088364
technology,snopes.com says Nope: Sean Connery Letter to Apple,,20,293,2011-06-21,TECH,0.04126051068305969,0.9099236726760864,0.04881585016846657
technology,"Open Wi-Fi Is Not a Crime, BitTorrent Case Judge Hears",,28,194,2011-06-21,TECH,0.10531370341777802,0.8717690110206604,0.022917242720723152
technology,The internet used to be a force for anonymity. Now it will be the force that ends it.,,26,158,2011-06-21,TECH,0.11864086240530014,0.8562058210372925,0.025153331458568573
gadgets,"Nokia N9: Stunning battery life, 1GB RAM, 8mp Carl Zeiss, No Symbian.",,126,151,2011-06-21,TECH,0.023220470175147057,0.9182991981506348,0.058480359613895416
technology,New camera focuses on everything at once,,338,1689,2011-06-22,TECH,0.013087638653814793,0.8651337623596191,0.12177856266498566
technology,Bill Would Make Carriers Publish 4G Data Speeds,,118,1599,2011-06-22,TECH,0.019077910110354424,0.9407552480697632,0.04016687721014023
technology,Lulzsec gets exposed by TeaMp0isoN; Lulzsec member site defaced,,595,1008,2011-06-22,TECH,0.02464759536087513,0.9329882264137268,0.04236423969268799
technology,Internet Backbone Visual,,109,979,2011-06-22,TECH,0.02063998393714428,0.9444677829742432,0.03489217534661293
technology,Fired IT Worker Replaces CEO's Presentation With Porn,,105,709,2011-06-22,TECH,0.9298620223999023,0.05947105213999748,0.010666920803487301
technology,New Japanese Pop Idol Shocks Fans With News–She's Not Real (video),,201,668,2011-06-22,TECH,0.023764345794916153,0.8445420265197754,0.13169358670711517
technology,Apple iPhone Patent a Huge Blow to Rival Smartphone Makers,,83,161,2011-06-22,TECH,0.6183199882507324,0.22476762533187866,0.1569124013185501
technology,FTP Must Die,,194,142,2011-06-22,TECH,0.06854615360498428,0.8896604180335999,0.04179346188902855
technology,"Scientists have developed a way to transform ordinary sand -- a mainstay filter material used to purify drinking water throughout the world -- into a ""super sand"" with five times the filtering capacity of regular sand.",,13,134,2011-06-22,TECH,0.012319076806306839,0.8652374148368835,0.12244349718093872
technology,Verizon's 'DataGate' plans leaked in excruciating detail,,54,84,2011-06-22,TECH,0.037129852920770645,0.9330626130104065,0.029807565733790398
technology,Netherlands makes net neutrality a law,,486,3433,2011-06-23,TECH,0.02205806039273739,0.9402530789375305,0.03768889978528023
technology,FBI finally raids the right websites &amp; servers:  Malware.,,79,544,2011-06-23,TECH,0.318231463432312,0.6300535202026367,0.051715053617954254
gadgets,Amazon Prepares to be the Next iPad Competitor,,63,138,2011-06-23,TECH,0.01311506424099207,0.9175243973731995,0.06936050951480865
technology,Nevada Passes Law Authorizing Driverless Cars,,38,125,2011-06-23,TECH,0.02563691884279251,0.9091257452964783,0.06523735821247101
gadgets,Am I missing something with Car Stereos?,"Is it just me or are car stereos just horrible?  Searching through sites like Best Buy and Walmart (which sadly are the only local stores that would have car stereos in my area), they all remind me of the old feature-phones for cell companies offered to it's users.  Nothing but piece meal proprietary bull-crap.  

So am I missing something?  Are there any good car stereos with good user interfaces?  Are there any good touch screen stereos that I can use with my iPod Classic (it doesn't even need GPS).",193,96,2011-06-23,TECH,0.028804901987314224,0.9095891118049622,0.06160605326294899
technology,Price Gap: Storage vs. Bandwidth,,22,71,2011-06-23,TECH,0.4302227199077606,0.4868937134742737,0.0828835591673851
technology,"For the second time in a week, the Electronic 
Frontier Foundation (EFF) has won the dismissal of 
an infringement case filed by copyright troll 
Righthaven LLC.",,3,53,2011-06-23,TECH,0.43537113070487976,0.5393810272216797,0.02524782530963421
technology,"Pervious concrete, a type of concrete without sand, can drain hundreds of inches of rain per hour, allowing water to filter into groundwater stores below, rather than run off into storm drains.",,20,39,2011-06-23,TECH,0.04854714870452881,0.9187383055686951,0.0327146016061306
technology,"Top ISPs that includes AT&amp;T, Comcast, and Verizon to introduce tougher punishments for customers who refuse to stop using their networks to pirate films, music and other IP",,18,34,2011-06-23,TECH,0.40238916873931885,0.5755934715270996,0.02201732061803341
technology,LulzSec leaks Arizona law enforcement papers,,14,33,2011-06-23,TECH,0.0565592460334301,0.9231958389282227,0.020244847983121872
technology,Verizon memos leaked on tiered data plans. Hey Verizon 'Fuck you! Can you hear me now?',,1033,2780,2011-06-24,TECH,0.0248219296336174,0.9249579906463623,0.050220027565956116
technology,The main reason I'm not a mac person...,,1395,818,2011-06-24,TECH,0.029619205743074417,0.9350427389144897,0.03533799946308136
gadgets,BBC News - The new vehicle set to revolutionise the skies. I am not sure what makes it a hybrid though...,,85,202,2011-06-24,TECH,0.009962276555597782,0.8072677254676819,0.1827699840068817
technology,D-Dalus - an entirely new genre of aircraft arrives,,32,102,2011-06-24,TECH,0.011448358185589314,0.8754824995994568,0.11306915432214737
technology,LulzSec hack reveals cops’ least favorite iPhone apps,,34,93,2011-06-24,TECH,0.022094186395406723,0.9254943132400513,0.05241157487034798
technology,Even Conan's editors don't like Final Cut Pro X.,,52,88,2011-06-24,TECH,0.29773566126823425,0.6778390407562256,0.024425316601991653
technology,LulzSec's first Operation Anti-Security release: Arizona DPS,,27,77,2011-06-24,TECH,0.023571515455842018,0.9253258109092712,0.0511026494204998
technology,"True Crypt User Held in Contempt of Court, sends post mail to sister for blogging",,59,67,2011-06-24,TECH,0.16332824528217316,0.807014524936676,0.029657218605279922
technology,Policing the Police: The Apps That Let You Spy on the Cops,,6,57,2011-06-24,TECH,0.06139866262674332,0.914671003818512,0.023930327966809273
gadgets,Nokia Android Smartphone Pics Leaked On The Web,,22,48,2011-06-24,TECH,0.14039310812950134,0.8281643986701965,0.03144244849681854
technology,Audio Editing Software like NOTHING you've ever seen before.,,259,1465,2011-06-25,TECH,0.0242697112262249,0.9386173486709595,0.03711297735571861
technology,LulzSec stops its activity after 50 days of 'lulzing',,411,1276,2011-06-25,TECH,0.02901449240744114,0.9280627369880676,0.0429227389395237
technology,"Audio Editing Software, I see your bid, and raise you...",,61,270,2011-06-25,TECH,0.022263530641794205,0.9324226975440979,0.0453137643635273
technology,"If you ever wondered why corporations use IE, it's because of things like this",,164,244,2011-06-25,TECH,0.11252660304307938,0.8641066551208496,0.023366756737232208
technology,Solar 3D sintering printer,,22,106,2011-06-25,TECH,0.04257429763674736,0.8908047080039978,0.06662103533744812
technology,TeaM p0isoN releases former UK prime minister Tony Blair’s national insurance number; more personal info,,23,97,2011-06-25,TECH,0.038268785923719406,0.9322535991668701,0.029477562755346298
gadgets,Wireless Earbuds,"Do they exist? I want a pair, just a pair of earbuds that doesn't have that cord thing that I detest.

EDIT: Yes 3.5mm ones.",59,81,2011-06-25,TECH,0.0198975782841444,0.9293237924575806,0.050778601318597794
gadgets,I wonder why Nokia keeps going down,,32,54,2011-06-25,TECH,0.027862336486577988,0.9086050391197205,0.06353257596492767
technology,"New phase-changing alloy turns waste heat into green energy, exhibits spontaneous magnetism",,9,53,2011-06-25,TECH,0.016311777755618095,0.9300298690795898,0.05365832522511482
technology,"Solar-powered 3D sand-printer -- ""Markus Kayser built a 3D printer that works with solar power to heat up sand and form objects like a regular 3D printer, by taking the energy and the raw material directly out of the desert.""",,2,50,2011-06-25,TECH,0.024508804082870483,0.9467929005622864,0.02869824506342411
technology,Cable boxes use more power than the fridge,,385,1164,2011-06-26,TECH,0.023469803854823112,0.9405322670936584,0.0359979122877121
