subreddit,title,selftext,num_comments,score,created_utc,stock/sector,neg,neu,pos
technology,The EFF is asking people to set up TOR relays.,,617,1366,2011-06-01,TECH,0.026186097413301468,0.9314031600952148,0.04241076856851578
technology,Boom. This is Windows 8.,,1185,1022,2011-06-01,TECH,0.01773706078529358,0.9092073440551758,0.07305555045604706
technology,A way to take out spammers? 3 banks process 95% of spam transactions,,138,592,2011-06-01,TECH,0.01704879105091095,0.9288879632949829,0.05406323820352554
technology,Conde Nast Digital purchase 285 domain names related to Reddit,,118,272,2011-06-01,TECH,0.06767591834068298,0.913994312286377,0.018329786136746407
technology,"""I believe that software patents should not exist. They are a tax on innovation"" - A prominent NYC VC",,59,258,2011-06-01,TECH,0.019521739333868027,0.8902587294578552,0.09021954238414764
gadgets,"HD video camera sunglasses' 5MP CMOS lets you take AVIs in 1,280×720 resolution at 30fps – handsfree.",,85,252,2011-06-01,TECH,0.0263553187251091,0.9204737544059753,0.05317093804478645
technology,A first look at the Windows 8 user interface,,172,193,2011-06-01,TECH,0.02557261474430561,0.9424504041671753,0.03197690099477768
technology,"I found this in the attic, my first cordless",,41,161,2011-06-01,TECH,0.02173788659274578,0.8974027037620544,0.08085943758487701
technology,Tennessee has passed a bill that makes it a crime to use a friend/family member's login (even with permission) to listen to music or watch movies from services like Netflix or Rhapsody.,,79,160,2011-06-01,TECH,0.04132454842329025,0.925514817237854,0.033160630613565445
technology,The RIAA is at it again: They want to violate the 4th Amendment and conduct warrantless searches of California CD and DVD manufacturing plants to ensure the discs they are producing carry legally required identification marks,,16,126,2011-06-01,TECH,0.03484754264354706,0.9337910413742065,0.03136144578456879
technology,Why Bitcoin is a scam,,1663,1071,2011-06-02,TECH,0.030042318627238274,0.9223228096961975,0.047634925693273544
technology,"Sony hacked again. Millions of usernames, 
passwords, and personal information stolen, put in 
torrents, distributed.",,192,467,2011-06-02,TECH,0.07999615371227264,0.9038766622543335,0.016127195209264755
technology,The cable industry paid millions of dollars to a Tea Party lobbyist to get him to orchestrate opposition to net neutrality,,34,464,2011-06-02,TECH,0.038451384752988815,0.9300909042358398,0.03145768493413925
technology,"Sony hacked AGAIN. 1m passwords revealed with simple SQL injection, PWs were stored in plain text",,33,121,2011-06-02,TECH,0.04788748919963837,0.9335023760795593,0.018610144034028053
technology,Ars does the funkyjunk/oatmeal shuffle,,60,117,2011-06-02,TECH,0.028833720833063126,0.9019423723220825,0.06922385096549988
technology,"Skype protocol has been reverse engineered, source available for download",,18,112,2011-06-02,TECH,0.02442210353910923,0.9463064074516296,0.029271503910422325
gadgets,"Windows 8 previewed, today.",,76,101,2011-06-02,TECH,0.08384139090776443,0.8631572127342224,0.05300138145685196
gadgets,EDWARD - The Vehicle Of The Future...,,44,93,2011-06-02,TECH,0.021271277219057083,0.9020975828170776,0.07663112133741379
technology,Walt Mossberg Tells Adobe CEO To His Face That Flash Sucks On Android,,122,80,2011-06-02,TECH,0.4873688817024231,0.49187561869621277,0.020755454897880554
technology,Oracle donates Open Office to Apache,,20,68,2011-06-02,TECH,0.011064857244491577,0.8304086327552795,0.15852651000022888
technology,"Google will no longer support IE7, Safari 3 and FF3.5 from August",,433,998,2011-06-03,TECH,0.02160448580980301,0.9429720044136047,0.03542359173297882
technology,It wouldn't be fucking useless if you explained what the problem was and how you fixed it.,,205,843,2011-06-03,TECH,0.2794326841831207,0.6238749623298645,0.09669234603643417
technology,UN: Disconnecting File-Sharers Breaches Human Rights,,75,382,2011-06-03,TECH,0.042329903692007065,0.9251564145088196,0.032513681799173355
technology,"Anonymous steals 10,000 Iranian government emails, plans DDoS attack",,53,303,2011-06-03,TECH,0.06173352897167206,0.9118574261665344,0.026408987119793892
technology,AT&amp;T Admits They're 2-3 Years Behind Verizon.,,49,168,2011-06-03,TECH,0.04838457703590393,0.8480055928230286,0.10360980033874512
technology,Syria is shutting down its Internet access in an attempt to control protests,,19,106,2011-06-03,TECH,0.44746217131614685,0.5286445617675781,0.023893291130661964
technology,"Sharing Netflix accounts is now a crime in Tennessee, punishable by up to 1 year in jail + a $2500 fine.",,38,91,2011-06-03,TECH,0.711593508720398,0.25173714756965637,0.03666936233639717
technology,EFF: The RIAA is backing a bill in the California legislature (SB 550) which permits the police to disregard the Fourth Amendment... and search without a warrant any disc manufacturer to ensure the discs produced carry identification marks,,5,52,2011-06-03,TECH,0.02148413099348545,0.9271630644798279,0.051352739334106445
technology,The overwhelming majority of Internet users can be uniquely fingerprinted using their public browser info,,24,45,2011-06-03,TECH,0.028313761577010155,0.9446070194244385,0.027079230174422264
gadgets,OtterBox Tries To Get Chinese Phone Cases Banned,,14,41,2011-06-03,TECH,0.5161391496658325,0.43572893738746643,0.048131898045539856
technology,"Do yourself, EFF and the world a favor. See how susceptible you are to browser fingerprinting.",,540,803,2011-06-04,TECH,0.0366685651242733,0.9248901009559631,0.038441382348537445
technology,"French court rules that merely having the word ""torrent"" in your domain means you are encouraging infringement",,234,678,2011-06-04,TECH,0.0633477121591568,0.9049981832504272,0.03165413811802864
technology,Dealership informs man he can't have the tax credit for his new Chevy Volt because they already claimed it -- dealerships selling electric cars to each other to claim tax credits,,195,412,2011-06-04,TECH,0.014089602045714855,0.9043160080909729,0.08159438520669937
technology,"LulzSec hacks FBI affiliate InfraGard Atlanta, claims to have exposed use of botnets by said affiliate's members",,61,219,2011-06-04,TECH,0.06910311430692673,0.9120240807533264,0.01887274906039238
technology,Apple patenting technology that will cripple its devices when they are in the proximity of ‘a concert or a classified facility’,,118,196,2011-06-04,TECH,0.03402700647711754,0.9411914944648743,0.02478151209652424
gadgets,First impressions of my new Simple Nook Touch.,"It is noticeably wider than my Kindle, but quite a bit shorter.  The rubberized back and side bezel feels very good in the hand.
The touch screen works very well for everything so far.
There are three ways to turn pages.  Swiping or tapping the screen and yes there are physical button on the left and right bezel.  The buttons are barely raised ridges in the rubber and require a solid push to click.
The screen does not turn black at every page turn, the letters fade away and the new letters fade in.  About every ten pages or so it will do the full black page turn.
I honestly can't tell much difference between the screens.  The sharpness, contrast and level of glare is about the same as my Kindle.
The memory card slot has a dust cover which is flush when closed.  I like that they added this feature, but I'm not sure I will ever need additional storage.
Most importantly I already like it better.  Primarily because of the form factor, rubberized texture and of course the touch screen.  



[Unboxing](http://i.imgur.com/yHy4z.jpg)



[Back](http://i.imgur.com/p4pCG.jpg)



[Screen lock](http://i.imgur.com/dmR2e.jpg)



[Kindle comparison -front](http://i.imgur.com/UjcNG.jpg)



[Kindle comparison -back](http://i.imgur.com/9Fq66.jpg)



[Kindle screen comparison](http://i.imgur.com/1WouM.jpg)



[Search function](http://i.imgur.com/VFcf1.jpg)



edit: added photo links",94,117,2011-06-04,TECH,0.02920965850353241,0.9358317852020264,0.03495858237147331
technology,Apple patents way to prevent concert piracy,,84,92,2011-06-04,TECH,0.038713887333869934,0.9193270206451416,0.04195912182331085
technology,"UN report on human rights and govt attempts to censor the internet, condemns the so-called “three strikes- law” in France and UK's Digital Economy Act 2010. Kicking people off the internet is a violation of existing civil rights",,3,89,2011-06-04,TECH,0.2994801998138428,0.6723138689994812,0.02820596843957901
technology,How the “Thumbs Up/Like” Button is Dumbing Users Down,,85,86,2011-06-04,TECH,0.026320021599531174,0.9215657114982605,0.05211424082517624
gadgets,Alternative to Ipod touch?,"My car was just broken into last night and my ipod got stolen (along with a bunch of other stuff... bastards!)  
So before jumping back in the band wagon and getting a new one, I thought i'd see what other suggestions there might be? 

I'd want one that definitely has same functionality as an ipod touch.  I saw the Creative Zen Touch 2, looked pretty interesting, quite a bit cheaper and has GPS (which would be really cool to have).  But heard some not so great reviews on it. 

Anything i should be looking at? Thanks guys very much!

Edit* Thanks so much guys! Tons of great advice, i'll sift through and find out what works best for me! Mucho appreciated!",166,78,2011-06-04,TECH,0.03789135813713074,0.8226462006568909,0.1394624412059784
technology,Apple Store Hamburg Gets Trolled IRL,,513,1284,2011-06-05,TECH,0.0713394358754158,0.7540143132209778,0.17464624345302582
technology,"The US again placed Canada on its Special 301 Priority Watch List, claiming that Canada's IP laws are seriously deficient! But the Wikileaks cables show that ""the entire process is nothing more than a calculated guess at how much pressure can constructively be brought on foreign govts.""",,44,581,2011-06-05,TECH,0.08961454033851624,0.8576182723045349,0.05276715010404587
gadgets,"Screw smartphones, I wish cell phones went in this direction.",,64,171,2011-06-05,TECH,0.031208278611302376,0.7893402576446533,0.17945140600204468
gadgets,PrintBrush™ 4X6 -First pocket size ink jet printer/digital camera in the world!,,40,127,2011-06-05,TECH,0.020204761996865273,0.9387640953063965,0.0410311184823513
technology,U.N. Report declares Internet access a Human Right,,30,127,2011-06-05,TECH,0.02773272804915905,0.8915545344352722,0.08071278780698776
technology,Visualized: Acer's Iconia Tab A500 is 'a better choice' than the iPad,,33,27,2011-06-05,TECH,0.016495345160365105,0.8464375734329224,0.1370670199394226
technology,VIDEO: Windows 7 can be tablet-friendly after all,,15,25,2011-06-05,TECH,0.045797817409038544,0.9228277802467346,0.031374406069517136
technology,"Google, Apple ordered by Taipei City to offer 7-day free trials on apps or face fines",,11,23,2011-06-05,TECH,0.01744551956653595,0.9080385565757751,0.07451597601175308
technology,"Apple, Google, Microsoft -- all are after Nortel's patent portfolio",,11,21,2011-06-05,TECH,0.06290912628173828,0.9068983793258667,0.03019249066710472
technology,"Nintendo says server breached, no data lost",,9,20,2011-06-05,TECH,0.9323580265045166,0.048958778381347656,0.01868310384452343
technology,xkcd: The Cloud,,159,747,2011-06-06,TECH,0.02024970017373562,0.9246640801429749,0.055086273699998856
technology,Sony Computer Entertainment Developer Network source code leaked,,342,455,2011-06-06,TECH,0.03129519149661064,0.9460676908493042,0.0226371381431818
technology,Steve Jobs invents Google Contacts and Google Docs.,,723,407,2011-06-06,TECH,0.03847850486636162,0.9303954243659973,0.031126076355576515
technology,McDonald's does it right,,153,396,2011-06-06,TECH,0.02122613973915577,0.9078757762908936,0.07089810818433762
technology,Large Air Spill at Wind Farm. No threats reported. Somе claim to enjoy the breeze.,,133,322,2011-06-06,TECH,0.05817066878080368,0.867275595664978,0.0745537206530571
technology,The FBI and US secret service have used the threat of prison to create an army of informers among online criminals,,79,294,2011-06-06,TECH,0.2558213174343109,0.7209047675132751,0.02327396348118782
technology,New battery design could give electric vehicles a jolt,,38,176,2011-06-06,TECH,0.00782772246748209,0.6503666043281555,0.34180566668510437
technology,"Hello Pot, meet Kettle...",,277,118,2011-06-06,TECH,0.04192934185266495,0.8918894529342651,0.06618120521306992
gadgets,Finally!  It's about time you can take pictures by pushing a physical button..,,150,114,2011-06-06,TECH,0.020172271877527237,0.9116882681846619,0.0681394711136818
technology,iOS 5 Announced,,370,109,2011-06-06,TECH,0.039582882076501846,0.9325841069221497,0.027833029627799988
technology,Verizon ban on 4G tethering apps violates openness rule that the company agreed to when they bought the spectrum in 2008,,370,1986,2011-06-07,TECH,0.017916478216648102,0.9216015338897705,0.06048200652003288
technology,Contact lenses that beam a heads-up-display directly into your eyeball are being developed.,,196,677,2011-06-07,TECH,0.02819485403597355,0.9412282109260559,0.03057697042822838
gadgets,"Samsung Delivers Galaxy S II to CyanogenMod Dev, Says Get to Work",,70,340,2011-06-07,TECH,0.019847447052598,0.8980937600135803,0.08205883204936981
technology,"I'm calling it right now, Apple will find a reason to remove the Dropbox app from the iStore as Dropbox kicks iclouds ass. Oh, and it's free.",,217,255,2011-06-07,TECH,0.07573270797729492,0.8866210579872131,0.03764626383781433
technology,Mapnificent: A revolutionary new time-based transit map,,22,199,2011-06-07,TECH,0.03368574380874634,0.9220203161239624,0.04429398104548454
technology,RSA admits SecurID tokens have been compromised - understatement of the year,,56,155,2011-06-07,TECH,0.03615672513842583,0.9135858416557312,0.05025741830468178
technology,Richard Stallman was DEAD ON with one of his police state predications,"Stallman wrote a piece of fiction in 1997 about police states cracking down on password sharers: http://www.gnu.org/philosophy/right-to-read.html

Today Tennessee passed this: http://www.schneier.com/blog/archives/2011/06/tennessee_makes.html#comments

I am dazzled.",75,153,2011-06-07,TECH,0.03566507622599602,0.9032093286514282,0.06112559512257576
technology,"Just Months After Jeopardy!, Watson Wows Doctors With Medical Knowledge",,38,106,2011-06-07,TECH,0.01752573624253273,0.7986413240432739,0.18383298814296722
technology,how a hard drive works,,11,87,2011-06-07,TECH,0.02602120116353035,0.9295579791069031,0.04442084580659866
technology,World IPv6 DAY - Test Your v6 here,,49,87,2011-06-07,TECH,0.027150757610797882,0.9185758233070374,0.05427345260977745
technology,Google R&amp;D Team charged with making renewable energy cheaper than coal within a few years,,437,1251,2011-06-08,TECH,0.012672808952629566,0.7702187299728394,0.21710838377475739
technology,Apple rips off student's rejected iPhone app,,856,1188,2011-06-08,TECH,0.680095911026001,0.29208964109420776,0.027814490720629692
gadgets,Kranium: A cardboard helmet that's safer than plastic,,59,347,2011-06-08,TECH,0.02339354157447815,0.8521514534950256,0.12445501238107681
technology,"I had deleted all my messages in my facebook inbox, and now with the new message center they released all those old messages from 2005 resurfaced. WTF?",,108,186,2011-06-08,TECH,0.06449730694293976,0.9093614220619202,0.026141278445720673
gadgets,Ars: Hands on with the Wii U,,49,165,2011-06-08,TECH,0.02983933314681053,0.9316504001617432,0.03851025551557541
technology,"I think everyone should watch The Lightbulb Conspiracy. Products today are designed to be disposed and rebought, not to last.",,110,142,2011-06-08,TECH,0.025912277400493622,0.9286767244338989,0.04541099816560745
technology,The U.N. Declares Internet Access a Human Right,,13,107,2011-06-08,TECH,0.021424729377031326,0.9165387153625488,0.062036532908678055
technology,A child's hobby? Average gamer is 37 years old,,73,101,2011-06-08,TECH,0.07621658593416214,0.888397216796875,0.03538618981838226
technology,US Senators seek crackdown on Bitcoin currency,,186,98,2011-06-08,TECH,0.26926925778388977,0.6915391683578491,0.03919157013297081
technology,I duct-taped a spy camera to a model rocket [video],,20,80,2011-06-08,TECH,0.02736312709748745,0.936785101890564,0.03585177659988403
technology,Newegg got a cease and desist letter from Best Buy for airing this hilarious TV commercial,,859,1942,2011-06-09,TECH,0.02753816358745098,0.9039462804794312,0.0685155913233757
technology,Wow the google logo for today is really fun to play with!,,455,1422,2011-06-09,TECH,0.014295273460447788,0.6453123092651367,0.34039247035980225
technology,"Judge furious at ""inexcusable"" P2P lawyering, nukes subpoenas",,85,766,2011-06-09,TECH,0.04613339155912399,0.9087167382240295,0.04514988511800766
gadgets,"Man makes a can of beer turn into a robot, controls it with the Wii remote.",,27,270,2011-06-09,TECH,0.04217858985066414,0.9258937239646912,0.03192776069045067
technology,"US solar-power companies say they'll be in a position to compete on price with conventional generation within three years, without subsidy",,97,220,2011-06-09,TECH,0.00952746719121933,0.658561110496521,0.3319113552570343
technology,Judge reverses course on letting his court be used for mass copyright suit farce,,14,114,2011-06-09,TECH,0.4841846823692322,0.48417162895202637,0.031643614172935486
gadgets,Wireless Headphones Question,"Between living in a crowded house and owning an iPhone I pretty much use headphones constantly. I've had a recurring problem with wired headphones. Eventually, no matter what brand I buy, something fucks up in the connector and the right speaker stops working. I'm tired of buying new headphones every few months and want to find a wireless solution that I can use for my PC, Mac, and iPhone. Does anyone have any recommendations?",82,66,2011-06-09,TECH,0.07096052169799805,0.9040721654891968,0.024967290461063385
technology,Why we secretly love LulzSec: Elephant in room visible. Cans open. Worms everywhere...,,7,52,2011-06-09,TECH,0.06004233658313751,0.9092661738395691,0.030691515654325485
technology,"Ars: Chrome 12 arrives with security, rendering improvements",,40,40,2011-06-09,TECH,0.015495623461902142,0.756038248538971,0.22846613824367523
technology,"Citigroup, the worlds largest financial services network admits to data breach",,2,38,2011-06-09,TECH,0.021503400057554245,0.8815496563911438,0.09694695472717285
technology,Anti-Piracy Lawyers Found Guilty of Professional Misconduct,,73,1014,2011-06-10,TECH,0.5485531687736511,0.4138304889202118,0.037616390734910965
technology,Supreme Court: AT&amp;T must share its lines with competitors,,67,445,2011-06-10,TECH,0.048059720546007156,0.8975448608398438,0.05439538136124611
gadgets,"Why yes, I HAVE been looking for a way to improve my aerial cattle mustering!",,72,315,2011-06-10,TECH,0.0114964060485363,0.7874268889427185,0.2010766863822937
technology,1Gbps fiber? Check. $70 a /mo.? Check. In America? Check. It's Sonic.net,,118,285,2011-06-10,TECH,0.02990352176129818,0.904085099697113,0.06601133942604065
technology,"So far, this is the only reason I'd want to buy a 3D TV.",,32,277,2011-06-10,TECH,0.020414011552929878,0.9216303825378418,0.05795556679368019
technology,IBM Builds World First Graphene Integrated Circuit,,51,215,2011-06-10,TECH,0.014535343274474144,0.8964065909385681,0.089058056473732
technology,"LulzSec re-seizes their domain, I love these guys..",,55,155,2011-06-10,TECH,0.024366986006498337,0.9086478352546692,0.06698517501354218
technology,Groupon Was “The Single Worst Decision I Have Ever Made As A Business Owner”,,65,119,2011-06-10,TECH,0.8358277678489685,0.1337486356496811,0.030423646792769432
technology,5 Reasons Internet Access in America is a Disaster,,79,103,2011-06-10,TECH,0.01960473135113716,0.9439525604248047,0.03644273802638054
technology,Hover. Bike.,,50,98,2011-06-10,TECH,0.01768176443874836,0.8869343400001526,0.0953839123249054
technology,"Tennessee law bans 'distressing images': Anyone who sends or posts an image online that they ""reasonably should know"" would ""cause emotional distress"" could face several months in jail and thousands of dollars in fines.",,603,1496,2011-06-11,TECH,0.8931363224983215,0.09253695607185364,0.014326689764857292
technology,Why can't I bear to throw these away?,,191,368,2011-06-11,TECH,0.12149379402399063,0.8432689905166626,0.03523724526166916
technology,Canadian intellectual property lobbyists caught faking counterfeit data so they could try to enact new border measure provisions that could lead to the searching of luggage as travellers enter Canada,,15,289,2011-06-11,TECH,0.07788801938295364,0.716428816318512,0.20568318665027618
technology,Tennessee bans 'distressing images' online. This is the text of the bill turned into a 'distressing image.',,23,160,2011-06-11,TECH,0.06191037967801094,0.914590060710907,0.023499621078372
gadgets,"What sort of home rigs do redditors feel like they have perfectly figured out.  HTPCs, servers, home automation, security, etc.  Help the rest of us join the 21st century with ease","I always think about building a HTPC-powered theater room, a more robust backup server with surveillance, and some sort of in-car mobile-broadband audio system.  
  
However, I'm always crippled a bit by feeling like I'm going to get started on a project and realize I'm going about it wrong, or whatever set up I come up with will be cumbersome and unintuitive.  
  
It'd be nice for everyone to share their electronic masterpieces for which all the kinks are worked out, simplicity and sexiness have been maximized, so other redditors can more easily get started on their own.  
  
Pics of your setup, links to how-tos, etc when possible, please.",19,90,2011-06-11,TECH,0.04227430000901222,0.9245681762695312,0.03315753489732742
technology,Right to remain online: Why the UN believes internet access is a human right,,15,78,2011-06-11,TECH,0.016837922856211662,0.8540999293327332,0.12906217575073242
technology,Anonymous takes down Turkish government website in response to Turkey's Internet censorship,,11,77,2011-06-11,TECH,0.17335383594036102,0.8089486956596375,0.017697419971227646
gadgets,"What gadget have you owned that had the longest support from its manufacturer, in terms of driver or firmware updates?","I've noticed that few of my computers have received BIOS updates beyond the first year or two after they were released, and none of the updates added new features.

I know ATI/AMD regularly releases all-in-one drivers, but I don't think they do much for the older cards. 

**EDIT**: Note that I'm talking about *hardware* and driver/firmware **updates** from manufacturers.


**EDIT 2**: Wow, people are just ignoring the premise of my question. I'm talking about the longest period of manufacturers releasing **updated** drivers or firmware, not how long your gadget worked.",147,72,2011-06-11,TECH,0.041435305029153824,0.9097590446472168,0.048805661499500275
technology,China’s investment in GPU supercomputing begins to pay off!,,54,50,2011-06-11,TECH,0.02553412690758705,0.9101927876472473,0.06427312642335892
technology,"IBM application seeking to patent the process of using a computer to make money from a patent portfolio is intriguing. If granted, Big Blue could potentially have an infringment counterclaim against NPEs (patent trolls)",,19,48,2011-06-11,TECH,0.015016417019069195,0.8900918364524841,0.09489172697067261
technology,"I love my grandparents, but sometimes the 21st century is too much for them...",,390,1417,2011-06-12,TECH,0.04549841955304146,0.908359169960022,0.04614238068461418
technology,I only just noticed this thing in Windows 7 and I love it. Has this always been there?,,867,862,2011-06-12,TECH,0.02793879620730877,0.8682640194892883,0.10379713028669357
technology,"Apple Sued by iCloud - iCloud Communications, an Arizona-based computer communications company, filed suit against Apple on Thursday for allegedly infringing on its trademark of the name iCloud",,169,465,2011-06-12,TECH,0.462606281042099,0.5028961896896362,0.034497540444135666
technology,Streisand effect in action.  Senators call for the shutdown of anonymous drug network built on Tor and Bitcoins.  They gave the drug network publicity that quite literally couldn't be bought.,,110,304,2011-06-12,TECH,0.15536677837371826,0.8068041801452637,0.037828993052244186
technology,Yesterday’s Banned Apps Are Tomorrow’s Great New Feature,,87,182,2011-06-12,TECH,0.028531305491924286,0.8919201493263245,0.07954853028059006
technology,Who else wants tabs in Windows Explorer in Windows 8?,"I mean... c'mon, we figured this shit out with Internet browsers years ago. Why can't things like Windows Explorer keep up? It would definitely make my browsing much easier. 

Specially with Windows 7. Before I just quickly pressed the folder on the taskbar. Now I have to hover over by folder icon and then select the necessary one. Or I have to start alt-tab and find the correct window.",113,148,2011-06-12,TECH,0.02842041105031967,0.9196159839630127,0.05196365341544151
technology,"The beginning of the end? First Bitcoin ""depression"" hits, value drops 30% in one day",,130,93,2011-06-12,TECH,0.5712242722511292,0.36253488063812256,0.0662408098578453
gadgets,Best solar charger?,"HI,

I'm planning on a three day outdoor trip, and I'd like to be able to charge my phone as well.  I've done some searching for solar charges but I'm not sure which are good.

Any suggestions?

Thanks!",64,51,2011-06-12,TECH,0.010156403295695782,0.7300158739089966,0.2598276734352112
