subreddit,title,selftext,num_comments,score,created_utc,stock/sector,neg,neu,pos
technology,Google Succeeds in Making Driverless Cars Legal in Nevada. FUCK YES.,,243,810,2011-06-26,TECH,0.026088709011673927,0.9133065342903137,0.06060482934117317
technology,"Lulzsec doxed by The A-Team; personal info about it's members released (ips, phone, address, etc)",,155,353,2011-06-26,TECH,0.043959323316812515,0.9378594756126404,0.01818123087286949
technology,At least one Australian ISP is wavering on plans to begin blocking illegal websites next month because of fear of reprisals from “internet vigilantes.”,,23,184,2011-06-26,TECH,0.2624938488006592,0.7151200771331787,0.022386061027646065
technology,Skype’s Worthless Employee Stock Option Plan: Here’s Why They Did It,,27,175,2011-06-26,TECH,0.02313937433063984,0.9339613318443298,0.04289932921528816
gadgets,"This may not fit here, but! What are your favorite headphones or earbuds. I'm on a search to find the best!","Upvote your favorite!!! and Link to your Favorite!!!
(Mine are Skull Candy)
But I want you to change my mind!",258,137,2011-06-26,TECH,0.04734931141138077,0.9178584814071655,0.03479215130209923
technology,"One high-definition DVR and one high-definition cable box use an average of 446 kilowatt hours a year, about 10 percent more than a 21-cubic-foot energy-efficient refrigerator",,16,52,2011-06-26,TECH,0.02653614990413189,0.9061501622200012,0.06731369346380234
technology,The KGB and Stasi would be proud; welcome to the new world where no information is private,,20,46,2011-06-26,TECH,0.008981950581073761,0.7598923444747925,0.23112568259239197
technology,"I invented this last night, then realized it already exists... why aren't these standard in nerd homes?",,90,43,2011-06-26,TECH,0.03716108575463295,0.9328551888465881,0.02998366951942444
technology,Master Foo and the Script Kiddie,,1,27,2011-06-26,TECH,0.021932486444711685,0.9201453328132629,0.0579221285879612
technology,A List Of People Who Need To Stop Writing Software.,,788,1335,2011-06-27,TECH,0.30342453718185425,0.6623207926750183,0.034254707396030426
technology,"""Google's war on nonsense"" - how cynical websites decided writing is a fungible commodity that can be mass-produced, and how Google fought back",,177,757,2011-06-27,TECH,0.12308987975120544,0.8145129084587097,0.06239729002118111
technology,Good will online comes in pizza form,,115,503,2011-06-27,TECH,0.013829121366143227,0.3858363628387451,0.6003345251083374
technology,I think it's time to start an open source CIA .... collect dossiers on public servants.,,215,466,2011-06-27,TECH,0.01961830072104931,0.9349942803382874,0.045387353748083115
technology,Seriously Apple? [WWDC Videos],,266,339,2011-06-27,TECH,0.02170076034963131,0.9262625575065613,0.052036672830581665
gadgets,I can see this being big - Camera you focus after taking the shot,,92,203,2011-06-27,TECH,0.025211581960320473,0.9089871644973755,0.0658012330532074
technology,EFF Releases 'Know Your Digital Rights' Guide to Your Constitutional Liberties,,24,200,2011-06-27,TECH,0.032688044011592865,0.9269746541976929,0.04033731296658516
gadgets,Nokia activates its brain cells again and introduces a brilliant idea for portable speakers,,66,180,2011-06-27,TECH,0.010082759894430637,0.6322637796401978,0.35765349864959717
technology,New alloy material that converts heat directly into electricity,,58,148,2011-06-27,TECH,0.01149484422057867,0.906548023223877,0.0819571390748024
technology,The Red Flag Act of 1865,,20,147,2011-06-27,TECH,0.055472828447818756,0.9104571342468262,0.034070078283548355
technology,"Introducing the Google+ project: Real-life sharing, rethought for the web:",,750,1211,2011-06-28,TECH,0.03284680098295212,0.9312555193901062,0.03589768707752228
technology,"U.S. Navy bought 59,000 microchips  that turned out to be fakes from China. Wired reports the chips had been made with a ""back-door"" and could have been remotely shut down at any time",,359,831,2011-06-28,TECH,0.04493464156985283,0.8990846276283264,0.05598076060414314
technology,Storage vs. Bandwidth Infographic,,126,315,2011-06-28,TECH,0.04694824665784836,0.9212828874588013,0.03176882490515709
technology,"Google Introduces Facebook Competitor, Emphasizing Privacy",,149,264,2011-06-28,TECH,0.038436245173215866,0.9103259444236755,0.051237817853689194
technology,"Google's latest attempt at beating Facebook, Google+ ... looks very promising this time around.",,73,158,2011-06-28,TECH,0.024270331487059593,0.7288903594017029,0.24683938920497894
technology,Two professors from the University of Illinois have created a roller-ball pen with conductive ink that can be used to simply draw circuits by hand.,,30,154,2011-06-28,TECH,0.029221022501587868,0.9390718936920166,0.031707070767879486
gadgets,"reddit, what is your favorite gadget purchase of the year?","I'll go first. 

[The Kindle.](http://www.amazon.com/gp/product/B002Y27P3M?ie=UTF8&amp;tag=musrevforidib-20&amp;linkCode=shr&amp;camp=213733&amp;creative=393177&amp;creativeASIN=B002Y27P3M) It has gotten me back into reading. I can take it and read it anywhere. Commuting to work, planes, coffee shop, etc. I never thought I'd get this much use out of it when I got it for X-mas last year.

How about you reddit? iPad? smartphone? Google TV? 3DTV(ha)?",572,131,2011-06-28,TECH,0.030375156551599503,0.9198542237281799,0.049770649522542953
gadgets,"Nikon shows off some new concept cameras, is this the future of photography?",,39,109,2011-06-28,TECH,0.01587369292974472,0.9031426906585693,0.08098355680704117
technology,Hackers are being radicalised by government policy,,23,103,2011-06-28,TECH,0.07200854271650314,0.8895695805549622,0.03842192888259888
technology,"Major Breakthrough in Solar Power: Inexpensive Coating Solves Full-Spectrum Solar Conversion, Efficiency To 42%",,16,80,2011-06-28,TECH,0.009121607057750225,0.7454593777656555,0.2454189956188202
technology,i love their sense of humor,,294,1189,2011-06-29,TECH,0.041026242077350616,0.880104124546051,0.07886961847543716
technology,xkcd: Google+,,100,255,2011-06-29,TECH,0.02614583820104599,0.9343776702880859,0.039476506412029266
technology,"""Google+ is not a product like Buzz or Wave where the company’s leaders can chalk off a failure to laudable ambition and then move on. We’re in this for the long run. This isn’t like an experiment. We’re betting on this, so if obstacles arise, we’ll adapt.”",,113,254,2011-06-29,TECH,0.022199705243110657,0.9096099138259888,0.06819039583206177
gadgets,CyanogenMod 7 on the Nook Color is almost too excellent.,,57,153,2011-06-29,TECH,0.03159302473068237,0.9175695776939392,0.050837479531764984
technology,News Corp. sells Myspace to Specific Media for $35M. They originally bought it for $580M,,29,99,2011-06-29,TECH,0.016716446727514267,0.9442812204360962,0.039002303034067154
technology,Hate Verizon's tiered data plan. Cancel service WITHOUT early termination fee.,,26,84,2011-06-29,TECH,0.4503587782382965,0.534376859664917,0.015264355577528477
technology,"Google releases tool to convert Flash SWF files to HTML5, allowing you to reuse Flash content on devices without a Flash player.",,14,84,2011-06-29,TECH,0.014055599458515644,0.9293259382247925,0.05661849305033684
technology,Hacker attack cripples Al-Qaida web communications,,15,76,2011-06-29,TECH,0.05102391541004181,0.9262142181396484,0.022761942818760872
technology,"OnLive CEO reveals 'entirely new approach' to wireless, credits Rearden for toppling Shannon's Law -- Engadget",,26,57,2011-06-29,TECH,0.013574651442468166,0.8859027028083801,0.10052268207073212
technology,what the first ever website looked like,,15,56,2011-06-29,TECH,0.013030451722443104,0.9110074639320374,0.07596200704574585
technology,Organizational chart of big IT companies,,348,1720,2011-06-30,TECH,0.07167873531579971,0.901715099811554,0.02660614438354969
technology,"Hey reddit! My dad, one of the first speech synthesis engineers, sent me an old audio file of a computer singing!",,344,1149,2011-06-30,TECH,0.018731815740466118,0.9106103181838989,0.07065783441066742
gadgets,Open letter to BlackBerry bosses: Senior RIM exec tells all as company crumbles around him - BGR,,177,311,2011-06-30,TECH,0.020277848467230797,0.9186158776283264,0.06110632047057152
technology,Hewlett Packard's Laptop Lock Takes Only Seconds To Crack,,53,178,2011-06-30,TECH,0.08028297126293182,0.8919458389282227,0.02777121402323246
technology,Mark Zuckerberg Is On Google+ (But He Doesn't Look Happy About It),,180,148,2011-06-30,TECH,0.14464960992336273,0.8254346251487732,0.02991579659283161
technology,World's most sophisticated botnet virtually indestructible; has infected 4.5 million computers in first three months.,,122,134,2011-06-30,TECH,0.021129213273525238,0.9234592914581299,0.05541154369711876
technology,Saudis go full steam into solar energy. Saudi Arabia aspires to export solar electricity to neighbouring countries and even international markets given the advances in efficient electricity transmission.,,36,92,2011-06-30,TECH,0.009479088708758354,0.3673977553844452,0.6231232285499573
technology,Why is European broadband faster and cheaper? Blame the government,,41,85,2011-06-30,TECH,0.0214249100536108,0.7354063391685486,0.24316871166229248
technology,"Value of solar power far exceeds its cost. ""Solar power has a monetary value as much as 10 times higher than its energy value, thanks to its ability to reduce peak demand on the transmission and distribution system, hedge against fuel price increases, and enhance grid and environmental security.""",,24,76,2011-06-30,TECH,0.01636691205203533,0.3231377601623535,0.6604952812194824
technology,"California Tells Online Retailers To Start Collecting Sales Taxes From Customers: ""Beginning Friday [1 July 2011], Amazon.com and other large out-of-state retailers will be required to collect sales taxes on purchases that their California customers make online.""",,184,76,2011-06-30,TECH,0.041493114084005356,0.9314587712287903,0.027048097923398018
