subreddit,title,selftext,num_comments,score,created_utc,stock/sector,neg,neu,pos
technology,Judge demands tech companies hand activist data over to Chevron,,6.0,9,2013-07-15,TECH,0.31922194361686707,0.6499713063240051,0.030806759372353554
technology,Apple to probe death of Chinese woman who used iPhone when it was charging,,1.0,9,2013-07-15,TECH,0.7872680425643921,0.1791144609451294,0.0336175337433815
technology,"Spotify Defends Against New Music Backlash, Says It Will Pay Out $1B To Artists By End Of 2013",,0.0,9,2013-07-15,TECH,0.1920984834432602,0.7693172693252563,0.038584183901548386
technology,"Why We Can No Longer Trust Microsoft. If the NSA is spying on Microsoft products, why would anyone want to use them (especially European/foreign governments)?",,338.0,897,2013-07-15,TECH,0.027279814705252647,0.9385491609573364,0.03417098894715309
technology,"Richard Stallman: Snowden leak a chance for privacy, time to fight Big Brother",,22.0,876,2013-07-15,TECH,0.06073717772960663,0.8929183483123779,0.04634447395801544
gadgets,Projector for LG Nexus 4 (Google),"I want to buy my boyfriend a pico projector for his phone (the LG Nexus 4 from Google) but am having a tough time finding one that is compatible for his phone. His birthday is coming up and I know he's wanted one for watching tv.

Anyone have this particular phone and happen to be using a pico projector with it? Or, know what kind of projector would work with it?",5.0,8,2013-07-15,TECH,0.026111431419849396,0.9374263882637024,0.03646219149231911
technology,"Linux 3.11 has been released. Linus Torvalds has changed its name to ""Linux for Workgroups"" and modified the logo that some systems display when booting: it now depicts a Tux holding a flag with a symbol that is reminiscent of the logo of Windows for Workgroups 3.11, which was released in 1993",,1.0,8,2013-07-15,TECH,0.023233048617839813,0.9426239728927612,0.034142982214689255
gadgets,FIDO Would Enable Dog-To-Human Communication,,1.0,8,2013-07-15,TECH,0.01784832403063774,0.9096527099609375,0.07249900698661804
technology,Google and Microsoft sign up to ad network guidelines against piracy,,0.0,8,2013-07-15,TECH,0.01577257737517357,0.9431746006011963,0.04105283319950104
technology,New thermocell could harvest 'waste heat',,10.0,92,2013-07-16,TECH,0.033302947878837585,0.9179599285125732,0.048737164586782455
technology,Read this before switching to Yahoo! Mail,,3.0,9,2013-07-16,TECH,0.03548523783683777,0.9332476854324341,0.03126705065369606
technology,"Google Updates Analytics With Improved User Segmentation, Sequence Filters",,0.0,9,2013-07-16,TECH,0.01733815297484398,0.7818852663040161,0.2007765769958496
technology,Don’t Blame Big Cable. It’s Local Governments That Choke Broadband Competition,,3.0,9,2013-07-16,TECH,0.0378219373524189,0.9271175861358643,0.035060446709394455
technology,"Crazy Giant Robot Guy Has a Kickstarter! He's Not The Best at Marketing, but Check Him Out!",,2.0,9,2013-07-16,TECH,0.01470400020480156,0.8037247657775879,0.18157121539115906
technology,Okay: Now Do You Realize Why CISPA's Granting Of Broad Immunity For Companies Sharing Data With The Feds Is An Issue?,,1.0,89,2013-07-16,TECH,0.022065110504627228,0.9157748222351074,0.06216012313961983
technology,EFF Sues NSA to Stop 'Dragnet' Surveillance,,21.0,837,2013-07-16,TECH,0.04025790095329285,0.926324725151062,0.033417314291000366
technology,"IGN shares some of the amazing tech in the 17"" touchscreen display on the Tesla Model S (3:30)",,0.0,8,2013-07-16,TECH,0.011575061827898026,0.8476718664169312,0.1407531350851059
technology,Q2 2013 Venture Capital Financing and Exit Report,,0.0,8,2013-07-16,TECH,0.20431950688362122,0.759835958480835,0.03584454208612442
technology,"Yahoo opens wait list for soon-to-be recycled, abandoned usernames.",,4.0,8,2013-07-16,TECH,0.04898793250322342,0.9292500615119934,0.021762050688266754
technology,Edit Wars Reveal The 10 Most Controversial Topics on Wikipedia,,60.0,96,2013-07-17,TECH,0.17774100601673126,0.7913734316825867,0.030885590240359306
gadgets,Lark Wristband Will Help You Sleep And Wake Up More Easily,,19.0,92,2013-07-17,TECH,0.044190663844347,0.8816275000572205,0.07418186217546463
gadgets,Smart Phone with no Data Plan?,"My 14 year old is looking at sub $200 Tablets, Ipod Touches and Smartphones that have comparable OtterBoxes to use around the house. Hes checking out smart phones but we are unsure if you can use WIFI without a SIM Card / Data Plan? 

One in particular is a HTC Thunderbolt. Google brings back conflicting opinions on if you can use Wifi without a data-plan.",9.0,9,2013-07-17,TECH,0.03920368477702141,0.9275183081626892,0.03327799588441849
gadgets,Best bluetooth speakers to daisy chain.,Essentially I want about 5 bluetooth speakers I can daisy chain for a home theatre on the cheap. Any suggestions?,1.0,9,2013-07-17,TECH,0.029165610671043396,0.9068566560745239,0.06397775560617447
technology,First promising Google Glass competitor is here and it doesn't cost nearly as much,,13.0,9,2013-07-17,TECH,0.009207569994032383,0.5561097860336304,0.434682697057724
technology,"What with Microsoft back-pedalling over the fact that they breached your privacy, but they're outraged and they were forced into it - here's a reminder of their advertising campaign that launched earlier this year.",,19.0,86,2013-07-17,TECH,0.03539732098579407,0.8833194971084595,0.08128319680690765
technology,"Vehicle Records Taken By Law Enforcement Agencies Across America: capturing, storing and sharing data on license plates, making it possible to see people's movements, whether they're making tracks to the beach or up to no good.",,1.0,8,2013-07-17,TECH,0.033670734614133835,0.9309210777282715,0.03540824353694916
technology,Arsenic In Your Water? This Innovation Attacks The Problem.,,1.0,8,2013-07-17,TECH,0.8562124371528625,0.12146877497434616,0.022318782284855843
technology,The US is home to one third of the world’s data—here’s who’s storing it,,2.0,8,2013-07-17,TECH,0.04311875253915787,0.9065300226211548,0.05035122483968735
technology,"Massive Tumblr Security Flaw Requires Everyone On iPhone, iPad To Change Their Password",,0.0,8,2013-07-17,TECH,0.27910399436950684,0.7001603245735168,0.020735658705234528
technology,"Snowden’s Contingency: ‘Dead Man’s Switch’ Borrows From Cold War, WikiLeaks -- Snowden passed encrypted copies of his NSA cache ""to a number of third parties."" If Snowden should suffer a mysterious fatal accident, they will have a decryption key and they can publish the documents to the world.",,11.0,96,2013-07-18,TECH,0.03427574038505554,0.9238932728767395,0.04183099418878555
gadgets,The Verge: ‘Microsoft Took a $900 Million Hit on Surface RT This Quarter’,,34.0,90,2013-07-18,TECH,0.01958431676030159,0.8517828583717346,0.1286327838897705
technology,First hand stories on what happens when your startup gets sued by a patent troll. Spoiler - it doesn't get any worse than that.,,2.0,9,2013-07-18,TECH,0.20836128294467926,0.7502041459083557,0.041434574872255325
technology,"BitTorrent’s serverless P2P sync software hits beta, adds Android support",,8.0,82,2013-07-18,TECH,0.014062376692891121,0.8968271613121033,0.08911047875881195
technology,Researchers from Microsoft Asia and the Institute of Computing Technology at the Chinese Academy of Sciences have been working together using Kinect to translate gestures used in sign language to text. They hope to use the new tech to allow deaf persons to communicate.,,1.0,8,2013-07-18,TECH,0.017418572679162025,0.9185432195663452,0.06403820216655731
technology,Photo-realistic computer generated images,,9.0,8,2013-07-18,TECH,0.036036502569913864,0.9393409490585327,0.02462250553071499
technology,Wide range of industries plead for Congressional action on patent trolls,,11.0,71,2013-07-18,TECH,0.06991850584745407,0.8077446222305298,0.12233685702085495
technology,Pending law would block Tesla sales in New York,,2.0,7,2013-07-18,TECH,0.5932984948158264,0.38815391063690186,0.018547652289271355
technology,Tiny laser may speed up future computers,,0.0,7,2013-07-18,TECH,0.011610346846282482,0.8494104743003845,0.13897912204265594
technology,Turning Hackaday into a virtual hackerspace,,0.0,7,2013-07-18,TECH,0.06918411701917648,0.9009541273117065,0.029861818999052048
technology,"Microsoft earns $4.97 billion in Q4, but Surface RT hurts profits",,47.0,95,2013-07-19,TECH,0.18726256489753723,0.7380180358886719,0.07471944391727448
technology,It's kind of ironic how the U.S government keep accusing Huawei of spying when it's been proven to be them that are spying.,,12.0,93,2013-07-19,TECH,0.6484575867652893,0.3264770209789276,0.02506544068455696
technology,"Original Schindler's list being auctioned on eBay, bidding starts at $3 million",,0.0,9,2013-07-19,TECH,0.024255823343992233,0.929566502571106,0.046177688986063004
technology,"BlackBerry overtakes Samsung in the UK, takes #2 spot in market share",,2.0,9,2013-07-19,TECH,0.03240197151899338,0.5733560919761658,0.39424198865890503
technology,"Comcast 'mobile WiFi network' would use transceivers placed on rental cars, buses, bicycles, humans -- The patent, titled ""Mobile WiFi Network,"" details a strategy for managing a dynamic mesh network of mobile hotspots",,1.0,9,2013-07-19,TECH,0.012941165827214718,0.9238691329956055,0.06318964064121246
technology,"""General Motors has created a team to study electric car maker Tesla -- high irony considering GM was one of the pioneers of the moden electric car.""",,36.0,88,2013-07-19,TECH,0.011608314700424671,0.8507947325706482,0.1375969499349594
technology,Broadband speeds in space are getting upgraded to 300Mbps by using lasers.,,6.0,83,2013-07-19,TECH,0.011198741383850574,0.7831242084503174,0.2056770622730255
technology,Hackers break into and take down Hospital VOIP system.,,5.0,8,2013-07-19,TECH,0.03930295258760452,0.9269282817840576,0.033768780529499054
technology,Thank You For Using The Internet! We Regret To Inform You That Your Free Trial Has Expired,,8.0,8,2013-07-19,TECH,0.012985260225832462,0.8900084495544434,0.09700630605220795
technology,U.S. government renews authorization for domestic telephone surveillance.,,1.0,79,2013-07-19,TECH,0.0162372924387455,0.9083287715911865,0.07543391734361649
technology,"FISA Court Rubber Stamps Continued Collection Of All Phone Records, While DOJ Insists No One Can Challenge This--""it's all legal -- but not so legal that we're comfortable with it being tested in court.""",,158.0,976,2013-07-20,TECH,0.10248181968927383,0.8102846741676331,0.08723348379135132
technology,MPAA Demands Source Code of isoHunt’s “Failing” Piracy Filter,,31.0,96,2013-07-20,TECH,0.20501413941383362,0.7766461372375488,0.018339654430747032
technology,San Jose State suspended its online classes after more than half the students failed.,,3.0,9,2013-07-20,TECH,0.9203508496284485,0.06855661422014236,0.01109249610453844
technology,Apple Buys HopStop and Immediately Drops Windows Phone Support,,307.0,843,2013-07-20,TECH,0.731643795967102,0.25157052278518677,0.016785679385066032
technology,"Tech groups, investors and activists join forces to press gov’t on surveillance",,0.0,8,2013-07-20,TECH,0.14588594436645508,0.675331711769104,0.17878231406211853
gadgets,Leaked images of the Ubtuntu Edge smartphone revealed,,13.0,79,2013-07-20,TECH,0.021424181759357452,0.914704442024231,0.06387139856815338
technology,Twitter Marketing - Stop Wasting Time On Getting Followers!,,0.0,76,2013-07-20,TECH,0.0426657497882843,0.9214569926261902,0.03587722405791283
technology,Microsoft Experiences Its Biggest Drop Of The Century As Shares Fall 12 Percent,,9.0,7,2013-07-20,TECH,0.9696876406669617,0.022659800946712494,0.007652538828551769
technology,Second man in coma after being electrocuted by charging iPhone,,10.0,7,2013-07-20,TECH,0.055296048521995544,0.9112939238548279,0.03341001644730568
technology,"Microsoft will ""aggressively challenge"" any government attempt to spy through Kinect",,79.0,67,2013-07-20,TECH,0.2354581505060196,0.7002595067024231,0.0642823576927185
gadgets,The R2-D2 Projection Alarm Clock,,10.0,88,2013-07-21,TECH,0.03625084087252617,0.916366457939148,0.04738269001245499
technology,NSA Spokesman Accidentally Admits that the Government Is Spying On Virtually All Americans,,7.0,85,2013-07-21,TECH,0.8192812204360962,0.16286662220954895,0.017852114513516426
technology,"​NVIDIA Shield ships July 31st, barely meets delayed launch window",,6.0,8,2013-07-21,TECH,0.09880539029836655,0.8662081360816956,0.034986499696969986
technology,"Honda has built the world's fastest lawn mower. Dubbed the ""Mean Mower,"" it can reach 130 mph.",,21.0,77,2013-07-21,TECH,0.015774574130773544,0.30591848492622375,0.6783069372177124
technology,Disney Creates New Mid-Air Haptic Technology,,17.0,75,2013-07-21,TECH,0.009502531029284,0.8477380871772766,0.14275941252708435
technology,AMD Falls Most in 9 Months After Lower Margin Forecast,,0.0,7,2013-07-21,TECH,0.8806757926940918,0.05392080917954445,0.06540340185165405
technology,High-End Stores Use Facial Recognition to Spot VIPs...,,20.0,68,2013-07-21,TECH,0.017401760444045067,0.9430010318756104,0.03959718719124794
technology,Amazon Beat Out IBM And Won A $600 Million Cloud Computing Contract With The CIA,,83.0,655,2013-07-21,TECH,0.0149232754483819,0.09254638850688934,0.8925303220748901
technology,NSA head admits the agency made “huge set of mistakes” in 2009,,11.0,62,2013-07-21,TECH,0.8813183307647705,0.10417518019676208,0.014506514184176922
technology,"Crypto-Currency Conference: Bitcoin and the Future of Money - October 23, 2013 - Atlanta",,0.0,6,2013-07-21,TECH,0.03576546907424927,0.9316539764404297,0.03258049488067627
technology,"After backlash Yahoo's Tumblr quietly restores adult, NSFW blogs",,21.0,96,2013-07-22,TECH,0.027466731145977974,0.9184003472328186,0.054132912307977676
technology,Google Now Serves 25 Percent of North American Internet Traffic,,13.0,94,2013-07-22,TECH,0.013732035644352436,0.9066329598426819,0.07963503152132034
gadgets,PSA: Ars is hiring a gadget hound | Ars Technica,,0.0,9,2013-07-22,TECH,0.018888724967837334,0.9316688179969788,0.04944241791963577
technology,This is what a bad quarter for Apple looks like,,3.0,9,2013-07-22,TECH,0.25851359963417053,0.6284965872764587,0.11298983544111252
technology,US tech firms brace for economic fallout from Snowden leaks,,153.0,870,2013-07-22,TECH,0.4683762788772583,0.44881442189216614,0.08280925452709198
technology,"Anti-Rape Underwear With GPS Invented By Indian Students, Emits Up To 82 Shocks",,27.0,87,2013-07-22,TECH,0.07921800017356873,0.8757433295249939,0.0450386106967926
technology,Sign the official petition to prevent UK ISPs censoring the internet further.,,0.0,8,2013-07-22,TECH,0.027481745928525925,0.9317110180854797,0.04080728441476822
technology,Paper-thin touchscreens that could one day be used as interactive wallpaper,,0.0,8,2013-07-22,TECH,0.016548341140151024,0.9382711052894592,0.04518058896064758
technology,"Paper-thin e-skin responds to touch, holds promise for sensory robotics and interactive environments",,1.0,8,2013-07-22,TECH,0.011212239041924477,0.8423153758049011,0.14647233486175537
technology,Online pornography to be blocked automatically in the UK,,1.0,8,2013-07-22,TECH,0.4506468176841736,0.5306191444396973,0.018734049052000046
technology,"As expected, porn industry quick to adopt Google Glass",,1.0,9,2013-07-23,TECH,0.009302932769060135,0.852940559387207,0.13775654137134552
technology,Finland Writes First Crowdsourced Copyright Law,,2.0,9,2013-07-23,TECH,0.04374174401164055,0.9228508472442627,0.03340738266706467
technology,"Subbable lets you subscribe to YouTube channels for a price you pick (yes, $0 is allowed), to support creators making high quality content advertising money wouldn't be able to pay for; you can get perks too! [beta]",,0.0,9,2013-07-23,TECH,0.01804937794804573,0.8210880756378174,0.16086255013942719
technology,Finland Writes History With Crowdsourced Copyright Law,,1.0,9,2013-07-23,TECH,0.06372536718845367,0.9054012894630432,0.03087337128818035
technology,First Google Glass porno made.,,26.0,87,2013-07-23,TECH,0.025885211303830147,0.9356241822242737,0.03849055990576744
technology,"Microsoft would aggressively challenge NSA use of Kinect to spy on living room ""Microsoft has responded to concerns over the potential use of its Kinect technology in relation to NSA's Prism programme, saying that it would 'aggressively challenge in court any attempts to try and force us to do so'""",,76.0,82,2013-07-23,TECH,0.10983315110206604,0.7620406746864319,0.12812620401382446
technology,Really Old News that is Startling New News to Me! - Mobile Phone Networks Detect Stealth Aircraft With Ease!,,0.0,8,2013-07-23,TECH,0.029642902314662933,0.9085589051246643,0.06179817393422127
technology,"""Snowden wants to stay in Russia"" says the Russian lawyer",,1.0,8,2013-07-23,TECH,0.1554681360721588,0.8015182018280029,0.04301365092396736
technology,Crack of mobile SIM card crypto and virtual machine features could let an attacker target and clone a phone,,0.0,8,2013-07-23,TECH,0.025583017617464066,0.9343860745429993,0.04003085941076279
technology,"OpenCL 2.0 provisional spec gets outlined, OpenGL 4.4 released",,4.0,8,2013-07-23,TECH,0.04348032549023628,0.9073744416236877,0.04914519935846329
technology,"A security firm says it has identified the first known malicious use of Android's ""master key"" vulnerability.",,6.0,92,2013-07-24,TECH,0.09435933083295822,0.8762937188148499,0.029347013682127
technology,Google strengthens Android security muscle with SELinux protection,,0.0,9,2013-07-24,TECH,0.015202042646706104,0.9166321754455566,0.06816572695970535
technology,"Michael Hayden on the Effects of Snowden's Whistleblowing: ""Hayden has it backwards -- this is good…companies that have cooperated with the NSA are penalized in the market""",,0.0,9,2013-07-24,TECH,0.027938762679696083,0.9199146628379822,0.05214651674032211
technology,"NVIDIA Demonstrates Logan SoC: &lt; 1W Kepler, Shipping in 1H 2014, More Energy Efficient than A6X?",,0.0,9,2013-07-24,TECH,0.014926282688975334,0.8593525886535645,0.12572118639945984
gadgets,I need help buying a new television set.,"Right now my budget is under $1000 and I'm looking for a TV 42"" or higher.  The sizes I've mostly been looking at are 46""-47"".  I use my TV for streaming video from my desktop, watching bluray, and playing console games.  I just don't know what the best is or what brands are considered better than others.  I've been looking at LG televisions only because my last one was LG and I loved it.  Any advice?",5.0,9,2013-07-24,TECH,0.020065976306796074,0.9027218818664551,0.07721216231584549
gadgets,"Leap Motion Impressions, Input Sanitation, and 3D Gesture Ideas",,2.0,9,2013-07-24,TECH,0.037123970687389374,0.9388245940208435,0.02405148185789585
technology,"OpenOffice 4.0 overhauls user interface, boosts Microsoft compatibility",,25.0,89,2013-07-24,TECH,0.022807590663433075,0.8788302540779114,0.09836210310459137
technology,Texas man charged with running $60M Bitcoin Ponzi scheme,,26.0,81,2013-07-24,TECH,0.027463048696517944,0.9059455990791321,0.06659132242202759
technology,"BMW electric i3 coming next year at $42,225, 80-100 miles radius, 80% charging in 20 minutes",,55.0,80,2013-07-24,TECH,0.018576297909021378,0.8594255447387695,0.1219981387257576
technology,Anti-Piracy Group Will Use New Law to Block The Pirate Bay,,0.0,8,2013-07-24,TECH,0.20967939496040344,0.7689975500106812,0.02132307179272175
technology,A List Of Congressmen Who Voted For &amp; Against The Amendment To Stop NSA Spying,,73.0,959,2013-07-25,TECH,0.04946199059486389,0.8811290860176086,0.06940896809101105
technology,Google Chromecast Annoys TV Executives,,88.0,94,2013-07-25,TECH,0.06768230348825455,0.909670352935791,0.022647356614470482
technology,"Amprius has built a lithium ion battery that can power smartphones for 25% longer than today’s best batteries, by using silicon anode technology, and they have a road-map to increase that to 75% over the next two years.",,24.0,93,2013-07-25,TECH,0.011860601603984833,0.8185310363769531,0.16960832476615906
technology,Feds tell Web firms to turn over user account passwords,,4.0,9,2013-07-25,TECH,0.03509178385138512,0.9381381273269653,0.02677004411816597
technology,Russia Building Floating Nuclear Power Plants,,6.0,9,2013-07-25,TECH,0.013623311184346676,0.9191185832023621,0.06725812703371048
technology,Microsoft pledges Linux boost for Windows Server and Center R2 duo,,1.0,9,2013-07-25,TECH,0.013136242516338825,0.1526549607515335,0.8342088460922241
technology,BlackBerry announces 250 layoffs in R&amp;D,,5.0,9,2013-07-25,TECH,0.030546996742486954,0.8796629309654236,0.08979015797376633
technology,Twitter Apology For Hijacking User Accounts To Promote Ads,,0.0,9,2013-07-25,TECH,0.026953697204589844,0.9428908824920654,0.030155446380376816
technology,"From gold, a new way to control blood clotting: engineers design nanoparticles that can turn the blood-clotting cascade on or off",,0.0,9,2013-07-25,TECH,0.016866039484739304,0.9145045876502991,0.06862937659025192
technology,The NSA is going to continue spying on Americans after the House of Representatives narrowly defeats the amendment today in court,,0.0,9,2013-07-25,TECH,0.3155268728733063,0.6237852573394775,0.06068786606192589
gadgets,World’s first fully 3D printed rifle—made in Canada,,28.0,94,2013-07-26,TECH,0.012970993295311928,0.8083348274230957,0.17869418859481812
technology,Custom Wristbands Boost Local Charity's Profit by 1900%,,0.0,91,2013-07-26,TECH,0.015599926002323627,0.4207260310649872,0.5636740326881409
gadgets,A Modern Gandalf Pipe?,,3.0,9,2013-07-26,TECH,0.03454330191016197,0.9096453189849854,0.05581138655543327
technology,"The lost isle of Jura: According to Google Maps, this 141-square-mile Scottish island doesn't exist",,2.0,9,2013-07-26,TECH,0.07867475599050522,0.8946887254714966,0.026636509224772453
technology,"Microsoft's Xbox One devkit policy is ""wonderful"", says Minecraft creator, Notch.",,92.0,86,2013-07-26,TECH,0.02510695345699787,0.9208465218544006,0.05404646694660187
gadgets,Connected cars increase efficiency by 273%,,0.0,81,2013-07-26,TECH,0.010852474719285965,0.31761088967323303,0.6715366840362549
technology,Jeff Bezos Doesn't Care What You Think About Amazon's Quarterly Earnings,,4.0,8,2013-07-26,TECH,0.09714397042989731,0.8793723583221436,0.023483704775571823
technology,"Volvo's new 'tent' electric charger, no really (x-post from /r/Gadgets)",,4.0,8,2013-07-26,TECH,0.02321280725300312,0.9180222153663635,0.0587649904191494
technology,"MaskMe helps you cover your tracks, avoid online annoyances",,2.0,8,2013-07-26,TECH,0.023233234882354736,0.9014601707458496,0.07530656456947327
technology,Sky's Now TV box is a £9.99 Roku clone that streams iPlayer and more,,3.0,8,2013-07-26,TECH,0.020259663462638855,0.915342390537262,0.064397893846035
technology,Court stops scientists from publishing codes that could wirelessly lockpick Porsches,,19.0,93,2013-07-27,TECH,0.12675105035305023,0.8452332615852356,0.02801566757261753
technology,An automated phlebotomist (robot blood-sample taking),,1.0,9,2013-07-27,TECH,0.025592772290110588,0.9352162480354309,0.039191048592329025
technology,What Wi-Fi Would Look Like If We Could See It,,3.0,9,2013-07-27,TECH,0.014805041253566742,0.8927561044692993,0.09243883937597275
technology,The Brave New World of Unmanned Vehicles,,0.0,9,2013-07-27,TECH,0.019095761701464653,0.8879401683807373,0.09296403080224991
technology,Google floods market with hardware,,0.0,9,2013-07-27,TECH,0.8190141320228577,0.16148234903812408,0.019503552466630936
technology,Microsoft's Windows NT turns 20,,11.0,8,2013-07-27,TECH,0.06496080756187439,0.7646461725234985,0.17039301991462708
technology,computer repair sacramento,,0.0,8,2013-07-27,TECH,0.0461360327899456,0.9098332524299622,0.04403068870306015
technology,"Holograms, bio-sensors will change how you shop: Intel - Behind the Storefront",,1.0,7,2013-07-27,TECH,0.03578254207968712,0.9126362204551697,0.05158121883869171
technology,3D-Printed Rocket Parts Excel in NASA Tests,,0.0,7,2013-07-27,TECH,0.02653336152434349,0.9344721436500549,0.038994453847408295
technology,How super computers solve supersize problems.,,1.0,7,2013-07-27,TECH,0.04805605486035347,0.905256450176239,0.046687450259923935
technology,Edward Snowden's not the story. The fate of the internet is,,33.0,917,2013-07-28,TECH,0.05308553948998451,0.9106665849685669,0.03624783083796501
technology,Virus tricks man into turning himself in for child porn,,31.0,84,2013-07-28,TECH,0.18693478405475616,0.7806349396705627,0.032430220395326614
technology,"Tough Copyright Laws Chill Innovation, Tech Companies Warn Lawmakers -- ""The CCIA, which includes Google, Facebook and Microsoft as members, further points out that the devastating piracy numbers reported by the copyright industry often lack objectivity, and sometimes deserve the label 'fiction.'""",,2.0,82,2013-07-28,TECH,0.33429810404777527,0.6433455944061279,0.022356273606419563
technology,Edward Snowden's not the story. The fate of the internet is - The press has lost the plot over the Snowden revelations. The fact is that the net is finished as a global network and that US firms' cloud services cannot be trusted,,0.0,8,2013-07-28,TECH,0.05076466500759125,0.9196833968162537,0.029551975429058075
technology,Users Continue to Double-Click Online,,2.0,8,2013-07-28,TECH,0.06572999805212021,0.9116068482398987,0.022663205862045288
technology,"Dad's perfect gift for son: A 737 cockpit simulator in his bedroom | 'Laurent Aigon knew exactly what his kid wanted. So, despite not being a pilot himself -- nor an engineer -- he orders the parts online and begins to build.'",,93.0,785,2013-07-28,TECH,0.016826268285512924,0.8799167275428772,0.1032569482922554
technology,NSA spying pales in comparison to European efforts.,,15.0,73,2013-07-28,TECH,0.030446216464042664,0.8491066098213196,0.12044718861579895
