subreddit,title,selftext,num_comments,score,created_utc,stock/sector,neg,neu,pos
technology,Wikipedia rolls out the new WYSIWYG editor! This will make editing the free encyclopedia far more accessible to non-technical users,,31.0,98,2013-07-01,TECH,0.020931484177708626,0.9204482436180115,0.05862026289105415
technology,Solution how to make NSA mass surveillance go blind - Diffie-Hellman key exchange with the help of elliptic curve cryptography.,,163.0,947,2013-07-01,TECH,0.028200503438711166,0.9269255995750427,0.044873952865600586
technology,Scientists develop the first telescopic contact lens.,,0.0,9,2013-07-01,TECH,0.015567746013402939,0.9367575645446777,0.04767466336488724
technology,D-Wave’s quantum optimizer might be quantum after all,,1.0,9,2013-07-01,TECH,0.027007408440113068,0.9216526746749878,0.051339857280254364
technology,"This Glove Could Help Deaf-Blind People Communicate With Anyone, Anywhere",,1.0,9,2013-07-01,TECH,0.025263797491788864,0.9164145588874817,0.05832166597247124
technology,Saudi Arabia court jails seven Facebook cyber activists,,2.0,9,2013-07-01,TECH,0.8496403694152832,0.1272791624069214,0.023080436512827873
technology,"Don Mattrick, ex-Microsoft Interactive Entertainment Business lead, now CEO of Zynga.",,2.0,8,2013-07-01,TECH,0.02409764751791954,0.9314447045326233,0.044457584619522095
technology,Microsoft killing off TechNet subscriptions,,1.0,8,2013-07-01,TECH,0.02845548465847969,0.9360488057136536,0.03549576550722122
technology,The NSA is watching. So are Google and Facebook,,3.0,8,2013-07-01,TECH,0.06259351968765259,0.9134743213653564,0.02393222786486149
gadgets,Apple iWatch Confirmed - Seeks Trademark in Japan Patent Office,,4.0,8,2013-07-01,TECH,0.12769241631031036,0.8502587080001831,0.02204887382686138
technology,"The stock market likes the new Zynga CEO, but it’s wrong. Here is why",,4.0,9,2013-07-02,TECH,0.020705701783299446,0.8596335649490356,0.11966069787740707
technology,"W3C Chief: To Prevent Parts Of The Web From Being Walled Off, We Need To Wall It Off Ourselves",,3.0,9,2013-07-02,TECH,0.06281240284442902,0.9033206105232239,0.03386702015995979
technology,AT&amp;T Says It Can Accurately Track P2P-Shared Content,,39.0,88,2013-07-02,TECH,0.027750054374337196,0.9259122014045715,0.04633777216076851
technology,"Appeal filed to free AT&amp;T hacker Weev, who never leaked the vulnerability he discovered",,12.0,82,2013-07-02,TECH,0.04249934107065201,0.9172496199607849,0.040251050144433975
technology,Telescopic contact lens lets you zoom in on the world,,0.0,8,2013-07-02,TECH,0.02384551428258419,0.9372865557670593,0.038867853581905365
technology,Tesla Versus The Rent Seekers: The Battle That Sums Up 2013,,1.0,76,2013-07-02,TECH,0.04974915832281113,0.7670774459838867,0.18317340314388275
technology,Researchers at MIT have created a new system that transmits a low-power Wi-Fi signal that reflects off of people and can be used to the track them through walls and closed doors.,,26.0,75,2013-07-02,TECH,0.023280084133148193,0.9293984174728394,0.04732145741581917
gadgets,How a total n00b mined $700 in bitcoins,,20.0,70,2013-07-02,TECH,0.029268614947795868,0.9083995223045349,0.06233188882470131
technology,Laser-scanning technology helped scientists peer at ancient temples buried under jungle.,,1.0,7,2013-07-02,TECH,0.016603462398052216,0.78326016664505,0.2001364380121231
gadgets,"Best Buy selling Pebble smartwatch online now, in stores July 7",,11.0,67,2013-07-02,TECH,0.04492208734154701,0.916504979133606,0.03857290744781494
technology,"Doug Engelbart, inventor of the mouse and early GUI's, has passed away",,1.0,9,2013-07-03,TECH,0.07060009241104126,0.9046512842178345,0.024748612195253372
technology,Mastercard and Visa Start Banning VPN Providers,,2.0,9,2013-07-03,TECH,0.1104741021990776,0.8647748231887817,0.02475106157362461
technology,Book News: Authors Lose Class-Action Status In Google Books Case : NPR,,3.0,9,2013-07-03,TECH,0.42204549908638,0.5545338988304138,0.02342061884701252
technology,We are a team of citizen scientist researchers aiming to cure antibiotic resistant gonorrhea!,,2.0,9,2013-07-03,TECH,0.02335359714925289,0.8995587229728699,0.07708775252103806
technology,Doug Engelbart has died,,5.0,85,2013-07-03,TECH,0.03759179636836052,0.9177685976028442,0.04463959485292435
technology,Tesla Motors White House petition passes 100K signatures — a small win for electric cars?,,64.0,832,2013-07-03,TECH,0.015948256477713585,0.42339953780174255,0.5606521964073181
technology,Out-of-Control Automatic Book Pricing—used 2nd Grade math book selling for $117 Trillion.,,10.0,8,2013-07-03,TECH,0.032209061086177826,0.9135759472846985,0.05421499162912369
technology,"Prepare for .brand, .luxury, .thing, .futbol: individuals &amp; organizations can now apply for their own generic top level domain name.",,14.0,8,2013-07-03,TECH,0.018713679164648056,0.9497633576393127,0.03152303397655487
technology,EU and Japan join forces to tackle data explosion and build 100Gbps internet,,1.0,8,2013-07-03,TECH,0.015453065745532513,0.8128336071968079,0.17171329259872437
gadgets,"Toshiba Excite Pro - tegra 4 tablet, ships in 2 weeks, $50 off until the 8th",,14.0,8,2013-07-03,TECH,0.03165037930011749,0.915867269039154,0.05248228833079338
technology,Android master key discovered that makes ANY Android device sold in the last 4 years vulnerable to malware and data mining.,,159.0,916,2013-07-04,TECH,0.04778695106506348,0.8863321542739868,0.06588096171617508
technology,Worlds 4th largest SSD vendor might surprise you… it’s the big G,,0.0,9,2013-07-04,TECH,0.05580104887485504,0.7812337279319763,0.16296522319316864
technology,'Master key' to Android phones uncovered,,2.0,8,2013-07-04,TECH,0.014142046682536602,0.9264591932296753,0.05939876660704613
gadgets,BB 10.2 Update to Beat Competition to Quick-Reply Notification,,0.0,8,2013-07-04,TECH,0.01698029227554798,0.7914535403251648,0.19156624376773834
technology,"Reddit, Mozilla, EFF and more join July 4th anti-NSA protests",,15.0,775,2013-07-04,TECH,0.03707239404320717,0.9118297696113586,0.0510978102684021
technology,Computer mouse inventor Douglas Engelbart dies,,3.0,7,2013-07-04,TECH,0.03293529897928238,0.9225295186042786,0.04453514888882637
technology,"""The European airline industry has seen the future of aviation. It’s sleek and organic, carries a sextet of turbines, and its powertrain works a lot like the Chevrolet Volt.""",,21.0,65,2013-07-04,TECH,0.019852180033922195,0.9007682800292969,0.07937951385974884
technology,Astonishing Graphic Shows What You Can Learn From 6 Months Of Someone's Phone Metadata,,39.0,620,2013-07-04,TECH,0.04201074689626694,0.8840903043746948,0.07389889657497406
technology,Dell explores wearable computers as its conventional market shrinks,,1.0,6,2013-07-04,TECH,0.02931085042655468,0.9123861789703369,0.058302994817495346
technology,"""If PRISM Is Good Policy, Why Stop With Terrorism?"" ""...the actual threat, the real danger, is a person w/ good intentions who believes that their draconian actions are morally justified &amp; prudent.""",,0.0,6,2013-07-04,TECH,0.026273394003510475,0.8861028552055359,0.08762382715940475
technology,"EU votes to support suspending U.S. data sharing agreements, including passenger flight data",,53.0,980,2013-07-05,TECH,0.04131970927119255,0.41513827443122864,0.5435420274734497
technology,German government cancels data preservation after PRISM scandal,,12.0,94,2013-07-05,TECH,0.33794841170310974,0.6135051250457764,0.0485464371740818
technology,"California's Open Access Bill Encounters A Hurdle, But Gathers Support",,0.0,9,2013-07-05,TECH,0.1981675624847412,0.1527569741010666,0.6490755081176758
technology,Researchers build an all-optical transistor: an optical switch that can be turned on by a single photon could point toward new designs for both classical and quantum computers,,1.0,89,2013-07-05,TECH,0.00980816688388586,0.7877905368804932,0.20240134000778198
technology,Jay-Z's 100th problem: Hackers busted his Android app,,19.0,87,2013-07-05,TECH,0.05587541684508324,0.896151602268219,0.04797293618321419
gadgets,"Buy a machine that tells you how many eggs you have left over the internet, or just spend an extra $3 is your not sure.",,77.0,84,2013-07-05,TECH,0.0304355900734663,0.8993310332298279,0.07023340463638306
technology,Optical transistor switches states by trapping a single photon,,0.0,8,2013-07-05,TECH,0.020046280696988106,0.9341022372245789,0.045851487666368484
technology,"With wearable computing becoming a reality, tech companies hiring fashionistas",,1.0,8,2013-07-05,TECH,0.019565632566809654,0.8976395130157471,0.08279486000537872
technology,"Now Corning, the maker of Gorilla Glass, is working on anti-glare glass that also incorporates antimicrobial tech that kills germs and viruses...",,11.0,70,2013-07-05,TECH,0.03043482080101967,0.9061095118522644,0.06345567852258682
technology,"People pay hundreds for ""Digital Detox"" camp.",,9.0,7,2013-07-05,TECH,0.10366795212030411,0.8545346856117249,0.04179735481739044
technology,These university researchers have developed a thruster that will give us access to deep space destinations like Europa! But now they need our support to construct the spacecraft. Check out the Kickstarter project if you love exploration!,,8.0,99,2013-07-06,TECH,0.014648218639194965,0.8507280349731445,0.1346237063407898
technology,AT&amp;T To Sell Location Data: Here's How to Stop It.,,12.0,99,2013-07-06,TECH,0.033306512981653214,0.9416036009788513,0.025089900940656662
technology,"France also scoops up phone, Internet metadata on its citizens",,8.0,91,2013-07-06,TECH,0.014922230504453182,0.8633344173431396,0.12174330651760101
technology,"Should We Fear ""the End of Work""? | PBS NewsHour",,178.0,91,2013-07-06,TECH,0.07316289842128754,0.8766283392906189,0.05020881071686745
technology,oxygen injection keeps you alive while not breathing,,2.0,9,2013-07-06,TECH,0.01710759662091732,0.8526313304901123,0.13026107847690582
technology,"Kodak announces new cell phone for 2014, The Instamatic",,3.0,9,2013-07-06,TECH,0.01566479541361332,0.8903529644012451,0.09398229420185089
technology,NSA whistleblower Edward Snowden offered asylum in Venezuela,,0.0,9,2013-07-06,TECH,0.19481107592582703,0.7770311236381531,0.028157813474535942
technology,"NSA introduced a cryptographic backdoor into a random number generator, threatening even the most secure cryptographic ciphers that use it",,48.0,823,2013-07-06,TECH,0.022529449313879013,0.9364961385726929,0.04097440093755722
technology,Google Glass app lets Tesla owners check on cars from afar,,13.0,74,2013-07-06,TECH,0.014041304588317871,0.9243496656417847,0.06160905957221985
technology,Human Liver Created from Stem Cells,,7.0,7,2013-07-06,TECH,0.019728612154722214,0.9016865491867065,0.07858490198850632
gadgets,"XE7 Teardown reveals upcoming music player, new voice commands, and more for Google Glass.",,4.0,98,2013-07-07,TECH,0.02150278352200985,0.9174715876579285,0.061025623232126236
technology,Disruptions: How Driverless Cars Could Reshape Cities,,5.0,9,2013-07-07,TECH,0.03842820227146149,0.9128774404525757,0.04869438335299492
technology,"And how would you like to pay, sir – cash, credit card, or Bitcoin?",,5.0,9,2013-07-07,TECH,0.02315855398774147,0.8861687183380127,0.09067275375127792
technology,Tech companies are cooperating with US intelligence agencies more than you think,,56.0,895,2013-07-07,TECH,0.20079681277275085,0.735901951789856,0.06330128014087677
technology,""" Drone it yourself"" lets you create a drone from any object",,13.0,86,2013-07-07,TECH,0.024862561374902725,0.937913179397583,0.03722424805164337
technology,Japanese railway company plans to sell data from e-ticket records,,6.0,80,2013-07-07,TECH,0.03543703258037567,0.9264928698539734,0.038070086389780045
gadgets,All the best features of current mobile phones combined into one beautiful mockup device.,,114.0,75,2013-07-07,TECH,0.014815873466432095,0.9153555035591125,0.0698285922408104
technology,Agreements with private companies protect U.S. access to cables’ data for surveillance,,0.0,7,2013-07-07,TECH,0.016528122127056122,0.9224789142608643,0.06099293753504753
technology,The NSA's mass and indiscriminate spying on Brazilians | Glenn Greenwald,,1.0,7,2013-07-07,TECH,0.01797475852072239,0.8973283171653748,0.084696926176548
technology,Disruptions: How Driverless Cars Could Reshape Cities,,69.0,68,2013-07-07,TECH,0.03842820227146149,0.9128774404525757,0.04869438335299492
technology,"PRISM Exposé and the threat of industrial espionage from US hosting providers has lead to significant decrease in the use of US-controlled cloud services, such as AWS, Azure and Dropbox.",,108.0,961,2013-07-08,TECH,0.038682468235492706,0.8956748247146606,0.06564274430274963
gadgets,"Staples Drops Nexus 7 32GB To $199.99 ($50 Off) And 16GB To $179.99 ($20 Off), Clearing Inventory For A New Nexus?",,23.0,91,2013-07-08,TECH,0.06718885153532028,0.885841965675354,0.04696924239397049
technology,Amazing Screen Caps from Google Street View as discovered by Jon Rafman,,5.0,9,2013-07-08,TECH,0.02955368161201477,0.9052916169166565,0.06515461206436157
technology,Government to assign email addresses to all Iranians,,7.0,9,2013-07-08,TECH,0.04854528605937958,0.92448890209198,0.026965854689478874
technology,Study: Reading novels makes us better thinkers,,14.0,82,2013-07-08,TECH,0.013076038099825382,0.8637715578079224,0.12315244227647781
technology,Brazil Wants UN to Help Safeguard Internet,,11.0,80,2013-07-08,TECH,0.013893681578338146,0.8057051301002502,0.18040120601654053
technology,MIT Media Lab maps your connections - Immersion: a people-centric view of your email life,,1.0,8,2013-07-08,TECH,0.025790853425860405,0.9422955513000488,0.03191355988383293
technology,Solar panels are getting thinner,,0.0,8,2013-07-08,TECH,0.04841964319348335,0.5479738712310791,0.40360650420188904
technology,The NSA/GCHQ metadata reassurances are breathtakingly cynical,,0.0,79,2013-07-08,TECH,0.048529963940382004,0.9101316928863525,0.04133836552500725
technology,Internet big boys take aim at Singapore's 'regressive' new rules,,2.0,72,2013-07-08,TECH,0.0313088595867157,0.9203720092773438,0.04831913858652115
technology,Elon Musk (Tesla Founder) Developing high speed travel tube. Get LA to NYC in 1hr for $100,,226.0,967,2013-07-09,TECH,0.010344477370381355,0.8206523060798645,0.1690032035112381
technology,Why public libraries should follow Chicago's lead and build maker labs,,116.0,901,2013-07-09,TECH,0.008485017344355583,0.7966415286064148,0.19487346708774567
technology,Microsoft keeps selling the same idea and they keep failing at it.,,18.0,9,2013-07-09,TECH,0.12081611901521683,0.8141067624092102,0.06507709622383118
technology,Giant Exoskeleton Mimics Your Every Move,,6.0,9,2013-07-09,TECH,0.0342007577419281,0.9183641076087952,0.04743511974811554
technology,France drops controversial 'Hadopi law' (a French anti-piracy law that would disconnect those suspected of copyright infringement) after spending millions,,4.0,82,2013-07-09,TECH,0.39017927646636963,0.5768231153488159,0.03299754112958908
technology,Phone companies no longer want new landline customers due to costs associated with maintaining a dying technology.,,0.0,8,2013-07-09,TECH,0.9165457487106323,0.06998550891876221,0.013468842022120953
technology,"US agency baffled by modern technology, destroys mice to get rid of viruses",,1.0,8,2013-07-09,TECH,0.02772369608283043,0.9129114151000977,0.05936484783887863
technology,Maplin becomes first high street retailer to sell 3D printers,,1.0,8,2013-07-09,TECH,0.01384775061160326,0.7263653874397278,0.25978684425354004
technology,Jelly Bean Finally Surpasses Gingerbread on Android,,17.0,8,2013-07-09,TECH,0.033812325447797775,0.8622862696647644,0.10390140861272812
technology,Seeing double: TSMC adopts new lithography technique to push Moore’s law to 20nm,,1.0,8,2013-07-09,TECH,0.02489027939736843,0.9005455374717712,0.074564129114151
technology,Parts installed “upside down” caused Russian rocket to explode last week,,209.0,975,2013-07-10,TECH,0.8692099452018738,0.1074862852692604,0.023303745314478874
technology,"Chris Poole Is The Creator Of One Of The World's Biggest And Most Powerful Web Sites [4chan], And It Is Very Strange That He Is Not Insanely Rich",,50.0,91,2013-07-10,TECH,0.04618623107671738,0.9071493744850159,0.04666433855891228
gadgets,"A friend showed this site that is building a ""mint.com for gadgets"". The idea is to help us manage our tech gear better, what do you think?",,3.0,9,2013-07-10,TECH,0.010330780409276485,0.8171961903572083,0.1724730134010315
technology,Mobile Privacy: 'You can't see the contract until after we've done a credit check',,1.0,9,2013-07-10,TECH,0.10525280982255936,0.8437784910202026,0.050968676805496216
technology,"5D optical memory in nanostructured quartz glass could lead to unlimited lifetime data storage. Includes 360 TB/disc data capacity, thermal stability up to 1000°C and a lifetime of over a million years.",,2.0,9,2013-07-10,TECH,0.014340249821543694,0.9102500677108765,0.07540971785783768
technology,"3-D Printers At Harold Washington Library Debut, Chicago Opens 'Maker Space' To Public (VIDEO)",,1.0,9,2013-07-10,TECH,0.019302848726511,0.9183031320571899,0.06239406764507294
technology,NSA is quietly writing code for Google’s Android OS,,245.0,886,2013-07-10,TECH,0.06571069359779358,0.899355411529541,0.03493385389447212
technology,We’re watching: malls track shopper’s cell phone signals to gather marketing data,,1.0,8,2013-07-10,TECH,0.027455557137727737,0.9305699467658997,0.04197443649172783
technology,"Apple guilty of conspiring to raise ebook prices, federal judge rules",,1.0,8,2013-07-10,TECH,0.12323927879333496,0.8450123071670532,0.03174842894077301
technology,"So, You Want to Hide from the NSA? Your Guide to the Nearly Impossible - Philip Bump",,0.0,8,2013-07-10,TECH,0.05185898020863533,0.9079070687294006,0.040233954787254333
technology,"Nokia unveils Lumia with 41 mpx camera, lossless zoom, dual capture, stereo audio recording and optical image stabilization",,387.0,955,2013-07-11,TECH,0.07935402542352676,0.8949154615402222,0.02573053538799286
gadgets,"LG Creates World's Thinnest 1080p LCD – 5.2-Inches Diagonal, 2.2mm Thick, And A Tiny Bezel",,0.0,9,2013-07-11,TECH,0.037150003015995026,0.8965239524841309,0.0663260743021965
technology,"Next Mars mission in 2020 to search for signs of life, bring samples back to Earth",,1.0,9,2013-07-11,TECH,0.015427768230438232,0.8949880003929138,0.08958418667316437
technology,SOPA Should Have Ended Backroom Deals About Copyrights &amp; Patents; So Why Is TPP Still Secret?,,1.0,88,2013-07-11,TECH,0.05005614086985588,0.8909936547279358,0.058950211852788925
technology,HITECH act passed in 2009 may allow the NSA to collect medical records,,15.0,85,2013-07-11,TECH,0.018398400396108627,0.9045014381408691,0.07710009813308716
gadgets,Video eyewear: waste my money?,"I was really interested in purchasing video eyewear, just to use since I travel quite often and I would love to have that on the plane. But i'm also quite skeptical on the compatibility with my Android. Any suggestions? I am running Android 2.3 but will be upgrading to Android 4.1 pretty soon. price isn't much of an issue, within reason. Thank to!",1.0,8,2013-07-11,TECH,0.02128099836409092,0.9297104477882385,0.04900861531496048
technology,Revealed: how Microsoft handed the NSA access to encrypted messages,,0.0,8,2013-07-11,TECH,0.01884402334690094,0.9236552119255066,0.057500772178173065
gadgets,"'Charlieplexing': multiplexing large LED arrays with fewer data lines. Boost for Arduino, RaspPi &amp; other small controllers.",,0.0,8,2013-07-11,TECH,0.021000413224101067,0.8899252414703369,0.08907432854175568
technology,Telcos 'Volunteered' To Hand Over Data To NSA... And Got Over $100 Million For It,,55.0,769,2013-07-11,TECH,0.01378833781927824,0.8371536731719971,0.1490580290555954
gadgets,Nokia Lumia 1020: a 41-megapixel Windows Phone,,1.0,7,2013-07-11,TECH,0.019506271928548813,0.924798846244812,0.055694837123155594
technology,Australian Telco Telstra storing data on behalf of US government,,12.0,99,2013-07-12,TECH,0.03986164182424545,0.9371914863586426,0.022946875542402267
technology,How Edward Snowden Sends His Ultra-Sensitive Emails,,27.0,92,2013-07-12,TECH,0.034616097807884216,0.9214327931404114,0.043951090425252914
technology,"Here's the flexible E Ink screen that could be in the 2014 Kindle -- ""Expect some incremental improvements to new e-ink e-readers this holiday season, but superslim designs are probably a year or two away.""",,3.0,9,2013-07-12,TECH,0.017955360934138298,0.895423948764801,0.0866207405924797
technology,The father of the Smart-Grid is pretty disappointed with the US Power Grid.,,0.0,9,2013-07-12,TECH,0.34778448939323425,0.4331856966018677,0.21902985870838165
technology,"Meet DARPA’s real-world Terminator, Atlas",,7.0,9,2013-07-12,TECH,0.04130426049232483,0.9283879399299622,0.030307838693261147
technology,A Game That Deals in Personal Data - A group of Web developers in Austria has introduced an online game called Data Dealer that aims to make the business of consumer profiling more transparent.,,0.0,8,2013-07-12,TECH,0.011351575143635273,0.8668482303619385,0.12180016934871674
technews,"Boston Dynamics shows off Atlas, humanoid robot from the creators of Big Dog",,1.0,8,2013-07-12,TECH,0.02446873113512993,0.9102978706359863,0.06523335725069046
technology,"""NLee the Engineer"" The best REAL reviewer on Amazon. With the best, most in depth, technical, and statistically backed reviews ever.",,1.0,8,2013-07-12,TECH,0.01218982134014368,0.824726402759552,0.1630837619304657
technology,BBC News - NSA's access to Microsoft's services detailed,,1.0,8,2013-07-12,TECH,0.021665075793862343,0.9471421837806702,0.031192734837532043
technology,"NSA Even Spies on Google Maps Searches, Documents Suggest",,1.0,8,2013-07-12,TECH,0.05716366320848465,0.9167004227638245,0.02613597735762596
technology,When People From Oliver Stone To Famous Ex-Porn Stars Are Speaking Out About NSA Spying...,,95.0,910,2013-07-13,TECH,0.04769708216190338,0.8811217546463013,0.07118116319179535
technology,There's A Guy Suing Apple Just Because Its Devices Can Display Porn,,9.0,9,2013-07-13,TECH,0.019334087148308754,0.9177464246749878,0.06291946023702621
technology,Estonia publishes its e-voting source code on GitHub,,116.0,831,2013-07-13,TECH,0.02579364739358425,0.9290469884872437,0.04515930265188217
technology,"Live Silk Worms Guided By Computer ""3D Print"" A Dome",,2.0,8,2013-07-13,TECH,0.03188445419073105,0.9401538372039795,0.027961740270256996
technology,"We downloaded 240,000 posts from Reddit and here is what we did with it. (this is our initial Prototype)",,32.0,71,2013-07-13,TECH,0.04071510210633278,0.9165844917297363,0.04270043596625328
gadgets,Keeping up with the latest tablets/convertibles/etc,I'm trying to find a website that helps me stay up to date with new or upcoming devices. Any suggestions?,5.0,7,2013-07-13,TECH,0.016277465969324112,0.9040674567222595,0.07965509593486786
gadgets,pocket phone jammer,,6.0,7,2013-07-13,TECH,0.06634677946567535,0.8735287189483643,0.060124557465314865
technology,"Amar Bose, founder of Bose Corp, dies at 83.",,14.0,68,2013-07-13,TECH,0.22492672502994537,0.7337191700935364,0.04135417565703392
technology,Elon Musk's Dream Is Coming True: Vacuum Tube Company Is Building A 3-Mile 'Hyperloop' Transport System (TSLA),,16.0,67,2013-07-13,TECH,0.020030435174703598,0.9063863158226013,0.07358327507972717
gadgets,"Nokia Lumia 1020′s Pro Camera app coming to Lumia 920, 925 and 928",,0.0,6,2013-07-13,TECH,0.019226273521780968,0.8757181763648987,0.10505551099777222
technology,Awesome Stuff: Keeping Your Online Activities Private Suddenly More Interesting,,11.0,97,2013-07-14,TECH,0.023366721346974373,0.8993814587593079,0.07725181430578232
gadgets,"Just bought a Nexus 10, what are some of your must-have apps?","I want your completely biased opinions, no matter how petty. Price is an issue, but if you think it is worth it then feel free to recommend it. 

Also, I ask that you use the upvote and downvote system if you like or dislike an app someone recommends.

Here is the obligatory thank you for taking the time out of your busy day to read and hopefully reply.",11.0,9,2013-07-14,TECH,0.04089822620153427,0.9132314324378967,0.04587038233876228
technology,Analysis: After five years of the App Store - Apple is the biggest winner,,4.0,9,2013-07-14,TECH,0.03715759143233299,0.8116285800933838,0.1512138694524765
technology,Inside the solar-powered plane that crossed the US,,0.0,7,2013-07-14,TECH,0.01864202506840229,0.8497025966644287,0.13165536522865295
technology,The coating that makes iPhones touch sensitive is running out,,7.0,7,2013-07-14,TECH,0.05205054581165314,0.8631514310836792,0.08479807525873184
technology,Russia's solution to NSA spying? The humble typewriter,,23.0,68,2013-07-14,TECH,0.03874800726771355,0.9195029735565186,0.04174903780221939
technology,Another botched Windows patch: MS13-057/KB 2803821/KB 2834904,,23.0,58,2013-07-14,TECH,0.026638779789209366,0.8884494304656982,0.08491184562444687
technology,Mazda has been experimenting with laser ignition.,,154.0,569,2013-07-14,TECH,0.019544225186109543,0.8527689576148987,0.12768682837486267
technology,"Leaked video shows Google-owned Motorola Moto-X will come with Xbox One-like ""Always On"" listening feature for easier voice command access",,143.0,550,2013-07-14,TECH,0.011727603152394295,0.894036054611206,0.0942363440990448
technology,Will a phone with a world-beating camera arrest Nokia’s decline?,,102.0,53,2013-07-14,TECH,0.04240892082452774,0.9081018567085266,0.049489207565784454
technology,"While Microsoft, Google, Facebook and other tech firms have downplayed their participation in government spying programs, U.S. and international companies should worry about access to their data in the cloud",,1.0,91,2013-07-15,TECH,0.4810165762901306,0.5002908110618591,0.01869260147213936
