subreddit,title,selftext,num_comments,score,created_utc,stock/sector,neg,neu,pos
gadgets,Wireless road charging to EVs could become a reality in the relatively near future,,1.0,8,2013-04-15,TECH,0.008496477268636227,0.7812227606773376,0.21028076112270355
technology,Chinese scammers turn fake parts into real iPhones,,0.0,8,2013-04-15,TECH,0.04031415656208992,0.9200688600540161,0.039616961032152176
technology,Dish Network Makes $25.5 Billion Bid for Sprint Nextel,,19.0,79,2013-04-15,TECH,0.010631142184138298,0.7860322594642639,0.20333658158779144
technology,"After over 100k complaints in 90 days about software changing browser settings, Google details hardened ad policies",,0.0,7,2013-04-15,TECH,0.03328850865364075,0.9249796271324158,0.04173187538981438
technology,20 Dramatic Predictions for 2030,,1.0,7,2013-04-15,TECH,0.02889072336256504,0.80290287733078,0.16820643842220306
technology,BBC News - Google offers deal to end Brussels anti-trust,,0.0,7,2013-04-15,TECH,0.03136179968714714,0.8693494200706482,0.09928880631923676
technology,You think Google Fiber is fast? Japanese company So-net announced 2Gbps down/1Gbps up for 4980 yen (~$50 USD) a month.,,316.0,926,2013-04-16,TECH,0.0242849662899971,0.871435284614563,0.10427971929311752
technology,Trader admits fraud in $1 billion Apple stock scheme,,16.0,90,2013-04-16,TECH,0.3848331868648529,0.585028886795044,0.030137933790683746
technology,"TIL: Google Glass doesn't come with headphones, instead it uses Bone Conduction to pump sound directly into your skull.",,6.0,9,2013-04-16,TECH,0.030707530677318573,0.9299020171165466,0.039390403777360916
technology,"Google reveals Glass specs: one-day battery life, bone conduction audio, 16GB storage",,5.0,9,2013-04-16,TECH,0.02597516030073166,0.9314612746238708,0.04256352037191391
technology,New App Prevents Icelanders from Sleeping With their Relatives,,27.0,84,2013-04-16,TECH,0.7023440599441528,0.2691611051559448,0.02849479578435421
technology,"White House issues veto threat against CISPA, citing privacy concerns",,5.0,82,2013-04-16,TECH,0.7987849712371826,0.1773884892463684,0.023826580494642258
technology,Windows 8.1 will include boot to desktop option to bypass the Start Screen,,48.0,82,2013-04-16,TECH,0.027359316125512123,0.9415714740753174,0.031069252640008926
technology,CISPA Sponsor Mike Rogers Claims Opposition Is '14 Year Olds In Their Basement',,11.0,81,2013-04-16,TECH,0.26505008339881897,0.6763489246368408,0.05860106274485588
technology,Stakes high for White House on CISPA,,0.0,8,2013-04-16,TECH,0.04980909451842308,0.8346654176712036,0.11552545428276062
technology,Why iTunes U Isn't Revolutionizing Education Despite having over 1 billion downloads,,3.0,8,2013-04-16,TECH,0.01993977092206478,0.8489525318145752,0.1311076432466507
technology,"Great solution to expensive cloud storage is on the horizon, if we support it.",,10.0,9,2013-04-17,TECH,0.04350888729095459,0.8263972997665405,0.13009381294250488
technology,Google comments on software patents: Applications should have an algorithm. Purely functional applications should be rejected.,,1.0,9,2013-04-17,TECH,0.056209273636341095,0.926470935344696,0.017319809645414352
gadgets,Are there any 120Hz TVs that actually accept a 120Hz input?,"It'd be perfect for 24Hz, 30Hz, and 60Hz playback. I've never seen one though.",94.0,89,2013-04-17,TECH,0.028215130791068077,0.9292054772377014,0.04257933422923088
technology,Tor calls for help as its supply of bridges falters: Bridges help users in countries like China and Iran access the network,,16.0,81,2013-04-17,TECH,0.009953228756785393,0.7593979835510254,0.23064877092838287
technology,"Next Stop For Google Fiber is Provo, Utah?",,35.0,80,2013-04-17,TECH,0.02225840464234352,0.913422167301178,0.06431937217712402
technology,"Google to acquire Provo, Utah’s fiber, transform it into Google Fiber",,5.0,8,2013-04-17,TECH,0.016189735382795334,0.9240544438362122,0.05975578725337982
gadgets,Airplane Speakers of nature’s inspiration,,5.0,8,2013-04-17,TECH,0.031381525099277496,0.9194188117980957,0.049199625849723816
technology,Georgina Real Estate,,47.0,8,2013-04-17,TECH,0.03510560840368271,0.9396228790283203,0.025271529331803322
technology,Graphene enhanced Li-Ion batteries charge in 20 seconds,,1.0,8,2013-04-17,TECH,0.018487347289919853,0.9356955885887146,0.045817069709300995
technology,House of Representatives passes CISPA,,8.0,7,2013-04-17,TECH,0.0308622308075428,0.7942977547645569,0.17483997344970703
technology,"CISPA passed in the House; congressman says it will prevent bombings like in Boston, in this case, ""digital bombs""",,91.0,962,2013-04-18,TECH,0.08541985601186752,0.8494985699653625,0.06508154422044754
technology,Microsoft partners claim Windows 8 caused ‘millions of customers’ to switch to Apple,,178.0,96,2013-04-18,TECH,0.9286074638366699,0.05256781727075577,0.01882474683225155
technology,US House of Representatives Pass CISPA,,0.0,9,2013-04-18,TECH,0.03484528139233589,0.7899638414382935,0.17519088089466095
technology,A touchscreen that even Tony Stark would love,,2.0,9,2013-04-18,TECH,0.021053891628980637,0.9028573036193848,0.07608877122402191
technology,"Intuit fail - claims redundant data centers for their quickbase service, but a single hardware failure of a single router crashes the system completely and forces them to take the entire thing offline. (See the note with time stamp Apr 18 11:24AM - Apr 18 11:46AM)",,2.0,9,2013-04-18,TECH,0.3527980148792267,0.6267984509468079,0.02040347270667553
technology,"Samsung, HTC and LG join wireless charging alliance, compatible devices coming in 2014",,16.0,86,2013-04-18,TECH,0.01320413313806057,0.8645462989807129,0.122249536216259
technology,The $12 Gongkai Phone,,0.0,8,2013-04-18,TECH,0.03737558051943779,0.8902868032455444,0.07233762741088867
technology,Robot hands gain a gentler touch,,0.0,8,2013-04-18,TECH,0.03497759625315666,0.6994606852531433,0.2655617892742157
technology,Hardware hacker unifies 15 retro consoles in format frenzy,,0.0,8,2013-04-18,TECH,0.017446182668209076,0.9329692125320435,0.04958454146981239
technology,How Google Glass works,,6.0,8,2013-04-18,TECH,0.02564973756670952,0.9437588453292847,0.03059137612581253
technology,MPAA Pretends To Be A Regular Defender Of Fair Use; The Evidence Suggests Otherwise,,29.0,934,2013-04-19,TECH,0.018172001466155052,0.8282367587089539,0.15359120070934296
technology,Google to invest $600m in NC facility. The announcement was NOT Google Fiber.,,4.0,9,2013-04-19,TECH,0.024822335690259933,0.9396161437034607,0.03556150943040848
technology,Google’s future: Doing the impossible,,24.0,89,2013-04-19,TECH,0.03761621192097664,0.9274464845657349,0.03493724763393402
gadgets,MOGA Pro Android controller is out,,0.0,8,2013-04-19,TECH,0.023011503741145134,0.9050924777984619,0.0718960091471672
technology,Yahoo shuts down six products,,4.0,8,2013-04-19,TECH,0.9045947194099426,0.08417174220085144,0.01123348530381918
technology,introducing the new worlds fastest computer[The Titan Supercomputer],,2.0,8,2013-04-19,TECH,0.018722577020525932,0.9176583886146545,0.06361900269985199
technology,Driverless cars expected to go mainstream by 2025,,456.0,753,2013-04-19,TECH,0.03252401575446129,0.8558258414268494,0.11165013909339905
gadgets,The sweet spot for tablets: 8-inch slates to grab 11.9% of tablet market in 2013,,27.0,73,2013-04-19,TECH,0.02360186167061329,0.7883486151695251,0.18804949522018433
technology,How Reddit Fueled the Scanner-Happy Media to Out Innocent Boston 'Suspects',,3.0,7,2013-04-19,TECH,0.02504701353609562,0.9423609375953674,0.03259207308292389
technology,The Solar Cell That Turns 1 Photon into 2 Electrons. New technique that utilizes organic materials shows potential to substantially increase solar cell efficiency.,,2.0,7,2013-04-19,TECH,0.008123942650854588,0.10040349513292313,0.891472578048706
technology,"Extended warranty in hand, big box store wanted $59 more to process repairs. Why did I buy the warranty then??",,26.0,95,2013-04-20,TECH,0.037386275827884674,0.9180320501327515,0.044581662863492966
technology,Fox Censors Cory Doctorow’s “Homeland” Novel From Google.,,1.0,9,2013-04-20,TECH,0.0326058492064476,0.9176944494247437,0.049699682742357254
technology,Man who sold up to $40 million worth of counterfeit headphones gets two years in jail,,49.0,88,2013-04-20,TECH,0.04580058157444,0.8989928960800171,0.055206481367349625
technology,Sun-powered plane completes California test flight,,0.0,8,2013-04-20,TECH,0.018254050984978676,0.8755813837051392,0.10616462677717209
technology,"""I would prefer to not spread and democratise the ability to fight war to every single human being..."" - Eric Schmidt on Google and the future",,2.0,8,2013-04-20,TECH,0.02361133135855198,0.9196221828460693,0.05676651373505592
technology,"Computer Hardware Chart: CPUs, RAM, HDDs, Ports, Desktop Card Slots",,2.0,8,2013-04-20,TECH,0.02194368652999401,0.9369090795516968,0.041147198528051376
technology,"Oh Look, Rep. Mike Rogers Wife Stands To Benefit Greatly From CISPA Passing... from the no-conflict,-no-interest dept",,10.0,781,2013-04-20,TECH,0.05267353728413582,0.8737652897834778,0.07356122136116028
technology,"Security researchers have unearthed a family of malware for Android-based smartphones that's been downloaded as many as 9 million times from Google Play, the official distribution platform hosted on Google servers",,15.0,77,2013-04-20,TECH,0.021312197670340538,0.9245163202285767,0.05417146161198616
gadgets,"We now have two android tablets in our house, plus two android phones. What cool games or apps can we get to use them together?","I'm thinking of things like board games, two player games, etc. The tablets are a Sony Tablet S and a Samsung Tab2 7"", if it matters.",64.0,75,2013-04-20,TECH,0.015055167488753796,0.9158046841621399,0.06914012134075165
technology,Looming Cyber-Security Bill Could Have Ruined Reddit's Boston Investigation,,11.0,72,2013-04-20,TECH,0.04005769267678261,0.9187378883361816,0.041204385459423065
technology,Online Education is replacing physical colleges at a crazy fast pace,,290.0,952,2013-04-21,TECH,0.01765304058790207,0.7362599968910217,0.24608689546585083
technology,Japanese police ask ISPs to start blocking Tor,,175.0,904,2013-04-21,TECH,0.27518296241760254,0.6906035542488098,0.03421349450945854
technology,The Genius Of Google Fiber,,17.0,90,2013-04-21,TECH,0.019190438091754913,0.9090573191642761,0.07175225764513016
technology,Bitcoin Exchange Mt. Gox Taken Down for Hours by DDoS Attack,,4.0,9,2013-04-21,TECH,0.02640826813876629,0.9352531433105469,0.03833860158920288
gadgets,where else can you find Faraday Cage protection for your cellphone?,,11.0,9,2013-04-21,TECH,0.050963278859853745,0.9127315282821655,0.03630517050623894
gadgets,Review: Samsung Galaxy Note 8.0 is pricey but has its charms,,8.0,9,2013-04-21,TECH,0.04970215633511543,0.7821393013000488,0.16815853118896484
technews,"Family of ""BadNews"" malware in Google Play downloaded up to 9 million times: Apps steal sensitive data, push SMS app that racks up charges to pricey service",,0.0,9,2013-04-21,TECH,0.05341915413737297,0.9080355763435364,0.03854522109031677
gadgets,Happy Birthday Little Guy - 10 years old today,,146.0,892,2013-04-21,TECH,0.037640418857336044,0.8918514847755432,0.07050809264183044
technology,"From Atoms To Bits, Physics Shows Entropy As The Root Of Intelligence",,13.0,88,2013-04-21,TECH,0.06222546845674515,0.8586496114730835,0.07912495732307434
gadgets,So I was going through some old stuff... Found my first smartphone from back in 2005-2006,,144.0,831,2013-04-21,TECH,0.033741675317287445,0.9138990640640259,0.05235924944281578
technology,The rise and fall of AMD: How an underdog stuck it to Intel,,435.0,951,2013-04-22,TECH,0.16893941164016724,0.7720138430595398,0.059046778827905655
gadgets,“Winking” at your Google Glass could trigger the camera,,15.0,90,2013-04-22,TECH,0.044233016669750214,0.8948725461959839,0.06089441478252411
gadgets,Blackberry’s New Found Agility. Software as much as hardware leads RIM turnaround but for how long?,,0.0,9,2013-04-22,TECH,0.0181316826492548,0.830273449420929,0.15159489214420319
technology,New Netflix Family Plans: $12 for Four Simultaneous Streams,,21.0,8,2013-04-22,TECH,0.009951640851795673,0.9104816317558289,0.07956675440073013
technology,As many as 10 million people are mooching off others’ Netflix streaming plans. Netflix may possibly try and squeeze revenue from these 10 million people,,4.0,8,2013-04-22,TECH,0.02304084412753582,0.9118494391441345,0.0651097521185875
technology,Groundhog day for routers,,0.0,8,2013-04-22,TECH,0.027572669088840485,0.9191547632217407,0.05327259376645088
technology,"Apple, Samsung and other tech firms have raised more than $32 million to aid China as it tries to recover from Saturday's devastating earthquake.",,0.0,8,2013-04-22,TECH,0.01727651245892048,0.07648532092571259,0.9062381386756897
technology,"Germany fines Google over ""systematic, illegal"" collection of data for Google Street View.",,1.0,8,2013-04-22,TECH,0.9021100997924805,0.08284492790699005,0.01504502072930336
technology,"'World's first Braille smartphone' designed, due at less than $200.",,8.0,8,2013-04-22,TECH,0.010467339307069778,0.7166456580162048,0.2728870213031769
technology,Amazon Patent Describes Wirelessly Powered Remote Displays.,,1.0,8,2013-04-22,TECH,0.02527637407183647,0.9239470958709717,0.05077651888132095
technology,"First Synthetic Biology Kickstarter ever. ""Glowing Plants: Natural Lighting with no Electricity or CO2""",,33.0,90,2013-04-23,TECH,0.013082891702651978,0.9187748432159424,0.06814225763082504
technology,Nvidia Tesla bigwig: Why you REALLY won't need x86 chips soon,,1.0,9,2013-04-23,TECH,0.018858300521969795,0.9148678183555603,0.06627384573221207
technology,"How CISPA Opponents Were Outspent by Industry Lobbyists, 38 to 1.In the cybersecurity fight, one side has the money, but so far it can't get it's way.",,0.0,9,2013-04-23,TECH,0.031502045691013336,0.9061698317527771,0.06232813373208046
technology,"After Earth Google Hangout, with Google's Ray Kurzweil, Elon Musk, Alexandra Cousteau, and NASA Astronaut Sunita Williams Join ""After Earth"" Stars Jaden Smith and Will Smith to Talk About Science, Technology, Innovation and the Future in ""After Earth Day""",,1.0,9,2013-04-23,TECH,0.021084632724523544,0.9228335618972778,0.05608173832297325
technology,"Citi goes sour on Apple, claims iPhone 5S, iPhone 6 delay | Apple",,2.0,9,2013-04-23,TECH,0.33183619379997253,0.6333140134811401,0.03484979644417763
technology,Android predicted to beat Apple in China – thanks to its potential for ‘oppression’,,4.0,9,2013-04-23,TECH,0.012542081996798515,0.06902250647544861,0.9184353947639465
technology,Gamers can order Pizza Hut using Xbox Live,,3.0,9,2013-04-23,TECH,0.01511008758097887,0.926230251789093,0.05865964666008949
gadgets,"Hey r/Gadgets, I built a site that aggregates gadgets, concepts, and otherwise weird stuff. Let me know what you think.",,22.0,88,2013-04-23,TECH,0.028893107548356056,0.9338101744651794,0.037296731024980545
technology,"Customers hate contracts, Verizon still doesn't care",,214.0,844,2013-04-23,TECH,0.5872339010238647,0.38592493534088135,0.026841185986995697
technology,"For the first time in 10 years, Apple experiences its first quarterly drop in profits",,47.0,84,2013-04-23,TECH,0.9724196195602417,0.01872599683701992,0.008854381740093231
technology,"For the First Time Ever, You Can Now Hear What Alexander Graham Bell Sounded Like",,11.0,91,2013-04-24,TECH,0.0231509767472744,0.8592039346694946,0.11764512956142426
gadgets,Microsoft announces that the Surface RT and Surface Pro tablets will be heading to additional markets in the coming weeks.,,4.0,9,2013-04-24,TECH,0.01121836993843317,0.7962424159049988,0.1925392597913742
technology,Schmidt's Six Predictions: Our Digital Future,,0.0,9,2013-04-24,TECH,0.019291939213871956,0.8673564791679382,0.11335153132677078
technology,McAfee Patents Technology to Detect and Block Pirated Content,,44.0,89,2013-04-24,TECH,0.04296192154288292,0.9300040006637573,0.02703414112329483
technology,"“If I was drunk in Brooklyn, I’d want to be able to hit ‘hail cab’ [on my phone] and have them come to me without any confusion,” said one forthcoming 28-year-old man. (yeah, me too)",,27.0,83,2013-04-24,TECH,0.04116518050432205,0.9005711078643799,0.05826377868652344
technology,Google's Street View expansion hits 50 countries as Hungary joins the fold,,8.0,83,2013-04-24,TECH,0.009910709224641323,0.31938299536705017,0.6707063317298889
technology,Bypassing CISPA by secretly allowing Internet surveillance,,0.0,8,2013-04-24,TECH,0.04782193526625633,0.9192812442779541,0.03289677947759628
technology,Average U.S. Connection Speed Now 7.4 Mbps - U.S. Now Eighth Place For Average Connection Speed,,3.0,8,2013-04-24,TECH,0.01827799715101719,0.8562847971916199,0.1254371702671051
technology,MetroPCS Shareholders Approve T-Mobile USA Merger,,0.0,8,2013-04-24,TECH,0.01916690170764923,0.9217154383659363,0.059117626398801804
technology,"Inspired by frog feet, new robot will crawl around your abdomen during laparoscopic surgery.",,2.0,8,2013-04-24,TECH,0.02174014411866665,0.9124563336372375,0.06580351293087006
technology,CISPA legalizes already common cyber surveillance practices,,8.0,95,2013-04-25,TECH,0.08948620408773422,0.886347234249115,0.024166570976376534
technology,"Utah ISP CenturyLink (formerly Qwest) Spends a Decade Being an Anti-competitive Bully That Shirks Network Upgrades, Then Whines That Google Fiber's Arrival in Utah ""Isn't Fair.""",,159.0,932,2013-04-25,TECH,0.0356481671333313,0.9321831464767456,0.0321686826646328
technology,Anonymous Just Took Down NAMBLA's Homepage to Protest Pedophilia Pride Day,,27.0,84,2013-04-25,TECH,0.07394945621490479,0.8843981027603149,0.04165240749716759
technology,New Chrome extension can open Office docs,,0.0,8,2013-04-25,TECH,0.012205993756651878,0.8560441136360168,0.13174989819526672
technology,Amazon introduces 'Amazon Coins',,11.0,8,2013-04-25,TECH,0.022504957392811775,0.9332427978515625,0.04425228014588356
technology,Mini-robot finds surprise in Mexico's ancient Temple of Quetzalcoatl,,0.0,8,2013-04-25,TECH,0.020080311223864555,0.870835542678833,0.10908416658639908
technology,"Malware Apps Abound In Google Play, Android Users Suffer",,3.0,8,2013-04-25,TECH,0.03134654834866524,0.9373881816864014,0.03126532584428787
technology,Prenda’s last stand: threats sprawl from a Minnesota hacking lawsuit,,0.0,8,2013-04-25,TECH,0.15769311785697937,0.8183342218399048,0.02397271618247032
technology,Home made coil gun,,2.0,8,2013-04-25,TECH,0.02298162505030632,0.8841193914413452,0.09289892017841339
technology,Study finds there may not be a shortage of American STEM graduates after all,,1.0,8,2013-04-25,TECH,0.3678782284259796,0.4278801381587982,0.20424164831638336
technology,What Happened When One Man Pinged the Whole Internet: A home science experiment that probed billions of Internet devices reveals that thousands of industrial and business systems offer remote access to anyone,,197.0,939,2013-04-26,TECH,0.015272092074155807,0.9093893766403198,0.07533852010965347
technology,Google Fiber’s Ripple Effect: The threat of superfast Google Fiber is causing other Internet providers to crank up their own offerings,,15.0,92,2013-04-26,TECH,0.7894908785820007,0.19100861251354218,0.019500507041811943
technews,Guy in France creates robot to steal from vending machines.,,2.0,9,2013-04-26,TECH,0.025410503149032593,0.916042685508728,0.05854684114456177
technology,"CNET: White House weigh in on an important issue: It's pronounced GIF, with a hard G.",,11.0,9,2013-04-26,TECH,0.025192391127347946,0.8973244428634644,0.07748320698738098
technology,"Tesla offering a new Warranty Program (full Battery Warranty, Valet Service, and other perks)",,10.0,9,2013-04-26,TECH,0.009179235436022282,0.835277795791626,0.15554293990135193
technology,"Gigabit Fiber Comes to Lawrence Kansas, but not from Google -- $100/mo for gigabit, $70/mo for 100 mbit",,10.0,9,2013-04-26,TECH,0.022396963089704514,0.9050347805023193,0.07256831973791122
technology,Samsung Galaxy S4 vs Nokia Lumia 920 Camera Comparison,,13.0,9,2013-04-26,TECH,0.015497981570661068,0.6199729442596436,0.3645291328430176
technology,"Android notebooks? Yep, Intel says, and they'll only cost $200",,79.0,88,2013-04-26,TECH,0.0172134879976511,0.8792659640312195,0.10352052748203278
technology,"American Gangs Use Internet for Bragging, Not Cybercrime, Study Finds",,1.0,8,2013-04-26,TECH,0.048847805708646774,0.930401086807251,0.0207511018961668
technology,"Obesity could be treated with a pacemaker implanted into the brain, according to new study",,2.0,8,2013-04-26,TECH,0.028888149186968803,0.9176911115646362,0.053420767188072205
technology,"Nokia beats Apple in customer satisfaction on Verizon, AT&amp;T and T-Mobile",,14.0,85,2013-04-27,TECH,0.019932657480239868,0.6040769219398499,0.37599050998687744
technology,Suspected Spamhaus DDoS attacker arrested in Spain,,3.0,83,2013-04-27,TECH,0.6860003471374512,0.2932811975479126,0.02071845903992653
technology,Mark Zuckerberg Reaped $2.3 Billion On Facebook Stock Options,,18.0,70,2013-04-27,TECH,0.03886628523468971,0.9377760291099548,0.023357758298516273
technology,Wolfram|Alpha Blog : Data Science of the Facebook World,,0.0,7,2013-04-27,TECH,0.033430781215429306,0.9380733370780945,0.028495866805315018
technology,Snake arms and crystal legs: Artificial limbs push boundaries of art,,13.0,67,2013-04-27,TECH,0.042126625776290894,0.9286982417106628,0.029175108298659325
technology,Tesla Model S Tops GM Volt in North American Plug-In Race,,20.0,67,2013-04-27,TECH,0.03437025845050812,0.9127400517463684,0.052889633923769
technology,Apple has been hit with a fine in China after being found to have illegally distributed copywrited materials,,12.0,64,2013-04-27,TECH,0.7623401284217834,0.2234119474887848,0.014247871935367584
technology,Alert: Skype account hijack technique may affect all users,,6.0,59,2013-04-27,TECH,0.623686671257019,0.36136719584465027,0.014946112409234047
technology,"Iter project makes breakthrough in quest for nuclear fusion, a solution to climate change and an age of clean, unlimited energy",,26.0,57,2013-04-27,TECH,0.01277356781065464,0.8510224223136902,0.13620400428771973
technology,Braille smartphone in development,,2.0,54,2013-04-27,TECH,0.02708210051059723,0.931878924369812,0.04103899374604225
technology,Bus company threatens redditor with lawsuit... Troll bus company... Troll_ey_bus,,9.0,90,2013-04-28,TECH,0.2918315529823303,0.6870101094245911,0.02115829847753048
technology,"With few other outlets, inmates review prisons on Yelp",,7.0,85,2013-04-28,TECH,0.18493883311748505,0.7773624658584595,0.037698645144701004
technology,Sony’s DualShock 4 controller revolutionizes splitscreen gaming and player location,,5.0,8,2013-04-28,TECH,0.01703178696334362,0.92337965965271,0.0595884844660759
technology,LivingSocial Password Breach Affects 50 Million Accounts,,3.0,7,2013-04-28,TECH,0.49417611956596375,0.4855271875858307,0.020296676084399223
technology,Apple won't fix your computer if you smoke near it,,120.0,69,2013-04-28,TECH,0.11369882524013519,0.8497150540351868,0.03658615052700043
technology,"Icelandic Pirate Party Wins, Enters Parliament.",,3.0,66,2013-04-28,TECH,0.21782729029655457,0.5937764048576355,0.18839634954929352
gadgets,Question regarding chargers,"[http://i.imgur.com/8pNFsmh.jpg](http://i.imgur.com/8pNFsmh.jpg)  
Plug (1) first or plug (2) first? Or it doesn't matter?  
My friend says to plug (2) first so that the voltage will adjust to the right level of electricity or something like that.",9.0,6,2013-04-28,TECH,0.024272456765174866,0.9216411113739014,0.05408642441034317
technology,Silk floral arrangements,,8.0,6,2013-04-28,TECH,0.025871634483337402,0.9278294444084167,0.04629893973469734
technology,If you plan on upgrading your phone you should read this interesting android article.,,61.0,54,2013-04-28,TECH,0.020389212295413017,0.9330691695213318,0.04654168337583542
technology,LivingSocial Hacked- More than 50 Million Customers Impacted,,4.0,52,2013-04-28,TECH,0.014958183281123638,0.9217728972434998,0.06326889991760254
technology,"Spain's Extremadura starts switch of 40,000 government PCs to Linux and open source software",,24.0,98,2013-04-29,TECH,0.01847030594944954,0.9238417744636536,0.05768796056509018
technology,Why your password can’t have symbols—or be longer than 16 characters,,44.0,96,2013-04-29,TECH,0.040813934057950974,0.9326785802841187,0.02650749869644642
technology,Virgin Galactic's SpaceShipTwo Passes First Rocket Test,,4.0,90,2013-04-29,TECH,0.02122240699827671,0.897415816783905,0.081361785531044
technology,"Would-Be Pirates Get a Taste of Delicious, Delicious Irony",,6.0,9,2013-04-29,TECH,0.026794051751494408,0.8489384055137634,0.1242675706744194
technology,A wide group of venture capitalists in Silicon Valley is being enticed into making big bets on food.,,0.0,9,2013-04-29,TECH,0.023244716227054596,0.8907446265220642,0.0860106498003006
technology,Flipboard is a giant iceberg lurking in the path of the media,,2.0,9,2013-04-29,TECH,0.03807070106267929,0.9302582144737244,0.03167109563946724
technology,"Chat apps have overtaken SMS by message volume, but how big a disaster is that for carriers?",,3.0,9,2013-04-29,TECH,0.12495256960391998,0.8488734364509583,0.026173949241638184
technology,"""Don't Fight"" - an awesome Nokia 920 ad from Microsoft",,56.0,87,2013-04-29,TECH,0.03384115546941757,0.9163737297058105,0.04978508874773979
gadgets,An MP3 Player from 13 years ago,,214.0,866,2013-04-29,TECH,0.024768086150288582,0.9304420948028564,0.044789861887693405
technology,Google Fiber forces Time Warner’s hand yet again,,148.0,802,2013-04-29,TECH,0.1910681575536728,0.7676104307174683,0.041321445256471634
technology,"Swedish Authorities Target Pirate Bay Again, Police Question Founder in Prison",,9.0,96,2013-04-30,TECH,0.6987169981002808,0.2771523892879486,0.024130651727318764
