subreddit,title,selftext,num_comments,score,created_utc,stock/sector,neg,neu,pos
technology,World record solar cell with 44.7% efficiency,,72,282,2013-09-26,TECH,0.019057011231780052,0.7231450080871582,0.2577979564666748
technology,DO NOT BUY the Samsung Galaxy Note 3 because it is region locked just like a DVD,,79,232,2013-09-26,TECH,0.019874922931194305,0.9351032376289368,0.04502186179161072
technology,Samsung Galaxy Note 3 is region locked,,61,218,2013-09-26,TECH,0.022223640233278275,0.9353678226470947,0.04240855574607849
technology,Verizon wants to slow down your favorite websites unless they pay bribes,,1644,3984,2013-09-27,TECH,0.059625569730997086,0.914827823638916,0.025546571239829063
technology,Verizon and AT&amp;T’s data caps have made LTE a waste of money,,2676,3527,2013-09-27,TECH,0.04359776899218559,0.9225444197654724,0.03385773301124573
technology,SPREAD THE WORD: Steven Harper calls on Presidents and Prime Ministers of 12 powerful countries to meet *in a few days* behind closed doors to seal an extreme Internet censorship plan called the Trans Pacific Partnership (TPP),,1710,3191,2013-09-27,TECH,0.11504266411066055,0.8534060716629028,0.0315513052046299
technology,Netflix Makes Super HD Streams Available to All ISPs,,1083,3095,2013-09-27,TECH,0.011616296134889126,0.8655415773391724,0.12284217774868011
technology,"EU wants all companies, ahem Apple, to use standard charger",,1718,2344,2013-09-27,TECH,0.018229076638817787,0.9432659149169922,0.03850496560335159
gadgets,"Handmade Gadgets? This is my Piratebox, more info about it in the comments.",,307,1262,2013-09-27,TECH,0.041101355105638504,0.9328571557998657,0.026041515171527863
technology,"Comcast CEO: Aereo Illegal, A La Carte Never Happening",,404,1001,2013-09-27,TECH,0.08665070682764053,0.8816224932670593,0.03172682970762253
technology,"Apple's iOS 7 is making people SICK. As in puking, not just upset",,643,892,2013-09-27,TECH,0.18732020258903503,0.7588820457458496,0.053797733038663864
technology,Former SpaceX director signs on to crowdfunded hyperloop project,,56,630,2013-09-27,TECH,0.027376623824238777,0.9245836734771729,0.04803968220949173
technology,Steam Controller Announced!,,243,603,2013-09-27,TECH,0.031448692083358765,0.9340208172798157,0.034530505537986755
technology,New York Times: N.S.A. Secretly Examining Social Networks of U.S. Citizens Without Warrants,,750,3088,2013-09-28,TECH,0.3110121488571167,0.6594229340553284,0.02956491895020008
technology,"After 13-year ban, China to allow game console sales",,878,2752,2013-09-28,TECH,0.11676516383886337,0.8131573796272278,0.07007745653390884
technology,Revealed: UK secretly arrested 16-year old boy for world’s ‘biggest’ DDoS-attack,,825,2456,2013-09-28,TECH,0.3652038276195526,0.5862529873847961,0.04854320362210274
technology,Record Label Picks Copyright Fight — With The Wrong Guy,,76,1113,2013-09-28,TECH,0.5860013961791992,0.3851807713508606,0.028817733749747276
technology,Rise of the machines: 47% of U.S. jobs are “at risk” of being automated in the next 20 years.,,801,965,2013-09-28,TECH,0.5211460590362549,0.1238383874297142,0.35501548647880554
technology,"The Senate is busy creating a privileged 1st amendment club for 'official' journalists. The Senate is skirting the substantial investigative role served by independent journalists, bloggers, and nontraditional media.",,83,878,2013-09-28,TECH,0.02691270411014557,0.9150784015655518,0.05800884589552879
technology,NYT: New docs reveal US Government secretly examining social networks of US citizens without warrants,,43,742,2013-09-28,TECH,0.19995930790901184,0.7672414183616638,0.03279930353164673
technology,Why Free Software Is More Important Now Than Ever Before | Wired Opinion,,193,680,2013-09-28,TECH,0.018101515248417854,0.8476206064224243,0.1342778354883194
gadgets,Keeping Your Laptop Plugged in All the Time Will Kill Its Battery Faster | Gadget Lab,,172,473,2013-09-28,TECH,0.03866776078939438,0.8922836780548096,0.06904854625463486
technology,30 years of GNU and free software movement,,45,301,2013-09-28,TECH,0.019858263432979584,0.9173843264579773,0.06275741755962372
technology,SpaceX to launch Falcon 9 v1.1 at NOON EDT. LIVE stream.,,707,2662,2013-09-29,TECH,0.022703208029270172,0.9398030638694763,0.037493668496608734
technology,Pilot plant to be built to convert CO2 emissions into carbonate rock 'bricks' for use in the construction industry.,,293,2089,2013-09-29,TECH,0.016788315027952194,0.929970383644104,0.053241368383169174
technology,Facebook Admits Its Ads Are Too Annoying,,253,1656,2013-09-29,TECH,0.11026788502931595,0.8626281023025513,0.027103973552584648
technology,The founder of a brand new movie search engine designed to send users to reasonably priced legal content online says that chasing down pirates is not the way to deal with unauthorized copying,,92,1475,2013-09-29,TECH,0.044607434421777725,0.9008604288101196,0.054532136768102646
gadgets,"John McAfee reveals details on gadget to thwart NSA. And if the U.S. government bans its sale, ""I'll sell it in England, Japan, the Third World. This is coming and cannot be stopped.""",,144,757,2013-09-29,TECH,0.27020207047462463,0.694320559501648,0.035477399826049805
technology,Could Apple be forced into charger redesign by EU? Apple could be forced to scrap its iPhone chargers under EU plans to make a universal phone charger law.,,623,742,2013-09-29,TECH,0.09474442154169083,0.8735641837120056,0.031691376119852066
technology,"Judge tosses Apple motion, allows patent-troll Lodsys to continue rampage",,104,641,2013-09-29,TECH,0.04074198752641678,0.921639621257782,0.03761839494109154
technology,Estonian President Explains His Country's Tech Boom And Why America Is Falling Behind,,99,445,2013-09-29,TECH,0.6526010036468506,0.21454888582229614,0.1328500360250473
technology,"‘Run, don’t walk’: The school that gets pupils to generate electricity",,39,343,2013-09-29,TECH,0.059504296630620956,0.9117090106010437,0.02878672070801258
technology,"SpaceX demo was great and all, but Orbital's Cygnus spacecraft docked with the ISS today!",,21,194,2013-09-29,TECH,0.01733226515352726,0.9048885107040405,0.07777923345565796
technology,Swedish flat-pack furniture giant IKEA will start selling residential solar panels at its stores in Britain,,1203,3769,2013-09-30,TECH,0.010946703143417835,0.7696498036384583,0.2194034904241562
technology,"40 times stronger than diamond, Carbyne is ""a supermaterial first theorized in 1967 [but] its legitimacy has been disputed for the last 40 years. This time around the team figured out how to successfully synthesize and stabilize it at room temperature.""",,613,2670,2013-09-30,TECH,0.013666789047420025,0.7233931422233582,0.26294004917144775
technology,Security researchers rewarded $12.50 voucher to buy Yahoo T-shirt for reporting XSS vulnerabilities that could compromise any @yahoo.com email account.,,504,2524,2013-09-30,TECH,0.049344323575496674,0.9310912489891052,0.019564401358366013
technology,Apple and Google have surpassed Coca-Cola to become the #1 and #2 most valuable brands.,,345,2337,2013-09-30,TECH,0.01488714199513197,0.7165676951408386,0.26854515075683594
technology,Google Web Designer,,299,1540,2013-09-30,TECH,0.04341280087828636,0.9329153895378113,0.023671822622418404
gadgets,John McAfee wants to sell you a $100 gadget that blocks the NSA,,150,443,2013-09-30,TECH,0.018758311867713928,0.9086694121360779,0.072572261095047
technology,How to advise someone as to what type of computer they should buy,,47,314,2013-09-30,TECH,0.058746349066495895,0.9167382717132568,0.02451537735760212
technology,"French Gendarmerie: ""Open source desktop lowers total cost of ownership by 40%"". Next to the massively lower TCO, the benefits include being independent from commercial software vendors. ""This is priceless.""",,79,250,2013-09-30,TECH,0.025264093652367592,0.8869944214820862,0.0877414345741272
technology,Yahoo proves it has a reckless and moronic attitude to email security,,113,219,2013-09-30,TECH,0.4023610055446625,0.5715311765670776,0.02610783278942108
technology,A 32-year-old man whose knee and lower leg were amputated in 2009 after a motorcycle accident is apparently the first person with a missing lower limb to control a robotic leg with his mind. A team reports the breakthrough today in the New England Journal of Medicine,,37,209,2013-09-30,TECH,0.41992729902267456,0.5529844164848328,0.027088208124041557
