subreddit,title,selftext,num_comments,score,created_utc,stock/sector,neg,neu,pos
gadgets,HTC One Review: The best Android smartphone in the world — period.,,38.0,92,2013-04-01,TECH,0.019356153905391693,0.5443360805511475,0.43630778789520264
technology,Check out the new product line from Sony!,,3.0,9,2013-04-01,TECH,0.014837046153843403,0.8999690413475037,0.08519388735294342
technology,Appeals Court Denies Broadcasters' Motion to Shut Down Aereo,,1.0,9,2013-04-01,TECH,0.4589187502861023,0.5053495764732361,0.035731732845306396
technology,"Web browser war: The early 2013 report. Depending on who you believe, it's Chrome or IE in 1st on PCs and Android or Safari on tablets &amp; smartphones",,0.0,9,2013-04-01,TECH,0.016648326069116592,0.8689185976982117,0.11443309485912323
technology,"Google Fiber team in Kansas City announces ""Fiber to the Pole,"" opening up quicker expansion possibilities to the rest of the country",,0.0,9,2013-04-01,TECH,0.018074458464980125,0.8705959320068359,0.11132964491844177
technology,Coast-to-coast solar plane flight set for May 1,,2.0,9,2013-04-01,TECH,0.022329213097691536,0.9287155270576477,0.04895530641078949
technology,Google announces Google Fiber Poles,,11.0,9,2013-04-01,TECH,0.0318852998316288,0.936598002910614,0.031516749411821365
technology,Actor Adrian Grenier talks about how technology can clarify the mission of sustainable practices and green living for all of us,,3.0,9,2013-04-01,TECH,0.01581840217113495,0.8957360982894897,0.08844544738531113
technology,TPB: We hereby announce that we have moved our servers from the evil North Korea to the greatest fuckin nation in the entire world.,,139.0,883,2013-04-01,TECH,0.3577216565608978,0.6059449315071106,0.03633345291018486
technology,Tesla is entering NASCAR,,148.0,878,2013-04-01,TECH,0.038506362587213516,0.9278004765510559,0.0336931012570858
technology,Cleverbot opens up API,,15.0,94,2013-04-02,TECH,0.03347783163189888,0.9025241136550903,0.06399808824062347
technology,"Xavier Vlad, head of Center for Advanced Material Irradiation at UM, may have discovered first step of teleportation",,9.0,9,2013-04-02,TECH,0.01816045492887497,0.9186726212501526,0.06316693872213364
technology,Damaging The Internet Is Not Acceptable Collateral Damage In The Copyright Wars,,40.0,845,2013-04-02,TECH,0.8305875062942505,0.15669892728328705,0.012713594362139702
technology,Prenda lawyers take Fifth Amendment; judge storms out: “We’re done”,,189.0,820,2013-04-02,TECH,0.24773769080638885,0.7008746862411499,0.05138764902949333
technology,"Anonymous hackers claim to have stolen 15,000 passwords from North Korea’s Uriminzokkiri site",,0.0,8,2013-04-02,TECH,0.07151465862989426,0.8928709030151367,0.03561437875032425
technology,How NASA's Nuclear Rockets Will Take Us Beyond Mars,,3.0,8,2013-04-02,TECH,0.012396945618093014,0.8607668876647949,0.1268361359834671
technology,"After three years on the job, Google's first privacy director, Alma Whitten, resigns.",,1.0,8,2013-04-02,TECH,0.03164687380194664,0.9146742224693298,0.05367890000343323
technology,"Paul Allen, the billionaire co-founder of Microsoft Corp, is opening an office in Silicon Valley to make new investments in emerging technology and internet companies.",,12.0,72,2013-04-02,TECH,0.022377382963895798,0.9046996831893921,0.07292291522026062
technology,Copyright wars are damaging the health of the internet,,5.0,71,2013-04-02,TECH,0.7003496885299683,0.2816676199436188,0.01798265613615513
technology,Death of the Social Media Strategist: Overselling &amp; Underperforming from the Start,,0.0,7,2013-04-02,TECH,0.04564164578914642,0.9127228260040283,0.041635528206825256
technology,"The Great Equalizer: Apple, Android &amp; Windows Tablet GPUs Compared using GL/DXBenchmark 2.7",,0.0,9,2013-04-03,TECH,0.017619919031858444,0.8845029473304749,0.09787716716527939
technology,"40 years ago today, standing on 6th Ave. in NY, Martin Cooper made the first cell phone call.",,4.0,9,2013-04-03,TECH,0.016023434698581696,0.9194896817207336,0.06448692828416824
technology,Windows Phone outsells iPhone in seven markets,,4.0,8,2013-04-03,TECH,0.023640766739845276,0.869701087474823,0.10665816813707352
technology,"The End of Moore's Law is on the Horizon, Says AMD",,12.0,8,2013-04-03,TECH,0.022704528644680977,0.921629786491394,0.05566567927598953
technology,University of Michigan takes first step towards teleportation,,6.0,8,2013-04-03,TECH,0.012930084019899368,0.8738484978675842,0.1132214218378067
technology,Google's Nexus 7 seeing a successor in July!,,5.0,8,2013-04-03,TECH,0.02081843838095665,0.8723390698432922,0.10684243589639664
technology,"Rather than recreate Google Drive, Yahoo integrates Dropbox into Mail",,0.0,8,2013-04-03,TECH,0.0651499405503273,0.9129734039306641,0.021876636892557144
technology,"Bitcoin price goes on wild ride: the value of one bitcoin ricocheted in overnight trading from $106 to as high as $147, then back down to $125, then to $141.",,81.0,74,2013-04-03,TECH,0.0305698923766613,0.8819630146026611,0.08746712654829025
technology,"Google is forking WebKit to build a new rendering engine named Blink for Chrome, Chromium and Opera",,0.0,7,2013-04-03,TECH,0.01084744930267334,0.8726929426193237,0.1164596676826477
technology,America is watching more TV than ever before—just not on TV,,3.0,7,2013-04-03,TECH,0.05033441260457039,0.913820207118988,0.03584533929824829
technology,Samsung said to be making Galaxy Mega phone with 6.3-inch screen,,12.0,9,2013-04-04,TECH,0.012159214355051517,0.8454003930091858,0.14244040846824646
technology,House Intel Committee to hold secret CISPA hearing,,1.0,9,2013-04-04,TECH,0.06115809082984924,0.9134794473648071,0.025362500920891762
gadgets,Samsung Galaxy Star and Galaxy Pocket Neo with 3-inch Display Announced,,4.0,9,2013-04-04,TECH,0.027046754956245422,0.9097307324409485,0.0632224828004837
technology,Google vs. the EU: The YouTube search history of Europeans is at the center of a major face off between the web’s most powerful company and the European Commission.,,5.0,74,2013-04-04,TECH,0.023448511958122253,0.9160259962081909,0.06052551418542862
technology,"Opera Confirms It Will Follow Google, Ditch WebKit for Blink",,168.0,711,2013-04-04,TECH,0.02119539864361286,0.9288981556892395,0.04990643635392189
technology,"In quest to make every phone a Facebook phone, Facebook officially unveils 'Facebook Home' for Android",,132.0,71,2013-04-04,TECH,0.015713708475232124,0.9188309907913208,0.06545532494783401
technology,Rocket powered by nuclear fusion could send humans to Mars,,1.0,7,2013-04-04,TECH,0.047085780650377274,0.8863831758499146,0.06653107702732086
technology,Handheld device used to unlock vehicles in a string of auto burglaries. - So Youtube was right!,,2.0,7,2013-04-04,TECH,0.019665440544486046,0.9343233108520508,0.04601119086146355
technology,EFF patent lawyer rates lawyer-rating patent ‘terrible’,,1.0,7,2013-04-04,TECH,0.016650600358843803,0.9107984900474548,0.07255091518163681
technology,A Short Translation from Bullshit to English of Selected Portions of the Google Chrome Blink Developer FAQ,,0.0,7,2013-04-04,TECH,0.019705623388290405,0.9355732798576355,0.044721152633428574
gadgets,DIY cardboard rifle fires bullet-shaped paper pellets 75 feet,,2.0,97,2013-04-05,TECH,0.019483575597405434,0.9093199372291565,0.0711965337395668
technology,"Microsoft Creative Director Defends Always-Online, Insults Customers, Murders Logic...All In One Day!",,20.0,96,2013-04-05,TECH,0.0870535671710968,0.8811774849891663,0.03176896646618843
gadgets,Gasket V8 Aluminum iPhone 5 Case,,27.0,92,2013-04-05,TECH,0.014950520358979702,0.8885552883148193,0.0964941531419754
technology,Mt. Gox under largest DDoS attack as bitcoin price surges,,1.0,9,2013-04-05,TECH,0.07907623052597046,0.8856122493743896,0.0353114940226078
technology,The rise and fall of music delivery formats.,,10.0,9,2013-04-05,TECH,0.025777576491236687,0.7810750007629395,0.19314740598201752
technology,New Skype Malware Uses Victims' Machines to Mine Bitcoins,,34.0,87,2013-04-05,TECH,0.04387250170111656,0.9208548069000244,0.03527262806892395
technology,"AMI Firmware Source Code, Private Key Leaked.. This is kinda bad..",,4.0,8,2013-04-05,TECH,0.3284056782722473,0.6498286128044128,0.021765680983662605
technology,Database of public school children's personal information to be shared with vendors to sell educational products.,,0.0,8,2013-04-05,TECH,0.03210640326142311,0.9413489699363708,0.02654467336833477
technology,Online music licensing revenues pass radio for first time,,0.0,8,2013-04-05,TECH,0.011222459375858307,0.8678692579269409,0.12090826034545898
technology,"Defending Honor of Web, Rackspace Sues 'Most Notorious Patent Troll'",,0.0,8,2013-04-05,TECH,0.0818978026509285,0.8513119220733643,0.06679024547338486
technology,California Court Rules It Illegal To Check Maps On Your Phone While Driving,,65.0,96,2013-04-06,TECH,0.5989695191383362,0.38018879294395447,0.02084159664809704
technology,"Editorial: The Internet in the U.S. isn't built for an ""always on"" game console",,178.0,946,2013-04-06,TECH,0.027235331013798714,0.93110591173172,0.04165869206190109
technology,"BitTorrent Site isoHunt Wants Jury to Rule on Free Speech Issues in MPAA Case: 'In a petition filed this week isoHunt argues that, among other things, the Ninth Circuit decision chills innovation and threatens free speech online.'",,2.0,85,2013-04-06,TECH,0.22335469722747803,0.7539275288581848,0.02271771989762783
technology,Disappearing Messages Are Everywhere: Smartphone apps that send disappearing messages are gaining in popularity,,1.0,8,2013-04-06,TECH,0.08352080732584,0.8699908256530762,0.04648837819695473
technology,Add Storage to an Android Device With This Mini MicroSD Reader,,1.0,8,2013-04-06,TECH,0.018776454031467438,0.9367726445198059,0.04445091262459755
gadgets,Anandtech's extremely detailed review of the HTC One.,,15.0,73,2013-04-06,TECH,0.021076610311865807,0.8990028500556946,0.07992061972618103
technology,Intel's next-gen 'Haswell' chip now shipping to PC makers,,1.0,7,2013-04-06,TECH,0.013157063163816929,0.8504505753517151,0.13639236986637115
technology,The ATF Wants 'Massive' Online Database to Find Out Who Your Friends Are,,15.0,62,2013-04-06,TECH,0.015940634533762932,0.9167115092277527,0.06734789907932281
technology,ITC judge says Samsung infringes on Apple’s text-selection patent,,0.0,6,2013-04-06,TECH,0.030623430386185646,0.9192108511924744,0.05016576871275902
technology,"Apple, Google Employees Lose In Court Battle Over Illegal Tech Cartel To Tamp Down Wages; conspiracy ""may have affected workers in too many different ways to justify lumping the individual claims together.""",,0.0,6,2013-04-06,TECH,0.7807483077049255,0.19975097477436066,0.019500747323036194
technology,"Joe Biden Pushed For “Six Strikes” Anti-Piracy Plan, IFPI Says",,150.0,950,2013-04-07,TECH,0.029999345541000366,0.901840090751648,0.06816060096025467
technology,NASA chief rules out manned Moon mission in 'his lifetime',,40.0,90,2013-04-07,TECH,0.029301505535840988,0.9280557632446289,0.0426427498459816
technology,"CIA's Gus Hunt On Big Data: We ""Try To Collect Everything And Hang On To It Forever"" and ""It is really very nearly within our grasp to be able to compute on all human generated information""",,1.0,8,2013-04-07,TECH,0.019930824637413025,0.9299013018608093,0.05016790330410004
technology,"Based on Tesla technology, Utah State University will launch commercial demonstration in mid-2013 of wireless charging transit bus.",,1.0,8,2013-04-07,TECH,0.010990375652909279,0.9001040458679199,0.08890555799007416
technology,Rumor: Microsoft to introduce Google Glass competitor in 2014,,85.0,78,2013-04-07,TECH,0.02648076042532921,0.92807936668396,0.045439887791872025
technology,Support for XP to be withdrawn in April 2014. Businesses' poor preparation putting them at risk.,,75.0,75,2013-04-07,TECH,0.938524603843689,0.04229428619146347,0.019181108102202415
technology,The Invisible Bike Helmet That You'll Have To (Not) See To Believe,,18.0,7,2013-04-07,TECH,0.0255228653550148,0.9164682626724243,0.058008842170238495
technology,TIL about an 86 year-long experiment demonstrating that pitch (tar) is hard enough to be cracked with a hammer while fluid enough to drip like water...once every 10 years. And its about to drip again.,,2.0,7,2013-04-07,TECH,0.0398130863904953,0.8954119086265564,0.0647750049829483
technology,I for one welcome our strutting robotic overlords,,11.0,7,2013-04-07,TECH,0.03477809950709343,0.8540343642234802,0.11118754744529724
technology,"Microsoft's Windows 8 Has Failed, Now What?",,3490.0,698,2013-04-07,TECH,0.01932237297296524,0.8860434889793396,0.09463414549827576
technology,"Google Fiber is coming to Austin, Texas | The Verge",,9.0,96,2013-04-08,TECH,0.016610629856586456,0.9418199062347412,0.04156949743628502
technology,Facebook users to be charged for messaging 'non-friends',,63.0,96,2013-04-08,TECH,0.0822886973619461,0.8990160226821899,0.01869526319205761
technology,Former Apple retail chief Ron Johnson out as JCPenney CEO,,4.0,9,2013-04-08,TECH,0.04059658572077751,0.9267989993095398,0.032604366540908813
technology,"Intel Atom chips poised for power, performance boost with Avoton",,0.0,9,2013-04-08,TECH,0.03772475942969322,0.25055816769599915,0.7117169499397278
technology,Robocalls stopped by Google phone spam filter,,1.0,9,2013-04-08,TECH,0.025649094954133034,0.9343965649604797,0.039954304695129395
technology,Realtime Bitcoin stats,,5.0,9,2013-04-08,TECH,0.03515972942113876,0.9202389121055603,0.04460131376981735
technology,California Judge rules using smartphone maps while driving illegal.,,11.0,8,2013-04-08,TECH,0.6158862709999084,0.3577381372451782,0.026375629007816315
technology,A quick look at Google Fiber pricing v. the incumbents,,1.0,8,2013-04-08,TECH,0.014274273067712784,0.9201866388320923,0.06553906947374344
technology,Shodan: The scariest search engine on the Internet,,3.0,8,2013-04-08,TECH,0.02965543605387211,0.9374164342880249,0.03292805701494217
gadgets,"Sony’s 4K UltraHD TVs plummet in price, but content still scarce",,24.0,79,2013-04-08,TECH,0.04073861613869667,0.8955315351486206,0.06372979283332825
technology,Google Glass Already Being Banned from Strip Clubs,,444.0,984,2013-04-09,TECH,0.23178808391094208,0.7401434183120728,0.028068507090210915
technology,German Court finds Apple's 'slide to unlock' patent invalid | TUAW,,141.0,966,2013-04-09,TECH,0.8421685695648193,0.11887592822313309,0.03895551711320877
technology,India uses drones to fight rhino poaching,,0.0,9,2013-04-09,TECH,0.04847857356071472,0.8910356760025024,0.06048575043678284
technology,Can we patent life?,,1.0,9,2013-04-09,TECH,0.02212776429951191,0.9266069531440735,0.051265232264995575
technology,India puts solar panels above clean water canals so they preserve the water from evaporation and get clean energy on top.,,10.0,80,2013-04-09,TECH,0.01436572428792715,0.8565385341644287,0.12909571826457977
technology,"AT&amp;T would totally bring gigabit to Austin, provided it gets same deal as Google",,3.0,8,2013-04-09,TECH,0.015734024345874786,0.8908374309539795,0.09342852234840393
technology,BitCon: Don't - An interesting article detailing the problems with BitCoins beyond simply pointing out that it's a pyramid scheme,,17.0,8,2013-04-09,TECH,0.0643957108259201,0.9101548790931702,0.02544945292174816
technology,Microsoft and Nokia file EU antitrust complaint against Google's Android,,0.0,8,2013-04-09,TECH,0.1128058061003685,0.8648310899734497,0.022363165393471718
technology,"As Aereo threatens to alter TV landscape, major networks promise a fight",,2.0,8,2013-04-09,TECH,0.1551520973443985,0.7578089237213135,0.0870390310883522
technology,Google Street View Hyperlapse by Teehan+Lax Labs,,7.0,8,2013-04-09,TECH,0.020830148831009865,0.9283401370048523,0.050829704850912094
technology,The Worlds Lightest Material-Amazing Pictures!,,2.0,9,2013-04-10,TECH,0.04422668740153313,0.9186404943466187,0.0371328666806221
technology,"Xbox 720 Roundup: May 21 Announcement, x86 Chip, No Backwards Compatibility",,8.0,9,2013-04-10,TECH,0.02805284969508648,0.9276601672172546,0.04428704082965851
technology,VUDU Break-in: Hard drives stolen with user info.,,1.0,9,2013-04-10,TECH,0.25675642490386963,0.7242716550827026,0.018971899524331093
technology,Now CBS is threatening to become a cable channel if Aereo isn’t shut down,,67.0,84,2013-04-10,TECH,0.03341637924313545,0.9378705024719238,0.028713136911392212
technology,Intel announces full set of new Atom and Xeon server processors to fend off ARM,,6.0,8,2013-04-10,TECH,0.01235329732298851,0.8732191920280457,0.11442753672599792
technology,Windows Phone 8 Collection By Huawei – New Addition In Windows Phone 8,,0.0,8,2013-04-10,TECH,0.015642277896404266,0.9167142510414124,0.06764347106218338
technology,RasPi Weekly,,0.0,8,2013-04-10,TECH,0.029233107343316078,0.9052126407623291,0.06555427610874176
technology,Why Mozilla had a change of heart about WebP images,,2.0,8,2013-04-10,TECH,0.029494406655430794,0.9360226392745972,0.03448287770152092
technology,"In June 2007, I filed a Freedom of Information Act (FOIA) request to learn more about the basis for Google's complaint that Microsoft's implementation of desktop search in Windows Vista violated the terms of its 2002 antitrust consent agreement. After six years, the truth can finally be told.",,3.0,8,2013-04-10,TECH,0.22544662654399872,0.6904263496398926,0.0841270238161087
technology,Reddit Checker for Chrome - Check if content has been submitted on reddit,,2.0,8,2013-04-10,TECH,0.07193070650100708,0.9074915051460266,0.020577775314450264
gadgets,Snoutlets!,,48.0,953,2013-04-11,TECH,0.05713406205177307,0.8350829482078552,0.10778298228979111
technology,US Military to build robots with real brains!,,6.0,9,2013-04-11,TECH,0.020771430805325508,0.9222679734230042,0.056960586458444595
technology,"Energy efficient car can go 1,525 kilometres per litre",,0.0,9,2013-04-11,TECH,0.020781997591257095,0.7368123531341553,0.24240562319755554
technology,"Bitcoin Was the 'Victim of Its Own Success,' Not DDOS Attack",,28.0,89,2013-04-11,TECH,0.06407275050878525,0.9047136306762695,0.031213629990816116
technology,"Google released today the ""Inactive Account Manager"". You can set your Google account to give full access to a select group of people. If your account is inactive for 6+ months (i.e. if you die) then those people can log into your account and download your mail, pictures, youtube videos, etc.",,76.0,839,2013-04-11,TECH,0.04289793595671654,0.9378576874732971,0.019244423136115074
technology,IRS May Be Sifting Through Email in Defiance of Court Order,,0.0,8,2013-04-11,TECH,0.08428434282541275,0.8976990580558777,0.01801665686070919
technology,"A stolen MacBook apparently goes on an epic journey from London to Iran, sending back goofy images of the new owners to the theft victim. A riveting story, unless it's a publicity stunt.",,0.0,8,2013-04-11,TECH,0.07202264666557312,0.9041297435760498,0.023847555741667747
gadgets,15 More Insanely Specific Kitchen Gadgets,,8.0,8,2013-04-11,TECH,0.03740006685256958,0.9256243705749512,0.03697555512189865
technology,Apple's desire to dump Google Services sends it fleeing to Yahoo,,3.0,8,2013-04-11,TECH,0.7088223695755005,0.2673805356025696,0.023797104135155678
technology,Spotify now steals focus to its advertisements.,,6.0,8,2013-04-11,TECH,0.1009841188788414,0.724243700504303,0.17477217316627502
technology,Researchers use DVD player to detect HIV in a matter of minutes,,0.0,9,2013-04-12,TECH,0.0561944916844368,0.9144264459609985,0.029379110783338547
technology,"Despite the fact that Spain enacted an anti-piracy law in 2011 (under pressure from the United States), the country is now working on a new one as a way to keep the Iberian nation off of an American watchlist",,0.0,9,2013-04-12,TECH,0.024525973945856094,0.8475663065910339,0.1279076784849167
technology,'Chinese Google' Baidu Opens Artificial-Intelligence Lab in Silicon Valley,,0.0,9,2013-04-12,TECH,0.026143191382288933,0.9280675649642944,0.04578923061490059
gadgets,Titanium Escape Ring – just what you need when you're on the run,,83.0,850,2013-04-12,TECH,0.029724013060331345,0.9161043167114258,0.054171591997146606
technology,What Privacy? CISPA Passes in Closed Door Vote,,5.0,82,2013-04-12,TECH,0.03875599056482315,0.8896853923797607,0.07155855000019073
technology,KB2839011 Released to Address Security Bulletin Update Issue - MSRC - Site Home,,5.0,8,2013-04-12,TECH,0.043773360550403595,0.9345372319221497,0.021689459681510925
gadgets,New Subreddit for DIY/Hacked Gadgets /r/DIYGadets - Please take a look!,,1.0,8,2013-04-12,TECH,0.032974038273096085,0.940744161605835,0.02628178708255291
technology,"Wind Turbine With Record-Breaking Rotors: The gigantic rotor, which measures 154 meters, has to withstand huge air masses, as it is hit by the energy of 200 tons of air per second when the wind blows at a speed of 10 meters per second.",,0.0,8,2013-04-12,TECH,0.021626939997076988,0.8953807353973389,0.08299233764410019
technology,Oculight LED hack gives the Oculus Rift a hint of peripheral vision (video),,1.0,8,2013-04-12,TECH,0.01636333204805851,0.9181432127952576,0.06549350917339325
gadgets,Samsung Galaxy Mega is official and comes in 6.3- and 5.8-inch sizes,,2.0,8,2013-04-12,TECH,0.02908479981124401,0.9151648879051208,0.05575038492679596
technology,Unfinished text message of a fatally injured driver,,375.0,985,2013-04-13,TECH,0.7643756866455078,0.20787012577056885,0.027754155918955803
technology,"Lobbying group representing Google, Yahoo, and Microsoft sends letter to Congress in support of CISPA",,64.0,929,2013-04-13,TECH,0.02699621394276619,0.8528084754943848,0.12019527703523636
technology,"Lobby group representing Google, Yahoo backs CISPA",,0.0,9,2013-04-13,TECH,0.02752815932035446,0.9272153377532959,0.04525653272867203
technology,New Mars Photos May Reveal 1970s Soviet Lander,,5.0,86,2013-04-13,TECH,0.01851355843245983,0.9275557994842529,0.053930655121803284
technology,56 percent of all patent lawsuits are made by patent trolls | ZDNet,,87.0,820,2013-04-13,TECH,0.41048213839530945,0.5631827116012573,0.02633514255285263
technology,Crowdfunding for economics,,0.0,8,2013-04-13,TECH,0.07022901624441147,0.8845517635345459,0.04521914944052696
technology,North Korea Pirates Spy Tools and Porn on BitTorrent,,1.0,8,2013-04-13,TECH,0.12774479389190674,0.8381896018981934,0.03406563401222229
technology,Graphene nanoplatelets used to make battery anode with four times the capacity available now at commercial scale,,39.0,77,2013-04-13,TECH,0.013875574804842472,0.9137144088745117,0.07241001725196838
technology,Australia To Propose Copyright Reform That Includes Fair Use,,3.0,71,2013-04-13,TECH,0.01597464084625244,0.8780453205108643,0.10597997158765793
technology,BBC News - How environmentally friendly are electric cars?,,3.0,7,2013-04-13,TECH,0.019700832664966583,0.9065962433815002,0.07370292395353317
technology,"What Bitcoin teaches us about the Internet’s energy use - ""at Bloomberg, Mark Gimein calls Bitcoin — yes, Bitcoin — an “environmental disaster.” Why? Because all that processing power used to mine for new Bitcoins requires a staggering amount of energy""",,412.0,965,2013-04-14,TECH,0.023630032315850258,0.9285060167312622,0.047863904386758804
technology,"Introducing Boosted Boards, The World's Lightest Electric Vehicle",,15.0,92,2013-04-14,TECH,0.02122459001839161,0.9251604080200195,0.053614985197782516
technology,Facebook Home a Dud – Users are pissed they can't use their own phones,,25.0,9,2013-04-14,TECH,0.08545441925525665,0.8968421816825867,0.017703374847769737
technology,"What is CISPA, and what does it mean for you? FAQ",,4.0,89,2013-04-14,TECH,0.03517405316233635,0.9225116968154907,0.042314279824495316
technology,Mozilla TowTruck - realtime collaboration on any site,,9.0,86,2013-04-14,TECH,0.035147231072187424,0.933880627155304,0.03097209520637989
gadgets,What do you think I should do? (HTC One vs. Galaxy S4),"So, after the unveil from both companies, I originally had my heart set on the HTC One, with one big con that could possibly be the deal breaker: lack of expandable memory. The HTC One is the phone I truly want, but I don't want my 32 GB memory card to just go to waste. That's not to say that the Galaxy S4 isn't a good phone, I just don't wanna feel like I'm settling. What do you think?",121.0,81,2013-04-14,TECH,0.11545112729072571,0.8553240895271301,0.029224839061498642
technology,Cyborg bugs and glow-in-the-dark cats: How we're engineering animals,,0.0,8,2013-04-14,TECH,0.03026852011680603,0.9362216591835022,0.033509787172079086
gadgets,"Now That We Have All These Devices, It’s Time For Them To Truly Work Together",,2.0,8,2013-04-14,TECH,0.019811494275927544,0.7807453274726868,0.19944317638874054
technology,The Real Story Behind Facebook Moderation and Your Petty Reports,,1.0,8,2013-04-14,TECH,0.05448668450117111,0.918138861656189,0.027374407276511192
gadgets,"Powered surfboard? Yes, please!",,0.0,8,2013-04-14,TECH,0.02044692076742649,0.896725594997406,0.08282742649316788
gadgets,"Hey, r/gadgets. Exactly a year ago I a posted a link here to a crappy little website I'd made for my invention -- a folding dry-erase board. You made that invention (""the Noteboard"") mildly famous. Now it's my full-time job and has been for several months. Thank you for changing my life.",,21.0,95,2013-04-15,TECH,0.03967327997088432,0.9140565991401672,0.04627010226249695
technology,Microsoft applies for ‘Blink’ trademark less than one week after Google announces Blink,,35.0,87,2013-04-15,TECH,0.07220211625099182,0.9029380679130554,0.02485976368188858
technology,Weekend project: site to read what women have written about you on Lulu.,,63.0,81,2013-04-15,TECH,0.04019368812441826,0.9040929079055786,0.055713359266519547
technology,C/Ada/ObjC/C++/Fortran cross compiler for Android,,3.0,8,2013-04-15,TECH,0.03581368178129196,0.9247454404830933,0.039440885186195374
