subreddit,title,selftext,num_comments,score,created_utc,stock/sector,neg,neu,pos
technology,Google Glass How-to: Getting Started,,1.0,9,2013-04-30,TECH,0.03056199662387371,0.8518508672714233,0.1175871267914772
gadgets,LG to start selling curved OLED TVs in South Korea,,1.0,9,2013-04-30,TECH,0.024815017357468605,0.8628453016281128,0.11233966797590256
technology,Comcast's hidden policy: Business Internet customers w/static IPs must rent modems,,20.0,85,2013-04-30,TECH,0.03509264439344406,0.9414450526237488,0.023462288081645966
technology,Verizon's Still Happily Blocking Google Wallet And The FCC Is Still Ignoring Verizon's Bad Behavior,,0.0,8,2013-04-30,TECH,0.6662291884422302,0.3062226176261902,0.027548184618353844
technology,"Mozilla to sue spy tech company Gamma Group over ""offensive"" trademark violation.",,0.0,8,2013-04-30,TECH,0.32858073711395264,0.6543905735015869,0.017028683796525
technology,"German Ministry of Education Throws Away PCs For 190,000 € Due To Virus Infection. It was cheaper to replace the PCs then fix them.",,8.0,8,2013-04-30,TECH,0.9204398393630981,0.06732971966266632,0.012230345979332924
technology,Nokia reportedly investing in Lytro-style array camera startup,,0.0,8,2013-04-30,TECH,0.013556006364524364,0.8592453598976135,0.12719860672950745
technology,"CERN celebrates 20 years of a free, open web by restoring world's first website",,32.0,797,2013-04-30,TECH,0.01113449689000845,0.775580108165741,0.2132853865623474
technology,"20 years ago today, CERN published a statement that made WWW free of loyalty.",,8.0,75,2013-04-30,TECH,0.018295899033546448,0.939513623714447,0.04219045862555504
