subreddit,title,selftext,num_comments,score,created_utc,stock/sector,neg,neu,pos
technology,Software experts to release code for car hack,,9.0,70,2013-07-28,TECH,0.02661636658012867,0.9438909292221069,0.02949264645576477
technology,Cutting Cables: it's happened several times the past few years - the other way of controlling the internet,,1.0,7,2013-07-28,TECH,0.04434571415185928,0.901646614074707,0.05400766804814339
technology,The impossible becomes the possible! Learn how to live the life of you're Dreams now!,,0.0,7,2013-07-28,TECH,0.04146706312894821,0.9163107872009277,0.04222212731838226
technology,When 'Smart Homes' Get Hacked: I Haunted A Complete Stranger's House Via The Internet,,21.0,99,2013-07-29,TECH,0.07556883990764618,0.9060539603233337,0.018377266824245453
technology,"Sony and Panasonic sign basic agreement to jointly develop standard for professional-use next-generation optical discs, will target the development of an optical disc with recording capacity of at least 300GB by the end of 2015",,171.0,945,2013-07-29,TECH,0.012024101801216602,0.8567487001419067,0.13122716546058655
technology,UK Watchdog Tired of ISPs' Loose Definition of 'Unlimited' - Maybe Someday Carriers Will Stop Abusing The Word,,1.0,9,2013-07-29,TECH,0.03510254621505737,0.902396559715271,0.06250092387199402
gadgets,Canary is a simple device packed with smart sensors that empowers you to keep your home safe and secure — controlled through your mobile device.,,0.0,9,2013-07-29,TECH,0.01586081087589264,0.9035666584968567,0.08057256042957306
technology,Is Nokia getting sick of Windows Phone?,,3.0,9,2013-07-29,TECH,0.6336669325828552,0.332405149936676,0.03392793610692024
technology,Disney's Amazing Air Cannons Let You Touch the Digital World,,0.0,9,2013-07-29,TECH,0.022986456751823425,0.9257683157920837,0.051245253533124924
technology,What the Ashcroft “Hospital Showdown” on NSA spying was all about. How the government sought to justify blanket collection of Internet metadata.,,1.0,9,2013-07-29,TECH,0.19347336888313293,0.7728769779205322,0.03364967182278633
technology,"Yes, You will even be able to 3D Print an Airplane... MakerPlane.org | Open Source Aviation",,0.0,9,2013-07-29,TECH,0.013278035447001457,0.9224711060523987,0.06425083428621292
technology,Moscow Metro says new tracking system is to find stolen phones; no one believes them,,0.0,8,2013-07-29,TECH,0.315975546836853,0.6369762420654297,0.047048140317201614
technology,Apple's Unkept Promises: China Labor Watch releases a new report on the appalling working conditions of Apple's suppliers,,2.0,8,2013-07-29,TECH,0.36253827810287476,0.5993738770484924,0.038087841123342514
technology,The Window: Watch the Rebirth of the American Car in Tesla's Stunning Factory,,18.0,97,2013-07-30,TECH,0.014643202535808086,0.45021355152130127,0.535143256187439
technology,Dad of Aaron Swartz knocks MIT report on Internet activist’s suicide,,2.0,9,2013-07-30,TECH,0.06453385949134827,0.8817835450172424,0.05368262529373169
technology,"Google Engineer Wins NSA Award, then Says NSA Should Be “Abolished”",,3.0,9,2013-07-30,TECH,0.020127758383750916,0.7726227045059204,0.20724953711032867
technology,"In 2014 Genia plans on selling gene sequencers capable of sequencing whole human genomes in minutes for $100, 50x cheaper than today ($5000)",,4.0,9,2013-07-30,TECH,0.013769522309303284,0.8981820344924927,0.08804842084646225
technology,Samsung Galaxy S4 reportedly explodes and burns down a house in Hong Kong,,7.0,9,2013-07-30,TECH,0.23187407851219177,0.7345256209373474,0.03360030800104141
gadgets,"Wootch: If your small kids like to wander, this may be for you",,32.0,86,2013-07-30,TECH,0.08868644386529922,0.875697910785675,0.03561558574438095
technology,Google: We can ban servers on Fiber without violating net neutrality,,58.0,83,2013-07-30,TECH,0.2743486166000366,0.7023829817771912,0.023268362507224083
technology,Why NSA Surveillance Will Be More Damaging Than You Think,,6.0,83,2013-07-30,TECH,0.05184338614344597,0.9268945455551147,0.021262025460600853
technology,"Vimeo, Pandora, HBO Go, and Redbox Instant are reportedly prepping their services for Chromecast support.",,193.0,810,2013-07-30,TECH,0.02590661309659481,0.9318588972091675,0.04223443567752838
technology,"Time Warner gobbles up more cash from customers by raising modem fees -- Monthly modem rental fee goes from $3.95 to $5.99. ""That's $71.88 extra per year compared to the days when Time Warner did not charge for modem usage""",,30.0,81,2013-07-30,TECH,0.03444266319274902,0.9276865124702454,0.037870798259973526
technology,DMCA Abuse Will Cause Censored Product Review to Go Viral,,73.0,987,2013-07-31,TECH,0.025080809369683266,0.9367037415504456,0.03821546584367752
technology,NSA using top-secret program to mine online data of millions of Americans,,161.0,910,2013-07-31,TECH,0.028221387416124344,0.9457038640975952,0.0260747279971838
technology,Protecting journalist sources: Lessons in communicating securely,,1.0,9,2013-07-31,TECH,0.027692202478647232,0.932113766670227,0.04019399359822273
technology,9 reasons why my next computer will be a PC,,37.0,9,2013-07-31,TECH,0.020788490772247314,0.929863452911377,0.049348000437021255
technology,Starbucks switches to Google Wi-Fi to give U.S. customers up to 10-times faster network speeds.,,0.0,9,2013-07-31,TECH,0.014375442638993263,0.8996918201446533,0.08593267947435379
technology,PRISM got you worried? Seecrypt app promises secure calls and texts,,3.0,9,2013-07-31,TECH,0.09635238349437714,0.8779587745666504,0.025688832625746727
technology,"The Obama administration has declassified a secret order directing Verizon Communications to turn over a vast number of Americans’ phone records, and it plans to disclose the document Wednesday morning in time for a Senate hearing",,9.0,89,2013-07-31,TECH,0.05585004761815071,0.9192816615104675,0.024868251755833626
gadgets,Wicked Lasers Spyder III 3 Arctic and Krypton burning lasers and Galaxy lens with camp fire,,22.0,83,2013-07-31,TECH,0.03132754936814308,0.9259699583053589,0.04270251840353012
technology,Spotify's losses grow even though they doubled their revenue in 2012.,,1.0,8,2013-07-31,TECH,0.8169799447059631,0.01673569716513157,0.16628439724445343
technology,Zynga sues “Bang With Friends” for trademark infringement,,0.0,8,2013-07-31,TECH,0.03323645517230034,0.9235902428627014,0.04317329451441765
