subreddit,title,selftext,num_comments,score,created_utc,stock/sector,neg,neu,pos
technology,"Tesla’s new Supercharger network to expand over into new European destinations including locations within Germany, the Netherlands and even the UK",,125,903,2013-09-13,TECH,0.008760099299252033,0.6445318460464478,0.3467080295085907
technology,LHC Celebrates 5 Years of Not Destroying the World,,60,651,2013-09-13,TECH,0.04035475105047226,0.777654230594635,0.1819910705089569
technology,DARPA reveals its plans to boost the Navy’s response to threats in international waters by developing submerged unmanned platforms that can be deployed at a moment’s notice,,75,395,2013-09-13,TECH,0.00842046644538641,0.23459088802337646,0.7569886445999146
technology,"Google's Quest to Eliminate the Language Barrier ""to build the perfect translation computer, a machine that is so inconspicuous and fast 'that you hardly notice it all, except as a whisper in your ear,' a device that can promptly spit out any text, the content of a website ... in any other language""",,69,381,2013-09-13,TECH,0.039544787257909775,0.9341515302658081,0.026303673163056374
technology,Netflix uses pirate sites to determine what shows to buy.,,2080,4140,2013-09-14,TECH,0.28849494457244873,0.6931439638137817,0.018361039459705353
technology,Wikipedia will fail in 4 years (2006),,950,2282,2013-09-14,TECH,0.6141872406005859,0.34775421023368835,0.038058534264564514
technology,"Space on a shoestring: Japan launches new Epsilon rocket: Japan has launched a comparatively cheap and simple solid-fuel rocket on its first mission. The Epsilon successfully delivered its payload, a telescope for remote observation of planets, about an hour after takeoff.",,118,1105,2013-09-14,TECH,0.009429060854017735,0.6163111329078674,0.3742597699165344
technology,How Amateurs Destroyed the Professional Music Business - The problem isn’t piracy — it’s competition.,,227,801,2013-09-14,TECH,0.11555854231119156,0.8580300211906433,0.026411421597003937
technology,"Argentina arrests teen hacker who netted $50,000 a month. The arrest operation shut down the power to the entire neighbourhood to prevent the deletion of sensitive data.",,407,749,2013-09-14,TECH,0.6887226700782776,0.29488885402679443,0.016388429328799248
technology,"Intel turns wine into electricity to power mobile devices -- The researcher boasted that the computing solutions being worked on in Intel Labs are so low in power that in the future we'll be able to ""power them by the heat of our skin, or the ambilight in the room""",,57,529,2013-09-14,TECH,0.013181863352656364,0.8854291439056396,0.10138895362615585
technology,Nearly Half of U.S. Jobs Are Vulnerable to Computerization,,244,203,2013-09-14,TECH,0.04126162827014923,0.9041289687156677,0.05460936948657036
technology,Why the PhoneBloks phone will never happen,,119,175,2013-09-14,TECH,0.10496465861797333,0.8737544417381287,0.021280920132994652
technology,"Office of Secretary of Defense can't get a fax machine fixed, or process Freedom of Information requests",,25,157,2013-09-14,TECH,0.050411805510520935,0.9301301836967468,0.019457997754216194
technology,"With 30 tuners and 30 TB of storage, SnapStream makes TiVos look like toys",,20,149,2013-09-14,TECH,0.02348765917122364,0.9261897206306458,0.050322648137807846
technology,"Net Neutrality debate may decide future of Netflix -- If Verizon has its way, it and other providers like Comcast or AT&amp;T could “play favorites,” by blocking or degrading services such as YouTube or Netflix to promote their own offerings",,2848,4131,2013-09-15,TECH,0.023905159905552864,0.9295878410339355,0.04650703817605972
technology,"It's finally here. Wireless charging for what looks like most electronic devices, safely transmitted through something like your current wifi hub and received by a chip or small dongle, to be made available in 2015. Cota will be huge.",,591,2194,2013-09-15,TECH,0.012022246606647968,0.8402748107910156,0.14770297706127167
technology,"Argentina, Brazil agree on cyber-defense alliance against US espionage",,79,790,2013-09-15,TECH,0.017389265820384026,0.8901379108428955,0.09247279167175293
technology,Tired of how crappy YouTube has become? Here's how to force YouTube to buffer your entire video.,,124,696,2013-09-15,TECH,0.06586296111345291,0.9093292951583862,0.02480781078338623
gadgets,Ray Dolby has died. At 12 o'clock there will be a minute's noise reduction to remember him.,,18,404,2013-09-15,TECH,0.027112742885947227,0.9226969480514526,0.05019030347466469
gadgets,"Neverwet on Skin, this stuff is Awesome",,173,361,2013-09-15,TECH,0.06071320176124573,0.9152462482452393,0.024040598422288895
gadgets,Never plug in your phone again,,84,345,2013-09-15,TECH,0.05601276457309723,0.9129573106765747,0.03102996200323105
technology,How the US government inadvertently created Wikileaks,,17,306,2013-09-15,TECH,0.06981369107961655,0.8940325379371643,0.03615378960967064
technology,"Bruce Schneier: How to remain secure against the government -- How do you communicate securely against such an adversary? ""Encryption works. Properly implemented strong crypto systems are one of the few things that you can rely on.""",,46,230,2013-09-15,TECH,0.015147673897445202,0.9046750068664551,0.08017738163471222
technology,FCC to auction off 10 MHz of spectrum in January 2014,,44,227,2013-09-15,TECH,0.02198164351284504,0.9249213933944702,0.05309689790010452
technology,Google’s next ‘moonshot’ - Google’s Translate team has enormous ambitions to eventually eliminate language barriers with the development of a voice-enabled universal translation system.,,792,3326,2013-09-16,TECH,0.010350925847887993,0.76372891664505,0.2259201854467392
technology,"Gabe Newell: Linux is the future of gaming, new hardware coming soon",,2798,2921,2013-09-16,TECH,0.016170796006917953,0.8415700793266296,0.1422591358423233
technology,At What Point Will The Next Generation Kill The Copyright Monopoly Altogether?,,1882,2231,2013-09-16,TECH,0.0766984224319458,0.8968093991279602,0.0264921635389328
technology,The Internet isn’t making us dumb. It’s making us angry.,,325,1508,2013-09-16,TECH,0.15416710078716278,0.8058412075042725,0.03999171033501625
technology,"Feinstein amendment: defines who is and isn't a ""real journalist"" and declares who qualifies for freedom of press",,548,1444,2013-09-16,TECH,0.044843606650829315,0.9104703664779663,0.04468602314591408
technology,Microsoft's Real-Time Translation Software Converts English to Chinese—and Preserves the Sound of Your Voice,,123,1365,2013-09-16,TECH,0.014651905745267868,0.9228837490081787,0.06246431544423103
technology,"Researchers have built prototypes of a micro-robot, the size of a human cell, that can carry drugs into the body and eliminate the need for risk operations. Measuring 100 microns in length and 40 microns in width, the micro-robot can be injected into the human body without leaving a wound",,120,1355,2013-09-16,TECH,0.019762076437473297,0.9184640645980835,0.06177378445863724
technology,Angry entrepreneur replies to patent troll with racketeering lawsuit,,96,806,2013-09-16,TECH,0.26890334486961365,0.6990714073181152,0.0320252999663353
technology,Amazing Cold-war era spy gear,,35,603,2013-09-16,TECH,0.06772178411483765,0.8868845105171204,0.04539372771978378
technology,"Dear USA, my data has left your building",,161,593,2013-09-16,TECH,0.0796305239200592,0.8747896552085876,0.04557979106903076
technology,Pirate Party Crashes Spy Drone in Front of German Chancellor Angela Merkel,,1221,2845,2013-09-17,TECH,0.6960529088973999,0.2476702779531479,0.05627686157822609
technology,"FEMA Grounds Private Drones That Were Helping To Map Boulder Floods, Threatens To Arrest Operators",,839,2553,2013-09-17,TECH,0.705081582069397,0.23868034780025482,0.05623805150389671
technology,"Anonymous Cop Pens Bizarre Editorial Calling for 'End of Anonymity on the Internet,' Says All Internet Posters Should be Forced to Register with the Government for 'Public Safety'",,837,2208,2013-09-17,TECH,0.5028135776519775,0.47098129987716675,0.026205051690340042
technology,U.S. secret surveillance court rules phone metadata collection lawful,,316,1833,2013-09-17,TECH,0.11104349792003632,0.8688324689865112,0.020124055445194244
technology,Microsoft announces a $40 billion stock buyback and a 22% dividend increase.,,182,1329,2013-09-17,TECH,0.03031644970178604,0.9258242249488831,0.0438593290746212
technology,Tesla moves ahead from Google in race to build self-driving cars,,186,775,2013-09-17,TECH,0.018588576465845108,0.9086241722106934,0.07278730720281601
technology,Brazil looks to break from US-centric Internet,,106,508,2013-09-17,TECH,0.034034162759780884,0.6240571141242981,0.34190869331359863
gadgets,Anyone else still REALLY want one of these?,,115,436,2013-09-17,TECH,0.03662857040762901,0.9165124893188477,0.04685894772410393
gadgets,Google unleashes Coder for Raspberry Pi as kid-friendly tool,,22,405,2013-09-17,TECH,0.033286429941654205,0.9249511957168579,0.041762325912714005
technology,The U.S. military bankrolled early development of a non-lethal microwave weapon that creates sound inside your head. | Wired,,82,377,2013-09-17,TECH,0.01874808967113495,0.9166280031204224,0.06462396681308746
technology,"Verizon, caught red-handed",,864,3368,2013-09-18,TECH,0.041853565722703934,0.9172722697257996,0.040874164551496506
technology,"Soldiers are developing relationships with their battlefield robots, naming them, assigning genders, and even holding funerals when they are destroyed.",,1848,2655,2013-09-18,TECH,0.02790248394012451,0.931629478931427,0.04046807810664177
technology,Dept. of Commerce takes tiny step towards restoring right to unlock cellphones,,342,2491,2013-09-18,TECH,0.014394273050129414,0.506855309009552,0.47875040769577026
technology,Tesla enters race to build self-driving car,,283,1972,2013-09-18,TECH,0.01643497496843338,0.9019126296043396,0.08165235817432404
technology,"'Doctor Who,' 'Sherlock,' and more are coming to Hulu thanks to BBC deal.",,233,1543,2013-09-18,TECH,0.05876144394278526,0.8571478724479675,0.08409062772989273
technology,"Facebook apologizes for dating site ad with photo of Rehtaeh Parsons with ""meet Canadian girls and women for dating, friendship and relationships."" Parsons killed herself after being sexually assaulted then subsequently bullied on Facebook.",,216,1164,2013-09-18,TECH,0.147978737950325,0.8272645473480225,0.02475675754249096
technology,11 Million Users Drop Facebook Over Privacy Concerns,,110,842,2013-09-18,TECH,0.9129152297973633,0.07641299813985825,0.01067177765071392
technology,AnandTech: The iPhone 5s Review,,787,840,2013-09-18,TECH,0.022157516330480576,0.9099985957145691,0.06784392893314362
technology,Google launches new venture to extend human life.,,174,611,2013-09-18,TECH,0.011837528087198734,0.8361642360687256,0.15199819207191467
technology,"Since Netflix launched in Canada 3 years ago, torrenting down 50% [X-post from /r/Canada]",,83,458,2013-09-18,TECH,0.029537852853536606,0.905226469039917,0.06523571163415909
technology,Nintendo visionary Hiroshi Yamauchi dies aged 85,,715,3515,2013-09-19,TECH,0.16504664719104767,0.7956100106239319,0.03934332728385925
technology,"iOS 7 Bug Lets Anyone Bypass iPhone's Lockscreen To Hijack Photos, Email, Or Twitter",,1025,2751,2013-09-19,TECH,0.05972546339035034,0.9213750958442688,0.018899476155638695
technology,Linus Torvalds Admits He's Been Asked To Insert Backdoor Into Linux,,434,1569,2013-09-19,TECH,0.04164085164666176,0.917405366897583,0.04095377027988434
technology,Facebook's Zuckerberg says U.S. spying hurt users' trust,,308,1383,2013-09-19,TECH,0.8181653618812561,0.160573348402977,0.021261299028992653
technology,"Microsoft won’t make Office editing free on iOS/Android, so Google does",,276,1345,2013-09-19,TECH,0.4020497500896454,0.5735599398612976,0.024390339851379395
technology,Massive Music Piracy Plunge Fails to Halt Decline in Sales,,171,922,2013-09-19,TECH,0.9428715109825134,0.03839223086833954,0.01873626746237278
technology,"Charles Carreon finally quits fighting, calls Oatmeal battle “a dumb thing”: Lawyer says he was ""rapeutated,"" unjustly lowering his reputation online",,101,537,2013-09-19,TECH,0.044667139649391174,0.9062663316726685,0.04906654357910156
technology,"Pay TV facing first-ever year of declines in total subscribers, thanks to 'cord nevers' who watch everything streaming",,184,468,2013-09-19,TECH,0.6073688268661499,0.36043280363082886,0.032198332250118256
technology,"German chancellor’s drone “attack” shows the threat of weaponized UAVs. Dutch researchers warn that the next time, that drone could explode.",,132,422,2013-09-19,TECH,0.10569747537374496,0.799821674823761,0.09448081254959106
technology,"Google will create Calico, a new company focused on health and well-being, in particular the challenge of aging and associated diseases.",,83,388,2013-09-19,TECH,0.06240302324295044,0.9081238508224487,0.02947310358285904
technology,Tesla patents electric car battery that gets 400 miles on a single charge,,369,2776,2013-09-20,TECH,0.011356671340763569,0.898262083530426,0.09038130939006805
technology,"BlackBerry announces nearly $1 billion loss due failed Z10 failure, 4,500 layoffs on the way",,1823,2718,2013-09-20,TECH,0.7667919993400574,0.20332451164722443,0.0298834927380085
technology,Ballmer calls Google a 'monopoly' that authorities should control,,3444,2192,2013-09-20,TECH,0.44864165782928467,0.5305556058883667,0.020802738144993782
technology,Bento: A beginner's cheat sheet for learning everything about web development,,316,2036,2013-09-20,TECH,0.02886972948908806,0.9320222735404968,0.03910796716809273
technology,"Advanced computer simulations show Elon Musk's Hyperloop is ""quite viable""",,219,1075,2013-09-20,TECH,0.03267882391810417,0.9135133028030396,0.05380789563059807
technology,Can Apple Read Your iMessages? Yes! iOS Hacker @Pod2g Reveals The Truth About Apple Encryption Services And What It Means For Your Privacy,,118,867,2013-09-20,TECH,0.020930834114551544,0.9077566266059875,0.0713125541806221
technology,Apple's A7 processor is made by Samsung,,188,806,2013-09-20,TECH,0.011396982707083225,0.674331545829773,0.3142715096473694
technology,"Homeless, Unemployed, and Surviving on Bitcoins",,252,538,2013-09-20,TECH,0.3292977511882782,0.6316140294075012,0.03908821940422058
technology,"Linkedin may be hacking your email contacts, and spamming them with invitations.",,107,527,2013-09-20,TECH,0.03293881192803383,0.9382374286651611,0.028823791071772575
technology,"Facebook Added to Russian Website Blocklist, Joins 30,000 Unofficial Others",,61,414,2013-09-20,TECH,0.04797074943780899,0.9279263019561768,0.0241029504686594
technology,Robotic cars could prevent 90% of road accidents and transform the front seat into an office but that might not be enough to convince humans to give up driving.,,4786,2851,2013-09-21,TECH,0.01585187017917633,0.7170953750610352,0.2670527994632721
technology,"LinkedIn sued by users who say it hacked email accounts, stole contact lists",,444,2483,2013-09-21,TECH,0.8082824945449829,0.17094847559928894,0.020769009366631508
gadgets,"I don't care what you call yourself. If you are trying to sell a USB cable for $700, you are a scam artist.",,298,1669,2013-09-21,TECH,0.02067866362631321,0.9371397495269775,0.042181603610515594
technology,3ders.org - Peachy Printer - The world's first $100 3D Printer,,233,1664,2013-09-21,TECH,0.011822037398815155,0.8583815097808838,0.12979644536972046
technology,BitTorrent Admins Face Six Years in Jail After Spanish Govt. Approves New Law. Amendments to the country’s penal code passed yesterday means that admins of sites offering links to copyrighted works without the owners’ permission will face jail sentences of up to six years.,,120,584,2013-09-21,TECH,0.25018227100372314,0.7249616980552673,0.024856017902493477
technology,Microsoft's response to Siri: Say hello to Cortana.,,172,439,2013-09-21,TECH,0.028329815715551376,0.9262232780456543,0.045446887612342834
technology,Judge will not ban Dish's Hopper technology,,62,311,2013-09-21,TECH,0.12680819630622864,0.7999988794326782,0.07319296896457672
technology,DuckDNS - a completely free (as in beer) DDNS solution.,,115,308,2013-09-21,TECH,0.015410578809678555,0.9278531670570374,0.0567362941801548
technology,Man's Samsung Galaxy S4 randomly explodes in his pocket while at the store.,,144,265,2013-09-21,TECH,0.020307693630456924,0.8931179046630859,0.08657439798116684
gadgets,Latest iOS 7 bug lets you place calls from a locked iPhone,,46,238,2013-09-21,TECH,0.2849954664707184,0.6929704546928406,0.022034091874957085
technology,Chaos Computer Club breaks Apple TouchID,,1949,2648,2013-09-22,TECH,0.06825179606676102,0.8946242332458496,0.0371238999068737
technology,Nokia's 'Thanks Apple' taunt goes down as one of the most retweeted brand tweets ever.,,1629,2063,2013-09-22,TECH,0.02062220498919487,0.9120532274246216,0.06732454150915146
technology,Apple ran out of gold iPhones is because it underestimated how much Asia likes gold,,440,1727,2013-09-22,TECH,0.014043210074305534,0.8496973514556885,0.13625940680503845
technology,iPhone 5s fingerprint sensor gets completely misunderstood | TUAW,,929,1077,2013-09-22,TECH,0.647097647190094,0.3316181004047394,0.02128419652581215
technology,"Wikileaks releases ""Spy Files 3"" - 249 documents from 92 global intelligence contractors",,24,610,2013-09-22,TECH,0.03875041753053665,0.9286978244781494,0.03255172446370125
technology,What A Difference Six Years Makes...,,134,499,2013-09-22,TECH,0.04363235458731651,0.8389412760734558,0.11742640286684036
technology,Close the N.S.A.’s Back Doors,,65,453,2013-09-22,TECH,0.03498049080371857,0.9219927191734314,0.04302677884697914
technology,Warner Bros. DMCA Fraud and Abuse Case Goes to Jury,,27,318,2013-09-22,TECH,0.37200331687927246,0.5866228342056274,0.04137387499213219
technology,How to Tell Your Mother and Your Bosses Why They Should Protest Surveillance,,38,230,2013-09-22,TECH,0.36957138776779175,0.6023733615875244,0.028055284172296524
technology,Step away from the phone: Smartphone addicts are starting to curb the habit,,33,213,2013-09-22,TECH,0.2022179514169693,0.6342044472694397,0.16357766091823578
technology,SteamOS Announced!,,2023,3878,2013-09-23,TECH,0.028175342828035355,0.9120405912399292,0.059784095734357834
technology,Peachy Printer's sub-$100 3D printer smashes fundraising goal (video),,829,2813,2013-09-23,TECH,0.011623661033809185,0.8679722547531128,0.12040414661169052
technology,"Finally, we won’t have to power off during takeoff and landing - FAA expected to officially change electronics rule this week",,437,2450,2013-09-23,TECH,0.04125083610415459,0.9245434403419495,0.03420569375157356
technology,"Content Industry Drafts Anti-Piracy Curriculum for Elementary Schools ""A near-final draft of the curriculum shows that it comes in different flavors for every grade from kindergarten through sixth, to keep pace with your developing child’s ability to understand that copying is theft, period.""",,886,1437,2013-09-23,TECH,0.02730097435414791,0.9020063877105713,0.07069260627031326
technology,"The Government Is Spying On Us Through Our Computers, Phones, Cars, Buses, Streetlights, At Airports And On The Street, Via Mobile Scanners And Drones, Through Our Smart Meters, And In Many Other Ways -- A link list detailing the disregard for privacy",,63,901,2013-09-23,TECH,0.03239155933260918,0.941276490688324,0.02633192390203476
technology,Microsoft announces Surface Pro 2 with updated kickstand and Haswell processor,,691,857,2013-09-23,TECH,0.030764637514948845,0.8838579058647156,0.08537747710943222
technology,Germany Caps Piracy Fines - The Hollywood Reporter,,65,565,2013-09-23,TECH,0.7276648283004761,0.18074144423007965,0.09159376472234726
technology,"Bye Bye Blackberry, BlackBerry leaves the consumer market",,136,562,2013-09-23,TECH,0.18258202075958252,0.6610241532325745,0.1563938409090042
technology,Apple sells 9 million iPhones over the 5c/5s opening weekend and 200M iOS devices are now running iOS 7.,,472,496,2013-09-23,TECH,0.014975146390497684,0.8949935436248779,0.09003135561943054
technology,New York Police Department sending out officers with pamphlets advising Apple users to update to iOS 7.,,134,440,2013-09-23,TECH,0.4809277653694153,0.481662780046463,0.037409402430057526
technology,Nokia admits giving misleading info about Elop's compensation -- he had a massive incentive to tank the share price and sell the company,,903,2847,2013-09-24,TECH,0.7910142540931702,0.17333725094795227,0.035648465156555176
technology,"Nvidia seeks peace with Linux, pledges help on open source driver (Updated)",,793,2626,2013-09-24,TECH,0.01616859994828701,0.8504478931427002,0.13338352739810944
technology,"Dropbox joins the call for transparency, asks government to let it publish surveillance requests.",,144,1768,2013-09-24,TECH,0.06142018362879753,0.9149158596992493,0.02366403490304947
technology,$649 iPhone 5s Costs Apple $199 To Make,,839,992,2013-09-24,TECH,0.023613715544342995,0.9091771245002747,0.0672091469168663
technology,"Verizon CEO: Unlimited data plans are a dead end, despite Sprint and T-Mobile",,530,806,2013-09-24,TECH,0.31058111786842346,0.6549393534660339,0.0344795286655426
technology,Analysis: Can SteamOS drag the PC game industry over to Linux?,,547,720,2013-09-24,TECH,0.046155866235494614,0.9139336943626404,0.039910465478897095
technology,Behind the scenes at Valve - how going boss-free spurred on the firm's success,,183,662,2013-09-24,TECH,0.038314089179039,0.8808556199073792,0.08083037286996841
technology,"BlackBerry executives bought a $20million jet just before phone company sacked 4,500 employees",,66,567,2013-09-24,TECH,0.21573945879936218,0.7497630715370178,0.03449743986129761
technology,iMessage For Android Sounds Great But It's A Serious Security Issue ... here's why.,,145,344,2013-09-24,TECH,0.018778441473841667,0.881859302520752,0.09936227649450302
technology,Firefox burns Chrome in our trustworthy browser poll,,111,340,2013-09-24,TECH,0.02254817634820938,0.9188399314880371,0.05861194431781769
technology,"800 Years of Power From Waste: Bill Gates is funding research to build a reactor that runs on uranium 238, the waste product from modern u-235 reactors",,1285,3678,2013-09-25,TECH,0.023286763578653336,0.9187015891075134,0.05801166966557503
technology,VLC new major release (2.1.0) is out!,,1818,3363,2013-09-25,TECH,0.025696886703372,0.9183115363121033,0.055991578847169876
technology,"Youtube revamps comments feed... Say goodbye to all the ""how I make $10,000 a day comments"".",,1458,2870,2013-09-25,TECH,0.042714182287454605,0.9207218289375305,0.03656405210494995
technology,"All Americans hacked: Major data brokers hacked and American data sold for millions on fraud websites for months, possibly over a year",,368,2616,2013-09-25,TECH,0.4875866174697876,0.48384639620780945,0.02856690064072609
technology,Valve unveils Steam Machines,,838,1990,2013-09-25,TECH,0.031209032982587814,0.9110089540481567,0.05778195336461067
technology,"Either someone just broke the speed of light or the federal reserve has been hacked. Even though it takes 7 milliseconds for the fed interest rate report to reach Chicago, Several gigantic trades were made 4-5 milliseconds before the official report was released, reaping huge profits.",,230,1311,2013-09-25,TECH,0.09816627204418182,0.8644741177558899,0.03735963627696037
technology,"DOJ study on license plate trackers finds ""no significant difference"" in crime. Privacy cost and no security gain.",,90,1056,2013-09-25,TECH,0.011301331222057343,0.6240620017051697,0.3646366000175476
technology,Finnish media: Nokia pleads with Elop to accept smaller bonus – Elop claims he needs full $25M for his divorce,,275,878,2013-09-25,TECH,0.0366707369685173,0.8504282236099243,0.11290105432271957
technology,"Dell drops Windows RT, only Microsoft remains selling the OS",,136,522,2013-09-25,TECH,0.8945169448852539,0.08507751673460007,0.020405566319823265
gadgets,Apple Maps sends errant drivers onto airport runway,,97,520,2013-09-25,TECH,0.19969114661216736,0.7675989270210266,0.03270994871854782
technology,Report: 20% of all Yelp reviews are written by paid shills,,1983,3845,2013-09-26,TECH,0.04266539216041565,0.9257922172546387,0.03154238313436508
technology,Verizon lawyer says 'the company wants to prioritize those websites and services that are willing to shell out for better access... also admitted that the company would like to block online content from those companies or individuals that don't pay Verizon's tolls',,483,2368,2013-09-26,TECH,0.08177975565195084,0.8820909261703491,0.036129336804151535
technology,"Bill Gates admits Control-Alt-Delete was a mistake and blames IBM: ""We could have had a single button, but the guy who did the IBM keyboard design didn't wanna give us our single button.""",,563,2270,2013-09-26,TECH,0.02428247593343258,0.9168280363082886,0.05888951197266579
technology,"Crush the Carriers: For real mobile phone innovation, someone needs to smash AT&amp;T and Verizon.",,341,1467,2013-09-26,TECH,0.02168590947985649,0.8766039609909058,0.10171019285917282
technology,"Say No to Internet Censorship: For the first time, actual Presidents and Prime Ministers of 12 powerful countries will meet behind closed doors to seal an extreme Internet censorship plan called the Trans Pacific Partnership (TPP)",,80,1403,2013-09-26,TECH,0.019510269165039062,0.8959337472915649,0.08455600589513779
technology,"Republicans have included ""Blocking Net Neutrality Regulations"" as one condition to raise the debt ceiling",,106,381,2013-09-26,TECH,0.12080428749322891,0.7751208543777466,0.10407489538192749
technology,Netflix gloats as broadcast television ratings continue to horrify,,66,300,2013-09-26,TECH,0.041860610246658325,0.8992904424667358,0.05884893611073494
