subreddit,title,selftext,num_comments,score,created_utc,stock/sector,neg,neu,pos
technology,"Anti-patent-troll ads launch on radio and in print in 15 states. Tech companies join retailers, restaurants, and grocers to get Congress' attention.",,456,3170,2013-09-01,TECH,0.01888083480298519,0.9230439066886902,0.05807528644800186
technology,Pandora removes 40 hour per month limit on free mobile listening,,1372,2863,2013-09-01,TECH,0.05987083166837692,0.8915275931358337,0.048601578921079636
technology,Per-MB hard disk prices are still higher than at the end of 2010,,497,1480,2013-09-01,TECH,0.14717598259449005,0.04826708510518074,0.8045569658279419
technology,E-book purchasers could get up to $3.06 per book in price-fixing settlement -- Five publishers allegedly conspired with Apple to keep prices artificially high,,164,1156,2013-09-01,TECH,0.045488305389881134,0.9006598591804504,0.05385185778141022
technology,"Windows 9 rumored for next year, Windows 10 to be ‘cloud OS’",,894,689,2013-09-01,TECH,0.01697339117527008,0.9328988790512085,0.05012774094939232
technology,"Across the US, ‘mystery’ car unlocking devices have cops stumped.",,222,542,2013-09-01,TECH,0.058715615421533585,0.8925579786300659,0.04872635006904602
technology,"Tiny Mexican village launches its own cellular service, 13 times cheaper than big telecoms",,35,505,2013-09-01,TECH,0.00957718025892973,0.487044095993042,0.5033786296844482
technology,The light shining onto Spain's 40-story tall solar power tower is so intense it illuminates into visible beams in the air. It outputs 11MW.,,95,470,2013-09-01,TECH,0.014759187586605549,0.88654625415802,0.0986945852637291
technology,"For the last year, the Pentagon's top technologists have been working on 'Plan X', a program that will make cyberwarfare as easy as Angry Birds.",,101,393,2013-09-01,TECH,0.040567412972450256,0.910346269607544,0.04908629506826401
technology,"Vincent Connare, Inventor Of 'The Most Hated Font,' Defends Himself",,102,227,2013-09-01,TECH,0.03384241834282875,0.9148610234260559,0.05129648372530937
technology,"DEA supplied with access to vast database of AT&amp;T phone records | Project Hemisphere, which was detailed in slides supplied to the New York Times, included access to phone logs dating back 26 years.",,298,2746,2013-09-02,TECH,0.02491656504571438,0.9426972270011902,0.03238626569509506
technology,A Federal Judge Says Search Warrants for E-mails Must Be ‘Limited’,,192,2674,2013-09-02,TECH,0.47166362404823303,0.5006090402603149,0.027727263048291206
technology,"Google has a plan: to get into your brain. ""Eventually you'll have an implant."" said Google CEO Larry Page, ""When you think about something and don't really know much about it, you will automatically get information.""",,2261,2473,2013-09-02,TECH,0.029665401205420494,0.9305435419082642,0.03979111835360527
technology,Lenovo CEO Shares Bonus with Workers for a Second Year,,439,1936,2013-09-02,TECH,0.11930572986602783,0.7360748648643494,0.1446194052696228
technology,"US Army ignores shared PC login flaw, asks soldiers to keep quiet: A soldier was made to sign a non-disclosure agreement by the US Army after pointing out a security flaw which allowed accounts on shared PCs to be accessed without proper authentication",,201,1342,2013-09-02,TECH,0.30514031648635864,0.6674589514732361,0.02740076743066311
technology,Reversing Sinclair's amazing 1974 calculator hack,,68,820,2013-09-02,TECH,0.024065274745225906,0.9216681718826294,0.05426659807562828
technology,Marines.com hacked with a message to US Marines about Syria.,,239,792,2013-09-02,TECH,0.039242833852767944,0.9185677766799927,0.04218943789601326
technology,AT&amp;T partnered with the DEA to provide phone records for over 26 years,,34,649,2013-09-02,TECH,0.021078310906887054,0.9243751168251038,0.054546572268009186
gadgets,Sony Vaio Laptops Have Defective WIFI and Sony is Ignoring Customers,,134,602,2013-09-02,TECH,0.03556074574589729,0.9342106580734253,0.030228616669774055
technology,Stop paying monthly payments! Save on your loans by simply paying Half A Payment,,0,296,2013-09-02,TECH,0.07580246031284332,0.9038216471672058,0.020375879481434822
technology,Amazon announces Kindle MatchBook: Cheap or free ebooks for any physical book you've purchased from Amazon,,942,3611,2013-09-03,TECH,0.01910075917840004,0.9109654426574707,0.06993378698825836
technology,Microsoft to acquire Nokia Devices &amp; Services,,2147,3497,2013-09-03,TECH,0.015053369104862213,0.9225727319717407,0.06237385421991348
technology,Kit Kat's homepage is currently a parody of an Android device announcement page.,,268,1741,2013-09-03,TECH,0.05486109107732773,0.9278010129928589,0.017337869852781296
technology,AT&amp;T Has Employees Embedded In The Gov't Providing Near Realtime Searches On Nearly Every Phone Call,,103,1708,2013-09-03,TECH,0.05480947345495224,0.9217430353164673,0.02344747819006443
technology,Next version of Android (4.4) will be called KITKAT,,429,1126,2013-09-03,TECH,0.019426481798291206,0.9371238350868225,0.04344971477985382
technology,"Kodak officially exits bankruptcy, emerges as a commercial printing company",,107,1046,2013-09-03,TECH,0.20663931965827942,0.7675060629844666,0.025854604318737984
technology,First US-made smartphone just as cheap to produce as imports,,161,1035,2013-09-03,TECH,0.016161339357495308,0.7755165100097656,0.20832212269306183
technology,"Tor Is Less Anonymous Than You Think -- ""Even if an attacker had no control of routers, 80% of Tor users could be de-anonymized within six months. With control of one AS, nearly 100% of users were likely to be uncovered within three months. With two, it could take just one day.""",,83,518,2013-09-03,TECH,0.089969702064991,0.8812664747238159,0.028763791546225548
technology,"When Google and Microsoft ""Stand Together"" against US spying, you know stuff just got real",,91,427,2013-09-03,TECH,0.0193029697984457,0.8396983742713928,0.14099863171577454
technology,NASA’s original flight director calls agency’s direction a “tragedy”,,28,354,2013-09-03,TECH,0.023141779005527496,0.948525607585907,0.028332559391856194
technology,"HDMI 2.0 officially announced: 18Gbps bandwidth, 60fps 4K, 32 channel audio",,2923,3534,2013-09-04,TECH,0.01913858950138092,0.9270373582839966,0.053824104368686676
technology,"The Internet’s next victim: Advertising; What the story of AdBlock Plus tells us: The online economy is broken, and won't be easy to fix",,2774,2676,2013-09-04,TECH,0.06559799611568451,0.8550347089767456,0.07936728000640869
technology,US Stops Jailed Activist Barrett Brown From Discussing Hacking Prosecution,,233,1723,2013-09-04,TECH,0.3945060074329376,0.545613706111908,0.059880297631025314
technology,State AG Says It's OK Ohio Implemented Facial Recognition Program Without Notifying Public Because Everyone Else Is Doing It,,116,1329,2013-09-04,TECH,0.016262857243418694,0.9272714853286743,0.056465644389390945
technology,That free Netflix caching service big ISPs refuse to use may be working wonders.,,200,1089,2013-09-04,TECH,0.03185035288333893,0.8990265130996704,0.06912310421466827
technology,Facebook hashtags said to have zero viral impact | Internet &amp; Media,,99,936,2013-09-04,TECH,0.10176435112953186,0.8774901032447815,0.020745517686009407
technology,RAM prices jump as Hynix lose fabrication facilities in fire,,181,713,2013-09-04,TECH,0.9317042827606201,0.05405231565237045,0.01424335315823555
technology,The guy who hacked Zuckerberg gets a well-deserved career change,,61,695,2013-09-04,TECH,0.038217008113861084,0.9135439395904541,0.048239074647426605
technology,Kim Dotcom resigns as director of MEGA,,86,613,2013-09-04,TECH,0.04439721256494522,0.9169667363166809,0.038636013865470886
technology,"Autonomous vehicles . . . Audi is developing a system that allows the driver to exit the car at the entrance of a parking garage, leaving the vehicle to find a vacant spot on its own",,92,567,2013-09-04,TECH,0.0999075397849083,0.8779208064079285,0.022171618416905403
technology,Paypal freezes Mailpile - privacy aware webmail project's indiegogo funds,,1131,2929,2013-09-05,TECH,0.02992585115134716,0.9353809952735901,0.03469313308596611
technology,Japan's Levitating Train Hits 310 MPH in Trials,,1142,2879,2013-09-05,TECH,0.07416275143623352,0.43630510568618774,0.48953208327293396
technology,US and UK spy agencies defeat privacy and security on the internet,,903,2849,2013-09-05,TECH,0.5936391353607178,0.365244597196579,0.04111625626683235
technology,"Feds Beg NY Times, Pro Publica Not To Reveal That They've Inserted Backdoors Into Internet Encryption",,322,2578,2013-09-05,TECH,0.02882596291601658,0.9185769557952881,0.052597153931856155
technology,N.S.A. Foils Much Internet Encryption,,417,2408,2013-09-05,TECH,0.028305279091000557,0.9356750845909119,0.03601962700486183
technology,The US government has betrayed the internet. We need to take it back,,257,2373,2013-09-05,TECH,0.2521163821220398,0.6899358034133911,0.057947754859924316
technology,Another 1.8 Million People Just Ditched Cable TV,,524,2187,2013-09-05,TECH,0.14411801099777222,0.8115456104278564,0.044336337596178055
technology,Fake Cable Ad Apparently Hits Too Close To Home; Bogus Defamation Claim Censors Video In Canada,,260,1933,2013-09-05,TECH,0.04520171880722046,0.8970267176628113,0.05777154862880707
technology,"Google Streets View goes underground. Trip to salt mine in Wieliczka, Poland.",,198,1719,2013-09-05,TECH,0.030358189716935158,0.9224038124084473,0.047238003462553024
technology,Jeff Bezos thinks 100% ad-supported businesses are bad for users.,,265,1581,2013-09-05,TECH,0.4065869152545929,0.5667936205863953,0.026619428768754005
technology,"Feds Beg NY Times, Pro Publica Not To Reveal That They've Inserted Backdoors Into Internet Encryption",,517,3177,2013-09-06,TECH,0.02882596291601658,0.9185769557952881,0.052597153931856155
technology,"“Shopping cart” patent troll tries to save itself, gets pounded by Newegg",,765,3152,2013-09-06,TECH,0.028435228392481804,0.8603253960609436,0.11123932898044586
technology,Intel Unveils Optical Technology to Kill Copper Cables and Make Data Centers Run Faster,,443,2793,2013-09-06,TECH,0.021163221448659897,0.9167180061340332,0.062118735164403915
technology,Microsoft was ‘surprised’ by negative Xbox One reaction,,341,313,2013-09-06,TECH,0.5736684799194336,0.21433930099010468,0.21199221909046173
technology,"Remember those drone-hunting licenses that don't exist yet? The Colorado town has received $19,006 in orders so far.",,53,218,2013-09-06,TECH,0.022286977618932724,0.9050965905189514,0.07261641323566437
technology,Virgin Galactic's SpaceShipTwo completes its second test flight (video),,28,181,2013-09-06,TECH,0.017917810007929802,0.8749673962593079,0.1071147620677948
gadgets,Samsung Galaxy Note 3 - Thoughts?,,142,163,2013-09-06,TECH,0.018579619005322456,0.9344072341918945,0.047013137489557266
technology,This Russian Software Is Taking Over the Internet,,31,145,2013-09-06,TECH,0.03173946961760521,0.9306838512420654,0.03757667914032936
technology,Samsung’s Disposable Blu-Ray Player Won’t Play New Blu-Rays,,53,126,2013-09-06,TECH,0.02690666727721691,0.9243176579475403,0.04877568036317825
technology,Judge lays down Apple’s punishment in ebooks case. It’s largely in line with what the feds wanted,,33,111,2013-09-06,TECH,0.11487199366092682,0.8152121305465698,0.06991583108901978
technology,"New connection between stacked solar cells can handle energy of 70,000 suns. 'We have discovered that by inserting a very thin film of gallium arsenide into the connecting junction of stacked cells we can virtually eliminate voltage loss without blocking any of the solar energy'",,1063,3747,2013-09-07,TECH,0.010177030228078365,0.8655975461006165,0.12422540038824081
technology,"British scientists have developed a computer program they say can map the mood of the nation using Twitter...it can scan up to 2,000 tweets a second and rate them for expressions of one of 8 human emotions. They claim Emotive could help calm civil unrest and identify early threats to public safety",,133,420,2013-09-07,TECH,0.022266468033194542,0.9074114561080933,0.07032209634780884
technology,Girl's life saved with a lab grown body part.,,23,356,2013-09-07,TECH,0.028666986152529716,0.8978627920150757,0.07347025722265244
technology,"Last week Elon Musk of SpaceX tweeted that he had invented a way to create rocket parts, with hand gestures and a laser printer, virtually out of thin air. He has now posted a video to show how — almost like it is in your favorite sci-fi movies.",,88,227,2013-09-07,TECH,0.02402101457118988,0.9234750270843506,0.052503932267427444
technology,"Amazon to launch a $0 phone, without any contract??",,56,196,2013-09-07,TECH,0.015230798162519932,0.9164657592773438,0.06830351054668427
technology,"Kim Dotcom Teases New Music Service, called ""BABOOM"". “Artists never had more freedom, transparency and control,” he says.",,68,193,2013-09-07,TECH,0.02529533952474594,0.9215077757835388,0.05319685488939285
technology,"Nintendo faces 'path to irrelevance', says Atari founder",,233,168,2013-09-07,TECH,0.033092644065618515,0.9096993803977966,0.05720803141593933
technology,"Google seeks to dismiss Gmail privacy lawsuit, says it has right to scan correspondence",,106,154,2013-09-07,TECH,0.7693134546279907,0.21011698246002197,0.02056952565908432
technology,The feds pay for 60 percent of Tor’s development. Can users trust it?,,140,128,2013-09-07,TECH,0.021205998957157135,0.9318852424621582,0.04690876603126526
technology,Light-powered screen could mean mobiles never run out of battery,,29,114,2013-09-07,TECH,0.08123009651899338,0.8949658274650574,0.023804033175110817
technology,"Verizon’s bid to kill network neutrality law goes to court Monday: Gutting law would let ISPs block content, applications, services, and devices -- Verizon argues ""it has a free speech right to block or degrade content under the First Amendment""",,781,2965,2013-09-08,TECH,0.048764750361442566,0.9160323143005371,0.03520297259092331
technology,"At $265 million, GTA V has cost more to make than every Hollywood blockbuster ever made - except one: Pirates of the Caribbean 3, which holds the top record at $300 million. Rockstar has already made the money back on pre-orders alone. (X-post from r/todayilearned)",,1258,2835,2013-09-08,TECH,0.02181931957602501,0.8585520386695862,0.11962860822677612
technology,"A professor at Vienna University of Technology built a Lego Mindstorms robot that strips DRM off Kindle books -- unlike those DRM-circumvention tools, this setup does not violate the law",,392,1312,2013-09-08,TECH,0.035197559744119644,0.9256272315979004,0.03917519003152847
technology,19 year old invents way to clean up the world's oceans in under 5 years time,,831,927,2013-09-08,TECH,0.03836360201239586,0.8704615235328674,0.09117483347654343
technology,That New Cheap iPhone That's Coming Out on Tuesday? It Was Made in Illegal Sweatshops.,,494,844,2013-09-08,TECH,0.14877565205097198,0.7946813702583313,0.056543003767728806
technology,"Elon Musk unveils his vision for 'The Future of Design' with hand manipulated holographic technology -- ""he shows off a 3D projection, a freestanding glass projection (Ironman style), and interacts with the model using the Oculus Rift. Finally, he prints the part in titanium with a 3D metal printer""",,90,579,2013-09-08,TECH,0.012579260393977165,0.9031868577003479,0.08423393219709396
technology,Deceptive domain and SSL certificate issued by Network Solutions,,29,282,2013-09-08,TECH,0.030444888398051262,0.9470654726028442,0.022489607334136963
technology,"In Secret AT&amp;T Deal, U.S. Drug Agents Given Access to 26 Years of Americans’ Phone Records",,20,236,2013-09-08,TECH,0.03237288072705269,0.9196157455444336,0.048011329025030136
technology,"In a groundbreaking new study at the University of California, San Francisco, scientists found that older adults improved cognitive controls such as multitasking and the ability to sustain attention by playing a specially designed videogame — and that the effects can be long lasting.",,11,184,2013-09-08,TECH,0.020024525001645088,0.49856799840927124,0.48140740394592285
technology,"Yahoo says U.S. sought data on 40,332 user accounts in 2013",,20,173,2013-09-08,TECH,0.04682614654302597,0.9144698977470398,0.03870399668812752
technology,Google Refuses to Remove The Pirate Bay Homepage,,693,3899,2013-09-09,TECH,0.25274887681007385,0.7295079231262207,0.017743194475769997
technology,Google encrypts data amid backlash against spying -- The move by Google is among the most concrete signs yet that recent revelations about government sweeping surveillance efforts have provoked significant backlash within an American technology industry,,920,2990,2013-09-09,TECH,0.8523532748222351,0.05616717040538788,0.09147945791482925
technology,"105 Years in Jail for Posting a Link? -- ""This is almost a textbook case of prosecutorial overreach. As Carr points out, the guy who actually stole the Stratfor information is facing a sentence of only ten years. So why is Brown facing 105 years?""",,394,2857,2013-09-09,TECH,0.25930681824684143,0.7073718905448914,0.033321309834718704
technology,American Government Propose SOPA Revival Amidst Piracy Increase Claims,,470,2763,2013-09-09,TECH,0.025750435888767242,0.27998924255371094,0.69426029920578
technology,The beast is back: The FCC’s net neutrality case gets its day in court,,287,1338,2013-09-09,TECH,0.29861289262771606,0.4975132644176483,0.20387384295463562
technology,Google speeding up end-to-end crypto between data centers worldwide. New measure is a defense tactic against direct taps of fiber optic cables.,,85,575,2013-09-09,TECH,0.014084812253713608,0.9233980774879456,0.06251705437898636
technology,Ikea has designed a refugee tent that can be shipped in a regular flat pack and assembled with no tools in 4 hours.,,93,537,2013-09-09,TECH,0.019578952342271805,0.8845438361167908,0.09587714821100235
technology,"Indian government said to have deployed Lawful Intercept and Monitoring systems to track Internet activities of citizens, without ISP knowledge",,21,476,2013-09-09,TECH,0.031357310712337494,0.9260039925575256,0.042638715356588364
technology,Stanford Scientists Use DNA to Assemble a Transistor From Graphene,,25,462,2013-09-09,TECH,0.025437263771891594,0.9387469291687012,0.03581582382321358
technology,Man Remodels Internet as One Giant Computer,,54,428,2013-09-09,TECH,0.028014609590172768,0.9287010431289673,0.0432843416929245
technology,Intel's Wi-Fi adapters connectivity issues continue; users who complain are now seeing their Intel forum accounts removed,,844,3412,2013-09-10,TECH,0.9579155445098877,0.034213837236166,0.007870558649301529
technology,"CA School District Announces It's Doing Round-The-Clock Monitoring Of Its 13,000 Students' Social Media Activities: ""Geo Listening is a social media monitoring system that allows school districts to locate and process publicly available social media content.""",,2502,2976,2013-09-10,TECH,0.025347255170345306,0.9464930295944214,0.028159717097878456
technology,Developers force Microsoft to release Windows 8.1 early,,1056,1498,2013-09-10,TECH,0.2161228358745575,0.7535317540168762,0.03034539707005024
technology,"Appeals court rules Google must stand trial for Wi-Fi data scandal. Wi-Fi data isn't like radio data, and grabbing it can be like wiretapping.",,156,646,2013-09-10,TECH,0.08473248034715652,0.8940715193748474,0.021195972338318825
technology,The iPhone 5S,,1686,591,2013-09-10,TECH,0.01840839348733425,0.7941247224807739,0.18746688961982727
technology,Windows 8.1 to Show Advertisements instead of Wikipedia in OS Search Results,,348,572,2013-09-10,TECH,0.0641712173819542,0.9181225895881653,0.017706170678138733
technology,"Not surprisingly, the top 10 highest paying college-majors are all engineering/science degrees",,340,444,2013-09-10,TECH,0.017672467976808548,0.8371042013168335,0.14522333443164825
technology,A phone worth keeping! This looks awesome!,,161,439,2013-09-10,TECH,0.02989921346306801,0.7871487736701965,0.18295200169086456
technology,Return of the zeppelin: Firm unveils gigantic airship which could revolutionise how goods are carried around the world,,189,363,2013-09-10,TECH,0.014282766729593277,0.8820193409919739,0.10369788110256195
technology,FCC’s wishy-washy rulemaking might doom net neutrality in court,,21,315,2013-09-10,TECH,0.5564311742782593,0.41396579146385193,0.029603060334920883
technology,"Steam announces Family Sharing beta, for lending out your digital downloads",,634,2595,2013-09-11,TECH,0.019228173419833183,0.9344609975814819,0.04631083831191063
technology,"How the Feds asked Microsoft to backdoor BitLocker, their full-disk encryption tool",,531,2541,2013-09-11,TECH,0.045209310948848724,0.9254509806632996,0.029339641332626343
technology,"Intel reveals 14nm PC, declares Moore's Law 'alive and well'",,933,2540,2013-09-11,TECH,0.025141043588519096,0.8542865514755249,0.12057239562273026
technology,A world first! Success at complete quantum teleportation,,1065,2373,2013-09-11,TECH,0.01734910160303116,0.9042810201644897,0.07836988568305969
technology,Remember that chart Tim Cook showed yesterday of iPhone sales to date? Here is the accurate version.,,505,1190,2013-09-11,TECH,0.032422345131635666,0.8919126391410828,0.07566500455141068
technology,Microsoft's Concept Videos From 2000 Were Spot-On. So Why Didn't Ballmer Build Any of It?,,309,990,2013-09-11,TECH,0.02272891253232956,0.9130375981330872,0.0642334595322609
technology,"Over 1,200 Hackers Are Attending MHacks At University Of Michigan's Stadium This Month",,87,778,2013-09-11,TECH,0.02325468696653843,0.9317803382873535,0.04496493190526962
technology,"4K TVs will halve in price within a year, says major UK retailer",,373,567,2013-09-11,TECH,0.015189428813755512,0.769293487071991,0.2155170440673828
technology,Australians are currently fighting their newly elected government to maintain plans to build a complete fibre-to-the-home network and bring the country in line with the rest of the world. It's currently on track to be one of the largest petitions in Australia's history. [X-Post from /r/Australia],,57,536,2013-09-11,TECH,0.016717882826924324,0.8830630779266357,0.10021905601024628
gadgets,Gigabyte's tiny new gaming PC is smaller than an Xbox controller,,57,459,2013-09-11,TECH,0.015838205814361572,0.8915238380432129,0.09263797104358673
technology,"Verizon's diabolical plan to charge websites for carrying their packets, if it happens 'End of Internet' is near",,3043,3395,2013-09-12,TECH,0.04816066101193428,0.9223257303237915,0.029513603076338768
technology,"Apple No Longer Innovates, Says the Man Who Helped Steve Jobs Design the Mac",,1923,2116,2013-09-12,TECH,0.014892235398292542,0.8860480785369873,0.09905966371297836
technology,Washington Post | You Can Get Sued For Posting the Public Law on the Internet? This Internet Freedom Fighter Did.,,599,2104,2013-09-12,TECH,0.699927806854248,0.2619674503803253,0.038104765117168427
technology,Lavabit's Owner Appeals Secret Surveillance Order That Led Him to Shutter Site,,160,1971,2013-09-12,TECH,0.7364487051963806,0.24471387267112732,0.01883741281926632
technology,"Federal Courts claim ""open source"" software is dangerous because ""it can be modified"" ...",,262,1701,2013-09-12,TECH,0.7562486529350281,0.22108577191829681,0.02266562730073929
technology,MIT Research Shows How Reddit Users Are Like Sheep,,322,1381,2013-09-12,TECH,0.02859959751367569,0.9262751340866089,0.045125264674425125
technology,"Yahoo CEO Marissa Mayer on government data requests: ""You don't comply, it's treason"" -- Mayer said executives faced jail if they revealed government secrets. ""Releasing classified information is treason and you are incarcerated""",,231,1222,2013-09-12,TECH,0.5949001908302307,0.38085323572158813,0.02424653433263302
technology,MPAA Gets Its Wish: Court Basically Says It Can File Bogus DMCA Takedowns Without Concern For Fair Use,,76,713,2013-09-12,TECH,0.04623805731534958,0.9223559498786926,0.03140602633357048
technology,"Nebraska’s attorney general has declared war on patent trolls ""We will not be deterred from protecting Nebraska consumers and businesses by the bully tactics of patent trolling law firms or their clients""",,15,571,2013-09-12,TECH,0.3336523771286011,0.6411937475204468,0.025153866037726402
technology,Apple's Fingerprint ID May Mean You Can't 'Take the Fifth',,275,530,2013-09-12,TECH,0.21449322998523712,0.7650801539421082,0.020426588132977486
technology,"USBCondoms - Charging only, no data",,842,2878,2013-09-13,TECH,0.02979779988527298,0.941582441329956,0.028619755059480667
technology,Microsoft offering $200 trade-in for your iPad towards purchase of a Surface,,2391,2661,2013-09-13,TECH,0.015825046226382256,0.727853536605835,0.25632140040397644
technology,Australian bus company invests in and creates first ever solar-powered bus. You can ride it for free and has no emissions.,,241,2349,2013-09-13,TECH,0.009883500635623932,0.53998863697052,0.45012789964675903
technology,Google knows nearly every Wi-Fi password in the world,,1690,1765,2013-09-13,TECH,0.028630508109927177,0.9454562664031982,0.025913283228874207
technology,"The FTC is reportedly looking into Facebook’s latest round of privacy policy updates, as it might have violated a 2011 court order requiringthe social networking giant to alert users when their private information would be shared with others and explain more clearly how their data was being used.",,83,1701,2013-09-13,TECH,0.29879531264305115,0.6724998950958252,0.02870485559105873
technology,Apple's shares fell more than 5% as investors worried that the firm's latest iPhone models may not help it increase its share in emerging markets,,529,1067,2013-09-13,TECH,0.9515423774719238,0.02497018128633499,0.023487528786063194
