subreddit,title,selftext,num_comments,score,created_utc,stock/sector,neg,neu,pos
technology,Surprise! The NSA Is Still Spying On You -- The USA Freedom Act didn’t make sweeping reforms. It nipped one program and left most others intact.,,543,5941,2015-12-01,TECH,0.12178173661231995,0.831243097782135,0.04697515442967415
technology,Man sues Apple after retail employee deletes years worth of photos,,2479,5172,2015-12-01,TECH,0.03544138744473457,0.9150261878967285,0.04953240603208542
technology,"Is Comcast’s new Stream TV service as bad as it seems for net neutrality? No, it’s even worse",,857,4353,2015-12-01,TECH,0.7235996127128601,0.2537578046321869,0.022642601281404495
technology,"The government often doesn’t need a warrant to get your e-mails. But most think it should. “Support for strengthening online privacy spans across all ages, races and political affiliations. This level of support is typically unheard of in politics today,” said Vox Populi's Michael Meyers.",,26,1255,2015-12-01,TECH,0.01344479899853468,0.8360339403152466,0.15052126348018646
technology,'Germany’s wind farms are now producing so much electricity one of its grid managers is paying generators in neighboring Denmark to shut down to keep its network from overloading.',,148,616,2015-12-01,TECH,0.5296335816383362,0.4449678659439087,0.02539861388504505
technology,Snowden reveals US intelligence’s black budget: $52.6 billion on secret programs,,33,418,2015-12-01,TECH,0.043817054480314255,0.9127609133720398,0.043422043323516846
technology,Mark Zuckerberg and Priscilla Chan pledge 99 percent of their Facebook shares to charity,,96,344,2015-12-01,TECH,0.01278072688728571,0.922243595123291,0.06497571617364883
technology,WhatsApp Is Blocking Telegram Links In Its Android App,,54,336,2015-12-01,TECH,0.04527410492300987,0.9287840723991394,0.02594175562262535
technology,Comcast data caps make life for deaf difficult,,26,301,2015-12-01,TECH,0.5932497382164001,0.37891656160354614,0.027833767235279083
gadgets,Huawei Teasing Smartphone With Flippable Camera,[deleted],73,294,2015-12-01,TECH,0.024142341688275337,0.927528440952301,0.04832926765084267
technology,"Los Angeles is considering using number plate readers to send ""Dear John"" letters to the homes of men who have simply driven down streets known to have a prostitution problem",,2955,5258,2015-12-02,TECH,0.2262716293334961,0.750024676322937,0.02370370179414749
technology,GOP Again Tries to Kill Net Neutrality With Spending Bill Rider,,890,5244,2015-12-02,TECH,0.254523366689682,0.6923840045928955,0.05309266969561577
gadgets,Seiko Epson Will Sell World’s First In-Office Paper Recycler,,332,2613,2015-12-02,TECH,0.022888654842972755,0.893652617931366,0.08345869928598404
technology,"No, Mark Zuckerberg Is Not Donating 99% Of His Facebook Stock To Charity",,359,2427,2015-12-02,TECH,0.029043175280094147,0.9337061047554016,0.037250760942697525
technology,$1 pill alternative to Turing’s $750 pill gets boost from drug manager,,52,1987,2015-12-02,TECH,0.015088729560375214,0.7823030948638916,0.2026081532239914
technology,"Mossberg: An encryption backdoor is a bad idea. If the FBI gets access to your iPhone, so do lots of bad guys",,73,1576,2015-12-02,TECH,0.2655424177646637,0.7021408081054688,0.03231677785515785
technology,"The FBI is collecting all internet searches including all IP Addresses and internet purchases of every American citizen through what is known as the ""National Security Letter"".",[deleted],36,728,2015-12-02,TECH,0.035835038870573044,0.940184473991394,0.023980457335710526
gadgets,"The GIGABYTE Z170X-Gaming G1 Review: Quad-SLI on Skylake, and now with Thunderbolt 3",,125,574,2015-12-02,TECH,0.03019748255610466,0.8991187214851379,0.07068376988172531
technology,Man Wins Lawsuit Against Apple After Apple Store Employee Wipes Away Honeymoon Photos,,124,453,2015-12-02,TECH,0.2772572338581085,0.6337260603904724,0.08901667594909668
technology,Mozilla dumping Thunderbird to concentrate on Firefox,,78,261,2015-12-02,TECH,0.04407801851630211,0.9103326797485352,0.045589376240968704
technology,"AT&amp;T swears it was about to offer you a bunch of amazing deals, but then net neutrality happened",,1644,6559,2015-12-03,TECH,0.011555464938282967,0.796221137046814,0.19222332537174225
gadgets,Li-fi Deliver Internet Access 100 times Faster than Traditional Wi-Fi,,618,1897,2015-12-03,TECH,0.009932463988661766,0.8174314498901367,0.17263610661029816
technology,"After Illegally Censoring Websites For Five Years On Bogus Copyright Charges, US Gov't Quietly 'Returns' Two Domains",,89,1527,2015-12-03,TECH,0.6947203874588013,0.27641573548316956,0.02886386588215828
technology,"Snowden unveils NSA ""God Mode"" malware that lives on your motherboard and can not be traced or deleted.",[deleted],487,1139,2015-12-03,TECH,0.08979125320911407,0.8777120113372803,0.032496675848960876
technology,Republicans have tucked an anti-net neutrality rider into a government spending bill that would block the Federal Communications Commission from enforcing its open Internet rules.,,28,416,2015-12-03,TECH,0.6312839984893799,0.33100926876068115,0.03770672529935837
technology,SSD pricing closing in on HDD faster than ever,,165,358,2015-12-03,TECH,0.04442939534783363,0.7383110523223877,0.21725958585739136
technology,Apple’s Swift programming language is now open source,,56,221,2015-12-03,TECH,0.02635325863957405,0.94526606798172,0.028380639851093292
technology,"PayPal, Square and big banking's war on the sex industry",,55,199,2015-12-03,TECH,0.1634669154882431,0.8127995133399963,0.02373352088034153
technology,I got a formal response from my FCC complaint to Comcast.,"I don't recall my exact wording of the complaint. I wish I had saved it, but it was in regards to the data caps that Comcast is trialing.


In the letter I received they state


&gt;The FCC  has previously recognized that usage-based pricing for Internet service is a legitimate billing practice that may benefit consumers by offering them more choices over a greater range of service options.


They link an FCC document, the 2015 Open Internet Order, in the footer. And, yeah, the document does imply that in more than one sense.  The same document also has this to say about data caps as well.


&gt;Since the original transparency rule was promulgated, the
Commission has received hundreds of complaints regarding advertised rates, slow or congested services,
data caps, and *other potentially deceptive practices*.


While the FCC does recognize data caps as a business practice, it also very clearly calls it a ""deceptive practice"".  They also go on to say that data caps have potentially negative effects on consumers.


&gt;Data caps or allowances, which limit the
amount and type of content users access online, can have a role in providing consumers options and
differentiating services in the marketplace, but they also can negatively influence customer behavior and
the development of new applications


&gt; “even if providers
do not block content outright, providers can still utilize their market power to harm consumers in more subtle ways,
such as by lowering data caps or exempting their own services from such caps”


Another excerpt from the letter I received says

&gt;Comcast is trialing an innovative usage-based billing approach that relieves lighter end users from paying the same price as heavier end users, while enabling those heaver end users to continue using as much data as they want without being subjected to a hard cap


They go on to say that the median monthly usage over the last six months was 40 GB.  In images posted in [this](https://www.reddit.com/r/technology/comments/3rnfnm/leak_of_comcast_documents_detailing_the_coming/) thread from a little while back, in [this](http://i.imgur.com/Dblpw3h.jpg) image in particular, we see that the smallest data option in Tuscon, AZ is 300 GB.  So... if the average monthly data usage over the past *six months* was only 40GB, and this plan is about relieving ""lighter end users from paying the same price as heavier end users"", why is there not a 50 GB option significantly cheaper than the 300 GB option?  Wouldn't **that** be the fair thing to do in this case?


It's like if a city had a bunch of 1200 sq ft apartments for rent, and the average tenant only uses 500 sq ft of it.  Instead of giving them a smaller option to save money, they're just allowing them more room if they choose to have it.  That's still not fair. They're still paying for a bunch of space they're not using.  I know I'm trying to compare a limited floor plan with unlimited internet usage, but I hope you see my point here.


The letter concluded with contact information to a Comcast Customer Security Assurance rep, should I wish to call them back.  I'm sure plenty of you have gotten letters too in regards to your complaints, but I decided to do a little digging into mine and wanted to share my findings. It seems like Comcast is trying to hide behind the FCC's acknowledgment that data caps are a ""legitimate billing practice"" without fully understanding what the FCC believe about data caps.


Extra note:  I did a ctrl+f for ""legitimate"" in the Open Internet Order linked above. I didn't find any hit relating the word ""legitimate"" to data caps specifically, but I did find this.


&gt;In order to maintain flexibility, the Commission tailored the rules contained in the Open 
Internet Order to fit the technical and economic realities of the broadband ecosystem. To this end, the 
restrictions on blocking and discrimination were made subject to an exception for “reasonable network 
management,” allowing service providers the freedom to address legitimate needs such as **avoiding 
network congestion** and combating harmful or illegal content.


Sound familiar? We all learned with the [leaked documents](http://i.imgur.com/quf68FC.jpg) that Comcast's data caps have nothing to do with avoiding network congestion.  This Open Internet Order seems to discuss ""legitimate network management"" practices as a whole in regards to what services broadband providers should be providing to end users.  The one thing I've taken from all of this is that the data caps have nothing to do with fairness.  Hope you all enjoyed the write-up.",29,155,2015-12-03,TECH,0.12513160705566406,0.8494782447814941,0.02539008855819702
technology,"Privacy group claims Google is collecting student data from Chromebooks used in schools, violating a pledge that Google signed in January.",,19,136,2015-12-03,TECH,0.4502623677253723,0.5210126638412476,0.02872493304312229
technology,"If the FCC Loses in Court Today, It Could Be the End of Net Neutrality",,1586,6014,2015-12-04,TECH,0.6292564868927002,0.3512437343597412,0.019499819725751877
technology,Dave Chappelle Uses New Technology to Keep People off Their Phones at his Shows,,2677,4441,2015-12-04,TECH,0.014666243456304073,0.8856200575828552,0.0997137650847435
technology,FCC Boss Mocks Comcast Broadband Caps at Industry 'Prom',,20,876,2015-12-04,TECH,0.1367311179637909,0.8418257236480713,0.021443158388137817
gadgets,DIGNO Rafre: A Waterproof SmartPhone (SoapPhone) you can wash with soap,,147,799,2015-12-04,TECH,0.02995317429304123,0.9346946477890015,0.03535211831331253
technology,"This may be the biggest news yet to come out of the Paris climate meeting - in just 15 years Africa would be producing twice as much electricity from solar panels, wind farms, geothermal plants and hydropower than it currently generates from all sources combined.",,34,453,2015-12-04,TECH,0.014043323695659637,0.9180447459220886,0.06791191548109055
technology,Mozilla Is Flailing When the Internet Needs It the Most,,210,375,2015-12-04,TECH,0.14725475013256073,0.8291362524032593,0.023609008640050888
technology,Is the new Zuckerberg fake charity an estate tax avoidance scheme?,,62,362,2015-12-04,TECH,0.12234842777252197,0.851500391960144,0.02615121193230152
technology,Towns want Verizon investigated for abandoning networks through neglect,,10,350,2015-12-04,TECH,0.02908421866595745,0.9148686528205872,0.05604717135429382
technology,Trans-Pacific Partnership (TPP) agreement threatens security and safety by locking down U.S. policy on source code audit.,,12,316,2015-12-04,TECH,0.045352332293987274,0.9274721145629883,0.02717548795044422
technology,Cable and telecom industry groups will urge a three-judge panel to throw out rules that require Internet providers to treat all Web equally.,,11,201,2015-12-04,TECH,0.04278203099966049,0.9232405424118042,0.033977411687374115
technology,Tesla becomes the third automaker to bow out of the 2016 Detroit Auto Show,,1408,4629,2015-12-05,TECH,0.061763517558574677,0.6689763069152832,0.26926013827323914
technology,English Wikipedia is now blocked in China,"It's not been picked up by international media yet, but the English Wikipedia site (one of the only uncensored parts of the Chinese internet) has, since last night, been blocked. No idea at the moment if this is temporary or permanent, but it might be connected to this [story](http://www.channelnewsasia.com/news/asiapacific/wikipedia-boss-to-lobby/2312740.html).

Here are some screenshots of my location, wikipedia and other websites for proof:

http://imgur.com/a/Udq8g",399,3103,2015-12-05,TECH,0.26066526770591736,0.7167119383811951,0.022622758522629738
technology,You can fit the entire iTunes Library in a empty can of Coke.,"The iTunes Store has about 37,000,000 songs available worldwide.

Lets immagine each song is encoded at the highest mainstream MP3 Quality (320 kbps), and that the average song is 4 minutes long.

320 * 4 * 60= 7.7 Megabytes per song

7.7 * 37,000,000= 285,000,000 Megabytes
=285 Terabytes

A modern archive HDD can store 8TB worth of data
so 285/8 =36.6 Hard Drives.

But it gets better...

Modern Micro SD Cards can store about 200GB of data per card. Each Micro SD Card has a volume of 165 mm3, and a mass of 0.5g.

We could store the entire iTunes Library on just 1425 Micro SD Cards. (285/0.2 = 1425)

The cards would weigh just 713 grams. They would take up the space of 235cm3 meaning that you can fit the entire iTunes Library in an empty can of Coke.",415,2324,2015-12-05,TECH,0.020001808181405067,0.9089059233665466,0.07109227776527405
technology,"Kazakhstan announces their plans to spy on all Internet traffic, encrypted or not, starting with January 2016.",,207,2042,2015-12-05,TECH,0.014410295523703098,0.9256539940834045,0.059935688972473145
gadgets,"You can buy a birthday/Christmas card for £5 that turns into a record player and comes with a 7"" record.",,126,1758,2015-12-05,TECH,0.05435387045145035,0.8785223960876465,0.06712368875741959
technology,Judges May Side with ISPs to Kill Key Parts of Net Neutrality,,70,860,2015-12-05,TECH,0.03244847059249878,0.9347401857376099,0.03281130641698837
gadgets,"Galaxy A3, A5 &amp; A7 2016 Edition Are Now Official: Bigger, Faster &amp; Prettier",,238,648,2015-12-05,TECH,0.014738035388290882,0.8638110160827637,0.12145090103149414
technology,Net neutrality just went to court. Here's how it did.,,34,479,2015-12-05,TECH,0.052773088216781616,0.8555268049240112,0.09170010685920715
technology,A Search Engine for the Internet’s Dirty Secrets: Google is helping to power a new search engine built on a daily scan of the whole Internet,,12,415,2015-12-05,TECH,0.025004222989082336,0.9089403748512268,0.06605538725852966
technology,GCHQ finally admits it 'persistently' hacked computers and phones in the UK and abroad,,7,394,2015-12-05,TECH,0.026182468980550766,0.8934807777404785,0.08033671230077744
technology,I emailed my Congressman about the net neutrality killing rider that's been attached in the stopgap funding bill. His response is some of the biggest horseshit I've read in a while and I wanted to share it with you all,"My Congressman's response:

I would like to thank you for contacting me regarding net neutrality and the Federal Communications Commission (FCC). I appreciate hearing about issues that are important to my constituents.
 
As you may know, net neutrality refers to the principle of the open and free internet. Under this principle Internet Service Providers (ISP) provide equal access to all lawful internet traffic, and consumers are free to choose what content they wish to access. The main focus of debate over net neutrality has been whether the current regulatory framework is sufficient for policy makers to address this issue, or whether they should look to Congress to amend current law.
 
Since the Telecommunications Act of 1996 was passed into law, new technologies and advancements in telecommunications have rapidly developed due to the limited government regulation of internet traffic and services. However, on February 26th, 2015, the FCC voted to reclassify broadband Internet as a telecommunication service under Title II of the Communications Act of 1934. This essentially allows the FCC to reclassify broadband as a utility giving the FCC more regulatory authority over Internet providers. 
 
Over the past 20 years the Internet has changed the way we live our lives, from how we get the news to how we pay our bills. Now the FCC is reaching back 80 years for their authority to reclassify broadband Internet service as a public utility, a move that will not only open the Internet up to heavier regulations and additional taxes, but would disincentive the development and deployment of faster Internet service throughout the nation. 
 
While President Obama and Chairman Wheeler continue their short sighted approach to net neutrality I hope to use my position as a member of the Communication and Technology Subcommittee to push for a bi-partisan solution that will help keep the internet open and free while incentivizing the build-out of broadband services and spurring innovation in the marketplace. The Subcommittee is currently discussing draft legislation, which I support, that would amend the Communications Act of 1934 to prohibit blocking lawful content, throttling data, and paid prioritization. Moving forward please be assured that I will keep your views in mind as we continue to work on this important issue.
 
Again, thank you for taking the time to contact me. If you would like to keep up on this and other important issues you can follow me on Facebook, Twitter or sign up for my electronic newsletter.
 
 
Sincerely,
 
JOHN SHIMKUS
Member of Congress",1966,6184,2015-12-06,TECH,0.03775541111826897,0.9313952922821045,0.03084932453930378
technology,China has blocked Wikipedia again,,399,4527,2015-12-06,TECH,0.1092458963394165,0.8336650729179382,0.05708909034729004
technology,"Google’s “Apps for Education” isn’t a tool that “schools can trust,” because it is spying on 40 million K-12 students and compiling all their online activities even though it pledged not to do that, according to Electronic Frontier Foundation, in a complaint filed with the FTC",,416,2727,2015-12-06,TECH,0.07649792730808258,0.895666778087616,0.027835268527269363
technology,"Loading-screen boredom may be behind us thanks to expiring patent - ""Namco had a legal monopoly on interstitial mini-games for the past 20 years.""",,238,1690,2015-12-06,TECH,0.02863161452114582,0.9041143655776978,0.06725403666496277
gadgets,"Unhackable, Unbreakable, and Waterproof Turing Phone Gets Postponed, New Release Date Is In The 1Q16",[deleted],369,1281,2015-12-06,TECH,0.10153375566005707,0.8675615787506104,0.03090464510023594
technology,LARRY PAGE: I Would Rather Give My Billions To Elon Musk Than Charity,,116,588,2015-12-06,TECH,0.04058414697647095,0.9303324818611145,0.029083384200930595
technology,Comcast Panics: Minnesota Rolls Out Free High-Speed Internet Funded by Taxing the Rich,[deleted],45,544,2015-12-06,TECH,0.03310871869325638,0.9249839186668396,0.04190736263990402
technology,"After Paris Attacks, Proposed French Law Would Block Tor and Forbid Free Wi-Fi",,88,401,2015-12-06,TECH,0.18401895463466644,0.7878549695014954,0.028126053512096405
technology,The FCC defended net neutrality from internet providers in court on Friday,,2,379,2015-12-06,TECH,0.6100758910179138,0.310231477022171,0.07969271391630173
technology,"Researchers uncover major security flaws in Hello Barbie, an Internet-connected doll that listens to children and uses AI to respond",,28,310,2015-12-06,TECH,0.143845334649086,0.8285686373710632,0.027585990726947784
technology,"""Comcast's data caps are something we’ve been warning Washington about for years"", Roger Lynch, CEO of Sling TV",,1115,6431,2015-12-07,TECH,0.059833601117134094,0.9025745391845703,0.03759187087416649
technology,Speedtest finally drops Adobe Flash for HTML5,[deleted],191,2551,2015-12-07,TECH,0.09683297574520111,0.867195188999176,0.03597186133265495
technology,"France looking at banning Tor, blocking public Wi-Fi - Leaked documents from Ministry of Interior show a worryingly illiberal trend for France",,137,2290,2015-12-07,TECH,0.24462690949440002,0.7273340225219727,0.028039030730724335
technology,Sling CEO: Comcast data caps so low they hurt competing video providers. Five hours of TV streaming a day could blow through a Comcast data cap.,,111,1974,2015-12-07,TECH,0.20879977941513062,0.7222223877906799,0.06897781044244766
technology,"Final version of CISA ""cybersecurity"" bill appears to strip out key privacy protections",,21,1289,2015-12-07,TECH,0.03302813321352005,0.935804009437561,0.031167831271886826
gadgets,‘Snowstorm’ personal flying machine built by students,[deleted],138,1182,2015-12-07,TECH,0.021319927647709846,0.8926376700401306,0.08604243397712708
technology,Competition is the best way to stop Comcast’s data caps from ruining the Internet - but how do we get it?,,74,564,2015-12-07,TECH,0.4647512435913086,0.512906551361084,0.022342225536704063
technology,"The Sports Bubble Is About to Pop: Don’t buy ESPN’s PR talk that its 7 million-household dip in subscribers is just a blip. It’s for real, and the end of its empire will have widespread consequences for the way you watch sports and pay for TV.",,139,559,2015-12-07,TECH,0.027125544846057892,0.9308358430862427,0.04203860089182854
technology,Vermont utility says it will be the first to install Tesla powerwalls in the US,,12,365,2015-12-07,TECH,0.011936882510781288,0.9196887612342834,0.0683743804693222
technology,Netflix will have 31 new shows in 2016,,69,353,2015-12-07,TECH,0.03276912495493889,0.9182031750679016,0.04902765527367592
technology,The Two Leading Presidential Candidates -- Clinton And Trump -- Are Both Mocking Free Speech On The Internet,,2958,6738,2015-12-08,TECH,0.6765900254249573,0.2624567151069641,0.06095332279801369
technology,"Donald Trump wants to close up the Internet, saying ""We have to go see Bill Gates,” to better understand the Internet and then possibly “close it up.”“We’re losing a lot of people because of the Internet.”",,6592,6042,2015-12-08,TECH,0.025500910356640816,0.9261140823364258,0.048384957015514374
technology,Netflix needs to follow Sling TV’s lead and call out Comcast’s data caps,,486,5750,2015-12-08,TECH,0.0261762086302042,0.9438687562942505,0.029955070465803146
technology,"EFF: Stop the ""Cyber"" Bills. It’s Not Information Sharing—It's Surveillance.",,59,3387,2015-12-08,TECH,0.06163738667964935,0.911899209022522,0.026463400572538376
gadgets,Apple unveils official 25-hour battery case for the iPhone 6 and 6S,,1229,1696,2015-12-08,TECH,0.02660483680665493,0.892149806022644,0.08124541491270065
gadgets,Innovative new sensor chip pulls power out of the air so it never needs to be charged,,75,1287,2015-12-08,TECH,0.009664700366556644,0.6225232481956482,0.36781200766563416
technology,Donald Trump: America should consider “closing the Internet up in some way” to fight Islamic State terrorists,,205,1272,2015-12-08,TECH,0.03282039985060692,0.8962522149085999,0.07092739641666412
gadgets,Uni a Sign Language Translator Gadget Gives Voice to Deaf,,71,565,2015-12-08,TECH,0.020695555955171585,0.8813244104385376,0.09797997772693634
technology,"FBI admits it uses stingrays, zero-day exploits",,18,546,2015-12-08,TECH,0.06314414739608765,0.9121411442756653,0.024714723229408264
technology,Google taps Los Angeles and Chicago to explore Fiber,,78,396,2015-12-08,TECH,0.018686365336179733,0.9305076003074646,0.05080605670809746
technology,"While the world is pushing for more surveillance, Germany wants to become encryption site number one and make end-to-end encryption the standard",,584,6691,2015-12-09,TECH,0.01578758843243122,0.9275806546211243,0.05663177743554115
technology,"“The more bits you use, the more you pay”: Comcast CEO justifies data caps. Unfortunately, usage-based billing only works one way: in Comcast's favor.",,2281,6237,2015-12-09,TECH,0.04000864550471306,0.9309437870979309,0.029047593474388123
gadgets,What happened to Apple design? Unapologetically bad,,2072,3777,2015-12-09,TECH,0.033760327845811844,0.9159390926361084,0.05030060559511185
technology,"Save Crypto: Tell the White House We Can't Sacrifice Security ""The White House Lied; Neither I, nor anyone else at EFF, had been invited by the White House to a meeting about this.""",,28,757,2015-12-09,TECH,0.024076474830508232,0.9273809790611267,0.04854253679513931
technology,Verizon is about to ruin the Internet,,108,398,2015-12-09,TECH,0.18476258218288422,0.7896677851676941,0.025569593533873558
technology,Verizon exec in charge of FiOS TV confesses that she cut the cord,,37,377,2015-12-09,TECH,0.11781658977270126,0.8217254281044006,0.06045796349644661
technology,Silicon Valley professionals are micro-dosing LSD at work to gain “superhuman” creativity,,94,303,2015-12-09,TECH,0.017612135037779808,0.8488055467605591,0.13358230888843536
gadgets,HTC One A9: It looks like an iPhone clone,,303,290,2015-12-09,TECH,0.014837263152003288,0.9323320388793945,0.05283068120479584
