subreddit,title,selftext,num_comments,score,created_utc,stock/sector,neg,neu,pos
technology,"Meet the Bionic Lens: This 8-Minute Surgery Will Give You Superhuman Vision, Forever",,76,240,2015-12-09,TECH,0.01745305024087429,0.9102297425270081,0.07231724262237549
technology,"Google, NASA: Our quantum computer is 100 million times faster than normal PC: But only for very specific optimization problems.",,47,223,2015-12-09,TECH,0.011054611764848232,0.8193487524986267,0.1695966124534607
technology,AT&amp;T Has Fooled The Press And Public Into Believing It's Building A Massive Fiber Network That Barely Exists,,1731,7347,2015-12-10,TECH,0.01992782950401306,0.8698065280914307,0.11026566475629807
technology,New Report: Netflix-related bandwidth — measured during peak hours — now accounts for 37.05% of all Internet traffic in North America.,,666,4810,2015-12-10,TECH,0.03861136734485626,0.9370864033699036,0.024302223697304726
technology,MIT invents untraceable SMS text messaging system that is even more secure than Tor,,126,1704,2015-12-10,TECH,0.01691311225295067,0.8923923969268799,0.09069452434778214
gadgets,"Tim Cook defends Apple iPhone Smart Battery Case, says it's not a 'hump'. Company chief tells users case is not designed for people who charge their phone every day, and that lump is a design feature.",,968,1699,2015-12-10,TECH,0.02140709012746811,0.9209964871406555,0.05759640410542488
technology,"""After months of telling the American public that cybersecurity was the nation’s number one priority and that it’s “impossible to overstate” the threat from hackers, the FBI director and many senators spent Wednesday calling for a law that would indisputably weaken online security for everyone.""",,61,1529,2015-12-10,TECH,0.18229976296424866,0.7866475582122803,0.03105269931256771
technology,"Cord-Cutting Is Accelerating - By 2018, 21% of U.S. households won’t pay for traditional TV.",,108,594,2015-12-10,TECH,0.16652245819568634,0.7990096211433411,0.034467872232198715
gadgets,Nokia’s Ozo virtual-reality camera packs $60K price tag,,51,536,2015-12-10,TECH,0.020601395517587662,0.927247941493988,0.05215063318610191
technology,"Comcast's CEO is right, they're not data caps.","I'm sick of seeing interviews with ISP CEOs getting a ""pass"" from moderators for answering the question, ""WTF is with these data caps?"" with the answer, ""They're not data caps, we don't limit anybody!"" And technically, they're correct. So we need to change the language we're using.

Instead of us complaining about **data caps**, we need to start campaigning against **usage penalties**. Because this is exactly what they're doing, they're penalizing you for using your service. It also changes the conversation from a ""how many GB until your cap"" (which they usually respond with a statement about how so few users get close to that number) into a monetary discussion regarding what those penalties are and why we aren't paying enough already.",73,333,2015-12-10,TECH,0.1130862757563591,0.8628880977630615,0.024025656282901764
technology,Microsoft surface overtakes Apple’s iPad as top-selling tablet online,,95,290,2015-12-10,TECH,0.02126379869878292,0.8950173854827881,0.08371874690055847
technology,Germany fires up bizarre new fusion reactor,,53,236,2015-12-10,TECH,0.0428687259554863,0.8117923736572266,0.14533883333206177
technology,"France will not ban Wi-Fi or Tor, prime minister says: ""Internet is a freedom, is an extraordinary means of communication between people, it is a benefit to the economy,"" Valls added",,376,5368,2015-12-11,TECH,0.025835173204541206,0.8981589674949646,0.07600583136081696
technology,"Elon Musk announces the formation of a new Artificial Intelligence research company, OpenAI",,851,4385,2015-12-11,TECH,0.011973073706030846,0.8671078681945801,0.12091905623674393
technology,Germany just switched on a revolutionary nuclear fusion machine,,528,3458,2015-12-11,TECH,0.021785713732242584,0.9101666212081909,0.0680476501584053
technology,"Google Says its Quantum Computer Works, Is 100 Million Times Faster Than Traditional PC",,208,1655,2015-12-11,TECH,0.009387115947902203,0.7595925331115723,0.23102031648159027
gadgets,"Red launches the Scarlet-W, an entry-level 5K video camera",,350,1535,2015-12-11,TECH,0.025540320202708244,0.9333489537239075,0.041110701858997345
technology,"Couple takes pics of Star Wars figure they bought, gets DMCA notice from Lucasfilm",,142,797,2015-12-11,TECH,0.027109311893582344,0.8760347366333008,0.09685593098402023
technology,In A New Breakthrough Scientists Have Developed Diesel That Emits Much Less CO2,,84,667,2015-12-11,TECH,0.011850280687212944,0.832230269908905,0.15591950714588165
technology,"MIT Researcher Reportedly Sentenced to Death in Syria -- ""his work to keep the Internet open and provide access to content could be viewed as subversive to anyone trying to 'lock down' the Internet and free speech""",,9,426,2015-12-11,TECH,0.13764385879039764,0.8416308760643005,0.020725253969430923
technology,Cable providers still have no answer for Netflix as cord-cutting accelerates,,88,380,2015-12-11,TECH,0.12134579569101334,0.8390316367149353,0.03962263464927673
gadgets,Oukitel K10000 – The Smartphone with 10000mAh Battery,[deleted],141,378,2015-12-11,TECH,0.02584504336118698,0.9174125790596008,0.05674232169985771
technology,"""America does have a cybersecurity problem – but the NSA is part of it.""",,366,5215,2015-12-12,TECH,0.17957648634910583,0.794623851776123,0.025799689814448357
technology,Pirate Bay Founder: ‘I Have Given Up’,,1982,4997,2015-12-12,TECH,0.1145714521408081,0.8587376475334167,0.026690872386097908
technology,A group of tech companies has urged Congressional leadership to abandon a GOP plan to kill the Federal Communications Commission's net neutrality rules.,[deleted],274,3769,2015-12-12,TECH,0.5182352066040039,0.4345596730709076,0.04720507934689522
technology,Congress to Finally Make Broadband Tax Ban Permanent,,24,516,2015-12-12,TECH,0.23696015775203705,0.7057672142982483,0.05727268010377884
gadgets,DJI turns up the heat with new thermal-imaging camera,,35,419,2015-12-12,TECH,0.021801237016916275,0.9171143174171448,0.06108444929122925
technology,"OneDrive users can keep their free 15GB of storage and camera roll bonus after all, if they opt-in by Jan. 31",,13,219,2015-12-12,TECH,0.03260696679353714,0.8910926580429077,0.07630035281181335
gadgets,Zolt (Computer/USB power adapter) Unboxing,"My zolt shipment came in the mail yesterday.  I had forgotten I pre-ordered it in Feb. 2015.

http://imgur.com/a/glUtg

Zolt is a laptop and generic 5V USB charging and power adapter.  To be honest, I was kind of surprised at the build quality. I was expecting it to look and feel cheap but it feels pretty solid.  I was also surprised that they used the same USB connector for laptop charging.  Seems like it'd be pretty easy to accidentally plug your phone expecting 5V into that port supplying 19.5V.",60,154,2015-12-12,TECH,0.016283167526125908,0.8501444458961487,0.13357236981391907
technology,Tor Hires a New Leader to Help It Combat the War on Privacy,,13,143,2015-12-12,TECH,0.020076775923371315,0.7809382081031799,0.19898498058319092
technology,Hit and Run Driver Arrested After Her Car Calls Police,,46,143,2015-12-12,TECH,0.7764604687690735,0.1995934247970581,0.02394602634012699
gadgets,"Logitehc G502 proteus core, the best gaming mouse (For Most People)",[deleted],197,133,2015-12-12,TECH,0.016070494428277016,0.8827952146530151,0.1011342853307724
technology,A US town has rejected a proposal for a solar farm following public concerns that solar panels 'suck up all the energy from the sun',,1485,4872,2015-12-13,TECH,0.3703520596027374,0.5740727782249451,0.0555751733481884
technology,Law Enforcement is Using a 226-Year-Old Law to Force Tech Companies to Unlock Mobile Phones,,379,4325,2015-12-13,TECH,0.022729085758328438,0.9076465368270874,0.06962434947490692
technology,A Congresswoman from California is questioning DHS officials who put pressure on a local public library to take down the relay node it had set up for the anonymity network Tor,,340,4302,2015-12-13,TECH,0.033015359193086624,0.9071142673492432,0.059870339930057526
technology,Mozilla is shutting down Firefox OS for smartphones,,388,2940,2015-12-13,TECH,0.02925575152039528,0.9171229600906372,0.05362134054303169
technology,"WebTorrent Brings BitTorrent to the Web, Impresses Netflix",,274,1851,2015-12-13,TECH,0.03216199576854706,0.9275786876678467,0.04025925323367119
technology,UK porn laws a year on: A porn actress and a dominatrix on destroyed businesses and censorship,,136,1204,2015-12-13,TECH,0.7371829748153687,0.24662616848945618,0.016190849244594574
technology,"Tech giants pledge $1bn for 'altruistic AI' venture, OpenAI",,84,983,2015-12-13,TECH,0.020304687321186066,0.9019651412963867,0.07773015648126602
gadgets,"D-Link unveils the DIR-885L/R, its first AC3150 Wi-Fi router with MU-MIMO",,292,981,2015-12-13,TECH,0.02832757495343685,0.9104141592979431,0.061258308589458466
technology,Frontier Comm settles with state of West Virginia over false advertising and sluggish broadband performance: the $160 million settlement will reduce the bills of thousands of West Virginia DSL customers while forcing Frontier to invest in necessary upgrades,,25,878,2015-12-13,TECH,0.03177734091877937,0.89188551902771,0.07633717358112335
technology,Even Apple doesn't want to use Final Cut Pro X,,181,769,2015-12-13,TECH,0.019041528925299644,0.9351241588592529,0.04583427682518959
technology,Comcast CEO Brian Roberts reveals why he thinks people hate cable companies,,1780,4317,2015-12-14,TECH,0.4872497022151947,0.4795166552066803,0.03323368355631828
technology,Elon Musk worries third World War would ruin Mars mission,,1783,4196,2015-12-14,TECH,0.47649866342544556,0.49287742376327515,0.030623970553278923
technology,"The NY attorney general is crowdsourcing speed tests to see if Verizon, Cablevision and Time Warner Cable may be short-changing customers with slower-than-advertised speeds",,271,3729,2015-12-14,TECH,0.05374932661652565,0.8992069363594055,0.04704374819993973
gadgets,FAA requires all drones to be registered by February 19th,,2220,3026,2015-12-14,TECH,0.05163365602493286,0.9294220209121704,0.018944310024380684
technology,"Congress is about to ban taxes on your Internet service, once and for all: a bill that's soon set to become law will make the ban permanent — meaning Internet providers, and by extension, consumers, won't have to fear that their subscription to fixed broadband will be subject to state &amp; local taxes",,72,1411,2015-12-14,TECH,0.054025277495384216,0.8948734402656555,0.051101334393024445
technology,North Carolina citizenry defeat pernicious Big Solar plan to suck up the Sun: Town council votes to deny zoning permit that would allow solar farm development.,,203,1246,2015-12-14,TECH,0.027929047122597694,0.7244305610656738,0.24764041602611542
gadgets,"Security drone chases trespassers all on its own for $6,000",,181,914,2015-12-14,TECH,0.2548394799232483,0.7170140147209167,0.02814646065235138
technology,"Donald Trump Can Post Hate Speech To Facebook, But You Can't",,190,804,2015-12-14,TECH,0.12950925529003143,0.8474137187004089,0.023076945915818214
technology,"FAA Says All Owners of Small Drones Must Register By February 19, 2016",,277,688,2015-12-14,TECH,0.09338879585266113,0.8887698650360107,0.01784132607281208
technology,Amazon Bans Swagway Hoverboards After Reports Of Catching Fire,,71,431,2015-12-14,TECH,0.03190595656633377,0.8357308506965637,0.1323632299900055
technology,Congress Drops All Pretense: Quietly Turns CISA Into A Full On Surveillance Bill,,1355,7613,2015-12-15,TECH,0.07916639000177383,0.8950755000114441,0.025758156552910805
technology,Netflix Dropping Its “One-Size-Fits-All” Streaming Algorithm,,1411,5050,2015-12-15,TECH,0.025831757113337517,0.9390679001808167,0.035100340843200684
technology,"In the weeks since the Senate approved CISA, Speaker Paul Ryan has been busy stripping privacy protections from the bill. Now CISA is worse than the version Obama threatened to veto—but Ryan is adding it as a rider to a must-pass budget bill that Obama can't veto without shutting down the government",,522,3453,2015-12-15,TECH,0.3724209666252136,0.5920831561088562,0.03549589961767197
gadgets,These 3D-Printed Sneakers Are Made From The Trash We Throw Into The Ocean | IFLScience,,369,3414,2015-12-15,TECH,0.04054992273449898,0.9154102206230164,0.044039808213710785
technology,Netflix is working on new technology that will help Comcast users beat their data caps,,278,3181,2015-12-15,TECH,0.042145829647779465,0.8848466277122498,0.07300757616758347
technology,"Congress Adds 'CISA' To 'Omnibus' Budget Bill, Up To President Obama To Veto",,69,587,2015-12-15,TECH,0.0327797532081604,0.8626315593719482,0.10458866506814957
technology,Hackers trace ISIS Twitter accounts back to internet addresses linked to UK Department of Work and Pensions,,61,527,2015-12-15,TECH,0.0760507732629776,0.9044479131698608,0.019501296803355217
technology,COMCArrogance: Comcast CEO Lectures ‘Paranoid’ Customers to Get Used to Data Caps,,74,490,2015-12-15,TECH,0.06882154196500778,0.9022600054740906,0.028918420895934105
gadgets,The True Love Tinder Robot: A robot that reads human love emotions through their hands,,54,451,2015-12-15,TECH,0.027642877772450447,0.9123836159706116,0.059973541647195816
technology,Reincarnated CISPA Gaining Traction In Congress,,16,444,2015-12-15,TECH,0.02887348085641861,0.434480756521225,0.5366458296775818
technology,Lawmakers Have Snuck CISA Into a Bill That Is Guaranteed to Become a Law,,3981,8751,2015-12-16,TECH,0.019179262220859528,0.8710840940475464,0.10973658412694931
technology,"The FCC Has Received 13,000 Complaints About Comcast Data Caps",,179,3087,2015-12-16,TECH,0.04656093195080757,0.9206250905990601,0.032813940197229385
technology,Why politicians still dream of controlling the internet,,145,1486,2015-12-16,TECH,0.0746869444847107,0.8866068124771118,0.03870631009340286
gadgets,Amazon UK tells some customers to trash their hoverboards,,510,1308,2015-12-16,TECH,0.11773752421140671,0.858696699142456,0.0235657449811697
technology,Donald Trump just proposed closing “areas” of the internet.,,219,725,2015-12-16,TECH,0.2132217437028885,0.7502530217170715,0.03652525320649147
technology,Small Massachusetts Town Offers 2 Gigabit Internet For $75/Month,,103,703,2015-12-16,TECH,0.02411378175020218,0.877540111541748,0.09834611415863037
gadgets,Fall asleep while binge-watching? Netflix smart socks save your spot,,92,553,2015-12-16,TECH,0.03745998069643974,0.8740023374557495,0.08853762596845627
technology,Comcast Data Cap: Simple policy change to make caps truly fair,,137,534,2015-12-16,TECH,0.015123305842280388,0.8387510776519775,0.1461256444454193
technology,"Google Inc. plans to make its self-driving cars unit, which will offer rides for hire, a stand-alone business under the Alphabet Inc. corporate umbrella next year, a person briefed on the company’s strategy said.",,57,416,2015-12-16,TECH,0.014715536497533321,0.9413435459136963,0.043940939009189606
technology,The First Person to Hack the iPhone Built a Self-Driving Car. In His Garage,,100,373,2015-12-16,TECH,0.029942890629172325,0.9343118667602539,0.035745248198509216
technology,"Comcast to pay $26 million to settle charges for routinely and illegally dumping used, hazardous electronic equipment into landfills and failing to shred documents containing customers’ private information",,1009,7022,2015-12-17,TECH,0.4703347086906433,0.5121681094169617,0.01749715581536293
technology,A key under the doormat isn’t safe. Neither is an encryption backdoor.,,495,4896,2015-12-17,TECH,0.08138196915388107,0.8652400374412537,0.05337794870138168
technology,"White House Supports Privacy Destroying CISA, Despite Past Promises It Would Not",,587,4507,2015-12-17,TECH,0.06561634689569473,0.6071730256080627,0.3272106945514679
technology,Yet another problem with Comcast data caps: Customers have no idea why they’re exceeding their limits,,370,3272,2015-12-17,TECH,0.6856666803359985,0.28185564279556274,0.03247771039605141
technology,"Comcast customer discovers huge mistake in company’s data cap meter -- Comcast’s data meter was “showing I used 120 gigs of data, like, while I was gone,” he wrote",,407,3240,2015-12-17,TECH,0.2140779197216034,0.761248767375946,0.024673327803611755
technology,Mozilla's Firefox finally enters the 64-bit era on Windows,,527,3145,2015-12-17,TECH,0.023712793365120888,0.910571277141571,0.06571587175130844
technology,"Comcast, AT&amp;T, and T-Mobile must explain data cap exemptions to FCC",,325,2979,2015-12-17,TECH,0.04849066585302353,0.9241712093353271,0.027338111773133278
technology,"Security researcher discovers critical security flaws in Instagram's servers and reports it under Facebook's bug bounty program. Facebook denies bounty, contacts his employer, and threatens legal action",,241,2867,2015-12-17,TECH,0.9140793085098267,0.07359456270933151,0.012326208874583244
technology,"""There is no evidence that any of the lone-wolf attacks could have been prevented by regulation of encryption. A proper, targeted open-source investigation could have. Yet the FBI is reluctant to recognize open-source as an important - arguably the most important - tool to track jihadists online.""",,32,1610,2015-12-17,TECH,0.026140175759792328,0.9237170219421387,0.050142813473939896
technology,"Now Merged, AT&amp;T and DirecTV Raise TV Rates in Perfect Unison",,210,1507,2015-12-17,TECH,0.014904459938406944,0.7927533388137817,0.19234226644039154
technology,"As expected, President Obama has just signed the bill, enacting both the $1.1 trillion budget and CISA.",,7218,8196,2015-12-18,TECH,0.027339596301317215,0.8793386220932007,0.09332182258367538
technology,"Bernie Sanders Campaign Is Disciplined for Breaching Hillary Clinton Data - The Sanders campaign alerted the DNC months ago that the software vendor ""dropped the firewall"" between the data of different Democratic campaigns on multiple occasions.",,1795,4875,2015-12-18,TECH,0.1999070644378662,0.7700368762016296,0.030056074261665344
technology,Mark Zuckerberg’s plea for internet freedom means nothing if he keeps kissing up to China,,325,4179,2015-12-18,TECH,0.03995519131422043,0.9173200130462646,0.042724840342998505
technology,CNN publishes article about House passage of $1.1 trillion budget bill and does not even mention the quiet forcing of CISA into its contents.,,102,3498,2015-12-18,TECH,0.0713701918721199,0.8653867244720459,0.06324310600757599
technology,Private search engine DuckDuckGo grows 70% in 2015,,145,2564,2015-12-18,TECH,0.049720291048288345,0.9173058867454529,0.032973870635032654
technology,Source leaks catalog of cellphone spying gear the Feds don’t want you to see,,57,1362,2015-12-18,TECH,0.23087218403816223,0.7492424845695496,0.019885309040546417
technology,Back door on US government computer equipment may have allowed foreign governments to spy on US encrypted communication for past 3 years,,177,1265,2015-12-18,TECH,0.04508925974369049,0.9102640748023987,0.04464662820100784
technology,“Unauthorized code” in Juniper firewalls decrypts encrypted VPN traffic,,70,959,2015-12-18,TECH,0.04975324869155884,0.9204733967781067,0.029773378744721413
technology,House approves CISA funding bill,,63,726,2015-12-18,TECH,0.01949445530772209,0.9026739001274109,0.07783162593841553
gadgets,This Real-Life Flaming Lightsaber Is About As Real As It Gets,,106,699,2015-12-18,TECH,0.03012734279036522,0.9178647994995117,0.05200783535838127
technology,"""Cure the air, not the cars."": Elon Musk proposes that instead of paying billions of dollars in fines and ""fixing"" the cheating cars, Volkswagen should be forced to accelerate its rollout of zero-emissions cars (which in the process would actually create more direct competition to Tesla's cars)",,966,6471,2015-12-19,TECH,0.07828591018915176,0.8648659586906433,0.05684811994433403
technology,Amazon is capturing 39.3% of all US money spent online,,596,3861,2015-12-19,TECH,0.02774275280535221,0.8960850834846497,0.07617218792438507
technology,Facebook secretly backing Senate's zombie CISA surveillance bill while publicly pretending to oppose it,[deleted],24,773,2015-12-19,TECH,0.15046438574790955,0.8047158122062683,0.044819772243499756
gadgets,Gear S2 3G Review: Samsung's best smartwatch offers more than the Apple Watch,,333,755,2015-12-19,TECH,0.01301270816475153,0.8826083540916443,0.10437896847724915
technology,"UK police busts karaoke “gang” for sharing songs that aren’t commercially available - Three old guys giving away karaoke tunes is now a ""commercial-scale gang.""",,29,725,2015-12-19,TECH,0.044270940124988556,0.9207838773727417,0.03494524583220482
gadgets,"Samsung 950 Pro NVMe SSD Review: Stacked NAND, stacked performance",,80,265,2015-12-19,TECH,0.023867299780249596,0.9209218621253967,0.05521082505583763
technology,"How giving away over $8,000 in free samples on Reddit saved this woman's startup",,30,203,2015-12-19,TECH,0.030702441930770874,0.9226465225219727,0.04665103927254677
gadgets,Need budget sports/action camera for vacation etc.,[removed],87,180,2015-12-19,TECH,0.06342722475528717,0.915460467338562,0.021112317219376564
technology,FAA Grounds ‘Uber for Planes’,,36,171,2015-12-19,TECH,0.058388471603393555,0.9045982360839844,0.03701329603791237
technology,Pirate Bay Founder Builds The Ultimate Piracy Machine,,40,137,2015-12-19,TECH,0.018881050869822502,0.9048327207565308,0.0762861967086792
