subreddit,title,selftext,num_comments,score,created_utc,stock/sector,neg,neu,pos
gadgets,"Flimmer: A drone developed by the Navy that can not only fly through the air, but also swim underwater.",,169,1987,2015-08-26,TECH,0.02516109123826027,0.9193527102470398,0.05548623204231262
technology,Tesla Model S driven a record 452.8 miles on a single charge,,227,1285,2015-08-26,TECH,0.019175218418240547,0.8744732737541199,0.10635152459144592
technology,Cops decide to collect less license plate data after 80GB drive got full: Police department unilaterally decides to impose six-month retention policy.,,129,648,2015-08-26,TECH,0.051189932972192764,0.9117465615272522,0.03706355020403862
technology,"How Today’s NSA Is Much, Much Worse Than Stasi Or Orwell’s “1984”",,93,406,2015-08-26,TECH,0.8210111260414124,0.1546519249677658,0.02433696761727333
technology,"Amazon expands Prime Now, offers U.S. alcohol for first time",,33,381,2015-08-26,TECH,0.009544139727950096,0.8572872281074524,0.13316865265369415
technology,"Tesla Motors Inc.’s all-wheel-drive version of the battery-powered Model S, the P85D, earned a 103 out of a possible 100 in an evaluation by Consumer Reports magazine.",,2413,5616,2015-08-27,TECH,0.020751183852553368,0.532933235168457,0.4463155269622803
technology,Do people really not know that the US is in the middle of a huge Outage spanning the nation?,,2225,4507,2015-08-27,TECH,0.04073425754904747,0.9153300523757935,0.043935663998126984
gadgets,Former Apple CEO John Sculley launches a line of stylish smartphones,,476,1821,2015-08-27,TECH,0.022462164983153343,0.9277806878089905,0.04975717142224312
technology,TSA's $150K full body scanners so inept that government officials are suggesting people exiting them should immediately go through a traditional metal detector,,296,1683,2015-08-27,TECH,0.03945052996277809,0.9094478487968445,0.05110163241624832
technology,86% of internet users have taken steps to mask their digital footprints,,64,852,2015-08-27,TECH,0.013033788651227951,0.871330738067627,0.1156354695558548
technology,Tech Giants Want to Punish DMCA Takedown Abusers,,48,750,2015-08-27,TECH,0.04654499143362045,0.908584475517273,0.04487048462033272
technology,New York City Says It May Sue Verizon For Failed FiOS Promises,,31,399,2015-08-27,TECH,0.04108693078160286,0.907707691192627,0.0512053444981575
gadgets,LG made a full-size keyboard for mobiles that folds into a stick to fit in your bag,[deleted],105,308,2015-08-27,TECH,0.019403601065278053,0.9096412658691406,0.07095517218112946
technology,"""Get going fast"" Windows 10 tries to rush you through the install with ""Express settings"" avoiding displaying extremely important privacy settings.",,81,196,2015-08-27,TECH,0.030099738389253616,0.8731672763824463,0.09673293679952621
technology,Germany hands over citizens’ metadata in return for NSA’s top spy software,,21,173,2015-08-27,TECH,0.019584469497203827,0.8948226571083069,0.08559293299913406
technology,Google Chrome will block auto-playing Flash ads from September 1,,1278,7256,2015-08-28,TECH,0.06962957233190536,0.9061759114265442,0.024194492027163506
technology,"The FCC is asking for comments on a proposal to require manufacturers to lock down computing devices (routers, PCs, phones) to prevent modification if they have a ""modular wireless radio"" (a Wi-Fi network adapter for example)",,784,4631,2015-08-28,TECH,0.03952989727258682,0.9373047947883606,0.02316533774137497
gadgets,Handy TV speakers: Sony crammed a full-size speaker into this silly TV remote,,110,680,2015-08-28,TECH,0.029107388108968735,0.9367265105247498,0.034166041761636734
technology,"AT&amp;T grudgingly accepts $428 million in annual government funding. AT&amp;T objected to 10Mbps requirement, but will expand ""broadband"" in 18 states.",,83,473,2015-08-28,TECH,0.015258392319083214,0.8573643565177917,0.1273772120475769
technology,"It’s not just Windows 10, Windows 7 and 8 are also tracking you – here’s how to stop them",,154,381,2015-08-28,TECH,0.029847806319594383,0.9358304142951965,0.03432179242372513
gadgets,MIT unveils 3D printing with glass breakthrough!,,24,287,2015-08-28,TECH,0.016988426446914673,0.881557285785675,0.10145425796508789
technology,"Defense lawyers in Baltimore are examining nearly 2,000 cases in which the police secretly used powerful cellphone tracking devices, and they plan to ask judges to throw out “a large number” of criminal convictions as a result.",,41,253,2015-08-28,TECH,0.3434189558029175,0.6052300333976746,0.05135102570056915
technology,Uber Hires Two Engineers Who Showed Cars Could Be Hacked,,9,184,2015-08-28,TECH,0.012557532638311386,0.7753375768661499,0.2121049016714096
technology,"Associated Press sues FBI over fake news story. FBI director: ""We do use deception at times to catch crooks.""",,23,164,2015-08-28,TECH,0.122472383081913,0.8536542654037476,0.02387337014079094
technology,Pirate Bay Founder Released From Jail But Immediately Re-Arrested,,42,147,2015-08-28,TECH,0.20439821481704712,0.7565386295318604,0.03906308859586716
technology,A team of Nasa recruits has begun living in a dome near a barren volcano in Hawaii to simulate what life would be like on Mars - It will last a year starting on Friday and be the longest of its type attempted. Experts estimate a human mission to the Red Planet could take between one and three years.,,655,4793,2015-08-29,TECH,0.02433169260621071,0.8869240880012512,0.08874423056840897
technology,Google's self-driving cars are really confused by 'hipster bicyclists',,896,3011,2015-08-29,TECH,0.0404350571334362,0.9168439507484436,0.04272100701928139
gadgets,"Welcome to the World, Drone-Killing Laser Cannon",,264,1265,2015-08-29,TECH,0.055039044469594955,0.9041885137557983,0.0407724604010582
technology,99% Of Women Profiles On Ashley Madison Were Fake,,116,1007,2015-08-29,TECH,0.03360956534743309,0.9274157285690308,0.03897464647889137
technology,Lexmark’s war against a man who recycles toner cartridges,,108,971,2015-08-29,TECH,0.04219476506114006,0.9115256071090698,0.04627956822514534
technology,Bitcoin Technology Piques Interest on Wall St: “ “The whole blockchain tech behind Bitcoin has massive implications for really any kind of asset. It’s hard to see a world where blockchain technology doesn’t end up changing the way we think about asset ownership”,,221,959,2015-08-29,TECH,0.017045535147190094,0.89715576171875,0.0857987031340599
gadgets,BlackBerry 'Venice' Android slider spotted once again in new images,,238,662,2015-08-29,TECH,0.019512644037604332,0.8079814314842224,0.1725059151649475
technology,"Report: A major change in YouTube is about to arrive, with paywall in-tow",,291,544,2015-08-29,TECH,0.06484615057706833,0.8884609341621399,0.04669296741485596
technology,OpenWRT vs. FCC followup video...even worse than we thought. FCC commenting extended to Sept 9,,69,417,2015-08-29,TECH,0.0750555619597435,0.9006450772285461,0.024299420416355133
technology,"Oh Good, the Weaponized Police Drones Are Here",,70,315,2015-08-29,TECH,0.20338411629199982,0.6772647500038147,0.11935107409954071
technology,The FCC proposed ‘software security requirements’ obliging WiFi device manufacturers to “ensure that only properly authenticated software is loaded and operating the device”,,402,4509,2015-08-30,TECH,0.03964277356863022,0.9292665123939514,0.031090719625353813
technology,Windows 10 Worst Feature Installed On Windows 7 And Windows 8,,1886,3672,2015-08-30,TECH,0.02799120545387268,0.9323797821998596,0.0396290086209774
technology,DIY Tractor Repair Runs Afoul Of Copyright Law : John Deere has a digital lock on the software that runs his tractor. And it won't give him the key.,,558,3299,2015-08-30,TECH,0.047579746693372726,0.9244544506072998,0.027965834364295006
technology,FCC Rules Block use of Open Source,,643,3294,2015-08-30,TECH,0.05103416368365288,0.9302480816841125,0.01871776208281517
technology,"Hobby drone flies within 50ft of LAPD helicopter, derails a suspect search - drone pilot arrested",,804,2722,2015-08-30,TECH,0.015025991015136242,0.9141885638237,0.07078547775745392
gadgets,A look inside Google's new OnHub wireless router - This is what $200 worth of router looks like.,,835,2049,2015-08-30,TECH,0.01665283739566803,0.929063081741333,0.05428406968712807
technology,"Supercookies are back, and they're as unappealing as ever",,156,1794,2015-08-30,TECH,0.0282047837972641,0.9185861945152283,0.053209010511636734
technology,Tesla Motors TSLA +2.13% ranks No. 1 on FORBES’ new list of the world’s most innovative companies.,,83,1148,2015-08-30,TECH,0.013242412358522415,0.7969143986701965,0.18984314799308777
technology,Google self-driving cars to drive in Austin without drivers in in the next few weeks,,156,1118,2015-08-30,TECH,0.07876268774271011,0.8908151984214783,0.030422136187553406
technology,"Congress, Don’t Make Us Hitch Rides With Russia. Love, NASA",,71,988,2015-08-30,TECH,0.033513326197862625,0.9106563925743103,0.05583023279905319
technology,HP told some employees to choose between becoming contractors with no benefits or being fired without severance,,1968,6203,2015-08-31,TECH,0.37064796686172485,0.6007078886032104,0.028644125908613205
technology,"Stop copying Apple! : Chinese phone maker Doogee tells companies. ""Since the birth of iPhone 6/6 Plus, curved edge design has been a fashion and followed by almost every manufacturer... Designs should be diversified.""",,1168,3311,2015-08-31,TECH,0.021775610744953156,0.9235788583755493,0.05464550480246544
technology,"T-Mobile going after ~3k ""Network Abusers"" on Monday...some of them are using as much as 2 terabytes of data in a month",,1052,2326,2015-08-31,TECH,0.024950040504336357,0.9233120679855347,0.05173785611987114
technology,"We are just one day away from a huge event that will affect the entire digital advertising industry - From September 1, Google's Chrome browser (51.74% of Internet users) will begin blocking Adobe Flash ads, favoring HTML5 ads instead.",,193,2249,2015-08-31,TECH,0.3710610568523407,0.6101635694503784,0.01877533830702305
technology,Howard Stern Just Taught Everyone's Parents About Ad-Blockers,,300,1069,2015-08-31,TECH,0.056723207235336304,0.9185322523117065,0.024744544178247452
technology,Tesla strikes deal to buy lithium hydroxide mined in northern Mexico,,61,965,2015-08-31,TECH,0.012387850321829319,0.5450820922851562,0.4425300657749176
technology,"Nielson is finally using data from Netflix, Amazon, and Hulu streaming",,54,943,2015-08-31,TECH,0.026242101565003395,0.9106765985488892,0.063081294298172
gadgets,New Apple TV to bring Wii-like remote,,321,654,2015-08-31,TECH,0.011462799273431301,0.7086191773414612,0.27991804480552673
technology,"Theranos, a $9 billion biotech company, developed a new method of blood testing, providing 200+ tests from with one drop of blood.",,37,483,2015-08-31,TECH,0.010338816791772842,0.8329558968544006,0.1567053198814392
technology,Man Given Eight-Inch Bionic Penis After Losing Use Of Genitals In An Accident,,156,436,2015-08-31,TECH,0.02762652188539505,0.9198319315910339,0.05254150927066803
