subreddit,title,selftext,num_comments,score,created_utc,stock/sector,neg,neu,pos
technology,Apple tears apart proposed British anti-encryption law in written memo to parliament,,155,1782,2015-12-22,TECH,0.028365079313516617,0.9177065491676331,0.05392832309007645
technology,"Manhattan District Attorney Still Totally Ignorant About Encryption, Slams Tim Cook &amp; Demands Legislation To Wipe Out Encryption | Techdirt",,145,1645,2015-12-22,TECH,0.5736421346664429,0.39593571424484253,0.03042210452258587
technology,U.S. presidential candidates don't understand encryption,,91,1422,2015-12-22,TECH,0.6689417362213135,0.31048068404197693,0.020577529445290565
technology,"It seems everywhere he goes these days, Apple CEO Tim Cook is out there forcefully and publicly defending his company’s decision to provide end-to-end encryption. The question is: when will other tech company leaders follow his lead?",,1032,5789,2015-12-23,TECH,0.12169638276100159,0.8330775499343872,0.045226089656353
technology,"Bank of America gets Twitter to delete journalist’s joke, says he violated copyright",,909,5673,2015-12-23,TECH,0.5588315725326538,0.41350501775741577,0.027663422748446465
technology,Internet Freedom Is Actively Dissolving in America,,708,5482,2015-12-23,TECH,0.02765941433608532,0.9356309771537781,0.036709681153297424
technology,Comcast's CEO Wants the End of Unlimited Data,,887,4565,2015-12-23,TECH,0.1837788075208664,0.7909306883811951,0.02529045380651951
technology,"Juniper firewall fiasco is a major blow-up for the government's backdoor rhetoric. If ever there's been a shining example of why government backdoors are a bad idea, the motherlode just got served up hot on a platter.",,131,3509,2015-12-23,TECH,0.06397870182991028,0.884549081325531,0.05147217586636543
technology,YouTube says T-Mobile’s net neutrality-bending Binge On scheme throttles its videos,,464,3368,2015-12-23,TECH,0.030227990821003914,0.9322417974472046,0.03753024712204933
technology,"A top-secret document dated February 2011 reveals that British spy agency GCHQ, with the knowledge and apparent cooperation of the NSA, acquired the capability to covertly exploit security vulnerabilities in 13 different models of firewalls made by Juniper Networks",,52,2259,2015-12-23,TECH,0.022791244089603424,0.9026631116867065,0.07454566657543182
technology,"42% of cord-cutters don’t even subscribe to home broadband ""the cord-cutting process poses a big problem for Comcast and others in its position. It's not just that some customers could move from Comcast's TV bundle to Comcast's standalone Internet plan. It's that they could abandon Comcast entirely""",,175,1321,2015-12-23,TECH,0.05856488272547722,0.9162207245826721,0.025214411318302155
technology,Yahoo now warns users if they're targets of state-sponsored hackers,,20,824,2015-12-23,TECH,0.15331028401851654,0.8185326457023621,0.02815711870789528
gadgets,Chuwi Vi8 Plus is a $100 Cherry Trail Windows tablet,,260,708,2015-12-23,TECH,0.01099929865449667,0.868319034576416,0.12068169564008713
technology,"Verizon, longtime enemy of net neutrality, may soon exempt its video app from data caps",,909,5197,2015-12-24,TECH,0.415130078792572,0.549340546131134,0.03552933409810066
technology,"This is the perfect example of why government backdoors are a bad idea - TSA created baggage locks that they had a master key to and then released an image of the master keys, allowing anyone to 3D print keys and defeating the security",,320,4546,2015-12-24,TECH,0.035010289400815964,0.9305002689361572,0.03448938950896263
gadgets,A Working Light-Based Processor,,283,2368,2015-12-24,TECH,0.032709211111068726,0.9358463883399963,0.03144434094429016
technology,"3D TVs Are Dead at CES 2015, Now the Fight's Moved to 4K",,210,291,2015-12-24,TECH,0.024796688929200172,0.9154981374740601,0.05970517918467522
technology,TSA changes rules for who must go through body scanner: The Transportation Security Administration can now mandate some passengers go through a body scanner even if the travelers ask to opt out and get a full-body pat-down instead.,,47,277,2015-12-24,TECH,0.11183422803878784,0.8682630658149719,0.019902681931853294
gadgets,"Samsung adds 6"" Galaxy A9 to the 2016 Galaxy A Series",,64,228,2015-12-24,TECH,0.01593797467648983,0.8561102151870728,0.12795183062553406
gadgets,Lifx Color 1000 review: The best color-changing bulb? Not Hue you think.,,59,217,2015-12-24,TECH,0.01581454649567604,0.851246178150177,0.13293926417827606
technology,"Over 3,000 US Prisoners Released Early Due to Software Bug",[deleted],27,216,2015-12-24,TECH,0.925554096698761,0.053261563181877136,0.021184373646974564
technology,Megaupload founder Kim Dotcom loses fight to avoid extradition to the US,,72,197,2015-12-24,TECH,0.4683866798877716,0.5077419877052307,0.023871373385190964
technology,"AT&amp;T bought out my previous service provider, Corr Wireless, but promised to uphold my contract with them. Now, they're attempting to retroactively change the contract to eliminate my unlimited data plan. Is there anything I can do about it? How is this legal?",[removed],16,189,2015-12-24,TECH,0.07193697988986969,0.9057223200798035,0.022340726107358932
technology,Clinton and Trump are looking for an easy out on the Internet. Don’t give it to them.,,764,5998,2015-12-25,TECH,0.04772841930389404,0.896664559841156,0.055607035756111145
technology,Facebook is running a deceitful multi-million dollar campaign to undermine Net Neutrality in India.,"A full two page ad in the most distributed daily and in many others.
http://imgur.com/yqDSv72

Similar hoarding in prime spots in Metro Cities

http://imgur.com/SWYTq4w

http://i.imgur.com/aSV0ln4.jpg

Sending SMS's to people in regional languages.

&gt;ફેસબુક દ્વારા ફ્રી બેસિક્સ સેવા બધા માટે બુનિયાદી ઈન્ટરનેટ સેવાઓ નિશુલ્ક ઉપલબ્ધ કરાવે છે. પણ આ બધી સેવાઓ પર પ્રતિબંધ લાગવા ની આશંકા છે. કૃપા કરી 1800 209 0921 પર આજેજ એક મિસ્ડ કોલ આપી અમારી મદદ કરો.

Translation.

Free basics by Facebook provides basic internet services free, but these services may get banned. Please help us by giving a missed call today on this number.

Also prompting users to send a message to TRAI(Telecom regulatory authority of India) through their very platform. I wonder how much would other users have to pay to run such a campaign on FB.
https://pbs.twimg.com/media/CWfYxOfU4AACHA5.jpg

This is all being done to save their 'Free Basics' platform which infringes upon the principles of Net Neutrality.",348,4558,2015-12-25,TECH,0.07326216995716095,0.8966412544250488,0.03009655512869358
technology,Steam is experiencing major glitches and giving people access to each others' accounts,,619,3792,2015-12-25,TECH,0.015728525817394257,0.8775533437728882,0.10671810060739517
gadgets,The FDA Has Approved A Wearable Defibrillator LifeVest That Could Save A Child's Life,,275,2463,2015-12-25,TECH,0.026239939033985138,0.9112637042999268,0.06249634549021721
technology,These Japanese Researchers Are Making Holograms You Can Touch,,103,796,2015-12-25,TECH,0.03739651292562485,0.9052028656005859,0.05740061402320862
technology,"UCLA researchers create super-strong yet light new metal could be used for lighter airplanes, cars helping to improve fuel efficiency",[deleted],33,469,2015-12-25,TECH,0.011072915978729725,0.5510854125022888,0.43784162402153015
technology,"Just Before Passing Surveillance Expansion, Lawmakers Partied With Pro-CISA Lobbyists",,12,391,2015-12-25,TECH,0.030484287068247795,0.9272871613502502,0.04222854599356651
technology,"Anonymous takes credit for massive cyberattack on Turkey. ""The attack left more than 400,000 websites down in Turkey"". The government eventually had to cut off all foreign Internet traffic coming to “.tr” websites, the domain for Turkey, to mitigate the assault",,23,332,2015-12-25,TECH,0.8724016547203064,0.11408708244562149,0.013511247001588345
technology,Error 451: There's Now an HTTP Code for Internet Censorship,,14,326,2015-12-25,TECH,0.10337013006210327,0.8731226325035095,0.023507241159677505
technology,Cable companies should not provide internet.,[removed],56,261,2015-12-25,TECH,0.017994999885559082,0.9450915455818176,0.03691350296139717
technology,Switzerland has ruled on a single charger format for mobile telephones,,4125,6560,2015-12-26,TECH,0.026213575154542923,0.9309451580047607,0.04284128174185753
gadgets,Robot drinking buddy,,117,953,2015-12-26,TECH,0.05591019615530968,0.9151696562767029,0.028920194134116173
technology,Hackers Are Already Using The Secret Juniper Firewall Backdoor In Their Attacks,,50,404,2015-12-26,TECH,0.04645531624555588,0.9210736155509949,0.032471079379320145
gadgets,[Rule announcement] We are changing some things up in a big way in our fight against spam,"Hello gadget fanatics! 

Here in /r/gadgets we have to deal with **a lot** of spam, on a daily basis we remove a lot of submissions from sketchy domains, ad ridden blogs, etc. Unfortunately we can't always be around (in case you did not know, subreddit mods are volunteers) meaning that a spammy submission will be caught a bit late. 
A little bit too often these submissions reach our frontpage. 
This because of vote manipulation or sometimes just because spammers are really good at making attractive titles, making use of the fact that a sizeable amount of people don't actually read the articles behind them.
It isn't surprising that one of the major points in feedback we receive is the presence of spam on this subreddit. 
To combat this our rules have become ever more restrictive and automod, as well as some other scripts, more trigger happy. 

Unfortunately this also means that a lot of legitimate submissions and users got caught in the crossfire, something a lot of you and us as well are not all too happy about. 

# Introducing the accepted domains white list
Because of that we have sat down and after some brainstorming decided to switch things around. From now on every submissions will be held for review **unless it is on our white list of accepted domains**. If the website you submit is not on the white list you will receive a message from the bot asking to check up on our rules and then message us for review. 

## What domains will be on the white list? 

We have made an initial list of well known and acceptable tech websites, manufactures and general news websites. Over time we will review the list and submissions to /r/gadgets and add those domains that consistently are approved after review. Here is the important bit though, we also want **your input**! Every month we will post a list feedback thread, in that thread people can discuss the allowed domains and suggest domains that should be on the white list. 
We will use the input from those monthly threads to further finetune the list. 

**[You can find the complete list here](https://www.reddit.com/r/gadgets/wiki/domainlist)**

## What benefits will this have for /r/gadgets? 

We see several benefits to this approach: 

- A lot less (blog)spam visible for you.
- Less restrictive rules. A lot of the rules are aimed at reducing spam, since we can catch it much sooner now we can loosen up some rules. To be more specific, we can be much looser in enforcing the rules we have now.
- Less skynet, we currently have a lot of automoderator rules aimed at reducing spam that also catch genuine users. We can now remove those rules and remove the confusion for many users where automod pulled something where it was not needed. 

## Are all articles from white listed domains allowed? 

No, although we will look at loosening up some rules the content you submit still has to follow those we have in place.

## Are only submissions from white listed domains allowed? 

No, it just means that submissions from domains not on the list will need to be reviewed *before* being visible for everyone in the subreddit.

## I still don't like it! 

Well that is very unfortunate, the policy we implement is aimed at solving a lot of the feedback we received in the past year. Unfortunately with a user base in the millions it is impossible to make everyone happy. Of course we are happy to hear any suggestions you have, it is how we ended up with this post :)",42,121,2015-12-26,TECH,0.08066783845424652,0.8939862251281738,0.0253459420055151
technology,"Scientists have developed a new reusable polymer that can remove pollutants from flowing water within seconds, just like air fresheners trap invisible air pollutants in the home and remove unwanted odours.",,17,105,2015-12-26,TECH,0.021344216540455818,0.9195170402526855,0.05913868919014931
technology,Yahoo To Notify Users If Government is Trying To Get Into Their Account,,4,102,2015-12-26,TECH,0.09158234298229218,0.8740392327308655,0.034378401935100555
technology,What happened to being able to unlink G+ and YouTube accounts?,"Google announced that in June of 2015, and now, almost half a year later, we're at the same point we were when they first announced it.  

http://www.bbc.com/news/technology-33687110",11,92,2015-12-26,TECH,0.017615849152207375,0.9356899261474609,0.04669418931007385
technology,Asus to bake ad-blockers right into its mobile devices,,16,86,2015-12-26,TECH,0.028053538873791695,0.9340021014213562,0.03794441744685173
technology,Hey Reader’s Digest: Your site has been attacking visitors for days,,13,80,2015-12-26,TECH,0.029474681243300438,0.9332284927368164,0.03729679062962532
technology,"UK Home Secretary defends controversial surveillance bill, says it will stop cyberbullies",,20,50,2015-12-26,TECH,0.08981354534626007,0.8650313019752502,0.04515519365668297
technology,"U.S. Predicts Zero Job Growth For Electrical Engineers: ""IEEE-USA said government estimate is probably accurate""",,2052,4810,2015-12-27,TECH,0.2629707157611847,0.6443350315093994,0.09269429743289948
technology,When a Unicorn Stumbles... “Employees essentially ended up paying to work for the company.”,,653,2814,2015-12-27,TECH,0.9413279294967651,0.05028118938207626,0.00839085504412651
technology,"German security experts found huge credit card flaw, companies continue keeping silent",,251,2782,2015-12-27,TECH,0.8969107270240784,0.08269362151622772,0.020395683124661446
technology,North Korea's computer operating system revealed by researchers.,,217,2508,2015-12-27,TECH,0.32460108399391174,0.5183951258659363,0.15700383484363556
gadgets,"Home Insurers Rush To Exclude Drones As Christmas Sees Popularity Soar: ""Canny underwriters have forseen the risk of drones falling into the hands of 'amateurs, fools and children'""",,684,2099,2015-12-27,TECH,0.06599397212266922,0.8820713758468628,0.05193471908569336
technology,Time Warner Cable is having a massive outage right now,[removed],144,710,2015-12-27,TECH,0.2316582351922989,0.6933622360229492,0.07497948408126831
technology,"What Windows 10's ""Privacy Nightmare"" Settings Actually Do",,150,457,2015-12-27,TECH,0.22925567626953125,0.7316262722015381,0.03911805525422096
technology,"When politicians want approval for controversial security measures, they like to lean on insecurities about your kids' safety - the ""won't somebody think of the children?"" trope. And the British government isn't above using that tactic to get its draft Investigatory Powers Bill past critics",,12,401,2015-12-27,TECH,0.16681618988513947,0.7903313040733337,0.0428524874150753
technology,"Home Insurers Rush To Exclude Drones As Christmas Sees Popularity Soar: ""Canny underwriters have forseen the risk of drones falling into the hands of 'amateurs, fools and children'""",,44,316,2015-12-27,TECH,0.06599397212266922,0.8820713758468628,0.05193471908569336
technology,Scientists Put A Worm's Mind Into A Robot's Body,,44,193,2015-12-27,TECH,0.058768779039382935,0.9029706120491028,0.038260579109191895
technology,Why ‘I Have Nothing to Hide’ Is the Wrong Way to Think About Surveillance,,1641,6979,2015-12-28,TECH,0.05501968413591385,0.9031339287757874,0.041846372187137604
technology,Comcast Cap Blunder Highlights How Nobody Is Ensuring Broadband Meters Are Accurate | Techdirt,,161,2167,2015-12-28,TECH,0.03851213678717613,0.9200633764266968,0.041424453258514404
gadgets,2015: The year that Microsoft started getting the benefit of the doubt,,901,2147,2015-12-28,TECH,0.014426174573600292,0.40550854802131653,0.5800652503967285
technology,NSA helped GCHQ spies hack Juniper firewalls – Snowden leak,,69,1421,2015-12-28,TECH,0.023407883942127228,0.9104058742523193,0.06618630141019821
technology,Stop Patent Trolls: Support the Innovation Act of 2015,,49,1146,2015-12-28,TECH,0.0894726812839508,0.8647381663322449,0.04578913003206253
technology,191 Million US Voter Registration Records Leaked In Mystery Database,,45,671,2015-12-28,TECH,0.3581380844116211,0.6240530014038086,0.01780889742076397
technology,Meet The Shadowy Tech Brokers That Deliver Your Data To The NSA,,14,543,2015-12-28,TECH,0.015097342431545258,0.9151087403297424,0.06979387998580933
technology,Gullible Facebook Users Duped By Mark Zuckerberg $45 Billion Giveaway Hoax,,47,377,2015-12-28,TECH,0.04182639718055725,0.9105260968208313,0.04764749854803085
technology,Widely-criticised new Chinese spying laws have big similarities with UK powers,,16,353,2015-12-28,TECH,0.035134442150592804,0.9172738790512085,0.04759166017174721
technology,How the TPP Will Affect You and Your Digital Rights,,28,201,2015-12-28,TECH,0.03688693791627884,0.936057984828949,0.02705514244735241
technology,"After A Decade Of Waiting For Verizon, Town Builds Itself Gigabit Fiber For $75 Per Month",,943,7446,2015-12-29,TECH,0.03361817076802254,0.9113506078720093,0.05503123998641968
technology,Doctor invents a $1 device that enables throat cancer patients to speak again,,438,5180,2015-12-29,TECH,0.010289905592799187,0.8196579217910767,0.17005212604999542
technology,Mark Zuckerberg can’t believe India isn’t grateful for Facebook’s free internet,,2240,4965,2015-12-29,TECH,0.026846734806895256,0.912377119064331,0.060776110738515854
gadgets,Japanese Researchers Create Holograms You Can Touch,"Japanese researchers have created holograms that can be disrupted by human touch,poke,and push

The system is called HaptoClone, and it offers a new technology that the researchers are calling ""telehaptics."" Using the technology, users can send a holographic message of an image.

http://www.bcnstar.com/gadgets/japanese-researchers-create-holograms-you-can-touch/",348,1912,2015-12-29,TECH,0.011059915646910667,0.9074498414993286,0.08149019628763199
gadgets,New York is finally installing its promised public gigabit Wi-Fi,,167,1725,2015-12-29,TECH,0.024516014382243156,0.8613848686218262,0.11409906297922134
gadgets,Disney's robot car drives up walls,,86,798,2015-12-29,TECH,0.024894924834370613,0.9182384014129639,0.056866686791181564
technology,"T-Mobile: We're Not Throttling YouTube, We're 'Optimizing' It!",,98,662,2015-12-29,TECH,0.04007609933614731,0.9152101874351501,0.044713664799928665
technology,Recently Bought a Windows Computer? Microsoft Probably Has Your Encryption Key,,139,485,2015-12-29,TECH,0.018665285781025887,0.9137353897094727,0.06759931892156601
technology,"Madison eyes public broadband system to compete with private sector ""American cities can't afford to ""wait and hope"" that Google or AT&amp;T will develop a high-speed broadband network in a particular community.""",,42,443,2015-12-29,TECH,0.015704257413744926,0.9092746376991272,0.07502105832099915
technology,US Army scraps $42m Darpa robot for being too noisy,,121,441,2015-12-29,TECH,0.04638446122407913,0.9099539518356323,0.04366162791848183
technology,The Cable Industry's Response To A Banner Year For Cord Cutting? Massive Across The Board Price Increases For 2016,,2423,6683,2015-12-30,TECH,0.550054669380188,0.04651694744825363,0.403428316116333
technology,Congressman plans bill to repeal CISA-like legislation included in omnibus,,310,5333,2015-12-30,TECH,0.036368247121572495,0.9118542671203613,0.051777519285678864
technology,Lawsuit seeks more than $5M from Apple for slowing older iPhones with iOS 9 upgrade,,968,3796,2015-12-30,TECH,0.05814016982913017,0.8861201405525208,0.05573969706892967
technology,Apple to pay €318 million in landmark tax evasion case,[deleted],129,2269,2015-12-30,TECH,0.7422028183937073,0.22036634385585785,0.03743082284927368
technology,Tech companies face criminal charges if they notify users of UK government spying,,85,1536,2015-12-30,TECH,0.7679434418678284,0.2013477385044098,0.03070879355072975
technology,Spying on Congress and Israel: NSA Cheerleaders Discover Value of Privacy Only When Their Own is Violated,,62,1101,2015-12-30,TECH,0.02440480701625347,0.9173482656478882,0.05824689939618111
technology,Microsoft's most advanced AI is doing the morning news weather report on Chinese TV,,63,939,2015-12-30,TECH,0.03681153804063797,0.931685745716095,0.031502723693847656
gadgets,LG has a smarthome hub that looks a lot like an Amazon Echo,,169,745,2015-12-30,TECH,0.012287850491702557,0.9000518918037415,0.08766019344329834
technology,"Epic achievement: Comcast generates more FCC complaints than AT&amp;T, Verizon and TWC combined",,21,542,2015-12-30,TECH,0.06784374266862869,0.9076671600341797,0.024489115923643112
technology,In Memoriam: Ian Murdock; debian founder,,48,418,2015-12-30,TECH,0.03995390608906746,0.9246172904968262,0.035428788512945175
technology,"iPhone 4S owners file suit against Apple, claim iOS 9 made phones unbearably slow",,3145,6258,2015-12-31,TECH,0.11208676546812057,0.8604128360748291,0.027500400319695473
technology,"Starting Jan 1st, all law enforcement in California will have to obtain a search warrant before looking at private emails, texts, cloud data, and more",,405,5950,2015-12-31,TECH,0.03825385123491287,0.9296258687973022,0.032120347023010254
technology,"TIL Amazon, Google, Twitter, Snapchat, WhatsApp, Comcast and more don't tell their users when governments demand access to their private data",,632,4770,2015-12-31,TECH,0.0972653403878212,0.882041871547699,0.020692838355898857
gadgets,A team of hackers has managed to install Linux on a PS4,,569,3333,2015-12-31,TECH,0.016043389216065407,0.9226537346839905,0.061302848160266876
technology,"Microsoft didn't warn victims of Chinese email hack for ""fear of angering the Chinese government""",,80,3062,2015-12-31,TECH,0.23956631124019623,0.729793131351471,0.030640525743365288
technology,"Rubio Outraged by Spying on Israel’s Government, OK with Mass Surveillance of Americans",,39,873,2015-12-31,TECH,0.09228983521461487,0.8801511526107788,0.027559034526348114
gadgets,New Snapdragon Flight Chipset for Drones,,55,412,2015-12-31,TECH,0.018815908581018448,0.9427199959754944,0.038464147597551346
technology,Exclusive: Microsoft to warn email users of suspected hacking by governments,,15,236,2015-12-31,TECH,0.7600206136703491,0.21407251060009003,0.025906864553689957
technology,Hackers get Linux running on a PlayStation 4,,52,157,2015-12-31,TECH,0.015691028907895088,0.8852818012237549,0.09902720153331757
gadgets,"ArcaBoard is a real hoverboard—but it’ll cost you $20,000",,61,130,2015-12-31,TECH,0.026200253516435623,0.9078213572502136,0.06597837805747986
