subreddit,title,selftext,num_comments,score,created_utc,stock/sector,neg,neu,pos
technology,"Now that CISA has passed, here are some tips to protect your Privacy, Anonymity, and Security (x-post from /r/YouShouldKnow)","***[PSA--Long post ahead. tl;dr for the first half of this: You might be getting spied on. Skip to the numbered part and I'll teach you how to protect yourself. I will not explain in detail how these things work in this post, because I want anyone, regardless of their tech prowess, to find these suggestions accessible. It is also because I am by no means an expert in this area, and do not wish to spread misinformation. Luckily, the information is readily available all over the net, if you would like to know more.]***

&gt; **(UPDATE 12/20/2015: I just want to point out that I am aware that a few of my suggestions have been disputed in the comments. I am *OKAY* with that. In fact, I *encourage* it. A few people seem to be getting heated, and there is just no reason for that. I am just some dude on the internet looking to help out. These are all just suggestions that work *for me*. I am sharing with you what I know. None of these tips will cause you any harm, I promise, though an alternative might suit *your* purposes better. Please, I implore you to take what I say with a grain of salt and do your own research. Feel free to tell me I'm wrong in the comments, but please be kind to one another. I will make updates and corrections as needed, so please check back now and again.)**

I promise, I am not as crazy and paranoid as this post is about to make me seem. This is just an important issue to me as a techy/geek. [This is important for you as well, I swear](http://www.zdnet.com/article/if-you-have-nothing-to-hide-heres-where-to-send-your-passwords/), so grab your tinfoil hats and come to [Crazy Town](http://www.weebls-stuff.com/other-toons/video/aaaaaaaaaaaaahaha.html) with me for a moment.

Basically, [CISA](https://en.wikipedia.org/wiki/Cybersecurity_Information_Sharing_Act) has been signed into law. For those that don't know what this means, many corporations and the Department of Homeland Security now have greater access to your online activity and can do with it what they will. There are scary implications of this that I could ramble about; but, honestly, they will *probably* never happen to you or I. But it's the principle of the thing that concerns me.

There are three important things that everyone should have a right to as a ""citizen of the internet"": *Privacy*, *Anonymity*, and *Security*. CISA is a blatant invasion of the first two, particularly Privacy. You do not have to be doing anything illegal to warrant a need to private access to the internet. You just simply should not be spied on. You are being violated. It doesn't matter if you're just returning an email to your grandma, or buying some shoes--there is no reason that your activity should be monitored, recorded, and passed around unless there is some solid evidence pointing to you extorting your grandma or stealing those shoes.

The legislation was [trojan-horsed](http://www.engadget.com/2015/12/18/house-senate-pass-budget-with-cisa/) in on a budget bill and signed off by the Prez himself, so nothing can be done to reverse it. At least not yet. The good news is, there are things *YOU* can do right now to maintain your rights. *All of the following tips are completely legal (in the USA), freely available, relatively simple to use, and within your rights to use as you wish.*

&amp;nbsp;

**[Pro tips begin here!]**

&amp;nbsp;

**1. Privacy:** Use a VPN service. [Cyberghost](http://www.cyberghostvpn.com/en_us?utm_expid=85864364-18._HAGhHhTTvKkQRZylpXQXw.0&amp;utm_referrer=https%3A%2F%2Fwww.google.com%2F) and ~~TunnelBear~~ both offer excellent free services. If you want even better service, there are a few excellent paid services, as well (I don't know any well enough to endorse one, but I've heard good things about NordVPN. It's got 256-bit AES encryption and is completely logless). 

&gt; (**UPDATE:** It was brought to my attention that TunnelBear, while adorable, is not logless and is hosted within the USA. It is therefor not recommended for privacy. It's good if you want to get around a site blocker at work or school, but for REAL privacy, use a reputable paid VPN service. Regardless of arguments, though, the free version of Cyberghost *will* help you maintain Privacy. It is hosted out of the US, it is logless, and they make their revenue from paid subscriptions and will not sell your information. That is not to say that a paid service is not better, it's just that Cyberghost's free service will be safe for you to use.)

The merit of VPNs is debated around the internet, but I have found them to be indispensable in maintaining my own privacy, as they are quick and easy to connect to and are one of the simplest and most effective tools of allowing you to maintain your privacy. 

There are also small program switches you can make. For example, switch from Skype to [qTox](https://tox.chat/). It is a more steady, reliable program that offers all of the same services as Skype, but with excellent end-to-end encryption and it's logless, much like a good VPN. Your conversations will remain between you and the other person only. It's also available on a wide variety of platforms, so it should work for almost anyone. 

Also consider using a more secure email provider. If you want to keep it net-based, use ~~HushMail~~. If you like a client installed on your PC, combine your secure email account with a program called [ThunderBird](https://www.mozilla.org/en-US/thunderbird/), which allows you to easily manage multiple email accounts, among other cool, secure features. 

&gt; (**UPDATE:** I stand corrected. /u/theforcereturns was able to show me that HushMail is *NOT* your most secure option. A much better option, as per his recommendation, would be [ProtonMail](https://protonmail.com/). I've looked into it, and I will be making the switch myself. It's based out of Switzerland and has true end-to-end encryption, among other features that help to privatize and anonymity your email, PLUS--it's free. Super rad. The only downside is that as of now, you have to request an invite and wait for an account due to their need to expand the size of their servers.

&gt; He also wanted me to include some information regarding instant messaging. He recommended [Signal](https://whispersystems.org/blog/signal/) or [Telegram](https://telegram.org/). Signal, in particular, as it was developed by a highly reputable team--however, it is only available for mobile devices. Telegram offers a client for PC, as well. I have personally used [Wickr](https://www.wickr.com/), and I know it to be very secure and reliable. 

&gt; If you MUST use Facebook Messenger (*which I do not recommend in the slightest*), then the best way to do it is to connect through [Pigdin](https://pidgin.im/) with the [OTR Plug-In](https://otr.cypherpunks.ca/) and the current [Messenger compatability](https://github.com/jgeboski/purple-facebook/wiki#basic-usage). The only drag is that your other party MUST have this setup, too, and you will have to authenticate each other. But the plus is that your Facebook messages will be encrypted. Still though, either way, don't send sensitive messages over Facebook. Never. Never ever. Don't. Like... do not. Ever.

Another good idea is to reconsider the search engines you use. Google and Bing are notorious data compilers. I use ~~DuckDuckGo~~ instead. It's fast, accurate, and totally private and anonymous. They do not collect data on you. 

&gt; (**UPDATE:** Some redditors are claiming DuckDuckGo to be less-than-reputable. I can't confirm or deny that as of now, so in lieu of that, I suggest you check out [StartPage](https://startpage.com/) or [PrivateSearch.io](https://www.privatesearch.io/). Both are great, secure search engines. StartPage is slowly becoming my new personal favorite.)

I also want to mention (legal) File Sharing. I'd like to add that [BitDrop](https://bitdropapp.com/) is an awesome tool for anonymous, secure file sharing between your devices. As mentioned above, qTox also has secure file sharing capability.

You can also get a free [MEGA](https://mega.nz/#fm/c1UwVZAZ) account. While not the most secure, if you use Winrar or 7Zip to create an encrypted RAR file with a conspicuous name and send it over HushMail, Tox, etc. to your friend/receiver of the file separate from the decryption password/MEGA access code, it will be secure enough (for non-sensitive documents and files), and you can upload up to 50GB with a free account. Just remember to delete the files from your account AND the rubbish bin after the other party has received them. 

&gt; (**UPDATE:** MEGA is *NOT* to be used as a secure, private file sharing tool. Please see my second edit at the bottom of this post.)

Another option is to create a torrent file of the encrypted RAR file and seed it directly to the other party, after both of you have configured your torrent clients to run all traffic through a proxy.

If you're especially tech-savvy, you can even go so far as to install CFW on your router, provided it's supported, like [Tomato](http://www.polarcloud.com/tomato) or [DD-WRT](http://www.dd-wrt.com/site/index). Tomato in particular will allow you to actively monitor your bandwidth activity to see who is accessing your network, or even just to see if Comcast is throttling your Netflix usage. 

&amp;nbsp;

**2. Anonymity:** Again, you don't have to be a criminal to want to keep your anonymity online. Download the [Tor Browser Bundle](https://www.torproject.org/projects/torbrowser.html.en). It's a modified version of Firefox that allows you to route all of your activity online through the Onion server network. *(Pro tip: Tor will not protect you when downloading or torrenting anything, legal or not. If you engage in a peer-to-peer download, you will inevitably upload real personal information about your system, AND it slows down the Tor network for everybody else. The safest way to download is through a [torrent client](http://www.oldapps.com/utorrent.php?old_utorrent=38?download) that has been [configured to work with a Proxy or VPN](https://www.bolehvpn.net/utorrent.html), but nothing is guaranteed. [Here](http://samair.ru/) is a list of free public proxy servers you may use. Always check the validity of your proxy server [here](http://samair.ru/s-proxychecker/index.php) before each use).* 

(Please note that I **DO NOT** condone piracy or illegal activity of **ANY KIND**. I am simply suggesting uTorrent as a means of securely sharing legally obtained or created files between two parties.)

&gt; (**UPDATE:** Yes, recent versions of uTorrent have been shown to include spyware. Settle down. The version that I linked to above is version 2.2.1, arguably the best version of uTorrent, more lightweight, and spyware free. If you want to forego uTorrent entirely, go with [qBittorent](http://www.qbittorrent.org/), an open source bittorent client that I personally use in addition to uTorrent. It's excellent. A lot of redditors have also recommended Deluge, which looks promising, but I have never used it personally.)

Also, NEVER open a downloaded file while still connected to Tor, especially a PDF. There are often traces of data that ""call home"" when the file is opened, and it can void any protection Tor offers you.

It's also good practice to visit HTTPS versions of sites whenever possible, as they are more secure. The Tor bundle includes a browser plug-in called [HTTPS Everywhere](https://www.eff.org/https-everywhere) that will automatically get you the most secure connection to sites whenever possible. You can also add it to your regular Chrome, Firefox, or Opera browsers, and on Android devices.

You might also consider [spoofing your MAC address](http://www.instructables.com/id/How-to-Spoof-Your-MAC-Address/) now and again. 

&gt; (**UPDATE:** Spoofing your MAC is only necessary if you think your LAN has been compromised from the ""inside."" Otherwise, don't worry about it.)

The last thing I will say on anonymity, for the more tech-savvy again, is that you may consider using something like [VirtualBox](https://www.virtualbox.org/wiki/Downloads) to run a more secure operating system INSIDE of another operating system. You can also just install that more secure OS on a flash drive, but I find the VirtualBox to be easier to manage AND  that it provides more anonymity. I personally would recommend using [Whonix](https://www.whonix.org/wiki/VirtualBox) with VB. It's very effective. I've also heard good things about Tails, but apparently it's not truly logless, and I cannot wholeheartedly recommend it, as I have never used it.

Finally, it's important to know your stuff is working. To test my level of anonymity, I like to use [IP Check](http://ip-check.info/?lang=en) and [Panopticlick](https://panopticlick.eff.org/).

&amp;nbsp;

**3. Security:** Not really relevant to CISA, but it's important, too. ~~Ditch McAffee, Kaspersky, or whatever junk you paid for.~~ Download [Malwarebytes](https://www.malwarebytes.org/lp/sem/?sfc=sem-gs_b_us_en&amp;gclid=CMCSvNKO6ckCFY9gfgodrZED8Q), [Panda Antivirus](http://www.pandasecurity.com/usa/homeusers/solutions/free-antivirus/), and [CCleaner](https://www.piriform.com/ccleaner/download). 

&gt; (**Update:** Just to clarify, CCleaner is NOT an antivrus, and I do not claim that it is. Clearing your registry is just a good practice for security and in general.) 

All free, all easy to use, all great at what they do. Just allow them to update regularly and run automatic scans each night. If you prefer paid software, Kaspersky has the highest detection rate and is super reliable software. There are other good options, as well.

&amp;nbsp;

**Final Notes:** These are just *BASIC* tips to help you protect yourself. This will not make you invisible; if someone still wants to spy on you, they could... but they'll actually have to work for it. There's a lot more you can do to abstract your digital ""fingerprint"". But either way, care about your privacy. Protect yourself. As far fetched as it seems, due to the nature of the issue, the more people that do this stuff, the more secure everyone becomes (especially in regards to Tor use).

&gt;*""Arguing that you don't care about the right to privacy because you have nothing to hide is no different than saying you don't care about free speech because you have nothing to say.""* -- Edward Snowden

&amp;nbsp;

~~/Wall of text~~ *Apparently not....*

&amp;nbsp;

&gt; **EDIT:** A lovely anonymous user posted [this comment](https://www.reddit.com/r/technology/comments/3xj5fe/now_that_cisa_has_passed_here_are_some_tips_to/cy52yyp) with links to further reading, if you're interested. 

&amp;nbsp;

&gt; **EDIT: PART DEUX:** Some redditors have pointed out a few things to be wary of that I should have included in the original post. Later versions of uTorrent have been found to come with spyware. The version I linked to is an older version (2.2.1) and it safe for you to use. If you want to forego uTorrent altogether, qBittorent is an excellent alternative, that I use myself on occasion. It's completely open source, which is groovy, too. 

&gt; Also, MEGA is NOT by any means a secure way of file sharing. I meant to say that if it is NOT a particularly sensitive document you're sending, and it's encrypted, it works in a pinch. Please do not rely on it for secure sharing. There are some good recommendations below in the comments for you to investigate. I won't name any specific ones, as I have not tested them myself. 

&gt; Also Also, one user (I lost his name in the vast ocean that is my inbox--I now I understand what ""RIP My Inbox"" means--but as soon as I find it again, I will credit you, kind stranger) pointed out that unless you select the options to ENCRYPT the email you send with HushMail, it will only send through the clearnet as a normal email and will NOT be secure. Don't forget to encrypt your emails, kids.

&gt; Finally, I just want to make it clear, NONE of this will make you ""invisible."" It simply helps to scatter the information that makes up you ""fingerprint"" to A) Make it less reliable to track you with, and B) to give up less personal data to prying eyes. *YES* the contents of you hard drive are probably compromised if you're not using Whonix or Tails. *YES* the NSA can still watch you if they want to. IF someone REALLY wants to get to you, especially the govt., they still can. This isn't a guide to disappearing completely. This is a guide for the average Joe or Jane, who are not cybercriminals, to regain their privacy online. This won't save you if you're trafficking drugs, but it WILL keep a substantial amount of nosey trackers off your back and help you regain your privacy.

&amp;nbsp;

&gt; **HE'S EDIT AGAIN:** Holy *shit* this post blew up. First of all, THANK YOU for gold, kind stranger. That is awfully kind. I luh you.

&gt; Second, a lot of people are discussing what I recommended for ""Security."" First of all, I said straight up, it basically has nothing to do with CISA. It's just something I believe to be a fundamental right as an internet user and wanted to include. But I also apologize for referring to paid anti-virus software as ""junk."" Most of it is not junk, I do not mean to confuse you. I used Kaspersky for a year or two back in 2011 or so, and it was great. A lot of those programs have a lot to offer, and they work very well. For my purposes, the free anti-virus software does everything I need it to do and more, so it is not worth it to pay for the software. Your purposes may be different, and at the end of the day, it's all about what works for you. So, no, paid antivirus software is not junk. I apologize for the misrepresentation.  

&gt; It should also be noted that spoofing your MAC is JUST for if you think you have been compromised from within your own LAN network. 

&gt; As I stated before, I am no expert. Just a guy who has done a lot of research on his own, trying to do a solid for his fellow internet-users. Everything I suggest is just that--a suggestion. It's what works for me based off the research I have done. I encourage you to take my advice with a grain of salt and do research on your own to see what works for you. But I would venture to say that what I have written is a solid starting point on your journey to a more private, anonymous, and secure browsing experience. Serve hot with a side of common sense. 

&amp;nbsp;

&gt; **EDIT EPISODE IV: A NEW DNS SERVER:** Your DNS server. Change that shizz. I recommend [DNS.Watch](https://dns.watch/index). A redditor (who's name I'll have to hunt down) recommended it to me, I've played with it, and it's great so far. OpenDNS is also good. DON'T use Google DNS. I did for a long time. It's effective, but they absolutely store and use your DNS look-up records. If you use Google's, drop it now.

&amp;nbsp;

&gt; **FOR PEOPLE OUTSIDE THE US WONDERING IF THIS AFFECTS THEM:** Yes. And no. Yes, if you visit sites hosted in the US, but no, the legislature itself does not extend beyond the US border, as I understand it. Your country may or may not have it's own laws regarding the matter.

&amp;nbsp;

&gt; **MORE INFORMATION:** These are some comments that I felt were worth noting, because of some excellent information that was brought up. 

&gt; /u/bytester on software recommendations: https://www.reddit.com/r/technology/comments/3xj5fe/now_that_cisa_has_passed_here_are_some_tips_to/cy5a1qe

&gt; /u/fluxjackal on additional ways to be *extra* secure, if you really want to be secure: https://www.reddit.com/r/technology/comments/3xj5fe/now_that_cisa_has_passed_here_are_some_tips_to/cy5n5no

&gt; /u/Em_Adespoton on software to be wary of and alternate DNS servers: https://www.reddit.com/r/technology/comments/3xj5fe/now_that_cisa_has_passed_here_are_some_tips_to/cy5q4i1

&gt; /u/unska sent me an ~~unbiased~~ site that compares VPNs based on raw information: http://comparisonvpn.com/ *(Another user, /u/OSTIFofficial, pointed out that the site contains all affiliate links and is not ""unbiased."" I have struck that, but kept the link as another point of reference in deciding on a VPN that works for you).*

&gt; /u/OSTIFofficial (full disclosure, s/he runs a VPN company of their own) has compiled a comparison of VPNs you can view here: https://docs.google.com/spreadsheets/d/1FJTvWT5RHFSYuEoFVpAeQjuQPU4BVzbOigT0xebxTOw/edit#gid=0 

&gt; /u/PhillyWick and subsequent comments... this isn't useful. At all. But I laughed really hard, so that's fun? https://www.reddit.com/r/technology/comments/3xj5fe/now_that_cisa_has_passed_here_are_some_tips_to/cy58w4h

&gt; I'll probably add more as I sift through the comment section. There's a lot, and I am only one man, no matter how many fake mustaches I own.

&amp;nbsp;

**Thanks for all the gold, homies! I think when paranoid people tell you to buy gold, they aren't referring to this. But I will accept it graciously. Be safe, friends, and Happy Holidays!**",1960,8032,2015-12-20,TECH,0.047705856151878834,0.9216051995754242,0.030688938684761524
technology,Apple's stock loses over $160B as analysts forecast smartphone decline,,1185,3873,2015-12-20,TECH,0.950600266456604,0.030222510918974876,0.019177187234163284
technology,Rand Paul: Nobody read the $1.1 trillion omnibus bill,,443,2301,2015-12-20,TECH,0.021323565393686295,0.8326305747032166,0.14604590833187103
technology,Comcast customer discovers huge mistake in company’s data cap meter,,213,2059,2015-12-20,TECH,0.5845760703086853,0.3932630717754364,0.02216089889407158
technology,Google's artificial intelligence bot thinks the purpose of life is 'to live forever',,388,1989,2015-12-20,TECH,0.03121253289282322,0.9233847856521606,0.04540272802114487
gadgets,New Sony battery reportedly gets 40% better life,,351,1843,2015-12-20,TECH,0.01792813278734684,0.04589308425784111,0.9361787438392639
technology,Hillary Clinton Says She Wants a Manhattan Project for Encryption. The Fuck?,,308,1682,2015-12-20,TECH,0.01847226917743683,0.9095701575279236,0.07195758074522018
technology,Towns Start to Realize AT&amp;T's Gigabit Fiber Promises Are Hollow,,60,1392,2015-12-20,TECH,0.036687955260276794,0.8984800577163696,0.06483196467161179
technology,"In a first, East Texas judge hits patent troll with attorneys’ fees",,47,1262,2015-12-20,TECH,0.42721840739250183,0.5161246061325073,0.05665706843137741
technology,Hillary Clinton on encryption: 'maybe the back door isn't the right door',,134,1038,2015-12-20,TECH,0.2512204945087433,0.678381085395813,0.07039843499660492
technology,Edward Snowden: Clinton's Call for a 'Manhattan-Like Project' Is Terrifying - Clinton's Big Brotherish proposal at Saturday's Democratic debate was both troubling and vague,,1940,6016,2015-12-21,TECH,0.03320455551147461,0.9269819259643555,0.03981352224946022
technology,The first website went online 25 years ago today,,443,4750,2015-12-21,TECH,0.01838565804064274,0.9370269179344177,0.04458744451403618
technology,MIT Team Uses Modified Kinect to Boost 3D Scan Resolution by 1000x - Potential VR and 3D Printing Breakthrough,,331,4181,2015-12-21,TECH,0.01163074653595686,0.9096640348434448,0.07870521396398544
technology,Manhattan DA goes after Tim Cook and Apple for offering full-disk encryption,,373,2132,2015-12-21,TECH,0.028375927358865738,0.9236802458763123,0.04794388636946678
technology,Tim Cook: Americans shouldn't have to choose between privacy and security,,68,1352,2015-12-21,TECH,0.0734330415725708,0.8919270038604736,0.03463997691869736
technology,The HTTP 451 Error Code for Censorship Is Now an Internet Standard,,49,1290,2015-12-21,TECH,0.08035813271999359,0.9010883569717407,0.01855357550084591
gadgets,Your Smartphone Camera Should Suck. Here’s Why It Doesn’t,,204,833,2015-12-21,TECH,0.060445502400398254,0.8912876844406128,0.048266783356666565
technology,Red Tape and Installation Prove Biggest Challenge to Solar Today,,45,781,2015-12-21,TECH,0.18245398998260498,0.7388077974319458,0.07873819023370743
technology,WTF. No...Hillary Clinton wants “Manhattan-like project” to break encryption,,87,590,2015-12-21,TECH,0.0239737369120121,0.9300174117088318,0.0460088886320591
gadgets,A water detection gadget that learns water usage to detect leaks in the home,[deleted],70,396,2015-12-21,TECH,0.03912116959691048,0.9007436037063599,0.060135189443826675
technology,The Obama administration fought a legal battle against Google to secretly obtain the email records of a researcher and journalist associated with WikiLeaks,,1913,7284,2015-12-22,TECH,0.15915006399154663,0.8050603270530701,0.035789620131254196
technology,"SpaceX successfully lands Falcon 9 booster for the first time, paving the road for reusable rockets",,960,6844,2015-12-22,TECH,0.010526174679398537,0.7622678875923157,0.22720590233802795
technology,US Gov't Agencies Freak Out Over Juniper Backdoor; Perhaps They'll Now Realize Why Backdoors Are A Mistake,,359,4075,2015-12-22,TECH,0.0716203898191452,0.8697733879089355,0.05860619619488716
gadgets,Oculus begins shipping the finished Rift to developers,,1246,3510,2015-12-22,TECH,0.016160951927304268,0.8082586526870728,0.17558041214942932
technology,Santa Claus confirms NSA attack on naughty or nice database,[deleted],72,3071,2015-12-22,TECH,0.03391290083527565,0.9192825555801392,0.04680446535348892
technology,Researchers think that a dangerous 'back door' in software used by the US government was caused by the NSA,,98,2886,2015-12-22,TECH,0.700439453125,0.2759683132171631,0.02359219640493393
technology,"AT&amp;T, DirecTV Deliver 'Merger Synergies' By Raising Rates In Perfect Unison",,221,2029,2015-12-22,TECH,0.017219815403223038,0.8115026354789734,0.17127752304077148
