subreddit,title,selftext,num_comments,score,created_utc,stock/sector,neg,neu,pos
technology,"Wikileaks Latest Info-Dump Shows, Again, That The NSA Indeed Engages In Economic Espionage Against Allies",,876,5027,2015-08-01,TECH,0.19143377244472504,0.7784704566001892,0.03009577840566635
technology,TPP a threat to knowledge and innovation: Trade and investment may be winners but intellectual property could suffer if the deal adopts US rules.,,450,4707,2015-08-01,TECH,0.5774612426757812,0.39557716250419617,0.026961591094732285
gadgets,Go-Pro Spherical: The future of Virtual Reality,"http://youtu.be/TO-m3exi27M

Stand up and tilt your phone around while you watch this.",259,1221,2015-08-01,TECH,0.018707184121012688,0.9147754311561584,0.06651739776134491
technology,AntiVirus firm BitDefender hacked; Turns out stored passwords are unencrypted,,136,1176,2015-08-01,TECH,0.06712931394577026,0.8950479626655579,0.03782271966338158
technology,"£300 ""audiophile cables"" make no difference, finds test",,182,823,2015-08-01,TECH,0.017465362325310707,0.8826000094413757,0.09993471205234528
technology,The intellectual property provisions of the TPP will give the United States’ “third offset” strategy teeth.,,38,538,2015-08-01,TECH,0.010789571329951286,0.853610098361969,0.13560034334659576
technology,Tech industry's persistent claim of worker shortage may be phony,,99,296,2015-08-01,TECH,0.9348771572113037,0.05237896367907524,0.012743832543492317
technology,Brazil will use drones to fight slave labor in rural areas,,14,290,2015-08-01,TECH,0.21583759784698486,0.7562824487686157,0.027879977598786354
technology,Ridiculous 'Terrorist Reporting' Provision In Intelligence Authorization Would Undermine The First Amendment,,5,242,2015-08-01,TECH,0.5502411723136902,0.423942893743515,0.02581588365137577
technology,"Chinese factory replaces 90% of humans with robots, production soars",,94,193,2015-08-01,TECH,0.2092408537864685,0.7300981283187866,0.06066100671887398
technology,"HitchBOT destroyed in Philadelphia, ending U.S. tour",,2264,4599,2015-08-02,TECH,0.6046940088272095,0.3528842628002167,0.04242167994379997
technology,Microsoft To Invest About $100 Million in Startup Uber,,1024,4593,2015-08-02,TECH,0.009060072712600231,0.8181652426719666,0.17277473211288452
technology,Anti-Web Blocking Site More Popular in the UK than Spotify &amp; Skype,,376,3620,2015-08-02,TECH,0.042791951447725296,0.9128714203834534,0.044336702674627304
gadgets,Density sensor: Tiny sensor tells you when your favorite places are crowded,,175,1590,2015-08-02,TECH,0.024627981707453728,0.9343056082725525,0.04106635972857475
technology,Former Head of DHS Warns Americans About the Horrors of Govt-Mandated Crypto “Backdoors”,,92,1454,2015-08-02,TECH,0.08617369085550308,0.863593578338623,0.050232648849487305
technology,Kim Dotcom: don't trust Mega... I'm launching Mega 3.0 (Wired UK),,85,918,2015-08-02,TECH,0.057058900594711304,0.9156275391578674,0.027313562110066414
technology,"Inside the failure of Google+, a very expensive attempt to unseat Facebook",,248,907,2015-08-02,TECH,0.09185242652893066,0.8724889755249023,0.03565855324268341
technology,An international team of scientists has successfully built robotic insects that walk and jump off water surface without sinking just as real life Water Striders,,12,691,2015-08-02,TECH,0.010712213814258575,0.8325005173683167,0.15678730607032776
gadgets,"Wtf they killed hitchbot, you bastards!",,217,589,2015-08-02,TECH,0.08860687911510468,0.8809634447097778,0.03042967990040779
technology,Victoria Taylor Reflects on Her Time at Reddit and Life at the Center of a Media Maelstrom,,12,375,2015-08-02,TECH,0.029273150488734245,0.9292786717414856,0.041448190808296204
technology,Fed-up customers are hammering ISPs with FCC complaints about data caps,,1617,6534,2015-08-03,TECH,0.053890127688646317,0.9189309477806091,0.027178918942809105
technology,"Tesla, unlike every other car company, is soon going to start arguing publicly for higher fuel efficiency standards.",,1493,4662,2015-08-03,TECH,0.013031753711402416,0.7137680649757385,0.273200124502182
gadgets,"X15 Flamethrower: For just $1,600, you can buy a flamethrower that spits fire 50 feet into the air",,863,2893,2015-08-03,TECH,0.020343326032161713,0.9226846694946289,0.056972045451402664
technology,"Genetically modified rice makes more food, less greenhouse gas. A 50 percent boost in rice, with methane dropping by 90 percent.",,289,1497,2015-08-03,TECH,0.020111242309212685,0.7975611686706543,0.18232759833335876
technology,TPP Will Override Five Years Of Democratic Discussion About Software Patents In New Zealand,,47,931,2015-08-03,TECH,0.03587472438812256,0.9197770953178406,0.04434821382164955
technology,Airbus just patented a jet that could fly from London to New York in 1 hour,,97,375,2015-08-03,TECH,0.009878905490040779,0.8694598078727722,0.12066134065389633
technology,Google's Sergey Brin: You'll ride in robot cars within 5 years,,122,170,2015-08-03,TECH,0.012046943418681622,0.8750787377357483,0.11287431418895721
technology,"Nokia says no to Uber, sells $3 billion HERE Maps to German trio of BMW, Audi and Mercedes.",,33,169,2015-08-03,TECH,0.009851193986833096,0.8509342074394226,0.13921457529067993
technology,Man upgrades to Windows 10 – it shows his wife his entire porn collection,,100,156,2015-08-03,TECH,0.02032412961125374,0.9360268712043762,0.043649010360240936
technology,New manufacturing approach slices lithium-ion battery cost in half,,21,118,2015-08-03,TECH,0.012662886641919613,0.5394656658172607,0.4478714168071747
technology,"Where broadband is a utility, 100Mbps costs just $40 a month. Small Oregon city upgrades network to fiber, destroys competition.",,1528,6553,2015-08-04,TECH,0.019977156072854996,0.8827218413352966,0.09730106592178345
technology,"Major Comcast Outage Occurring At The Moment, Comcast Customer Service Lines Go Dark, No Major News Outlets Covering Outage - (Chicago, S.F., Denver, Seattle, Atlanta, Miami, Detroit and more without cable / internet)",,2384,5915,2015-08-04,TECH,0.1488911211490631,0.8334463834762573,0.017662489786744118
technology,By Bill Gates: Why I’m investing $1 billion of my own money into clean energy research,,1543,5652,2015-08-04,TECH,0.010440932586789131,0.859103798866272,0.13045527040958405
technology,Netflix Announced a Game-Changing Parental Leave Policy - it’s allowing employees to take unlimited maternity or paternity leave during the first year after their child’s birth or adoption.,,1254,4565,2015-08-04,TECH,0.27390557527542114,0.7066090106964111,0.019485415890812874
technology,Putting Elon Musk and Steve Jobs on a Pedestal Misrepresents How Innovation Happens | MIT Technology Review,,650,3691,2015-08-04,TECH,0.020913653075695038,0.9042056798934937,0.07488071918487549
technology,"If Google Shouldn't Apply EU's 'Right To Be Forgotten' Everywhere, Why Should It Apply US DMCA Takedowns Globally?",,148,2721,2015-08-04,TECH,0.03042447753250599,0.9184331297874451,0.05114244297146797
gadgets,This is the world's first braille smartwatch,,208,2326,2015-08-04,TECH,0.026178238913416862,0.9275959134101868,0.046225838363170624
technology,EFF creates a stronger ‘Do Not Track’ standard to stop unwanted tracking once and for all,,37,789,2015-08-04,TECH,0.018859343603253365,0.2535734176635742,0.7275672554969788
technology,T-Mobile officially passes Sprint to become third-largest US carrier,,55,466,2015-08-04,TECH,0.016297535970807076,0.8719953298568726,0.1117071583867073
technology,"Github's new Code of Conduct says ""Our open source community prioritizes marginalized people’s safety over privileged people’s comfort."" and will not act on ""reverse"" racism, sexism, etc.",,334,375,2015-08-04,TECH,0.02706337533891201,0.9321843981742859,0.04075228422880173
technology,Mayor Taylor announces Google Fiber coming to San Antonio,,1017,5296,2015-08-05,TECH,0.027376264333724976,0.8326090574264526,0.1400146335363388
technology,An Undead SOPA Is Hiding Inside an Extremely Boring Case About Invisible Braces,,589,5133,2015-08-05,TECH,0.13419364392757416,0.8340569734573364,0.0317494161427021
technology,TPP Leaks Shows US Stands Firm That Companies Should Be Free To Abuse Patents &amp; Copyrights,,216,3921,2015-08-05,TECH,0.019362080842256546,0.8775355219841003,0.10310238599777222
technology,iTunes is now illegal under UK law,,781,3800,2015-08-05,TECH,0.31867727637290955,0.6623280048370361,0.018994754180312157
technology,New virus created that can completely wreck Apple computers,,742,2906,2015-08-05,TECH,0.7409994602203369,0.2386699765920639,0.020330607891082764
gadgets,"SanDisk, Toshiba double down, announce the world's highest cap",,312,1329,2015-08-05,TECH,0.027668645605444908,0.3513593077659607,0.6209720373153687
technology,Apple stock implosion shreds $113.4B,,323,1234,2015-08-05,TECH,0.02405145764350891,0.9019891023635864,0.07395941019058228
technology,"The dream of a free and open Internet is slowly being killed by overregulation, censorship and bad laws that don't stop the right people, a top computer crime defense lawyer says.",,35,1069,2015-08-05,TECH,0.22916969656944275,0.7310965657234192,0.03973374888300896
technology,Sanders wants panel to study privacy in digital age,,53,966,2015-08-05,TECH,0.01586185209453106,0.8950143456459045,0.08912378549575806
technology,"Facebook deleted our companies page (17.5k likes), changed employment info on our personal accounts and forced us to change our emails with no reason given and we haven't heard from them.",,124,909,2015-08-05,TECH,0.3729453980922699,0.5993101000785828,0.02774452604353428
technology,Spy agency whistleblower posted top secret report to 4chan but users dismissed it as 'fake and gay',,1730,7662,2015-08-06,TECH,0.6725424528121948,0.3039937913417816,0.0234637763351202
technology,"Previously reliable, Ookla's Speedtest.net now says Comcast #1 ISP in country. Who's your sugar daddy?",,276,2332,2015-08-06,TECH,0.027921069413423538,0.9091441631317139,0.0629347488284111
technology,Hawaii bans non-compete and non-solicit clauses between high-tech companies and their employees,,88,1986,2015-08-06,TECH,0.045798975974321365,0.9307885766029358,0.023412436246871948
technology,"In 2010, Finland became the first country in the world to make Internet access a legal right. Now there are plans to make access to 100 Mbit/s Internet a legal right for all citizens. Nordic think tank Demos Helsinki lists the 10 principles to follow in a hyperconnected society.",,161,1528,2015-08-06,TECH,0.015250181779265404,0.9173075556755066,0.06744223833084106
gadgets,"HTC, Still Struggling, Pins Turnaround On Cost Cutting And Sexier Devices",,653,1258,2015-08-06,TECH,0.8577556014060974,0.0942443460226059,0.048000071197748184
technology,Japanese court rules that bitcoin can't be 'owned',,165,904,2015-08-06,TECH,0.11881829798221588,0.8606640100479126,0.02051769383251667
technology,EFF releases Privacy Badger 1.0 -- a browser addon that algorithmically detects and blocks online trackers,,30,485,2015-08-06,TECH,0.04761124774813652,0.9203646183013916,0.03202413395047188
technology,FCC might finally start judging broadband on more than speed | The Verge,,9,463,2015-08-06,TECH,0.01126786507666111,0.8446286916732788,0.14410346746444702
technology,Donald Trump's Trump.com Hacked to Thank Jon Stewart,,17,365,2015-08-06,TECH,0.021830551326274872,0.9002249836921692,0.07794444262981415
technology,Pay TV stocks are getting hammered and it's all thanks to cord cutters,,60,285,2015-08-06,TECH,0.12276924401521683,0.21166279911994934,0.665567934513092
technology,"Kim Dotcom: Mega 3.0 will succeed as a nonprofit ""Copyright extremism has to stop. Hollywood needs to adapt to the internet and not the other way around. They need to make their content available globally at the same time, at a fair price and for any device.""",,1682,8134,2015-08-07,TECH,0.014697084203362465,0.8784961104393005,0.10680679976940155
technology,"BitTorrent to RIAA: You’re ‘barking up the wrong tree’ -- ""Piracy is a real thing, but BitTorrent, Inc. is not the source. We do not host, promote, or facilitate copyright infringing content and the protocol, which is in the public domain, is a legal technology""",,962,7240,2015-08-07,TECH,0.048593439161777496,0.9310254454612732,0.020381098613142967
technology,"An Oakland shooting reveals how cops snoop on cell phones. An undercover operation is going very, very wrong for local and federal authorities.",,251,4414,2015-08-07,TECH,0.4130532443523407,0.5628772377967834,0.02406950667500496
technology,"See-Through Solar Could Turn Windows, Phones Into Power Sources",,336,3709,2015-08-07,TECH,0.012066073715686798,0.8713573813438416,0.11657659709453583
gadgets,"Amazon Fire Stick will DESTROY your data usage! And by ""destroy"" I mean ""use up your monthly data quota quickly and you'll pay serious overage charges for"".","We had cable TV to all three televisions and a Roku in the living room.  The Comcast bill got out of control so we opted to drop cable and keep the Internet, and stream all our programming. 

Instead of getting Roku for the other two televisions we went with the Amazon Fire Sticks. No good reason. This was near the end of the month. 

A few days later, in the last day of the month, we get a notice that we're at 90% of our data usage with an explanation of what the overage charges would be. I guess that was nice of them to warn us.  Our monthly cap is 300 GB and we were shocked that we'd used so much, and also unaware until that point we even had a cap. 

After checking the wireless router to make sure no unauthorized connections existed we thought it might be the new Fire Sticks. The following day we started over on the August data plan and we used 40 GB!!!! IN ONE DAY! Seriously Amazon??? Unplugged those suckers and the next day used only 3 GB. 

We've installed Roku sticks on all the televisions and have been watching closely for a week and so far we've used about 3 to 10 GB a day. 

TLDR: Amazon Fire Stick used over 4 times the data that Roku uses, and nearly cost us a bundle of money on data overage charges. 

Edit: Yes, it's a data usage cap of 300 GB a month. 
No really, it is. 
Yes, I'm serious, I have a data cap. 
No, I'm not in a 3rd world country and yes I'm aware this is 2015. 
And yes I really do have a data cap. 
We didn't even know we had a cap until we got the Fire Stick so it's possible you have one too. 
This post isn't about my data cap - it's about data usage of the Fire Stick. 
I returned both Fire Sticks and got two Roku sticks. No more data usage problems. Hooray!",972,1950,2015-08-07,TECH,0.057757679373025894,0.9170753955841064,0.02516687661409378
gadgets,64 gb usb 3.0 drives are now $19 at Best Buy. Multiple brands. And they have 256 gb usb drives too.,,285,761,2015-08-07,TECH,0.019751306623220444,0.9391636848449707,0.04108507186174393
technology,"FCC urges carriers to turn off copper networks, upgrade to fiber",,34,608,2015-08-07,TECH,0.01230986975133419,0.26526376605033875,0.7224263548851013
technology,Speedtest.net is owned by comcast.,,135,600,2015-08-07,TECH,0.044779591262340546,0.9257555603981018,0.02946481481194496
technology,EFF Told To “Shut The Hell Up” About SOPA,,38,477,2015-08-07,TECH,0.07282334566116333,0.8681764006614685,0.05900022014975548
gadgets,"Fully Charged: Pebble Time Steel preorders begin, and see Tesla's automated Snakebot charger",,42,349,2015-08-07,TECH,0.02498459257185459,0.9243332743644714,0.050682198256254196
technology,"New Zealand to be coal-free by 2018, 90% renewable by 2025",,1063,7420,2015-08-08,TECH,0.033842384815216064,0.9178416132926941,0.048316024243831635
gadgets,"Japanese mini Segway ""WalkCar""",,803,3610,2015-08-08,TECH,0.02875024452805519,0.9144959449768066,0.05675387755036354
technology,"Cord-Cutting Gets Ugly: U.S. Pay-TV Sector Drops 566,000 Customers in Q2",,131,339,2015-08-08,TECH,0.560019314289093,0.4069988429546356,0.032981812953948975
technology,Windows 10 Forced Updates Causing Endless Crash Loops,,157,249,2015-08-08,TECH,0.9119913578033447,0.07205276191234589,0.015955865383148193
technology,Mainstream Media Stock Prices Collapsing as People Choose Internet Over TV,,24,202,2015-08-08,TECH,0.03239515796303749,0.9404318332672119,0.027172936126589775
technology,"Study about search engines &amp; elections: “What we’re talking about here is a means of mind control on a massive scale that there is no precedent for in human history.” [...] ""Specifically, we show that biased search rankings can shift the voting preferences of undecided voters by 20% or more.""",,24,174,2015-08-08,TECH,0.055288031697273254,0.9057075381278992,0.03900444135069847
technology,Samsung has an 18.4″ tablet in the making — could fold into two when idle,,28,129,2015-08-08,TECH,0.02419024333357811,0.8472468256950378,0.12856292724609375
technology,Verizon ends two-year contracts with new plans,,57,127,2015-08-08,TECH,0.029873739928007126,0.8578234910964966,0.11230272054672241
technology,Canadian Filmmaker Fears for Creative Freedom Under the TPP,,9,126,2015-08-08,TECH,0.17974327504634857,0.7774286866188049,0.042827997356653214
technology,Chemical-only cell reprogramming transforms human and mouse skin cells into neurons,,1,120,2015-08-08,TECH,0.021342426538467407,0.9196411371231079,0.0590163879096508
technology,RollJam a US$30 device that unlocks pretty much every car and opens any garage,,1426,6318,2015-08-09,TECH,0.023440200835466385,0.937817394733429,0.03874235972762108
technology,"Tesla likely to supply cars to Uber in the nearterm and Uber would buy 500,000 cars if Tesla can make them fully self driving",,342,2021,2015-08-09,TECH,0.00930395070463419,0.8646202683448792,0.12607577443122864
technology,"Anti-piracy group hits indie creators for using the word ""pixels"" -- An anti-piracy firm working for Columbia Pictures has hit Vimeo with a wave of bogus copyright takedowns just because people used the word 'Pixels' in their video titles. Several indie productions are affected",,135,1926,2015-08-09,TECH,0.19442452490329742,0.7857369780540466,0.019838539883494377
gadgets,"Review of the Amazon Dash Button, Now Available to Prime Members",,440,1324,2015-08-09,TECH,0.020748501643538475,0.9405361413955688,0.03871532157063484
gadgets,Intel has launched the first Skylake processors intended for gamers,,460,918,2015-08-09,TECH,0.012310684658586979,0.8549967408180237,0.1326926201581955
technology,Researchers Discover Rootkit Exploit In Intel Processors That Dates Back To 1997,,76,598,2015-08-09,TECH,0.030191609635949135,0.9207464456558228,0.049061864614486694
gadgets,"Exposed: the Galaxy Note 5 is leaked in-full, packaging and all",,139,294,2015-08-09,TECH,0.03913870453834534,0.920764148235321,0.04009716585278511
technology,Ban Killer Robots before They Become Weapons of Mass Destruction,,45,285,2015-08-09,TECH,0.14918096363544464,0.8271620273590088,0.023657072335481644
technology,A new method for assembling aircrafts has passed testing at Langley: the new method allows aircraft to be built without rivets meaning more complex plane shapes become possible.,,15,271,2015-08-09,TECH,0.011699563823640347,0.8684856295585632,0.11981477588415146
technology,"Software Engineer Finds Security Breach in Facebook, Enabling Him to Harvest Potentially Millions of User Profiles and Their Phone Numbers",,37,250,2015-08-09,TECH,0.9078992605209351,0.07260552793741226,0.019495151937007904
technology,Larry Page and Sergey Birn announce the Alphabet,,2240,7592,2015-08-10,TECH,0.045470044016838074,0.8987953662872314,0.05573461577296257
technology,"Adobe study finds there are 198 million adblocking users, growing 47% YoY and that the advertising industry will lose $21bn in 2015.",,2472,6085,2015-08-10,TECH,0.410302996635437,0.37462329864501953,0.21507367491722107
technology,NASA crew to eat space-grown veggies for the first time,,483,5791,2015-08-10,TECH,0.021521298214793205,0.8923459649085999,0.08613276481628418
technology,"Leaked Trans-Pacific Partnership draft would force Canada to rework copyright, critics say",,273,4399,2015-08-10,TECH,0.8223806023597717,0.15995563566684723,0.017663707956671715
gadgets,"Security expert creates Rolljam, a $30 device that can break into your car and home",,509,2579,2015-08-10,TECH,0.04457928240299225,0.9234312176704407,0.031989485025405884
technology,YouTube is now better at live streaming than Twitch,,258,1913,2015-08-10,TECH,0.01903323084115982,0.9341527819633484,0.04681398347020149
technology,HTC caught storing fingerprints AS WORLD-READABLE CLEARTEXT,,147,1545,2015-08-10,TECH,0.03408140316605568,0.9261789321899414,0.03973964601755142
technology,Computer engineer writes a twitter bot to enter contests and won over 1000 prizes in about 9 months,,78,1158,2015-08-10,TECH,0.03915990889072418,0.9271975159645081,0.03364253044128418
technology,"Researcher develops Living Wage Calculator (LWC) - This online spreadsheet lets anyone calculate a wage required to make ends meet, adjusted for every community in the U.S.",,188,959,2015-08-10,TECH,0.043758574873209,0.9058648943901062,0.05037650838494301
technology,Vimeo Should Take Some Of The Blame For Simply Accepting Massive Bogus DMCA Takedown Over The Word 'Pixels',,52,635,2015-08-10,TECH,0.08603083342313766,0.8662580251693726,0.047711119055747986
technology,"Lenovo is now using rootkit-like techniques to install their software on CLEAN Windows installs, by having the BIOS overwrite windows system files on bootup.",,1525,7753,2015-08-11,TECH,0.03615391254425049,0.9260690212249756,0.0377771332859993
technology,"Want fiber Internet? That’ll be $383,500, ISP tells farm owner. Good news, though: Small ISP promises to do the same work for just $42,000.",,1387,7123,2015-08-11,TECH,0.02829642966389656,0.8956693410873413,0.07603425532579422
gadgets,Google wants to drop its low-end Android One phones to £20-30,,320,2428,2015-08-11,TECH,0.38798612356185913,0.5886095762252808,0.023404333740472794
technology,"First victim of Spain's 'gag law' fined for criticising 'lazy' police: Eduardo Díaz described his local police force as ""slackers"" on Facebook and a few hours later, they turned up on his doorstep and fined him",,51,782,2015-08-11,TECH,0.7243909239768982,0.2437468022108078,0.031862273812294006
technology,Oracle security chief to customers: Stop checking our code for vulnerabilities,,59,676,2015-08-11,TECH,0.2564932107925415,0.7226746678352356,0.02083214744925499
technology,Wall Street Suddenly Wakes Up To Cord Cutting,,139,611,2015-08-11,TECH,0.34130996465682983,0.5253607034683228,0.1333293616771698
gadgets,£20-30 Google Android One phones are Coming to Shake the Market,,111,342,2015-08-11,TECH,0.05612621083855629,0.8600985407829285,0.08377522975206375
technology,Hackers who breached corporate wires made millions off insider trading,,27,325,2015-08-11,TECH,0.5016520023345947,0.46315068006515503,0.03519735485315323
technology,Why TPP Threatens To Undermine One Of The Fundamental Principles Of Science,,12,299,2015-08-11,TECH,0.3758910894393921,0.5886424779891968,0.035466451197862625
technology,The first consumer vehicle to drive on its own without any input from a human will come from Tesla on August 15th,,65,283,2015-08-11,TECH,0.011270984075963497,0.9060844779014587,0.08264456689357758
technology,"I built a Twitter bot that entered—and won—1,000 online contests for me",,1590,7197,2015-08-12,TECH,0.015606562606990337,0.4105655550956726,0.5738279223442078
gadgets,Third-party iPhone case maker invents self-repairing plastic technology that works instantly,,426,3128,2015-08-12,TECH,0.011388922110199928,0.8188017010688782,0.16980937123298645
technology,Fight back against your ISP: Stop paying bogus modem rental fees,,409,2623,2015-08-12,TECH,0.061235763132572174,0.9136956930160522,0.02506856434047222
technology,"A commercial airline pilot with 30 years' experience claims the threat of drones crashing into aircraft is ""much ado about nothing"". He points out how hundreds of mostly harmless annual bird strikes dwarfs the number of drone sightings made by pilots.",,279,1266,2015-08-12,TECH,0.10837724804878235,0.864501416683197,0.027121372520923615
technology,Russia bans Reddit,,117,1084,2015-08-12,TECH,0.24167408049106598,0.7299897074699402,0.02833625301718712
gadgets,Leak shows Galaxy S6 Edge+ preorders start August 21,,168,383,2015-08-12,TECH,0.03485313802957535,0.9338623285293579,0.03128456324338913
technology,"Adblock Plus Study: ""Ultimately, there is a 25.0% reduction in bytes downloaded, a result that increases to 40.0% when video traffic is considered in isolation.",,88,332,2015-08-12,TECH,0.5883569717407227,0.2774801552295685,0.13416290283203125
gadgets,Holographic fantastic: Galaxy S7 could feature an image projection screen,,65,312,2015-08-12,TECH,0.013452072627842426,0.9335252046585083,0.05302274227142334
technology,Study: Consumers Don’t Trust Businesses With Their Data,,28,232,2015-08-12,TECH,0.30803951621055603,0.6456254720687866,0.04633501544594765
technology,How to see all the companies tracking you on Facebook - and block them,,28,168,2015-08-12,TECH,0.09415122866630554,0.8838077187538147,0.022041087970137596
technology,Lenovo crams unremovable crapware into Windows laptops – by hiding it in the BIOS,,2060,8629,2015-08-13,TECH,0.028180085122585297,0.9131828546524048,0.0586371012032032
technology,Roomba just got government approval to make an autonomous lawn mower,,1282,5924,2015-08-13,TECH,0.010091084986925125,0.7646351456642151,0.2252737581729889
gadgets,Roomba just got government approval to make an autonomous lawn mower,,748,4251,2015-08-13,TECH,0.010091084986925125,0.7646351456642151,0.2252737581729889
technology,Facebook canceled a student's internship after he highlighted a significant privacy issue with the Messenger app.,,147,3347,2015-08-13,TECH,0.9464647769927979,0.04377268627285957,0.009762582369148731
