subreddit,title,selftext,num_comments,score,created_utc,stock/sector,neg,neu,pos
technology,"CIA Accidentally Releases Apology Letter It Wrote, But Never Sent To The Senate For Illegally Spying On It",,64,1734,2015-08-13,TECH,0.2612502872943878,0.6887730360031128,0.04997667670249939
technology,Samsung unveils 2.5-inch 16TB SSD: The world’s largest hard drive,,168,913,2015-08-13,TECH,0.017707912251353264,0.8457222580909729,0.13656990230083466
technology,"Woman’s webcam hacked. Media calling it ""Netflix hack"", because they happened to be watching Netflix at the time.",,162,862,2015-08-13,TECH,0.11177463084459305,0.8659180402755737,0.02230728603899479
technology,"Even when told not to, Windows 10 just can’t stop talking to Microsoft",,198,771,2015-08-13,TECH,0.1768905371427536,0.7715981006622314,0.051511287689208984
technology,Windows 10 sends identifiable data to Microsoft despite privacy settings,,114,633,2015-08-13,TECH,0.028475144878029823,0.9270913600921631,0.044433485716581345
technology,Researcher finds backdoor in TOTOLINK routers. TOTOLINK updates firmware to deactivate backdoor from launching at startup but keeps it in the firmware while denying its existence and threatening to sue media entities that write about it,,29,494,2015-08-13,TECH,0.18042971193790436,0.795291543006897,0.024278730154037476
technology,Reddit is now censoring posts and communities on a country-by-country basis,,3712,8824,2015-08-14,TECH,0.031242750585079193,0.9129411578178406,0.05581608787178993
technology,"The biggest cell phone ripoff: $100 for 32 GB of storage -- ""The flash storage drives installed in the iPhone 6 cost Apple just $7.55 per 16 GB, according to TechInsights, a patent consultant that performs gadget tear-downs. The 32 GB of storage included the Galaxy S6 costs Samsung $14.50""",,1934,5460,2015-08-14,TECH,0.02771739661693573,0.8752308487892151,0.0970517098903656
technology,"Sen. Dianne Feinstein claims that Net Neutrality helps terrorists, urges FCC to allow ISPs to block content",,132,1174,2015-08-14,TECH,0.07216108590364456,0.8769521117210388,0.0508868545293808
gadgets,OnePlus 2 teardown reveals easy-to-replace modular components,,120,816,2015-08-14,TECH,0.023575490340590477,0.9109923839569092,0.06543218344449997
technology,"Australian court demands a $600,000 bond from the movie rights holders to obtain downloaders data",,62,715,2015-08-14,TECH,0.048409633338451385,0.9239256978034973,0.027664707973599434
technology,"Comcast VP: 300GB data cap is “business policy,” not technical necessity",,49,410,2015-08-14,TECH,0.07209187000989914,0.9075746536254883,0.020333506166934967
technology,Larry Page says he wants his fortune to go to Elon Musk. Alphabet is the next best thing.,,96,379,2015-08-14,TECH,0.0357196182012558,0.8995980620384216,0.06468227505683899
technology,"Apple secretly recalls small number of Apple TVs. No public advisory, customers were contacted directly.",,29,346,2015-08-14,TECH,0.4591156542301178,0.516181468963623,0.024702873080968857
technology,New breakthrough in fusion power could produce 6 times more energy than input,,65,284,2015-08-14,TECH,0.007878176867961884,0.6380727291107178,0.3540491461753845
technology,Samsung unveils 2.5-inch 16TB SSD,,30,230,2015-08-14,TECH,0.03162729740142822,0.8942060470581055,0.0741666629910469
technology,"Amazon employee on relentless working conditions - “Nearly every person I worked with, I saw cry at their desk.”",,6460,8477,2015-08-15,TECH,0.9482675194740295,0.04105183854699135,0.010680535808205605
technology,Mozilla just built an ad blocker into Firefox,,270,1662,2015-08-15,TECH,0.036030981689691544,0.9247440695762634,0.03922491520643234
gadgets,Surfing The Internet With A Laptop From 1983 Sounds Nightmarish [TRS-80 Model 100],,107,1252,2015-08-15,TECH,0.02125139720737934,0.9261259436607361,0.05262267217040062
technology,"The National Security Agency’s ability to spy on vast quantities of Internet traffic passing through the United States has relied on its extraordinary, decades-long partnership with a single company: the telecom giant AT&amp;T",,14,777,2015-08-15,TECH,0.009288614615797997,0.7932413220405579,0.1974700391292572
technology,AT&amp;T Helped N.S.A. Spy on an Array of Internet Traffic,,16,389,2015-08-15,TECH,0.0776977390050888,0.876179039478302,0.046123210340738297
technology,"Legal scholars warn against 10 year prison for online pirates - The proposed extension is disproportionate, ineffective and puts casual file-sharers at risk of long jail sentences, they argue.",,84,339,2015-08-15,TECH,0.5285923480987549,0.43157756328582764,0.039830081164836884
technology,8chan-hosted content disappears from Google searches,,117,244,2015-08-15,TECH,0.05382426083087921,0.92479008436203,0.021385619416832924
gadgets,Samsung Officially Announces SM-G9198 Clamshell Smartphone,,116,224,2015-08-15,TECH,0.03457428142428398,0.926706075668335,0.03871968016028404
technology,Kaspersky Antivirus Made Fake Malware for More Than 10 Years – Ex-employees,,34,145,2015-08-15,TECH,0.04607526585459709,0.9073156714439392,0.046609099954366684
technology,AT&amp;T helped U.S. NSA in spying on Internet traffic: N.Y. Times,,5,141,2015-08-15,TECH,0.044119998812675476,0.9173915386199951,0.03848845884203911
technology,A Trail of Evidence Leading to AT&amp;T’s Partnership with the NSA,,769,7604,2015-08-16,TECH,0.015261455439031124,0.8791378140449524,0.1056007370352745
gadgets,Nerf's New 70 MPH Guns,,787,4249,2015-08-16,TECH,0.02169829048216343,0.7900317311286926,0.18827004730701447
technology,New Documents and Reports Confirm AT&amp;T and NSA’s Longstanding Surveillance Partnership,,70,2443,2015-08-16,TECH,0.030299939215183258,0.927180290222168,0.04251980409026146
technology,Dept. To Equip Patrol Cars With Cannons That Shoot GPS Projectiles,,192,777,2015-08-16,TECH,0.03557141497731209,0.9207655787467957,0.043662991374731064
technology,GamerGate Event Evacuated After Multiple Bomb Threats - Forbes,,507,628,2015-08-16,TECH,0.1904764622449875,0.7298007011413574,0.0797228291630745
technology,Android Won't Catch A Break Until Google Fixes The Update System,,60,446,2015-08-16,TECH,0.19899298250675201,0.772610604763031,0.02839643321931362
technology,AT&amp;T’s “Extreme Willingness to Help” is key to NSA Internet surveillance,,6,180,2015-08-16,TECH,0.012965059839189053,0.8297515511512756,0.15728338062763214
gadgets,Force iPhone to show numerical value for signal strength - You can trade the five dots that indicate your iPhone's signal strength for a number. No jailbreak required.,,22,172,2015-08-16,TECH,0.03011449985206127,0.9074464440345764,0.062439098954200745
technology,OS X 10.10.4/5 zero day vulnerability: Privilege escalation to root,,8,146,2015-08-16,TECH,0.020936602726578712,0.9157838821411133,0.06327953934669495
technology,Tennessee Teen Uses Siri to Save His Life After Being Pinned by Truck,,19,133,2015-08-16,TECH,0.033290836960077286,0.903542697429657,0.06316650658845901
technology,Comcast admits its 300GB data cap serves no technical purpose,,2023,7941,2015-08-17,TECH,0.16155783832073212,0.8201090097427368,0.01833318918943405
technology,"Amazon CEO Jeff Bezos responds to brutal New York Times story: ""The article claims that our intentional approach is to create a soulless, dystopian workplace where no fun is had and no laughter heard. Again, I don’t recognize this Amazon and I very much hope you don’t, either.""",,3620,6544,2015-08-17,TECH,0.04641973227262497,0.9049070477485657,0.04867316037416458
technology,"Comcast Admits Broadband Usage Caps Are A Cash Grab, Not An Engineering Necessity | Techdirt",,92,2465,2015-08-17,TECH,0.056718748062849045,0.8953418135643005,0.04793936759233475
technology,"The farmer so sick of poor internet signal he built DIY mast...And now it's giving him superfast broadband. He said ""We only had a 1 Mbps [megabits per second] speed, which means everything is far too slow. Now I run at 69 Mbps""",,241,1871,2015-08-17,TECH,0.019115112721920013,0.8837769031524658,0.09710795432329178
technology,"Donald Trump calls out Mark Zuckerberg on immigration - Zuckerberg is one of the leading tech executives who has called for a more open immigration policy. Specifically, he wants to make more H-1B visas available to tech employers so they can hire foreign skilled workers.",,462,1101,2015-08-17,TECH,0.042781878262758255,0.8804041743278503,0.07681392878293991
gadgets,You can roll up this screen like a yoga mat,,131,881,2015-08-17,TECH,0.02182469330728054,0.9352657198905945,0.04290959984064102
technology,Minimum-wage offensive could speed arrival of robot-powered restaurants,,379,468,2015-08-17,TECH,0.018535209819674492,0.8634003400802612,0.11806442588567734
technology,AT&amp;T's Long History Of Fraudulent And Abusive Behavior Apparently Of No Concern To The NSA,,6,387,2015-08-17,TECH,0.5284913182258606,0.4401349425315857,0.03137368708848953
technology,Microsoft 10 can disable your pirated games and illegal hardware,,194,339,2015-08-17,TECH,0.38515785336494446,0.5953027009963989,0.019539501518011093
technology,Virginia Finally Drops America's 'Worst Voting Machines',,16,291,2015-08-17,TECH,0.49440324306488037,0.339219868183136,0.16637687385082245
technology,The Ashley Madison Hackers Just Released All of Their Stolen Data,,4201,7586,2015-08-18,TECH,0.48915231227874756,0.4779823422431946,0.03286539390683174
technology,Samsung to Release 16TB SSD Next Year,,1348,6590,2015-08-18,TECH,0.02857714146375656,0.9393243789672852,0.03209846839308739
technology,"FCC To Dish: No, You Are Not A Small Business, You May Not Use Small Business Discounts",,453,6586,2015-08-18,TECH,0.024427907541394234,0.9471556544303894,0.028416402637958527
technology,"The beginning of the end for pay TV bundles: Following the news that ESPN is losing subscribers, eight U.S. media companies lost a combined $46.2 billion in market capitalization in one day.",,1680,6171,2015-08-18,TECH,0.8809223771095276,0.10486388206481934,0.014213779009878635
gadgets,IBM scientists have developed a brain inspired computer chip which mimics the neurons inside your brain - The chip consumes just 70 milliwatts of power and can perform 46 billion synaptic operations per second,,481,4363,2015-08-18,TECH,0.023510968312621117,0.9161860942840576,0.06030294671654701
technology,Forgetful scientists accidentally quadruple lithium-ion battery lifespan,,261,2497,2015-08-18,TECH,0.04908609017729759,0.9118784666061401,0.039035458117723465
technology,"Company pays FCC $750,000 for blocking Wi-Fi hotspots at conventions | Ars Technica",,185,2291,2015-08-18,TECH,0.023220621049404144,0.9396906495094299,0.03708873689174652
technology,Apple just lost a key fight in its patent war against Samsung,,349,2118,2015-08-18,TECH,0.307807594537735,0.49884918332099915,0.1933431327342987
technology,TPP's Copyright Term Extension Isn't Made for Artists—It's Made By and For Big Content Companies,,50,749,2015-08-18,TECH,0.023934269323945045,0.9406715631484985,0.03539412096142769
technology,This guy is desperately trying to save a whole basement of unique manuals from being destroyed TOMORROW and needs our help!,,42,645,2015-08-18,TECH,0.07247543334960938,0.8848949670791626,0.042629558593034744
technology,"New York Times: ""If blocking becomes widespread, the ad industry will be pushed to produce ads that are simpler, less invasive, and are far more transparent about the way they’re handling our data — or risk getting blocked forever if they fail.""",,2081,8334,2015-08-19,TECH,0.2485966980457306,0.7244190573692322,0.026984287425875664
technology,"Ashley Madison made millions from $19 'full delete' option, which may not actually have deleted anything",,1599,8084,2015-08-19,TECH,0.0649181455373764,0.8986622095108032,0.036419689655303955
gadgets,Here's The Box That Can Turn a Puny Laptop Into a Graphical Powerhouse,,323,2106,2015-08-19,TECH,0.029924729838967323,0.9115725755691528,0.05850275978446007
technology,"The End of the Internet Dream. In 20 years, the Web might complete its shift from liberator to oppressor. It’s up to us to prevent that.",,138,1450,2015-08-19,TECH,0.02435442991554737,0.9104703068733215,0.06517524272203445
technology,Kim Dotcom's Music Streaming Service Has Finally Been Released... selling points of the service is the fact that it allows independent artists to keep as much as 90 percent of proceeds,,39,1019,2015-08-19,TECH,0.011242058128118515,0.8307797908782959,0.1579780876636505
gadgets,Google's new OnHub is a $200 Wi-Fi router and smart home hub,,203,445,2015-08-19,TECH,0.01709018275141716,0.9066142439842224,0.07629556953907013
technology,"You CAN'T jail online pirates for 10 years, legal eagles tell UK govt",,31,363,2015-08-19,TECH,0.1505597084760666,0.8183267116546631,0.031113602221012115
gadgets,Clever cameras in Japan will now detect drunken railway passengers,,54,358,2015-08-19,TECH,0.1494339257478714,0.8142958283424377,0.036270204931497574
technology,FCC Fines Internet Company $750000 for Blocking Wi-Fi Hotspots at Convention ...,,22,182,2015-08-19,TECH,0.033787649124860764,0.936625599861145,0.029586736112833023
technology,Police Arrest Men For Spreading Popcorn Time Information,,24,176,2015-08-19,TECH,0.7573000192642212,0.19798831641674042,0.044711604714393616
technology,"Jeb Bush wants “a new arrangement with Silicon Valley” to ease crypto Y'know, because only ""evildoers"" want to protect their communications.",,1281,6961,2015-08-20,TECH,0.028851697221398354,0.9151298999786377,0.05601832643151283
technology,"Amazon joins in on killing Flash, stops accepting Flash ads.",,461,5850,2015-08-20,TECH,0.7357035279273987,0.24749842286109924,0.01679805852472782
technology,It begins: Movie studio sues individual 'Popcorn Time' users for infringement,,1432,5114,2015-08-20,TECH,0.015261593274772167,0.9315831065177917,0.05315522849559784
technology,Your Toner Is No Good Here: Region-Coding Ink Cartridges... For The Customers,,453,3958,2015-08-20,TECH,0.020837055519223213,0.9316115975379944,0.04755139723420143
technology,So Elon Musk’s Hyperloop Is Actually Getting Kinda Serious,,467,3049,2015-08-20,TECH,0.09423144906759262,0.4870106875896454,0.41875791549682617
technology,Spotify updates its T's and C's to allow access to your personal information,,424,2811,2015-08-20,TECH,0.031898561865091324,0.942993700504303,0.025107670575380325
technology,"Work Hard, Live Well | The research is clear: beyond ~40–50 hours per week, the marginal returns from additional work decrease rapidly and quickly become negative.",,284,2524,2015-08-20,TECH,0.7338587045669556,0.23644289374351501,0.029698509722948074
technology,Jeb Bush Comes Out Against Encryption,,313,2044,2015-08-20,TECH,0.03357413783669472,0.8228886127471924,0.143537238240242
technology,How Google Could Rig the 2016 Election - Google’s search algorithm can easily shift the voting preferences of undecided voters by 20 percent or more—up to 80 percent in some demographic groups—with virtually no one knowing they are being manipulated.,,146,2034,2015-08-20,TECH,0.012287246063351631,0.7963932156562805,0.1913195550441742
technology,Windows 10 Chewing Through Broadband Usage Caps,,415,1515,2015-08-20,TECH,0.018074773252010345,0.8683897852897644,0.11353547126054764
technology,Spotify: SORRY. We are in the middle of rolling out new terms and conditions and privacy policy and they’ve caused a lot of confusion about what kind of information we access and what we do with it. We apologize for that.,,1508,5804,2015-08-21,TECH,0.8824648261070251,0.10072332620620728,0.01681194081902504
gadgets,The 16TB Samsung hard drive is just a hint of what's coming next for flash storage,,951,3792,2015-08-21,TECH,0.029740825295448303,0.927332878112793,0.04292631521821022
technology,Google ordered to remove links to stories about Google removing links to stories,,202,3649,2015-08-21,TECH,0.6407010555267334,0.34392550587654114,0.015373400412499905
technology,Comcast Cable Communications has given a local politician the identity of an Internet service subscriber whose account was used to post an anonymous comment online suggesting the politician molests children.,,96,1034,2015-08-21,TECH,0.05198746919631958,0.9246408343315125,0.02337164804339409
technology,Google's smart contact lenses just went from concept to reality,,64,940,2015-08-21,TECH,0.6609883308410645,0.26200270652770996,0.07700902223587036
technology,"This 3D-Printed Stethoscope Head Costs $5, Outperforms $200 Competitors",,73,637,2015-08-21,TECH,0.0763556957244873,0.8889310956001282,0.034713201224803925
technology,"Clean coal is an oxymoron. The owner of the first U.S. ""clean coal"" power plant has not been able to get it going and is on the brink of bankruptcy.",,19,234,2015-08-21,TECH,0.010881919413805008,0.47445160150527954,0.5146664977073669
technology,Spotify's new privacy policy angers users,,20,132,2015-08-21,TECH,0.014195713214576244,0.8981350064277649,0.08766930550336838
technology,"Thanks to the influence of companies like Apple and Tesla, traditional car dealerships are being killed off",,57,124,2015-08-21,TECH,0.010047775693237782,0.71749347448349,0.2724587619304657
technews,Firefox will now Run Chrome Extensions,,4,91,2015-08-21,TECH,0.03065510466694832,0.9313786625862122,0.0379662849009037
technology,SOPA is back,,781,7447,2015-08-22,TECH,0.03914712369441986,0.8853975534439087,0.07545535266399384
technology,Astronauts report LED lighting is making light pollution worse,,1502,5872,2015-08-22,TECH,0.750920295715332,0.2276528924703598,0.02142683044075966
technology,Amazon employee who wrote a rebuttal to The New York Times worked 100-hour weeks at a different tech company,,733,4564,2015-08-22,TECH,0.049031812697649,0.9185998439788818,0.03236827999353409
technology,Torrent Trackers Ban Windows 10 Over Privacy Concerns,,614,3835,2015-08-22,TECH,0.14513809978961945,0.819392740726471,0.03546909615397453
technology,"Reddit is Now ‘Quarantining’ Their Edgier Communities: r/gore , r/picsofdeadkids , /r/spacedicks and many others...",,1762,3537,2015-08-22,TECH,0.05132589489221573,0.9115831851959229,0.037090983241796494
technology,"Intel has open sourced Stephen Hawking's Speech Program, you can try it for yourself.",,136,3294,2015-08-22,TECH,0.025197163224220276,0.9356011152267456,0.0392017737030983
gadgets,"Circular ""bullseye"" laser that helps you drill straight",,162,1247,2015-08-22,TECH,0.020752938464283943,0.887026309967041,0.09222076833248138
technology,"Mozilla sets plan to dump Firefox add-ons, move to Chrome-like extensions",,155,1109,2015-08-22,TECH,0.028256166726350784,0.9179147481918335,0.05382909998297691
gadgets,Asus has launched a new premium ZenPad S 8.0 tablet with 8-inch screen and 4 GB of RAM,,252,899,2015-08-22,TECH,0.009700140915811062,0.795976459980011,0.19432339072227478
technology,Kaspersky Antivirus accused of creating fake malware for over 10 years,,54,506,2015-08-22,TECH,0.13654816150665283,0.8350549340248108,0.028396887704730034
technology,The real issue Amazon’s work culture raises — for blue- and white-collar employees alike — is: How disposable are people?,,2419,6355,2015-08-23,TECH,0.03837021440267563,0.9184324145317078,0.0431973971426487
gadgets,ASUS makes a Zenfone 2 with a massive 256GB of storage and a unique back,,398,1520,2015-08-23,TECH,0.017743181437253952,0.8929623365402222,0.08929450809955597
technology,Underground Piracy Sites Want To Block Windows 10 Users,,184,739,2015-08-23,TECH,0.6656215190887451,0.3189008831977844,0.015477675944566727
technology,Second Ashley Madison dump prompts more inside-job speculation,,32,466,2015-08-23,TECH,0.040232956409454346,0.9265314340591431,0.03323562815785408
technology,British firm invents hydrogen-powered phone battery that could keep your mobile charged for a week.,,40,265,2015-08-23,TECH,0.01142252516001463,0.8046321272850037,0.18394528329372406
technology,"Turns out, Windows 7/8/8.1 has updates, which allows microsoft to spy on you just like in Windows 10.",,41,239,2015-08-23,TECH,0.012777864001691341,0.7447517514228821,0.24247044324874878
technology,"New Zealand passes law making it punishable by fine or jail time for ""causing emotional distress"" on the Internet",,144,206,2015-08-23,TECH,0.19123238325119019,0.7184041738510132,0.09036343544721603
technology,Phone and laptop encryption guide: Protect your stuff and yourself,,29,202,2015-08-23,TECH,0.02146047353744507,0.912686824798584,0.06585272401571274
technology,Senior Russian lawmaker seeks ban on Windows 10 in state agencies,,13,191,2015-08-23,TECH,0.8455415368080139,0.12308571487665176,0.031372781842947006
technology,What we learnt from Amazon: the workplace of 2016 could echo Orwell’s 1984.,,33,167,2015-08-23,TECH,0.04366360604763031,0.8944728374481201,0.061863552778959274
technology,Twitter shuts down 30 sites dedicated to saving politicians' deleted tweets,,981,8443,2015-08-24,TECH,0.1383289098739624,0.8362549543380737,0.025416122749447823
technology,Elon Musk's Hyperloop - the futuristic transportation system that’s faster than an airplane to start construction in 2016,,747,3917,2015-08-24,TECH,0.013959982432425022,0.8933532238006592,0.09268676489591599
technology,"Google Lobbied Against Real Net Neutrality In India, Just Like It Did In The States",,241,3370,2015-08-24,TECH,0.011602598242461681,0.7609434723854065,0.22745397686958313
gadgets,"The Dash button: good design for Amazon, bad for everyone else",,766,2408,2015-08-24,TECH,0.1625678986310959,0.7987001538276672,0.038731981068849564
technology,"Uber isn’t happy with its competitors in China. The U.S. ride-sharing goliath has “spoken out for the first time” about being blocked on WeChat, China’s hugely popular mobile messaging platform which is run by Tencent, an investor in Uber rival Didi Kuaidi.",,163,1137,2015-08-24,TECH,0.019354624673724174,0.8556907176971436,0.12495468556880951
technology,Windows 10 users banned from torrenting by piracy sites because of worries that Microsoft spies on downloads,,170,606,2015-08-24,TECH,0.7578266859054565,0.22520095109939575,0.016972359269857407
technology,Carl Malamud Asks YouTube To Institute Three Strikes Policy For Those Who Abuse Takedowns,,42,511,2015-08-24,TECH,0.10344140231609344,0.860115647315979,0.03644295036792755
technology,"Verizon customer gets $1,500 refund after 5 years of phantom phone charges. Verizon charged for long-dead landline, offered no refund until media stepped in.",,18,492,2015-08-24,TECH,0.024610217660665512,0.9264206290245056,0.04896918684244156
technology,Twitter's Excuse For Shutting Down Services That Highlight Deleted Politicians' Tweets Is Painfully Ridiculous,,33,394,2015-08-24,TECH,0.18950924277305603,0.7925161719322205,0.01797456108033657
technology,"""Patents are protected by governments because they are held to promote innovation. But there is plenty of evidence that they do not.""",,46,299,2015-08-24,TECH,0.14028380811214447,0.6286713480949402,0.23104481399059296
technology,"Flash is dying a death by 1,000 cuts, and that's a good thing - The end of Adobe’s video carrier is nigh as Amazon marks the first of the big-name advertisers to block Flash ads, while Google’s Chrome will ‘intelligently pause’ them",,860,6047,2015-08-25,TECH,0.016793014481663704,0.9161466360092163,0.06706032902002335
technology,Mozilla CEO threatens to fire person responsible for anonymous hate speech on Reddit,,771,1788,2015-08-25,TECH,0.7786837220191956,0.2063632607460022,0.014953020960092545
technology,"Linux Turns 24, Happy Birthday!",,72,771,2015-08-25,TECH,0.04916006326675415,0.8385442495346069,0.1122957095503807
technology,Microsoft Prototypes A Keyboard Cover With E-Ink Display,,101,674,2015-08-25,TECH,0.02074127458035946,0.9343521595001221,0.04490663483738899
technology,iOS 9 content blocking will transform the mobile Web: I’ve tried it,,130,416,2015-08-25,TECH,0.02656094916164875,0.934197187423706,0.03924182802438736
gadgets,"Olympus' latest mirrorless camera is all digital, but looks like a film camera",,100,324,2015-08-25,TECH,0.03294363245368004,0.9352585673332214,0.0317978635430336
technology,AT&amp;T Injecting Ads Into Its Wi-Fi Hotspot Data Streams,,31,324,2015-08-25,TECH,0.04438243433833122,0.9310208559036255,0.024596672505140305
gadgets,Microsoft Prototypes A Keyboard Cover With E-Ink Display,,18,208,2015-08-25,TECH,0.02074127458035946,0.9343521595001221,0.04490663483738899
technology,Github under DDOS attack again,,11,185,2015-08-25,TECH,0.059839215129613876,0.9150485396385193,0.025112183764576912
gadgets,Major technological advancement yields a 3D printer that creates objects out of more than one material at a time,,19,173,2015-08-25,TECH,0.012290256097912788,0.9119887351989746,0.07572105526924133
technology,"Apple loses ""Slide to Unlock"" patent in a lawcase at the German Supreme Court",,1643,8178,2015-08-26,TECH,0.5546128153800964,0.3974803686141968,0.04790676757693291
technology,"The Austrian branch of T-Mobile is refusing to block access to The Pirate Bay and several other popular torrent sites. T-Mobile was asked to do so by a local music rights group, who want the ISP to voluntarily follow a court order that was issued against rival Internet provider A1.",,903,6537,2015-08-26,TECH,0.17638133466243744,0.7502957582473755,0.07332297414541245
technology,"Police in North Dakota are now authorized to use drones armed with tasers, tear gas, rubber bullets, and other ""non-lethal"" weapons, following the passage of Bill 1328",,841,5468,2015-08-26,TECH,0.022480614483356476,0.8984959721565247,0.07902348786592484
technology,Irony: NSA worried hackers with super computers might break current encryption standards,,156,2421,2015-08-26,TECH,0.9150564670562744,0.06572280824184418,0.019220663234591484
technology,Angry Birds maker Rovio sacks almost half of staff after it 'did too many things',,285,2079,2015-08-26,TECH,0.20288734138011932,0.7615001797676086,0.0356125608086586
