subreddit,title,selftext,num_comments,score,created_utc,stock/sector,neg,neu,pos
technology,US spy court didn't reject a single government surveillance request in 2015,,461,6179,2016-05-01,TECH,0.15440917015075684,0.7818384766578674,0.06375232338905334
technology,Tor and VPN users will be target of government hacks under new spying rule,,713,5489,2016-05-01,TECH,0.1180925965309143,0.8555688858032227,0.026338577270507812
technology,"Snowden: Without encryption, everything stops",,587,4720,2016-05-01,TECH,0.06111348792910576,0.9051553606987,0.033731184899806976
technology,Yahoo's Marissa Mayer gets $55M to leave,,570,2607,2016-05-01,TECH,0.04706524312496185,0.8783326148986816,0.0746021643280983
technology,Man jailed for failing to decrypt hard drives,,404,1966,2016-05-01,TECH,0.09181346744298935,0.8696673512458801,0.03851909562945366
gadgets,Stanford team made a humanoid robot that can stand in for a real diver,,88,1689,2016-05-01,TECH,0.02463122084736824,0.9170265793800354,0.05834216624498367
technology,TTIP Documents Revealed,,21,985,2016-05-01,TECH,0.10169186443090439,0.8809718489646912,0.017336253076791763
technology,Microsoft's heavy-handed Windows 10 tactics may be its undoing,,481,936,2016-05-01,TECH,0.44368842244148254,0.5178905725479126,0.038420990109443665
technology,"If You Use Tor Browser, The FBI Just Labeled You A Criminal",,70,839,2016-05-01,TECH,0.36858367919921875,0.6084901690483093,0.022926129400730133
technology,"Pirate Bay Gets a 'Massive' $9 in Donations, Per Day",,46,453,2016-05-01,TECH,0.014130940660834312,0.8037103414535522,0.1821586936712265
technology,76% of Netflix Subscribers Think Netflix Can Replace Traditional TV,,2096,7417,2016-05-02,TECH,0.01880800910294056,0.8823316097259521,0.09886042028665543
technology,Greenpeace leaks big part of secret TTIP documents,,1108,6546,2016-05-02,TECH,0.030150750651955605,0.934744119644165,0.035105109214782715
gadgets,First official video of Franky Zapata's turbojet-powered hoverboard world-record flight.,"On April 30th, Franky Zapata smashed the hoverboard world record, flying 2200m on his prototype Flyboard air. It's got four turbojets and runs off a backpack full of kerosene. It weighs 45 pounds, has a max flight duration of 10 minutes, and can cruise at 60 mph.

Video: https://www.youtube.com/watch?v=hsn-qWB4Ey4

Interview: https://www.youtube.com/watch?v=HOJsKpZlSTU",398,1707,2016-05-02,TECH,0.023441582918167114,0.9214041233062744,0.05515424907207489
technology,Chrome Overtakes Internet Explorer For Most Popular Desktop Browser,,207,1431,2016-05-02,TECH,0.018976382911205292,0.9078584313392639,0.07316522300243378
gadgets,Graphene e-paper is brighter and bendier,,82,609,2016-05-02,TECH,0.03649900108575821,0.9229762554168701,0.040524739772081375
technology,"Vacationing Couple Discover, Remove, and Reverse Engineer an ATM Skimmer. Best article on skimmers I've seen.",,24,374,2016-05-02,TECH,0.02313365787267685,0.8842793107032776,0.09258700162172318
technology,The price of solar power just fell 50% in 16 months – Dubai at $.0299/kWh!,,34,322,2016-05-02,TECH,0.8732472062110901,0.10644630342721939,0.02030649036169052
technology,"Self-driving features could lead to more sex in moving cars, expert warns",,127,305,2016-05-02,TECH,0.0207936093211174,0.880750834941864,0.09845557808876038
technology,Feinstein-Burr: The Bill That Bans Your Browser,,43,301,2016-05-02,TECH,0.031029628589749336,0.922432541847229,0.04653787240386009
technology,US Senator calls for investigation into hundreds of thousands of billboards that track consumer cell phone location data,,15,140,2016-05-02,TECH,0.04944448545575142,0.9259867072105408,0.024568762630224228
technology,NSA and CIA Double Their Warrantless Searches on Americans in Two Years,,675,5663,2016-05-03,TECH,0.34048447012901306,0.6313568353652954,0.028158672153949738
technology,Edward Snowden: ‘Governments can reduce our dignity to that of tagged animals’,,1615,5397,2016-05-03,TECH,0.2495984137058258,0.6913752555847168,0.059026334434747696
gadgets,"When Your Internet Goes Out, This Smart Plug Resets Your Router Until It Works Again",,1135,4986,2016-05-03,TECH,0.022283295169472694,0.9342253804206848,0.04349127039313316
technology,Snowden: Whistleblowing Is Not Just Leaking — It’s an Act of Political Resistance,,65,1956,2016-05-03,TECH,0.10657713562250137,0.8536829352378845,0.03973984718322754
technology,"Uber Plans To Kill Surge Pricing, Though Drivers Say It Makes Job Worth It",,606,1955,2016-05-03,TECH,0.0671149492263794,0.6397899389266968,0.29309511184692383
technology,McLaren needs a 20-year-old Compaq laptop to maintain its F1 supercar,,142,1330,2016-05-03,TECH,0.023388739675283432,0.8846293091773987,0.0919819325208664
technology,Scientists have finally discovered the fifth and final protein which was attacked by the immune system to cause type 1 diabetes. It was elusive for over two decades. This discovery will help stalling the type 1 diabetes.,,11,715,2016-05-03,TECH,0.032126691192388535,0.5584895014762878,0.4093838036060333
technology,"The Supreme Court on Thursday approved changes that would make it easier for the FBI to hack into computers, including those belonging to victims of cybercrime. The changes will take effect in December, unless Congress adopts competing legislation.",,27,661,2016-05-03,TECH,0.08138056099414825,0.8870190978050232,0.03160032257437706
gadgets,Leica's M-D is a digital camera for manual purists,,245,537,2016-05-03,TECH,0.02522275224328041,0.9225387573242188,0.05223846435546875
technology,Google Chrome Dethrones Internet Explorer To Become Most Popular Browser,,109,418,2016-05-03,TECH,0.019500019028782845,0.8824876546859741,0.09801236540079117
technology,65% of Netflix’s Subscribers Disapprove of Its VPN Ban,[deleted],1680,6104,2016-05-04,TECH,0.02938355691730976,0.929151177406311,0.04146525636315346
technology,"Russian hacker tries selling 272 million stolen Gmail, Hotmail, and other accounts for $1",,638,5288,2016-05-04,TECH,0.42053791880607605,0.55138099193573,0.028081033378839493
technology,Japan now officially has more Electric Charging stations than Gas Stations,,282,4757,2016-05-04,TECH,0.025562524795532227,0.9357832670211792,0.03865420073270798
technology,Medical Equipment Crashes During Heart Procedure Because of Antivirus Scan,,319,2495,2016-05-04,TECH,0.051168859004974365,0.9239640831947327,0.024867039173841476
technology,Brazil Has To Pause Adoption Of Broadband Usage Caps After Consumers Revolt,,74,2080,2016-05-04,TECH,0.07056836783885956,0.781121015548706,0.1483105719089508
gadgets,Biotech firm wants to deliver organs using a passenger drone,,213,1982,2016-05-04,TECH,0.012868824414908886,0.8824443817138672,0.10468685626983643
technology,Windows 10 updates are now ruining pro-gaming streams,,635,1714,2016-05-04,TECH,0.021815983578562737,0.882000207901001,0.09618376940488815
technology,Comcast is falsely inflating data usage.,"So we kept going over our data cap every month so I setup a traffic monitor on my router to ID the cause. Low and behold we only used 406.50 gigs last month when Comcast said we used 574 gigs. I called them to fix the issue and they refused saying they tested the meter and it was fine. Just to reassure you all, all traffic flows through the router and it is not possible for it to go through the modem. SO a traffic monitor on the router should show EVERYTHING I am using. Even though I had PROOF they still wouldn't do anything. Everyone needs to monitor their data usage and report it to BBB and the FTC. I wouldn't be shocked if they are doing this to everyone.

Proof: http://imgur.com/a/6ZdUw


UPDATE: Comcast called and is randomly reopening the case to look further. Additionally they clarified that they do NOT count dropped packets so there goes that theory. They also didn't want to give me a detail log of what I was using because they weren't sure they could share that information. Which could be more scary than being overcharged. Just a remind to LOG YOUR DATA USAGE YOURSELF! If they aren't overcharging you, good! However, you need to be aware if they are.",225,1314,2016-05-04,TECH,0.03664735332131386,0.9300411939620972,0.0333113968372345
technology,"WhatsApp banned for 3 days in Brazil as punishment for not releasing data it doesn't have anyway; will face daily fine of US$143,000.00 until it complies.",,102,1186,2016-05-04,TECH,0.13409753143787384,0.8410345315933228,0.024867892265319824
technology,"Romanian hacker Guccifer: I breached Clinton server, 'it was easy'",,76,1135,2016-05-04,TECH,0.07897667586803436,0.8888075947761536,0.03221569210290909
technology,"Prison telecoms are replacing in-person jail visits with a glitchy, expensive system called ""video visitation"" in an attempt to end in-person visitation entirely and rake in cash via monopolistic contracts",,1225,7019,2016-05-05,TECH,0.04556398093700409,0.9321076273918152,0.022328361868858337
technology,Cupertino's mayor: Apple 'abuses us' by not paying taxes. Barry Chang is stuck between Apple on one side not paying for his infrastructure proposal and frustrated citizens on the other who see their roads too crowded.,,1611,5455,2016-05-05,TECH,0.6652229428291321,0.28827497363090515,0.04650205746293068
technology,"Apple stole my music. No, seriously",,1800,4841,2016-05-05,TECH,0.14707547426223755,0.8252715468406677,0.027652962133288383
gadgets,Microsoft's hover gestures for Windows phones are magnificent,,778,2881,2016-05-05,TECH,0.019120173528790474,0.930388331413269,0.05049153417348862
technology,"FBI Harassing Core Tor Developer, Demanding She Meet With Them, But Refusing To Explain Why",,147,1552,2016-05-05,TECH,0.5453407764434814,0.42385587096214294,0.030803313478827477
technology,Cops deploy StingRay anti-terror tech against $50 chicken-wing thief,,133,1525,2016-05-05,TECH,0.04963601008057594,0.9131632447242737,0.037200722843408585
technology,"Watch out, a new round of forced upgrades begins: Microsoft re-enables KB3035583 on Windows 7 to force Windows 10 upgrade",,334,821,2016-05-05,TECH,0.015386226586997509,0.7863362431526184,0.19827759265899658
technology,Zynga Now Worth Less Than Its Own Office Building,,89,564,2016-05-05,TECH,0.0697869062423706,0.8591727614402771,0.07104036211967468
technology,"Apple Stole My Music. No, Seriously.",,145,519,2016-05-05,TECH,0.14707547426223755,0.8252715468406677,0.027652962133288383
technology,Microsoft has retroactively removed the ability of companies to turn off access to the Windows Store in its Windows 10 Pro version,,107,445,2016-05-05,TECH,0.13025173544883728,0.8341728448867798,0.03557547181844711
technology,San Diego to run 100 percent on renewable energy by 2035. The city also plans to cut greenhouse gas emissions by 50 percent.,,764,5303,2016-05-06,TECH,0.010894021019339561,0.7212006449699402,0.2679052948951721
technology,SpaceX successfully lands its Falcon 9 rocket on a floating drone ship again,,209,3754,2016-05-06,TECH,0.01588979922235012,0.4622223377227783,0.5218878984451294
technology,New study: no increase in brain cancer across 29 years of mobile use in Australia,,179,2787,2016-05-06,TECH,0.01045577134937048,0.6067233681678772,0.38282090425491333
technology,Microsoft cripples Windows 7 UEFI installs on ASUS motherboards with latest KB update,,262,1897,2016-05-06,TECH,0.038507312536239624,0.9274766445159912,0.034016016870737076
gadgets,New tech turns your skin into a touchscreen for your smartwatch,,211,1798,2016-05-06,TECH,0.017541663721203804,0.9144598245620728,0.06799846887588501
technology,Elon Musk sleeps at Tesla's factory 'quite frequently' to hit lofty production targets,,237,1694,2016-05-06,TECH,0.039989933371543884,0.8853561878204346,0.07465393096208572
technology,US Senate website doesn't want you to use HTTPS,,110,1342,2016-05-06,TECH,0.09447368234395981,0.888750433921814,0.01677589863538742
technology,Microsoft will kill 'Get Windows 10' nagware in July,,314,1181,2016-05-06,TECH,0.012040975503623486,0.8246877193450928,0.16327132284641266
gadgets,Backers of cancelled e-ink watch won't get their money back,,327,1043,2016-05-06,TECH,0.3157837390899658,0.6488654613494873,0.035350777208805084
technology,How Google’s quietly building a Life Manager with their app ecosystem,,38,866,2016-05-06,TECH,0.0106310760602355,0.8747813105583191,0.11458755284547806
technology,Can a company stop you from writing a negative online review? Not if Congress passes this bill,,719,5841,2016-05-07,TECH,0.1726130098104477,0.7866969704627991,0.04069005325436592
technology,Apple Stock Hits Near Two Year Low Amid Falling Sales And Credibility,,2546,5544,2016-05-07,TECH,0.95627760887146,0.03001406043767929,0.01370831485837698
gadgets,"NVIDIA's GTX 1080 GPU is faster than Titan X, lands May 27",,1860,4460,2016-05-07,TECH,0.03129006549715996,0.9247546792030334,0.043955281376838684
technology,Tor developer Isis Agora Lovecruft publicly accuses the FBI of harassment,,154,2091,2016-05-07,TECH,0.0975307747721672,0.8724486827850342,0.03002053312957287
technology,"Piracy site for academic journals playing game of domain-name Whac-A-Mole: Just like The Pirate Bay, Sci-Hub is domain hopping to beat takedown court orders.",,61,1047,2016-05-07,TECH,0.10615818202495575,0.8717801570892334,0.022061653435230255
technology,"Nvidia launches Pascal-based consumer PC graphics chips, 360-degree photo art, and 3D audio for VR",,107,774,2016-05-07,TECH,0.026067528873682022,0.9278337359428406,0.04609866812825203
technology,"Chrome, Firefox And Safari Block Pirate Bay As “Phishing” Site",,74,753,2016-05-07,TECH,0.029547225683927536,0.9405125379562378,0.029940204694867134
technology,Jeff Bezos just made a whopping $671 million in his biggest Amazon stock sale ever,,52,563,2016-05-07,TECH,0.017778806388378143,0.8777018189430237,0.10451939702033997
technology,Nvidia’s GTX 1080 and GTX 1070 revealed: Faster than Titan X at half the price,,97,404,2016-05-07,TECH,0.017672846093773842,0.9002004861831665,0.08212665468454361
technology,"Once upon a time, there was a difference between on and off. Now, it’s more complicated: Roughly 50 devices and appliances in the typical American household are always drawing power, even when they appear to be off.",,59,386,2016-05-07,TECH,0.024370266124606133,0.9259020686149597,0.0497276708483696
technology,Mod Announcement: We're considering banning all domains that require users to disable ad blockers and we'd like your input,"It has come to our attention that many websites such as Forbes and Wired are now requiring users to disable ad blockers to view content. Because Forbes requires users to do this and has then served malware to them we see this as a security risk to you our community. There are also sites such as Wall Street Journal that have implemented pay-walls which we were are also considering banning. 

We would like all of your thoughts on whether or not we should allow domains such as Forbes here on /r/technology while they continue to resort to such  practices. 

Thank you for the input.",3571,11002,2016-05-08,TECH,0.04773329198360443,0.926389217376709,0.025877516716718674
technology,"Pirate Bay termed as deceptive site by Google Chrome, blocked by Firefox and Safari as well",,1399,5384,2016-05-08,TECH,0.0527602955698967,0.9211386442184448,0.02610105276107788
gadgets,Nintendo NX may use game cardridgets,,1127,2506,2016-05-08,TECH,0.016882367432117462,0.9489099979400635,0.034207653254270554
technology,Babies now have legal grounds to sue parents for posting pictures of them on Facebook,,200,1083,2016-05-08,TECH,0.5738884806632996,0.40639448165893555,0.019717000424861908
technology,Spectacular Tesla Model S crash after flying 82+ft in the air shows importance of a large crumple zone,,197,616,2016-05-08,TECH,0.020319031551480293,0.9071431159973145,0.0725378692150116
technology,"Cupertino's mayor: “I was shocked and dismayed to see a recent article quoting me with words I never used and describing situations that never happened,” regarding Guardian Apple article",,17,527,2016-05-08,TECH,0.10377804934978485,0.8700360059738159,0.02618594840168953
technology,Facebook loses first round in facial recognition lawsuit,,21,168,2016-05-08,TECH,0.8417119979858398,0.13680849969387054,0.02147946134209633
technology,"Dropbox cutting a bunch of employee perks which equate to about $25,000 per year per employee",,33,149,2016-05-08,TECH,0.05364995449781418,0.9150776863098145,0.031272292137145996
technology,Microsoft half-bricks Asus Windows 7 PCs with UEFI boot glitch,,43,114,2016-05-08,TECH,0.03138100728392601,0.9168470501899719,0.05177196487784386
technology,Antivirus scan crashes heart machine in the middle of a procedure,,31,108,2016-05-08,TECH,0.0582491010427475,0.9070408940315247,0.03470997512340546
technology,"Jury is picked for $9 billion Oracle v. Google showdown. Only one juror worked with computers, and he was Oracle's first strike.",,1795,5795,2016-05-09,TECH,0.013977505266666412,0.8138468861579895,0.17217563092708588
technology,Uber and Lyft pull out of Austin after locals vote against self-regulation | Technology,,3444,5273,2016-05-09,TECH,0.021256498992443085,0.8915250301361084,0.08721844106912613
technology,"David Patraeus, Who Leaked Classified Info To His Mistress, Says Snowden Should Be Prosecuted",,379,3099,2016-05-09,TECH,0.053190622478723526,0.913711667060852,0.03309769928455353
technology,"Panama Papers are now part of a massive, searchable, online database",,46,1848,2016-05-09,TECH,0.02380364015698433,0.9455174207687378,0.03067897818982601
technology,Tesla’s inherent safety saves five joyriding teenagers in Germany,,241,1787,2016-05-09,TECH,0.028241965919733047,0.9102336764335632,0.061524298042058945
technology,"A.I. wins the Superfecta at the Kentucky Derby, turns $20 bet into $11,000",,115,1546,2016-05-09,TECH,0.02412104792892933,0.8767825365066528,0.09909646213054657
technology,European Parliament Orders MEP To Take Down A Video About His Attempt To Visit The 'Reading Room' For Trade Documents,,59,1362,2016-05-09,TECH,0.0795028880238533,0.8997330665588379,0.02076403796672821
technology,Japan is building the World’s largest floating solar power plant,,44,1267,2016-05-09,TECH,0.012205573730170727,0.7662501931190491,0.2215442955493927
technology,"Is Online Free Speech Under Attack?: ""Regulators in Washington [District of Columbia, USA] are showing increasing interest in tightening rules on political speech on the web, arguing that the dissonant voices enabled by 'new media' have become too influential.""",,70,1109,2016-05-09,TECH,0.01769220270216465,0.7997493743896484,0.18255841732025146
technology,Reddit's Technology Subreddit Ponders Banning Wired &amp; Forbes For Blocking Adblock Users | Techdirt,,70,578,2016-05-09,TECH,0.02667059190571308,0.9298169016838074,0.043512552976608276
technology,Four megabits isn’t broadband! US Senators want to redefine bandwidth cap on grants,,1398,6595,2016-05-10,TECH,0.039583779871463776,0.908643364906311,0.05177284777164459
technology,"Netflix cuts out over 6 days of commercials from your life per year, compared to cable TV",,315,3796,2016-05-10,TECH,0.6372328400611877,0.3363158106803894,0.026451291516423225
gadgets,"Indian police gets first fleet of drones, uses them to monitor illegal mining",,244,2806,2016-05-10,TECH,0.010453075170516968,0.7816335558891296,0.20791330933570862
gadgets,This $70 wireless gateway now blocks ads for anyone who connects to it,,497,2229,2016-05-10,TECH,0.3295097053050995,0.6526095271110535,0.01788070797920227
technology,Mark Zuckerberg is a hypocrite - Facebook has destroyed the open web,,174,1832,2016-05-10,TECH,0.0485362745821476,0.9283226132392883,0.02314114384353161
technology,This $70 wireless gateway now blocks ads for anyone who connects to it. The gateway plugs in to your home router and blocks potentially dangerous ads on the fly to every user connecting to it.,,141,747,2016-05-10,TECH,0.26434460282325745,0.7176803946495056,0.01797499880194664
gadgets,3D-printed wheelchair promises more comfortable rides,,55,660,2016-05-10,TECH,0.011926050297915936,0.6674925684928894,0.3205813765525818
technology,"Verizon Taking Heat For Galaxy S7 Stealth Bloatware: DT Ignite will re-install some of a device's bloatware upon reboot or factory reset, and users need to find and disable the app to stop this from happening",,82,525,2016-05-10,TECH,0.08555367588996887,0.8868488073348999,0.027597516775131226
technology,UK Judge rules cops can't subvert law on cryptography to force suspected hacktivist to decrypt files,,12,457,2016-05-10,TECH,0.10130295157432556,0.8738037943840027,0.024893300607800484
technology,Nasa releases 56 patented space and rocket technologies into public domain,,29,417,2016-05-10,TECH,0.016378190368413925,0.9443235397338867,0.039298295974731445
technology,Google bans ads for payday loans,,2782,8143,2016-05-11,TECH,0.16198793053627014,0.8164591193199158,0.021552972495555878
technology,Samsung announces a massive 256GB microSD card,,1106,5081,2016-05-11,TECH,0.03297461196780205,0.911108136177063,0.05591728910803795
technology,45000 People Ask Netflix to Stop VPN Crackdown,,367,2230,2016-05-11,TECH,0.28960278630256653,0.6728671193122864,0.037530120462179184
technology,The U.S. Senate wants Mark Zuckerberg to say whether Facebook has been manipulating the news,,266,1524,2016-05-11,TECH,0.03981838375329971,0.9321749806404114,0.02800665609538555
gadgets,Samsung Galaxy Surfboard - a smart surfboard,,353,1272,2016-05-11,TECH,0.027388520538806915,0.928942084312439,0.0436694510281086
technology,Save Firefox! | EFF,,111,742,2016-05-11,TECH,0.026521790772676468,0.9179879426956177,0.05549028143286705
technology,Germany had so much renewable energy on Sunday that it had to pay people to use electricity,,32,665,2016-05-11,TECH,0.025056593120098114,0.9271931052207947,0.04775027558207512
technology,NASA releases 56 patents into the public domain,,21,461,2016-05-11,TECH,0.0328533910214901,0.9472303986549377,0.019916243851184845
technology,Cable lobby group: Broadband competition is bad for customers,,27,325,2016-05-11,TECH,0.800460934638977,0.18310147523880005,0.016437577083706856
gadgets,The EpicGear Defiant Mechanical Gaming Keyboard Review,,81,324,2016-05-11,TECH,0.0307279322296381,0.9298748970031738,0.03939720243215561
technology,"This Isn’t a Google Streetview Car, It’s a Government Spy Truck",,1099,5952,2016-05-12,TECH,0.09825938940048218,0.8807640075683594,0.02097659558057785
technology,Pornhub is offering you up to $25K to hack its site and find flaws,,758,4948,2016-05-12,TECH,0.03517988696694374,0.9299812912940979,0.03483882173895836
technology,ISPs Now Forcing Cordcutters to Sign up For TV to Avoid Caps,,432,3622,2016-05-12,TECH,0.05388153716921806,0.9068500995635986,0.03926841542124748
gadgets,GoPro is finally shipping its massive professional VR rig,,426,3272,2016-05-12,TECH,0.009331394918262959,0.7303785681724548,0.26029011607170105
technology,Senator Rand Paul to back bill blocking FBI hacking expansion,,100,2029,2016-05-12,TECH,0.21199485659599304,0.6397606134414673,0.14824451506137848
technology,"Charter blocked customer-owned modems for two years, must pay fine",,93,1483,2016-05-12,TECH,0.23533958196640015,0.7438302636146545,0.020830221474170685
technology,"Tesla Model S driver claims his car crashed into a trailer on its own, Tesla says ‘Summon’ was activated",,478,1213,2016-05-12,TECH,0.7068343162536621,0.26884725689888,0.024318421259522438
technology,"Instagram censors searches for hundreds of hashtags, including #women, #kansas, #carving and #publicrelations",,121,553,2016-05-12,TECH,0.035735245794057846,0.9084080457687378,0.055856674909591675
technology,Drones could replace $127 billion worth of human labour,,131,429,2016-05-12,TECH,0.01631455309689045,0.8101279735565186,0.17355743050575256
technology,"Despite deal with Microsoft, US Marine Corps can't upgrade to Windows 10 because its hardware is too old for the OS. DoD chief warns that ""there will be consequences.""",,215,348,2016-05-12,TECH,0.5694068074226379,0.3388082683086395,0.09178492426872253
technology,Wendy's wants to automate stores due to $15/hr wage hike.,,9142,5864,2016-05-13,TECH,0.04971637204289436,0.8979475498199463,0.05233604460954666
technology,Nissan buys controlling share in Mitsubishi for $2.1 billion,,1037,5280,2016-05-13,TECH,0.015166711062192917,0.9286985397338867,0.05613475292921066
gadgets,LG Action Cam lets you live stream to YouTube without a phone,,152,1552,2016-05-13,TECH,0.01972714066505432,0.9406090378761292,0.03966386616230011
technology,Professor reveals to students that his assistant was an AI all along,,74,1065,2016-05-13,TECH,0.0625714510679245,0.9118210673332214,0.025607440620660782
technology,"Boeing Falters, And Now Only SpaceX Will Carry Astronauts in 2017",,67,729,2016-05-13,TECH,0.015382833778858185,0.9108970165252686,0.07372017949819565
technology,Google Paying Arizona Residents $20/hour to Drive Self-Driving Cars (Requires BS or BA),,86,454,2016-05-13,TECH,0.06396449357271194,0.912461519241333,0.023573970422148705
technology,"Hardcore fetish forum hacked, personal details leaked, including .gov email addresses",,55,432,2016-05-13,TECH,0.2485923171043396,0.7330175042152405,0.018390262499451637
technology,Bing is banning all Computer Support Ads from their network due to scams,,56,392,2016-05-13,TECH,0.6604556441307068,0.32247456908226013,0.017069824039936066
technology,"Linksys WRT routers won’t block open source firmware, despite FCC rules",,14,281,2016-05-13,TECH,0.03514531999826431,0.9313217997550964,0.03353288397192955
technology,California Bill Would Let AT&amp;T Hang up on DSL Users,,31,257,2016-05-13,TECH,0.01646425947546959,0.9315268397331238,0.052008889615535736
technology,"Germany To Give €1 Billion Electric Car Subsidy. People purchasing purely electric vehicles will receive €4,000 ($4,500) and plug-in hybrid car buyers will receive €3,000 .",,878,5386,2016-05-14,TECH,0.012792376801371574,0.8340599536895752,0.1531476378440857
