subreddit,title,selftext,num_comments,score,created_utc,stock/sector,neg,neu,pos
technology,Another Whistleblower -- One Who Tried To Protect Other Whistleblowers -- Says The 'Official Channels' Are Worthless,,4,279,2016-05-23,TECH,0.02237273007631302,0.9458820819854736,0.03174515441060066
technology,"China fakes 488 million social media posts per year. Their goal is to distract the public and change the subject from undesirable topics, according to one study",,57,260,2016-05-23,TECH,0.0299676526337862,0.932888925075531,0.03714342787861824
technology,AT&amp;T Begins Capping Broadband Users Today,,1923,5807,2016-05-24,TECH,0.026757512241601944,0.9306051731109619,0.04263730347156525
technology,"Microsoft accused of Windows 10 upgrade ""nasty trick""",,3699,5470,2016-05-24,TECH,0.9426444172859192,0.0365547351539135,0.020800793543457985
technology,If you are mad about data caps go here to actually do something about it and complain to the FCC.,[removed],427,4673,2016-05-24,TECH,0.30250218510627747,0.6659072637557983,0.03159061819314957
technology,Congratulations! You Lost. The Do Not Call list was supposed to defeat telemarketers. Now scammy robocalls are out of control. What happened?,,511,3107,2016-05-24,TECH,0.05148465186357498,0.9148053526878357,0.033709973096847534
gadgets,SoftBank's humanoid robot Pepper is getting a job at Pizza Hut,,336,1726,2016-05-24,TECH,0.03644103184342384,0.90933758020401,0.05422138050198555
technology,"Congress Keeps Holding Repeated, Pointless Hearings Just To Punish The FCC For Standing Up To ISPs On Net Neutrality | Techdirt",,113,1676,2016-05-24,TECH,0.08664922416210175,0.8892673254013062,0.02408342994749546
technology,"Engineers Smash Wireless Data Record, Beaming 6 GB/Sec Over 23 Miles",,123,1613,2016-05-24,TECH,0.035513125360012054,0.8292481303215027,0.13523870706558228
technology,"Oculus Is Hurting VR's Development By Supporting Walled Gardens, Closed Ecosystems",,223,1053,2016-05-24,TECH,0.17722350358963013,0.7971457839012146,0.025630710646510124
technology,"To illustrate exactly how ridiculous Terms &amp; Conditions remains for app users, Norway’s consumer protection agency is live streaming reading out the T&amp;Cs for 30 common apps — including Snapchat, Dropbox, Instagram and Facebook — over a 24 hour+ readathon",,25,1032,2016-05-24,TECH,0.06317314505577087,0.9001269340515137,0.03669986128807068
gadgets,Pebble announced three new devices,,191,913,2016-05-24,TECH,0.0098329558968544,0.5455142259597778,0.44465282559394836
technology,"Congrats, FBI, You've Now Convinced Silicon Valley To Encrypt And Dump Log Files",,663,6358,2016-05-25,TECH,0.059529781341552734,0.9112222194671631,0.029248036444187164
technology,"Microsoft bangs the final nail in Nokia Devices’ coffin, will lay off 1,850",,1677,5520,2016-05-25,TECH,0.0776304304599762,0.8730060458183289,0.049363475292921066
technology,The Pirate Bay Returns To Its Original And 13-Year-Old .ORG Domain,,375,3820,2016-05-25,TECH,0.06488978862762451,0.9076573252677917,0.027452852576971054
technology,US Department of Energy wants 100% solar power for electricity grid,,217,3366,2016-05-25,TECH,0.008917327970266342,0.8702239990234375,0.12085862457752228
gadgets,"Xiaomi unveils the Mi Drone, costing $460 for 4K video or $380 for 1080p",,484,2871,2016-05-25,TECH,0.021628066897392273,0.9081677794456482,0.07020417600870132
technology,Comcast Users Must Now Pay $50 Per Month Extra to Avoid Caps,,264,1793,2016-05-25,TECH,0.1677686721086502,0.8119922280311584,0.02023911662399769
gadgets,Pebble's new smartwatches focus on fitness,,108,507,2016-05-25,TECH,0.03218088299036026,0.91912442445755,0.04869472607970238
technology,"""The [United States] government is squandering its technology budget maintaining museum-ready computer systems in critical areas from nuclear weapons to Social Security. They're still using floppy disks at the Pentagon.""",,79,432,2016-05-25,TECH,0.08101289719343185,0.900936484336853,0.018050633370876312
technology,Microsoft has u-turned over changes it made to a pop-up encouraging users to upgrade to Windows 10. Users were angry that clicking the cross to dismiss the box meant that they had agreed to the upgrade.,,118,348,2016-05-25,TECH,0.015478240326046944,0.7702735066413879,0.21424826979637146
technology,"Norwegians have spent more than 30 hours reading out terms and conditions from smartphone apps in a campaign by the country's consumer agency. The average Norwegian has 33 apps, whose terms and conditions together run longer than the New Testament.",,13,341,2016-05-25,TECH,0.034387558698654175,0.9190991520881653,0.04651331156492233
technology,"GOP Pushing Bill That Guts FCC Authority, Kills Net Neutrality",,2076,7298,2016-05-26,TECH,0.08060097694396973,0.8727710843086243,0.04662797227501869
technology,FBI won't reveal hacking method used to track suspect so judge tosses case,,421,5212,2016-05-26,TECH,0.09096371382474899,0.8850434422492981,0.02399284392595291
technology,Google wins trial against Oracle as jury finds Android is “fair use”,,295,4749,2016-05-26,TECH,0.08748040348291397,0.2399691939353943,0.6725504398345947
technology,Google might name and shame slow-to-update Android vendors,,611,3991,2016-05-26,TECH,0.029209591448307037,0.933387279510498,0.037403177469968796
technology,"Microsoft won't back down from Windows 10 nagware 'trick'. Redmond assumes closing nagware dialog means 'yes', says that's by design",,668,1869,2016-05-26,TECH,0.028136741369962692,0.8789980411529541,0.09286519885063171
technology,Twitter abuse - '50% of misogynistic tweets from women',,381,1857,2016-05-26,TECH,0.04588407650589943,0.9283315539360046,0.025784429162740707
gadgets,"HP launches a new line of gaming laptops, desktops, and accessories",,700,1369,2016-05-26,TECH,0.014210020191967487,0.7980504631996155,0.1877395063638687
gadgets,"Linksys put tri-band, 5.3Gbps MU-MIMO into a $399 Wi-Fi router",,362,836,2016-05-26,TECH,0.03223534673452377,0.917587399482727,0.05017722398042679
technology,Billions of dollars and the future of software development depend on a jury's ability to understand complex programming concepts [Oracle-Google trial],,63,520,2016-05-26,TECH,0.012525981292128563,0.830118715763092,0.15735527873039246
technology,Judge torpedoes 'Tor pedo' evidence due to the FBI refusing to reveal its data acquisition techniques,,35,452,2016-05-26,TECH,0.6774173378944397,0.29105010628700256,0.03153254836797714
technology,Facebook begins tracking non-users around the internet,,1338,6108,2016-05-27,TECH,0.04476216435432434,0.9322994947433472,0.022938381880521774
technology,"My Town won't see Google Fiber or FiOS any time soon, so they are rolling out 10gbps fiber/600mbps wireless at 30-50% cost reduction to everyone starting in October.",,326,4281,2016-05-27,TECH,0.025159290060400963,0.9248262643814087,0.050014469772577286
technology,"""A provision snuck into the still-secret text of the [United States] Senate's annual intelligence authorization would give the FBI the ability to demand individuals' email data and possibly web-surfing history from their service providers without a warrant and in complete secrecy.""",,68,2415,2016-05-27,TECH,0.016610344871878624,0.9316048622131348,0.051784828305244446
gadgets,Facebook and Microsoft are building a huge trans-Atlantic data cable,,301,2071,2016-05-27,TECH,0.02468850463628769,0.9065130352973938,0.06879844516515732
technology,All European scientific articles to be freely accessible by 2020,,62,1668,2016-05-27,TECH,0.018035899847745895,0.9408144950866699,0.04114961624145508
technology,FBI raids dental software researcher who discovered private patient data on public server,,107,1205,2016-05-27,TECH,0.2632541358470917,0.7087673544883728,0.027978500351309776
technology,"Symantec makes BlueCoat, a company specializing in surveillance and censorship technology, a Certificate Authority, allowing it to initiate man-in-the-middle attacks without warning [x-post r/privacy]",,38,909,2016-05-27,TECH,0.03913501650094986,0.9217880964279175,0.03907686844468117
gadgets,ForcePhone software makes any mobile device pressure sensitive,,65,458,2016-05-27,TECH,0.2714917063713074,0.6793835759162903,0.04912472516298294
gadgets,"UnaPhone Zenith, a custom Android smartphone, promises to protect your privacy",,55,399,2016-05-27,TECH,0.012979204766452312,0.8225589394569397,0.1644619107246399
gadgets,Google aims to launch its consumer Project Ara phone in 2017,,34,319,2016-05-27,TECH,0.008961922489106655,0.8407080769538879,0.15033000707626343
technology,Delta built the more efficient TSA checkpoints that the TSA couldn't,,1324,5876,2016-05-28,TECH,0.021136818453669548,0.9109240174293518,0.0679391399025917
technology,Meet the Kentucky Congressman aiming to kill net neutrality,,701,4985,2016-05-28,TECH,0.3268091082572937,0.6354932188987732,0.03769771382212639
gadgets,The iRobot Braava uses Roomba logic to wet-mop kitchens and bathrooms,,191,2001,2016-05-28,TECH,0.034059565514326096,0.9294342398643494,0.03650616481900215
gadgets,Latest robot roach can leap like the real thing,,70,864,2016-05-28,TECH,0.016149763017892838,0.9104755520820618,0.07337472587823868
technology,Lenovo suffers net loss of $128 million for fiscal 2015,,217,838,2016-05-28,TECH,0.9232661724090576,0.06417499482631683,0.012558801099658012
gadgets,Samsung's Batman Galaxy S7 Edge has Alfred on speed dial,,41,521,2016-05-28,TECH,0.020413389429450035,0.9008811712265015,0.07870541512966156
technology,"After Six-Week Strike, Verizon Workers Claim Major Victory as Deal Reached: ""This proves that when we stand together we can raise up working families, improve our communities and protect the American middle class.""",,24,441,2016-05-28,TECH,0.03646460175514221,0.5295719504356384,0.4339633882045746
technology,Chinese users criticise Microsoft’s push for Windows 10 upgrade: Report,,72,406,2016-05-28,TECH,0.016991570591926575,0.6949082016944885,0.2881002426147461
gadgets,German scientists are training robots to 'feel' pain,,63,359,2016-05-28,TECH,0.08085749298334122,0.8684284687042236,0.05071406438946724
technology,The NSA's Guide To The Internet Is The Weirdest Thing You’ll Read Today,,24,254,2016-05-28,TECH,0.034482523798942566,0.9168784618377686,0.048639025539159775
technology,"Google's upcoming Allo messaging app is 'dangerous', Edward Snowden claims - ""Google's decision to disable end-to-end encryption by default in its new Allo chat app is dangerous, and makes it unsafe. Avoid it for now.""",,927,4446,2016-05-29,TECH,0.25172725319862366,0.7264752388000488,0.021797550842165947
technology,Microsoft uses malware tactics to foist Windows 10 on more PCs,,1465,4439,2016-05-29,TECH,0.034853942692279816,0.9374342560768127,0.02771175093948841
technology,"PSA: ""Imgur Uploader"" is injecting ads on Google and many different domains","One of the two most popular Imgur chrome extensions is injecting ads.

https://chrome.google.com/webstore/detail/imgur-uploader/hgmpmjpekinnebjgnakcahjikbomnmlb

Seems to be running external js from:

    s3.amazonaws.com/jscache/72d07657ba1ad678d2.js
    
and

    http://connectionstrenth.com/addons/lnkr5.min.js

and

    http://connectionstrenth.com/addons/lnkr40_drct.min.js
        

I'll pass on this shit.",135,1929,2016-05-29,TECH,0.022726260125637054,0.9234949350357056,0.053778745234012604
gadgets,Nest's co-founder is releasing a smart go-kart for kids,,283,1751,2016-05-29,TECH,0.02582618221640587,0.911176323890686,0.06299746036529541
technology,Microsoft Removes 260-Character Path Length Limit in Windows 10 Redstone,,194,1570,2016-05-29,TECH,0.1747482866048813,0.7911242246627808,0.034127481281757355
technology,"Beware of keystroke loggers disguised as USB phone chargers, FBI warns",,35,672,2016-05-29,TECH,0.03836815431714058,0.9266663193702698,0.034965548664331436
technology,Boston Dynamics employees were frustrated with Google's plan for a household robot,,135,596,2016-05-29,TECH,0.5860836505889893,0.37737348675727844,0.03654281795024872
technology,The North Korean bank heist hack shows the exact need of why we NEED strong encryption (x-post from world news),,21,594,2016-05-29,TECH,0.019837044179439545,0.9087892174720764,0.07137375324964523
technology,"Setting Free The Words Trapped In Our Heads: ""Neuroscientists are on their way to turn a person's thoughts into speech producible by a device, to help victims of stroke and others with speech paralysis to communicate with their loved ones.""",,17,260,2016-05-29,TECH,0.10008636116981506,0.8713853359222412,0.02852828986942768
gadgets,"Twitter awarded bug bounty hunters $322,420 over two years",,13,218,2016-05-29,TECH,0.028654394671320915,0.8006561994552612,0.17068937420845032
technology,Tesla's Gigafactory grand opening to take place July 29,,701,5283,2016-05-30,TECH,0.026561833918094635,0.9407424330711365,0.0326957106590271
technology,Holder says Snowden performed 'public service',,865,5254,2016-05-30,TECH,0.027350038290023804,0.9065831899642944,0.06606678664684296
technology,"It looks like reddit wants to become a profitable business by using user data. Interesting statements from Steve Huffman: ""We know all of your interests. Not only just your interests you are willing to declare publicly on Facebook - we know your dark secrets, we know everything""(x-post r/privacy)",,451,3224,2016-05-30,TECH,0.015471821650862694,0.9240021705627441,0.060526035726070404
gadgets,"ASUS' ZenBook 3 is thinner, lighter and faster than the MacBook.",,1106,2914,2016-05-30,TECH,0.022978944703936577,0.8906688690185547,0.08635219186544418
technology,"Comcast loses key Oregon tax rulings, with 'tens of millions' at stake",,19,478,2016-05-30,TECH,0.518898606300354,0.3963017463684082,0.08479964733123779
technology,"Verizon workers reach tentative bargaining agreement with management. Won 11% raise over 4 years, plus commitment for additional 1,200 new hires",,60,463,2016-05-30,TECH,0.06911583989858627,0.5008700489997864,0.43001410365104675
technology,YouTube Threatens Legal Action Against Video Downloader,,89,404,2016-05-30,TECH,0.5345779657363892,0.44482147693634033,0.02060053125023842
gadgets,Tesla hosts a grand opening for its Gigafactory on July 29th,,8,301,2016-05-30,TECH,0.02743702195584774,0.9179379343986511,0.05462498962879181
technology,"NYT: 22 Percent of Smartphone Users Are Blocking Ads, 419 Million Users Worldwide",,79,267,2016-05-30,TECH,0.26085612177848816,0.7042869925498962,0.0348568893969059
technology,"While Surveillance around the World Is Constantly Growing, Germany Celebrates a Victory for Privacy",[deleted],8,184,2016-05-30,TECH,0.013228518888354301,0.7851845622062683,0.20158690214157104
technology,"Apartment block demands tenants give Facebook “like” within 5 days - ""...owners of the complex are trying to coerce tenants into giving positive feedback.""",,1263,6118,2016-05-31,TECH,0.014340066350996494,0.8841553926467896,0.10150453448295593
technology,"Zuckerberg Is Dictator of The World's Largest Nation, Pirate Bay Founder Says",,1169,5044,2016-05-31,TECH,0.024564692750573158,0.895525336265564,0.07990991324186325
gadgets,"Intel's first 10-core desktop CPU will cost $1,723",,1828,4917,2016-05-31,TECH,0.48963695764541626,0.4340396821498871,0.07632344216108322
technology,Samsung starts producing 512GB 16mmx20mm BGA SSD weighing 1 gram,,373,2649,2016-05-31,TECH,0.018310217186808586,0.9020683765411377,0.07962135225534439
technology,"Burr-Feinstein Anti-Encryption Bill Has No Support, Won't Be Moving Forward Anytime Soon | Techdirt",,65,1766,2016-05-31,TECH,0.031132496893405914,0.8838555216789246,0.0850120335817337
technology,"Facebook using people’s phones to listen in on what they’re saying, claims professor",,200,1176,2016-05-31,TECH,0.054022934287786484,0.9162284135818481,0.029748685657978058
technology,FBI Gets Warrantless E-mail Snooping Added to Two Senate Bills,,29,1109,2016-05-31,TECH,0.05514338240027428,0.9045810699462891,0.04027559235692024
technology,Apple Actually Is Deleting Music Files Off Some People’s Hard Drives,,145,971,2016-05-31,TECH,0.0420851856470108,0.9312546849250793,0.026660099625587463
technology,Electric bus that can fully recharge wirelessly in just 15 minutes (or during stops) being field tested.,,77,859,2016-05-31,TECH,0.043413225561380386,0.9261041879653931,0.030482571572065353
technology,Police Can Force You to Use Your Fingerprint to Unlock Your Phone,,203,458,2016-05-31,TECH,0.0520954504609108,0.9263535737991333,0.021550899371504784
