subreddit,title,selftext,num_comments,score,created_utc,stock/sector,neg,neu,pos
technology,Megaupload’s Kim Dotcom seeks to retain millions in assets: US federal court rules the German tech entrepreneur could not recover his assets because he is ‘a fugitive’ – but he vows to fight on,,53,172,2016-08-14,TECH,0.15684305131435394,0.805392861366272,0.0377640537917614
technology,Americans prefer a ‘password’ over a fingerprint,,110,136,2016-08-14,TECH,0.037184566259384155,0.9350231885910034,0.02779231034219265
technology,Vancouver police confirm use of 'stingray' surveillance technology,,2,127,2016-08-14,TECH,0.020094767212867737,0.9339293837547302,0.04597579315304756
technology,"Google Fiber rethinking its costly cable plans, looking to wireless",,2647,6318,2016-08-15,TECH,0.019823215901851654,0.9038777947425842,0.07629892230033875
technology,"The NSA has been hacked, information up for sale",,776,4219,2016-08-15,TECH,0.23999886214733124,0.7351983189582825,0.024802759289741516
gadgets,"Apple Watch band gives you worst of both worlds, adds traditional analog watch",,579,3475,2016-08-15,TECH,0.0389404222369194,0.923542857170105,0.037516698241233826
technology,"Design flaw in Samsungs S7 series camera glass keeps shattering, the response from samsung is... no mea culpa.",,966,3434,2016-08-15,TECH,0.2805180251598358,0.6740772128105164,0.04540468379855156
technology,Julian Assange: WikiLeaks will show how US intelligence interferes in European elections,,174,1726,2016-08-15,TECH,0.018143435940146446,0.9106540083885193,0.07120252400636673
technology,The FCC Can't Save Community Broadband -- But We Can,,61,947,2016-08-15,TECH,0.18827137351036072,0.7827237248420715,0.029004942625761032
gadgets,The best wireless headphones for running,,200,906,2016-08-15,TECH,0.016642652451992035,0.8997979760169983,0.08355934917926788
technology,"Who owns the wind? We do, Wyoming says, and it's taxing those who use it",,110,576,2016-08-15,TECH,0.02329368330538273,0.9304274320602417,0.046278901398181915
technology,"Reality check: Manufacturers returning to U.S. may mean jobs for robots, not people",,97,464,2016-08-15,TECH,0.8923655152320862,0.07447978109121323,0.03315471112728119
technology,Police Can Use a Legal Grey Area to Rob Anyone of Their Belongings,,31,388,2016-08-15,TECH,0.3193269670009613,0.661311686038971,0.019361283630132675
technology,Federal Judge Says Real-Time Cell Location Info -- Whether Obtained With A Stingray Or Not -- Requires The Use Of A Warrant,,485,7275,2016-08-16,TECH,0.06671098619699478,0.9133386611938477,0.019950423389673233
technology,Australian university students spend $500 to build a census website to rival their governments existing $10 million site.,,994,5537,2016-08-16,TECH,0.02593059651553631,0.8267179727554321,0.14735147356987
gadgets,"Nvidia stuffs desktop GTX 1080, 1070, 1060 into laptops, drops the “M”",,1764,5519,2016-08-16,TECH,0.024653559550642967,0.9116393327713013,0.06370707601308823
technology,"Chatbot lawyer that overturned 170,000 parking tickets now helps fight homelessness",,88,2348,2016-08-16,TECH,0.022550905123353004,0.8731288313865662,0.104320228099823
technology,Snowden speculates leak of NSA spying tools is tied to Russian DNC hack,,82,1217,2016-08-16,TECH,0.05534462630748749,0.910860002040863,0.03379535302519798
technology,"CEO Tim Cook Decides Apple Doesn’t Have to Pay Corporate Tax Rate Because It’s “Unfair” - ""Wouldn't it be great if you could refuse to pay your taxes until you decided your tax rate was “fair”?""",,92,469,2016-08-16,TECH,0.18496164679527283,0.7829799056053162,0.03205842152237892
gadgets,New Nvidia graphics technology makes VR-ready laptops slimmer and cheaper,,53,425,2016-08-16,TECH,0.0146648483350873,0.906049907207489,0.07928524166345596
technology,"‘Shadow Brokers’ Claim to be Selling NSA Malware, in What Could Be Historic Hack",,36,377,2016-08-16,TECH,0.07511326670646667,0.8309215903282166,0.09396517276763916
technology,Someone is Spying on the Researchers Behind the Veracrypt Audit,,46,297,2016-08-16,TECH,0.12708665430545807,0.8471669554710388,0.02574644237756729
technology,Every major cable TV company lost subscribers last quarter,,59,262,2016-08-16,TECH,0.9664955139160156,0.02646360918879509,0.0070409392938017845
technology,Companies Can’t Legally Void the Warranty for Jailbreaking or Rooting Your Phone,,1390,7702,2016-08-17,TECH,0.1503874510526657,0.8306323885917664,0.018980199471116066
gadgets,Samsung Galaxy Note 7 review: The ultimate phone for scribblers,,482,1468,2016-08-17,TECH,0.03024161607027054,0.9138048887252808,0.055953528732061386
technology,"EFF: With Windows 10, Microsoft Blatantly Disregards User Choice and Privacy: A Deep Dive",,210,1024,2016-08-17,TECH,0.0251263789832592,0.9264843463897705,0.04838920757174492
technology,"Cisco Systems to lay off about 14,000 employees: report",,81,526,2016-08-17,TECH,0.41257500648498535,0.5248966217041016,0.06252841651439667
technology,Windows 10 tip: Turn off Cortana completely,,100,431,2016-08-17,TECH,0.025662774220108986,0.9187709093093872,0.055566348135471344
technology,NSA website goes down as hackers auction stolen ‘cyber weapons’,,19,190,2016-08-17,TECH,0.165502667427063,0.8056511878967285,0.028846068307757378
technology,Nvidia calls out Intel for cheating in Xeon Phi vs. GPU benchmarks,,50,155,2016-08-17,TECH,0.03165964037179947,0.9260104298591614,0.04232992231845856
technews,Companies Can’t Legally Void the Warranty for Jailbreaking or Rooting Your Phone,,8,110,2016-08-17,TECH,0.1503874510526657,0.8306323885917664,0.018980199471116066
technology,"Wayback Machine Won’t Censor Archive for Taste, Director Says After Olympics Article Scrubbed",,9,107,2016-08-17,TECH,0.038582004606723785,0.9280753135681152,0.03334268555045128
technology,"Comcast Fancies Itself The Tesla Of Cable: Despite offering some of the worst customer service ever documented, Comcast has been busy lately trying to convince anybody who'll listen that it's on the cusp of becoming a Silicon-Valley-esque innovation giant.",,20,92,2016-08-17,TECH,0.11116360872983932,0.8421431183815002,0.04669325798749924
technology,"Court rules that ISPs do not need to give up information on alleged pirates, copyright infringers",,1945,8068,2016-08-18,TECH,0.07269346714019775,0.9095025658607483,0.01780393347144127
technology,Uber's first self-driving cars will start picking up passengers this month,,754,3403,2016-08-18,TECH,0.038712773472070694,0.8488072156906128,0.112480029463768
gadgets,Kobo Aura One takes on the Kindle with a huge screen and water resistance,,395,1715,2016-08-18,TECH,0.02625524438917637,0.9257181286811829,0.04802663251757622
technology,"Electronic Frontier Foundation says T-Mobile’s new unlimited data plan ""runs directly afoul of the principle of net neutrality""",,179,908,2016-08-18,TECH,0.01394503191113472,0.9389653205871582,0.04708969220519066
technology,Gawker.com to End Operations Next Week,,230,858,2016-08-18,TECH,0.4515928328037262,0.5327784419059753,0.01562873274087906
gadgets,You can see through your walls with this $200 stud finder,,78,446,2016-08-18,TECH,0.03222166746854782,0.9095415472984314,0.05823680758476257
technology,Gawker.com to shut down next week after acquisition by Univision - Flagship website of Gawker Media to close in wake of crippling lawsuit brought by Hulk Hogan and bankrolled by Silicon Valley billionaire Peter Thiel.,,67,363,2016-08-18,TECH,0.035549577325582504,0.8931460380554199,0.07130442559719086
gadgets,Nokia is bringing its 360-degree Ozo camera to China's booming VR market,,29,321,2016-08-18,TECH,0.01912839338183403,0.9165583848953247,0.06431320309638977
technology,T-mobile Eliminating All Plans in Favor of Unlimited Data,,226,284,2016-08-18,TECH,0.04423579201102257,0.9219540357589722,0.03381016105413437
technology,"""It looks as if the NSA has indeed been hacked.""",,46,202,2016-08-18,TECH,0.019088122993707657,0.760312557220459,0.22059935331344604
technology,"The NSA Was Hacked, Snowden Documents Confirm",,1242,6629,2016-08-19,TECH,0.16942040622234344,0.8070724606513977,0.023507079109549522
technology,Comcast’s $70 gigabit offer is only good in cities with Google Fiber,,1101,6556,2016-08-19,TECH,0.02126101776957512,0.906514048576355,0.07222495973110199
technology,Breakthrough MIT discovery doubles lithium-ion battery capacity,,1311,6019,2016-08-19,TECH,0.010764495469629765,0.5479327440261841,0.44130274653434753
gadgets,Here One earbuds let you control the sound around you with an app,,444,3557,2016-08-19,TECH,0.021583624184131622,0.9250783920288086,0.0533379428088665
technology,"The NSA may have known the exploits were in the ""wrong"" hands but withheld this info to continue utilizing them. If that's the case, the NSA is complicit in any exploitation by the ""wrong"" people because it chose to withhold major vulnerabilities even after it knew it had been compromised.",,89,3135,2016-08-19,TECH,0.0641690269112587,0.9074510335922241,0.028379885479807854
technology,Microsoft Has Broken Millions Of Webcams With Windows 10 Anniversary Update,,274,1591,2016-08-19,TECH,0.04673844948410988,0.9079755544662476,0.04528604447841644
technology,"""Data scientists aren't actually analyzing data, instead they are stuck wading through cluttered disorganized data.""",,148,1178,2016-08-19,TECH,0.0644463524222374,0.9065448641777039,0.029008788987994194
technology,We Shouldn’t Wait Another Fifteen Years for a Conversation About Government Hacking,,5,509,2016-08-19,TECH,0.06057838350534439,0.8758324980735779,0.06358909606933594
technology,Anti-Google research group in Washington is funded by Oracle,,16,193,2016-08-19,TECH,0.04024602100253105,0.9175022840499878,0.042251668870449066
technology,Elon Musk's next project involves creating solar shingles – roofs completely made of solar panels.,,22,133,2016-08-19,TECH,0.010210550390183926,0.9014776349067688,0.08831185102462769
technology,Let the CPU wars begin: AMD shows its Zen CPU can compete with Intel’s best,,2322,5900,2016-08-20,TECH,0.015013323165476322,0.8048384785652161,0.1801481693983078
technology,"China Invests in Molten-Salt Reactors: Cheaper and cleaner nuclear plants could finally become reality—but not in the United States, where the technology was invented more than 50 years ago.",,528,3085,2016-08-20,TECH,0.016755925491452217,0.8791636824607849,0.10408039391040802
gadgets,Apple just dropped iOS 10 beta 7 for developers and public testers,,218,1051,2016-08-20,TECH,0.19583088159561157,0.7479193210601807,0.05624975636601448
technology,UK Court: ISPs have to block *trademark* infringements in addition to copyright infringements,,89,981,2016-08-20,TECH,0.5093576312065125,0.47046950459480286,0.02017282135784626
gadgets,The Lamborghini Centenario Roadster has 770 horsepower of open-top ferocity,,141,807,2016-08-20,TECH,0.025802304968237877,0.8929151892662048,0.08128243684768677
technology,Netherlands to ban all non-electric vehicles by 2025,,515,632,2016-08-20,TECH,0.020733123645186424,0.9329506158828735,0.04631626233458519
technology,Motorola to Samsung: You nicked our idea - Fifth Avenue,,44,586,2016-08-20,TECH,0.02328137680888176,0.9295022487640381,0.04721644148230553
gadgets,"Sony Xperia XA review: It has the looks, but it comes at a cost",,111,452,2016-08-20,TECH,0.022411275655031204,0.9119851589202881,0.0656035766005516
technology,DNC Hacks and Leaky Government Make Encryption Restrictions Look More Foolish Than Ever,,0,167,2016-08-20,TECH,0.31161656975746155,0.6646644473075867,0.02371903322637081
technology,"Google announces it will phase out Chrome apps for Windows, Mac and Linux",,52,148,2016-08-20,TECH,0.02622721903026104,0.937808632850647,0.035964228212833405
technology,The NSA hack proves Apple was right to fight the FBI,,1617,7665,2016-08-21,TECH,0.16955749690532684,0.5915790796279907,0.23886337876319885
technology,Nasa just made all its research available online for free,,276,5535,2016-08-21,TECH,0.012375621125102043,0.9279295802116394,0.059694722294807434
gadgets,PCI Express 4.0 Brings 16 GT/s And At Least 300 Watts At The Slot,,505,3060,2016-08-21,TECH,0.015505172312259674,0.8700293302536011,0.11446548998355865
technology,T-Mobile deal 'may breach US net neutrality' rules,,383,2582,2016-08-21,TECH,0.9095295071601868,0.07799621671438217,0.012474262155592442
technology,"War on Cash: Banks, governments, credit card companies and fintech evangelists all want us to believe a cashless future is inevitable and good. But this isn't a frictionless utopia, says Brett Scott, and it's time to fight back",,312,1147,2016-08-21,TECH,0.034626491367816925,0.8777123689651489,0.08766112476587296
technology,Canadian Cops Want a Law That Forces People to Hand Over Encryption Passwords,,54,610,2016-08-21,TECH,0.03612691909074783,0.9347510933876038,0.02912200428545475
technology,Windows falls to 0.6 percent share in the smartphone market,,93,429,2016-08-21,TECH,0.9441347718238831,0.024535680189728737,0.03132953867316246
technology,Is it true that Facebook listens to your conversation when your phone is nearby?,Friends tell me that they have noticed FB serving ads related to conversations they have been having .. Has anyone else noticed this?,356,428,2016-08-21,TECH,0.03060636855661869,0.9365865588188171,0.032807011157274246
technology,Massachusetts will tax ridesharing services to compensate taxis,,70,245,2016-08-21,TECH,0.11199603974819183,0.7747002243995667,0.1133037582039833
technology,"""Jolly Roger"" uses software to trap telemarketers - his new podcast is hilarious",,46,219,2016-08-21,TECH,0.017939304932951927,0.9353886246681213,0.046672143042087555
technology,Comcast hopes you don’t notice it’s twice as expensive in non-Google Fiber markets,,1099,8124,2016-08-22,TECH,0.0675659254193306,0.8940936326980591,0.03834046423435211
technology,Elon Musk to unveil a ‘Solar Roof’ product to revolutionise the roof industry,[deleted],1589,5989,2016-08-22,TECH,0.012368403375148773,0.8936571478843689,0.09397440403699875
gadgets,"PS4 Slim leaks online, looks legit",,1120,3738,2016-08-22,TECH,0.02034595049917698,0.9305244088172913,0.049129635095596313
technology,Comcast Gigabit Twice as Expensive in non Google Fiber Markets,,110,1318,2016-08-22,TECH,0.023097606375813484,0.9446156024932861,0.03228681534528732
technology,"In India, accessing a blocked website potentially carries a 3 year sentence",,41,926,2016-08-22,TECH,0.446479856967926,0.5311576724052429,0.022362539544701576
technology,Door that auto-locks when you start private browsing,,33,566,2016-08-22,TECH,0.04504559561610222,0.9271508455276489,0.027803484350442886
technology,EFF blasts Microsoft over Windows 10 privacy concerns,,48,533,2016-08-22,TECH,0.4723035991191864,0.48675763607025146,0.04093877226114273
technology,Anti-Piracy Operations Are Fabricating Links To Non-Existent Torrents In DMCA Notices,,16,294,2016-08-22,TECH,0.03460061922669411,0.9233561754226685,0.042043231427669525
technology,"Linux turns 25, is bigger and more professional than ever",,88,235,2016-08-22,TECH,0.027820082381367683,0.7927218675613403,0.17945806682109833
technology,Emails show cozy White House relationship with Google lobbyists may have led to interference in FTC resulting in unprecedented step of ignoring recommendation to file an anti trust lawsuit,,21,197,2016-08-22,TECH,0.21423402428627014,0.6667771935462952,0.11898874491453171
technology,"Pokémon Go loses its luster, sheds more than 10 million users. Engagement, downloads, and time spent in the app are fading fast.",,6126,6567,2016-08-23,TECH,0.18404752016067505,0.7656208872795105,0.05033154785633087
gadgets,Smart ring with built in sensors to track calorie intake has raised almost half a million dollars in funding,,582,3044,2016-08-23,TECH,0.00919007696211338,0.39442792534828186,0.5963820219039917
technology,Google will punish sites that use annoying pop-up ads,,185,2288,2016-08-23,TECH,0.7284953594207764,0.25515061616897583,0.016354037448763847
technology,Dear God no: Facebook is testing autoplaying video with sound,,184,1823,2016-08-23,TECH,0.03232636675238609,0.9171028733253479,0.0505707785487175
technology,"Tesla announces new P100D Tesla battery, which gives Teslas faster speeds and better range",,308,1312,2016-08-23,TECH,0.010680890642106533,0.1331557333469391,0.8561634421348572
technology,"Secret Cameras Record Baltimore’s Every Move From Above - Since January, police have been testing an aerial surveillance system adapted from the surge in Iraq. And they neglected to tell the public.",,230,1211,2016-08-23,TECH,0.04880480468273163,0.9045709371566772,0.046624332666397095
gadgets,HELLO transforms any TV into the ultimate cross-platform communication device for work and home,,181,858,2016-08-23,TECH,0.026371631771326065,0.9272478222846985,0.04638049751520157
gadgets,Massachusetts becomes the first state to tax Uber and Lyft,,301,727,2016-08-23,TECH,0.02539432793855667,0.8763024210929871,0.09830324351787567
gadgets,"HBM3: Cheaper, up to 64GB on-package, and terabytes-per-second bandwidth",,64,478,2016-08-23,TECH,0.030855711549520493,0.9136101007461548,0.05553421750664711
technology,Comcast Buys DreamWorks Animation for $3.8 Billion,,140,451,2016-08-23,TECH,0.029736533761024475,0.9228335022926331,0.047429993748664856
technology,Google to start punishing mobile sites that show hard-to-dismiss popups,,1482,8963,2016-08-24,TECH,0.08052336424589157,0.8664746284484863,0.05300197750329971
technology,Chromebooks outsell Macs for the first time,,1789,4684,2016-08-24,TECH,0.033205218613147736,0.8867067098617554,0.0800880640745163
technology,"No, Bloomberg, the Olympics didn’t stumble because of Millennials. It stumbled because of NBC.",,634,3730,2016-08-24,TECH,0.5032963156700134,0.4499935805797577,0.046710118651390076
gadgets,The Zungle Panther is a pair of Sunglasses that transmit audio through bone conduction speakers,,226,2278,2016-08-24,TECH,0.02854752354323864,0.9162355065345764,0.05521700903773308
technology,Steve Wozniak Warns Apple Against Removing iPhone 7’s Headphone Jack,,687,935,2016-08-24,TECH,0.03618510439991951,0.9198827147483826,0.04393221437931061
gadgets,Samsung Gear VR (2016) review,,168,789,2016-08-24,TECH,0.02530939318239689,0.9308745861053467,0.04381605610251427
technology,"Google Fiber hits Salt Lake City, now available in seven metro areas",,20,247,2016-08-24,TECH,0.011625310406088829,0.878652036190033,0.10972259938716888
technology,France and Germany want Europe to crack down on encryption,,56,192,2016-08-24,TECH,0.12970396876335144,0.8266875743865967,0.04360843077301979
technology,One More Time With Feeling: Net Neutrality Didn't Hurt Broadband Investment In The Slightest,,7,181,2016-08-24,TECH,0.060291364789009094,0.8202243447303772,0.1194843053817749
technology,No privacy on Facebook: Eight Facebook users indicted for mocking Thai junta leader,,9,171,2016-08-24,TECH,0.8653571605682373,0.11093656718730927,0.023706234991550446
technology,Pizza drones are go! Domino's gets NZ drone delivery OK,,1472,6121,2016-08-25,TECH,0.025983145460486412,0.8589520454406738,0.11506477743387222
technology,"‘Betrayal of trust'? WhatsApp to start sharing user data with Facebook, corporations",,899,5063,2016-08-25,TECH,0.025353366509079933,0.9299099445343018,0.044736653566360474
technology,"Researchers at Princeton have built an open source 25-core chip that can easily be scaled to create a 200,000-core computer",,392,4466,2016-08-25,TECH,0.011589155532419682,0.8252652287483215,0.16314567625522614
technology,WhatsApp is going to share your phone number with Facebook. That means WhatsApp users could soon start seeing more targeted ads on Facebook.,,278,2222,2016-08-25,TECH,0.034586675465106964,0.933002233505249,0.03241116181015968
technology,"Researchers are able to detect your keystrokes with over 90% accuracy using Wi-Fi devices. Not using a malicious software, but by detecting the ripples in the Wi-Fi signal.",,169,2063,2016-08-25,TECH,0.033238187432289124,0.9317458868026733,0.03501595929265022
technology,Google Fiber reduces staff by 50%,,381,1438,2016-08-25,TECH,0.9535501003265381,0.037213388830423355,0.009236520156264305
gadgets,Tested - Hands-On with Shaper Origin Handheld CNC Router!,,146,1322,2016-08-25,TECH,0.022077888250350952,0.9073505997657776,0.07057148963212967
technology,Windows 10 Privacy Placebo: Phone home setting gets automatically re-enabled,,238,1239,2016-08-25,TECH,0.07687903940677643,0.8907625079154968,0.032358407974243164
technology,"All the Ways Your Wi-Fi Router Can Spy on You: ""By analyzing the exact ways that a wi-fi signal is altered when a human moves through it, researchers can “see” what someone writes with their finger in the air, identify a particular person by the way that they walk, and even read a person’s lips.""",,98,840,2016-08-25,TECH,0.043002210557460785,0.9264481067657471,0.030549705028533936
technology,A serious attack on the iPhone was just seen in use for the first time,,88,764,2016-08-25,TECH,0.09382955729961395,0.8520597815513611,0.05411059781908989
technology,Tesla Clears Antitrust Hurdle In $2.6 Billion Deal For SolarCity,,886,5541,2016-08-26,TECH,0.015260724350810051,0.8957642912864685,0.08897493779659271
technology,"Turkey blocks Facebook, Youtube, and Twitter... again",,186,3580,2016-08-26,TECH,0.13878904283046722,0.8425122499465942,0.018698694184422493
technology,Hillary Clinton used BleachBit to wipe emails,,944,2469,2016-08-26,TECH,0.03953162953257561,0.9286514520645142,0.031816914677619934
technology,"Dyson will spend $1.4 billion, enlist 3,000 engineers to build a better battery",,304,2153,2016-08-26,TECH,0.013426101766526699,0.6989378333091736,0.28763601183891296
technology,Uber Lost More Than $1.2 Billion In The First Half Of 2016 Alone,,432,1903,2016-08-26,TECH,0.9555175304412842,0.035476285964250565,0.0090061379596591
gadgets,The Chord Mojo turns good headphones into great ones,,573,1817,2016-08-26,TECH,0.018748890608549118,0.7885124683380127,0.1927386224269867
technology,Apple is under fire for “excessive overtime” and illegal working conditions in another Chinese factory,,110,1566,2016-08-26,TECH,0.8278957605361938,0.15554432570934296,0.016559982672333717
technology,FBI’s stingray quickly found suspect after local cops’ device couldn’t,,46,363,2016-08-26,TECH,0.10017210245132446,0.8557694554328918,0.04405849054455757
technology,Exploits patched by Apple today hint at years of surreptitious government hacks,,45,316,2016-08-26,TECH,0.036720648407936096,0.9188299775123596,0.04444936662912369
technology,"Solar-powered art project ""Pipe"" can desalinize 1.5 billion gallons of drinking water for California annually.",,44,202,2016-08-26,TECH,0.018234841525554657,0.9151853322982788,0.06657983362674713
technology,"Unless congress stops it, the FBI wants to mass-hack computers, especially targeting Tor and Bitcoin users",,2161,7511,2016-08-27,TECH,0.02892371267080307,0.930875837802887,0.04020041227340698
technology,Tech firm brags about blocking FBI from recovering Clinton emails,,1898,4961,2016-08-27,TECH,0.6470105051994324,0.3017100393772125,0.05127954110503197
gadgets,Codex Silenda,,81,2649,2016-08-27,TECH,0.036278024315834045,0.8868080973625183,0.07691384851932526
technology,MegaUpload Lawsuit: Kim Dotcom Wants His Extradition Trial to Be Livestreamed,,65,1806,2016-08-27,TECH,0.07612545788288116,0.8974725604057312,0.02640199288725853
technology,FBI’s massive porn sting puts internet privacy at risk,,102,872,2016-08-27,TECH,0.8124270439147949,0.1676211804151535,0.019951852038502693
gadgets,iPhone malware that steals your data proves no platform is truly secure,,208,751,2016-08-27,TECH,0.015786144882440567,0.36672085523605347,0.6174930334091187
