subreddit,title,selftext,num_comments,score,created_utc,stock/sector,neg,neu,pos
technology,When Facebook/Instagram/WhatsApp tell you they don't even want your data it's a trick - but not why you think.,"When they tell you in their press statements that your messages are always encrypted and unreadable and that they ""don't even want your data"" they are trying to trick you into thinking your information is safe. It is true, they don't want your messages. That data is unuseable. Facebook tried for years to tailor your ads to the things you specifically talked about (in status updates etc) but the subtleties of language, slang, sarcasm Etc made it impossible with current technology. They could just as easily market something to you that you just sarcastically said you ""love"" leading to very poor ad results that would displease the companies buying that ad space. It was a huge failure.



What they do want is to be able to tie together everything you do online. Facebook accomplished this on the desktop by adding their ""like"" button to every website known to man. So for most people, whatever you do on a desktop browser is monitored by Facebook. They own the desktop space when it comes to knowing who you are and how to market to you. 



However in the last few years everyone is moving to mobile and this is a completely different environment.  People do much more in apps on their mobile devices than in browsers and those apps are essentially walled gardens. Facebook has trouble getting to that data and linking your device (and essentially who you are) to everything you are doing on mobile. So they want to expand this reach into a new app and get more identifiable information about you that can be used to track you. The WhatsApp info sharing is one more giant step in Facebook owning your entire online life, but on mobile this time. They are already number one in mobile ads because they had a head start with their mobile app getting there first while no one else knew how to properly track you on mobile. 



So while it is true they don't even want to read your messages or invade your ""privacy"" that is the straw man argument they are using to make you feel like the information they actually are getting isn't very useful or invasive when it is actually the most useful and valuable information that currently exists for advertisers. 


If you want to know more specifics I recommend the book ""Choas Monkeys"" (no affiliation)",55,490,2016-08-27,TECH,0.044414203613996506,0.9250365495681763,0.03054925613105297
technology,Solar panels have dropped 80% in cost since 2010 - Solar power is now reshaping energy production in the developing world,,108,410,2016-08-27,TECH,0.037422388792037964,0.6482772827148438,0.3143003582954407
technology,Mozilla Foundation: Reform Copyright,,20,181,2016-08-27,TECH,0.021840086206793785,0.9158385992050171,0.062321338802576065
technology,European Copyright Leak Exposes Plans to Force the Internet to Subsidize Publishers,,10,121,2016-08-27,TECH,0.09669741988182068,0.8802610635757446,0.023041529580950737
technology,FBI-owned Megaupload.org serves up porn and sex ads,,478,5303,2016-08-28,TECH,0.12780889868736267,0.849901556968689,0.02228958159685135
technology,"On Saturday the Juno spacecraft flew to within 4,200km of Jupiter -- and survived",,160,2567,2016-08-28,TECH,0.01699712499976158,0.8453234434127808,0.1376793533563614
technology,"TIL that a company tried to create an ""uber of the skies"" before the Supreme Court shut them down in 2015.",,224,1982,2016-08-28,TECH,0.7329172492027283,0.19880521297454834,0.06827757507562637
technology,No Way to Call Home: Incarcerated Deaf People Are Locked in a Prison Inside a Prison,,204,1599,2016-08-28,TECH,0.17430303990840912,0.7744868397712708,0.05121016502380371
technology,AT&amp;T explains why it has been slow in giving Google Fiber utility pole access,,173,1519,2016-08-28,TECH,0.06714587658643723,0.8555219173431396,0.07733216881752014
technology,"TTIP has failed – but no one is admitting it, says German Vice Chancellor",[deleted],34,885,2016-08-28,TECH,0.4764512777328491,0.3833284080028534,0.14022031426429749
technology,Nielsen admits to 18 months of YouTube online ratings mistakes,,5,189,2016-08-28,TECH,0.025539889931678772,0.9268554449081421,0.04760470241308212
technology,Google brings the National Parks to your living room with 360-virtual tours,,3,100,2016-08-28,TECH,0.019770346581935883,0.9356428384780884,0.044586848467588425
technology,Enhanced DMV facial recognition technology helps NY nab 100 ID thieves,,2,71,2016-08-28,TECH,0.011070978827774525,0.8721218705177307,0.11680712550878525
technology,Breitbart's Milo Yiannopoulos asks Twitter to release his data in bid to have suspension lifted | VentureBeat,,85,61,2016-08-28,TECH,0.19947613775730133,0.768687903881073,0.03183598816394806
technology,"Facebook fires trending team, and Facebook’s algorithms w/o humans goes crazy. Module pushes out false story about Fox’s Megyn Kelly, offensive Ann Coulter headline and a story link about a man masturbating with a McDonald’s sandwich",,1385,6876,2016-08-29,TECH,0.04864558205008507,0.9100580811500549,0.04129636660218239
technology,FBI says foreign hackers penetrated state election systems,,2322,6842,2016-08-29,TECH,0.7652006149291992,0.21039316058158875,0.02440617047250271
gadgets,Lenovo ThinkPad Yoga X1's stunning OLED screen seals the deal,,792,1629,2016-08-29,TECH,0.017066853120923042,0.9059231877326965,0.0770099088549614
technology,"Anker recalls, refunds USB-C cable over faulty implementation",,92,1574,2016-08-29,TECH,0.06288345158100128,0.890273928642273,0.046842608600854874
technology,MegaUpload Lawsuit: Judge Allows Kim Dotcom to Livestream Court Hearing,,69,1432,2016-08-29,TECH,0.10829091817140579,0.8708066940307617,0.020902439951896667
gadgets,Philips Hue motion sensor turns lights on for you,,172,1091,2016-08-29,TECH,0.03512813150882721,0.9123445749282837,0.05252724140882492
technology,Clinton Campaign Happily Using Strong End-To-End Encryption To Communicate; Will They Let The Rest Of Us Use It Too?,,67,809,2016-08-29,TECH,0.02907777763903141,0.9312195181846619,0.03970268368721008
gadgets,BlackBerry DTEK50 review,,54,293,2016-08-29,TECH,0.01914546638727188,0.9144411087036133,0.06641349196434021
gadgets,Disco Drone Hands-On: Crashing Parrot's New Fixed-Wing Flier. We threw it into a palm tree.,,26,286,2016-08-29,TECH,0.06555141508579254,0.8863168358802795,0.04813171550631523
technology,"Forbes alexa viewership numbers have plummeted over the past year, since taking a stand against AdBlock",,50,213,2016-08-29,TECH,0.030646249651908875,0.8993537425994873,0.06999996304512024
technology,Apple 'should repay Ireland 13bn euros' - BBC News,,2369,5541,2016-08-30,TECH,0.0347922220826149,0.9084299206733704,0.05677783116698265
technology,FBI director: 'There is no such thing as absolute privacy in America',,449,4216,2016-08-30,TECH,0.04972105473279953,0.9207642674446106,0.0295147392898798
gadgets,Google drops Nexus brand name for new phones &amp; hints at moving away from stock android,,929,2900,2016-08-30,TECH,0.8591169118881226,0.118113212287426,0.02276988886296749
technology,Study: 33% of Facebook Users Want Less News in Their Feeds,,196,2489,2016-08-30,TECH,0.792576014995575,0.17692211270332336,0.030501825734972954
gadgets,New screen uses your phone to make holograms,,274,1685,2016-08-30,TECH,0.014712739735841751,0.9247009754180908,0.060586340725421906
technology,The most absurd Internet privacy class-action settlement ever. Lawyers get millions. Consumers get nothing. E-mail snooping continues unabated.,,35,1423,2016-08-30,TECH,0.11754844337701797,0.8533543348312378,0.029097242280840874
technology,The internet wins! European regulators publish final guidelines protecting net neutrality,,61,1136,2016-08-30,TECH,0.017642609775066376,0.8983017802238464,0.08405563980340958
technology,Public defender: Baltimore's secret surveillance images could have exonerated innocent citizens,,30,969,2016-08-30,TECH,0.19776150584220886,0.7797414064407349,0.02249712310731411
technology,California bans ITT tech from accepting new students,,85,799,2016-08-30,TECH,0.03528016805648804,0.8940871357917786,0.07063271105289459
technology,"States Are Putting the Brakes on Municipal Broadband: Tennessee and North Carolina join other states in siding with cable and telecom companies, rather than allowing cities to provide affordable connectivity.",,35,497,2016-08-30,TECH,0.01807665452361107,0.8894193172454834,0.09250402450561523
technology,Turns out the signal astronomers saw was “strong” because it came from Earth,,679,5798,2016-08-31,TECH,0.07115153223276138,0.4668281674385071,0.46202030777931213
technology,"""An independent scientist has confirmed that the paper by scientists at the Nasa Eagleworks Laboratories on achieving thrust using highly controversial space propulsion technology EmDrive has passed peer review, and will soon be published by the American Institute of Aeronautics and Astronautics""",,1483,5677,2016-08-31,TECH,0.01549676526337862,0.9113619923591614,0.07314123213291168
technology,Building a new Tor that can resist next-generation state surveillance,,296,4129,2016-08-31,TECH,0.027119051665067673,0.9305274486541748,0.04235357046127319
gadgets,Acer announces the thinnest and fattest laptops in the world,,954,3742,2016-08-31,TECH,0.025430520996451378,0.9313307404518127,0.04323865845799446
technology,"T-Mobile, Sprint Unlimited Plans Are Full of Limits",,320,2282,2016-08-31,TECH,0.0332324244081974,0.9425718784332275,0.024195672944188118
technology,AT&amp;T Mocks Google Fiber's Struggles,,179,1547,2016-08-31,TECH,0.018539689481258392,0.9273439645767212,0.054116375744342804
technology,Dropbox has been hacked,,213,1354,2016-08-31,TECH,0.17317147552967072,0.8006190061569214,0.026209495961666107
technology,Startup Drive.AI Will Use Deep Learning To Teach Self-Driving Cars How To Solve Problems And Communicate With Humans - Fifth Avenue,,77,1291,2016-08-31,TECH,0.02566470578312874,0.8993109464645386,0.07502434402704239
technology,Facebook and Twitter (and a ton of other sites) have a browser vulnerability that allows a foreign site to hijack your browser tabs.,,40,714,2016-08-31,TECH,0.20745542645454407,0.7725082039833069,0.020036334171891212
technology,Samsung suspends Galaxy Note 7 shipments after explosion reports,,130,691,2016-08-31,TECH,0.8479353785514832,0.13530437648296356,0.01676015742123127
