subreddit,title,selftext,num_comments,score,created_utc,stock/sector,neg,neu,pos
technology,"Washington state to sue Comcast for $100M. A news release says the lawsuit accuses Comcast of ""engaging in a pattern of deceptive practices.""",,1935,8372,2016-08-01,TECH,0.31353387236595154,0.6663870811462402,0.020079046487808228
technology,Pokémon Go CEO Twitter account hacked – password was “nopass”,,1311,5618,2016-08-01,TECH,0.057245612144470215,0.9215880632400513,0.021166345104575157
technology,"Google Fiber stalls in Nashville in fight over utility poles. AT&amp;T, Comcast resist Nashville plan to speed Google Fiber construction.",,278,2491,2016-08-01,TECH,0.024837395176291466,0.9305152297019958,0.04464740678668022
gadgets,Review: Yi 4K Action Camera,,214,1149,2016-08-01,TECH,0.04409589245915413,0.8135296106338501,0.14237453043460846
technology,"""In its peak years, Nokia had 'accounted for 70% of Helsinki’s stock exchange market capital, 43% of corporate R&amp;D, 21% of total exports and 14% of corporate tax revenues.' For a country with only 5 million inhabitants, it was difficult to bounce back from that kind of an economic loss.""",[deleted],111,955,2016-08-01,TECH,0.37776634097099304,0.409099280834198,0.21313437819480896
technology,"Hackers create Safe Skies TSA master key from scratch, release designs",,52,659,2016-08-01,TECH,0.014887560158967972,0.9129731059074402,0.07213927060365677
technology,The EMV chip credit card transition in the US has been a disaster,,361,358,2016-08-01,TECH,0.010710284113883972,0.871913731098175,0.1173759326338768
technology,WhatsApp isn’t fully deleting its 'deleted' chats,,45,348,2016-08-01,TECH,0.03338521718978882,0.9176154136657715,0.04899940267205238
technology,Elon Musk sells his solar power company to his own electric car company,,42,182,2016-08-01,TECH,0.01763768680393696,0.9358681440353394,0.04649421200156212
technology,Donald Trump signs pledge to crack down on Internet porn,,147,167,2016-08-01,TECH,0.09839507937431335,0.8311325907707214,0.07047228515148163
technology,ISP: We're Not The Internet Piracy Police,,1113,6015,2016-08-02,TECH,0.23880869150161743,0.738777220249176,0.022414082661271095
technology,"No Matter Who Our Next President Is, They Won't Understand Technology",,520,4360,2016-08-02,TECH,0.42679208517074585,0.5347774624824524,0.03843042999505997
technology,Netflix Has More Subscribers Than Its Biggest Cable Competitors Combined,,280,3041,2016-08-02,TECH,0.04826517403125763,0.8941162824630737,0.05761856213212013
gadgets,Samsung Galaxy Note 7 out on 19th August,,802,1688,2016-08-02,TECH,0.027794385328888893,0.9221768975257874,0.05002874881029129
technology,Judge wipes out patent troll’s $625M verdict against Apple,,178,1665,2016-08-02,TECH,0.043166179209947586,0.8989492654800415,0.05788453295826912
technology,"Judge blasts FBI for bugging courthouse, throws out 200 hours of recordings",,61,1470,2016-08-02,TECH,0.489400714635849,0.4783695340156555,0.03222978860139847
gadgets,Alienware Aurora review: A lot of VR-ready desktop in a small package,,323,623,2016-08-02,TECH,0.03414357081055641,0.9330235719680786,0.03283286839723587
technology,America's Electronic Voting Machines Are Scarily Easy Targets,,47,486,2016-08-02,TECH,0.02006193995475769,0.8580543398857117,0.12188369035720825
technology,Your battery status is being used to track you online,,76,452,2016-08-02,TECH,0.027707356959581375,0.9474176168441772,0.024875061586499214
technology,A federal judge rules that the FBI violated the fourth amendment by recording more than 200 hours of conversation at the entrance to a court house.,,6,244,2016-08-02,TECH,0.7524241805076599,0.2250146120786667,0.02256125397980213
technology,Comcast Says It Wants to Charge Broadband Users More For Privacy,,1968,6883,2016-08-03,TECH,0.04462159425020218,0.8944320678710938,0.060946326702833176
technology,Bitcoin Sinks After Hackers Steal $65 Million From Exchange,,1961,5448,2016-08-03,TECH,0.019232822582125664,0.9189791679382324,0.06178806349635124
gadgets,Wild Charger Juices Up Your iPhone While It Floats in Mid-Air,,659,3515,2016-08-03,TECH,0.03285311162471771,0.8665666580200195,0.10058018565177917
technology,China Actually Built That Crazy Traffic-Straddling Bus,,240,1990,2016-08-03,TECH,0.03199110925197601,0.913962185382843,0.054046712815761566
technology,Now Jill Stein Thinks Wi-Fi Might Be Hurting Kids,,498,901,2016-08-03,TECH,0.8213380575180054,0.14229466021060944,0.036367300897836685
technology,Comcast: ISPs should be able to sell your Web history to advertisers,,48,370,2016-08-03,TECH,0.027329741045832634,0.926013171672821,0.04665711149573326
technology,Pennsylvania to Apply 6% “Netflix Tax”,,152,350,2016-08-03,TECH,0.02534751407802105,0.9167611002922058,0.057891327887773514
technology,The Republican Senator who intorduced the Cybersecurity Information and Sharing Act (CISA) last year is up for re-election in 2016,,25,333,2016-08-03,TECH,0.03224997967481613,0.9026514291763306,0.0650985836982727
technology,A $2 test for Zika detects the virus in saliva within 40 mins. Dye turns blue if virus present,,7,332,2016-08-03,TECH,0.04240472987294197,0.8957006931304932,0.061894506216049194
technology,Comcast: Consumers Are Harmed If We Don’t Get To Charge Extra For Privacy,,29,295,2016-08-03,TECH,0.22645430266857147,0.7476009726524353,0.025944724678993225
technology,"Japanese Olympic champion racks up $5,000 bill playing Pokémon Go in Brazil",,1088,5260,2016-08-04,TECH,0.03199896961450577,0.8923079967498779,0.07569298893213272
gadgets,Intel is recalling its fitness watches: It is important you stop using your watch and return it immediately,,549,3557,2016-08-04,TECH,0.064823217689991,0.911290168762207,0.023886663839221
technology,"Does dropping malicious USB sticks really work? Yes, worryingly well...",,443,1968,2016-08-04,TECH,0.04014571011066437,0.8999276161193848,0.059926606714725494
technology,Google slammed for removing Palestine from its maps,,420,957,2016-08-04,TECH,0.7516337037086487,0.22919577360153198,0.01917053386569023
gadgets,Basis recalls every Peak fitness tracker ever sold after some users sustain burns,,78,743,2016-08-04,TECH,0.023329829797148705,0.9036138653755188,0.07305626571178436
technology,The International Olympics Committe prohibits press from making GIFs,,80,342,2016-08-04,TECH,0.020836496725678444,0.9244755506515503,0.054687947034835815
technology,Copyright-lobby wants to ban illegal Downloads on OS-Level,,151,317,2016-08-04,TECH,0.284499853849411,0.686606764793396,0.02889338694512844
gadgets,This reversible Micro USB cable is impossible to plug in wrong,,91,283,2016-08-04,TECH,0.02948182448744774,0.9261558055877686,0.04436240717768669
technology,The next Google Maps update could show how bad the parking is,,21,246,2016-08-04,TECH,0.9514464139938354,0.038496389985084534,0.010057209990918636
technology,Facebook tweaks the News Feed to show you less clickbait,,36,232,2016-08-04,TECH,0.045831114053726196,0.9233807921409607,0.030788099393248558
technology,"Torrentz Shuts Down, Largest Torrent Meta-Search Engine Says Farewell",,2104,5925,2016-08-05,TECH,0.018277527764439583,0.9075438976287842,0.07417859882116318
technology,Sheriff Raids House to Find Anonymous Blogger Who Called Him Corrupt,,445,5128,2016-08-05,TECH,0.7500885128974915,0.22923006117343903,0.020681465044617653
technology,Man says Tesla Autopilot saved his life by driving him to the hospital,,765,4829,2016-08-05,TECH,0.014340110123157501,0.8207086324691772,0.16495127975940704
technology,"Louisiana Sheriff raids house of anonymous blogger who called him corrupt. This proves that in the USA, even at the local level internet anonymity is a thing of the past.",,277,2676,2016-08-05,TECH,0.5636008381843567,0.41644057631492615,0.019958587363362312
technology,Samsung caught using drawings of Apple Watch in its own smartwatch patent filing,,446,2156,2016-08-05,TECH,0.06742271035909653,0.8979652523994446,0.03461204096674919
gadgets,This is what Apple's alleged 'Lightning EarPods' will look like,,2452,2132,2016-08-05,TECH,0.02233322523534298,0.8822314739227295,0.09543529897928238
technology,Why Is The Copyright Office Lying To Protect The Cable Industry's Monopoly Stranglehold Over The Cable Box? | Techdirt,,63,1661,2016-08-05,TECH,0.040270645171403885,0.9322380423545837,0.027491267770528793
technology,Consumer Groups Slam Comcast's Plan to Charge Users for Privacy,,69,1658,2016-08-05,TECH,0.10191479325294495,0.8826162219047546,0.015468975529074669
technology,The Olympics committee just said we can't make GIFs of the games,,143,931,2016-08-05,TECH,0.1368214339017868,0.835371732711792,0.027806831523776054
technology,FTC to Crack Down on Paid Celebrity Posts That Aren’t Clear Ads,,34,664,2016-08-05,TECH,0.16467778384685516,0.8167222142219543,0.018599987030029297
technology,A bar owner in the UK has built a Faraday cage to stop customers using their phones,,3502,5175,2016-08-06,TECH,0.028996087610721588,0.8925023078918457,0.0785016342997551
technology,IBM's Watson correctly diagnoses woman after doctors were stumped,,767,5147,2016-08-06,TECH,0.026514146476984024,0.9304049015045166,0.043080881237983704
technology,Did Edward Snowden tweet out a dead man's switch?,,314,1688,2016-08-06,TECH,0.07831455767154694,0.8832172155380249,0.038468264043331146
technology,This Company Has Built a Profile on Every American Adult,,28,247,2016-08-06,TECH,0.016117488965392113,0.8359925150871277,0.14788997173309326
gadgets,Apple to rethink water pistol emoji change in iOS,,171,228,2016-08-06,TECH,0.04121236130595207,0.9200179576873779,0.03876965865492821
technology,The FBI's director said Friday the agency is collecting data to present next year in hopes of sparking a national conversation about law enforcement's increasing inability to access encrypted electronic devices,,44,198,2016-08-06,TECH,0.0260965283960104,0.8962998986244202,0.07760360091924667
technology,World's First Human Head Transplant Going Ahead,,33,111,2016-08-06,TECH,0.0099533312022686,0.7671892046928406,0.22285743057727814
technews,Comcast: Consumers Are Harmed If We Don’t Get To Charge Extra For Privacy,,3,109,2016-08-06,TECH,0.22645430266857147,0.7476009726524353,0.025944724678993225
technology,AI Saves Woman's Life By Identifying Her Disease When Other Methods (Humans) Failed,,13,105,2016-08-06,TECH,0.037135474383831024,0.8781414031982422,0.08472315222024918
technology,"Oxford team achieves a quantum logic gate with 99.9% precision, reaching the benchmark required to build a quantum computer",,15,82,2016-08-06,TECH,0.015193070285022259,0.36568766832351685,0.6191192865371704
technology,Facebook: Clickbait has no place in news feeds,,862,5609,2016-08-07,TECH,0.0554104819893837,0.9231927990913391,0.021396739408373833
technology,"Microsoft, Sony, and other companies still use illegal warranty-void-if-removed stickers",,368,4196,2016-08-07,TECH,0.35201460123062134,0.631571352481842,0.016414007171988487
technology,"As 3D printers break through, EU expands copyright to furniture, and extends term by a century",,493,2656,2016-08-07,TECH,0.03883052617311478,0.6838089823722839,0.2773604989051819
technology,Google blocking Windows 10 Mobile users from adding Google accounts to the mobile Outlook app,,263,1942,2016-08-07,TECH,0.03499360755085945,0.931450605392456,0.03355579450726509
gadgets,Corsair Lapdog vs. Razer Turret,,291,1766,2016-08-07,TECH,0.0520658940076828,0.9088557958602905,0.03907836601138115
technology,Julian Assange to Bill Maher: WikiLeaks ‘Working On’ Hacking Trump’s Tax Returns,,205,827,2016-08-07,TECH,0.02666483446955681,0.9261105060577393,0.04722463712096214
technology,Apple should stop selling four-year-old computers,,173,439,2016-08-07,TECH,0.6595659852027893,0.3146074712276459,0.025826573371887207
technology,Department of Justice Official Tells Hundred Federal Judges to Use Tor,,13,238,2016-08-07,TECH,0.08948571234941483,0.8872392177581787,0.02327508106827736
technology,"Edward Snowden Is Not Dead Despite Mysterious Tweets, Says Glenn Greenwald",,15,200,2016-08-07,TECH,0.058040350675582886,0.8890817165374756,0.05287789925932884
technology,"Ninjavideo uploader featured on Interpol's ""wanted"" criminals list",,4,155,2016-08-07,TECH,0.07377155870199203,0.8948272466659546,0.03140117600560188
technology,"Diamond glass is 800 times thinner than Gorilla glass and stronger than sapphire glass, and could become the new industry standard for mobile devices.",,909,4912,2016-08-08,TECH,0.008538726717233658,0.720573365688324,0.27088791131973267
technology,"Thermostats can now get infected with ransomware, because 2016",,1161,4659,2016-08-08,TECH,0.3908114433288574,0.5782057046890259,0.03098287433385849
gadgets,This VR gun uses haptic feedback to simulate real gunfire,,406,3357,2016-08-08,TECH,0.02408941462635994,0.9400022029876709,0.035908378660678864
technology,Walmart buys Jet.com for $3B in cash to fight Amazon,,603,2565,2016-08-08,TECH,0.034212544560432434,0.9129407405853271,0.05284672975540161
gadgets,Brixo is Lego with added electricity and sensors,,161,2382,2016-08-08,TECH,0.01436407957226038,0.7679861783981323,0.21764971315860748
technology,Hulu Bids Goodbye To Its Free Service,,485,1362,2016-08-08,TECH,0.045256540179252625,0.8147860169410706,0.1399574726819992
gadgets,'Quadrooter' security flaws said to affect over 900 million Android devices,,120,906,2016-08-08,TECH,0.05373034626245499,0.9100418090820312,0.03622783347964287
technology,China is using technology abandoned by the U.S. to build the nuclear plant of the future,,197,493,2016-08-08,TECH,0.012418262660503387,0.8716312646865845,0.11595049500465393
technology,"UK copyright extension on designed objects is “direct assault” on 3D printing. Industrial designs, like chairs and tables, now come with a copyright of 70+ years.",,43,472,2016-08-08,TECH,0.022513706237077713,0.9341970086097717,0.04328931123018265
technology,"Positive link between video games and academic performance, study suggests",,52,421,2016-08-08,TECH,0.013337337411940098,0.04186975210905075,0.9447929859161377
technology,"Ad board to Comcast: Stop claiming you have the “fastest Internet” -- Comcast relied on crowdsourced data from the Ookla Speedtest application. An ""award"" provided by Ookla to Comcast relied only on the top 10 percent of each ISP's download results",,1065,6338,2016-08-09,TECH,0.03870503604412079,0.9199187755584717,0.04137611761689186
technology,Researchers crack open unusually advanced malware that hid for 5 years,,915,5728,2016-08-09,TECH,0.28321537375450134,0.5914407968521118,0.12534384429454803
technology,Google killing Flash by having Chrome default to HTML5 by end of the year,,419,4403,2016-08-09,TECH,0.15106672048568726,0.8193303346633911,0.02960296906530857
gadgets,Rings that let you feel loved one's heartbeat,,1097,3989,2016-08-09,TECH,0.020079592242836952,0.9270537495613098,0.05286666750907898
technology,"The $47 Billion Network That’s Already Obsolete: FirstNet was envisioned as a way for police and firefighters to communicate with one another in the wake of 9/11. But four years later, it’s still not up and running.",,69,1215,2016-08-09,TECH,0.027584699913859367,0.9123247265815735,0.060090526938438416
technology,"Facebook will bypass web adblockers, but offer ad targeting opt-outs",,134,223,2016-08-09,TECH,0.07390093803405762,0.9050959944725037,0.02100302465260029
gadgets,"Samsung launches 15.36 TB SSD, only costs $10,000",,47,170,2016-08-09,TECH,0.02521389350295067,0.8873014450073242,0.0874846875667572
technology,"Internet trolls are even more hostile when they’re using their real names, a study finds",,44,169,2016-08-09,TECH,0.23332999646663666,0.7403422594070435,0.026327745988965034
technology,'Project Sauron' malware hidden for five years,,5,136,2016-08-09,TECH,0.06323143094778061,0.8948240876197815,0.041944459080696106
technology,AT&amp;T fined $7.7M over illegal phone charges,,10,125,2016-08-09,TECH,0.3782106041908264,0.5998902320861816,0.021899180486798286
technology,Adblock Plus says Facebook's decision to block ad blockers is 'anti-user',,3233,6626,2016-08-10,TECH,0.0638369619846344,0.910926103591919,0.025236951187253
gadgets,'World's largest' SSD revealed as Seagate unveils 60TB monster,,1481,5715,2016-08-10,TECH,0.0274109598249197,0.9048441052436829,0.06774495542049408
technology,FCC loses court battle to let cities build their own broadband,,960,5635,2016-08-10,TECH,0.26114779710769653,0.6264147162437439,0.11243743449449539
technology,"Windows 10's Secure ""Golden Key"" Boot: A backdoor, which Microsoft put in to secure boot because they decided to not let the user turn it off in certain devices, allows for secure boot to be disabled everywhere!",,247,1090,2016-08-10,TECH,0.021067162975668907,0.9272213578224182,0.051711492240428925
technology,Microsoft singlehandedly proves that golden backdoor keys are a terrible idea,,22,540,2016-08-10,TECH,0.3622249364852905,0.599336564540863,0.038438454270362854
technology,"AT&amp;T has been fined once again by the FCC, this time for helping drug dealers run a directory assistance scam on the company's own fixed-line phone customers",,29,378,2016-08-10,TECH,0.13976365327835083,0.8324292898178101,0.02780708484351635
technology,"In blow to muni broadband, FCC loses bid to overturn state laws. Major loss for Tom Wheeler in attempt to boost broadband competition.",,21,314,2016-08-10,TECH,0.5432382225990295,0.40553635358810425,0.0512254498898983
technology,Google Chrome will start blocking all Flash content next month,,47,261,2016-08-10,TECH,0.17092886567115784,0.8093020915985107,0.019769039005041122
technology,"Not sure where else to post: WARNING: Adobe's customer support ""screenshare"" software gives them full access. Support laughs at me when I point out the security risk.","*Edit: Upon further research, Bomgar appears to be a legitimate support service. But this experience made me uncomfortable with Adobe nonetheless.*

Sketchiest customer support experience ever.

[See the convo here.](http://imgur.com/a/e53Ah)

All I want to do is find out why my Adobe Encoder CC 2015.3 was reading a source file as having ""no audio"" but clearly it has audio.

Support proceeds to invite me to screenshare. I say okay, click their link to download some Adobe screenshare app. **Which proceeds to ask for full access to my entire computer despite being just told we were going to share screens in order to show this representative my issue.**

**The support rep laughed when I questioned this policy.**

Do not install this crap. I am now uncomfortable with my own computer, because of Adobe, because I don't know where this software installed itself, and appeared to self-destruct. It claims to have self-destructed upon close; the .dmg is deleted from my Chrome list (striked out).

No wonder Adobe has security issues.",71,238,2016-08-10,TECH,0.07785055041313171,0.8930761218070984,0.029073303565382957
technology,"Judge blasts DOJ’s refusal to explain stingray use in attempted murder case. Turns out not 1, but 2 cell-site simulators were deployed to find Oakland suspect.",,6,203,2016-08-10,TECH,0.058959756046533585,0.8881343007087708,0.05290597304701805
technology,It's been over a month since the Indian government shut down Internet access in Jammu and Kashmir,,1239,5353,2016-08-11,TECH,0.8701042532920837,0.11494366079568863,0.014952108263969421
technology,"The Telecommunications Act Of 1996 gave us shitty cell service, expensive cable",,456,3988,2016-08-11,TECH,0.01708708330988884,0.7898892760276794,0.1930236518383026
technology,"DEA regularly mines Americans' travel records to seize millions in cash. DEA has a network of airport ticket agents, bag handlers, others who feed it info on travelers so it can seize cash.",,258,3587,2016-08-11,TECH,0.08639763295650482,0.8922564387321472,0.02134590409696102
gadgets,This Robotic Smart Suitcase Rolls Along Next To You Autonomously,,477,3028,2016-08-11,TECH,0.0257817842066288,0.8951860070228577,0.07903227210044861
gadgets,"Have a smart lock? Yeah, it can probably be hacked",,702,2067,2016-08-11,TECH,0.012973019853234291,0.8150813579559326,0.17194561660289764
technology,Adblock Plus offers workaround to block Facebook ads again.,,150,986,2016-08-11,TECH,0.036749862134456635,0.9306957125663757,0.032554373145103455
technology,The Bandwidth Bottleneck That Is Throttling the Internet. Researchers are scrambling to repair and expand data pipes worldwide—and to keep the information revolution from grinding to a halt.,,66,742,2016-08-11,TECH,0.0516212061047554,0.8994314670562744,0.04894733801484108
technology,How the creator of the World Wide Web plans to reclaim it from Facebook and Google,,74,649,2016-08-11,TECH,0.034134943038225174,0.9415969252586365,0.024268168956041336
technology,"American broadband, what's wrong with you?",,84,240,2016-08-11,TECH,0.1376764476299286,0.821151614189148,0.04117199406027794
technology,Simple hack unlocks 100 million Volkswagen vehicles,,17,129,2016-08-11,TECH,0.011840094812214375,0.8930871486663818,0.09507275372743607
technology,"Adblock Plus bypasses Facebook's attempt to restrict ad blockers. ""It took only two days to find a workaround.""",,2223,8441,2016-08-12,TECH,0.052777308970689774,0.9063054919242859,0.04091713950037956
technology,"Hacker demonstrates how voting machines can be compromised - ""The voter doesn't even need to leave the booth to hack the machine. ""For $15 and in-depth knowledge of the card, you could hack the vote,"" Varner said.""",,1180,6192,2016-08-12,TECH,0.02402273565530777,0.9260334372520447,0.049943845719099045
technology,Hillary Clinton Won't Be the Broadband Savior You're Looking For,,359,1952,2016-08-12,TECH,0.028194628655910492,0.9015769958496094,0.07022831588983536
gadgets,LG is quadrupling down on the headphone jack,,737,1689,2016-08-12,TECH,0.03596034273505211,0.9324790835380554,0.03156062215566635
technology,"We need more high-speed internet, but politicians are blocking the way",,75,1213,2016-08-12,TECH,0.2660318613052368,0.6892595291137695,0.04470869526267052
gadgets,"Mom discovers security cameras hacked, kids' bedroom livestreamed",,287,932,2016-08-12,TECH,0.4945491552352905,0.4750884473323822,0.03036240115761757
technology,North Korea won't let Olympic athletes accept Galaxy S7 phones,,123,904,2016-08-12,TECH,0.032989613711833954,0.8104023337364197,0.15660810470581055
technology,"While the cable industry has been trying to imply it has cord cutting on the ropes, second quarter earnings reports paint a very different picture: pay TV sector lost 757,000 subcribers in the second quarter",,95,860,2016-08-12,TECH,0.9155744910240173,0.05649091303348541,0.027934610843658447
technology,"New ""Bionic"" Leaf Is Roughly 10 Times More Efficient Than Natural Photosynthesis",,29,279,2016-08-12,TECH,0.01319838222116232,0.8491629958152771,0.1376386433839798
technology,How I got tech support scammers infected with Locky,,24,219,2016-08-12,TECH,0.014764911495149136,0.8541365265846252,0.13109862804412842
technology,Facebook Facing Heavy Criticism After Removing Major Atheist Pages,,2612,6288,2016-08-13,TECH,0.9381274580955505,0.05080853030085564,0.011064008809626102
gadgets,MIT and Microsoft Research made a 'smart' tattoo that remotely controls your phone,,501,4684,2016-08-13,TECH,0.017262589186429977,0.9207403063774109,0.06199708953499794
technology,"As Apple offers $200k for iPhone vulnerabilities, Black Hat firm offers $500k",,229,3288,2016-08-13,TECH,0.013290941715240479,0.8763856887817383,0.11032336205244064
technology,Microsoft's 'Golden Key' Leak Illustrates Why Governments Should Stop Asking For Backdoors,,47,1400,2016-08-13,TECH,0.05532895773649216,0.8888506293296814,0.05582038685679436
technology,Appeals Court Says It's Perfectly Fine For The DOJ To Steal Kim Dotcom's Money Before Any Trial,,95,1028,2016-08-13,TECH,0.0570148229598999,0.8883547782897949,0.054630350321531296
gadgets,The iPhone 7 might not have stereo speakers after all,,574,765,2016-08-13,TECH,0.018401917070150375,0.926252543926239,0.05534550920128822
technology,Guccifer 2.0 doxes hundreds of House Democrats with massive document dump,,195,584,2016-08-13,TECH,0.052194979041814804,0.8964177966117859,0.051387183368206024
gadgets,HTC is reportedly building two versions of the midrange Desire 10,,63,448,2016-08-13,TECH,0.014248883351683617,0.9016855359077454,0.0840655267238617
gadgets,This robot butler is like your own personal R2-D2,,55,354,2016-08-13,TECH,0.015399279072880745,0.9170935750007629,0.06750717759132385
technology,Security experts reveal $40 device that would allow thieves to wirelessly unlock nearly every Volkswagen made since 1995,,25,240,2016-08-13,TECH,0.010472198016941547,0.814910888671875,0.17461687326431274
technology,"SpaceX succesfully launches another satellite, brings home another rocket",,889,6886,2016-08-14,TECH,0.014999506995081902,0.8468771576881409,0.1381233036518097
technology,Guy tricks Windows tech support scammers into installing ransomware,,61,1835,2016-08-14,TECH,0.019673539325594902,0.909353494644165,0.0709729716181755
technology,"Hack of Democrats Accounts Was Wider Than Believed, Officials Say",,116,799,2016-08-14,TECH,0.36955055594444275,0.4912976026535034,0.13915187120437622
technology,Tesla preps an extra long-range battery for its electric cars,,86,791,2016-08-14,TECH,0.023510584607720375,0.9236629605293274,0.05282651260495186
technology,"After hack, more data on Democrats hits the web",,69,350,2016-08-14,TECH,0.12387781590223312,0.8360430598258972,0.04007909074425697
technology,The Pirate Bay is the king of torrents once again (13th anniversary),,38,252,2016-08-14,TECH,0.03111226111650467,0.8874743580818176,0.08141334354877472
technology,[Updated] SpaceX is getting good at this: has hit four of five water landings,,15,221,2016-08-14,TECH,0.02002367191016674,0.8725458979606628,0.10743045061826706
