subreddit,title,selftext,num_comments,score,created_utc,stock/sector,neg,neu,pos
technology,Mozilla files legal challenge to find out how FBI cracked Tor Browser,,190,3614,2016-05-14,TECH,0.7256999015808105,0.25346994400024414,0.020830143243074417
technology,Analyst Uses NYPD's Open Data To Uncover Millions Of Dollars Of Bogus Parking Tickets,,101,2996,2016-05-14,TECH,0.023080823943018913,0.9182297587394714,0.05868946760892868
gadgets,Xbox One backward compatibility supports multi-disc games,,479,2534,2016-05-14,TECH,0.02065955474972725,0.9406645894050598,0.03867579624056816
technology,Hidden Microphones Exposed As Part of Government Surveillance Program In The Bay Area,,136,2279,2016-05-14,TECH,0.0277080237865448,0.9391148686408997,0.03317706286907196
technology,FBI Found To Be Harvesting Surreptitious Recordings Around Two Other California Courthouses,,22,947,2016-05-14,TECH,0.2447497844696045,0.731427013874054,0.023823164403438568
technology,"Sun’s Jonathan Schwartz at trial: Java was free, Android had no licensing problem - Schwartz parries attacks by Oracle's lawyer suggesting he was a terrible CEO.",,65,848,2016-05-14,TECH,0.6091897487640381,0.35739853978157043,0.033411722630262375
technology,Philly Cops Tried To Disguise An SUV With License Plate Readers As A Google Maps Vehicle,,38,317,2016-05-14,TECH,0.03141970932483673,0.9327244162559509,0.03585593402385712
technology,"Rumour: Microsoft to sell feature phone business to Foxconn, lay off 50% of Microsoft Mobile",,78,302,2016-05-14,TECH,0.021568452939391136,0.9392542839050293,0.03917723149061203
technology,"Romaina has the third fastest broadband in the world. Australia is at 47, after Tajikistan. - Who has the best internet in the world?",,101,261,2016-05-14,TECH,0.030981946736574173,0.8837023973464966,0.08531565219163895
technology,"Google Hiring Driverless Car Testers In Arizona: If you meet the requirements, you can earn $20 per hour to sit behind the wheel.",,760,5432,2016-05-15,TECH,0.028073638677597046,0.9264380931854248,0.04548827186226845
technology,"Pornhub said to be compromised, shell access available for $1,",,870,3287,2016-05-15,TECH,0.02652229741215706,0.943602442741394,0.02987528406083584
technology,How Elon Musk exposed billions in questionable Pentagon spending.,,193,3172,2016-05-15,TECH,0.570829451084137,0.4026682674884796,0.026502298191189766
technology,The FBI Can Neither Confirm Nor Deny Wiretapping Your Amazon Echo,,88,1095,2016-05-15,TECH,0.02649027854204178,0.9374409914016724,0.03606871888041496
gadgets,Xiaomi's new action camera combines the best of GoPro's Hero4 editions,,174,1006,2016-05-15,TECH,0.010126198641955853,0.7944014668464661,0.1954723596572876
technology,"Oracle v Google trial, which is based on the notion that APIs are copyrightable, hinges on a judge and jurors who don't have a firm grasp of FOSS philosophy",[deleted],92,863,2016-05-15,TECH,0.030351612716913223,0.921404242515564,0.048244163393974304
technology,British law enforcement beginning to use large-data methods to roll out facial recognition at large public events - seeking to identify people who are wanted for crimes.,,115,611,2016-05-15,TECH,0.06052571162581444,0.9185882806777954,0.020885955542325974
gadgets,"Nextbit Robin Smartphone Review: An ambitious newcomer that merges solid specs, unique design, and an attractive price tag.",,114,605,2016-05-15,TECH,0.008005134761333466,0.13694113492965698,0.855053722858429
technology,"Amazon Launches YouTube-Like ‘Video Direct’ Service, Allows All Creators To Monetize Their Videos",,32,478,2016-05-15,TECH,0.01861373893916607,0.9297541975975037,0.05163205415010452
technology,"BMW plans self-driving car launch by 2021: ""'Our goal is already clearly-defined - to be number one in autonomous driving', CEO Harald Krueger tells shareholders""",,75,362,2016-05-15,TECH,0.017378821969032288,0.8873125910758972,0.0953085646033287
technology,Pornhub wasn't compromised. Whoever paid $1000 for shell access was scammed. [Update],,870,5506,2016-05-16,TECH,0.030410941690206528,0.9440034031867981,0.02558562345802784
technology,Twitter to Stop Counting Photos and Links in 140-Character Limit,,743,5005,2016-05-16,TECH,0.07555543631315231,0.9016885757446289,0.022756000980734825
technology,"Microsoft is now auto scheduling the upgrade to Windows 10 on Windows 7 and 8.1, hoping that users won't notice and cancel it.",,1792,3831,2016-05-16,TECH,0.20516787469387054,0.7231315970420837,0.07170047610998154
technology,Policy Announcement: Domains which require readers to disable ad-blockers will now be automatically flaired with a warning message.,"**First, let me say thank you to all of the users who provided feedback in [this](https://www.reddit.com/r/technology/comments/4if65h/mod_announcement_were_considering_banning_all/) thread.**  The discussion here was very valuable to us, and we really appreciate not only the discussion that this generated, but also the visibility it provided to the issue.  Several tech blogs have picked up the story, and the reddit CEO himself even dropped by to give us encouragement.  People are watching, so we want to make sure we get this right.  
  
Following much discussion, the mod team on /r/technology has decided to take the following immediate actions to address the ad-blocking issue:  
  
-  We will maintain a list of domains which are not Ad-block friendly and will have these posts automatically flaired with the string ""AdBlock WARNING"" to reflect this. 
-  We will create a category filter on the sidebar which allows users to hide posts which receive this flair.  

-----------------------------
  
**THIS IS JUST THE FIRST STEP**  
  
We have many other ideas for how to address this in a manner which balances the democratic principles of reddit, with our desire to protect users from sites which may open them up to potentially malicious ad networks.  In the near future, we are going to explore ways to make the warnings more visible, interactive, and informative than simply a special flair.  Such actions may include:  
  
- Creating highly visible CSS to alert users when they are about to click on a domain which does not allow ad blockers.  
- Using automod to drop a comment in the thread, educating users on the safety considerations associated with some ad networks, and asking OP to consider finding an alternative source for the content.  
- Creating and maintaining a wiki page which will serve as a tracker for the issue, and which will contain a list of the flagged domains, as well as a list of safe browsing tips for visiting pages without an ad-blocker.   
- Creating a bot which will scrape these articles and post content in the comments. Preserving the discussion, but denying the  page views.    
 
---------------------------------
 
**What can I do to help?**  

- We will require user assistance to maintain a list of domains which will automatically receive the new flair.  Please message modmail with suspect domains, or report posts which are asking users to disable ad-block.  


**Why didn't you simply ban the domains in question?**  
  
- Banning domains outright is not a matter we take lightly. It is not a good ""first step.""  As moderators, it is not our job to play content police or to create editorial preference for one site over another - it is ultimately the job of our readers to make an informed decision about what constitutes high-quality content, and to vote according to their own individual set of values.  

- We plan to track the issue closely.  Right now there are only a handful of sites which are going this route, but there is a concern that a blanket ban on such sites could potentially remove a large amount of otherwise high-quality journalism from /r/technology, if this tactic becomes more popular.  Most ad networks are still very safe, and while a handful of domains have been caught serving malware in ads, it does not make sense to apply the same carrots and sticks to sites which do take the time to properly vet advertisers.  
  
- Many users still want to see and discuss the content.  Other users may not even be aware of the issue in the first place.  By going the route of informed consent, we not only preserve the ability to have discussions about a broad variety of topics from a broad variety of sources, but we also hope that making the issue visible will do more to spread awareness than would sweeping it under the rug.  

- This is not even our final form.  Starting with a conservative response to the issue gives us room to continue the discussion, and to adapt the policy moving forward.  If this ad tactic becomes more popular, we can enable the content filters by default, and require users to ""opt-in"" to see these posts.  And if the malware issue becomes a pandemic, we can easily throw a switch to ban the domains on a temporary or permanent basis, if it comes to that.  Rolling back a domain ban would be much more difficult than ratcheting up the response in deliberate steps.     
  
**When can we expect this to be fully implemented?**  

- Automod will be configured to flair posts from our (currently short) list of domains shortly after this announcement goes live.  
- We hope to have the content filter implemented within the next several days.  
- We hope to have visible CSS alerts implemented within the next week or two.  
- The Wiki tracking page will be generated over the next several days to weeks.  
  
**I have other questions or concerns.**
  
We will continue to solicit feedback on this topic.  Please leave a comment in this thread, or [Send us some modmail](https://www.reddit.com/message/compose?to=%2Fr%2Ftechnology) with your thoughts.  
  
------------------------------------------
  
Edit:  
- New Wiki is available [here](https://www.reddit.com/r/technology/wiki/index).  
- [Here](https://www.reddit.com/r/technology/comments/4jnyzw/test_post_please_ignore/) is what the new warning style will look like.",136,3524,2016-05-16,TECH,0.060261230915784836,0.9158450961112976,0.023893678560853004
technology,"Lack of Online Privacy Has Chilling Effect, U.S. Department of Commerce Says - Breaches &amp; corporate data collection have stopped 45% of Americans from buying and saying stuff online.",,190,3377,2016-05-16,TECH,0.8725973963737488,0.1130140945315361,0.01438854355365038
technology,"Indefinite prison for suspect who won’t decrypt hard drives, feds say",,941,3366,2016-05-16,TECH,0.0503082275390625,0.9159488081932068,0.03374294936656952
gadgets,"Raspberry Pi Zero gains camera support, keeps the £4 price",,256,2630,2016-05-16,TECH,0.028499014675617218,0.4106227159500122,0.5608782172203064
technology,"The ISS Just Completed Its 100,000th Orbit",,79,2590,2016-05-16,TECH,0.02375704050064087,0.9135479927062988,0.0626949816942215
technology,Warren Buffett Buys $1 Billion Stake in Apple,,383,2385,2016-05-16,TECH,0.01781327649950981,0.9325808882713318,0.0496058464050293
technology,Never 10: Prevent Microsoft from auto-updating your computer to Windows 10.,,656,2107,2016-05-16,TECH,0.04907051846385002,0.9119235873222351,0.039005957543849945
technology,IBM's optical storage is 50 times faster than flash and is now cheaper than RAM.,,1339,6848,2016-05-17,TECH,0.011135353706777096,0.6595422029495239,0.32932236790657043
technology,Elon Musk apologizes for Tesla workers paid just $5 an hour by subcontractor.,,899,5007,2016-05-17,TECH,0.07979417592287064,0.8799599409103394,0.04024585336446762
gadgets,"Lenovo fragments Moto G into three models, because it has no idea what we want",,567,1943,2016-05-17,TECH,0.02120836265385151,0.917733371257782,0.061058301478624344
technology,"The copyright industry wants to eliminate the counter-notice process that people can use to fight DMCA takedown claims. Instead they want a “take down, stay down” system where website owners have to police user-uploaded content and proactively remove any copyrighted material.",,61,558,2016-05-17,TECH,0.0766185000538826,0.9048041105270386,0.018577372655272484
technology,Firefox tops Microsoft browser market share for first time while Chrome remains king with over 60% market share.,,216,532,2016-05-17,TECH,0.018929224461317062,0.5978286266326904,0.3832421600818634
gadgets,AirBar Makes Almost Any Laptop Screen a Touchscreen,,66,428,2016-05-17,TECH,0.02359721250832081,0.9247475862503052,0.05165526643395424
technology,Groundbreaking gadget claims to fit in your ear and translate foreign languages in real-time,,92,390,2016-05-17,TECH,0.014507749117910862,0.8690478801727295,0.11644440144300461
technology,"Windows 7 ""patch rollup"" will take the endless reboots out of installing by combining five years of updates into a single patch",,56,345,2016-05-17,TECH,0.03266209736466408,0.9071747660636902,0.06016312912106514
technology,IBM social media team took over r/IBM subreddit and is censoring/monitoring reddit.,,44,305,2016-05-17,TECH,0.035254281014204025,0.9064111709594727,0.05833454802632332
technology,"A Host of Soon-to-be-Expired Patents are Set to Revolutionize 3D Printing. As this occurs, it will bring on a new era in 3D printing. Machinery and material costs will plummet, and the quality of prints will increase.",,38,284,2016-05-17,TECH,0.03731803596019745,0.8503891825675964,0.1122928112745285
technology,California wants to own copyrights on everything - “Imagine local officials having the power to issue a … takedown notice of YouTube videos of city council meetings simply because they did not like them.”,,445,5299,2016-05-18,TECH,0.04178893193602562,0.9349651336669922,0.023245949298143387
technology,Microsoft ends Windows 7 updating pain with massive patch,,1626,4663,2016-05-18,TECH,0.826525092124939,0.09072747081518173,0.08274738490581512
technology,Computer scientists have developed a new method for producing truly random numbers.,,736,3699,2016-05-18,TECH,0.015941938385367393,0.8636284470558167,0.12042959779500961
technology,"Filmmakers Ask ""Pirate"" to Take Polygraph, Backtrack When He Agrees",,494,3675,2016-05-18,TECH,0.03964407742023468,0.9180682301521301,0.04228765890002251
gadgets,Google's new gigapixel camera captures every paint stroke in famous artwork,,283,3123,2016-05-18,TECH,0.01979278214275837,0.9299633502960205,0.05024387687444687
technology,Nokia to start making Android-based smartphones,,319,2672,2016-05-18,TECH,0.02074703387916088,0.911616325378418,0.06763661652803421
technology,Netflix launches Fast.com to show how fast (or slow) your Internet connection really is,,353,2441,2016-05-18,TECH,0.02005213126540184,0.9276980757713318,0.05224977061152458
technology,"Fun Fact: Want a Windows 8 or 10 ISO? Visit the Microsoft page on a Linux system and you can grab the ISO. Visiting on a Windows machine forces you to download their ""Update Tool""",,126,1345,2016-05-18,TECH,0.029257144778966904,0.9346016645431519,0.03614121675491333
technology,Copyright Holders Dominate Closed-Door DMCA Hearings,,10,459,2016-05-18,TECH,0.04390856996178627,0.9272404313087463,0.0288509801030159
technology,"Microsoft now automatically schedules a date and time to update your PC to Windows 10. If you don't want the software update or if you want to change the installation date, you have to take deliberate action: manually click a link in the message, then choose to reschedule it or cancel it altogether.",,188,376,2016-05-18,TECH,0.26315099000930786,0.7217268347740173,0.015122201293706894
gadgets,Chromebooks outsold Macs for the first time in the US,,1796,5233,2016-05-19,TECH,0.024558495730161667,0.8971468806266785,0.07829458266496658
technology,"U.S. Court of Appeals back Snowden, Calls NSA's Metadata Collection Program ""Unlawful"".",,349,4616,2016-05-19,TECH,0.3719198703765869,0.5753905773162842,0.05268953740596771
technology,"Robin Hood hacker donates $11,000 of stolen Bitcoin to help fight ISIS",,883,4517,2016-05-19,TECH,0.02420891262590885,0.8457625508308411,0.13002854585647583
gadgets,Fitbit is buying Coin so it can make a fitness tracker that pays for things,[deleted],501,2928,2016-05-19,TECH,0.027921274304389954,0.9171121120452881,0.05496663227677345
technology,"Charter Mega-Merger Just Created a 'Price-Gouging' Monster | ""Charter will need to hike prices to pay down the nearly $27 billion in new debt it took on to complete its merger. That’s a burden that amounts to more than $1,000 per average Charter customer.""",,174,1022,2016-05-19,TECH,0.024973049759864807,0.8588118553161621,0.11621513217687607
technology,"Rochester Police Used A $200,000 Stingray To Track Gang Members",,52,556,2016-05-19,TECH,0.1327713131904602,0.8494543433189392,0.017774350941181183
technology,"Netflix launches Fast.com, a dead simple way to test your Internet speed",,99,535,2016-05-19,TECH,0.022905515506863594,0.932592511177063,0.044501934200525284
technology,Chromebooks outsold Macs for the first time in the US,,153,410,2016-05-19,TECH,0.024558495730161667,0.8971468806266785,0.07829458266496658
technology,Remember the device that would kill nuisance TVs by flashing every power-off remote command? Somebody built that concept for drone copters.,,80,406,2016-05-19,TECH,0.03094024397432804,0.9233177900314331,0.0457419715821743
technology,Government Argues That Indefinite Solitary Confinement Perfectly Acceptable Punishment For Failing To Decrypt Devices,,52,342,2016-05-19,TECH,0.09521963447332382,0.830730140209198,0.07405027002096176
technology,"Fox dowloaded a game clip from YouTube, used it in Family Guy and DCMA'd the original.",,3034,9204,2016-05-20,TECH,0.06831689178943634,0.9022266864776611,0.02945639193058014
technology,Google Chrome To Disallow Backspace As a 'Back' Button,,3089,6257,2016-05-20,TECH,0.059645675122737885,0.8950090408325195,0.04534530267119408
gadgets,Dell's 43 inch multi client monitor,,650,3508,2016-05-20,TECH,0.009911180473864079,0.8620600700378418,0.1280287206172943
gadgets,US Navy to arm its submarines with 'Blackwing' spy drones,,147,1590,2016-05-20,TECH,0.41474756598472595,0.5568748712539673,0.028377609327435493
technology,"Developer of anonymous Tor software dodges FBI, leaves US",,108,585,2016-05-20,TECH,0.5693211555480957,0.40193718671798706,0.02874162420630455
technology,Trans Pacific Partnership makes it “quite likely” that Canadians’ confidential data would be subject to US Patriot Act:,,40,581,2016-05-20,TECH,0.15164141356945038,0.8094193339347839,0.03893925994634628
technology,The TSA is failing spectacularly at cybersecurity,,42,475,2016-05-20,TECH,0.02884126827120781,0.9222961068153381,0.04886254295706749
gadgets,"You can't take photos with this camera, it shows you strangers' instead",,103,473,2016-05-20,TECH,0.05818544328212738,0.9164425134658813,0.025372087955474854
technology,People are turning on ad blockers because of data-consuming ad tech,,67,432,2016-05-20,TECH,0.12266848981380463,0.8573172688484192,0.020014150068163872
technology,"First Ever 100% Edible Six-Pack Ring Feeds Marine Animals Instead of Killing Them | The Edible Six Pack Ring is made from byproducts of the brewing process such as wheat and barley, making it the first 100 percent biodegradable, compostable and edible packaging implemented in the beer industry.",,24,333,2016-05-20,TECH,0.01490175910294056,0.923433780670166,0.06166448816657066
technology,Facebook Admits Its Trending Section Includes Topics Not Actually Trending on Facebook,,914,6376,2016-05-21,TECH,0.056820571422576904,0.9249367117881775,0.018242670223116875
technology,Startup To Create Man-Made Meteor Shower For 2020 Olympics,,642,4145,2016-05-21,TECH,0.01641242392361164,0.8931687474250793,0.09041880816221237
technology,Motorola's legendary RAZR flip phone is making a comeback,,548,2650,2016-05-21,TECH,0.016458408907055855,0.8392361998558044,0.14430537819862366
gadgets,Google's smart watch with radar for gesture control,,126,1464,2016-05-21,TECH,0.0211543757468462,0.9276678562164307,0.051177822053432465
technology,"Judge Changes Mind, Says FBI Doesn’t Have to Reveal Tor Browser Hack",,70,1220,2016-05-21,TECH,0.1640779674053192,0.8046733736991882,0.03124864771962166
gadgets,Motorola's legendary RAZR flip phone is making a comeback,,97,379,2016-05-21,TECH,0.016458408907055855,0.8392361998558044,0.14430537819862366
technology,Court Says Google Doesn't Have A First Amendment Right To Drop A Site From Its Search Results,,37,335,2016-05-21,TECH,0.49634718894958496,0.47388729453086853,0.0297655388712883
technology,Electricity from seawater: New method efficiently produces hydrogen peroxide for fuel cells,,23,325,2016-05-21,TECH,0.008735512383282185,0.6735625863075256,0.31770190596580505
gadgets,Philips will launch a $400 Ultra HD Blu-ray player next month,,219,307,2016-05-21,TECH,0.008879351429641247,0.8129352927207947,0.17818531394004822
technology,Microsoft's Windows 10 upgrades are getting even more sneaky-pushy,,155,272,2016-05-21,TECH,0.030688686296343803,0.4386310875415802,0.5306801795959473
technology,"Children of Striking Verizon Workers Join Picket Line': Despite $1.5 billion in monthly profits and a record $39 billion in profits over the last three years, Verizon is trying to force concessions that would devastate families and kill good jobs,""",,1594,5443,2016-05-22,TECH,0.5924493074417114,0.34800031781196594,0.059550363570451736
gadgets,Wristband that measures alcohol levels wins US competition,,596,4689,2016-05-22,TECH,0.03176509961485863,0.8369396328926086,0.131295308470726
technology,Google makes more money from iPhone users than Android users,[deleted],349,3178,2016-05-22,TECH,0.03327986225485802,0.9421514272689819,0.024568723514676094
technology,"How the Pentagon punished NSA whistleblowers - Long before Edward Snowden went public, John Crane was a top Pentagon official fighting to protect NSA whistleblowers. Instead their lives were ruined – and so was his",,74,2095,2016-05-22,TECH,0.07294032722711563,0.8865947127342224,0.040465012192726135
technology,Student Who Found Flaws in Police Communications Protocol Gets Prison Sentence,,123,754,2016-05-22,TECH,0.7211208343505859,0.20939674973487854,0.06948242336511612
technology,"It's Not ‘Malware’ When We Have a Warrant, FBI Says",,60,430,2016-05-22,TECH,0.1262878030538559,0.8152139186859131,0.058498285710811615
gadgets,"NVIDIA GeForce GTX 1080 video review: Behold, the GPU king",,229,428,2016-05-22,TECH,0.022565070539712906,0.911961555480957,0.06547335535287857
technology,University Study Discovers Fitbit’s Inaccurate Heart Rate Display which on Average is off by Nearly 20 BPM,,44,338,2016-05-22,TECH,0.030124979093670845,0.8425168395042419,0.12735821306705475
technology,Snowden calls for whistleblower shield after claims by new Pentagon source,,8,329,2016-05-22,TECH,0.02378586120903492,0.9149031639099121,0.06131097301840782
technology,FYI: Reddit now rehosts all images that are posted as direct image links from Imgur.,"I tried searching and didn't see anything calling this out, but I think it's worth calling attention to.

I noticed this browsing some NSFW content when I stumbled across a user's post history that contained some deleted submissions.  The posts show as being posted by **[deleted]**, and when I click on the submission link I am taken to the generic Imgur link for a deleted image: http://i.imgur.com/removed.png  However, when I click on ""Full Comments (x)"" I see the image previewed in the comments because it is rehosted on reddituploads.com  I don't want to link to the exact example I stumbled upon because it's obvious this particular user no longer wants those images on the internet, but [here](https://www.reddit.com/r/nsfw/comments/43nix2/yulia_pilushka/) is a random example I found on /r/nsfw.  Notice it shows as submitted by **[deleted]** and when you click the content link you are taken to the ""Image has been deleted"" page on Imgur, however you still see the original image at the top of the comments because it is rehosted on reddituploads.

I thought this is worth calling attention to for users that may post some naughty pictures of themselves they later want removed as they will now need to contact Reddit to remove the pictures in addition to deleting them from Imgur.  Especially since I am not aware of any way to remove the content from Reddituploads yourself.",37,301,2016-05-22,TECH,0.21203696727752686,0.7663466334342957,0.02161635458469391
technology,"The Federal Bureau of Investigation (FBI) is attempting to suppress information about a massive database which contains fingerprints, palm prints, iris, voice, and face scans, as well as other biometric data, of millions of Americans.",,1726,7434,2016-05-23,TECH,0.0436166487634182,0.9348812103271484,0.02150213159620762
technology,The Electric Car Revolution Is Finally Starting,,1138,3470,2016-05-23,TECH,0.013854488730430603,0.7823245525360107,0.20382097363471985
gadgets,"Dell's 43-inch, 4K monitor supports four clients on one screen",,431,2992,2016-05-23,TECH,0.011578143574297428,0.9223790764808655,0.0660427138209343
technology,"Thousands Beg FCC for Net Neutrality Crackdown. Consumers vent to regulators about slow Internet, high prices, and data caps.",,124,2930,2016-05-23,TECH,0.8685314655303955,0.112552709877491,0.018915772438049316
technology,Revealed: How copyright law is being misused to remove material from the internet.,,29,957,2016-05-23,TECH,0.5789093971252441,0.40363529324531555,0.01745528168976307
gadgets,"Inside Project Ara, Google's Lego-like plan to disrupt the smartphone",,79,567,2016-05-23,TECH,0.02375759743154049,0.9156541228294373,0.060588207095861435
technology,"As ISPs Push Harder On Usage Caps, House Pushes Bill Preventing The FCC From Doing Anything About It",,35,450,2016-05-23,TECH,0.16484898328781128,0.7071703672409058,0.12798072397708893
technology,"Lenovo is now using rootkit-like techniques to install their software on CLEAN Windows installs, by having the BIOS overwrite windows system files on bootup.",,65,432,2016-05-23,TECH,0.03615391254425049,0.9260690212249756,0.0377771332859993
