subreddit,title,selftext,num_comments,score,created_utc,stock/sector,neg,neu,pos
technology,"Reddit, Mozilla, Vimeo and 22 state attorneys general fight to save net neutrality today",,1621,73258,2019-02-01,TECH,0.028020638972520828,0.9167439937591553,0.05523541569709778
gadgets,Juul Labs hires former Apple employee to lead the fight against counterfeits,,734,10151,2019-02-01,TECH,0.0688118264079094,0.8882243037223816,0.04296388477087021
technology,FCC struggles to convince judge that broadband isn’t “telecommunications”,,117,1500,2019-02-01,TECH,0.6009016036987305,0.3722115457057953,0.026886817067861557
technology,"Firefighters join Mozilla in net neutrality fight, citing 'public safety",,60,1290,2019-02-01,TECH,0.0778115913271904,0.8634781241416931,0.058710288256406784
technews,Net neutrality heads to court today. Here’s what to expect.,,108,738,2019-02-01,TECH,0.030831368640065193,0.9369938373565674,0.03217480331659317
technews,Forget everything you know about 3D printing — the ‘replicator’ is here,,66,737,2019-02-01,TECH,0.036803990602493286,0.9359878897666931,0.027208112180233
technews,Customers Overpaying £800 Million for Unused Mobile Phone Data,[deleted],59,600,2019-02-01,TECH,0.2149915099143982,0.7616392374038696,0.023369282484054565
technology,Snopes pulls out of its fact-checking partnership with Facebook,,81,540,2019-02-01,TECH,0.033003948628902435,0.9246851801872253,0.042310912162065506
technews,NYC’s new driver wage law means the days of cheap Uber rides are over,,57,232,2019-02-01,TECH,0.029763976112008095,0.8110112547874451,0.15922482311725616
gadgets,A 49-inch ultrawide monitor is... a little much...,,106,226,2019-02-01,TECH,0.029705243185162544,0.8636058568954468,0.10668884217739105
technology,Major DNA testing company sharing genetic data with the FBI,,1872,29849,2019-02-02,TECH,0.020606447011232376,0.906514048576355,0.07287950068712234
technology,Terabytes of Enron data have quietly gone missing from the Department of Energy,,493,20802,2019-02-02,TECH,0.7388140559196472,0.23553723096847534,0.025648659095168114
technology,Samsung ditches plastic packaging for 'sustainable materials',,384,16700,2019-02-02,TECH,0.01867632381618023,0.900960385799408,0.08036329597234726
technology,"FCC didn’t have the right to repeal net neutrality, court case argues",,213,9027,2019-02-02,TECH,0.6775527000427246,0.2814122438430786,0.04103511944413185
technology,FBI charges second Apple employee with stealing autonomous car secrets,,94,2113,2019-02-02,TECH,0.8888684511184692,0.0908096507191658,0.020321937277913094
technews,NASA’s Hubble Captures Stunning Image Of New Dwarf Galaxy In Our Cosmic Backyard,,82,1717,2019-02-02,TECH,0.010591682977974415,0.7933379411697388,0.19607031345367432
technology,Unsecured MongoDB databases expose Kremlin's backdoor into Russian businesses,,86,1668,2019-02-02,TECH,0.03548591583967209,0.9218890070915222,0.042625073343515396
technology,"With 'Nothing Less Than Fate of the Internet' at Stake, Federal Court Told Why FCC's Attack on Net Neutrality So Dangerous: ""Without protecting net neutrality,"" broadband providers ""will control the internet experiences of everyone. And that cannot be what happens.""",,89,1546,2019-02-02,TECH,0.17946550250053406,0.7940893769264221,0.026445066556334496
technology,"Energizer says it’s making phones with pop-up cameras, 18,000mAh batteries, and foldable displays",,128,377,2019-02-02,TECH,0.01413736492395401,0.8753525018692017,0.11051014810800552
technology,Digital exchange loses $137 million as founder takes passwords to the grave,,106,277,2019-02-02,TECH,0.10758029669523239,0.8672245740890503,0.02519514411687851
technology,The 'Right to Repair' Movement Is Gaining Ground and Could Hit Manufacturers Hard - The EU and at least 18 U.S. states are considering proposals that address the impact of planned obsolescence by making household goods sturdier and easier to mend.,,901,26325,2019-02-03,TECH,0.138133704662323,0.762863039970398,0.09900331497192383
technology,San Francisco Could Be First to Ban Facial Recognition Tech,,693,23497,2019-02-03,TECH,0.09983068704605103,0.8664460182189941,0.03372330963611603
technology,Chinese bank’s software chief jailed after finding way to withdraw US$1m in ‘free’ cash from ATMs,,304,6090,2019-02-03,TECH,0.017718883231282234,0.8698111772537231,0.11246994137763977
technology,"Ethical Hacker Exposes Magyar Telekom Vulnerabilities, Faces 8 Years in Jail",,114,1752,2019-02-03,TECH,0.49088993668556213,0.4817546010017395,0.027355395257472992
technews,Digital exchange loses $137 million as founder takes passwords to the grave,,111,1075,2019-02-03,TECH,0.10758029669523239,0.8672245740890503,0.02519514411687851
technology,The infrastructural humiliation of America,,182,679,2019-02-03,TECH,0.05163565278053284,0.9020337462425232,0.04633058235049248
technology,Target’s app changes its prices on certain items depending on if you are inside or outside of the store.,,57,424,2019-02-03,TECH,0.038779065012931824,0.9381210207939148,0.023099903017282486
technology,Report: Attorneys General in Six States Are Now Investigating Facebook's Data Practices,,4,257,2019-02-03,TECH,0.8363964557647705,0.1485280841588974,0.015075480565428734
technology,"How Silicon Valley Puts the ‘Con’ in Consent - If no one reads the terms and conditions, how can they continue to be the legal backbone of the internet?",,14,124,2019-02-03,TECH,0.23686687648296356,0.7300676703453064,0.03306544944643974
technology,59% of U.S. consumers surveyed have cut the cable TV cord,,35,104,2019-02-03,TECH,0.9579289555549622,0.03349083662033081,0.008580168709158897
technology,Verizon Super Bowl ads honor California firefighters after throttling their data speeds,,834,23881,2019-02-04,TECH,0.026331566274166107,0.9176991581916809,0.05596930533647537
gadgets,"Microsoft preparing to bring Xbox Live to iOS, Android, and Nintendo Switch",,1117,11755,2019-02-04,TECH,0.015905803069472313,0.9015561938285828,0.08253799378871918
technology,Russian spam accounts are still a big problem for Reddit -- At least 89 subs have been targeted by Russian propaganda.,,473,3422,2019-02-04,TECH,0.49992525577545166,0.4493493437767029,0.050725437700748444
technology,"If Software Is Funded from a Public Source, Its Code Should Be Open Source",,93,1341,2019-02-04,TECH,0.028369788080453873,0.9454856514930725,0.026144562289118767
technews,Firefox 66 to block automatically playing audible video and audio,,53,1256,2019-02-04,TECH,0.0360209085047245,0.9368448257446289,0.027134303003549576
technology,Ex-FCC counselor says Verizon 'abdicated' its public safety role in California fires,,38,1129,2019-02-04,TECH,0.028293244540691376,0.932798445224762,0.03890826925635338
technews,Koenigsegg aims to build a 'CO2 neutral' combustion supercar,,68,951,2019-02-04,TECH,0.01566198095679283,0.8985534906387329,0.08578453212976456
technology,Ajit Pai loses in court—judges overturn gutting of tribal broadband program,,22,686,2019-02-04,TECH,0.038095008581876755,0.9218114018440247,0.040093567222356796
technology,"Apple just endorsed AT&amp;T’s fake 5G E network - New networking standard, same old scam",,49,276,2019-02-04,TECH,0.018920890986919403,0.9319345951080322,0.049144499003887177
technology,Ex-FCC counselor says Mozilla suit could lead to reinstatement of Obama-era net neutrality rules,,9,263,2019-02-04,TECH,0.031063634902238846,0.9163620471954346,0.052574362605810165
technology,"Firefox taking a hard line against noisy video, banning it from autoplaying",,1376,46030,2019-02-05,TECH,0.14166267216205597,0.8338890075683594,0.024448296055197716
technology,Google has quietly dropped ban on personally identifiable web tracking.,,509,10324,2019-02-05,TECH,0.7888816595077515,0.1850084811449051,0.026109863072633743
technology,Apple could pay a reward to the 14-year-old boy who found the FaceTime snooping bug,,513,9665,2019-02-05,TECH,0.028572140261530876,0.9075095653533936,0.06391828507184982
technology,"House Democrats tell Ajit Pai: Stop screwing over the public - Pai's FCC is too secretive and too beholden to corporations, Democrats say.",,165,3492,2019-02-05,TECH,0.1287381798028946,0.8345421552658081,0.03671968728303909
technews,Ajit Pai loses in court—judges overturn gutting of tribal broadband program,,80,3108,2019-02-05,TECH,0.038095008581876755,0.9218114018440247,0.040093567222356796
gadgets,Samsung Galaxy Sport leak shows a bezel-less smartwatch,,379,2761,2019-02-05,TECH,0.03706537187099457,0.9222907423973083,0.040643904358148575
technology,Amazon has finally admitted to investors that it has a counterfeit problem,,89,496,2019-02-05,TECH,0.27568259835243225,0.633842408657074,0.09047502279281616
technology,Court tells Ajit Pai he can’t take subsidies away from Tribal residents,,12,465,2019-02-05,TECH,0.13646498322486877,0.8258030414581299,0.03773197904229164
technology,Facebook bans 22 more pages linked to Alex Jones.,,123,252,2019-02-05,TECH,0.04999881982803345,0.9238751530647278,0.026126043871045113
technology,"To protect users’ privacy, iOS 12.2 will limit Web apps’ access to iPhone’s sensors",,8,113,2019-02-05,TECH,0.0515516959130764,0.923156201839447,0.025292128324508667
technology,"Dear Mr Zuckerberg: the problem isn't the internet, it's Facebook - ‘Driven by a set of ideals and some clever code, you built a money machine that has accumulated remarkable influence’",,1281,26044,2019-02-06,TECH,0.016189932823181152,0.8700441122055054,0.11376591771841049
gadgets,New hack can steal your Mac's passwords,,698,6492,2019-02-06,TECH,0.04204345867037773,0.916735053062439,0.0412214957177639
technews,Chinese satellite captures stunning backside image of the Moon with Earth,,248,2353,2019-02-06,TECH,0.012070641852915287,0.8410785794258118,0.1468508541584015
technology,NYPD demands that Google's Waze app stop revealing DWI checkpoints,,422,2317,2019-02-06,TECH,0.04555607959628105,0.9092562198638916,0.045187659561634064
technews,House Democrats tell Ajit Pai: Stop screwing over the public,,82,1674,2019-02-06,TECH,0.20757558941841125,0.7488884329795837,0.0435359850525856
technology,Apple Is Removing 'Do Not Track' From Safari,,104,942,2019-02-06,TECH,0.12946797907352448,0.8380215764045715,0.03251044079661369
technology,Apple to pay 10 years of back taxes to France | The Guardian,,52,740,2019-02-06,TECH,0.037836410105228424,0.9045560956001282,0.057607538998126984
gadgets,Audio-Technica ATH-CKR7TW true wireless headphones review,,145,523,2019-02-06,TECH,0.018361233174800873,0.9267880320549011,0.0548507459461689
technology,NYPD To Google: Stop Revealing Location Of DWI Checkpoints,,163,447,2019-02-06,TECH,0.054605841636657715,0.9121872186660767,0.033206865191459656
technology,"Reddit, Banned in China, Is Reportedly Set to Land $150 Million Investment From a Chinese Censorship Powerhouse",[deleted],133,431,2019-02-06,TECH,0.1457773745059967,0.7277897596359253,0.12643294036388397
technology,Facebook ordered to stop combining WhatsApp and Instagram data without consent in Germany,,1227,33239,2019-02-07,TECH,0.38732555508613586,0.5943902134895325,0.018284225836396217
technology,Jeff Bezos says National Enquirer is threatening to publish his nude photos,,2592,28386,2019-02-07,TECH,0.040702108293771744,0.9234724044799805,0.035825517028570175
technology,Cops Insist Waze Users Stop Snitching on DWI Checkpoints,,2776,23468,2019-02-07,TECH,0.05080718919634819,0.9091278314590454,0.04006495326757431
gadgets,Galaxy S10 photo leak shows Samsung wireless Galaxy Buds.,,1363,8666,2019-02-07,TECH,0.02108336053788662,0.9223524928092957,0.05656411126255989
technology,Mozilla exec calls on Congress to restore 2015 net neutrality protections,,99,2362,2019-02-07,TECH,0.03226509317755699,0.9075830578804016,0.060151804238557816
technews,Big Telecom Sold Highly Sensitive Customer GPS Data Typically Used for 911 Calls,,24,716,2019-02-07,TECH,0.02679099142551422,0.9346461296081543,0.03856288641691208
technews,Motorola’s 2019 cheap smartphone lineup includes a 5000mAh battery option,,45,317,2019-02-07,TECH,0.009682880714535713,0.831593930721283,0.15872319042682648
technology,Internet users won’t be fooled by fake net neutrality legislation pushed by telecom shills in Congress,,101,273,2019-02-07,TECH,0.262973427772522,0.6595131158828735,0.07751345634460449
technews,Many popular iPhone apps secretly track your screen without asking,,26,175,2019-02-07,TECH,0.02155933901667595,0.9405648112297058,0.03787585347890854
technology,Raspberry Pi opens its first dedicated retail store,,10,143,2019-02-07,TECH,0.015563009306788445,0.8138519525527954,0.17058499157428741
technology,Trump is reportedly expected to ban Chinese telecommunication equipment from US networks,,3143,37862,2019-02-08,TECH,0.03489292785525322,0.9084227085113525,0.05668429657816887
gadgets,AMD Radeon VII 16GB Review: A Surprise Attack on GeForce RTX 2080,,944,4348,2019-02-08,TECH,0.028051843866705894,0.905569314956665,0.06637886166572571
technology,reddit is on track to receiving hundreds of millions in funding from Chinese WeChat company,,414,4029,2019-02-08,TECH,0.014244871214032173,0.8452106714248657,0.1405443698167801
technology,Texas Bill Aims To Stop Companies From 'Throttling' Internet Service During Disasters,,196,3449,2019-02-08,TECH,0.1166294738650322,0.852372407913208,0.030998144298791885
technews,Tokyo will achieve its goal of making 2020 Olympic medals from e-waste,,56,1705,2019-02-08,TECH,0.0170276015996933,0.7553256750106812,0.22764669358730316
technology,Spotify will now suspend or terminate accounts it finds are using ad blockers,,269,490,2019-02-08,TECH,0.46204185485839844,0.5228633880615234,0.015094819478690624
technology,Sprint sues AT&amp;T over its fake 5G branding.,,35,456,2019-02-08,TECH,0.01928783766925335,0.9303447604179382,0.050367411226034164
technology,US Senators Demand Probe of Foreign VPNs Over Spying Risk,,103,435,2019-02-08,TECH,0.22186324000358582,0.7363018989562988,0.04183485358953476
technews,Cable lobby asks for net neutrality law allowing paid prioritization,,25,343,2019-02-08,TECH,0.0341632254421711,0.8825051784515381,0.0833316296339035
technology,UC Berkeley bans new research projects with Huawei after US indictments,,7,343,2019-02-08,TECH,0.030097689479589462,0.9039701819419861,0.06593211740255356
technology,Democrat Proposes Jail Time For Tech Companies Who Steal Your Data,,1264,52712,2019-02-09,TECH,0.6661341190338135,0.2982991635799408,0.03556666150689125
technology,Texas bill would ban throttling in disaster areas - Over 100 net neutrality bills have been introduced in states,,360,21209,2019-02-09,TECH,0.10395354777574539,0.846595287322998,0.049451153725385666
technology,"Jeff Bezos Protests the Invasion of His Privacy, as Amazon Builds a Sprawling Surveillance State for Everyone Else",,1058,20535,2019-02-09,TECH,0.07316282391548157,0.8964164853096008,0.03042064793407917
gadgets,This light-powered 3D printer materializes objects all at once,,357,8464,2019-02-09,TECH,0.020455271005630493,0.936342716217041,0.04320204630494118
technology,German Regulators just outlawed Facebook's whole ad business.,,363,5128,2019-02-09,TECH,0.8549787998199463,0.13049092888832092,0.014530342072248459
technology,"Tesla 'dog mode' will stop pets overheating in cars, Elon Musk says.",,244,1315,2019-02-09,TECH,0.028060724958777428,0.9131995439529419,0.05873977392911911
technews,Texas bill would ban throttling in disaster areas,,34,1295,2019-02-09,TECH,0.21206513047218323,0.7535052299499512,0.0344296433031559
technews,"AT&amp;T sued by Sprint, must defend decision to tell users that 4G is “5G E”",,45,741,2019-02-09,TECH,0.03751376271247864,0.9270050525665283,0.03548118844628334
technology,Apple is telling developers to disclose secret screen recordings or face ‘immediate action’,,29,295,2019-02-09,TECH,0.7015153169631958,0.28137293457984924,0.017111679539084435
technology,"AT&amp;T sued by Sprint, must defend decision to tell users that 4G is “5G E",,14,294,2019-02-09,TECH,0.03751376271247864,0.9270050525665283,0.03548118844628334
technology,Mozilla Adding CryptoMining and Fingerprint Blocking to Firefox,,862,15588,2019-02-10,TECH,0.04281001165509224,0.9237406253814697,0.03344930335879326
technology,Now Britain is the latest to make Huawei pay for its suspect technology,,161,1414,2019-02-10,TECH,0.428731232881546,0.4410850405693054,0.13018380105495453
technews,Tesla allegedly 'gutted' Model 3 delivery team with recent job cuts,,96,608,2019-02-10,TECH,0.8295454978942871,0.15381444990634918,0.01663999818265438
technology,"Long untouchable, web giants now know what it feels like to be hunted - Governments, after years of indulgence, are rightly getting tough on social media sites",,18,425,2019-02-10,TECH,0.07943306863307953,0.8445430397987366,0.0760238990187645
technology,Review: ‘Zucked’ examines Facebook’s unchecked power and ‘catastrophic’ results for us all – GeekWire,,15,347,2019-02-10,TECH,0.05809668451547623,0.8865265846252441,0.05537673085927963
technews,Tabloid CEO's lawyer denies National Enquirer tried to extort Amazon's Jeff Bezos,,35,325,2019-02-10,TECH,0.06059391424059868,0.8970265984535217,0.04237944632768631
technology,SpaceX seeks FCC approval for up to 1M Starlink satellite earth stations,,60,169,2019-02-10,TECH,0.011826703324913979,0.9164388179779053,0.07173443585634232
technology,Google completely terminated our new business via our Google Play Developer Account,,21,101,2019-02-10,TECH,0.39866021275520325,0.5851830840110779,0.016156747937202454
technology,Spotify hardens its stance on ad blockers. Users could have their accounts terminated without notice,,103,78,2019-02-10,TECH,0.5404748320579529,0.44545504450798035,0.014070057310163975
technology,Analysts determine Chinese law lets police hack online services and copy user data for 'security',,2,72,2019-02-10,TECH,0.37865564227104187,0.5982555150985718,0.023088859394192696
technology,Reddit Users Rally Against Chinese Censorship After the Site Receives a $150 Million Reported Investment,,2389,49202,2019-02-11,TECH,0.19756244122982025,0.7728455066680908,0.02959209680557251
technology,"Winnie The Pooh takes over Reddit due to Chinese investment, censorship fears",,779,21593,2019-02-11,TECH,0.6996448040008545,0.27865123748779297,0.021704018115997314
gadgets,Apple AirPower finally coming this spring with 'exclusive features',,953,5326,2019-02-11,TECH,0.02063499391078949,0.9323092103004456,0.047055747359991074
technology,Russia to disconnect from the internet as part of a planned test,,341,1200,2019-02-11,TECH,0.02733922190964222,0.9442030787467957,0.02845773659646511
technology,YouTube’s copyright strikes have become a tool for extortion,,83,907,2019-02-11,TECH,0.2751975357532501,0.6968818306922913,0.027920633554458618
technology,Most Americans don't realize what companies can predict from their data,,161,846,2019-02-11,TECH,0.18733008205890656,0.7825506329536438,0.030119286850094795
technews,NASA has taken a significant step toward human landings on the Moon,,97,568,2019-02-11,TECH,0.01099357008934021,0.3567480444908142,0.632258415222168
technology,Amy Klobuchar calls for net neutrality ‘guarantee’ in 2020 presidential announcement,,61,526,2019-02-11,TECH,0.018758879974484444,0.9067631959915161,0.07447788119316101
technology,"Shocking: Carriers not forced to abide net neutrality rules tend to raise data prices, not lower them",,13,317,2019-02-11,TECH,0.919590175151825,0.055773764848709106,0.024636100977659225
technews,Google wants to bring encryption to all with Adiantum,,33,176,2019-02-11,TECH,0.017364753410220146,0.9141611456871033,0.06847411394119263
technology,"With the recent Chinese company, Tencent, in the news about investing in Reddit, and possible censorship, it's amazing to me how so many people don't realize Reddit is already one of the most heavily censored websites on the internet.","I was looking through these recent /r/technology threads:

https://old.reddit.com/r/technology/comments/apcmtf/reddit_users_rally_against_chinese_censorship/

https://old.reddit.com/r/technology/comments/apgfu6/winnie_the_pooh_takes_over_reddit_due_to_chinese/

And it seems that there are a lot (probably most) of people completely clueless about the widespread censorship that already occurs on reddit. And in addition, they somehow think they'll be able to tell when censorship occurs! 


&amp;#x200B;

I [wrote about this](https://old.reddit.com/r/undelete/comments/apig51/rtheoryofreddit_mods_remove_thread_and_all/) in a few different subs recently, which you can find in my submission history, but here are some main takeaways:

* Over the past 5+ years Reddit has gone from being the best site for extensive information sharing and lengthy discussion, to being one of the most censored sites on the internet, with many subs regularly secretly removing more than 40% of the content. With the Tencent investment it simply seems like censorship is officially a part of Reddit's business model. 

* A small amount of random people/mods who ""got there first"" control most of reddit. They are accountable to no one, and everyone is subject to the whims of their often capricious, self-serving, and abusive behavior. 


* Most of reddit is censored completely secretly. By default there is no notification or reason given when any content is removed. Mod teams have to make an effort to notify users and cite rules. Many/most mods do not bother with this. This can extend to bans as well, which can be done silently via automod configs. Modlogs are private by default and mod teams have to make an effort to make them public. 

* Reddit finally released the mod guidelines after years of complaints, but the admins do not enforce them. Many mods publicly boast about this fact. 

* The tools to see when censorship happens are ceddit.com, removeddit.com, and using ""open in new private window"" for all your comments and submissions. You simply replace the ""reddit.com/r/w.e"" in the address to ceddit.com/r/w.e""

/r/undelete tracks things that were removed from the front page, but most censorship occurs well before a post makes it to the front page. 

There are a number of /r/RedditAlternatives that are trying to address the issues with reddit. 

EDIT: Guess I should mention a few notables:

/r/HailCorporateAlt 

/r/shills

/r/RedditMinusMods

-

[Those irony icons](https://i.redd.it/c0dbx2p11h121.jpg)...

-

Also want to give a shoutout and thanks to the /r/technology mods for allowing this conversation. Most subs would have removed this, and above I linked to an example of just that.",4715,52349,2019-02-12,TECH,0.2530769407749176,0.7277402877807617,0.019182739779353142
technology,Reddit users are the least valuable of any social network,,3065,37067,2019-02-12,TECH,0.08562121540307999,0.8731722831726074,0.04120654612779617
gadgets,The Raspberry Pi store is much cooler than an Apple Store,,655,11222,2019-02-12,TECH,0.02638004533946514,0.8746383190155029,0.09898167848587036
technology,"Cell companies lied to their customers about coverage, and the government believed them - The FCC is one step closer to acknowledging they have no idea who does and doesn’t have cell reception in America.",,156,5245,2019-02-12,TECH,0.01356097124516964,0.8640565276145935,0.12238247692584991
technews,Texas lawmaker wants to ban mobile throttling in disaster areas,,47,1598,2019-02-12,TECH,0.5110311508178711,0.46449390053749084,0.02447497844696045
technology,Judge rules we can’t know about US government trying to force Facebook to decrypt Messenger calls,,144,1382,2019-02-12,TECH,0.15307487547397614,0.8290258049964905,0.017899289727211
technology,"Swiss e-voting trial offers $150,000 in bug bounties to hackers",,121,957,2019-02-12,TECH,0.024518797174096107,0.9052925109863281,0.07018870115280151
technology,"Most Online ‘Terms of Service’ Are Incomprehensible to Adults, Study Finds",,43,238,2019-02-12,TECH,0.02451794221997261,0.933436930179596,0.042045120149850845
technews,AI-guided material changes could lead to diamond CPUs,,11,153,2019-02-12,TECH,0.5763434171676636,0.3927250802516937,0.030931556597352028
technology,"Activision Blizzard gives weak 2019 guidance, says it will slash 8% of workforce",,20,78,2019-02-12,TECH,0.9126101136207581,0.07483432441949844,0.012555582448840141
technology,The former Apple lawyer who was supposed to keep employees from insider trading has been charged with insider trading,,609,37385,2019-02-13,TECH,0.6162314414978027,0.356260746717453,0.027507832273840904
technology,How Facebook Screwed Us All: It’s not just spreading phony stories everywhere—it’s killing real news.,,1039,20818,2019-02-13,TECH,0.2644979655742645,0.7082778811454773,0.02722417563199997
technology,Netflix Has Saved Every Choice You’ve Ever Made in ‘Black Mirror: Bandersnatch' - A tech policy researcher used GDPR to request information about all of his choices from Netflix,,874,12794,2019-02-13,TECH,0.022867759689688683,0.9097169041633606,0.06741531193256378
gadgets,The US Government is about to put a dog tag on your drone,,1190,7757,2019-02-13,TECH,0.08336210995912552,0.8676860332489014,0.048951927572488785
technology,"Twitter boss names Elon Musk as his favourite tweeter despite multiple scandals - Jack Dorsey, Twitter's co-founder, believes the Tesla billionaire is ""solving existential problems and thinking openly"".",,984,6456,2019-02-13,TECH,0.07366089522838593,0.883467435836792,0.042871683835983276
technology,"Opportunity did not answer NASA’s final call, and it’s now gone to us",,167,2409,2019-02-13,TECH,0.020058125257492065,0.8682061433792114,0.11173572391271591
technology,Tim Cook says Apple will investigate app that lets Saudi men track and control women,,205,1970,2019-02-13,TECH,0.011273825541138649,0.8611569404602051,0.12756924331188202
technews,Amazon and GM may invest in Rivian's electric pickup trucks,,115,856,2019-02-13,TECH,0.010047396644949913,0.8682694435119629,0.12168318778276443
