subreddit,title,selftext,num_comments,score,created_utc,stock/sector,neg,neu,pos
gadgets,"This 18,000mAh Energizer battery has a phone in it",,1101,11821,2019-02-26,TECH,0.024111758917570114,0.9246336817741394,0.051254529505968094
technology,"IBM so very, very sorry after jobs page casually asks hopefuls: Are you white, black... or yellow?",,1171,8815,2019-02-26,TECH,0.07202122360467911,0.8766771554946899,0.05130163952708244
technews,Google forced to reveal which products have microphones following privacy backlash,,102,1926,2019-02-26,TECH,0.7209679484367371,0.2522760033607483,0.026756001636385918
technology,"Yes, retailers are colluding to inflate prices online",,119,1539,2019-02-26,TECH,0.03838071599602699,0.9258878827095032,0.03573138266801834
technology,Robocalls are rampant despite the Do Not Call list — FCC urges phone providers to help stop them,,159,1047,2019-02-26,TECH,0.08579543232917786,0.7605926990509033,0.15361186861991882
technology,"A Mom Found Almost A Dozen YouTube Kids Videos Showing Suicide, School Shootings, And Abuse",,158,420,2019-02-26,TECH,0.1949857473373413,0.7770936489105225,0.02792055904865265
technology,"Tonight (2/26), telecom lobbyists are throwing a lavish DC fundraiser for Sen. Wicker—the night before he chairs his first big Senate hearing on tech legislation. This is blatant corruption. Let's crash the party.",,9,211,2019-02-26,TECH,0.025381334125995636,0.8942856788635254,0.08033299446105957
technology,"US appeals court blesses AT&amp;T $81 billion takeover of Time Warner, affirming no harm to consumers, competition",,23,195,2019-02-26,TECH,0.04457516595721245,0.905381441116333,0.050043392926454544
technology,Belgian Scientists Crack the code for affordable green energy. Field trials with a solar panel generating hydrogen at 15% efficiency starting soon.,"Article translated from dutch (layout messed up):

[https://translate.google.com/translate?hl=en&amp;sl=nl&amp;tl=en&amp;u=https%3A%2F%2Fwww.vrt.be%2Fvrtnws%2Fnl%2F2019%2F02%2F24%2Fbelgische-wetenschappers-kraken-de-code-voor-betaalbare-groene-w%2F](https://translate.google.com/translate?hl=en&amp;sl=nl&amp;tl=en&amp;u=https%3A%2F%2Fwww.vrt.be%2Fvrtnws%2Fnl%2F2019%2F02%2F24%2Fbelgische-wetenschappers-kraken-de-code-voor-betaalbare-groene-w%2F)

Original article in dutch:

[https://www.vrt.be/vrtnws/nl/2019/02/24/belgische-wetenschappers-kraken-de-code-voor-betaalbare-groene-w/](https://www.vrt.be/vrtnws/nl/2019/02/24/belgische-wetenschappers-kraken-de-code-voor-betaalbare-groene-w/)

&amp;#x200B;

Sorry for the dutch article.

I could not find an english article.

Some highlights:

\- Energy is generated from a solar panel that outputs hydrogen

\- Efficiency is currently at 15%. Current (household) solar panel tech is at around 18-20%

\- The panel is made out of cheap, durable parts. No expensive, rare materials are needed.

\- No more batteries needed for storage. For household use, a tank can be put underground, which can be used in the winter, when solar output is low.

\- Household trials are starting as soon as possible

&amp;#x200B;

&amp;#x200B;",52,175,2019-02-26,TECH,0.02984093315899372,0.9230496883392334,0.047109391540288925
technology,Fight for your right... to repair - The Right to Repair is about restoring the power to repair products to the American people,,994,39963,2019-02-27,TECH,0.030193686485290527,0.9193001985549927,0.05050606653094292
technology,Facebook Says a “Clear History” Tool Will Hurt Its Advertising Business. Good.,,705,27838,2019-02-27,TECH,0.956215500831604,0.03140251711010933,0.012382067739963531
gadgets,USB 3.2 branding is a mess that will lead to confussion and scams,,1094,14686,2019-02-27,TECH,0.025906696915626526,0.9347396492958069,0.03935367986559868
technews,Fake Amazon reviews draw fraud charges in groundbreaking FTC case,,37,1653,2019-02-27,TECH,0.35383141040802,0.6238600015640259,0.022308597341179848
technology,"Windows 10 should never reboot your PC without your express permission, researchers conclude",[deleted],195,510,2019-02-27,TECH,0.07394925504922867,0.8936382532119751,0.032412465661764145
technology,Former FCC Chair Tom Wheeler Says the Internet Needs Regulation,,86,390,2019-02-27,TECH,0.023480966687202454,0.9093790650367737,0.06713999807834625
technology,Twitter suspends far-right activist Jacob Wohl for creating accounts to allegedly manipulate the U.S. presidential election,,41,249,2019-02-27,TECH,0.6073874831199646,0.36976364254951477,0.02284890227019787
technology,"Over 8,000 marijuana convictions in San Francisco cleared thanks to computer algorithm",,23,159,2019-02-27,TECH,0.022808725014328957,0.9073264002799988,0.0698649063706398
technology,How Mozilla moved fast to block Facebook and other privacy invaders from your web browser,,11,118,2019-02-27,TECH,0.021778026595711708,0.86919105052948,0.10903093963861465
technology,"Scientist turn CO2 gas into carbon particles in a process that is efficient, scalable, and could potentially ""rewind"" the carbon emission clock. The particles turn into supercapacitors that can be used for electric vehicle applications.",,33,116,2019-02-27,TECH,0.016720661893486977,0.92536860704422,0.05791068077087402
technology,Anti-vaxx 'mobs': doctors face harassment campaigns on Facebook - Medical experts who counter misinformation are weathering coordinated attacks. Now some are fighting back,,1952,27151,2019-02-28,TECH,0.5692048668861389,0.39996078610420227,0.03083432838320732
technology,Tesla will close most of its stores and only sell cars online.,,1516,14395,2019-02-28,TECH,0.02459428273141384,0.9468355774879456,0.028570130467414856
gadgets,Slider phone reborn: Fxtec Pro1 delivers Android 9 plus slide-out QWERTY keyboard | ZDNet,,1211,9508,2019-02-28,TECH,0.020351698622107506,0.8983976244926453,0.08125070482492447
technology,‘Gene-edited babies’ is one of the most censored topics on Chinese social media.,,451,8284,2019-02-28,TECH,0.037917107343673706,0.9365088939666748,0.025573955848813057
technology,TikTok has been illegally collecting children’s data.,,235,3552,2019-02-28,TECH,0.03301591798663139,0.9320257306098938,0.03495831415057182
technology,Researchers genetically modify yeast to ‘brew’ THC and CBD,,230,3024,2019-02-28,TECH,0.02119860239326954,0.9216305017471313,0.05717088654637337
technology,America’s Cities Are Running on Software From the ’80s,,360,2273,2019-02-28,TECH,0.019050516188144684,0.9363584518432617,0.04459104314446449
technews,Facebook and Google to be fined for harmful content,,82,1737,2019-02-28,TECH,0.5224789977073669,0.44172370433807373,0.03579733148217201
technology,Ridley Scott’s Alien will finally be released in 4K HDR for its 40th anniversary,,78,835,2019-02-28,TECH,0.019239721819758415,0.8382418155670166,0.14251846075057983
technology,Facebook and Google will be punished with giant fines in the UK if they fail to rid their platforms of toxic content,,183,379,2019-02-28,TECH,0.6604025363922119,0.3191661834716797,0.02043127827346325
