subreddit,title,selftext,num_comments,score,created_utc,stock/sector,neg,neu,pos
technology,"Amazon in Its Prime: Doubles Profits, Pays $0 in Federal Income Taxes",,71,416,2019-02-13,TECH,0.048013538122177124,0.9268198013305664,0.025166628882288933
technology,Apple CEO Tim Cook promises to investigate the 'abhorrent' Saudi Arabian app that allows men to track women,,54,378,2019-02-13,TECH,0.015112664550542831,0.8947248458862305,0.09016252309083939
technology,Amazon Will Pay a Whopping $0 in Federal Taxes on $11.2 Billion Profits,,4154,62832,2019-02-14,TECH,0.031342003494501114,0.9045774340629578,0.06408049911260605
technology,Movie Torrents Shown To Actually Boost Box Office Sales For Post-Release Movies,,684,13897,2019-02-14,TECH,0.030739666894078255,0.0614725761115551,0.9077876806259155
technology,"Google joins Apple in probing Saudi app that lets men control where women travel, as pressure piles on the tech giants to kill the service",,482,7013,2019-02-14,TECH,0.03167029470205307,0.8622718453407288,0.10605792701244354
gadgets,"New Nubia foldable phone is a camera watch, comes out in two weeks",,326,4568,2019-02-14,TECH,0.026498975232243538,0.9300330281257629,0.043467942625284195
technology,ISPs Are Violating the Old Net Neutrality Rules,,312,3405,2019-02-14,TECH,0.7513619661331177,0.2241583913564682,0.024479633197188377
technology,"Selling 911 location data is illegal—US carriers reportedly did it anyway: AT&amp;T, T-Mobile, and Sprint sale of GPS data called ""unquestionably illegal.""",,122,3162,2019-02-14,TECH,0.22167207300662994,0.7574278116226196,0.020900091156363487
technology,"No evidence playing violent video games leads to aggressive behaviour in teens, study finds: 'The idea that violent video games drive real-world aggression is a popular one, but it hasn’t tested very well over time'",,251,3160,2019-02-14,TECH,0.39164459705352783,0.4744422733783722,0.1339130997657776
gadgets,"Fun fact: GPS uses 10 bits to store the week. That means it runs out... oh heck – April 6, 2019",,443,2215,2019-02-14,TECH,0.054615896195173264,0.9166882038116455,0.028695913031697273
technews,Selling 911 location data is illegal—US carriers reportedly did it anyway,,35,1437,2019-02-14,TECH,0.5226314067840576,0.4578777849674225,0.019490793347358704
gadgets,North Focals glasses review: a $600 smartwatch for your face,,247,1420,2019-02-14,TECH,0.02108161151409149,0.9266546368598938,0.052263785153627396
technology,Facebook may face multi-billion dollar fine for Cambridge Analytica scandal,,364,18311,2019-02-15,TECH,0.192641943693161,0.7688143253326416,0.038543663918972015
gadgets,Is Apple the only major brand not releasing a foldable phone in 2019? Probably,,2288,13749,2019-02-15,TECH,0.01607186533510685,0.84697026014328,0.1369578242301941
technology,"Bold Plan? Replace the Border Wall with an Energy–Water Corridor: Building solar, wind, natural gas and water infrastructure all along the U.S.–Mexico border would create economic opportunity rather than antagonism",,903,8118,2019-02-15,TECH,0.010703256353735924,0.7483398914337158,0.2409568727016449
technology,"Pressure mounts on Facebook and Google to stop anti-vax conspiracy theories - ‘Repetition of information, even if false, can often be mistaken for accuracy.’",,549,4528,2019-02-15,TECH,0.2735476791858673,0.7010933756828308,0.02535894513130188
technology,Woman With Womb Transplanted From Deceased Donor Successfully Gives Birth,,143,1197,2019-02-15,TECH,0.015890054404735565,0.8295917510986328,0.15451814234256744
technews,General Motors starts taking orders for its first e-bike,,117,925,2019-02-15,TECH,0.016971824690699577,0.9226251244544983,0.06040311977267265
technews,Facebook reportedly negotiating multibillion dollar fine with FTC,,104,871,2019-02-15,TECH,0.04330263286828995,0.9183898568153381,0.03830747306346893
technews,Google is telling police where your phone was,,88,547,2019-02-15,TECH,0.2586888372898102,0.71056067943573,0.03075052611529827
technews,NASA emphasizing “speed” in its return to the Moon,,42,371,2019-02-15,TECH,0.020147258415818214,0.8306953310966492,0.14915744960308075
technology,"How Taylor Swift showed us the scary future of facial recognition - Surveillance at concerts is just the beginning, as fears grow around an unregulated, billion-dollar industry",,114,366,2019-02-15,TECH,0.03848740831017494,0.9134639501571655,0.048048678785562515
technology,"Ad code 'slows down' browsing speeds - Ads are responsible for making webpages slow to a crawl, suggests analysis of the most popular one million websites.",,1707,42107,2019-02-16,TECH,0.03031175583600998,0.9181511402130127,0.05153709650039673
technology,Google is reportedly hiding behind shell companies to scoop up tax breaks and land,,692,15177,2019-02-16,TECH,0.642619788646698,0.3173685669898987,0.0400116927921772
technology,Facebook may face multi-billion dollar fine for Cambridge Analytica scandal,,54,2199,2019-02-16,TECH,0.192641943693161,0.7688143253326416,0.038543663918972015
technology,Google backtracks on Chrome modifications that would have crippled ad blockers,,185,1334,2019-02-16,TECH,0.20077131688594818,0.7768661975860596,0.02236250229179859
technews,Samsung leaks entire new wearables lineup through its own app,,32,380,2019-02-16,TECH,0.013691568747162819,0.9222250580787659,0.06408334523439407
technews,Video: HDR (High Dynamic Range) Explained,,22,357,2019-02-16,TECH,0.019224558025598526,0.8297523856163025,0.15102306008338928
technology,I'm a neuroscientist / former brain bank manager who's developing an app to help researchers spend less time glued to microscopes in the lab. Ask me anything!,"Hello reddit,

I'm Dr Matthew Williams, a neuroscientist in the UK who has recently been developing [Segmentum Imaging](https://segmentumanalysisltd.com/), an attempt to move the slow and cumbersome methods of cell measurement into a more streamlined and neat system that you can use on a mobile device (meaning you can do it while lying in bed, watching TV or in the bar, rather than in a room with no windows and awful fluorescent lighting). We're hoping to launch our first version soon and are looking for people to try it and let us know what they think, or just people who've been stuck in lonely microscope rooms for untold hours to say what sort of features they'd like on such a system.  

What's my background, though? 

So after being a regular old neuroscientist for a few years I went up to full-on creepy neuroscientist when I inherited a huge human brain bank - a brief overview of this was described in a [Cracked article a few years ago](http://www.cracked.com/personal-experiences-1402-pe-brain-bank.html). More recently I got some very minor proxy fame in this parish by finding a tropical-spider egg sack on a banana and taking it to the local arachnid lab (as documented in a series of posts by /u/lagoon83, who's helping me stay on top of the AMA this evening: [1](https://www.reddit.com/r/whatsthisbug/comments/a0tvbb/midlands_uk_partners_brother_found_this_in_the/) [2](https://www.reddit.com/r/whatsthisbug/comments/a1mf97/update_spiderlab_got_back_to_us_with_a_photo_of/) [3](https://www.reddit.com/r/whatsthisbug/comments/adgsmj/update_the_banana_spiders_from_a_month_ago/) [4](https://www.reddit.com/r/whatsthisbug/comments/aqnkyc/another_update_the_banana_spiders_from_a_couple/)). 
More recently, as well as developing some digital biotech as a startup, I'm now working on creating another brain bank - but this time, for much of the animal kingdom as part of an international collaboration.

As suggested by the mods, I've posted this ahead of time so people can start adding comments - I'll be  on here from 6pm GMT (1pm EST) and will stick around for a few hours to answer any questions you have about our app, digital pathology, my background, neuroscience in general, and whether I've summoned the strength of will to eat a banana recently. 

Ask me anything!   

EDIT:  OK thanks everyone.  I'm off for the night but will check back over the next few days and reply to any other questions.",308,256,2019-02-16,TECH,0.035655226558446884,0.9287243485450745,0.035620421171188354
technology,"Insurance Giant Allstate Buys Independent Phone Repair Company, Joins Right to Repair Movement",,10,213,2019-02-16,TECH,0.01041841134428978,0.8021831512451172,0.1873984932899475
technology,Google removing ability for sites to detect Chrome Incognito Mode,,60,200,2019-02-16,TECH,0.09632834792137146,0.8773801326751709,0.026291485875844955
technology,Ajit Pai helped Charter kill consumer-protection rules in Minnesota,,7,180,2019-02-16,TECH,0.021552184596657753,0.9163806438446045,0.06206713244318962
technology,Facebook under pressure to halt rise of anti-vaccination groups,,2078,35198,2019-02-17,TECH,0.1857263743877411,0.7949851751327515,0.019288428127765656
technology,Study blames YouTube for rise in number of Flat Earthers,,334,3116,2019-02-17,TECH,0.04158592224121094,0.8932262063026428,0.06518786400556564
technology,"House bill requires pornography filter on all phones, computers purchased in Kansas",,379,1649,2019-02-17,TECH,0.31702685356140137,0.6599821448326111,0.022991042584180832
technology,The Air Force's 'rods from god' could hit with the force of a nuclear weapon — with no fallout,,485,1344,2019-02-17,TECH,0.022487998008728027,0.8633896112442017,0.1141224205493927
technews,'Made in Japan' goods to make US blitz through Amazon,,103,984,2019-02-17,TECH,0.02731526456773281,0.8995851278305054,0.07309959083795547
technews,Man discovers 30 year old Apple computer still in working order,,64,402,2019-02-17,TECH,0.019999654963612556,0.7792208790779114,0.20077946782112122
technology,"'Google, this is bogus as hell' — one of the fathers of the internet blasts Google for how Chromecast behaves on his home network",,84,238,2019-02-17,TECH,0.0619039349257946,0.9031149744987488,0.03498103842139244
technology,"US needs an internet data privacy law, GAO tells Congress",,5,204,2019-02-17,TECH,0.015147672966122627,0.9018831253051758,0.08296916633844376
technology,Google and Facebook face a CMA investigation into their stranglehold on digital advertising,,8,154,2019-02-17,TECH,0.04646047577261925,0.9304866790771484,0.023052826523780823
technews,"""what the ministry wanted was end-to-end encrypted, decentralized communication across the entire French government, running on systems that France could provision and control. The agency thought that Matrix might be an excellent platform for providing this.""",,1,76,2019-02-17,TECH,0.009052871726453304,0.5260152816772461,0.464931845664978
technology,"Huawei cloning Apple parts, rewarding employees for tech theft",,2253,25684,2019-02-18,TECH,0.031747303903102875,0.8817827105522156,0.08646997809410095
technology,Canadian Telecom Giant Bell Wanted NAFTA to Ban Some VPNs. Bell wanted the privacy tools—which can also be used to access geo-blocked media—to be made unlawful under NAFTA.,,592,12901,2019-02-18,TECH,0.018023451790213585,0.9286539554595947,0.05332264304161072
gadgets,Samsung will no longer make Blu-ray players for the US,,1059,6444,2019-02-18,TECH,0.08467952907085419,0.8754845857620239,0.039835892617702484
technology,"Mark Zuckerberg humiliated by group of lawmakers, who accuse Facebook's CEO of spectacular leadership failure",,423,4597,2019-02-18,TECH,0.8179812431335449,0.16073577105998993,0.021282924339175224
gadgets,Apple's 2019 product roadmap revealed: from giant MacBook to sandblasted iPhone,,1005,3700,2019-02-18,TECH,0.029825551435351372,0.9253038763999939,0.04487057402729988
technology,"Facebook can no longer govern itself, UK lawmakers say",,69,861,2019-02-18,TECH,0.432571679353714,0.5359923243522644,0.031435977667570114
technology,"The Tesla big battery in South Australia continues to make its mark on the Australian energy market, pocketing another $4m in the fourth quarter. Its presence effectively destroyed a “cartel”- like play that pushed prices up, and removed constraints that were exploited by gas generators.",,53,684,2019-02-18,TECH,0.05580832436680794,0.27637800574302673,0.6678136587142944
technews,"OpenAI won’t release AI text generator, branding it too dangerous",,86,608,2019-02-18,TECH,0.03929396718740463,0.9270872473716736,0.03361877426505089
technology,Google is reportedly hiding behind shell companies to scoop up tax breaks and land,,56,395,2019-02-18,TECH,0.642619788646698,0.3173685669898987,0.0400116927921772
technews,"Facebook broke rules, should be regulated: UK lawmakers",,14,356,2019-02-18,TECH,0.4994716942310333,0.454546719789505,0.04598158225417137
technology,"Self-Driving Cars Might Kill Auto Insurance as We Know It - Without humans to cause accidents, 90% of risk is removed. Insurers are scrambling to prepare.",,4062,52316,2019-02-19,TECH,0.15303552150726318,0.8233435153961182,0.023620977997779846
technology,"Trump Officials Tried To Rush Nuclear Technology To Saudis, House Panel Finds",,1873,30531,2019-02-19,TECH,0.3867866098880768,0.48568546772003174,0.12752783298492432
gadgets,Superfast Raspberry Pi rival: Odroid N2 promises blistering speed for only 2x price,,539,6134,2019-02-19,TECH,0.02455068938434124,0.9147207736968994,0.060728516429662704
technews,Google Earth accidentally reveals secret military sites | ZDNet,,94,1660,2019-02-19,TECH,0.15129002928733826,0.8253912925720215,0.02331867255270481
technology,"The U.S. cannot crush us, says Huawei founder - ""If the lights go out in the West, the East will still shine. And if the North goes dark, there is still the South. America doesn’t represent the world. America only represents a portion of the world.""",,404,978,2019-02-19,TECH,0.03779088333249092,0.9110630750656128,0.05114604905247688
gadgets,Retina resolution headset puts the “reality” into “virtual reality” - Clever dual-display tech means you really can't see the pixels.,,116,803,2019-02-19,TECH,0.03002389520406723,0.9331029653549194,0.03687315061688423
technews,What’s in a face? Artificial intelligence deciphers the emotional mysteries of ancient Buddhist statues,,24,365,2019-02-19,TECH,0.059736933559179306,0.9092708230018616,0.03099222294986248
technology,The Worst Possible Version of the EU Copyright Directive Has Sparked a German Uprising,,26,235,2019-02-19,TECH,0.8730156421661377,0.09250617772340775,0.034478217363357544
technology,"If you call this firm a “patent troll,” it might sue for defamation",,23,177,2019-02-19,TECH,0.586638867855072,0.3783421218395233,0.03501901775598526
technology,"Your cable company may soon be forced to be more transparent about your bill - Two Democratic lawmakers introduced a bill this month that would require phone, cable and internet providers to include all charges in advertised prices",,8,159,2019-02-19,TECH,0.09822076559066772,0.8466406464576721,0.05513855442404747
technology,New Bill Would Stop Internet Service Providers From Screwing You With Hidden Fees - Cable giants routinely advertise one rate then charge you another thanks to hidden fees a well-lobbied government refuses to do anything about.,,1108,43277,2019-02-20,TECH,0.22921045124530792,0.7447150945663452,0.02607443928718567
gadgets,Samsung’s foldable phone is the Galaxy Fold,,1650,7414,2019-02-20,TECH,0.01835668832063675,0.9320539832115173,0.049589332193136215
gadgets,Photos of foldable Galaxy allegedly leak ahead of today's Samsung event,,302,1608,2019-02-20,TECH,0.29753074049949646,0.6812421679496765,0.021227136254310608
technews,SpaceX gets $300 million from Defense Department,,75,995,2019-02-20,TECH,0.015083170495927334,0.8933066129684448,0.09161020815372467
technology,Google says the built-in microphone it never told Nest users about was 'never supposed to be a secret',,237,794,2019-02-20,TECH,0.05084502696990967,0.9167735576629639,0.03238147124648094
technews,Lenovo Buyers To Receive $55 Each In Adware Settlement,,61,657,2019-02-20,TECH,0.01879432424902916,0.9122087955474854,0.06899696588516235
technology,Florida prisons are getting sued for erasing $11 million worth of prisoner music purchases,,54,452,2019-02-20,TECH,0.697995126247406,0.25624966621398926,0.045755255967378616
gadgets,"Samsung unveils Galaxy Fold with huge 7.3-inch screen, $1,980 price tag",,261,392,2019-02-20,TECH,0.016366291791200638,0.886325478553772,0.0973081886768341
technology,Nest has a secret microphone–Google just forgot to tell us,,84,336,2019-02-20,TECH,0.04286166653037071,0.9100691676139832,0.04706914722919464
technology,"Florida inmate says prison sold him $569 of music, then took it away",,57,322,2019-02-20,TECH,0.17645247280597687,0.7346157431602478,0.08893181383609772
technology,Advertisers Boycott YouTube After Pedophiles Swarm Comments on Videos of Children,,3919,43039,2019-02-21,TECH,0.03774692490696907,0.933968722820282,0.028284413740038872
technology,"Trump calls for 6G cellular technology, because why the heck not",,3851,42777,2019-02-21,TECH,0.012112705036997795,0.8990713357925415,0.08881600946187973
gadgets,Nike self-lacing sneakers brick after bad firmware upgrade,,1302,25161,2019-02-21,TECH,0.040110036730766296,0.9214787483215332,0.03841128200292587
technology,Nike’s self-lacing smart sneakers malfunction days after release,,353,1814,2019-02-21,TECH,0.041366081684827805,0.9266106486320496,0.03202325478196144
technology,"Facebook Is an 'Innovator in Privacy,' Says Guy Who Runs Facebook",,129,1695,2019-02-21,TECH,0.040376827120780945,0.9313111305236816,0.028312042355537415
technews,The first private mission to the Moon may launch Thursday night,,96,1354,2019-02-21,TECH,0.015499534085392952,0.93177330493927,0.05272709205746651
technology,Apple's stubborn refusal to make a cheap iPhone resulted in its biggest sales decline in 3 years,,438,1201,2019-02-21,TECH,0.9715431928634644,0.019687261432409286,0.008769514039158821
technology,"OK, your boss allegedly called you a lazy n*****, promoted the person you trained ahead of you and paid you less, but you can't PROVE it's racism, Facebook says",,245,931,2019-02-21,TECH,0.5753048658370972,0.3980414569377899,0.026653744280338287
technology,"As fallout over pedophilia content on YouTube continues, AT&amp;T and Hasbro pull all advertisements",,118,410,2019-02-21,TECH,0.03037874959409237,0.9280405044555664,0.041580721735954285
technews,Ajit Pai says broadband access is soaring—and that he’s the one to thank,,89,291,2019-02-21,TECH,0.012609693221747875,0.884996771812439,0.10239353030920029
technology,YouTube just demonetized anti-vax channels.,,3640,71614,2019-02-22,TECH,0.03150789067149162,0.9333868622779846,0.03510528802871704
technology,Ajit Pai's FCC insists that ignoring consumers and gutting oversight of major ISPs dramatically boosted network investment. Reality suggests something else entirely.,,489,16106,2019-02-22,TECH,0.033420249819755554,0.9171571135520935,0.04942264407873154
technology,Facebook will shut down its spyware VPN app Onavo,,364,11718,2019-02-22,TECH,0.06321633607149124,0.9071568250656128,0.029626833274960518
gadgets,These shoes let you stroll through ‘Skyrim VR’ without leaving the comfort of your seat,,307,5040,2019-02-22,TECH,0.03636297583580017,0.852828860282898,0.11080817133188248
technews,China’s CRISPR twins might have had their brains inadvertently enhanced,,198,1000,2019-02-22,TECH,0.7578762769699097,0.21928998827934265,0.022833721712231636
technology,"Uber data used to identify accomplices in staged Jussie Smollett attack, police say",,128,881,2019-02-22,TECH,0.13701391220092773,0.8448861241340637,0.01810002699494362
technology,"Facebook reportedly gets deeply personal info from some apps, like ovulation times and heart rate",,71,552,2019-02-22,TECH,0.015159991569817066,0.8928186297416687,0.09202133864164352
technology,"Japanese spacecraft successfully touches down on an asteroid, grabbing a sample of dust",,29,496,2019-02-22,TECH,0.022949712350964546,0.6102766394615173,0.3667736053466797
technology,Are we on the road to civilisation collapse?,,223,324,2019-02-22,TECH,0.45482078194618225,0.5143240690231323,0.030855117365717888
technology,Facebook decided which users are interested in Nazis — and let advertisers target them directly,,34,175,2019-02-22,TECH,0.01804809831082821,0.9351161122322083,0.046835798770189285
technology,Microsoft workers protest $480m HoloLens military deal: 'We did not sign up to develop weapons',,2406,32036,2019-02-23,TECH,0.33048930764198303,0.6031200289726257,0.06639070808887482
gadgets,"Microsoft Hololens 2 is coming out tomorrow. Here is how to watch the conference streamed live from Barcelona, Spain",,452,5797,2019-02-23,TECH,0.025905227288603783,0.940342128276825,0.03375260904431343
technology,IKEA announces plans to release air purifying curtains,,88,2478,2019-02-23,TECH,0.03241611644625664,0.9235783219337463,0.044005539268255234
gadgets,The Light Phone 2 adds messaging and more to the ultra-minimalist cellphone,,359,2179,2019-02-23,TECH,0.026780247688293457,0.9331762790679932,0.040043484419584274
technology,"Confidential emails sent by Facebook executives leaked online - Communications between senior figures, including Mark Zuckerberg, shed new light on data use",,54,1492,2019-02-23,TECH,0.9327915906906128,0.05481649562716484,0.01239184569567442
technology,YouTube removes ads from anti-vaccination video channels,,114,1080,2019-02-23,TECH,0.4328365921974182,0.5508796572685242,0.016283752396702766
technology,"Facebook planned to spy on Android phone users, internal emails reveal",,132,784,2019-02-23,TECH,0.13890039920806885,0.8433640003204346,0.017735613510012627
technews,A Decryption Key for Law Firm Emails in Hacked 9/11 Files Has Been Released,,71,708,2019-02-23,TECH,0.335187166929245,0.6472091674804688,0.017603684216737747
technews,"Amazon Prime Air Cargo Plane Crashes Into Texas' Trinity Bay Near Houston, Killing 3",,163,687,2019-02-23,TECH,0.7802123427391052,0.18762719631195068,0.03216053918004036
technology,iOS apps sending private data to facebook,,45,533,2019-02-23,TECH,0.03543160483241081,0.9408921599388123,0.02367624267935753
technology,Facebook attacked over app that reveals period dates of its users | Technology,,1387,23672,2019-02-24,TECH,0.08496124297380447,0.8988129496574402,0.01622576080262661
technology,"PepsiCo is laying off corporate employees as the company commits to millions of dollars in severance pay, restructuring, and 'relentlessly automating'",,1905,19351,2019-02-24,TECH,0.16264061629772186,0.7976135015487671,0.03974592313170433
gadgets,Galaxy S10 Plus review: Ultrasonic fingerprint and class-leading battery life stand out,,1371,8315,2019-02-24,TECH,0.023681657388806343,0.934157133102417,0.04216112941503525
technews,Navy files for patent on room-temperature superconductor,,117,856,2019-02-24,TECH,0.03909601643681526,0.9277596473693848,0.03314438462257385
technews,"China Uses DNA to Track Its People, With the Help of American Expertise -- Now along with google tech and financial corporations are going all Orwellian to aid despotic totalitarian regimes.",,41,714,2019-02-24,TECH,0.021652553230524063,0.8956987857818604,0.08264859765768051
technology,Pinterest blocks all vaccine-related searches in effort to combat anti-vax content,,115,574,2019-02-24,TECH,0.02532370202243328,0.9204896092414856,0.054186612367630005
technology,Horrified mom discovers suicide instructions in video on YouTube and YouTube Kids,,103,445,2019-02-24,TECH,0.2525438368320465,0.718231737613678,0.029224367812275887
technology,NASA releases sharpest-ever images of distant Kuiper Belt object,,28,295,2019-02-24,TECH,0.020287679508328438,0.9251576662063599,0.054554689675569534
gadgets,Microsoft shrinks Kinect into a $399 cloud-powered PC peripheral,,49,291,2019-02-24,TECH,0.02353374846279621,0.9288002252578735,0.04766596481204033
technews,Ajit Pai Claims His FCC Improved Broadband Access,,45,204,2019-02-24,TECH,0.009595172479748726,0.421943724155426,0.5684610605239868
technology,1TB microSD cards are now a thing,,2122,38140,2019-02-25,TECH,0.034785252064466476,0.9359632134437561,0.02925155684351921
technology,Report: Facebook Moderators Are Routinely High and Joke About Suicide to Cope With Job,,1174,17831,2019-02-25,TECH,0.7040849924087524,0.2705974280834198,0.025317613035440445
gadgets,Memory cards are about to get much faster with new microSD Express spec,,392,10407,2019-02-25,TECH,0.012409098446369171,0.7312366962432861,0.2563541829586029
technology,Google forced to reveal which products have microphones following privacy backlash,,302,3817,2019-02-25,TECH,0.7209679484367371,0.2522760033607483,0.026756001636385918
technology,U.S. Navy files for patent on room-temperature superconductor,,319,3261,2019-02-25,TECH,0.036057088524103165,0.9290881752967834,0.03485473245382309
technews,'We won't be war profiteers': Microsoft workers protest $480m army contract,,248,1923,2019-02-25,TECH,0.8080559372901917,0.1684909462928772,0.023453164845705032
technology,"Think Facebook has an anti-vaxxer problem? You should see Amazon - The problem of distrust runs deeper than social media, with Amazon's recommendation algorithms also pushing people towards anti-vaxx content",,133,1514,2019-02-25,TECH,0.41366055607795715,0.5391192436218262,0.047220248728990555
technology,Facebook's Content Moderators Start Believing the Conspiracy Theories They're Charged with Policing,,96,431,2019-02-25,TECH,0.29603147506713867,0.6749908328056335,0.02897769771516323
technology,Right to Repair Legislation Is Officially Being Considered In Canada,,10,370,2019-02-25,TECH,0.0189630426466465,0.9076104760169983,0.07342644035816193
gadgets,Report: Facebook Moderators Are Routinely High and Joke About Suicide to Cope With Job,,105,269,2019-02-25,TECH,0.7040849924087524,0.2705974280834198,0.025317613035440445
technology,"Studies keep showing that the best way to stop piracy is to offer cheaper, better alternatives.",,1603,31152,2019-02-26,TECH,0.01796749234199524,0.5555426478385925,0.42648985981941223
