subreddit,title,selftext,num_comments,score,created_utc,stock/sector,neg,neu,pos
apple,DAE think that the iPod touch is now really badly priced when compared to the iPad Mini?,"In the UK an iPad Mini costs £269 and an iPod Touch costs £249. 
This seems crazy regardless of which way you want to look at it.  I appreciate that some will point to the iPod Touch having more hard drive space and, I think, a faster processor but if I was a kid this Christmas and my parents bought me a touch instead of a mini I would be gutted!  What do you lovely people think?

 Also before you say it, yes it is cheaper regardless in America but methinks the difference is somewhat similar in funny money too.  

Edit: The other way of looking at it is that the iPod is pretty cheap/ iPhone is horrifically expensive as in the UK the iPod is £249 and the iPhone is £529!
I think the Mini has just put a spanner in the works for me as now I've had a play with one I feel like although I wouldn't jog with it, I would accommodate in more places than I would previously have with the full-sized iPad. It's definitely made a nice entry point for people getting into the Apple ecosystem.",71,118,2012-11-17,AAPL,0.021027162671089172,0.8726516366004944,0.10632126778364182
apple,Panda iPhone 5,,27,114,2012-11-17,AAPL,0.016372906044125557,0.8916640877723694,0.0919630378484726
iphone,All iPhone tricks in one posting,"&gt;We are coming from: http://www.reddit.com/r/iphone/comments/13cv4k/what_is_the_least_commonly_known_iphone_tiptrick/#

1. Tapping comments and stories in Alien Blue with 2 fingers gives up votes, 3 fingers give downvotes. 

2. Another AlienBlue tip: Two finger swipe from left to right on a comment will give you that comment's full thread of replies. 

3. Tapping ""123"" then tapping the character you want then finally clicking back to the main keyboard can be a hassle. Instead hold down ""123"", slide thumb to character you want to use then let go. The character will be inputted and your keyboard will be back to normal.

4. Tapping the clock/top bar on a page will take you quickly to the top.

5. Tap chunk of text w/ 2 fingers to highlight the whole thing. Works only when commenting/editing etc.

6. **Be careful, actually there is no proofed solution to turn this off again!**
If you go into the phone app, and dial \*3001#12345#*
and hit call, the ""Field Test"" application opens, which allows you to see the numerical value of your cellular reception, along with other information about the surrounding cell towers. In addition, if you hold down the power button until the ""Slide to power down"" slider comes up and then hold down the home button until the app exits, you can tap on the carrier name in the top left corner to change between the numerical value and the visual representation (in bars) without going into ""Field Test"" mode. 
&gt;The values are always negative. In my experience, around -50 is pretty much the best reception possible, while about -120 is the lowest you can go without losing reception.
Anything above -80 is good, and would be considered full bars
Anything below -100 is bad, and would be considered few bars

7. Double click the upper case arrow to set caps lock

8. Force close a single app by holding the power button until the slide to power off slider appears, then press and hold the home screen button. It will close any app that you are in and also remove it from the RAM, forcing it to completely reload upon re-opening. Fixes many problems. 

9. This may have been obvious but you can zoom in and out in the default Camera app by using two fingers to pinch and spread.

10. You can use more than a 4 digit PIN number. By turning off ""Simple Password"" and choosing only numbers instead and NO letters. You will get a number keypad to unlock the phone instead of a full keyboard. And you can use as many numbers as you would like and you you have to press OK to enter it. This makes your PIN number much much harder to guess. Since you would need to not only guess the number but also how many digits the pin contains to break in.

11. Swipe away banner notifications that inhibit you pressing a button on the top of the screen by swiping from RIGHT TO LEFT (will not work L TO R).

12. In Mail, holding the ""New Email"" button will display all your recent drafts. 

13. Tapping the screen with two fingers while in Maps will zoom out

14. Add a shortcut for your email address (example @@). It makes filling in online forms much, much easier. 
&gt;Settings &gt; general &gt; keyboard &gt; shortcuts

15. Put a tracking number for UPS or some other mail services in a text field (notes, e-mail, text) and it becomes a link to the tracking website. 

16. To continue listening to a video or music video from safari after exiting safari, just double click the home button, go to music controls, and press play. Also works on the lock screen, useful for music videos, etc. 

17. A lot of people didn't notice the Emoji inclusion in iOS6. Under General-&gt;International-&gt;Keyboards-&gt;Add new keyboard. Then when you're sending a text, there is a new button that appears that let's you switch between keyboard layouts, so pop into the Emoji keyboard to add those silly things, and hit the keyboard button to switch back to a regular keyboard.

18. Sleep Timer - While playing music in the Music App , toggle to the clock app click timer, click ""when timer ends"", scroll to bottom, click stop playing. Start Timer.

19. Pressing the volume buttons when alarm clock goes off for the snooze. I've caught myself accidentally turning it off instead of pressing the snooze button and find this method much safer and easier.

20. If you turn on accessibility settings you can tap out a custom vibration pattern or make the bright camera LED flash when you get a call or text. Then go into contacts, hit Edit and you can select the vibration below the ring tone. On IOS6, the custom vibration settings have moved to Settings &gt; Sounds. You click on each individual alert type and you have to option to set a custom vibration.

21. If you're getting a call you can just press the lock button to mute it instead of pressing decline. Pretty useful for when your phone starts blasting in your pocket during a class or meeting! Works also with the volume keys.

22. Holding the keyboard globe icon gives you a list of keyboards that are on.

23. Swipe from leftmost of screen to right in camera to access the camera roll instead of clicking it from the bottom. 

24. In camera app, use the volume buttons as a picture clicker.

25. Press the home button and lock button to take a screenshot

26. To reset the new message counter. Lets say you have a bunch of unread emails and you don't want to click through all of them. Click edit, select the first message, hold down the Mark button and click the same message to unselect it. Voila! All the messages are selected! Click Mark as unread.

27. When websites have embedded content that scrolls (like an extra area with scrollbars), you can use 2 fingers to navigate through it. This works with textareas for example.

28. When your is screen off or the phone is locked while listening to music or just audio in general: Double Tap home button to bring up iPod controls to Pause/Stop or skip. Also works to resume last playing audio track whether native or 3 party. 

29. You don't have to swipe the homescreen to go to the next, you can simply tap the left corner/right corner right above the first and forth icons on the dashboard. See screenies: http://i.imgur.com/zNR0M.png

30. Here's for the lazy ones: end a phone conversation by pressing the lock button. This way, you can terminate the call and locking the screen in one press. 

31. If you want to search for a word on a page with safari, enter it in the web search box on the top right and scroll all the way down, past the suggestions until it says 'on this page'. 

32. You can use rich text styling in the mail app. Select some text and bring up the context menu, then press the arrow right. You can use bold, italics, underline, and indenting.

33. *#06# displays your iPhone's IMEI. Good to take down if you don't have the original box around you. You'll need the IMEI if your phone gets stolen or dislocated, in order to file a report with the police and/or a claim with the insurance company.


to be continued",251,2637,2012-11-18,AAPL,0.057027509436011314,0.9145644009113312,0.028408118523657322
apple,iMessage down?,My messages aren't being sent through iMessage. My network is working both on WiFi and on LTE...so is it down for anyone else?,276,756,2012-11-18,AAPL,0.07172435522079468,0.9066497087478638,0.02162589132785797
apple,It's kind of hilarious that Rayman iOS is graphically superior to the consoles versions,,51,311,2012-11-18,AAPL,0.0192942526191473,0.9395183324813843,0.0411873422563076
iphone,Fuck you newsstand.,,27,202,2012-11-18,AAPL,0.3746561110019684,0.584800124168396,0.040543727576732635
iphone,I like iPhones.,,73,162,2012-11-18,AAPL,0.020266856998205185,0.9165639877319336,0.06316917389631271
ipad,My iPad Lego Stand!,,6,93,2012-11-18,AAPL,0.019043754786252975,0.9142118692398071,0.06674434244632721
apple,We’re Getting Very Close To The Perfect MacBook | TechCrunch,,123,87,2012-11-18,AAPL,0.017358209937810898,0.8802234530448914,0.10241832584142685
iphone,iMessage down.,"Again...

Edit: Back up here in Australia.",59,63,2012-11-18,AAPL,0.0728912204504013,0.9037966728210449,0.02331206202507019
apple,Has anyone taught themselves Xcode?,"Or really any other program used to make iPhone apps.  I've been trying to teach myself using random articles online and YouTube videos, but It's not very helpful.
What did you use to learn?",60,57,2012-11-18,AAPL,0.03524809703230858,0.9314767122268677,0.03327517211437225
apple,OS X Smilodon,"We've had Cheetah, Puma, Jaguar, Panther, Tiger, Leopard, Snow Leopard, Lion and Mountain Lion. That leaves the Clouded Leopard as the only big cat Apple hasn't used (and hasn't leopard been used enough already?). Seeing as they have already used the Cheetah, we can assume that opens up Felinae for use, perhaps Lynx, Bobcat, Ocelot, Cougar (I know, Pumas and Mountain Lions are already up there) and Caracel. I'm not sure that OS X Jaguarundi really has the right ring to it.

I figure this means that it won't be long before Apple must start looking beyond Panthera and Felinae for OS X names. I'm leaning towards Machairodontinae next. By my estimates, sometime around 2018 we'll be loading up [OS X Smilodon](
http://imgur.com/Zm3l3)! How awesome would that be?",45,43,2012-11-18,AAPL,0.023932291194796562,0.9259556531906128,0.05011202022433281
apple,Oprah uses her iPad to tell us how much she loves the Surface,,257,1365,2012-11-19,AAPL,0.02329356223344803,0.8972933292388916,0.07941311597824097
iphone,I'm kind of in love with my Bamboo Case (by tmbr) for my iPhone 4,,62,350,2012-11-19,AAPL,0.02207046002149582,0.8920106291770935,0.08591891080141068
apple,Early builds of Apple’s upcoming OS X 10.9 include Siri and Maps integration,,304,265,2012-11-19,AAPL,0.011801538057625294,0.9103637933731079,0.07783472537994385
iphone,Not the most descriptive patch notes ever,,10,218,2012-11-19,AAPL,0.041512083262205124,0.9330512881278992,0.025436582043766975
mac,The pressure of studying a design degree.,,39,101,2012-11-19,AAPL,0.03903554752469063,0.9020751714706421,0.05888925492763519
iphone,This actually exists..,,12,99,2012-11-19,AAPL,0.026692871004343033,0.7480352520942688,0.2252718210220337
ipad,LPT: Stick a Post-it to the back of your iPad and use it when needed to reflect the speaker sound to you.,,33,96,2012-11-19,AAPL,0.041049014776945114,0.9203519821166992,0.03859899193048477
apple,"Sanded Down Black iPhone 5 Chamfers, Forget Where I Saw This.",,51,92,2012-11-19,AAPL,0.02172013930976391,0.8894469141960144,0.08883291482925415
apple,An iPad Lover’s Take On The Surface With Windows RT | TechCrunch,,39,89,2012-11-19,AAPL,0.021490637212991714,0.9021337628364563,0.07637565582990646
apple,Apple Finally Signs AC/DC To iTunes Music Store,,46,89,2012-11-19,AAPL,0.02875375561416149,0.8622369766235352,0.1090092882514
apple,"Damn it, why can't I just press the right arrow to move the selected button to ""Move to Trash""??",,160,1376,2012-11-20,AAPL,0.08769481629133224,0.8910470008850098,0.02125813066959381
apple,"$10,000 investment in Apple stock 10 years ago is worth $667,159.85 today",,245,981,2012-11-20,AAPL,0.021982768550515175,0.8929502964019775,0.08506697416305542
iphone,And next!. Every 'useful' thing you can say to Siri!,"ASKING ABOUT CONTACTS

What's Emily's address?
What is Susan Park's phone number?
When is my wife's birthday?
Show Lindsey's home email address
What's my brother's work address?

FINDING CONTACTS

Show Brian Conway
Find people named Park
Who is Jimmy Patrick?

ESTABLISHING RELATIONSHIPS

My mom is Susan Park
Jimmy Patrick is my brother
Call my brother at work
APP LAUNCHING

Open Photos
Play Infinity Blade II

ADDING EVENTS

Set up a meeting at 9
Set up a meeting with Jimmy at 9
Meet with Emily at noon
Set up a meeting about hiring tomorrow at 9am
New appointment with Susan Park Friday at 3
Schedule a planning meeting at 8:30 today in the boardroom

CHANGING EVENTS

Move my 3pm meeting to 4:30
Reschedule my appointment with Dr. Patrick to next Monday at 9am
Add Emily to my meeting with Brian
Cancel the budget review meeting

ASKING ABOUT EVENTS

What does the rest of my day look like?
What's on my calendar for Friday?
When is my next appointment?
When am I meeting with Jimmy?
Where is my next meeting?

USING ALARMS

Wake me up tomorrow at 7am
Set an alarm for 6:30am
Wake me up in 8 hours
Change my 6:30 alarm to 6:45
Turn off my 6:30 alarm
Delete my 7:30 alarm

CLOCK

What time is it in Berlin?
What is today's date?
What's the date this Saturday?

TIMER

Set the timer for ten minutes
Show the timer
Pause the timer
Resume
Reset the timer
Stop it

SENDING EMAIL

Email Emily about the trip
Email Lindsey about the change in plans
New email to Susan Park
Mail Dad about the rent check
Email Dr. Patrick and say I got the forms, thanks
Mail Emily and Brian about the party and say I had a great time

CHECKING EMAIL

Check email
Any new email from Jimmy today?
Show new mail about the lease
Show the email from Emily yesterday

RESPONDING TO EMAIL

Reply Dear Susan sorry about the late payment
Call him at work

FACETIME

FaceTime Brian
Make a FaceTime call to Susan Park
FACEBOOK

Post to Facebook headed to the new Pixar movie
Write on my wall just landed in San Jose!

FIND MY FRIENDS

Where's Brian?
Where is my sister?
Is my wife at home?
Where are all my friends?
Who is here?
Who is near me?
Let me know when Jimmy leaves home
Let Susan know when I leave work

LOCKSCREEN READING

Read my notifications
Do I have any new messages?

MAPS

Show me the Golden Gate Bridge
Show me a map of 1 Infinite Loop Cupertino California
LOCAL BUSINESSES

Find coffee near me
Where's the nearest coffee shop?
Find a gas station near work

NAVIGATION

How do I get home?
Directions to my dad's work
Get me directions from San Francisco to Santa Barbara
What's my next turn?
Are we there yet?
What's my ETA?
Find a florist along my current route

MAPS

Show me the Golden Gate Bridge
Show me a map of 1 Infinite Loop Cupertino California
LOCAL BUSINESSES

Find coffee near me
Where's the nearest coffee shop?
Find a gas station near work

NAVIGATION

How do I get home?
Directions to my dad's work
Get me directions from San Francisco to Santa Barbara

SENDING MESSAGES

Tell Susan I'll be right there
Send a message to Brian Conway
Send a message to Emily saying how about tomorrow
Tell Lindsey the show was great
Send a message to Susan on her mobile saying I'll be late
Send a message to 408 555 1212
Text Brian and Emily where are you?

READING MESSAGE ALERTS

Read my new messages
Read it again

RESPONDING TO MESSAGES

Reply that's great news
Tell him I'll be there in 10 minutes
Call her

SEARCHING FOR MOVIE INFORMATION

Find Disney movies
What comedies are playing?
Who starred in Tron Legacy?
Who directed Finding Nemo?
What is Toy Story 3 rated?

FINDING MOVIE SHOWTIMES

I want to see the new Pixar movie
What's playing at the movies tomorrow?
What's playing at Main Street Cinema

FINDING MOVIE THEATERS

Find some movie theaters near my office

READING MOVIE REVIEWS

Show me the reviews for Toy Story 3

MAJOR MOVIE AWARDS

Which movie won Best Picture in 1983?

MUSIC

Play Walk by Foo Fighters
Play Little Broken Hearts shuffled
Play Norah Jones
Play some blues
Play my party mix
Shuffle my roadtrip playlist
Play
Pause
Skip
NOTES

Note that I spent $12 on lunch
Note to self: check out that new Norah Jones album
Find my meeting notes
Show me my notes from June 25

PHONE

Call Brian
Call Emily's mobile
Call Susan on her work phone
Call 408 555 1212
Call home
FaceTime Emily

REMINDERS

Add artichokes to my grocery list
Add skydiving to my bucket list
Remind me to call mom
Remind me to call my mom when I get home
Remember to take an umbrella
Remind me take my medicine at 6am tomorrow
Remind me to pick up flowers when I leave here
Remind me when I leave to call Brian
Remind me to finish the report by 6
Victor Agreda is my hairdresser
Kelly Guimont is my colleague

SEARCHING FOR RESTAURANTS

Find some burger joints in Baltimore
Good Mexican restaurants around here

RESERVATIONS

Table for four in Palo Alto tonight
Make a reservation at a romantic Italian restaurant tonight at 7pm
RESTAURANT REVIEWS

Show me the reviews for Seven Hills in San Francisco

SCORES

Did the Giants win?
How did Kansas City do?
What was the score the last time the Tigers played the Red Sox?
Show me the football scores from last night

GAME SCHEDULES

When do the Giants play next?
When is the Boston Red Sox's first game of the season?
Show me the schedule for baseball

PLAYER INFORMATION

Who has the highest slugging percentage?
Who has the most home runs on the Giants?
Who has the most goals in soccer?
Which quarterback has the most passing yards

TEAM INFORMATION

Show me the roster for the Dodgers
Who is pitching for the Miami Marlins this season?
Is anyone on the Red Sox injured?

STOCKS

What's Apple's stock price?
What is Apple's PE ratio?
What did Yahoo close at today?
How is the Nikkei doing?
How are the markets doing?
What is the Dow at?

TWITTER

Post to Twitter another beautiful day in Cupertino
Tweet with my location great concert
Tweet meeting up with Brian Conway for lunch today
Tweet the new iPad looks insanely great! hashtag Apple Keynote
WEATHER

What's the weather for today?
What's the weather for tomorrow?
Will it rain in Cupertino this week?
Check next week's forecast for Burlington
What's the forecast for this evening?
How's the weather in Tampa right now?
How hot will it be in Palm Springs this weekend?
What's the high for Anchorage on Thursday?
What's the temperature outside?
How windy is it out there?
When is sunrise in Paris?

WEB SEARCH

Search the web for polar bears
Search for vegetarian pasta recipes
Search the web for best cable plans
Search Wikipedia for Abraham Lincoln
Bing Foo Fighters (We know, we know. Sorry.)

WOLFRAM ALPHA

What does repartee mean?
How many calories in a bagel?
What is an 18% tip on $86.74 for four people?
Who's buried in Grant's tomb?
How long do dogs live?
What is the Gossamer Condor?
What's the square root of 128?
How many dollars is €45?
How many days until Christmas?
How far away is the Sun?
When is the next solar eclipse?
Show me the Orion constellation
What's the population of Jamaica?",56,722,2012-11-20,AAPL,0.06990282237529755,0.9029170572757721,0.02718016318976879
iphone,Huge list of things to say to Siri..,,30,403,2012-11-20,AAPL,0.05811513960361481,0.8955051898956299,0.04637964069843292
apple,TIL Apple has a cutout in the bottom of the tables for bags.,,101,388,2012-11-20,AAPL,0.08817234635353088,0.8268298506736755,0.08499781787395477
ipad,Kids Don't Want Apple TV... ಠ_ಠ,,96,132,2012-11-20,AAPL,0.20501738786697388,0.770792543888092,0.02419009804725647
iphone,"It took 6 months, but my game is finished! Promo codes/download/video demo inside.",,48,74,2012-11-20,AAPL,0.03606637567281723,0.9167534112930298,0.047180261462926865
apple,"In a follow up to ""my husky ate my appletv remote.""",,22,58,2012-11-20,AAPL,0.0256649162620306,0.918231725692749,0.056103311479091644
iphone,"Apple Maps alternative Nokia HERE now available, featuring offline maps and coverage of 200 countries",,31,47,2012-11-20,AAPL,0.01569371297955513,0.9316315650939941,0.05267477035522461
apple,"Finally, Nokia HERE Maps hits the App Store!",,46,45,2012-11-20,AAPL,0.01636360213160515,0.8690619468688965,0.11457452923059464
apple,Impressive.,,164,668,2012-11-21,AAPL,0.057082511484622955,0.8086843490600586,0.13423314690589905
iphone,GTA Vice City coming to iOS December 6th,,60,413,2012-11-21,AAPL,0.02306743524968624,0.9073948860168457,0.06953771412372589
apple,Apple’s new Spaceship campus set to open in 2016 as project experiences delays,,5,120,2012-11-21,AAPL,0.013394240289926529,0.787091851234436,0.19951392710208893
iphone,Apparently someone didn't do their homework on the iPhone 5...,,16,105,2012-11-21,AAPL,0.0835036039352417,0.878825306892395,0.03767112269997597
iphone,My greatest achievement as a non-native English speaking person,,29,60,2012-11-21,AAPL,0.0192380640655756,0.9099676609039307,0.07079421728849411
apple,The ridiculous instructional video my friend and I made for the equally ridiculous app we created...,,13,60,2012-11-21,AAPL,0.2785225510597229,0.6979802846908569,0.023497100919485092
apple,Grand Theft Auto: Vice City 10th Anniversary Edition arriving on iOS December 6th for $4.99,,9,53,2012-11-21,AAPL,0.048197705298662186,0.9073061347007751,0.04449615627527237
apple,OS X 10.6 Snow Leopard available from Apple again,,24,52,2012-11-21,AAPL,0.017158158123493195,0.91805499792099,0.06478691101074219
mac,2001 iBook Graphite Throwbacktop,,10,49,2012-11-21,AAPL,0.0645114853978157,0.8832940459251404,0.05219455063343048
apple,Hot corners: does anyone here use it?,"I ask because I see a lot of posts here where using hot corners would make life easier.

To set hot corners: System preferences --&gt; Mission control --&gt; Hot corners

I've set the top right to display sleep, top left to mission control, bottom left to show the desktop and bottom right to launchpad. What other configurations do you use?",47,44,2012-11-21,AAPL,0.02439134567975998,0.937121570110321,0.03848712891340256
iphone,This is an absolutely fantastic iOS concept.,,67,590,2012-11-22,AAPL,0.013048987835645676,0.8690589666366577,0.11789204925298691
apple,"After all these blazingly fast LTE posts I present to you:
Welcome to the Netherlands where you pay 50€/month for this..",,102,434,2012-11-22,AAPL,0.025190571323037148,0.8946019411087036,0.0802074670791626
apple,"Do Not Buy an iPad from BestBuy this black friday. (or ever) they are selling returned and refurbished iPads as new under this deal, and are instructed to not accept returns or exchanges of any kind for any reason. I know this from first had experience.",,212,421,2012-11-22,AAPL,0.012362834997475147,0.8476440906524658,0.1399931162595749
apple,I swear I've seen a similar style to this somewhere else...,,166,332,2012-11-22,AAPL,0.014879371970891953,0.8782104253768921,0.10691018402576447
apple,Office Music Player (iMac G4 Lamp),,38,265,2012-11-22,AAPL,0.014632104896008968,0.8991221189498901,0.08624575287103653
apple,I hope this happens! - A Concept to Improve Notifications and rid iOS of its 'Legacy' UI (mockups) | The Verge Forums,,30,139,2012-11-22,AAPL,0.0189980361610651,0.877376139163971,0.1036258339881897
apple,How Apple can get into console gaming - A personal project to teach myself some After Effects.,,51,94,2012-11-22,AAPL,0.044965650886297226,0.923602819442749,0.03143145143985748
apple,Using Slate: A Hacker's Window Manager for Macs,,7,81,2012-11-22,AAPL,0.017256854102015495,0.9259094595909119,0.05683371052145958
ipad,1080P youtube via the Jasmine client!,"Just found out you could set the resolution in the options menu to 1080P. If you have set it to auto it will be 720P i believe. Always bothered me that you couldn't do that in safari. Anyway, i didn't know if everyone knew so i made this post :)",17,75,2012-11-22,AAPL,0.025239454582333565,0.9166684150695801,0.05809210240840912
apple,"""…using Dictation on Mountain Lion turns the fan off briefly on the MacBook…""",,14,65,2012-11-22,AAPL,0.015335454605519772,0.9163875579833984,0.06827700883150101
apple,Fried apple. ;_;,,88,1596,2012-11-23,AAPL,0.08098501712083817,0.8647660613059998,0.05424894019961357
apple,Pushing the boat out i see...,,56,919,2012-11-23,AAPL,0.04762515798211098,0.8239867687225342,0.12838806211948395
apple,iTunes through the ages - We look back at 12 years of iTunes releases.,,52,303,2012-11-23,AAPL,0.02892584726214409,0.9359639883041382,0.03511016443371773
apple,"Apple Fires Samsung As MacBook, iPad Battery Maker | Cult of Mac",,77,238,2012-11-23,AAPL,0.022322142496705055,0.7329378128051758,0.2447400987148285
iphone,Here’s A Huge List Of iOS Apps / Games Gone Free On Black Friday 2012 [Limited Time Only] |,,33,208,2012-11-23,AAPL,0.03566766530275345,0.9015552401542664,0.062777079641819
apple,Thanksgivings got a lot more civil since the iPhone.,,18,152,2012-11-23,AAPL,0.628341019153595,0.27129068970680237,0.10036822408437729
iphone,"Earlier this year, I made an app that allows you to share your iPhone text messages, and I'm making it free to you, r/iPhone, for Black Friday!","[Here's the link to the app I made](http://siteesi.getapp.cc/app/554594252), with details on how you can stitch together your favorite screenshots (like so: http://imgur.com/G5fou).  I'm very proud of having done this, and I'm making it free for Reddit through Black Friday.  Hope you like it!",45,135,2012-11-23,AAPL,0.013887317851185799,0.8545931577682495,0.13151946663856506
