subreddit,title,selftext,num_comments,score,created_utc,stock/sector,neg,neu,pos
apple,"Amazing iOS ""resizable app icons""-concept",,326,1190,2012-11-01,AAPL,0.025406407192349434,0.9236418008804321,0.050951797515153885
apple,2 year old girl cousin dresses up as Steve Jobs for Halloween!,,48,1158,2012-11-01,AAPL,0.16587968170642853,0.7811775803565979,0.05294271931052208
apple,I think my iMac is trying to tell me it's in distress.,,32,602,2012-11-01,AAPL,0.06136369705200195,0.8881411552429199,0.05049508437514305
iphone,Apple Finally Fixed This UI Inconsistency We've Been Complaining About! [6.1 Beta],,120,467,2012-11-01,AAPL,0.025293070822954178,0.8840123414993286,0.0906945988535881
iphone,Why is this happening?,,113,294,2012-11-01,AAPL,0.047876231372356415,0.8577889204025269,0.09433480352163315
apple,"iPad mini just landed in my hands. I must admit, the screen is pretty sharp!",,161,239,2012-11-01,AAPL,0.01451597735285759,0.7877161502838135,0.19776789844036102
apple,"Apple told to rewrite 'Samsung did not copy' statement, post it on front page until Dec 14th",,224,187,2012-11-01,AAPL,0.04078105464577675,0.9350343942642212,0.024184532463550568
iphone,iOS 6.0.1 has been released!,,76,181,2012-11-01,AAPL,0.019945837557315826,0.8470326066017151,0.1330215185880661
apple,Steve Jobs [Costume] Mini me...,,3,180,2012-11-01,AAPL,0.06210492178797722,0.9052320718765259,0.0326630100607872
apple,"Apple Releases iOS 6.0.1 with Fixes for Keyboard Screen Glitch, Camera Flash Issues, and More",,80,122,2012-11-01,AAPL,0.023085400462150574,0.9355331659317017,0.041381437331438065
apple,My little sister just pulled her 4th gen iPod touch apart and replaced the screen - all on her own. She's 13!,,335,2144,2012-11-02,AAPL,0.03184424713253975,0.8700234889984131,0.09813228249549866
apple,iPhoto face recognition is more awesome then I thought! (xpost),,34,519,2012-11-02,AAPL,0.021821504458785057,0.9303829669952393,0.047795530408620834
apple,"So Disney bought Lucas Films. The Steve Jobs Foundation owns part of Disney. George Lucas owns the word ""droid"" and licenses it out to the cell phones. Which means now, every droid that is sold, the Steve Jobs Foundation gets money.",,75,303,2012-11-02,AAPL,0.013083809055387974,0.9252883791923523,0.061627842485904694
iphone,What causes this to happen?,,63,238,2012-11-02,AAPL,0.05143186077475548,0.926379382610321,0.022188760340213776
iphone,So I just moved from iPhone 4 to Samsung Galaxy S3...,"I have had iPhones since the 3 and my wife and I trade off upgrades. In other words, she has a 4s and I had a 4 - it was my turn to upgrade when the 5 came out!

I love 99% of the iPhone experience, but the screen has been killing me, I NEED a bigger screen. I had already changed accessibility settings and the fonts were starting to look stupid. I was really hoping for a Galaxy S3 sized iPhone 5...

Needless to say, I was very disappointed when the news was released on the Apple version of making the screen larger. That wasn't what I was looking for when I meant larger.

So... I did some playing and had just about decided on the Note 2 when it came out, and an opportunity came up to get a Galaxy S3 through my work.

Here is what I am finding.

1. PATENT LAWS SUCK. Everything is slightly different. Just enough to not be exactly the same, and just enough to require a complete relearn of the smartphone experience.

2.  The larger screen is AMAZING. The Galaxy is truly a beautiful visual experience. 

3. Interestingly, even though the screen is awesome, side by side, the iPhone has a MUCH brighter, whiter, white. The Samsung has a very cool blue tint. You would never know unless you compare them side by side.

4. The iPhone feels way higher quality. The screen feels thicker, and it just feels nicer.

5. The iPhone is LIGHT years ahead on e-mail. It is ALMOST a deal breaker just how bad android email really is - but I am learning that there are apps that bridge the gap somewhat. I have completely given up on having all my email accounts in one app now and the email app I am leaning towards cost $20! That's enough to basically make the phone just $20 more expensive!

6. I thought texting was horrible, but I'm finding apps that bridge this gap that are inexpensive (free in many cases) that let me load an iPhone theme and almost look/act the same.

7. I'm finding apps are the only thing making android usable. For instance, the keyboard is TERRIBLE. I downloaded SwiftKey and it is simply amazing. The simple keyboard app takes the android typing experience from being way worse than the iPhone and makes it way better than the iPhone.

8. Notifications are terrible. iOS has this down beautifully. I know when I have a text, email, voicemail, phone call and more. With the Samsung, it makes all kinds of noises and gurgles that are meaningless to me right now. I'm sure with some work I will get it fixed, but out of the box it is bad.

9. Editing is a mixed bag. I LOVE the cursor and ability to move the cursor around text easily. Way better than iPhone and I suspect iPhone doesn't have this because of patent issues. On the other hand, things like ""select all"" are not obvious to me.

10. Android isn't intuitive. Apple wins hands down here. I'm constantly staring at my screen wondering, ""how the eff do I send that email"" or ""how do I make the keyboard go back down and get out of my way?"" Lots of things have weird symbols and I have no idea how to tell what to do! It is very frustrating.

11. Most everything you do on Android is a workaround or overly difficult, non-intuitive chore. For instance, if you want to make a folder on a ""home screen"" on iPhone, you drag one icon on top of another and name the newly created folder. With Android, you press and hold a blank spot on the home screen, then select edit and add folder and then you can put stuff in the folder and edit the name of the folder. I didn't even realize it HAD folders and ended up buying a $1.50 app that let me do custom folders (with more visual options) before I learned that you could do plain ones for free.

12. Visually, Android is stunning and hugely customizable. If you have to trick out your workspace, it is for you.

13. Battery life is atrocious. I thought iPhone was bad, I bet I get HALF the life out of the S3! I will either need an extra battery or one of the thicker 4,000+ maH batteries, but I already bought a Seidio Holster/Case so that isn't a great option. I end up charging in the afternoon!

14. The app stores are very close in having all the same apps you NEED. I was afraid I wouldn't have all my favorite apps from the iPhone, but they are in the play store. Maybe not as many fart apps, but the important stuff is there. I DO like that I don't have to enter my frigging password every time I download a FREE app. Drives me crazy that the apple App Store makes me enter my p/w for a free app.

I'm sure that I have a lot to learn, I've only had the Galaxy S3 a few days (about 4 days) but those are my first I impressions.

If someone were to ask me if they should switch from iPhone to the Samsung Galaxy S3, I would say, ""If you are happy with the iPhone - stay with the iPhone. If you are unhappy with the iPhone, stay with the iPhone. If you are unhappy with the iPhone screen size, then consider the Samsung Galaxy S3 or perhaps even the Samsung Note 2 but be ready for some things you aren't going to like as well as the iPhone!""

To Apple's credit, the overall user experience is far better and far more polished than Android. Android is catching up, but IMPORTANT apps like email just aren't there and honestly, WHY? Why isn't email as good as Apple by now? I get emails that do not fit on screen, I can barely tell what is read and what isn't. I had to download touchdown HD to get a decent exchange app and it cost $20. Gmail is terrible. Most Android mail options are NOT push... It is really poor. And that is a shame because email is a make-it-or-break-it app!

On the other hand, why can't apple offer a larger sized iPhone? They lost me because of that and I REALLY didn't want to leave.

Feel free to ask questions and I'll tell you what I can...

Tom Steele",304,217,2012-11-02,AAPL,0.035589464008808136,0.8889374732971191,0.07547306269407272
iphone,Sharing my Pokemon wallpaper:,,19,183,2012-11-02,AAPL,0.028261035680770874,0.9119186401367188,0.059820327907800674
iphone,"Heads up to App developers: If I get a notification from your app and I didn't sign up for it, I will delete it immediately.",,30,123,2012-11-02,AAPL,0.03604676201939583,0.9278368353843689,0.03611639514565468
mac,"Just got this baby(black macbook). Put OSX Lion on a 128 GB SSD, upgraded RAM to 4 GB. Awesome=]",,78,121,2012-11-02,AAPL,0.013556690886616707,0.8674859404563904,0.11895734816789627
iphone,"My game ""SimplePhysics"" is free today. It is a physics &amp; engineering puzzle game and includes a dozen challenges that will destroy your mind.",,60,109,2012-11-02,AAPL,0.033356405794620514,0.9248861074447632,0.04175747558474541
apple,Emoji Apps Are Getting Kicked Out Of The Apple App Store,,57,80,2012-11-02,AAPL,0.07280449569225311,0.8587662577629089,0.06842928379774094
apple,Only time will tell.,,251,1523,2012-11-03,AAPL,0.08549398928880692,0.8531419634819031,0.061364032328128815
apple,At the Apple store last night and someone changed all of their wallpapers to this...,,79,1302,2012-11-03,AAPL,0.06779593974351883,0.8805885314941406,0.051615480333566666
iphone,Why the heck didn't Apple think of this yet?,,215,635,2012-11-03,AAPL,0.11391770094633102,0.8105087280273438,0.07557358592748642
apple,"Fake ""iMac touch"" ad, but very well done nonetheless",,78,446,2012-11-03,AAPL,0.011995027773082256,0.5201400518417358,0.46786484122276306
apple,Haven't charged up my iPad mini yet since I got it Friday morning. It's on 22%. Awesome battery!,,40,282,2012-11-03,AAPL,0.023808112367987633,0.853672444820404,0.12251948565244675
apple,Hey guys - got the iPad Mini installed in my car yesterday. Wanted to share,,105,234,2012-11-03,AAPL,0.01604550890624523,0.8395750522613525,0.14437943696975708
ipad,Little known feature in pages. Just tap the word count.,,10,116,2012-11-03,AAPL,0.07961665093898773,0.902047336101532,0.018336070701479912
ipad,An iPad Mini Review by a Casual iPad Lover,"WARNING: LONG POST AHEAD.

**TL;DR: I love my new iPad. I think it's perfect for the causal tablet user. Reasons below.**


In the interest of full disclosure, I should tell you that I am writing this review from my brand new iPad mini. I have been in possession of this device for slightly more than twelve hours; still, I feel compelled to write a review of my initial, genuine reactions to my new favorite gadget.

I have, in preparation for launch day, read scads of professionals’ reviews, from scathing to glowing. I’ve read up on the product specs, even though pixel counts mean virtually nothing to me as a newbie to the tablet world. I even google searched “best iPad apps” and made meticulous lists as to which apps I would download for my new device once I got my hands on it.This morning, I awoke early (no small feat for a college student) and drove out to my local Best Buy. I waited patiently for an available sales representative and declared my desire for a 16GB white iPad mini. I stood awkwardly in the store front as he went to go get one from the back - and then.

There it was, as pristinely packaged as all of the other Apple products that I have ever purchased.The iconic white box with its minimalistic sans serif font made me want to rip it open right there in the store - luckily, I had the restraint not to. I paid the $329 plus tax - a somewhat steep price for an 8” tablet - and proudly carried my purchase home in its blue plastic bag.

After arriving home and figuring out how to set up the charger (yes, I actually had trouble plugging it in), I went about my day, attending class as I let the little thing do its charging. After class, I could hardly contain my excitement as I walked back to my dorm with some friends; I knew it would be done charging.

Sure enough, when I clicked the power button, the battery bar read 100%. Excited, I unplugged it and got to work configuring the settings and downloading apps. I happily spent the rest of my morning and a good portion of my afternoon toying with the device. I played games on it, listened to some radio, and experimented with the note taking apps. I carried it with me to and fro, holding it one-handedly as I strode across campus or laid in bed.

I think it’s safe to say that I was bitten by the iPad bug: my first tablet, and I’m already obsessed with it.

Fan-girling aside, however, the iPad mini holds it own, even for the non-starstruck. At just under 8” (7.9”, to be exact), the iPad mini is the perfect size for a student like me: small enough to function as an e-reader, but large enough to use to surf Facebook when procrastinating on a paper. It lacks the near-laptop feel of my brother’s full-sized iPad 2, but that isn’t necessarily a bad thing. At this size, the mini allows or ease of handling when strolling through campus or sprawling supine on the couch. It is also lightweight enough to allow for this one-handed ease of hefting, which is a particularly nice bonus for students with heavy textbooks.

As for the screen, which has been the biggest complaint that I have heard, there is no problem. While I don’t doubt that a lower pixel count and lack of Retina display is a deal breaker for some, I haven’t found it to cause any issues. As a first time iPad user, I don’t know the difference, and think the screen crisp and clear enough for all of my reading, gaming, and video-watching needs.

Of much more concern to me, in fact, was the keyboard. I worried that, on such a small screen, the keyboard would be unnavigable, which would be a major drawback for an avid typist such as myself. I was pleasantly surprised, then, to find the portrait-orientation to be the perfect size for two-thumb typing, which I have quickly grown to love. (As mentioned, I am writing this review on the iPad in question.) The landscape-orientation keyboard leaves something to be desired in terms of ease of navigability, being ever-so-slightly too wide for my thumbs to cover, but that is hardly a deal-breaker with the more convenient portrait-orientation keyboard. If a full keyboard that will allow you to rest all eight fingers on the home keys is what you desire, however, it’s likely that this is not the tablet that you are looking for.

And then, of course, we have the functionality. As an owner of a MacBook, I am comfortable with the Apple interface, though I found my laptop took some getting used to. Not so with the iPad. The layout is clean and intuitive, allowing me to very quickly organize and set up my device. I adjusted immediately to the ins- and-outs of the interface, grabbing and dragging apps and playing around with settings. As for the functionality of the mini as compared to other models, I can only speak based on brief experience with my brother’s iPad 2, but the experience does indeed seem to be the”full iPad experience” that Apple so proudly touted. Each and every one of the myriad of apps that I installed runs quickly and smoothly, seeming well adapted to my device.

Other salient points of the design include aesthetic value - the iPad mini is cute. My model is the white-and-aluminum option, and I’m not the only one who finds it overwhelmingly appealing. Already, I have received many compliments as to how “adorable” or “attractive” my mini is, and it’s only the first day that I’ve had it. The battery life is also nothing to scoff at: although I can’t speak for the long term, I can say that I have been using this little bugger almost constantly all day, and it’s yet to give out on me.

Finally, some would say that you should just spare the extra few bucks and take the plunge with a full sized iPad, but I disagree. The mini has its own advantages that make it more than just a shrunk down iPad. It’s in its own market, the market of the mid sized tablets, and rightfully so. And while the price might be exorbitant, I would be willing to argue that if you are looking for the iPad experience, then it is worth the incremental cost.

All in all, I think it’s safe to say that I am pro-iPad mini, for these reasons and more. And while I may just be a layperson goofing around joyfully on her first tablet, I like to think that my opinion matters as far as laypeople go - because that’s going to be a large section, if not the majority, of the market for the iPad mini. Not your tech gurus, but your everyday Dick and Jane, looking to add a functional, fun tablet to their lives. And I think that, with the iPad mini, Dick and Jane will like what they see.",59,112,2012-11-03,AAPL,0.03607842139899731,0.9210174083709717,0.04290413483977318
iphone,Does this annoy anyone else? (Podcasts app) can't see full description,,34,106,2012-11-03,AAPL,0.05326039716601372,0.9221598505973816,0.02457975409924984
iphone,One of My Fave IPhone 5 Wallpapers:),,4,78,2012-11-03,AAPL,0.02751891128718853,0.9208633303642273,0.051617830991744995
apple,So what ever happened to Apple making Facetime open?,,298,1180,2012-11-04,AAPL,0.057533495128154755,0.8934656977653503,0.04900079220533371
iphone,"By Popular demand, here are the i4 sized backgrounds.",,32,543,2012-11-04,AAPL,0.012607351876795292,0.8529247641563416,0.13446789979934692
apple,"I just removed my optical drive and replaced it with a SDD and added 16GB RAM to my MacBook Pro. This thing is now a ROCKET! If you haven't done this yet, I highly recommend you do!","Sure, not everyone needs to do this, but if you want to feel like you're working on a machine that is beyond what's available today in terms of performance, stability, and beauty, then take out that old optical drive (and put it into an external enclosure) and replace it with a solid-state drive. Personally, I took the hard drive out and put it into the drive expander and put the solid-state drive into the spot with the hard drive was, and added the 16GB RAM and I can't believe this is the same machine. I could never go back!

What amazed me most of all, however, was just how simple Apple made it for this to happen. I've done lots of PC upgrades, and I've NEVER had any upgrade go this easily! I literally just had to clone the HDD to the SDD, tell the computer to boot from the SDD from now on, and reboot. Done! It was amazing! There are lots and lots of articles and videos on Youtube to show how to do it. It's not scary or difficult at all. To be honest, it's even easier to do than the videos make it appear.

Like I said in the title; I highly recommend you do this. The prices for RAM and SDD's are so low now, that if you want the ultimate performance, it's an easy way to get it.

For the record, my MacBook Pro is a late-2011 model 2.2GHz i7. Only now, it's turbo-charged!",284,537,2012-11-04,AAPL,0.03543571010231972,0.9141722321510315,0.050392065197229385
apple,"So I facetime'd with my wife at the Apple Store on an iPad Mini, thought I signed out, apparently iMessage is still signed in.",,55,388,2012-11-04,AAPL,0.038224950432777405,0.905166506767273,0.05660852789878845
iphone,True story since the iPhone 5 for me,,15,293,2012-11-04,AAPL,0.027156826108694077,0.8931455612182617,0.07969757914543152
apple,Just noticed that Apple Maps fixed the suggestions I made.,"I was bored this afternoon and decided to get directions to places i had reported errors with in the Salt Lake City area. To my surprise they'd all been fixed. Pretty cool to see something happening, even though many feel like it's too little too late.",99,192,2012-11-04,AAPL,0.01976287178695202,0.8048238158226013,0.17541326582431793
apple,"Evernote 5 for iOS coming soon: new UI, revised places view, same inability to forget (video)",,13,74,2012-11-04,AAPL,0.028385832905769348,0.907802402973175,0.0638117641210556
iphone,"Pro Tip: For those of you with the Otterbox Defender series cases, use the hunky belt loop holster as an in-car phone holder!",,10,64,2012-11-04,AAPL,0.022988511249423027,0.9398750066757202,0.037136517465114594
mac,"My Macbook does this every time I start up, is it anything to worry about?",,23,58,2012-11-04,AAPL,0.04580824077129364,0.9220473766326904,0.03214437887072563
ipad,"For people with the Mini, how is it for games and web browsing? Compared to other tablets?","Some of you likely saw my post yesterday as well. I'm still undecided between the Nexus 10, Nexus 7, and the iPad Mini. 

I mainly want to play games and browse the web. I'll probably watch videos a good bit as well. 

The iPad definitely has a larger selection of games and it's got a (presumably) good version of Chrome. So it was really a no brainer. 

Until I saw the specs. 

They aren't up to par with other tablets but Apple's great at optimizing things so I assume it still works well. But I'm obviously not going to spend $330 based on assumptions.",47,47,2012-11-04,AAPL,0.016419807448983192,0.8598201274871826,0.12376008927822113
apple,My favorite game on the iPhone - Try to hit the back button without hitting the notification banner,,291,2950,2012-11-05,AAPL,0.02709759958088398,0.9278193712234497,0.04508306458592415
apple,"Jony Ive after long ""iPad mini"" event [GIF]",,118,733,2012-11-05,AAPL,0.030005408450961113,0.9286798238754272,0.041314806789159775
ipad,How To Find a Stolen iPad,,7,216,2012-11-05,AAPL,0.38133949041366577,0.5889894962310791,0.029671024531126022
iphone,Is there any way to get the notification off of the settings without updating?,,96,172,2012-11-05,AAPL,0.02908075600862503,0.9177374839782715,0.05318177863955498
iphone,The last thing you see before it all goes black,,27,150,2012-11-05,AAPL,0.10804254561662674,0.8681591153144836,0.023798370733857155
iphone,"What happened here? Stock 6.0 on iPhone 5.
Can't move apps there and doesn't do anything if tapped",,34,143,2012-11-05,AAPL,0.03778776526451111,0.9303261637687683,0.03188608959317207
apple,Apple Sells Three Million iPads in Three Days,,109,134,2012-11-05,AAPL,0.014107332564890385,0.9017381072044373,0.08415459841489792
iphone,I've tried countless times trying to setup my voicemail and I just keep getting this notification. Can anyone tell me what I can do to solve this problem?,,27,109,2012-11-05,AAPL,0.07549657672643661,0.885919451713562,0.03858403116464615
ipad,TeamViewer for iPad updated with new controls. Now you can remote control a Windows 8 PC as if you have Windows installed on your iPad instead of moving your finger to move the pointer.,,30,101,2012-11-05,AAPL,0.020930450409650803,0.9237914085388184,0.05527816712856293
iphone,This is the longest thing I've ever made Siri say and it was pretty deep also.,,16,93,2012-11-05,AAPL,0.028131162747740746,0.899841845035553,0.07202707231044769
apple,"I have color changing LEDs and I took this with the panorama, kind of reveals how the stitching works! The lights change approximately once per second",,49,1148,2012-11-06,AAPL,0.026966851204633713,0.9148622751235962,0.0581708624958992
iphone,I made you all a new lock screen image.,,36,342,2012-11-06,AAPL,0.016481483355164528,0.8512680530548096,0.13225048780441284
apple,What should I do with the ~122 Apple stickers I have?,,130,277,2012-11-06,AAPL,0.03292636573314667,0.9188251495361328,0.04824845492839813
apple,"Tribute to Steve Jobs at the end of the movie ""Brave""",,31,243,2012-11-06,AAPL,0.05813896656036377,0.9066475629806519,0.035213403403759
iphone,Spotify finally updated for iPhone 5...,,56,152,2012-11-06,AAPL,0.017055947333574295,0.47016942501068115,0.512774646282196
apple,"A collection of Apple computers, from 1983 to 2005. All working.",,17,124,2012-11-06,AAPL,0.03251655027270317,0.9301420450210571,0.037341345101594925
iphone,I'm glad I stuck with Sprint. I managed to do this within a week of getting my 5.,,49,121,2012-11-06,AAPL,0.05505649000406265,0.38333457708358765,0.5616088509559631
apple,I learned something cool about Video_TS folders today. (Hope it's new to you guys as well!),,24,120,2012-11-06,AAPL,0.01809616945683956,0.776008665561676,0.20589515566825867
apple,The Apple Haters’ 7 Stages of Grief,,71,119,2012-11-06,AAPL,0.054881494492292404,0.8498879075050354,0.09523062407970428
iphone,"""Sent from my iPhone 5""","Just a question if this is the default email signature that came with the phone or are people actually adding ""5"" at the end? 

edit: Is it just me or did this post make a lot of iphone users defensive? t(ツ)_/¯",110,118,2012-11-06,AAPL,0.06951124221086502,0.8929536938667297,0.037535060197114944
apple,The Day My iPod Forgot The Alphabet,,170,849,2012-11-07,AAPL,0.1875404417514801,0.6715356111526489,0.1409239023923874
apple,Not a great week for Steve Jobs...,,227,764,2012-11-07,AAPL,0.07073555141687393,0.8245788216590881,0.10468561947345734
iphone,Xbox smart glass app is now out! Control your Xbox with your iPhone.,,91,451,2012-11-07,AAPL,0.018357109278440475,0.9411950707435608,0.040447819977998734
iphone,I thought this sort of thing got developers kicked out of the App Store?,,66,433,2012-11-07,AAPL,0.33325156569480896,0.6370108127593994,0.029737669974565506
apple,"Exclusive: Microsoft Office for iPhone, iPad, and Android revealed",,69,407,2012-11-07,AAPL,0.01214253157377243,0.90297532081604,0.08488213270902634
iphone,I hate this kinda stuff,,40,389,2012-11-07,AAPL,0.10750777274370193,0.8582939505577087,0.03419825807213783
apple,Minimalist Icons for your mac.,,58,371,2012-11-07,AAPL,0.027052288874983788,0.9224425554275513,0.0505051463842392
apple,Honest Question: Why does it matter that the new iMac is lighter?,"To me, it seems like compromising performance for nothing. Was this just a byproduct of making it thinner? Do some of you iMac users actually move your computer around often?",128,81,2012-11-07,AAPL,0.023513542488217354,0.9165915250778198,0.059894949197769165
