subreddit,title,selftext,num_comments,score,created_utc,stock/sector,neg,neu,pos
apple,The unusual world of Mac prototypes,,9,112,2012-11-23,AAPL,0.030107060447335243,0.9096508026123047,0.06024207919836044
ipad,Here's my iPad workflow (since everyone likes to share) for some inspiration; from a college student's perspective,,12,75,2012-11-23,AAPL,0.024629201740026474,0.917309582233429,0.058061230927705765
iphone,"My app - SkinKeeper - is on sale for Skin Cancer Awareness Week. If you have moles (skin ones, not lawn ones), this app may save your life. We'd love you to try it out!",,33,73,2012-11-23,AAPL,0.01772279292345047,0.8922982215881348,0.08997896313667297
apple,Hmm... something feels... familiar...,,225,447,2012-11-24,AAPL,0.030962655320763588,0.69941246509552,0.2696249186992645
iphone,What is alien blue storing that takes so much space?,,110,320,2012-11-24,AAPL,0.037764254957437515,0.9238283634185791,0.03840743750333786
iphone,I cried a little this morning. Those of you with cats will understand my pain.,,155,144,2012-11-24,AAPL,0.04315807670354843,0.8697406053543091,0.0871012881398201
apple,Why does the volume status have to be so damn big? It's comically obtrusive.,,31,94,2012-11-24,AAPL,0.049366943538188934,0.9096577167510986,0.04097529500722885
iphone,Randomly stumbled upon this amazing wallpaper. Where do I get similar ones?,,20,82,2012-11-24,AAPL,0.026623466983437538,0.8808190822601318,0.09255749732255936
iphone,The original.,,8,73,2012-11-24,AAPL,0.03912010416388512,0.9199476838111877,0.040932249277830124
apple,Just a little reminder for all of the users /r/apple...,"Look, just a reminder, **please for the love of God**, remember [/r/applehelp](http://www.reddit.com/r/applehelp). All of the users and/or readers here at /r/apple, quite frankly, don't *care* about if you have any problems with your Apple stuff or questions about it. That's what [/r/applehelp](http://www.reddit.com/r/applehelp) is for. All of the nice people there will help you with whatever problems or questions you need. That's all. I (and I'm sure a majority of everybody on this sub), don't like to go to /r/apple to see all *sorts* of technical problems with your Apple hardware or software. Thank you.

EDIT: This is just a friendly reminder, just a PSA for /r/apple, and to let people know that /r/applehelp exists. 

UPDATE: I posted something similar to this to /r/applemeta for those who are of concern.",29,72,2012-11-24,AAPL,0.06329455226659775,0.9016407132148743,0.03506479039788246
iphone,A super sleek multi-tool case for your iPhone with more functionality than James Bond's watch.,,25,38,2012-11-24,AAPL,0.020991116762161255,0.861974835395813,0.11703404039144516
apple,Barclays Bank buys 8500 iPads in one fell swoop,,16,33,2012-11-24,AAPL,0.08757376670837402,0.8490100502967834,0.06341619044542313
iphone,Facebook app UI throughout the years,,2,25,2012-11-24,AAPL,0.023176249116659164,0.8798315525054932,0.09699223190546036
apple,"This is why I never use ""All My Files."" It is useless.",,455,1624,2012-11-25,AAPL,0.12339383363723755,0.8543001413345337,0.022306056693196297
iphone,Owning an iPhone 5,,115,535,2012-11-25,AAPL,0.0169923584908247,0.9066874384880066,0.07632014155387878
iphone,"I searched and couldn't find this, so apologies if it has been posted. TIL you can move all your apps over and leave page 1 completely blank! (Besides the dock of course)",,104,393,2012-11-25,AAPL,0.529549777507782,0.45072442293167114,0.01972583681344986
apple,"As a longtime Macintosh programmer, I remember when Apple said this to us in 1997.",,18,188,2012-11-25,AAPL,0.017482683062553406,0.9141632914543152,0.0683540627360344
mac,Is it just me or is this an asshole move?,,17,76,2012-11-25,AAPL,0.628880500793457,0.30707472562789917,0.0640447586774826
mac,"Made this repeating iCal event a year ago, still cannot delete it. Suggestions?",,23,75,2012-11-25,AAPL,0.15710769593715668,0.8070555329322815,0.03583672642707825
iphone,An ex-Android User's Thoughts on the iPhone 5,"So I recently purchased an iPhone 5 after using android for the past 3-4 years, and would like to share my thoughts and opinions for those who are curious about making the switch.

First off, this is only the second Apple device I have owned, the first being an iPod Touch 2g.  Prior to owning the 5 I had a T-Mobile myTouch 3g (awful, awful phone) and most recently an HTC HD2, a fantastic device (natively a windows phone, but I had been running the most recent Android Jellybean release on it).  My primary reason for dropping Android and switching to the 5 was because of the incredible functionality and reliability that I had experienced with my iPod. With the cost of owning a cell phone these days, I also wanted a phone that would surely be worth the monthly expenses, and I decided that the iPhone 5 was indeed that phone.

So far, I have owned the phone for just over a week.  To some this may not seem like a long time, but I have explored all of the features of the phone inside and out, and I think I have spent enough time with it to form some initial opinions.

TL;DR: The iPhone 5 is a remarkable machine that, in my opinion, represents the peak of technological mobile design and innovation.  Granted, there are many similarities in iOS that are identical to when I had first used it a few years ago, but this is in part what makes the phone so great.

Now, for the longer review:

First, I'll start with the hardware and physical design of the phone:

1. Physical Design

The physical look and feel of the iPhone 5 was largely why I chose it over the SIII or the 920.  Though the screen is clearly the smallest of the three, I had not yet owned a phone with the magazine-sharp resolution of the retina display, and I have actually been impressed with the screen size improvement over the 4s; when comparing both the 5 and 4s side-by-side, the 5 seems like a huge improvement.  Naturally, I purchased the matte black color because it looks incredibly streamlined; the matte aluminum backing and surrounding black frame makes the phone look incredibly simplistic and natural, yet futuristic at the same time.  Not having used an iPhone before, the vibrate switch is simply brilliant and I find it hard to believe this has not been replicated on another smartphone before (granted, Apple would probably file a lawsuit :D).  Not having any stick-out cameras is a godsend, and the thin, light feel of the phone only enhances its appeal.  Granted, I did not think I would like how light the phone was at first, since I am a fan of tactility and being able to feel the weight in my gadgets.  However, the weight does not bother me at all and the phone does not feel artificial in the slightest, as I feared the SIII would with its polycarbonate design. 
 
Now, moving on to the lightning dock.....though it seems many are complaining about this feature the most, I find it one of the most convenient changes with the new phone.  The connector is now reversible, which is very convenient.  The feel of the dock is also much better, as it firmly snaps into place and doesnt budge.  I have no complaints with the new redesigned dock.

Now, the only fault I have found with the physical design is that the power button and volume rockers are placed loosely within the phone, and you can hear them shaking if you tap the case when the phone is inside or shake it up against your ear.  I wasn't sure if this was just a defect with my unit, but I checked my brothers 5 and it was the same story; also checked my parent's 4s's and they both shared this same fault; I am not sure if the phones arrive like this, because I don't think I noticed it when I first got my phone, and maybe it is an onset of continuous use.  However, it does not affect the normal operation of the phone, and therefore is not that big of a complaint.

2. Software

Moving on to the software.  I have been running iOS 6 (obviously), and have had an all-around great time using it.  Yes, I can acknowledge that iOS is dated and -hopefully- will be redesigned following the management shakeup at Apple.  However, it is a very, very functional and useful operating system, which is why I believe it has been so successful.  

As I said before, cell phone data plans are very expensive, and it is important to purchase a phone that has the capacity to process the data properly and give you your moneys worth of use at the end of the month.  Switching from an android device, I can successfully say that the 5 achieves this beautifully.  Though I believe Android recently surpassed Apple in the number of apps on their store, I still firmly believe that Apple's app store is much more profound and reliable than Androids, which is often filled with spam apps and useless junk, which makes it more difficult to search.  

The iPhone 5 does everything that you would expect it to do, and it does it all very well.  The camera is amazing, there is an incredibly wide selection of unique apps, messaging works flawlessly (iMessaging is remarkable, though it is similar to Gtalk; group texts are also very streamlined).  Call quality is fine.  Very wide selection of ringtones and vibrate patterns, I have no complaints there.  From a phone perspective, the 5 is -obviously- a stout contender.

Now, when you start to use the phone more as you would a ""computer"", is where the magic really shines.  This phone is......ridiculously fast.  The first day I was using it, I did not turn on wifi...and I burned through half a gig of data (with only a single bar of 4g from my location).  This can present a problem to users (like me) who do not have unlimited data plans; however, there are easy ways to remedy this.  Turning off cellular data when you are on wifi is an easy fix; you can also use apps such as Onavo Count and Onavo Extend, which connect you to a 3rd party VPN tunnel to better filter your data and reduce your usage.  DataWiz is also a very useful quick snapshot of how much data you are consuming, as it breaks down your usage by day, week, and month.

I live in the Pacific Northwest, and using the Speedtest app, I consistently max out the meter on my wifi connection, with downloads in excess of 22 Mbps and uploads between 5-7 Mbps.  Using 4g, the average dl speed is typically between 10-15 Mbps...granted, since I don't have unlimited data, I don't necessarily WANT that speed to be high, although it is quite flattering....those who have unlimited plans can probably appreciate these speeds a little more :D

Downloading large files, such as apps and podcasts, is lightning-quick.  Streaming video through apps is also a snap.  The A6(?) processor also makes navigating the phone a breeze...I never wait for apps to load, and tapping through the settings and messaging menus feels completely natural with no lag.  The coupled performance of the 4G/LTE data and A6 processors really make this phone feel as though it has no limits; Apple has truly created a legendary device here with incredible speeds.  From some of the sources I have read, the 5 consistenly outmatches the SIII in various graphics and performance benchmarks, and I certainly estimate those tests to be true, based on my experience.

Now, for the notification bar.  This also seems to be a topic of annoyance for many people, yet I have had nothing but good experiences with it.  Very similar to the Android notification bar (which DID come first, I must acknowledge), yet works very snappy and holds LOTS of information on it for such a ""small"" screen (compared to Android phones).  The stock apps that show the weather and a stock ticker look very professional and streamlined, and the brushed-metal textures only enhance the looks that iOS frequently displays.

As a side-note: Siri is fantastic.  Granted, it is still in beta, and there are many things that I wish it could do (such as search for AND download apps, have more realistic conversations with you, etc....(because this is what I love doing with Siri the most, it gives a good laugh)) it pulls up information very quickly, is very responsive, and generally just a blast to use.  I often find myself using it in situations where it is non-essential, yet just is a fun and quirky app to play with.

Now, there are only a few gripes that I have experienced while tinkering with iOS 6:

Sometimes the 'soft' buttons on screen are too small to be tactfully and accurately touched, notably the 'close' buttons on the notification bar.  I do not think that this is a problem with the 5's hardware or screen capacity, yet is mostly just a con of iOS's old design-style.

The entire 'phone' app, with the dialer and contacts display, just seems old fashioned and needs a redesign, dialer in particular.

Maps.  Though I cant complain too much about this, and the maps themselves function just fine, maps are clearly Google's game and Apple should have just kept them in iOS 6.  Although, the 3d feature is very cool and novel.


That's really all I can think of right now, can't believe I almost hit the 10,000 character limit.  I'll post an edit later if I think of anything else.

All in all, I hope this 'review' serves some purpose for those who are facing the same decision that I had to make.  I love the iPhone 5 and have no intention of trading it in for an Android phone.  With both the unparalleled physical design and the ridiculously fast data &amp; software paired, this phone is truly a work of art and a technological masterpiece, and is probably the best smartphone that has ever been developed at this point.",57,73,2012-11-25,AAPL,0.032950516790151596,0.9238624274730682,0.043187061324715614
apple,iPhone/iPad dominate on Thanksgiving and Black Friday online shopping,,39,58,2012-11-25,AAPL,0.04515998810529709,0.9307267069816589,0.024113290011882782
ipad,Good Non-Casual iPad Games,"I need some fun, non-casual iPad games. Whenever I try to google this all people say are things like Angry Birds, Cut the Rope, Fruit Ninja. Preferably strategy or Tiny Tower-esque",109,51,2012-11-25,AAPL,0.04912536218762398,0.9126099944114685,0.03826463595032692
apple,iPad mini has same corner radius as Moleskine,,18,43,2012-11-25,AAPL,0.030698005110025406,0.9303618669509888,0.03894009441137314
apple,"Say what you want about autocorrect, but this is damn impressive.",,138,1284,2012-11-26,AAPL,0.042815160006284714,0.909952700138092,0.04723221808671951
apple,Can something please be done about the people who hack Game Centre and take all the top records?,,153,750,2012-11-26,AAPL,0.04274655506014824,0.9092080593109131,0.04804535582661629
iphone,I asked Siri how the weather was and got this response. Anyone know WTF this was all about?,,98,659,2012-11-26,AAPL,0.03299231454730034,0.9065183401107788,0.060489390045404434
apple,The best thing I've added to my dock in a while.,,96,491,2012-11-26,AAPL,0.042499054223299026,0.7973978519439697,0.16010308265686035
apple,In-App Purchases ruining games on the App store.,"Every new game on the App store is now ""pay to win"" and it's truly ruining the experience. One of my favorite series, Bloons Tower Defense, has now also turned to the ""pay to win"" genre. Why must the developers be so greedy? I'd rather pay a one time payment of a couple dollars more, rather than have all these bullshit in-app purchases. Is this just me? Or does the rest of the community feel this way, too?",116,156,2012-11-26,AAPL,0.09071189910173416,0.8795357346534729,0.029752422124147415
ipad,The most difficult screen to maintain,,22,148,2012-11-26,AAPL,0.7161257863044739,0.2598460018634796,0.024028180167078972
apple,"Fantastic design detail: If you have two documents with the same word first, they will be labelled by their second word in Mission Control.",,31,131,2012-11-26,AAPL,0.03981919214129448,0.9330776929855347,0.027103153988718987
ipad,Bydge case is in from Kickstarter... nice! :D,,62,121,2012-11-26,AAPL,0.0542147234082222,0.8997717499732971,0.046013522893190384
iphone,Hang in there buddy!,,25,108,2012-11-26,AAPL,0.030454963445663452,0.9243037104606628,0.04524131491780281
mac,"Good Guy Mac app developer. Emailed him saying my CC doesn't work on the appstore, he sent me a promocode for the app to download it for FREE",,4,93,2012-11-26,AAPL,0.03756210580468178,0.935427188873291,0.027010710909962654
apple,Wonderful iPad Mini ad on the back cover of Time Magazine,,158,2118,2012-11-27,AAPL,0.03423815965652466,0.9263723492622375,0.03938954323530197
iphone,"TIL you can decrease the sensitivity of the time elapsed slider in audio files by pulling the dot down, then sliding left/right.",,69,589,2012-11-27,AAPL,0.17113162577152252,0.7995124459266663,0.02935589663684368
apple,Apple announces redesigned 21.5-inch iMac will be available November 30th,,185,308,2012-11-27,AAPL,0.029788488522171974,0.9312556982040405,0.038955822587013245
apple,Apple firing Maps manager.,,167,284,2012-11-27,AAPL,0.016874250024557114,0.925778865814209,0.05734690651297569
apple,Report: Apple bumps Android from top spot in U.S. smartphone market on strength of iPhone 5,,135,205,2012-11-27,AAPL,0.048542436212301254,0.26428985595703125,0.687167763710022
iphone,"I started a tumblr for awesome ""What's new"" updates, because developers who are awesome should be celebrated.",,14,135,2012-11-27,AAPL,0.01270841620862484,0.6505860090255737,0.3367055058479309
apple,"TIL that you can tap with 3 fingers on a file (same gesture to look up a word) in Finder to ""Quicklook"" it.",,12,76,2012-11-27,AAPL,0.055309928953647614,0.9017472863197327,0.04294276982545853
iphone,Sold my iPhone 5. Sad day.,"I got the iPhone 5 on launch day and in the same day I poked my tv with the vacuum while vacuuming. 
Living without a tv was starting to bug me. Then while I was at work my pal mentioned that he wanted to get an iPhone 5 and send it to brazil. The next day I sold my iPhone 5 to him for 750. I told him its cheaper to buy it in store than the price he offered. He said there aren't any available right now. Soooooo long story short. 
Sold iPhone 5 for 750usd. Bought a new tv for 500usd and bought a 4s on Craigs for 275. So I came out pretty good I think. I miss LTE though.",47,55,2012-11-27,AAPL,0.019739463925361633,0.8675827980041504,0.1126776710152626
apple,"""Slide to Send"" on iOS - It's far too easy to hit the ""Send"" button by mistake in Messages, so I proposed this solution to Apple. Can anyone think of a better idea?",,93,54,2012-11-27,AAPL,0.05602312833070755,0.8930678963661194,0.050908979028463364
apple,GM is the first auto maker to sport Siri’s ‘Eyes Free’ feature with the Chevy Sonic and Spark starting next year.,,41,53,2012-11-27,AAPL,0.010543609037995338,0.9046146869659424,0.08484168350696564
iphone,"Most of the iPhone ""tips"" you see posted are detailed in the iPhone manual anyway. You knew there's a manual, right?",,43,463,2012-11-28,AAPL,0.029098935425281525,0.9333989024162292,0.037502214312553406
apple,Why does this exist?,,161,412,2012-11-28,AAPL,0.03992260992527008,0.869807243347168,0.09027019143104553
apple,Google Earth App. This guy gets it.,,35,269,2012-11-28,AAPL,0.027241965755820274,0.9343336224555969,0.03842446208000183
apple,Reminders - This needs to change!,,72,261,2012-11-28,AAPL,0.029887598007917404,0.8432769775390625,0.1268354207277298
apple,"Apple gets Galaxy sales ban in Netherlands, Samsung to pay $130K per day if it continues infringing photo gallery patent",,49,238,2012-11-28,AAPL,0.06027963012456894,0.8739182949066162,0.06580209732055664
iphone,iPhone 5 Returns Apple To Top Smartphone Spot In U.S. | Fast Company,,5,82,2012-11-28,AAPL,0.017980504781007767,0.13093970715999603,0.8510797619819641
apple,Apple may ditch Samsung to move A-series mobile chips to 28nm process,,42,75,2012-11-28,AAPL,0.13920451700687408,0.8076504468917847,0.05314507707953453
apple,"I knew Apple products were notoriously expensive, but the free engraving doesn't quite make up for this one.",,46,74,2012-11-28,AAPL,0.033924400806427,0.915920078754425,0.05015550181269646
mac,"Hey iMac/Thunderbolt Display owners, we just launched an iPhone dock that seamlessly integrates with the iMac stand, removing the dock from your desk. Paper-thin cable runs underneath the stand, making it look wireless. ;)",,28,61,2012-11-28,AAPL,0.01773955300450325,0.9140226244926453,0.0682377889752388
apple,I redesigned and animated Instagram. Hope you like it! (x-post r/design],,25,55,2012-11-28,AAPL,0.020218810066580772,0.8881996870040894,0.09158153831958771
iphone,Best thing of the new Vimeo app,,49,1158,2012-11-29,AAPL,0.03380662947893143,0.9099833965301514,0.05621003359556198
apple,"Getting real tired of this, Facebook iOS app.",,162,1068,2012-11-29,AAPL,0.05673408508300781,0.9044901728630066,0.038775794208049774
apple,iTunes 11 finally available for download - The Verge,,720,853,2012-11-29,AAPL,0.014952437952160835,0.9247085452079773,0.06033904105424881
apple,iTunes 11 has pretty intelligent coloring of tracklists based on album art,,73,284,2012-11-29,AAPL,0.029983416199684143,0.9234825372695923,0.04653400927782059
apple,Very welcome feature in iTunes 11!,,53,256,2012-11-29,AAPL,0.020188558846712112,0.9367187023162842,0.0430927574634552
apple,"Dear Apple,  Thank you for finally making this a feature.",,38,233,2012-11-29,AAPL,0.033445436507463455,0.5680787563323975,0.3984757661819458
apple,This caught my eye on the AppStore...,,9,210,2012-11-29,AAPL,0.020281866192817688,0.8798296451568604,0.09988850355148315
iphone,I guess I'll have to use snail mail.,,8,141,2012-11-29,AAPL,0.06543473899364471,0.9045161008834839,0.030049197375774384
apple,"Is it just I, or is iTunes 11 on Mac about 5-10x faster than iTunes 10?",,98,102,2012-11-29,AAPL,0.01890748366713524,0.9110819697380066,0.0700104683637619
ipad,"About damn time, Chrome!",,14,76,2012-11-29,AAPL,0.3012511432170868,0.5169444680213928,0.18180440366268158
apple,"Oh, how times change.",,451,1327,2012-11-30,AAPL,0.08850975334644318,0.8731836676597595,0.0383065901696682
apple,My Friend Submerged his MacBook Pro the other day...,,431,1309,2012-11-30,AAPL,0.031842365860939026,0.9055166840553284,0.06264090538024902
iphone,"Spent the last year of my life building this app, finally released, Apple just made it this weeks iTunes Editor's Choice! (x-post from r/apple)",,215,886,2012-11-30,AAPL,0.013857090845704079,0.863570511341095,0.1225724145770073
apple,"Does it bother anyone else that this is ""full screen"" on the iPad when browsing YouTube in safari?",,120,601,2012-11-30,AAPL,0.033868737518787384,0.9327716827392578,0.033359602093696594
ipad,"Does it bother anyone else that this is ""full screen"" on the iPad when browsing YouTube in safari?",,91,493,2012-11-30,AAPL,0.033868737518787384,0.9327716827392578,0.033359602093696594
iphone,"Hold down ""0"" on your iPhone keyboard to get the ""°"" for °C/°F degrees.",Helpful tip for iOS devices!,47,448,2012-11-30,AAPL,0.020448530092835426,0.8431254029273987,0.13642603158950806
apple,"Spent the last year of my life building this app, finally released, Apple just made it this weeks iTunes Editor's Choice!",,104,426,2012-11-30,AAPL,0.012655326165258884,0.8396966457366943,0.14764805138111115
apple,Scott Forstall's rejected iTunes 11 proposal:,,65,424,2012-11-30,AAPL,0.03381228446960449,0.9168861508369446,0.04930161312222481
iphone,Good use of the phone call rejection messages [OC],,36,339,2012-11-30,AAPL,0.035871926695108414,0.9302641749382019,0.03386392071843147
apple,Just realized you can Cmd-click a window in the background to move it and not change focus,"Edit: Also you can interact with the window if you keep holding Cmd and click (like click on bookmarks, links, dialog windows, etc).",29,225,2012-11-30,AAPL,0.04567641764879227,0.931213915348053,0.023109661415219307
