subreddit,title,selftext,num_comments,score,created_utc,stock/sector,neg,neu,pos
ipad,"Microsoft Office for iOS, coming soon-ish",,12,78,2012-11-07,AAPL,0.025249207392334938,0.927057147026062,0.04769366979598999
mac,My mid-2012 MBP (non-retina) running Skyrim in a Virtual Box.,,46,59,2012-11-07,AAPL,0.05756570026278496,0.9138879179954529,0.028546463698148727
apple,Mac Technician Porn (SFW),,91,808,2012-11-08,AAPL,0.07819560915231705,0.8842804431915283,0.03752388805150986
iphone,Great design from Apple on an interaction with Siri,,32,505,2012-11-08,AAPL,0.013515127822756767,0.8280247449874878,0.15846005082130432
apple,Kind of hard to remember this when your LTE is faster than your WI-FI..,,48,338,2012-11-08,AAPL,0.045486126095056534,0.9016841053962708,0.052829790860414505
apple,The Island of Lost Apple Products,,67,190,2012-11-08,AAPL,0.7635736465454102,0.20832382142543793,0.028102509677410126
apple,"The best part of the upcoming iOS 6.1 update, at least for those of us with big and/or clumsy fingers",,22,139,2012-11-08,AAPL,0.03672273829579353,0.9270604252815247,0.036216866225004196
apple,"Apple has just earned themselves a customer for life. Did apple give me a good deal, or what?","I'll try to make this short...

I water damaged my Macbook Pro 13 inch Spring 2011 (core i7, 8 gb ram, 128 SSD).

Today, apple offered me a baseline Macbook Pro 13 inch with Retina Display. (The processor is an i5, but is a newer model i believe. Same 8 gb Ram, 128 Flash Drive) for the same price as a repair on my old one would be: $755 plus tax.

Oh, and they let me keep my old macbook pro.

The Genius Bar service for my iPhone was the reason I got a Mac. The Genius Bar Service for my Mac is now the reason I will be returning to iPhone after a venture in Android, and the reason I will be getting an iPad eventually.",77,93,2012-11-08,AAPL,0.024413257837295532,0.8831791877746582,0.09240759164094925
apple,"Ars Technica review of the 13"" Retina MacBook Pro",,33,69,2012-11-08,AAPL,0.02580266445875168,0.9363952875137329,0.03780210390686989
ipad,Angry Birds Star Wars HD released,,28,62,2012-11-08,AAPL,0.04880962148308754,0.8989170789718628,0.05227329954504967
apple,"So, it's been a couple days. How do you like the iPad mini?","I'm seriously considering purchasing an iPad mini, but I want to know what you guys think about it. Any battery life issues? Any issues whatsoever? What's so great about it? Why should I get this when I already have a 1st gen iPad?",46,54,2012-11-08,AAPL,0.022648395970463753,0.9075453877449036,0.06980621814727783
apple,AT&amp;T expands FaceTime to cellular at no extra charge for iPhone 5,,24,50,2012-11-08,AAPL,0.015640361234545708,0.9021748900413513,0.08218474686145782
apple,Apple gives $2.5 million to the Red Cross in aid of families and businesses affected by Sandy,,257,1172,2012-11-09,AAPL,0.11349482089281082,0.6877514719963074,0.19875364005565643
iphone,"I'm not sure if anyone has mentioned this here yet, but I love being able to see what the update is without actually clicking and going to a separate screen!",,28,400,2012-11-09,AAPL,0.02569865807890892,0.9439958930015564,0.030305426567792892
apple,Walmart Employees Throwing iPads - YouTube,,116,303,2012-11-09,AAPL,0.2745092809200287,0.702025830745697,0.023464808240532875
iphone,"I'm about to be an uncle for the first time- my sis has just started her contractions! I send a txt but due to shotty coverage it doesn't send, I think my iPhone is clairvoyant- still waiting for my niece!",,20,167,2012-11-09,AAPL,0.05465005338191986,0.8919549584388733,0.053394969552755356
iphone,How can I get rid of this without clicking on the okay button?,,59,158,2012-11-09,AAPL,0.06742028892040253,0.9099951386451721,0.022584592923521996
apple,"Review: iPad Mini charms, but screen is a letdown",,172,156,2012-11-09,AAPL,0.04518583044409752,0.9072956442832947,0.047518469393253326
apple,Find my iPhone saves 17 year old teen's life after his car tumbles over 200 foot cliff,,22,141,2012-11-09,AAPL,0.018276885151863098,0.8872077465057373,0.0945153459906578
ipad,iPad sold at Texas gas station was actually a mirror.,,39,110,2012-11-09,AAPL,0.011725930497050285,0.8809083104133606,0.10736570507287979
apple,"""Simply Spectacular""",,3,105,2012-11-09,AAPL,0.03902234882116318,0.8898456692695618,0.07113201916217804
apple,"A hedge fund manager who helped drive the stock from $670 to $534 is buying now ""Having helped knock more than $130 billion off Apple's market valuation, Doug Kass on Friday cheerfully announced that he is buying Apple again.""",,29,98,2012-11-09,AAPL,0.02290872298181057,0.5174121260643005,0.4596792161464691
apple,iHome...?,,33,414,2012-11-10,AAPL,0.049803633242845535,0.900802493095398,0.049393851310014725
apple,The Lightning Micro-USB Adapter,,135,318,2012-11-10,AAPL,0.030830007046461105,0.8937560319900513,0.0754140093922615
apple,"Jobs had a reputation for being ""difficult"" to work with, or work for, but what was he like outside of Apple? Here's one illuminating story.",,40,236,2012-11-10,AAPL,0.17916718125343323,0.7791320085525513,0.0417008250951767
apple,PC Magazine reviews Apple iPad (4th gen.): A very rare 5 star product; a slam dunk Editors’ Choice,,56,214,2012-11-10,AAPL,0.031555287539958954,0.8395557999610901,0.12888894975185394
apple,"How do I transfer iTunes data (Play count, date added etc.) to a new computer?","I recently bought a new laptop and all my music is on my PC, I'd like to transfer all my music onto my laptop but keep the 'play count' and 'date added' info. I have an external hard drive. Is this possible? Thanks Reddit",40,168,2012-11-10,AAPL,0.016662482172250748,0.9094871878623962,0.07385025918483734
apple,"I'd never do this to one of these beauties, but it is pretty cool either way.",,20,130,2012-11-10,AAPL,0.019425740465521812,0.8836572766304016,0.09691699594259262
apple,Still Tickin',,9,121,2012-11-10,AAPL,0.3412021994590759,0.5355319380760193,0.12326584756374359
apple,iPhone 5 diagonal swipe bug found,,84,116,2012-11-10,AAPL,0.7322694063186646,0.2463223785161972,0.02140824869275093
iphone,New to iPhone,"Long time android household,  wife won an iPhone5.  Picked it up last night.  We know next to nothing about Apple products...  what do we need to know?  What are some ""necessary"" apps?  Are there any neat tricks I can show her?",168,115,2012-11-10,AAPL,0.019977565854787827,0.9244301319122314,0.05559229478240013
ipad,Love changelogs like this,,6,108,2012-11-10,AAPL,0.039538320153951645,0.9165093302726746,0.04395241662859917
apple,"Apple now asks ""have you tried turning it off and on again?"" if you want to make a genius bar appointment.",,377,1956,2012-11-11,AAPL,0.021777072921395302,0.8697740435600281,0.10844886302947998
apple,"Ahh, packaging.",,84,1605,2012-11-11,AAPL,0.02000945433974266,0.8471637964248657,0.1328268051147461
apple,When geeks get to name the drinks... check out the MacBook,,51,381,2012-11-11,AAPL,0.030530402436852455,0.927405059337616,0.04206451401114464
iphone,Till the last drop,,37,308,2012-11-11,AAPL,0.0808861032128334,0.8434761166572571,0.07563779503107071
iphone,"Oh, COME ON!",,59,303,2012-11-11,AAPL,0.1315290629863739,0.8009644746780396,0.06750644743442535
iphone,"Siri, find me some bagels.",,12,169,2012-11-11,AAPL,0.04377651959657669,0.9046652317047119,0.051558226346969604
apple,"Apple, in my opinion, hits it out of the park with the new iPad mini ad ""Photos""",,65,162,2012-11-11,AAPL,0.021308541297912598,0.8500977158546448,0.12859369814395905
iphone,Oops…,,38,105,2012-11-11,AAPL,0.036715637892484665,0.870927631855011,0.09235664457082748
iphone,Parkbud is free today guys.  Not much time left.,,13,85,2012-11-11,AAPL,0.03511433303356171,0.9059087634086609,0.058976974338293076
apple,Anybody want to buy Woz's house?,,13,69,2012-11-11,AAPL,0.043302010744810104,0.9145568609237671,0.042141206562519073
apple,Who else would like to see black and white anodized aluminum Macbook Airs/Pros like the iPhone 5s and iPad Mini's are made from?,"I know there were rumors about a black anodized aluminum macbook pro floating around back in 2011 but it was said to have been axed because the metal did not wear well over time. It's clear they must have solved that problem because they're using both black and white anodized aluminum on the iPad Mini and the iPhone 5, so shouldn't it only be a matter of time before we see these materials being used across the entire Apple product line? I'd personally love a black Macbook Air (with retina, please).

edit: I now realize there is no ""white anodized aluminum"" iPhone; it's just the same silver anodized aluminum they've been using all these years accented by white glass. My binary brain must have dreamed that up as the alternative to the black aluminum.",161,599,2012-11-12,AAPL,0.03526639938354492,0.9336743950843811,0.03105919621884823
apple,TIL holding shift while clicking the maximise button on an OS X window makes it do what I want it to,"Maybe I'm slow, but I'm finally getting used to the ""if it doesn't do what you want it to, try holding shift/alt/cmd/ctrl and click"" mantra

Edit: I should add that this has only been tested to work with Chrome. It seems to be app specific!",172,524,2012-11-12,AAPL,0.02692655473947525,0.9019902944564819,0.0710831880569458
iphone,Share your iPhone homescreens! hopefully this will help some improve their preferences and get new ideas.,,662,463,2012-11-12,AAPL,0.010579755529761314,0.765647292137146,0.22377292811870575
apple,Rampant Abuse of Push Notifications Is Ruining Them,,76,359,2012-11-12,AAPL,0.6191821694374084,0.3479415774345398,0.03287629783153534
apple,Is this the oldest surviving site still on Apple's servers?,,34,188,2012-11-12,AAPL,0.030462447553873062,0.8588610887527466,0.11067647486925125
iphone,An opinion.,"Hello all,

I am, as you all probably are, an avid iPhone user. I love learning new, cool things that I can do with this wonderful phone, should that be with the default OS, Jailbreaks, apps, etc.

I find that this sub-reddit has been getting worse and worse over the past couple of weeks. Almost every post is about a small glitch, a hardware issue, and things that you could easily look up for yourself. This is a drag.

This sub-reddit should take a turn for the better. Focusing more on this as mentioned in the first paragraph and less on the things as mentioned in the second.

To solve this, I think there should be rule changes that take part here, and and all iPhone problems should be sent over to /r/iphonehelp.

Let me know where you stand, do you agree, disagree, or have another suggestion?",37,184,2012-11-12,AAPL,0.05154608190059662,0.9038370847702026,0.04461681842803955
iphone,Apple Rumored To Begin Trial Production Of iPhone 5S Soon: Farewell Yearly Update Cycle?,,83,174,2012-11-12,AAPL,0.010714330710470676,0.8729167580604553,0.11636894196271896
ipad,Any exciting apps come out lately?,"No category in particular, just looking for new stuff.",73,104,2012-11-12,AAPL,0.017671404406428337,0.8441222906112671,0.1382063329219818
apple,Apple Allowing Select Employees to Devote Time to Special Projects,,35,79,2012-11-12,AAPL,0.029577240347862244,0.9399592280387878,0.030463464558124542
iphone,iOS 6.1 Beta 2 Is Now Available For Developers,,31,77,2012-11-12,AAPL,0.019020168110728264,0.9322614669799805,0.0487184040248394
apple,My 8 month old husky found my Apple TV remote easy to use and delicious.,,125,1210,2012-11-13,AAPL,0.014868772588670254,0.8537359833717346,0.13139525055885315
iphone,Duolingo App is Out!,,99,325,2012-11-13,AAPL,0.042486678808927536,0.9178495407104492,0.03966378793120384
apple,passcode to power down? would've been helpful in my recent mugging,"find my iphone is a great feature, but it's gotten to the point where thieves and muggers are aware of it, and can immediately power down a device. a passcode to power down would be so helpful, i really hope it's something apple implements. 

i was recently mugged at gunpoint, and lost my phone in the incident. i was talking to the cops within 15 minutes, but the device was already powered down. man, it would have been so clutch in the situation. the cops even told me how great they think that app is (getting my phone back is a plus for me, finding criminals is a plus for cops).
 
if only they couldn't just power down the phone and be in the clear...",178,186,2012-11-13,AAPL,0.025481251999735832,0.9211328029632568,0.05338596552610397
apple,Ever since installing Mountain Lion...,,78,120,2012-11-13,AAPL,0.024613242596387863,0.9102765321731567,0.06511025875806808
apple,Is Siri really Apple’s future? Or is it Apple’s game to lose?,,33,66,2012-11-13,AAPL,0.06616343557834625,0.8854495286941528,0.048387061804533005
ipad,Mini 4G LTE iPads now shipping...,,14,58,2012-11-13,AAPL,0.03877250850200653,0.9165201187133789,0.04470733180642128
iphone,Just realized you can edit an query with Siri.,,10,39,2012-11-13,AAPL,0.02868662029504776,0.9301674365997314,0.041145917028188705
apple,How we fixed my roommate's iPhone 4S running iOS 6.0/6.0.1 repeatedly dropping wi-fi,"Edit: in a few comments I insinuated that it is iOS that is causing the problem when it could in fact be either the router, iOS, or some third thing. Ignore those comments. All I know is that rather than clicking on the network when it is auto detected, if you enter it manually underneath ""other"", that fixed the problem for us. Also a lot of people here are posting their own solutions which is of course welcome. Hopefully this thread helps most people having wifi issues. 

I have a netgear router, I will update this with the exact model when I get home

.............................


It was pretty simple actually, but first, some background.

We both have the iPhone 4S. We reset network settings, reset all settings, restored from backup, set up as a new iPhone, *went to the Apple store and got a new iPhone,* thinking it was a hardware failure (since mine stayed connected to the same wireless router and his kept disconnecting), updated the firmware to the router, did a hard reset to the router, changed various settings/encryption type. Nothing worked. His kept disconnecting and mine would stay connected just fine. Finally, believe it or not, it ended up being to simply enter the network manually. Settings&gt;Wi-Fi&gt;Other. I didn't see this solution posted anywhere else so I figured I would share. You'd never think it was something that simple, right?...",32,39,2012-11-13,AAPL,0.06512819230556488,0.8969691395759583,0.03790261968970299
apple,Nokia's free 'Here' maps coming to Apple's iOS with offline support,,9,34,2012-11-13,AAPL,0.021710237488150597,0.9342957735061646,0.04399397224187851
apple,"Found this fellow at my university college in Norway  (sorry for bad quality, taken with phone).",,12,28,2012-11-13,AAPL,0.46464383602142334,0.39126721024513245,0.14408893883228302
apple,Got the prettiest Launchpad bug the other day.,,198,1374,2012-11-14,AAPL,0.04266589507460594,0.9156882166862488,0.041645895689725876
apple,I asked siri to remind me to grab my calculator tomorrow morning...,,54,1364,2012-11-14,AAPL,0.03187558799982071,0.9127157330513,0.05540861561894417
iphone,Do any of you have increased font size? How do you feel about it?,,69,383,2012-11-14,AAPL,0.009764977730810642,0.07118868082761765,0.9190462827682495
iphone,I have to kill the AppStore before it will give me this update. This happens all the time. Anyone else?,,58,323,2012-11-14,AAPL,0.04959026724100113,0.9267390370368958,0.02367066778242588
ipad,"I really like the new AppStore, but this annoys me.",,42,249,2012-11-14,AAPL,0.01731196604669094,0.911572277545929,0.07111574709415436
iphone,"Got tired of all apps trying to be ""The Next Instagram"", so I made my own. Introducing Graham Gram.",,57,169,2012-11-14,AAPL,0.07502361387014389,0.7900383472442627,0.13493803143501282
apple,So I got a real chuckle from the sidebar.,,39,155,2012-11-14,AAPL,0.021408285945653915,0.8242357969284058,0.15435588359832764
apple,A typo on the Apple website states that the iPad is thinner than a penny.,,34,144,2012-11-14,AAPL,0.030395783483982086,0.9098287224769592,0.05977552384138107
apple,Really the only keyboard shortcuts I'll ever need.,,21,117,2012-11-14,AAPL,0.5990943908691406,0.37888994812965393,0.022015724331140518
iphone,Jet Set Radio coming to iPhones!,,13,104,2012-11-14,AAPL,0.02283400110900402,0.8589078187942505,0.11825822293758392
apple,What happens when you tell Siri it's your birthday.,,125,2684,2012-11-15,AAPL,0.025779403746128082,0.9058279395103455,0.06839261204004288
iphone,Amazon.com's iPhone Trade In Program is a Scam,"FINAL UPDATE - Received a call from Amazon Executive Customer Relations and they have offered to reimburse me the full price of the trade in value I was expecting. I appreciate Amazon's response here and think its important you read this first as they have made an effort to satisfy me as a customer.
----
Just sent off an iPhone 4 8GB in almost brand new condition. I packaged the item in a new iPhone 4 Box, with charger, cables, headphones and packaging. Cables, Packaging and Headphones were new from new iPhone. I chose to use Amazon since I assumed they were a reputable business. When choosing the trade in you choose a range. I chose 'Like New' condition with the assumption that it would at the very least get a 'Good' condition rating. Like new is $187 - Good is $157. Not a great price, but good enough for me. The mistake I made was to choose the option to not return it and accept the appraised value if it does not meet your original appraisal. I did this because I knew there was no way it would be appraised lower than the $157 'Good' condition rating.

Several days later I get a rating of 'Heavily Scratched' and a gift card for $80 with no way to challenge the appraisal. I called Customer Service, yet they told me there is nothing they can do.

I'll eat this one, but I just got scammed. Don't make this mistake. The iPhone logic board is $100 + depending on the model.

Update 1: I am on the phone now with Amazon customer service and have asked for the number of the 3rd Party who took the iPhone. They still are saying the same thing that by electing not to have my phone shipped back to me that I have agreed to whatever price they provide, however, I haven't agreed on any price. For these terms, the buyer can give any price they wish and the customer has no option but to accept it. That is unreasonable giving them the option to low ball you knowing there is nothing you can do.

Update 2: Now Amazon is telling me it was not a 3rd Party, but Amazon who took the phone.

Update 3: Customer Service claims there is no manager that is available for me to speak with, but that I can call back but to be reassured there is nothing they are can/willing to do. At the very least, from an IT Director who spends a lot of money at Amazon I deserve an opportunity to speak with a manager. I chose Amazon because I didn't want the hassle of eBay or Craigslist. I just wanted a quick sale to use the money for my kids Christmas presents. It is what it is, but for those that choose to use this method, choose to have it shipped back. I allowed them the opportunity to low ball me because I trusted I would get a fair price. I was wrong. 

I will no longer allow my employees in this state agency to buy from Amazon because of my customer service experience. Thanks for the advice and comments.",132,343,2012-11-15,AAPL,0.03526032343506813,0.9267523288726807,0.0379873551428318
apple,"I defended you, Apple maps!  Why must you betray me?",,60,229,2012-11-15,AAPL,0.023401102051138878,0.9143543839454651,0.062244512140750885
iphone,Finally! Tagging enabled for Facebook.,,37,180,2012-11-15,AAPL,0.013503072783350945,0.8782873153686523,0.10820963978767395
ipad,Google Finishing Up Maps Application For iOS,,36,129,2012-11-15,AAPL,0.029634743928909302,0.9423591494560242,0.02800610288977623
apple,iOS 6.1b2 brings back iTunes Match individual song download/delete.,,17,102,2012-11-15,AAPL,0.021225037053227425,0.9206159114837646,0.05815909430384636
apple,I had a few iPads laying around do I decided to have some fun.,,24,91,2012-11-15,AAPL,0.0955876037478447,0.7911148071289062,0.11329755187034607
ipad,"iPad Mini Heist Nets 3,600 Units (~$1.5 million) at JFK Airport",,23,83,2012-11-15,AAPL,0.014525744132697582,0.8913393616676331,0.09413488209247589
apple,Does anyone else think the (prominent) pictures of the new iMac are a bit misleading?,,75,60,2012-11-15,AAPL,0.04056805744767189,0.9219699501991272,0.037462007254362106
apple,$1.5 million in iPad Mini's Stolen From JFK,,30,57,2012-11-15,AAPL,0.031338807195425034,0.9152224659919739,0.053438700735569
apple,"In hope of making Grumpy Cat the next OSX Cat, here's a background I made for Reddit (first post) [x-post from r/design]",,36,737,2012-11-16,AAPL,0.018527382984757423,0.9112962484359741,0.07017632573843002
apple,"Apple TV, what do you use it for?","Cut the cord many many years ago. Really enjoy the fact my kids have grown up without TV. We pick and choose out content without being bombarded with crap ads. But is the current offering on the Apple TV enough? Are they going in the right direction? What else could they or should they do?

The kids and I use the Apple TV as our main source of media consumption in the living room. We stream shows and movies from Netflix or our iTunes library (all ripped movies, nothing rented or bought digitally). Podcasts are a great addition as well. Youtube isn't too bad either. Airplay is wonderful but could use some tweaking.  

I personally will fork over money for Netflix or an Apple equivalent streaming service if/when it becomes available. A free ad supported model would be great also. Just think of the ad revenue from streaming a blockbuster show over the Apple TV with a few ads here and there. It works for many years for over OTA tv, why couldn't it work now for and Apple streaming service? Paying per app for sports or renting individual movies or shows just doesn't appeal to me as a consumer. Hopefully Apple can stir things up and bring some much needed innovation.",360,267,2012-11-16,AAPL,0.018121574074029922,0.9189161062240601,0.06296233832836151
apple,"Well, shoot....",,5,158,2012-11-16,AAPL,0.041487421840429306,0.7868302464485168,0.17168240249156952
iphone,Does this drive anyone else mad?,,23,153,2012-11-16,AAPL,0.1299043893814087,0.8151239156723022,0.05497166886925697
apple,Jony Ive's Design Video for the Twentieth Anniversary Mac,,13,88,2012-11-16,AAPL,0.019422922283411026,0.8929322361946106,0.08764487504959106
iphone,Switched from a Nexus S 4G to an iPhone 5 yesterday,"The difference is insane. It's like I'm holding the Death Star in my hands. I shouldn't have this much technology in that small of a device.

I love it, by the way. The fact I could call in a nuclear strike is just a perk.",141,88,2012-11-16,AAPL,0.02281779795885086,0.8986539840698242,0.07852821052074432
iphone,Google gives up to Apple. Google Maps for iOS is being tested for! WSJ,,56,69,2012-11-16,AAPL,0.0210903100669384,0.9114264845848083,0.06748320162296295
apple,Apple Now Owns the Page Turn,,48,67,2012-11-16,AAPL,0.02073436789214611,0.9511532783508301,0.028112336993217468
apple,List of rejected-but-open-sourced iOS Apps?,"I was just wondering, many Apps don't get accepted into the App store, and some categories of Apps would never stand a chance in the first place; however for iDevices, everybody with a developer account can download, compile and install any App from source code, so is anybody aware of useful Apps available only as source, or even a list of such Apps?",29,41,2012-11-16,AAPL,0.02982546202838421,0.9368147253990173,0.03335978090763092
apple,I thought I'd try to get Siri to sing me happy birthday like it did for you and I got this instead.,,8,41,2012-11-16,AAPL,0.029052799567580223,0.9009597897529602,0.06998739391565323
apple,"Just came across this...
What's your weirdest Anti-Apple story you've ever seen?",,448,1075,2012-11-17,AAPL,0.03481769189238548,0.9149964451789856,0.050185829401016235
iphone,What is the least commonly known iPhone tip/trick that you know of?,"I feel as I know everything there is to know about my iPhone, but I bet somebody, somewhere knows something I don't.  Share your tricks here and educate everyone on /r/iphone",632,708,2012-11-17,AAPL,0.03396154195070267,0.9241508841514587,0.04188762232661247
apple,i5 box vs adapter box,,112,694,2012-11-17,AAPL,0.03196932375431061,0.8976373672485352,0.07039326429367065
ipad,Painting I did on iPad Mini,,31,337,2012-11-17,AAPL,0.04596300050616264,0.9185692071914673,0.035467810928821564
iphone,The guy who made the game Letterpress is hilarious in his app updates,,12,253,2012-11-17,AAPL,0.015754099935293198,0.923373281955719,0.060872629284858704
iphone,Funniest. Update. Ever. (Letterpress),,14,172,2012-11-17,AAPL,0.036789439618587494,0.9302594661712646,0.03295114263892174
iphone,"My current wallpaper, it's the best mood booster.",,5,171,2012-11-17,AAPL,0.0718478411436081,0.8816288113594055,0.046523381024599075
apple,Humorous release notes for the amazing Letterpress.,,8,126,2012-11-17,AAPL,0.027077164500951767,0.921710729598999,0.05121215805411339
