subreddit,title,selftext,num_comments,score,created_utc,stock/sector,neg,neu,pos
apple,WWDC Insight: How dropped frames are finally being fixed in iOS 12,"While for many of us WWDC may feel like it's over, the keynote is only the simplified consumer focused overview of the new software. The actual meat and potatoes comes from the many dozens of dev sessions (like mini keynotes) where Apple developers and engineers will dive deep into the specific low level changes that make the new software tick. 

---------------------

I wanted to focus on one that took place yesterday titled ""[Session 202: What's New in Cocoa Touch](https://developer.apple.com/videos/play/wwdc2018/202/)"". Cocoa Touch is the low level framework that controls all touch events and their subsequent UI response/animation throughout iOS. Most notably: scrolling. After reading that iOS 12 was supposed to feature ""smoother animation and scrolling"" on the info page from Apple's website, I was interested to hear what the actual engineers had to say about this. In this session, Josh Shaffer confirmed that Apple has gone through a **full audit** of all native Apple apps within iOS and used those as a testing ground to profile for any areas the core animation frameworks are experiencing bugs and bottlenecks. 



I'm pleased to report that this session **directly** targeted three major reasons that we've had persistent frame drops throughout iOS despite the exponentially more powerful hardware we get year over year. This has been going on for many years and described in all kinds of ways from countless users on this sub: ""hitching"", ""jank"", ""stutter"", ""judder"", etc. Regardless of verbiage, iOS has been failing to maintain 60FPS consistently during scrolling since ~iOS 7, and it sounds like iOS 12 is finally **finally** addressing this. These improvements will not only benefit the native apps, but should also extend to improving the scrolling/animation performance of third party apps as well without any extra work on the developer's part. Should make a lot of users here ([especially Chris Pirillo!](https://docs.google.com/document/d/1TDCVavaqDJCFjcQxZsL6InzHxPEYWwMMMh9QtfRGjbY/edit)) quite happy.

------------------------------


I'm going to do my best to summarize the three major fixes below, but the video linked above is definitely the best way to get a full understanding of what's changing if you're interested. I've grabbed the slides from the presentation and placed them throughout the explanations where appropriate to help visualize what's being discussed. (the little comments in white are my own) Without further ado: 

1.	**An oversight within the [Cell Pre-fetch API](https://medium.com/capital-one-developers/boost-smooth-scrolling-with-ios-10-pre-fetching-api-818c25cd9c5d) causing dropped frames has been fixed**. This was an API introduced in iOS 10 intended to help solve frame drops, particularly those that were the result of [loading heavy data within an upcoming cell during a scroll](https://i.imgur.com/sTNRcAF.png). The idea was that you could pre-load the data (say, a large image coming up before it's made it to the screen upon scroll) in the background so by the time the cell is on screen, the data is already loaded and the CPU performance of the active scrolling thread remains unaffected. While this works much of the time and did in fact reduce dropped frames, Apple has identified a bug in the implementation. Instead of running the pre-fetch *after* the current cell is finished loading and visible on screen, sometimes the pre-fetch will incorrectly start loading future data at the *same time* as the current cell was already loading in on screen! This meant that the CPU was handling not only the scroll, but [also the pre-fetch for future data while there was already data in the process of loading in](https://i.imgur.com/5fEYNV8.png). Essentially, the pre-fetch was a bit ""too ambitious"" and would fetch too early requiring the CPU to load *two* large elements concurrently, often causing frames to drop due to the exact kind of spike in CPU usage this API was designed to reduce. In iOS 12, they [have adjusted the pre-fetch API so it now loads more intelligently](https://i.imgur.com/9a1OVsN.png), vastly reducing the chance that it will try to fetch data too early and prevent a slam to the CPU. 

2.	**Apple has identified and corrected an issue in the CPU performance controller causing dropped frames even when there was very little background load.** This one is an even bigger win for performance in iOS 12. Previously, when an app would alert the system that there was a big load coming up during a scroll and it needed more CPU performance, [the CPU was quite slow to respond and increase its clock speed.](https://i.imgur.com/EXSDvax.png) In fact, by the time the CPU was at a higher speed state, it was often too late and the frame was already dropped. This has been fixed, and is actually what Craig was referring to at the main keynote. Essentially, when an app needs more CPU performance to prevent a frame drop, [the CPU will now respond instantly and rocket right up to its high clock speeds](https://i.imgur.com/MxCxlLZ.png), and more quickly drop back down to idle. (all mobile CPUs idle as often as possible to maintain battery life, only going to max speed when required)

3.	**The auto-layout framework has been heavily optimized to substantially increase performance.** Auto-layout is what allowed Apple to begin targeting different screen sizes and shapes in iOS. It controls how most UI elements, text, and content are laid out on the display by automatically controlling spacing for the many different iDevice screen sizes, without requiring the developer to completely redesign an app to support a new screen size. It has been in active use since iOS 8 when the iPhones went big. As it turns out, [Apple discovered that the performance impact of the Auto-layout framework](https://i.imgur.com/A2uqXD7.png) was actually [scaling at an exponential rate with iOS 11](https://i.imgur.com/qFCWP1Y.png) (and quite likely, iOS 8/9/10) so the performance penalty for using it in more complex ways was quite severe. In iOS 12, they have gone through and heavily optimized the auto-layout framework so the performance impact of it is far more linear, which should free up the CPU and GPU substantially when rendering apps. 


-----------
These are the three primary improvements and fixes for avoiding dropped frames introduced in iOS 12. Josh mentions that there are even more than this, but these are the three that have brought the largest increase in scrolling performance and have dramatically reduced frame drops on old and new devices alike. Chances are the work described above is still on-going so the beta builds of iOS 12 may not reflect the full improvement we can expect, but hopefully when we're installing the final build of iOS 12 this September we can finally see a return to the locked 60FPS experience (and now 120FPS on iPad Pros) we once had in the early days of iOS. 

----------------------

**EDIT:** I feel inclined to tack on a disclaimer. I'm writing this to inform the wider community that Apple is detailing their efforts to smooth out animation in iOS 12, but I don't work for Apple and I don't make any guarantee that the frame drops WILL be fixed. I'm just acting as a messenger here. 

These are improvements that are in active development for iOS 12, and they are making the promise that it will help massively reduce frame drops in both first party and third party apps. As the only iOS 12 we have access to today is very early beta software, we cannot expect the current version to have these improvements fully implemented. We must reserve judgement on whether these endeavors were successful in solving the problem, or not, only when we have our hands on the final version of iOS 12. 

They've spent a year focusing a majority of engineering on optimizing low level frameworks to fix this and many other issues (I can do another write-up if anyone is interested, the new session videos dropped tonight). Quite frankly, if iOS 12 ships and the issue isn't solved/massively reduced on modern hardware (A9 and forward)... *I think we can safely abandon all hope that it ever will be.*

EDIT 2: Made some clarifications regarding the first point on pre-fetch. 

EDIT 3: I’ve never had the honor of making the fabled “Thanks for the gold!” edit for myself. Some said it was always a long shot, some said I just wasn’t born for gold.  But I’ve made it, here I am!  Thanks for the gold!!",253,2944,2018-06-07,AAPL,0.08774011209607124,0.8718826472759247,0.04037723410874605
apple,MKBHD and his tendency to state incorrect facts,"Edit: I would like to do a little post-discussion explosion additions here. In all honesty I went into this expecting a small group of comments and this post to disappear after a small amount of time. Because of this, my phrasing and terminology were much more lax than what I would have used if I knew this post would cause such a rift. I agree my post sounds a bit aggressive and some people have called me out for back tracking, which is fine I see what they’re saying, but essentially my reply to Marques is closer to what my feelings are. Were this a conversation between him and I, it would have been very casual and superficial. I genuinely feel bad that I likely came off as a bit insulting and appeared to be gas-lit and looking for validation. No one is perfect and that’s fine this was just something I had though about today. Sorry dude I meant no harm.  




Over the past few years, I have watched MKBHD videos a lot. Throughout that time, I’ve noticed a very frequent occurrences of him (seemingly) blatantly missing details about things he has talked about or simply giving incorrect information in almost every video focused on Apple products. 


In his most recent video of the [Top 5 iOS 12 Features ](https://youtu.be/RROs-zCrSko), he was flat out wrong about multiple things he had mentioned in the video. As an example, when he mentioned the addition of grouped notifications, he stated that while it was a nice feature, he wished Apple would implement a way to complete an action on a notification without entering the app. Anyone who has used iOS at all knows full well that we have had that ability for years yet he seems to have somehow not known about the actions apps present when you 3D Touch them. He said he hoped they would add it, but apparently it seems like it would be years from now, which is weird and absurd.


From his HomePod review video, he also stated that he thought it was very stupid that the HomePod can only be chosen as an output on the iPhone and NOT the Mac, Apple TV, or anything else. He went as far to say something along the lines of “classic Apple” which of course gave a field day to those in the comment section who enjoy cementing their distaste for Apple and their products. 


I think he is a good YouTube personality and his videos are always of excellent visual quality, but is quite baffling to me how little effort he puts into fact checking or (it seems) even doing a quick look into the settings/googling something he decided to put into the video. I currently chill in the Apple ecosystem with an iPhone and a Mac, but I like android a lot and keep up with that side of the fence just as much as Apple’s. It’s somewhat frustrating to watch a video of his where he states incorrect facts more than once in some videos with no history or intention of ensuring what he’s saying is true/back tracking to correct misinformation. 


I’m in no way trying to start some silly fanboy war, I was just curious about what this community felt about the topic.",629,2735,2018-06-07,AAPL,0.10949426144361496,0.8639982342720032,0.02650749310851097
apple,All the people Apple just pissed off to better protect your privacy,,262,1491,2018-06-07,AAPL,0.049564383924007416,0.8234609365463257,0.1269747018814087
iphone,iOS 12's Measure app is about to ruin some guys lives.,,60,531,2018-06-07,AAPL,0.3110042214393616,0.6651901602745056,0.023805659264326096
iphone,Apple proved this week that it's not trying to force you to buy a new iPhone,,133,491,2018-06-07,AAPL,0.5329495072364807,0.36197197437286377,0.10507848113775253
mac,PSA: MacOS Mojave will not let you install safari extensions that aren't approved by apple,,119,466,2018-06-07,AAPL,0.03307883068919182,0.9186400175094604,0.048281192779541016
apple,"In 1995, Apple promised us Dark Mode. I'm looking forward to them finally delivering!",,47,442,2018-06-07,AAPL,0.013661892153322697,0.703518271446228,0.28281983733177185
apple,iOS 12 definitely speeds up your iPhone,,78,417,2018-06-07,AAPL,0.012580294162034988,0.8299943208694458,0.1574253886938095
apple,"When macOS Mojave comes out, do us a favor: use Safari.","As many of you may have heard, [Apple is making a big push to making Safari a more powerful privacy tool](https://www.fastcompany.com/40581691/all-the-people-apple-just-pissed-off-to-better-protect-your-privacy) by anonymizing your data as much as possible. Basically, they're restricting what information about your machine companies can see by only allowing Safari to show them the most bare-bones basic info about your Mac. It's like the difference between a report describing ""a dark, glossy blue Ford Fusion with tinted windows and numberplate *555-LOL*,"" and ""a dark Ford sedan."" It won't stop companies from tracking you, or trying to at least, but it will make it harder to personally identify you in particular.

I watched the WWDC keynote, but it didn't really click until today that Mojave's Safari is [basically implementing something similar to TOR-style anonymizing](https://www.torproject.org/about/overview), minus the triple-encrypted routing to a separate node. The biggest thing about TOR's effectiveness (and the reason it was made public): [the more people that use it, the more that everyone using it blends in](https://youtu.be/mUP0tx7Ib2w?t=2m18s). Same case with Safari's ad-fingerprint disabling, the more people who use it, the more everyone using it blends in, because the more the people using it, the more they look like everyone else using it.

So Mac users, please do us a favour, when Mojave is released, switch to Safari if you haven't already. For your sake and that of everyone else using it.

TL;DR: Safari's ad-tracking disabling works better when more people use it, so if you're on macOS Majave, you can help make Safari's ad-tracking disabling more effective just by using Safari.

_____

Holy hell this blew up. I did not expect to get this much attention. Glad to help!

_____

This post is on the Front Page. Welp, I could retire from reddit happy now.

Also, RIP my inbox.",905,4627,2018-06-08,AAPL,0.04641249403357506,0.9205528497695923,0.033034663647413254
iphone,It’s actually insane how much better iOS 12 beta 1 is to iOS 11.4.,"I have a iPhone 7 and my god this thing is so much faster and smoother. I made a backup of 11.4 just Incase I run into any bugs but so far so good. iOS 12 feels so much better. 

Edit: I have no idea why this is flaired as a question.",256,1559,2018-06-08,AAPL,0.01292003970593214,0.6361793279647827,0.3509006202220917
AppleWatch,My Apple Watch is one of the most important weapons in my weight loss tool kit. 75 lbs down in 4 months.,,135,1420,2018-06-08,AAPL,0.023096399381756783,0.8857637643814087,0.09113984555006027
apple,In iOS 12 you can now swipe around on the home screen while apps are being minimized,"[Shown here in the developer session - Designing Fluid Interfaces](https://twitter.com/vincentriemer/status/1004880123617857536?s=12)

You can also dismiss an app while it's launching, or even interrupt it and go into multitasking.  And you can even interact with the app while it's coming into view.  This is pretty neat stuff.  Glad Apple is paying attention to these little things that can really make using the device just *feel* more responsive.",87,640,2018-06-08,AAPL,0.015743212774395943,0.9111769199371338,0.07307987660169601
AppleWatch,Nice find at target,,50,606,2018-06-08,AAPL,0.019922703504562378,0.8114807605743408,0.168596550822258
apple,"Apple Watch to get touch-sensitive solid-state buttons that use Taptic Engine to simulate clicks this or next year, buttons may act as health sensors",,100,439,2018-06-08,AAPL,0.02822483330965042,0.9261996746063232,0.04557551443576813
apple,"Apple's attention to the small details — The inside of this year's Apple Watch 'Pride Edition' Band is labeled ""Pride 2018"" instead of ""Woven Nylon""","I just noticed that the inside of this year's Pride Edition band is labeled ""Pride 2018"" instead of the typical ""Woven Nylon"" that is usually inside the woven bands, including last year's Pride Edition. Hopefully this means these are going to be a yearly tradition.

[Pride 2017 Band on Top. Pride 2018 Band on Bottom.](https://i.redd.it/9yc1wq2j8t211.jpg)

If nothing else, I wouldn't mind Apple specifying the colour name of the band on the non\-special edition bands. It would be more useful information than saying that it's ""Woven Nylon"" imho.",72,408,2018-06-08,AAPL,0.03807779401540756,0.9352957010269165,0.026626527309417725
apple,iCloud should offer Time Machine in the cloud and end-to-end encryption for storage and backup,"Currently Time Machine only works with an external hard drive or a local time capsule, NAS or similar. There is no possibility to use an external, off-site server, let alone iCloud. For the iOS devices however we have the possibilities of iTunes sync and iCloud backup. I don’t see why we shouldn’t have a similar option for macOS backups. It would be a great selling point for Apple to offer great backups out-of-the-box with a backup on a local device of yours, such as a time capsule, and an off-site backup in the iCloud.

Further, to make iCloud more attractive, unique and ultimately more secure against data breaches, the iCloud storage and backups put there should be truly end-to-end encrypted such that not even Apple could access the data. Currently this is only the case for a small amount of data, such as keychain elements, home data, payment data and iMessage in the cloud (if you do not perform iCloud backups). Of course, not backing up the keys used to encrypt your data runs a risk of permanently losing access to your backups and data, which is a problem I have no good solution to propose for. I am however sure Apple could come up with a clever way to solve this. 

What do you think? I’d be first in line for such a service.",81,377,2018-06-08,AAPL,0.07398299872875214,0.9006927013397217,0.02532423473894596
iphone,"Cool AR app created with ARKit 2: ""Control your iPhone with your eyes. Just look at a button to select it and blink to press. Powered by ARKit 2.""",,18,354,2018-06-08,AAPL,0.015321537852287292,0.9308812022209167,0.05379723012447357
ios,Why is 12 battery life is so good- iPad charges without being plugged in!,,45,332,2018-06-08,AAPL,0.011082150973379612,0.6952940225601196,0.2936239242553711
apple,iOS 12 includes support for reporting unwanted texts &amp; calls as spam,,463,8566,2018-06-09,AAPL,0.10195521265268326,0.8763588666915894,0.021685859188437462
iphone,A little gore for y’all,,127,1712,2018-06-09,AAPL,0.044949766248464584,0.8505202531814575,0.10452993214130402
AppleWatch,WWDC Pin for doing an Apple Watch Challenge,,42,1276,2018-06-09,AAPL,0.02508954145014286,0.9296790957450867,0.04523138701915741
iphone,"Okay, on a 32GB iPhone, this is getting outrageous.",,290,952,2018-06-09,AAPL,0.04703909903764725,0.5291759967803955,0.42378491163253784
ios,iOS 1.1 running on a 1st Gen iPod Touch,,112,651,2018-06-09,AAPL,0.013801135122776031,0.9029203057289124,0.0832786038517952
apple,"New iPhones To Use Next-Generation Of Face ID With Much Batter Reliability, As Dual-SIM will be Exclusively Available For iPhone X Plus",[deleted],169,545,2018-06-09,AAPL,0.013697046786546707,0.908211350440979,0.07809161394834518
iphone,Do you think the Iphone X will be a good choice to keep for 3-4 years?,"I had an Iphone and it got destroyed. I am looking for an upgrade,but also keep the phone for more than 3 years. Do you think it will last? if so, will it be up to date?

Cheers!",178,453,2018-06-09,AAPL,0.0388583168387413,0.8786671161651611,0.08247455954551697
ipad,"Not sure if iPad art is encouraged here, but here’s my Procreate portrait of the wonderful Noname, from my iPad Pro!",,22,320,2018-06-09,AAPL,0.016469944268465042,0.923348605632782,0.06018143147230148
iphone,iPhone X left in hot sun,I’m in Germany on an exchange program and left my phone in the hot sun for about and hour while tanning. When I woke up and grabbed it and it said I had to let it cool down. I brought it inside and it only took a couple minutes to cool down and let me into the phone. There was only a couple percent lost and it seems like no damage to the phone at all. Could I expect there to be any lasting damage though from this?,69,277,2018-06-09,AAPL,0.4070062041282654,0.5412517786026001,0.05174199864268303
mac,"Now your laptop will sleep when you fall asleep, instead of autoplaying YouTube or Netflix till you wake up and close it!",,19,218,2018-06-09,AAPL,0.07488135248422623,0.8804482221603394,0.04467041790485382
iphone,"5yrs ago today, iOS 7 was announced at WWDC 2013, making it the first complete redesign of iOS since 2007 — A giant leap from Steve Jobs' and Scott Forstall's iconic skeuomorphic design.",,244,1986,2018-06-10,AAPL,0.018981290981173515,0.8715693354606628,0.10944943875074387
apple,The changes to iOS’ ‘fluidity’ in iOS12 are amazing.,"Being able to interact with the OS even when apps are closing or launching is great and really makes the phone feel way faster than it was on iOS 11. 

Some neat things I’ve noticed/read about:

You can launch an app and start scrolling within the app even before it fills the screen. 
You can launch an app and then dismiss it even before the app has fully opened. 
You can close and app and instantly open another app from the home screen before the closing animation has finished, if you do it quick enough you can even see the closing animation and opening animation of each app playing at the same time. 
If you exit an app to a folder, you can exit the folder instantly without having to wait for the closing animation to finish. 
You can close an app an instantly start swiping on the home screen (although I think this may have been in iOS 11)",326,1642,2018-06-10,AAPL,0.02468343824148178,0.9081127643585205,0.06720385700464249
apple,"macOS Mojave Wallpapers for iPhone, iPad, and Apple Watch",,122,1420,2018-06-10,AAPL,0.02759198285639286,0.9101991057395935,0.062208957970142365
iphone,Apple says iPhone battery life is not improved by closing apps,,249,1091,2018-06-10,AAPL,0.015400740318000317,0.029563145712018013,0.9550361633300781
apple,"5yrs ago today, iOS 7 was announced at WWDC 2013, making it the first complete redesign of iOS since 2007 — A giant leap from Steve Jobs and Scott Forstall's iconic skeuomorphic design.",https://www.youtube.com/watch?v=4xzLr7xSr-g,152,778,2018-06-10,AAPL,0.018981290981173515,0.8715693354606628,0.10944943875074387
apple,iOS 12's Books dark background is pure black on the iPhone X.,This seems like such a small detail but it really bugged me that iOS 11's Books had a near-black but not FULLY black background. I really hope that more pure-black backgrounds come to iOS alongside dark mode.,50,542,2018-06-10,AAPL,0.027280420064926147,0.9380344748497009,0.03468509018421173
apple,Introducing MapKit JS: MapKit JS brings Apple Maps to your website.,[deleted],149,463,2018-06-10,AAPL,0.020782126113772392,0.9387051463127136,0.04051270708441734
apple,Apples conferences/events are so well put together.,"I know it’s different industries, but watching E3 yesterday and seeing EA’s conference, all I could think about is how disorganized and bad it was. It made me appreciate Apple and their well put together shows all the more. Now I’m sure Microsoft and Sony will be much better than EA during E3, but my main point was just that Apple really puts on some great organized events.",59,403,2018-06-10,AAPL,0.015149487182497978,0.625235915184021,0.35961461067199707
AppleWatch,Why can't we have these iPod Nano 6 watchfaces? Some of my favorites.,,73,291,2018-06-10,AAPL,0.02852318435907364,0.93684983253479,0.034626953303813934
ios,Texted my mom about dinner at 5 and this popped up after 5,,42,288,2018-06-10,AAPL,0.05699963867664337,0.9032368659973145,0.03976355493068695
apple,"Samsung rejects $539M Apple patent infringement verdict, demands a retrial",,372,2962,2018-06-11,AAPL,0.26505914330482483,0.6905708909034729,0.044369976967573166
apple,"Instagram has a full-featured web app, yet there's still no native iPad app. How is this possible?","Instagram's web app has everything built in except direct messages, yet Facebook has refused to release a proper iPad app. 

There are so many content creators that use iPads and share their work on Instagram, yet iPad users only option is to use the web interface or the iPhone app (which does not matches iPad screen resolution, thus looking terrible)! 

Instagram is one of the biggest social networks, yet iPad users are forced to use an enlarged and pixellated iPhone app.

EDIT: /u/Hunkir confirmed that **native iPad support is already built into the app,** but it’s disabled by default. Simply [replacing a number in a configuration file](https://reddit.com/r/apple/comments/8q5gab/_/e0hoo8m/?context=2) enables proper iPad support instead of the terrible 2x enlarged iPhone 4 app the rest of the users have to endure. So the app is already ported to iPad, yet Facebook refuses to release it?!",227,1858,2018-06-11,AAPL,0.10440028458833694,0.8706734776496887,0.02492627128958702
