subreddit,title,selftext,num_comments,score,created_utc,stock/sector,neg,neu,pos
iphone,An iPhone X ad is being hand painted in my city,,169,5134,2018-06-01,AAPL,0.02163037285208702,0.9218262434005737,0.05654333531856537
apple,iOS 12 will upgrade ARKit with ability for two iPhones to see same virtual object,,135,2453,2018-06-01,AAPL,0.021031681448221207,0.9137000441551208,0.06526823341846466
apple,Latest mobile CPU benchmarks show Apple two years ahead of the competiton,,254,1164,2018-06-01,AAPL,0.031475480645895004,0.8523269891738892,0.11619755625724792
mac,People say my MacBook makes me look like a terrorist...,,152,697,2018-06-01,AAPL,0.026539115235209465,0.9159274101257324,0.05753352493047714
apple,macOS 10.13.5 is out!,"Changelog should be here, but Apple hasn't updated the page yet: https://support.apple.com/en-us/HT208723

(Updated \^)

Security updates should be here (wait for an update from Apple): https://support.apple.com/en-us/HT201222

Full changelog:

&gt; ""The macOS High Sierra 10.13.5 update improves the stability, performance, and security of your Mac and is recommended for all users. 

&gt; This update adds support for Messages in iCloud, which lets you store messages with their attachments in iCloud and free up space on your Mac. To enable Messages in iCloud, go to Preferences in Messages, click Accounts, then select ""Enable Messages in iCloud

&gt; Enterprise content:

&gt; * [Variables used in SCEP payloads](https://help.apple.com/deployment/mdm/#/mdm495A6D79) now expand properly.

&gt; * Configuration profiles containing a [Wi-Fi payload](https://developer.apple.com/library/content/featuredarticles/iPhoneConfigurationProfileRef/Introduction/Introduction.html#//apple_ref/doc/uid/TP40010206-CH1-SW30) and [SCEP payload](https://developer.apple.com/library/content/featuredarticles/iPhoneConfigurationProfileRef/Introduction/Introduction.html#//apple_ref/doc/uid/TP40010206-CH1-SW18) install as expected when the ""KeyIsExtractable"" key of the SCEP payload is set to ""false.""",177,568,2018-06-01,AAPL,0.02887796238064766,0.9374421238899231,0.03367996960878372
AppleWatch,My watch thinks I’m a little lazy...,,71,530,2018-06-01,AAPL,0.09551456570625305,0.8237695693969727,0.0807158499956131
apple,Apple Declines EU Invitation to attend a Tax Evasion and Financial Crimes Committee Meeting,,138,494,2018-06-01,AAPL,0.1743743121623993,0.8008174896240234,0.024808179587125778
apple,I found who stole my iPhone using a personal data request from Apple,"I've made a couple of data requests to Apple over the last couple of weeks, learning more about how they respond to these. The dump of data I got this morning included AppleCare records showing that someone had rocked up at an Apple Store and paid for a repair job *on my stolen phone*. In order to do so, they had to leave a bunch of their own details with Apple.

Pretty cool that a stolen phone from two years back can reappear like this; it seems likely I'll be able to get a handle on who took it, or at least who has it now.

I wonder, should people who steal phones have to consent to Apple storing their data?

I wrote up [what I did, and what I was sent](https://www.reincubate.com/blog/stolen-iphone-thief-identity-revealed-gdpr/) earlier today.",94,447,2018-06-01,AAPL,0.2353908121585846,0.7354479432106018,0.02916124276816845
iphone,iPhone SE 2 Leaks are rampant,,99,424,2018-06-01,AAPL,0.7904931902885437,0.19273757934570312,0.01676924340426922
AppleWatch,I feel it! It‘s going to be a great twentygayteen!,,29,328,2018-06-01,AAPL,0.01754354126751423,0.7825148701667786,0.19994163513183594
apple,"The 5 Lock Button press ""Emergency Mode"" should have an option to start video/audio recording with auto cloud upload.",,102,1579,2018-06-02,AAPL,0.07321067899465561,0.8925336003303528,0.034255772829055786
apple,Xcode 10 on macOS 10.14 has a dark mode,"/r/Apple doesn't allow direct links to Twitter, but [here](https://twitter.com/stroughtonsmith/status/1002893737037582336) is a tweet by Steve Troughton-Smith.

It's unclear where this came from, but he's the one who dug into the iOS 11 GM when it leaked before the keynote last year and discovered Animoji and a lot of details about Face ID, so this is probably legit.

Edit: [Follow-up tweet](https://twitter.com/stroughtonsmith/status/1002903470939230208):

&gt; As usual, the spoilers came from within: Apple posted a 30-second preview video of Xcode on 10.14 to the Xcode MAS store page API (which, as videos aren't supported on the MAS, 'should' have been hidden. Guess nobody checked.). Here's the full video: https://9to5mac.com/2018/06/02/leaked-macos-10-14-screenshots-show-off-new-dark-mode-apple-news-app-xcode-10/

Edit 2: [Video hosted on Apple's site.](http://apptrailers.itunes.apple.com/apple-assets-us-std-000001/PurpleVideo115/v4/6a/de/53/6ade53cf-d36a-0f2f-6b10-d0aecc417887/P53788383_default.m3u8)",200,1482,2018-06-02,AAPL,0.04087730869650841,0.9324733018875122,0.02664940245449543
iphone,Perfect protection for going naked/not naked,,137,956,2018-06-02,AAPL,0.09508822113275528,0.8746679425239563,0.03024386428296566
AppleWatch,The time for 🍺 is near,,39,613,2018-06-02,AAPL,0.0896495133638382,0.8649176359176636,0.04543287679553032
apple,Remember Steve Job's 2010 Email Outlining Apple's Roadmap? Seems they nailed nearly all of it...,,173,511,2018-06-02,AAPL,0.04157554358243942,0.883573055267334,0.07485140115022659
apple,I just want to drop in and say that Apple’s News app is fantastic and deserves more recognition.,"I can’t speak for any other News App competition, but I am in love with the iOS News App. I never thought I would ever be able to replace Flipboard back in the day!

Edit: Not saying it’s perfect by any means. But it’s very solid IMO",162,477,2018-06-02,AAPL,0.039246849715709686,0.9142079949378967,0.04654521495103836
apple,The video EverythingApplePro made yesterday showing off the leaked ios 12 features was fake.,"He deleted the video and made a new one where he apologizes and says the video was obviously faked.

Link to the new video: https://www.youtube.com/watch?v=FIDHkUO8q5I&amp;t=0s",142,399,2018-06-02,AAPL,0.07022874802350998,0.8931252956390381,0.03664589673280716
apple,"Why’s Apple taking such a long time to get Apple News in other countries? Even in English speaking countries like Canada, it’s not available.",,38,384,2018-06-02,AAPL,0.02336101420223713,0.9121782183647156,0.06446078419685364
mac,Screenshots of macOS 10.14 and Xcode 10 with Dark Appearance Leak,[deleted],54,290,2018-06-02,AAPL,0.06547583639621735,0.9076148867607117,0.026909248903393745
ios,Safari forgot that the iPhone X has a notch,,59,270,2018-06-02,AAPL,0.01623053476214409,0.9049614667892456,0.0788080096244812
apple,A Third Class Action has been filed against Apple in California over MacBook Pro Keyboard Problems,,713,3796,2018-06-03,AAPL,0.6176455616950989,0.3580939769744873,0.024260511621832848
apple,Now is the time for free iCloud storage to be increased.,,672,1786,2018-06-03,AAPL,0.027956750243902206,0.9290809631347656,0.04296225309371948
iphone,iPhone landscape lock screen glitch made for a pretty cool bedside clock,,139,1359,2018-06-03,AAPL,0.010974690318107605,0.790342390537262,0.19868288934230804
iphone,"3 years on, the 6S is still the best phone I’ve ever owned.","Anybody that knows me irl would consider me to be very ADD when it comes to tech. I always sell my devices to upgrade to the latest and greatest. Between 2006 and 2015 when I got the 6S, I had 12 phones - an average of one every 9 months. 

But honestly, I haven’t had a reason to upgrade from the 6S. I had always heard about how long iPhones were supported (for better or worse) but I never thought after 3 years I’d have a phone on the latest OS performing exactly the same as the day I got it.  Even getting one years worth of updates is pushing it in the majority of the Android world. I had a few month low point after iOS 11 was released where I was getting awful lags, but that is long gone now. 

No wonder Apple still sells the 6S and SE. This hardware seems to be rock solid futureproof. Other than the shiny newness of the iPhone X interface, I don’t have a legitimate compelling reason to upgrade anytime soon.",313,1194,2018-06-03,AAPL,0.021824225783348083,0.9052196741104126,0.0729561448097229
apple,New Airpods seem to be announcing tomorrow...,"Checking stock on the Airpods in Toronto, a couple of days ago it showed stock in all the stores and just checked today and all shows available June 18. Seems very odd that all would go out of stock suddenly and have a new restock date. Pretty good sign a new model is coming out?

EDIT: Checked again and ALL of Canada shows out of stock \(except one store\) and available June 18. US still shows in stock in stores though.",407,953,2018-06-03,AAPL,0.02678558975458145,0.8589589595794678,0.11425545811653137
AppleWatch,"Three Years Later, S0 Is Still Great",,88,528,2018-06-03,AAPL,0.05772313475608826,0.4989638328552246,0.44331300258636475
AppleWatch,What is this watchface? I have been seeing it a lot on the internet. How can you get it?,,62,512,2018-06-03,AAPL,0.015661315992474556,0.91973876953125,0.06459993124008179
apple,Apple Music webplayer?!,"Ok so sometimes I use the Apple Music tools website to search a playlist that isn’t available in search (like some playlist of Skam or Norwegian rap). But this time I noticed that the player design changed a bit and after listening to a song (preview mode of 30s) I got the message asking me to log in Apple Music. 
So I logged in and this came up: 

[photo](https://imgur.com/a/JgoYTAH)

It’s something like “this and other websites have access to your account, so you can listen to a full song and add it to your library”.

By the way this is the website https://tools.applemusic.com/ 

[video from my computer](https://m.imgur.com/gallery/WgxPHQ5)

Maybe this wwdc we could see something about it.

I just wanted to share it and sorry for my English .",71,450,2018-06-03,AAPL,0.04433927685022354,0.9220343828201294,0.033626340329647064
apple,MacBook Pro refresh confirmed by Geekbench leak?,[deleted],305,419,2018-06-03,AAPL,0.028055336326360703,0.9194745421409607,0.052470166236162186
iphone,Loving the “Denim Blue” Silicone case!,,33,408,2018-06-03,AAPL,0.029665736481547356,0.899807870388031,0.0705263763666153
apple,iOS 12 to run on everything that runs iOS 11,,1296,9948,2018-06-04,AAPL,0.022273803129792213,0.9430902004241943,0.03463605418801308
apple,Can we all agree that Craig Federighi is a brilliant presenter.,"I am always hooked when he is on the stage, he is very good at keeping your attention, much more so than any others. Tim is still great too! Well done Craig and the rest of the Apple Team for today!",371,2465,2018-06-04,AAPL,0.027082303538918495,0.7212173938751221,0.2517002820968628
iphone,Proof AirPods are just dental floss,,38,1955,2018-06-04,AAPL,0.046201013028621674,0.9301170110702515,0.023681936785578728
iphone,Grouped Notifications on iOS 12!,,239,1767,2018-06-04,AAPL,0.021055418998003006,0.9258272647857666,0.053117308765649796
apple,Third-party password managers will be able to integrate with AutoFill in iOS 12!,,152,1745,2018-06-04,AAPL,0.013795213773846626,0.9227866530418396,0.06341806799173355
iphone,So close yet so far.,,109,1498,2018-06-04,AAPL,0.15411226451396942,0.6212327480316162,0.2246549129486084
apple,Here is everything Apple announced at WWDC today!,"* [iOS 12 introduces new features to reduce interruptions and manage Screen Time](https://www.apple.com/newsroom/2018/06/ios-12-introduces-new-features-to-reduce-interruptions-and-manage-screen-time/)

* [iOS 12 includes new Animoji characters, ‘Memoji’ avatar design feature](https://9to5mac.com/2018/06/04/ios-12-includes-new-animoji-characters-memoji-avatar-design-feature/)

* [Apple announces third-party map support for CarPlay, improvements to Stocks, Books, Voice Memo](https://9to5mac.com/2018/06/04/apple-wwdc-app-updates/)

* [Apple unveils new first-party ARKit Measure app that can auto-detect dimensions of objects](https://9to5mac.com/2018/06/04/apple-unveils-new-first-party-arkit-measure-app-that-can-auto-detect-dimensions-of-objects/?pushup=1)

* [Apple unveils AR Kit 2](https://www.apple.com/newsroom/2018/06/apple-unveils-arkit-2/)

* [watchOS 5 adds powerful activity and communications features to Apple Watch](https://www.apple.com/newsroom/2018/06/watchos-5-adds-powerful-activity-and-communications-features-to-apple-watch/)

* [Apple introduces new Apple Watch Pride band, available today](https://9to5mac.com/2018/06/04/apple-introduces-new-apple-watch-pride-band-available-today/)

* [Apple TV 4K delivers highest quality cinematic experience with tvOS 12](https://www.apple.com/newsroom/2018/06/apple-tv-4k-delivers-highest-quality-cinematic-experience-with-tvos-12/)

* [Apple announces tvOS 12 with immersive Dolby Atmos audio, iTunes content upgraded for free, more](https://9to5mac.com/2018/06/04/apple-announces-tvos12-wwdc/)

* [Apple unveils macOS 10.14 Mojave with dark mode](https://9to5mac.com/2018/06/04/apple-unveils-mac-10-14/)

* [Apple details redesigned Mac App Store with new editorial content, major apps coming this fall](https://9to5mac.com/2018/06/04/apple-details-redesigned-mac-app-store-with-new-editorial-content-major-apps-coming-this-fall/)

* [Safari Browser in iOS 12 and macOS Mojave to Feature Enhanced Privacy Tools](http://www.macrumors.com/link/639612/)

* [Apple gives a sneak peek at multi-year project to bring UIKit iOS apps to the Mac](https://9to5mac.com/2018/06/04/apple-gives-a-sneak-peek-at-multi-year-project-to-bring-uikit-ios-apps-to-the-mac/)

* [New apps added in macOS Mojave: Apple News, Stocks, Home, and Voice Memos](https://9to5mac.com/2018/06/04/new-apps-added-in-macos-mojave-apple-news-stocks-home-and-voice-memos/)",767,1343,2018-06-04,AAPL,0.017471425235271454,0.9261466264724731,0.056381937116384506
apple,Now it makes sense why Apple acquired the company behind Workflow!,"I am **really** looking forward to the new Shortcuts app. I always felt Workflow’s potential was limited due to the iOS API, I’ve always wanted them to access system-level stuff. 

I’ve already heard people criticizing it saying “since Siri can’t find out what you want, just go do it yourself” as if that’s a bad thing or something. I AM SO GLAD I CAN DO IT MYSELF. Too many people are becoming *dependent* in a way and this sense of control makes me really excited for iOS 12. Yes, it’s a shame that Siri can’t keep up but I have a feeling Apple is going to use all of these user-created shortcuts to improve Siri overall, it’s just a matter of time!",162,1206,2018-06-04,AAPL,0.07200627028942108,0.8939960598945618,0.03399767726659775
apple,iOS 12 performance is seriously impressive.,"So I've got an iPad mini 2 and I pretty much declared it dead a while ago. The loading times and performance were just horrible, and I deemed it unusable.

Fast forward to today, running the latest beta and I am shocked. This thing is practically new. The OS is snappy, apps load up a lot faster, and it really feels like it has gotten a second life. Thanks, Apple.",274,1184,2018-06-04,AAPL,0.013004310429096222,0.779462456703186,0.20753324031829834
mac,First Start Prompt,,107,1027,2018-06-04,AAPL,0.03704198822379112,0.9354180097579956,0.0275400560349226
apple,Apple Confirms Mojave is the Last macOS Release to Support 32-Bit Apps,,548,3006,2018-06-05,AAPL,0.028117645531892776,0.9173363447189331,0.05454600602388382
iphone,Measured my cat with iOS 12’s Measure App,,155,2608,2018-06-05,AAPL,0.01786726713180542,0.8727177381515503,0.10941507667303085
apple,Apple revised App Store rule after rejecting Valve’s game streaming app Steam Link. Probably means it’s coming very soon to iOS,,154,2157,2018-06-05,AAPL,0.385319322347641,0.5344474911689758,0.0802331417798996
apple,Apple CEO Tim Cook: 'Privacy is a Fundamental Human Right',,198,1789,2018-06-05,AAPL,0.024103479459881783,0.9312818646430969,0.04461466521024704
iphone,Can we ban pictures of boxes?,"There have been more than enough posts that are just ""I got a new iProduct today!"" And the actual post is just a picture of box. That's it. Just a picture of a box. Why don't we just make a new sub called /r/pictureofabox or /r/iBoxes or something?",122,1762,2018-06-05,AAPL,0.022893428802490234,0.9079694151878357,0.06913711875677109
apple,New App Store guidelines: Apps will now be forced to clearly describe new features in update notes,"&gt; 2.3.12: Apps must clearly describe new features and product changes in their “What’s New” text. Simple bug fixes, security updates, and performance improvements may rely on a generic description, but more significant changes must be listed in the notes.

[Link](https://developer.apple.com/app-store/review/guidelines/#accurate-metadata)",166,1746,2018-06-05,AAPL,0.02494429051876068,0.9285035729408264,0.04655211791396141
apple,Apple CEO Tim Cook says data tracking is 'totally out of control',,149,1121,2018-06-05,AAPL,0.3117567300796509,0.38539883494377136,0.30284440517425537
apple,Face ID in iOS 12 can now recognize two different people,,222,1027,2018-06-05,AAPL,0.06145046278834343,0.9124366044998169,0.026112966239452362
apple,Full res MacOS Mojave wallpaper:,,40,1009,2018-06-05,AAPL,0.0315542072057724,0.9218490719795227,0.0465967170894146
AppleWatch,"Please Apple, add the ability for my watch to tell me when I left my phone somewhere.",They could easily add it so when the watch looses Bluetooth connection with the phone. It will give 3 quick vibrates with a little notification or something. I would really love this feature so I never have to worry about leaving my phone at a restaurant or something ever again.,73,808,2018-06-05,AAPL,0.03352290019392967,0.9221397042274475,0.0443374402821064
iphone,Finally got my first pair of AirPods!,,389,24047,2018-06-06,AAPL,0.01798276975750923,0.7411266565322876,0.24089060723781586
iphone,"Mods are asleep, upvote iphone 3G",,100,3643,2018-06-06,AAPL,0.026449022814631462,0.9170449376106262,0.056506022810935974
apple,iOS 12 screentime will definitely create akward situations.,"[As seen here](https://i.imgur.com/Zu2MoDv.jpg), screentime displays some websites in its list. It’ll be fun when you show to your friends how you spend time on your phone and pornhub and similar appear with dozens of hours.

Edit: for science, I tested incognito mode. It doesn’t charge anything. [It also track all your websites.](https://i.imgur.com/OEGVIv6.jpg)",464,2658,2018-06-06,AAPL,0.04176483675837517,0.9320489168167114,0.026186222210526466
apple,A new era of Apple,"I really feel like with this past WWDC Apple really turned a corner in getting back to what made them great to begin with. Listening to the professionals but making the experience for everyone which Tim even said himself.

It speaks volumes that iOS 12 Beta 1 feels better and more reliable than the last version of 11.4.

I’m really looking forward to the next lot of hardware revisions. I think they will prove this return to form with new MacBook Pro’s and the new Mac Pro. The iMac Pro has already been a hint at their intent. 

I’ve gone from nearly looking outside the Apple Ecosystem to doubling down on them for the future. 

Nice work Tim.",593,1910,2018-06-06,AAPL,0.015257720835506916,0.7699664831161499,0.21477572619915009
iphone,I recreated The Brady Bunch intro out of the new Memojis,,74,1612,2018-06-06,AAPL,0.04724898561835289,0.9032769203186035,0.04947414621710777
apple,Trials for Paid Apps Come to App Store,,133,1334,2018-06-06,AAPL,0.013445665128529072,0.9313927292823792,0.05516158044338226
iphone,Toy phones are finally embracing the notch,,36,1081,2018-06-06,AAPL,0.031934164464473724,0.8165640234947205,0.1515018194913864
AppleWatch,I really like how these match!,,74,744,2018-06-06,AAPL,0.02198841981589794,0.8885544538497925,0.08945707976818085
apple,Introduction to Siri Shortcuts,,104,617,2018-06-06,AAPL,0.04095935449004173,0.9216606616973877,0.03737999498844147
apple,"In iOS 12, you can use AirPods as hearing aids.","In the control center settings, add “hearing” to “include”.",96,613,2018-06-06,AAPL,0.02244975045323372,0.9287314414978027,0.04881878197193146
apple,Apple strips Facebook &amp; Twitter integration from macOS Mojave,,463,7264,2018-06-07,AAPL,0.06003297492861748,0.9039772748947144,0.03598980978131294
iphone,Samsung AR Emoji vs. Apple Memoji,,363,6844,2018-06-07,AAPL,0.018896566703915596,0.8366625308990479,0.1444409340620041
