subreddit,title,selftext,num_comments,score,created_utc,stock/sector,neg,neu,pos
mac,TIL you can use your iPhone as an input audio device on your Mac,,95,997,2018-06-11,AAPL,0.013414612039923668,0.9286016225814819,0.05798378586769104
iphone,Apple should introduce a free-trial period for iOS games,"Basically, you get a free-trial where you can try premium games/apps for a certain period set by the developers e.g. 1 day, 3 days or 1 week. 

Let's face it - people aren't willing to spend money on premium games. And I can understand why, as I've regretted spending money on premium games because it was different to what I expected, or I just didn't like it. 

Introducing a free-trial period would support premium games more as it would allow iOS users to know if the game is worth spending money on. 

It's a shame that iOS is littered with poor quality F2P games that have in-app purchases, a P2W mechanism, or an energy/time system. 

The loot-box rule (the one where new apps must now disclose odds of loot boxes) they introduced last year was a step in the right direction for iOS gaming. But that is not enough, we iOS players want more quality games.",96,760,2018-06-11,AAPL,0.018574468791484833,0.9199634790420532,0.061462078243494034
iphone,Washed iPhone X in washing machine accidentally......,"I'm an idiot. Accidentally ran my phone through the washer for half a cycle. Realized it maybe, 20 minutes after it began. I couldn't find my phone, then it clicked that that's where it might be. The floor is soaked, but I found my phone lol.

So far, calls work, facetime works, cameras work, performance seems to work, i'm just worried something will come up. Thank god for Apple Care.

Any tests I should run to check if all is well, or just wait it out? Has anyone else done anything this stupid and want to make me feel better? 

EDIT: One day later, everything is well. Sound working, calls working, cameras working. Absolutely flawless. I'll keep updating.

EDIT: Two days later.....not even one thing is wrong with this phone haha still flawless.

EDIT: Day 3........nothing.",150,486,2018-06-11,AAPL,0.10141921788454056,0.8673062920570374,0.031274497509002686
apple,"The Elder Scrolls Blades is a first-person, free, mobile RPG",,57,477,2018-06-11,AAPL,0.015038736164569855,0.8447769284248352,0.14018434286117554
AppleWatch,Fuuuuuuuuuuuuuuuuuuuuu,[deleted],73,464,2018-06-11,AAPL,0.050602082163095474,0.8863006830215454,0.0630972608923912
apple,Lost iPhone X somehow survives weeks-long river adventure and finds owner [Video],,80,436,2018-06-11,AAPL,0.03636503219604492,0.7996272444725037,0.1640077829360962
iphone,What's the best car phone mount you have used so far?,"There are too many cell phone car mount options out there, what is the best one you find?

For me I found the best one is the [MagMount Qi from PITAKA](https://www.ipitaka.com/collections/magmount-qi?utm_source=reddit&amp;utm_medium=lily&amp;utm_term=MagMount%20Qi),  It is the only one I can find that has magnetic and wireless charging working at the same time in a proper way. Best of all, not like other car mounts,  it can automatically align the charging position, just need to simply attach my phone on and it starts to charge my phone, very convenient imo. Besides, I like their [MagCase](https://www.ipitaka.com/?utm_source=reddit&amp;utm_medium=lily&amp;utm_term=MagCase), probably the thinnest protective case in the world! Yes I'm a huge fan of PITAKA lol.",206,416,2018-06-11,AAPL,0.014167051762342453,0.903990626335144,0.08184236288070679
ios,iOS12 now puts 2FA sms codes into your autocomplete. Neat!,,33,320,2018-06-11,AAPL,0.027970347553491592,0.9258545637130737,0.04617513343691826
apple,Apple quietly banned developers from selling and sharing users’ contacts,,96,3716,2018-06-12,AAPL,0.622006356716156,0.34139248728752136,0.036601077765226364
apple,Supply Chain Rumor Claims Apple will switch to USB Type-C in its Series of 2019 iPhones,,570,3162,2018-06-12,AAPL,0.03018190711736679,0.9219009280204773,0.047917161136865616
iphone,iPhone Rumored to Adopt USB-C Ports Next Year,,260,1049,2018-06-12,AAPL,0.011287267319858074,0.8670262098312378,0.12168645858764648
apple,Apple Updates App Store Guidelines Prohibiting Data Harvesting,,93,946,2018-06-12,AAPL,0.04080606624484062,0.9172900319099426,0.04190387949347496
mac,Mojave's dynamic wallpapers make for a gorgeous timelapse video,,44,915,2018-06-12,AAPL,0.023364027962088585,0.9288983345031738,0.04773755744099617
iphone,iOS 11.4 brings battery life problems to some iPhone users,,187,825,2018-06-12,AAPL,0.8615114688873291,0.12311399728059769,0.015374514274299145
apple,7 months later since the launch of the iPhone X and still no sign of OLED burn-in.,"I really have to give Apple credit. They did an amazing job with the OLED implementation on the iPhone X. I have the screen on a lot so there's a lot of instances where there are static UI elements onscreen. 

Including one really weird experience where I accidentally fell asleep with my phone, I think Face ID kept scanning my face thinking I was looking at the iPhone and the screen stayed on the entire night! Even after that, still no burn\-in!

Whatever hardware techniques Apple employ through iOS to prevent burn\-in is clearly working and Apple should be commended for that. This also further buttresses their philosophy about not being first to release new tech but making it best.",97,540,2018-06-12,AAPL,0.03153114393353462,0.9042065143585205,0.06426233053207397
AppleWatch,Happy Tuesday,,128,530,2018-06-12,AAPL,0.06802311539649963,0.8252114653587341,0.10676539689302444
apple,iOS 11.4 is killing battery life on some iPhones,,173,493,2018-06-12,AAPL,0.03172222524881363,0.856050968170166,0.11222682893276215
apple,Want Spotify and Podcasts on your Apple Watch? WatchOS 5 will allow Audio Apps.,,78,486,2018-06-12,AAPL,0.021621201187372208,0.940933346748352,0.03744541481137276
apple,Apple to Close iPhone Security Hole That Police Use to Crack Devices,,331,3563,2018-06-13,AAPL,0.7050294876098633,0.2747402489185333,0.020230190828442574
apple,Shortcuts: A New Vision for Siri and iOS Automation,,202,1459,2018-06-13,AAPL,0.02208062633872032,0.8978914022445679,0.0800279974937439
iphone,Apple Confirms Plans to Disable Law Enforcement Access to iPhone via Tools Like GrayKey Box,,112,1373,2018-06-13,AAPL,0.012192055583000183,0.8871018290519714,0.10070613026618958
iphone,Bright Orange Leather case looks awesome,,147,1357,2018-06-13,AAPL,0.012636153027415276,0.7699702382087708,0.21739362180233002
AppleWatch,Wayback Wednesday - The first Apple Watch for fitness,,47,905,2018-06-13,AAPL,0.02838432602584362,0.9271939992904663,0.044421639293432236
apple,And another great idea stolen..,"Again Apple was not the first, but arguably the most successful:

https://i.imgur.com/W539kl6.jpg",66,720,2018-06-13,AAPL,0.010040144436061382,0.727798342704773,0.2621614933013916
apple,Apple finally has the right attitude about notifications in iOS 12,,142,663,2018-06-13,AAPL,0.02252071723341942,0.8148658275604248,0.16261345148086548
mac,"PSA: Please, please, please enable your firmware passwords!","Recently had my MacBook Pro stolen — left alone in a uni library for 5 mins whilst I went to the loo, though it'd be OK but alas. Anyway, that's stupidity on my behalf.

Thing is: I had Find My Mac enabled. I got back 5 mins later to a laptop that was missing, so had a look for it. Nothing registered. 30 mins later and my device didn't show in FMM — weird.

Looking into this, it seems likely the thief knew what they were doing. You can boot into recovery, clear the NVRAM (single line in terminal is all it takes) and that will prevent your Mac from communicating with Apples servers with regards to FMM. If they then wipe the hard drive, reinstall Mac OS and quickly login to iCloud with their own account, it will completely overwrite your ownership in iCloud. You won't be able to trace the Mac, or do anything to do. Apple won't help.

At this point you're at the mercy of law enforcement finding it and matching a serial number - a very unlikely scenario.

---

Lesson? ENABLE YOUR FIRMWARE PASSWORDS! If you do this in recovery, thieves can't wipe the HDD meaning even if NVRAM is cleared, the device is useless to them. If they don't, they can't wipe it either so eventually the Mac will ping when it connects to internet somewhere and you can track the device.

It's too late for me, but don't make the same errors. Don't leave your device unattended at all, ever. Enable firmware passwords. Enable find my Mac. Make a note of your serial number.

--

On a side note: I'm gutted that Apple doesn't have a solution whereby the serial number alone can trigger alerts when the device is reported as stolen. Having all FMM data stored in NVRAM seems far too easy to overcome.",116,488,2018-06-13,AAPL,0.11344489455223083,0.8588531613349915,0.02770191617310047
iphone,"Our iPhones Have Different Headings, Coordinates and Elevations",,81,484,2018-06-13,AAPL,0.026455800980329514,0.9410742521286011,0.0324699841439724
apple,2018 iPhone lineup will bring even faster charging,,108,455,2018-06-13,AAPL,0.010722661390900612,0.1570596843957901,0.8322176337242126
apple,All Apple Park employees getting standing desks because ‘sitting is the new cancer’,,572,3958,2018-06-14,AAPL,0.09807071089744568,0.822424054145813,0.07950522005558014
iphone,Finally found a way not to lose my pods,,127,2147,2018-06-14,AAPL,0.20184820890426636,0.45947885513305664,0.3386729657649994
iphone,Apple to Close iPhone Security Hole That Police Use to Crack Devices,,81,916,2018-06-14,AAPL,0.7050294876098633,0.2747402489185333,0.020230190828442574
AppleWatch,Metroid Watch face.,,53,538,2018-06-14,AAPL,0.04198430851101875,0.926981508731842,0.031034138053655624
apple,AirPods: battery degradation update after 18 months,"Thought this would be helpful for anyone currently using, or considering buying AirPods.

Background:

I received my AirPods on December 20th 2016 after preordering on Day 1. In early April 2017, I got my right AirPod replaced due to unresponsive sensors. I am a heavy AirPods user. For the past 18 months, I have used them anywhere from 2-8 hours every day for: listening to music/podcasts and phone calls. I use them exclusively in the gym, and have completely drained the batteries many times during long conference calls.

Degradation after 18 months:

- AirPods (together) drain about 25% per hour while listening to music and podcasts. I have noticed they drain slightly faster when the volume is louder. 
- The left AirPod (original) drains about 65% per hour on phone calls. This drains noticeably faster (as much as 5-10% more per hour) if I am speaking through the mic for most of the call.
- The right AirPod (replaced after 4 months) drains about 55% per hour on phone calls. I don't notice this one draining much when I'm speaking a lot.

So taking all of the above data into consideration, one can conclude that my AirPods will last around 4 hours per charge on music, and about 92 minutes per charge on phone calls (more if I manage both AirPods during calls). We're looking at about 20-25% degradation after 18 months of heavy use. 

My conclusion? This is about what I expected. I continue to use and enjoy my AirPods every day. So well done, Apple.",97,443,2018-06-14,AAPL,0.05112605169415474,0.9160740375518799,0.03279991075396538
mac,My first Mac ever. Got it for $600 from a friend (specs in flair),,63,349,2018-06-14,AAPL,0.013487077318131924,0.7848830819129944,0.2016299068927765
apple,Report: Grayshift may have already found a way around USB Restricted Mode in iOS 12,,118,329,2018-06-14,AAPL,0.02746763825416565,0.8801215887069702,0.09241074323654175
apple,Dark mode in macOS Mojave shows just how much the Windows one sucks | iMore,,63,326,2018-06-14,AAPL,0.025066740810871124,0.889133095741272,0.0858001783490181
apple,On The Sad State of Macintosh Hardware,,333,315,2018-06-14,AAPL,0.02907729148864746,0.9216525554656982,0.049270112067461014
apple,Face ID mirror fun,Just lined up 3 mirrors and managed to get the infrared sensors to reach my face and unlock my phone around a corner.,38,314,2018-06-14,AAPL,0.018092483282089233,0.9029505848884583,0.07895688712596893
apple,PSA: Apple Maps is Down for Many Users as 'Directions Not Available' Right Now,,371,1857,2018-06-15,AAPL,0.014481324702501297,0.9158504009246826,0.06966833025217056
apple,"Not Only Is the Mac Mini Outdated, It’s No Longer Mini",,530,1827,2018-06-15,AAPL,0.4631944000720978,0.37260547280311584,0.164200097322464
apple,Apple’s Spike Jonze-directed HomePod ad wins ‘advertising excellence’ award at AICP show,,72,1797,2018-06-15,AAPL,0.013665560632944107,0.27574974298477173,0.7105847001075745
iphone,"Reading on an iPhone X [TIP: use reduced white point, low-med light, and black background or smart invert if not available]",,101,1747,2018-06-15,AAPL,0.041580986231565475,0.9056786894798279,0.05274027958512306
apple,"Don’t update to Messenger 170.0 on iPhone X running iOS 11.4, as it crashes every time you switch to the app.","As the title says. After it crashes it will launch again, but then will consistently crash when you relaunch it after moving away.

EDIT: Update is out to fix.",283,1026,2018-06-15,AAPL,0.7008479833602905,0.28377267718315125,0.015379316173493862
iphone,Got this sweet bamboo case at the Sydney farmers market,,45,852,2018-06-15,AAPL,0.022592760622501373,0.8912733793258667,0.08613389730453491
AppleWatch,My Star Wars watch face!,,72,667,2018-06-15,AAPL,0.04290131852030754,0.9235843420028687,0.033514365553855896
mac,Photo of our families mac/I device collection. (Taken 2016),,57,652,2018-06-15,AAPL,0.021390050649642944,0.9403703212738037,0.03823962062597275
iphone,iPhone 3GS will go back on sale soon in South Korea; a stock of unopened units was discovered in a warehouse owned by SK Telink.,,49,512,2018-06-15,AAPL,0.023904329165816307,0.9196957945823669,0.056399840861558914
mac,"After reaching age 5 my company gave me a 2012 MacBook Pro as a write off. 1TB HD, 16gb ram, 2.5 i5.",,55,382,2018-06-15,AAPL,0.014389674179255962,0.8930279612541199,0.09258239716291428
apple,I wish more companies or even Apple themselves made AirPlay a little more universally accepted.,"For example, Apple only sells the Apple TV (over $200 in Australia) which then allows the device it's plugged into to be AirPlay ready.
What I propose is an ""AirPlay dongle"" that you plug into your TV (at a fraction of the cost of an Apple TV) that then grants that device with basic AirPlay capabilities.
The amount of times I'm at my partners house and want to watch a movie I've purchased on iTunes yet he doesn't own an Apple TV.
I understand that I could just HDMI my MacBook to the TV itself, but this would be an easier solution that would grant multiple TV's in your household the ability to AirPlay.",237,1761,2018-06-16,AAPL,0.013477589935064316,0.8931034207344055,0.09341892600059509
apple,I started building an Apple Music web player with MusicKit JS,"I've started building started building an Apple Music web player with MusicKit JS. It's available at [https://music.zacharyseguin.ca](https://music.zacharyseguin.ca).

It's still early in development, but the code is available on GitHub: [https://github.com/zachomedia/apple-music-webplayer](https://github.com/zachomedia/apple-music-webplayer).",206,1261,2018-06-16,AAPL,0.011411516927182674,0.9124939441680908,0.07609450072050095
iphone,Just finished charging my iPhone 7+ for the second time today..,..now I can rest assured it will last till the end of day,265,860,2018-06-16,AAPL,0.023560242727398872,0.7562392950057983,0.22020046412944794
iphone,Everything Apple products gets scammed again with a supposedly unopened iPhone 3GS,,140,726,2018-06-16,AAPL,0.018950441852211952,0.9203060269355774,0.0607435442507267
apple,"Sooo, I just had pizza delivered and this showed up on my phone... 🤔","https://imgur.com/gallery/35KADXa

Is this just a coincidence? 

My wife placed the order from her iPad. 

I didn’t text, email or speak to anybody on the phone about dinner. 

We normally eat dinner at around 6:00 throughout the week 

Any guesses on how this works? 

 Edit- this is on iOS 12",163,571,2018-06-16,AAPL,0.03794959932565689,0.9311779737472534,0.03087245114147663
AppleWatch,You can make a watch face as an app with Xcode and SpriteKit,,64,547,2018-06-16,AAPL,0.02914535067975521,0.9323955774307251,0.038459133356809616
AppleWatch,My best clearance find yet - Saddle Brown Leather for $44.98! Thanks Target!,,45,435,2018-06-16,AAPL,0.01826610416173935,0.81397545337677,0.16775839030742645
apple,An open source app to replicate macOS Mojave's dynamic wallpaper feature using sunrise-sunset times(Beta),,64,295,2018-06-16,AAPL,0.027137722820043564,0.9332994222640991,0.039562877267599106
AppleWatch,My Joey Gallo watch face...,,36,273,2018-06-16,AAPL,0.08380342274904251,0.8649818897247314,0.05121468007564545
iphone,This iPhone 150mb limit is fucking stupid,"We seriously need to look at this feature and get the attention of Apple on this. I don’t think I’ve seen a more useless feature ever. It’s a senseless limitation for the sake of it. Maybe this was useful for like 2000-2004 when 3G was all we could get and all data plans had like a 1G limit. This is 2018 where mobile carriers are nearly putting out more MBS then our land line cable companies. Seriously, I got 4 different explanations about how it’s there to keep me from going over my limit... Well that’s obsolete because unlimited data plans. The other explanation I got was because it was faster... that’s not right because I get 100mbs on cellular and only 25mbs on my own in home WiFi. Third was, It’s so that it doesn’t interrupt the downloads.. wrong again you can manually do that ALL you want by simply pausing the download or activating airplane mode. The fourth one was because someone said the network towers couldn’t handle it and wrong again because android phones do this with ZERO problems. This seems like a ploy by Apple to push internet sales. Further more is just flat out stupid and has arguably ZERO use. Somebody needs to say something to Apple. I have, I know you guys aren’t a personal army, not begging anyone to be one. Just saying this is extremely stupid. 

Edit: here is the Apple feed back Incase you guys want to submit without having to dig for it.

[Apple feedback](https://www.apple.com/feedback/iphone.html) 

Edit: Just to be clear on my stance on this, this NEEDS to be a feature we can pick and chose with. Majority of the users this effects which should be the vast majority of those of us who live in places where we can get unlimited data. This isn’t up for Apple to decide for us. This should be for us to decide if we want this on or not. There needs to be an off switch for this.",201,259,2018-06-16,AAPL,0.06869219988584518,0.9050964713096619,0.026211339980363846
apple,Apple should reward people who contribute to Apple maps,"I know it’s not very Apple ways to do something like crowded sourcing, but I think that’d be the only way maps can improve. Because no matter how many people they hired to add information to maps,they can’t cover everything. 

Google has the same thing called “Local guide”.  it’s program that gives point to people who contribute to Google maps and at a certain point you can have 1TB of free storage

I think Apple should do this too so their service will improve at a faster rate. They could do something like give 1TB of iCloud storage for free to people who contribute to a certain point too. 

What do you guys think ?",422,2868,2018-06-17,AAPL,0.013999179936945438,0.9104529023170471,0.07554788142442703
AppleWatch,"Hey, r/AppleWatch! Michael here.",,54,1089,2018-06-17,AAPL,0.042988020926713943,0.9221826791763306,0.0348292738199234
apple,Apple expects its budget iPhone to be the most popular 2018 model,,280,838,2018-06-17,AAPL,0.011536466889083385,0.8464280366897583,0.14203549921512604
iphone,EVERY iPhone COMMERCIAL In history | 2007-2017 | TimeLine,,31,780,2018-06-17,AAPL,0.038540590554475784,0.9239973425865173,0.03746209666132927
ios,"Why, Apple?",,41,610,2018-06-17,AAPL,0.05310986563563347,0.8601030111312866,0.08678712695837021
apple,How to shoot on iPhone. Apple provided tips on how to get the best out of your iPhone camera. Well worth checking out!,,17,408,2018-06-17,AAPL,0.020650474354624748,0.8699246644973755,0.10942479968070984
iphone,Any way to remove an iCloud account on a lost and found iPhone 6?,"This is going to sound suspicious but I promise it is perfectly innocent.

My girlfriend found an iPhone 6 at her work, it got put into lost and found, as per the hotels lost and found procedure they ran a check to see if it had been reported lost or stolen and it had not, they advertised it all over social media and contacted guests it may have belonged to and no one came forward

After 16 weeks because no one came forward and again it was never reported lost or stolen they let my girlfriend keep it.

Weirdly enough there's no contacts, texts or call logs and only a 5 second clip of a spongebob episode on it so I assume it belonged to a small child or something

I emailed the email address attached to the account but I've had no reply so now I'm just looking to sell it but obviously I can't remove the iCloud account with a password. Is there a away around this?",114,251,2018-06-17,AAPL,0.22996681928634644,0.7486165761947632,0.021416623145341873
apple,TIL : In iOS 12 you can search any opened website tab by just type keyword related to URL.,Today I come across when i was using safari where more than 100 tabs opened then I pull it down completely and find there is search option at the top where I had typed keyword to find specific website.,42,249,2018-06-17,AAPL,0.022235054522752762,0.9314965605735779,0.04626838490366936
apple,Should Apple enforce a designated format for pop-ups?,"I am so sick of iOS apps with pop-up ads designed to make it difficult to not accidentally click the ad when pressing the X  button to close. This is due to it being extremely tiny with a small touch area and it being in a difficult to reach area.

Should Apple create a designated format for these ads to reduce frustration, but not have them go away entirely?",42,246,2018-06-17,AAPL,0.12413757294416428,0.853844165802002,0.02201826125383377
apple,"Is the macOS UI still considered ""Aqua?""","While there are still some original Aqua elements as of High Sierra, it seems the interface has changed enough that it isn't really Aqua anymore. But I'm curious if Apple has ever retired the name?",58,195,2018-06-17,AAPL,0.02667088247835636,0.93563312292099,0.037695955485105515
apple,iPhones on iOS 12 Will Automatically Share Precise Location Data During 911 Calls in United States,,457,14164,2018-06-18,AAPL,0.029398320242762566,0.9436197876930237,0.02698187343776226
iphone,Here’s how to zoom in forever if you ever want to.,,101,1624,2018-06-18,AAPL,0.04510575532913208,0.8958215117454529,0.059072691947221756
iphone,"The iPhone X was released more than 8 months ago. Since that time, Inbox by Google has had 14 updates. Yet for some reason, it *still* doesn't support the IPX's edge to edge display.","The excuse from Google was that the UI does crazy ""one off"" stuff, so it's taken longer than other apps. But it's still frustrating when almost all of their other apps have been updated.

[http://www.idownloadblog.com/2018/04/26/google-inbox-iphone-x-support-explanation/](http://www.idownloadblog.com/2018/04/26/google-inbox-iphone-x-support-explanation/)",142,1482,2018-06-18,AAPL,0.0846780315041542,0.8740890622138977,0.041232891380786896
AppleWatch,"Just got a Series 3. On the left is the battery of a 4 hour workout on my S0, on the right is the battery of my S3 after the same workout. This is amazing!",,68,721,2018-06-18,AAPL,0.019266748800873756,0.9127176403999329,0.06801566481590271
