subreddit,title,selftext,num_comments,score,created_utc,stock/sector,neg,neu,pos
apple,Reason for the black curtains reveal: It’s because they’re bringing back the old-school 3D front windows at some stores.,,93,1178,2019-09-09,AAPL,0.03175048157572746,0.9198112487792969,0.048438217490911484
iphone,2019 iPhones to Include New 'R1' Sensor Coprocessor Codenamed 'Rose',,125,1087,2019-09-09,AAPL,0.016113750636577606,0.8966909050941467,0.08719537407159805
apple,"Apple says Face ID is coming to more devices, but Touch ID continues",,157,950,2019-09-09,AAPL,0.0402059443295002,0.9368484020233154,0.022945662960410118
apple,"Craig Federighi says scheduled iMessage feature is 'something we continue to consider,' lyrics visualizer slated for iOS 13.1 in Music app",,105,938,2019-09-09,AAPL,0.02549896202981472,0.9303619861602783,0.044139012694358826
apple,"Kuo on iPhone 11: No Apple Pencil support, bilateral wireless charging potentially scrapped, more",,680,891,2019-09-09,AAPL,0.010466060601174831,0.7480812668800354,0.24145261943340302
apple,Apple adjusted App Store algorithm to reduce presence of its own apps in search results - 9to5Mac,,72,653,2019-09-09,AAPL,0.6456989049911499,0.3357929289340973,0.01850813254714012
iphone,Now you can cook on it,,1270,45767,2019-09-10,AAPL,0.05996350944042206,0.8290901184082031,0.11094639450311661
apple,"Apple announces iPhone 11 Pro: triple camera, A13 chip, more",,5696,12903,2019-09-10,AAPL,0.022204982116818428,0.3545703887939453,0.623224675655365
apple,"""Hidden"" Message in Apple's Latest Video","During the ""Apple Event in a Flash"" video.

[Here](https://imgur.com/a/FxeSzbk).",220,4000,2019-09-10,AAPL,0.054120615124702454,0.9194697737693787,0.02640962041914463
iphone,ye,,34,3366,2019-09-10,AAPL,0.03859119117259979,0.8906028866767883,0.07080589234828949
apple,Apple’s Online Store Goes Down Ahead Of Today’s iPhone Event,,372,2860,2019-09-10,AAPL,0.01462655607610941,0.8724051117897034,0.11296825855970383
iphone,My face when they announce the new iPhones,,52,2527,2019-09-10,AAPL,0.01121855340898037,0.8651929497718811,0.12358846515417099
iphone,Who thought of this in the first place?,,60,2486,2019-09-10,AAPL,0.027170220389962196,0.9067088961601257,0.06612081825733185
iphone,UoU,,19,2427,2019-09-10,AAPL,0.044026944786310196,0.9007706642150879,0.055202364921569824
apple,iPhone 11 Pro and iPhone 11 Pro Max Include Faster 18W Charger in Box,,1071,2208,2019-09-10,AAPL,0.021419517695903778,0.9273170232772827,0.05126351863145828
iphone,The 2019 iPhone lineup,,968,2202,2019-09-10,AAPL,0.022828534245491028,0.9126949906349182,0.06447646766901016
AppleWatch,Just ordered my shiny new series 5. So psyched! :),,357,9735,2019-09-11,AAPL,0.013011904433369637,0.7049699425697327,0.28201818466186523
apple,"My friends and I recreated every default Apple wallpaper (MacOS Mojave, High Sierra, Yosemite, etc.) during a one week road trip through California","A month ago me and two other friends went on a week road trip to visit each spot from Apple's ""California location"" themed wallpapers. Remember how Mac operating systems changed from big cats to nature photos? We visited all the locations of where the nature themed wallpapers were taken, and tried to recreate the iconic photos for ourselves (MacOS Mojave, High Sierra, Sierra, El Capitan, Yosemite, and Mavericks). 

[Here](https://imgur.com/a/aceKqmG) is an image of 3 of the wallpapers, side by side with Apple's version.

If you want to see the rest of the photos or how the entire journey went, there is a link to a video we made [here](https://youtu.be/5yZuaAQKnkY). You can also check out the route we took, or download our wallpapers for yourself in the video's description. 

Our trip started in Death Valley, where we hiked sand dunes in 120+ degree heat to try and capture the [MacOS Mojave](https://512pixels.net/downloads/macos-wallpapers/10-14-Day.jpg) photo at sunset. Oh boy, was this rough! We ended up having to hike the sand dunes 3 times, since we couldn't find the right place to take the photo before the sun went down. I didn't know until months after the trip that we were in the hottest place on Earth! The only perk of going in the summer is all the sand dunes were beautifully untouched (you can see for yourself in the video).

Our next stop was Alabama Hills, a short drive from Death Valley. We arrived at 2AM, and got 3 hours of sleep before having to wake up before sunrise to take a photo of the mountain range in [MacOS Sierra](https://media.idownloadblog.com/wp-content/uploads/2016/06/macOS-Sierra-Wallpaper-Macbook-Wallpaper.jpg). We ended up getting really lucky finding the exact spot where the Apple wallpaper was taken. If you look, there is a rock formation in the foreground of the image that we just happened to see while we were racing against time to set up before the morning light was cast across the mountains. 

The same day we drove to the High Sierras for [this wallpaper](https://512pixels.net/downloads/macos-wallpapers/10-13.jpg). This was the easiest photo to get and is also my favorite of the trip. A quick Google search gave us the location, and all we had to do was hop out of the car and take the photo. I think our photo is beautiful in its own way, since it contrasts Apple's fall colors with lush greens. Also jumping in a cold lake was a great change from scorching hot sand dunes.

Next stop was in Yosemite National Park for [MacOS El Capitan](http://512pixels.net/downloads/macos-wallpapers/10-11.jpg). This photo was taken from Tunnel View, a popular spot for people to see the valley. We definitely came during the wrong season for this photo. If you take a look at our version, it's missing the clouds and snow in the background. Also, the light from the sun setting is much better in the winter.

Finding the photo of Half Dome for [MacOS Yosemite](http://512pixels.net/downloads/macos-wallpapers/10-10.jpg) was difficult. We read online that the photo could have possibly been taken in a field, but when we visited it we were nowhere close. It ended up taking us two days of hiking through unmarked trails to find the spot where the photo was taken!

In the end it was an incredible journey where we saw things we would never have seen had it not been for Apple. While our photos weren't a perfect match, that wasn't what the trip was about. The trip was about the chase -- kind of like a big scavenger hunt! It was about going outside and seeing these places for ourselves, instead of cooped up in an office looking at a screen. Because as amazing as Apple's wallpapers are, snapped at the right time under the perfect conditions, they still will never compare to seeing them in person.

Next stop, MacOS Catalina!",115,5692,2019-09-11,AAPL,0.06535758823156357,0.9091732501983643,0.025469107553362846
mac,My friends and I recreated every default Apple wallpaper,,105,4904,2019-09-11,AAPL,0.03657631203532219,0.9296048283576965,0.03381885215640068
iphone,iPhone 11 Pro Camera Module doesn't stick out as much as you'd think it would from the renders. Looks significantly more flush than straight on Renders/Photos,,425,4692,2019-09-11,AAPL,0.017178114503622055,0.70814448595047,0.2746773958206177
iphone,What about a Terminator Cover?,,102,4465,2019-09-11,AAPL,0.10923760384321213,0.8695429563522339,0.021219473332166672
mac,Apple's Mysterious Ways,,137,3375,2019-09-11,AAPL,0.13470032811164856,0.7975286245346069,0.06777101755142212
apple,Apple Drops $149 Price Tag of Milanese and Leather Loop Apple Watch Bands to $99,,478,2589,2019-09-11,AAPL,0.21929916739463806,0.7226420044898987,0.058058883994817734
apple,I don’t think I’ve seen anybody as mad about things they weren’t going to buy anyways as Android/Windows Fans are about Apple Products,"Under any YouTube video or discussion about anything from yesterday’s presentation you’ll find hundreds of comments from people saying that “oh androids been doing this for years” and “aha another flop for Apple that’s what I stay with my LG G6!” But... why do they even care so much if they weren’t planning on getting the device anyways?

I mean I’m as disappointed about the news yesterday as anybody else (I was hoping for a bit more) but why for any Apple product there’s android fans VEHEMENTLY attacking the product and acting like anybody who uses them are sheeple? I don’t think I’ve ever seen Apple fans attack a new android release, like ever as much as android fans do.

Edit: I’m not gonna contribute to this post anymore but just wanted to make an edit for the people who are complaining about the title. 
¯\\_(ツ)_/¯",458,1213,2019-09-11,AAPL,0.13353563845157623,0.8452084064483643,0.021255994215607643
apple,Yesterday's Keynote has the Announcement Timestamps marked in the video scrub bar,,71,1184,2019-09-11,AAPL,0.026348892599344254,0.9145918488502502,0.05905923247337341
ios,farewell old friend,,135,1135,2019-09-11,AAPL,0.06999863684177399,0.8383934497833252,0.09160790592432022
apple,iPhone11 = 4GB RAM + 3110mAh; iPhone11Pro = 6GB RAM + 3190mAh; iPhone11ProMax = 6GB RAM + 3500mAh,,1283,5205,2019-09-12,AAPL,0.03638827055692673,0.8810681700706482,0.08254358172416687
apple,"Apple iPhone 11, iPhone 11 Pro and iPhone 11 Pro Max in 24 seconds",,253,2706,2019-09-12,AAPL,0.03205826133489609,0.92850261926651,0.039439085870981216
iphone,iPhone XS Max purchased from Apple Store turned out to be a China Phone,"Yesterday at the Apple Store I purchased what I thought would be a brand new iPhone XS Max. The store was quite busy and the whole process took almost half an hour from speaking to someone to them having the phone in my hand. I was already running late thus decided not to open the box in a crowded store as I would rather unbox it in the peace and comfort of my own home.
 
I live about 15 minutes away and once I was home, I slid open the plastic seal, lift the box and immediately had a moment of shock. I've purchased many iPhones before so am quite familiar with Apple's packaging and what not. There was a phone in the box that resembled the size and shape of an actual XS Max and had a decent weight to it. However, I immediately noticed something was wrong:

-	No screen protector on the device
-	A couple finger prints on the screen
-	Scuff mark on the top left of the screen

I picked up the device and when I turned it on, there was a loud beep and it dropped me right off on the home screen - no regular startup and setup process at all. I realized right away this is a bigger issue than just a phone that hasn't been packaged properly and could tell by the resolution and software that this isn't even an Apple device. Now it looked pretty legit but anyone who's even minimally used an iPhone before would be able to realize within minutes based on the software alone.
 
It was 8:40PM at this point but I wasn't about to leave this until tomorrow. I rushed back to the store in a panic and found the sales person that cashed me out. I quickly explained to him what happened to which he connected with a manager - he seemed very concerned but the manager had quite a bit of an attitude when the situation was being explained to her and advised that they won't be able to do anything about it right now. She stated that they have to investigate and check their cameras, etc. At this point they already scanned the serial number and could identify that this device has had a total of 3 transactions including mine. It was obvious to me that someone purchased this before, replaced the device with the fake and returned it - to which Apple then resold to me.
 
At the end, they took the information down and went in the back to ""investigate"" and about 15 minutes later came out to me with a new device. They stated the manager found out this has happened to a couple other stores nearby as well.
 
It was truly an hour of panic as I thought I was down ~$1,600.
 
If you're the specialist that cashed me out and are reading this, thank you for your help with everything! You were a great support.
 
TLDR: I purchased a brand new iPhone XS Max from the Apple Store - when opened at home it turned out to contain a fake ""China iPhone"" inside. Was able to take it back to the store and have Apple replace it.

Edit: this happened in Toronto, Canada.

Edit 2: received a bigger response than I thought! To answer some questions: 

1.	the price for the current iPhone's drop as soon as the new line of iPhones are announced, hence why I bought the XS Max.

2.	the phone I received was shrink wrapped from the Apple store. however, this shrink wrap which is on any iPhone you'd buy right now on the Apple store is more of a wrap that you peel off and if unwrapped carefully, you'd be able to place it back together. Though Apple didn't directly share the results of the investigation with me, it's obvious that the phone was purchased by someone before (the serial number of the device had 3 separate receipt transactions) and then returned. When they must have taken it back, they could've either returned it to someone they know that works there who'd process the return quickly for them and be in on the scam, or the scammer knew that they wouldn't open up what appears to be a sealed phone. The Apple specialist mentioned that before they used to open up any device that came in whether it was sealed or not but they stopped doing that recently.",224,1977,2019-09-12,AAPL,0.11534067243337631,0.8539273142814636,0.03073200024664402
iphone,iPhone 11 Pros have 6GB RAM. Up from 4GB.,,302,1830,2019-09-12,AAPL,0.034221895039081573,0.9083796143531799,0.0573984757065773
apple,Walgreens joins Apple Card’s rewards program to offer 3% Daily Cash on purchases,,244,1561,2019-09-12,AAPL,0.013600335456430912,0.8510167002677917,0.13538290560245514
apple,Early images of iPhone 11 Night Mode,,344,1457,2019-09-12,AAPL,0.05081592872738838,0.9243637919425964,0.024820247665047646
ipad,My iPad Pro 12.9 with a retro skin!,,81,1143,2019-09-12,AAPL,0.01393667608499527,0.8819022178649902,0.10416117310523987
AppleWatch,Meridian face is beautiful!,,143,1027,2019-09-12,AAPL,0.052460651844739914,0.8357594013214111,0.11177995055913925
AppleWatch,8 years ago I created my own apple watch from an old Casio watchband and a nano. Almost got the name right.,,35,1008,2019-09-12,AAPL,0.01609574444591999,0.9050964713096619,0.0788077637553215
iphone,iPhone 11 Pro will feature a black box (Taken from AppStore App in iPhone Upgrade Program section),,103,897,2019-09-12,AAPL,0.037672072649002075,0.9346168637275696,0.027711041271686554
iphone,Sleep tight!,,339,3895,2019-09-13,AAPL,0.05026092007756233,0.9042351245880127,0.04550396278500557
apple,Disney CEO Bob Iger resigns from Apple board,,236,3614,2019-09-13,AAPL,0.030756870284676552,0.9293733835220337,0.03986967355012894
apple,"iPhone 11 and 11 Pro include the hardware for bilateral charging, but it is software disabled",,448,2973,2019-09-13,AAPL,0.011634964495897293,0.9196565747261047,0.06870842725038528
mac,Stumbled across a Gold mine,,116,2379,2019-09-13,AAPL,0.15558305382728577,0.7282734513282776,0.11614350974559784
iphone,iPhone 11 Pro spotted in the wild,,219,1722,2019-09-13,AAPL,0.015188079327344894,0.815548300743103,0.16926363110542297
apple,iPhone 11 Pro — Triple-camera system — Apple,,247,1662,2019-09-13,AAPL,0.027011161670088768,0.9337225556373596,0.039266373962163925
apple,How is this battery comparison useful to anyone?,"On the individual tech specs Apple lists absolute times like 16 hours of web browsing.  But on the iPhone comparison screen you’ve got to use some deductive reasoning to figure out the battery life of the phones you’re comparing

who thought this was a good idea?

&amp;#x200B;

[https://imgur.com/a/M9S963J](https://imgur.com/a/M9S963J)",183,1435,2019-09-13,AAPL,0.01550549641251564,0.9006258845329285,0.08386857807636261
AppleWatch,"As requested, Black on Black Meridian",,133,1128,2019-09-13,AAPL,0.0862603560090065,0.8842598795890808,0.029479768127202988
mac,Found a Molar Mac in my friend's basement,,22,1035,2019-09-13,AAPL,0.03344416618347168,0.913007915019989,0.053547974675893784
ipad,back to school haul!,,247,948,2019-09-13,AAPL,0.08036623150110245,0.816863477230072,0.10277024656534195
iphone,What is your favorite iPhone model to date?,,1710,5879,2019-09-14,AAPL,0.017896072939038277,0.9024297595024109,0.0796741247177124
apple,"TIL Apple made an exclusive auction version of the iPad Pro in 2016 with an orange Apple Pencil Case, more than a year before the Apple Pencil Case was actually released.",,46,2518,2019-09-14,AAPL,0.018237775191664696,0.9247906804084778,0.056971509009599686
iphone,"If iPhone 11’s are able to take 4K60 at extended dynamic range, should it mean that they should be capable of taking 4K120 at normal dynamic range?",,132,1441,2019-09-14,AAPL,0.01987426169216633,0.929544985294342,0.050580818206071854
apple,"The new iPhones don’t launch till next week, but Speck’s product page for its iPhone 11 Pro Max case already has 49 (likely fake) 5 star reviews",,121,1268,2019-09-14,AAPL,0.019639993086457253,0.20721596479415894,0.773144006729126
apple,[Self Promotion Saturday] We made an app that gives your iPhone camera Night Mode that works on all models starting with iPhone 6,,290,915,2019-09-14,AAPL,0.01271206047385931,0.9200106859207153,0.0672772154211998
mac,iMac 5k suddenly flashes this and the folder icon,,148,777,2019-09-14,AAPL,0.03775879368185997,0.8956909775733948,0.06655026227235794
apple,To Those Upgrading To A Qi Capable Phone For The First Time - Read New Research (Long),,372,668,2019-09-14,AAPL,0.008807728998363018,0.7397623658180237,0.2514299154281616
AppleWatch,"Loving my new band! Got it for only £20 pretty much new from eBay, a genuine one too",,60,585,2019-09-14,AAPL,0.02180192433297634,0.8426567912101746,0.13554129004478455
ios,Happiness lies in the eyes of beholder.,,25,557,2019-09-14,AAPL,0.02919403277337551,0.8622502684593201,0.10855567455291748
apple,"New Apple Stores open in Louisville and The Woodlands: green walls, mirrored facade, more",,45,508,2019-09-14,AAPL,0.03543788567185402,0.7721394300460815,0.19242262840270996
apple,‘Sign In With Apple’ Is Way Better Than Passwords—If You Can Find It,,411,3295,2019-09-15,AAPL,0.017623504623770714,0.8535420894622803,0.12883442640304565
apple,"Kuo: iPhone 11 demand better than expectations, stronger interest for new color options",,535,2771,2019-09-15,AAPL,0.01577971689403057,0.18942572176456451,0.7947945594787598
apple,The U1 chip in the iPhone 11 is the beginning of an Ultra Wideband revolution,,291,1899,2019-09-15,AAPL,0.015387891791760921,0.8869831562042236,0.09762886166572571
AppleWatch,Anyone else tap/wake their AW with the tip of their nose?,Just curious,219,1783,2019-09-15,AAPL,0.03712261840701103,0.9175638556480408,0.045313574373722076
mac,Tokyo vibes,,58,1460,2019-09-15,AAPL,0.024813920259475708,0.9104588031768799,0.06472726166248322
iphone,What's the name/brand of this device used in the iPhone Ad?,,135,1372,2019-09-15,AAPL,0.02662649005651474,0.9440439343452454,0.029329562559723854
AppleWatch,Every Nike watch face and style in watchOS 6,,154,1347,2019-09-15,AAPL,0.020131364464759827,0.9469280242919922,0.03294059634208679
iphone,Here’s the box art for the iPhone 11 Pro Max.,,171,1067,2019-09-15,AAPL,0.0183208379894495,0.9365069270133972,0.045172207057476044
apple,Always worth checking out: Apple - Every Second,,83,664,2019-09-15,AAPL,0.049465641379356384,0.8415007591247559,0.10903356224298477
apple,Apple News launched 4 years ago and still only supports 4 countries,"From [Wikipedia](https://en.wikipedia.org/wiki/Apple_News):  


&gt;The app was announced at Apple's WWDC 2015 developer conference. It was released alongside the iOS 9 release on September 16, 2015, for the iPhone, iPod Touch and iPad. At launch, the app was only available to users in the United States, but within a month had become available to users in Australia and the United Kingdom.

Canada was added in 2019 I believe. 

Is News just something Apple isn't interested in that much? I can't be critical of Apple's 'Services' in general because [most of them are in many more countries](https://www.apple.com/ios/feature-availability/), but News seems just ignored. And I know people will say it's difficult to 'make deals' with regional news organizations and that's the reason, but especially for the non-paid version of Apple News, I find it hard to believe these deals are so challenging that after 4 years, Apple has only managed to negotiate with news providers in 4 countries. It's not as if regional licensing and related issues do not exist for music, movies, etc., and Apple seems capable for providing content for their international users for these mediums.  

Maybe there just isn't much demand for it, but it's something I've wanted to try (in a functional local way, not with the workarounds that let you view US news outside of the US or whatever.) It's just surprising that it's STILL in only 4 countries. Not in continental Europe or Japan or anywhere else.",154,592,2019-09-15,AAPL,0.020310545340180397,0.9211359024047852,0.05855351313948631
apple,Apple please make Deep Sea Blue happen.,,450,7432,2019-09-16,AAPL,0.020295294001698494,0.8660333156585693,0.11367136985063553
iphone,Laser engraving on an iPhone,,124,5397,2019-09-16,AAPL,0.019496044144034386,0.9462161064147949,0.034287843853235245
mac,My first day of university,,180,3578,2019-09-16,AAPL,0.0954761877655983,0.8768195509910583,0.027704253792762756
iphone,Old times sake,,175,3145,2019-09-16,AAPL,0.06204509362578392,0.8752641677856445,0.06269069015979767
apple,"Multiple camera simultaneous recording coming to iPhone XS and iPhone XR, not just iPhone 11",,356,3079,2019-09-16,AAPL,0.01571938395500183,0.9247094392776489,0.059571195393800735
ipad,I didn’t expect to find one of these outside of Reddit...,,41,2317,2019-09-16,AAPL,0.19584894180297852,0.7736621499061584,0.0304888803511858
AppleWatch,Did anyone else know that pressing the battery percentage on the Apple Watch while using your AirPods shows the battery of both?,,105,1977,2019-09-16,AAPL,0.030490359291434288,0.9395608901977539,0.02994878590106964
mac,Loving this setup.,,59,950,2019-09-16,AAPL,0.033689580857753754,0.8593237996101379,0.10698659718036652
AppleWatch,"watchOS 6, here we come",,87,873,2019-09-16,AAPL,0.02960103750228882,0.932057797908783,0.03834119811654091
iphone,The new iPhone software update is already catching apps like Facebook being shady.,[deleted],101,720,2019-09-16,AAPL,0.053224630653858185,0.38026291131973267,0.5665124654769897
apple,"Ready to have your mind blown? This is Night Mode on the iPhone 11 Pro, and it is WILD. Works the same way on the base 11, too. Be sure to watch until the end to see just how dark this room is (so dark that my iPhone XS Max can’t even focus...). - Zach Hoing",,411,3171,2019-09-17,AAPL,0.04929553344845772,0.9105919599533081,0.04011255502700806
apple,iPhone 11 Pro review: the BEST camera on a phone,,879,2836,2019-09-17,AAPL,0.02604880928993225,0.516971230506897,0.45697999000549316
iphone,Two real world Night Mode examples,,240,1933,2019-09-17,AAPL,0.0347740612924099,0.9368695616722107,0.028356391936540604
AppleWatch,Am I the only one who sets their watch to silent mode from the moment it’s set up and never turns it off?,"For some reason, I never liked the watch to make notification sounds if I already had my phone on me. I wonder if that’s just me.",238,1741,2019-09-17,AAPL,0.04893474280834198,0.8943869471549988,0.056678351014852524
iphone,Testing out Apple Arcade. I love What The Golf!,,183,1622,2019-09-17,AAPL,0.02827303484082222,0.908403754234314,0.0633232370018959
mac,"MacBook Pro 13 mid 2014. It turns 5 years but still works like the very first day. The battery still last 8 hours, awesome screen, fast performance for daily tasks and Photoshop still manage to work with 8 RAW files to marge into a panorama. What a beast. Definitely a long term buy.",,142,1176,2019-09-17,AAPL,0.015906132757663727,0.8714030981063843,0.11269080638885498
apple,TheVerge: iPhone 11 Pro is the best camera on a phone and the battery life is real!,,236,1057,2019-09-17,AAPL,0.012656242586672306,0.6236132979393005,0.36373043060302734
apple,Apple watch series 4 is $299 in the refurbished store,[deleted],141,806,2019-09-17,AAPL,0.014184384606778622,0.8998916149139404,0.08592399954795837
ipad,My light carry for class today. It was nice not carrying a backpack in 93F/33C degree weather.,,105,763,2019-09-17,AAPL,0.019412720575928688,0.9003960490226746,0.08019126951694489
AppleWatch,"Position on WatchOS6 - I just installed watchOS6 GM and noticed that there's a small green blinking dot indicating my position on the ""earth"" complication. Useless but funny ! (FYI : Screen protection from AliExpress, reflective af on photos but so so useful and invisible irl !)",,145,652,2019-09-17,AAPL,0.025117484852671623,0.9375218749046326,0.03736069053411484
iphone,Anyone else get annoyed by the fact that these buttons switch when you go into landscape mode?,,229,4453,2019-09-18,AAPL,0.0749429315328598,0.9017073512077332,0.023349663242697716
apple,"7 out of 10 Apple Watch customers are first time buyers, not upgraders",,437,3732,2019-09-18,AAPL,0.0152405621483922,0.31488722562789917,0.6698722839355469
apple,"iJustine just posted a video comparing the iPhone 11 Pro Max’s night mode vs the Pixel 3a’s night shot, the iPhone is looking really good.",,905,3013,2019-09-18,AAPL,0.009503555484116077,0.16571937501430511,0.8247770667076111
iphone,Twitter now supports iOS 13 Dark Mode,,148,1577,2019-09-18,AAPL,0.012704694643616676,0.9273889064788818,0.05990640074014664
apple,[iPhonedo] iPhone 11 Audio Zoom Annihilates Note 10+ Zoom-In Mic,,202,1537,2019-09-18,AAPL,0.018261373043060303,0.9141845703125,0.06755401939153671
mac,Fighting with my Mac today - the only appropriate retort is a meme/piechart,,72,1167,2019-09-18,AAPL,0.04556989297270775,0.9009181261062622,0.05351199954748154
