subreddit,title,selftext,num_comments,score,created_utc,stock/sector,neg,neu,pos
apple,Apple cofounder Steve Wozniak says the Apple Watch is his 'favorite piece of technology in the world' because he doesn't want to be addicted to his phone.,,475,5563,2019-09-01,AAPL,0.023368850350379944,0.9155258536338806,0.061105262488126755
ipad,Obama’s setup (photo from Pete Souza’s Instagram),,108,1270,2019-09-01,AAPL,0.02478303201496601,0.9322149753570557,0.04300197586417198
AppleWatch,Apple cofounder says the Apple Watch is his 'favorite piece of technology in the world' because he doesn't want to be addicted to his phone,,102,989,2019-09-01,AAPL,0.047158077359199524,0.9083583950996399,0.044483572244644165
mac,Upgrading this old 2009 iMac that I picked up for only 30 euros with an SSD! I hope this works. It was do terribly sloww,,103,722,2019-09-01,AAPL,0.10068350285291672,0.7979835271835327,0.10133294761180878
mac,Gonna miss her backlit logo :(,,101,674,2019-09-01,AAPL,0.11896374821662903,0.8044458031654358,0.07659044861793518
apple,Apple products under pricing pressure as new 15% tariffs drop Sunday,,93,341,2019-09-01,AAPL,0.9526984691619873,0.03297636657953262,0.014325243420898914
ios,I’m baffled of how bad the Apple Maps satellite algorithms are... this is a VERY touristic city in Latin America (VALPARAISO) and the satellite view is all covered by clouds. SMH,,64,335,2019-09-01,AAPL,0.02746545895934105,0.9254051446914673,0.04712942987680435
AppleWatch,"Hey, Apple – The Activity App Needs Rest Days Like Right Now",,67,313,2019-09-01,AAPL,0.05956446751952171,0.8945629000663757,0.04587257653474808
apple,Sources say China used iPhone hacks to target Uyghur Muslims,,39,306,2019-09-01,AAPL,0.05159235745668411,0.9237295389175415,0.024678055197000504
apple,"Apple advances a Mixed Reality Headset with Hand, Body, Positional and Environmental Tracking Technologies",,41,297,2019-09-01,AAPL,0.020766111090779305,0.938546359539032,0.040687598288059235
apple,"Apple Watch sleep tracking revealed: sleep quality, battery management, more",,372,2668,2019-09-02,AAPL,0.020785151049494743,0.9245301485061646,0.054684679955244064
mac,Times Square - Your computer was restarted because of problem,,107,2150,2019-09-02,AAPL,0.4317927062511444,0.4963250458240509,0.07188218832015991
iphone,"Fun fact: If you load a website using Chrome and request the desktop site, the site will believe you’re using macOS.",,129,2116,2019-09-02,AAPL,0.025641286745667458,0.9406348466873169,0.03372388705611229
AppleWatch,I’m guessing my girls woke up before I did...,,42,1221,2019-09-02,AAPL,0.11033269762992859,0.8294970393180847,0.06017029285430908
apple,Screen burn in on my iPhone X and I know why,"I have the iPhone X since launch. Today I find out that I have a screen burn, a tiny circle, on the lower right corner.  


According to the screen time app, I use my phone for 2 hours max per day. The brightness setting is set to ""auto"". I barely use my phone with the brightness at 100%. But... the tiny circle came from Waze, and I use it almost everyday. 

So, even if you use an app that have statics elements like a navigation app, for 15-30 min per day, you have a chance to have screen burns issues.",425,1035,2019-09-02,AAPL,0.027555735781788826,0.9217175841331482,0.050726696848869324
mac,What is this? Spotted in my university's art department,,61,602,2019-09-02,AAPL,0.0353177972137928,0.9095045924186707,0.05517769604921341
AppleWatch,"Charging my Watch, iPhone, AirPods like Steve Jobs would have wanted.. ☺️",,182,576,2019-09-02,AAPL,0.04768141731619835,0.9003849029541016,0.05193367227911949
iphone,"Just Switched from Android, Any tips?","Finally went to get a new phone yesterday. I had been thinking about it for the whole summer (which I spent with my 3 year old LG). Nothing to complain about with Android but when the time came I decided to go with the Xs Max. Any tips for a guy who knows nothing about iOS?

Edit:anybody commenting about the new phone coming out isn't wrong... Just be aware that I knew that going in and I'm content with what I got, thanks for the concern though（＾◇＾）",382,573,2019-09-02,AAPL,0.021246539428830147,0.8889885544776917,0.08976496011018753
apple,"iOS 13 Code Suggests Apple Testing AR Headset With 'StarBoard' Mode, 'Garta' Codename, and More.",,55,495,2019-09-02,AAPL,0.028822926804423332,0.9374665021896362,0.03371059522032738
apple,Japan Display OLED iPhone screens could still be two plus years away,,61,394,2019-09-02,AAPL,0.3083142042160034,0.6602319478988647,0.031453829258680344
apple,Upcoming Firefox update will decrease power usage on macOS by up to three times,[deleted],349,3915,2019-09-03,AAPL,0.17861945927143097,0.7261009812355042,0.09527956694364548
apple,New Yorkers Losing So Many AirPods in Subway Tracks That MTA is Considering a PSA to Warn Commuters,,253,1196,2019-09-03,AAPL,0.03555703163146973,0.8939582109451294,0.07048474997282028
iphone,Apple announces out-of-warranty iPhone repair programme,,72,1174,2019-09-03,AAPL,0.19484499096870422,0.7719016075134277,0.03325344994664192
apple,"Apollo for Reddit 1.5 is now available for download! Featuring brand new messaging system ✉️, Auto Hide option 👁, Auto Collapse option 🦆, complete suite of moderator features 🚓, a brand new icon option 🖼, and so much more! Also 24 hour sale on Apollo Ultra! 🎉🎺🎊",,185,1155,2019-09-03,AAPL,0.01082843542098999,0.9124994277954102,0.07667219638824463
AppleWatch,“I AM GROOT”,,63,1014,2019-09-03,AAPL,0.10217993706464767,0.8505517840385437,0.04726824536919594
iphone,Do you leave your apps on open or do you close them?,"I have a habit of closing my apps all the time, I’ve heard countless times not to do that because your basically gonna kill your battery even faster. So I ask you do you leave your open (if you do how’s your battery like) or your just like me closing apps once your done using it.",358,975,2019-09-03,AAPL,0.025876691564917564,0.9276886582374573,0.04643463343381882
mac,"Today was a good day, finally got my MacBook Pro. Proud to bought all these things (+iPhone XS that took the picture) as an 18 year old kid without any financial help from my parents. Still going to school, but am working Saturdays to buy these things. Next comes the birthday for my mother :)",[deleted],149,946,2019-09-03,AAPL,0.09194457530975342,0.8712847232818604,0.036770716309547424
apple,USB4 Specification Merges Thunderbolt 3 and USB With Transfer Speeds up to 40Gb/s,,154,827,2019-09-03,AAPL,0.02099466323852539,0.9259645342826843,0.053040847182273865
mac,At my school's display case.,,16,700,2019-09-03,AAPL,0.038312725722789764,0.9327602982521057,0.028926970437169075
AppleWatch,Ready for chapter 2.,,47,680,2019-09-03,AAPL,0.053819138556718826,0.8989283442497253,0.04725249856710434
apple,Report says Apple to release new 'iPhone SE' with 4.7-inch display in spring 2020 - 9to5Mac,,551,3403,2019-09-04,AAPL,0.024207159876823425,0.9156172871589661,0.06017552688717842
apple,I bought a Macbook with a destroyed Retina display for a very low price and used it to make the first ever iPad Pro/Macbook hybrid! [Video in description],"It’s done! Following up on a recent post that I made on this sub, my iPad/Macbook hybrid is complete. The method involved defusing the broken LCD screen and backlight from the upper portion of the MacBook’s clamshell, modifying the retina display driver, attaching a magnetic iPad case in-place of the retina display and putting everything back together. In regards to software, I’m using Catalina’s ’Sidecar’ to wirelessly (bluetooth) mirror the once-existent Retina display and ‘keyboard maestro’ to establish the initial connection to the iPad upon booting up.

Not in the video below is a demonstration of 1keyboard being used to re-route the Macbook’s keyboard as an input device for the iPad when Sidecar is disabled.

I think I’ll make a video documenting the full process soon.

Any ideas for a name for the hybrid?

Here’s a link to it in action:

[https://gfycat.com/indelibleedibleguineafowl](https://gfycat.com/indelibleedibleguineafowl)",221,3051,2019-09-04,AAPL,0.028084615245461464,0.93784499168396,0.03407035022974014
iphone,Leak says Apple will release a fourth new iPhone model this coming spring,,254,1501,2019-09-04,AAPL,0.012549375183880329,0.8616193532943726,0.12583127617835999
apple,New Apple TV With A12 Chip and 'One More Thing' Teased Ahead of Next Week's Apple Event,,368,1204,2019-09-04,AAPL,0.01589386910200119,0.8449353575706482,0.13917072117328644
mac,this old lenco tv looks like an imac g3,,28,791,2019-09-04,AAPL,0.016744472086429596,0.9201792478561401,0.06307630985975266
AppleWatch,Anyone else look at other peoples watches and say damn that looks nice! Then look down and realize you have the same one?,I swear every time I see a black stainless watch it looks gorgeous! Then I realize it’s literally the same one on my wrist but it just doesn’t look as nice? I don’t understand this at all.,85,642,2019-09-04,AAPL,0.055629804730415344,0.9102427363395691,0.034127429127693176
ios,[Humour] My friends are flexing on me with iOS 13 🥺,,87,635,2019-09-04,AAPL,0.034255340695381165,0.9094963073730469,0.05624843388795853
AppleMusic,Facts,,25,478,2019-09-04,AAPL,0.04242430627346039,0.8881320357322693,0.06944367289543152
apple,Apple releasing second iOS 13.1 developer beta today,,81,466,2019-09-04,AAPL,0.0217344481498003,0.9346822500228882,0.043583255261182785
iphone,Battery Health: Stop battery capacity going down (the best [proven] way),"**TLDR: Don't use your iPhone when it's at 25% charge or less.**

**(Battery health is important since iPhone battery is by far one of the main components that cause the device to start running slow when it's capacity gets to \~80% cap or less. So, battery health is directly related to device's ""as-new"" feel and performance, hence related to longevity/obsolescence, and in the end (if you care); resale value)**

—

Thought I should share this:

So, I've read/viewed a lot of research **(main source credit goes to Battery University)**, and/so yeah, this is a scientific/quantified/statistical-based recommendation, considering the sources I've went through. So, I'm going to expand/complement on that with my personal experience, which came after following the advice I'm about to share, which resulted from my interpretation and simplification of a combination of sources.

We all know battery capacity goes down and never goes up again. We all want to know what are the best practices for battery health i.e keep its capacity as new (i.e 100% at iPhones Settings app - battery - battery health section). Losing battery cap over time inevitable, but the **average speed of that loss** ( \~1% every month in my observational experience) is ""usual"" only if you don't know the best practices for battery health.

Here comes the mix of my months of reading-concluding from many formal (and other not so much, but still relevant) sources, and then applying it to my iPhone \[don't worry, the main tip I give is based on the formal source\].

So..

**Got an iPhone X on November 2017. My battery capacity went down from 100% to %89 in 10 months** (more than 1pp per month, ahá).. which I didn't like, so I started this research. At the same time, I took advantage of Apple's battery discount program (ended December 2018) and changed my battery for a new one, so the following findings where tested just after my clean new battery was installed i.e restarted at 100% capacity.

**Punch line:** **After changing my battery and applying the following rule, I have now more than 10 months with my new battery and it's still at 100% capacity.** \[Keeping every other usage habit constant\]

Yes!..., and, I can't think of any reason for it to start going down in the short term (I mean, it has to at some point, even if very slowly), but all I'm saying is, it will do so much more (drastically) slowly than before I knew all this.

—

**Conclusions/Best practices:**

1. **The ONLY ""rule"" is to avoid using your iPhone with less than 25% battery**

Logic: using/demanding the battery with ""low juice"" is the worst you can do to it, it's where it struggles the most and takes damage for life. It's like going to the gym with 1hr sleep. You can do it, but you might get some permanent damage if this is the standard practice.

—

**Considerations** \[this following lines describe MY exact usage during this 10 months applying said rule\]**:**

1. Charge WHENEVER and AS MANY times you WANT/NEED during the day; this doesn't have bad consequences
2. Freely use fast-charge chargers including wireless ones, up to 18W (iPad's brick); this doesn't have bad consequences
3. You can leave it connected at 100% and have **noticeable** bad consequences, battery is smart, and will be even smarter with iOS 13 i.e calculating when is it that you'll wake up, to stop at 80% during night and then get to 100% just in time for when you wake up.
4. Avoid extreme hot/cold temperatures; this one's kind of irrelevant, we're talking leaving it under de sun or putting it in a freezer. This one is related to consideration #2. As higher then 18W get too hot and 18W is the best cost/benefit on speed (also, iPhones don't even pull more than 18W, so is non-needed heat).

—

Now, **of course you'll use it with less than 25% battery occasionally or in emergencies**, but 99% of my days I manage to accomplish that rule, and after 10 months, battery is still 100% capacity (and yes, I've performed several battery calibrations during this months; to avoid wrong capacity readings).

Now of course Apple (or any manufacturer) can't teach this “magic” trick, .. it would sort of mean 1/4 of your battery is un-usable; which is not good for marketing, and is also not entirely true cause it is usable. Thing is, it has consequences (which are normal and the same in any smartphone, not just Apple's).

**Also, this 25% threshold behaves proportionally, meaning using you iPhone with 1-5% is WAY WORSE than using it with 20-25%. But yes; bad consequences generally start at 25%.**

The only way to re-gain your cap is buying a new battery. But at least with your actual one, this tip will practically make it “stop” losing any more cap. Mine is literally 100%, not 99% or 98%; its clean 100% after more than 10 months.

**Hope many people find this helpful! took me a while, and it's proved cause-effect tip/practice, so I feel confident. On my old battery I definitely used it A LOT on 1-5% remaining battery charge.**",318,443,2019-09-04,AAPL,0.0642687976360321,0.8766230046749115,0.0591081827878952
apple,Apple Music launches on the web,,476,4126,2019-09-05,AAPL,0.05370078608393669,0.9134868383407593,0.032812412828207016
mac,"At the Apple Museum in Prague, Czech Republic. Made from old computer parts.",,78,2784,2019-09-05,AAPL,0.023778773844242096,0.9273962378501892,0.04882495105266571
iphone,Sold my iPhone X ($700) soon after buying an SE ($100) for beta testing. This little thing is lightning fast on iOS 13 and I love the size!,,336,2139,2019-09-05,AAPL,0.014041565358638763,0.8200307488441467,0.16592764854431152
apple,Apple Working on In-Display Fingerprint ID for Future iPhones,,421,2095,2019-09-05,AAPL,0.04112289100885391,0.9272390007972717,0.03163813427090645
mac,"At the Inn at the crossroads, Lakecity, SC",,47,1913,2019-09-05,AAPL,0.04536214843392372,0.9140028953552246,0.04063491150736809
AppleWatch,Be careful,,45,1633,2019-09-05,AAPL,0.05157698318362236,0.8587630391120911,0.0896599143743515
iphone,Apple Music launches on the web,,213,1412,2019-09-05,AAPL,0.05370078608393669,0.9134868383407593,0.032812412828207016
ipad,Charging my Galaxy phone with my iPad while I charge a friend's iPhone,,99,988,2019-09-05,AAPL,0.02005990594625473,0.9302867650985718,0.049653276801109314
ipad,TIL you can connect your iPod Classic to your iPad on iOS 13 and see the files on jt,,56,767,2019-09-05,AAPL,0.023127049207687378,0.92811119556427,0.04876171424984932
apple,Why phones that secretly listen to us are a myth,,259,617,2019-09-05,AAPL,0.02490311861038208,0.9394710063934326,0.035625919699668884
apple,Apple will be live streaming it’s September 10th event for the first time on YouTube!,,351,4202,2019-09-06,AAPL,0.02511468715965748,0.9420043230056763,0.03288095071911812
apple,"September 10, 2019: More than iPhones- Watch 5, Airpods 3, iPads, Mac pros.",,644,2506,2019-09-06,AAPL,0.015590090304613113,0.8808082342147827,0.10360164940357208
AppleWatch,Roman 4 doesn’t look like that...,,144,1306,2019-09-06,AAPL,0.048476431518793106,0.9199656248092651,0.031557951122522354
AppleWatch,Why is lawn mowing not in the workout section but fishing is?,,97,1305,2019-09-06,AAPL,0.025972988456487656,0.9329923391342163,0.04103465750813484
iphone,Tech support is available 24/7! I did not know this. I don’t have many tech support questions.,,143,1293,2019-09-06,AAPL,0.022875122725963593,0.9265264868736267,0.050598304718732834
iphone,A message about iOS security,,153,1245,2019-09-06,AAPL,0.04934348165988922,0.9172308444976807,0.03342569246888161
mac,My dream setup finally finished.,,102,1195,2019-09-06,AAPL,0.04777500778436661,0.774627149105072,0.177597776055336
apple,"'Apple Tags' to Feature Ultra-Wideband Technology, More Precise Than Tile's Trackers",,221,1029,2019-09-06,AAPL,0.022510189563035965,0.9300146102905273,0.0474751815199852
apple,A message about iOS security,,262,719,2019-09-06,AAPL,0.04934348165988922,0.9172308444976807,0.03342569246888161
ipad,Did a little IT fanart on Procreate,,31,499,2019-09-06,AAPL,0.032971497625112534,0.917421817779541,0.04960669204592705
apple,"iPhone XR shipments topped all other phones in the first half of 2019, report says",,450,2370,2019-09-07,AAPL,0.0461578369140625,0.051828593015670776,0.9020135402679443
apple,"""By naming this event “By innovation only,” Apple is really raising expectations for Tuesday, an event thus far expected to focus on iterative iPhone and Apple Watch updates. Internally, I’m told, attention has turned to more groundbreaking 2020 devices."" - Mark Gurman",,309,2140,2019-09-07,AAPL,0.040551841259002686,0.8104975819587708,0.14895060658454895
mac,"After months of planning, my grab-and-go Mac station.",,148,1847,2019-09-07,AAPL,0.029827412217855453,0.9370654225349426,0.03310718759894371
apple,Twitch launches public beta test of new app for Apple TV - 9to5Mac,,71,1005,2019-09-07,AAPL,0.025599589571356773,0.881571888923645,0.09282846748828888
iphone,Alleged iPhone 11 Pro Front Panel Leaks,,117,658,2019-09-07,AAPL,0.2742210328578949,0.6983970999717712,0.027381906285881996
ipad,I’ve joined the iPad group!,,76,470,2019-09-07,AAPL,0.020151760429143906,0.9236614108085632,0.056186873465776443
apple,"I just released an iOS app for those of us who listen to full albums. It interfaces with your Apple Music and local library to do album shuffle, pulls in release date/record label/credits, and more! There are some free codes in the comments if you want to check it out!",,90,466,2019-09-07,AAPL,0.030485814437270164,0.94428950548172,0.02522474154829979
MacOS,When your computer in Times Square restarts because of problem.,,37,404,2019-09-07,AAPL,0.12700901925563812,0.8208903670310974,0.05210057646036148
apple,Bloomberg: 2019 iPhones Will Have Centered Apple Logo on Back,,160,401,2019-09-07,AAPL,0.0129086310043931,0.9050253033638,0.08206602185964584
ios,Xr,,53,344,2019-09-07,AAPL,0.027838125824928284,0.9114642143249512,0.060697659850120544
iphone,iPhone 11 cases spotted in the wild,,303,4048,2019-09-08,AAPL,0.8072052001953125,0.13170172274112701,0.06109301373362541
apple,Can Apple's iPhone 11 Still Surprise in an Age of Leaks?,,750,2917,2019-09-08,AAPL,0.01768271066248417,0.7279549837112427,0.2543622851371765
mac,Your startup disk is almost full.,,104,2542,2019-09-08,AAPL,0.2374294549226761,0.7373923659324646,0.025178227573633194
apple,"Apple to launch 'iPhone 11' on Sept. 20, celebrate with reopening of Fifth Avenue store in NYC",,259,2160,2019-09-08,AAPL,0.025940630584955215,0.913651168346405,0.06040821224451065
iphone,"The iPhone 3G goes on sale, Fashion Valley Mall, San Diego, 2008",,140,1926,2019-09-08,AAPL,0.029964253306388855,0.905835747718811,0.06419995427131653
AppleWatch,4th day of SliceCharge Pro and so far it's been the best recharge experience,,174,1078,2019-09-08,AAPL,0.018589511513710022,0.8189579248428345,0.1624525487422943
ipad,The MacOS Catalina wallpaper + iPadOS with mouse support makes this 12.9” iPad Pro feel like the ultra-lightweight touchscreen Mac that I’ve always wanted.,,78,877,2019-09-08,AAPL,0.0180010087788105,0.9156028628349304,0.06639610230922699
apple,The Apple Watch's slow-burning success shows there is life after the iPhone,,151,734,2019-09-08,AAPL,0.02842649631202221,0.8736101388931274,0.0979633778333664
ipad,First Procreate painting :|,,29,550,2019-09-08,AAPL,0.01959729567170143,0.9067150950431824,0.0736875981092453
iphone,If you ever wondered what you've missed by sticking to iPhone and not trying Android flagships - you've missed nothing.,"This is kind of a short story.

I've been anti-Apple for as long as I remember. I thought they had overpriced, medicore hardware (both when it came to laptops and phones), packed in a nice-looking case. And so, I kept sticking to Dell/HP/Lenovo laptops and Android phones which were flagships. While Android phones I've been using were kind of fine, the laptops were just bad. I won't say what exactly I'm doing at work, but I use my laptop heavily, and unfortunately, I was stuck with Windows, as Linux was too unreliable.

And then, one day, I had to work with my colleague which was using a 2017 MacBook Pro. I barely had any previous experience with Apple hardware and macOS software, but I was mesmerized by how fluent his work was. We were doing pretty much the same thing, but his MacBook was fast, smooth and responsive, while my Windows laptop was laggy as hell. I think that I was already convinced by then, and a month later, I bought a MacBook Pro myself and it was one of the best decisions I ever made - I love it.

But I still kind of was resistant against using iPhone. My previous phone was already a bit slow (duh, thank you Android), but it happened that Samsung was about to release Galaxy S10, so I decided to wait and bought S10+. And guess what? It's just f\*\*\*ing bad.

First, the battery life. It's awful. I barely can get 3-4 hours of screen-on time, while it's set to 50% of brightness. Basically, after I unplug it, I wait around 30 minutes, and it's already down to 95-90%.

Second, the screen itself. The curved edges? I hate them. If not for my phone case, my fingers would constantly press those ""cool curved edges"", there's literally no way to hold the phone properly. The screen itself is fine, but I just can't help but think that iPhone screen is just brighter and better overall, but it may just be me.

Third, Android itself. The system itself is just ugly. Samsung's ""overlay"", OneUI or whatever they call it just made it uglier. Seriously. They only made like 10 system icons follow the same ""theme"", while the rest of the icons (especially of third-party apps, from the Google Play Store) is like a big white circle, with a minimized icon inside. I immediately had to download a custom launcher and a pack of icons because my eyes were bleeding.

And for the grande finale, let's talk about Samsung itself. They just announced that only S9 phones and S10 phones will be getting Android 10. Galaxy S8 won't receive any further updates and it was released in 2017. So what I'm looking at? A phone that receives few updates for the first 2 years and then is left out, because there are new flagships to support.

Oh, and Samsung tech support, boy, what a thrill. I had this problem, that sometimes, the screen would register random touches, like a ghost-press. I went with this issue to an authorized Samsung tech support in my local city and you know what? They said it's my fault because I pressed on the screen too hard (to remind you, Samsung doesn't have 3D Touch, no point in pressing the screen hard) and they made my warranty void.

I'm so done. When the iPhone 11 is released, I'm getting it. I just hope I'll be able to sell this piece of ""glorious"" hardware that S10+ is, at least for 50% of the initial price. I'm happier with my MacBook Pro than I ever was with any other laptop, so why not to try iPhone?

And by the way, any &amp; all tips for a new (future) iPhone user are welcome.

EDIT: Oh, I didn't describe another major thing. The camera. I was comparing the photo quality with my friend that has iPhone X, we were doing shots of different things, trying to use the same angles; long story short, imagine my disappointed that his iPhone was able to do just better photos than my brand-new Samsung flagship that was advertised for the amazing camera.",306,417,2019-09-08,AAPL,0.054904334247112274,0.9122509360313416,0.03284471109509468
apple,"“For the first time in years the front display windows of the Apple Store will be shielded by black curtains, the night before and during the #AppleEvent. Wait till you see why.”",,914,6528,2019-09-09,AAPL,0.03816774860024452,0.9203611612319946,0.04147106036543846
iphone,Found the case for the next iPhone at my local Walmart.,,221,2888,2019-09-09,AAPL,0.020216092467308044,0.860977828502655,0.11880603432655334
mac,Most beautiful mouse I've ever owned. It originally came with my iMac G3,,80,1733,2019-09-09,AAPL,0.020584186539053917,0.9122747182846069,0.0671410784125328
AppleWatch,"15 months ago my watch stopped working after swimming with it for a couple hours. For more than 9 months I would periodically try to charge it to see if it would turn on with no luck. Almost threw it out today, but my wife put it on the charger one last time and amazingly, it turned on!",,143,1280,2019-09-09,AAPL,0.11569420993328094,0.7884853482246399,0.09582047909498215
