subreddit,title,selftext,num_comments,score,created_utc,stock/sector,neg,neu,pos
AppleWatch,I’ve found these magnetic mesh bands come in handy a lot,,64,1377,2019-09-25,AAPL,0.013986247591674328,0.8625384569168091,0.12347531318664551
apple,Mario Kart Tour is out!,,290,1372,2019-09-25,AAPL,0.017442168667912483,0.8729580044746399,0.10959979146718979
iphone,The inside of the iPhone 11 Pro Max,,109,1111,2019-09-25,AAPL,0.013006164692342281,0.9114786982536316,0.07551519572734833
ios,Waiting for dark mode updated apps like..,,55,957,2019-09-25,AAPL,0.021710127592086792,0.9366947412490845,0.041595157235860825
mac,Technically the truth,,36,940,2019-09-25,AAPL,0.019925668835639954,0.8782312273979187,0.10184313356876373
ipad,Wasn't sure if r/oddlysatisfying would appreciate this but thought you guys might,,33,853,2019-09-25,AAPL,0.03956398740410805,0.8963516354560852,0.06408441066741943
apple,Ben Geskin on Twitter: “Exclusive: One of the 2020 iPhone prototypes has 6.7-inch display with Face ID and TrueDepth camera system housed in the top bezel.”,,970,5198,2019-09-26,AAPL,0.017309827730059624,0.8907201290130615,0.09197008609771729
AppleWatch,To non-UK AW owners. I got my S5 today and thought you might like to see the cool plug we get here,,218,2217,2019-09-26,AAPL,0.015167325735092163,0.831628143787384,0.1532045155763626
iphone,One of the 2020 iPhone prototypes has a completely symmetrical bezel with no notch - Ben Geskin,https://twitter.com/BenGeskin/status/1177242732550610945?s=20,480,1788,2019-09-26,AAPL,0.01735120266675949,0.9068007469177246,0.07584807276725769
iphone,"AltStore is an alternative iOS App Store with a built-in Nintendo emulator 8 And anyone can download it, no jailbreak required",,200,1376,2019-09-26,AAPL,0.05960047245025635,0.9097365736961365,0.030663030222058296
mac,Mac: So who’s voice do you want to download? Me: Yes,,39,1308,2019-09-26,AAPL,0.03221317008137703,0.9316691160202026,0.03611769527196884
mac,Just got my first Mac any suggestions on what I should do first?,,153,1155,2019-09-26,AAPL,0.014731092378497124,0.9073113799095154,0.07795750349760056
mac,"Decided to try MacOS, I love it!",,136,1027,2019-09-26,AAPL,0.01812724955379963,0.9288950562477112,0.05297773331403732
ios,Nice to see Apple putting user security and privacy front and center with the release of iOS 13 and iOS 13.1,,88,679,2019-09-26,AAPL,0.023676667362451553,0.9424258470535278,0.03389744460582733
apple,The “shoelace” handles on Apple Store bags are actually made of knitted paper fibers,,44,648,2019-09-26,AAPL,0.02294684387743473,0.9327457547187805,0.04430742561817169
apple,Some 7.5W Wireless Fast Chargers Limited to 5W as of iOS 13.1,,125,499,2019-09-26,AAPL,0.021548427641391754,0.8838676810264587,0.09458383172750473
apple,"Permanent jailbreak for A5 to A11 devices released, first jailbreak of its kind since 2009",,1328,10085,2019-09-27,AAPL,0.17802610993385315,0.7494428753852844,0.07253095507621765
iphone,My friend 3D printed and painted a frying pan for my Stovetop Pro Max,,111,8074,2019-09-27,AAPL,0.01764482446014881,0.9000577330589294,0.08229749649763107
iphone,Controller Support + $13 Mount + Apple Arcade = Heaven,,309,3793,2019-09-27,AAPL,0.012347140349447727,0.9048458933830261,0.08280694484710693
AppleWatch,Always listening,,124,2889,2019-09-27,AAPL,0.029384834691882133,0.8778359293937683,0.0927792638540268
iphone,iPhone 11 Pro Super Retina XDR display rated best smartphone screen with ‘highest ever A+ rating’ from DisplayMate - 9to5Mac,,255,1243,2019-09-27,AAPL,0.013634868897497654,0.7766014337539673,0.20976363122463226
apple,Spotify is finally getting Siri support with iOS 13 - The Verge,,164,991,2019-09-27,AAPL,0.012926827184855938,0.7757439613342285,0.21132922172546387
apple,"""iOS 13 warns you if you have a weekday alarm set and it notices a public holiday in tomorrow’s calendar.""","[From Twitter](https://twitter.com/GordyPls/status/1177114749143699456?s=20).

Curious about this; I haven't found any documentation of it other than this [support article about holiday calendars in the iOS calendar app](https://support.apple.com/en-us/HT208541). Has anyone run into this in real life yet?",45,853,2019-09-27,AAPL,0.043242912739515305,0.9306692481040955,0.026087824255228043
ipad,Studying on the bus a few hours before Midterms!,,93,834,2019-09-27,AAPL,0.09603136032819748,0.8722766637802124,0.031692009419202805
apple,Mario Kart Tour unavailable on Belgium's App Store because of country's loot box ban,,144,791,2019-09-27,AAPL,0.02002517133951187,0.927981436252594,0.051993418484926224
mac,I don't know what happened please help me.,,59,787,2019-09-27,AAPL,0.07865148782730103,0.8835254907608032,0.03782306984066963
iphone,GTA San Andreas + Xbox Mount on iOS 13 = 🔥🔥,,278,5231,2019-09-28,AAPL,0.01719740778207779,0.8878673315048218,0.09493525326251984
apple,Really cool detail in iOS 13: Cropping Snaps to the Edge of Nav and Tab Bars,,167,3353,2019-09-28,AAPL,0.01624302566051483,0.899263322353363,0.08449368178844452
AppleWatch,"Cockpit of a 737 descending out of 10,000FT. Not as bad as a screaming child.",,119,2919,2019-09-28,AAPL,0.26774272322654724,0.684757649898529,0.047499608248472214
apple,Astrophotographer using night mode on iPhone 11 pro tonight,,177,2112,2019-09-28,AAPL,0.016682486981153488,0.924740731716156,0.05857681855559349
mac,"My friend just bought her son a 2009 MacBook, he’s 14 and I told him to appreciate this beautiful piece of history.",,175,1721,2019-09-28,AAPL,0.018825342878699303,0.8814796209335327,0.09969498217105865
mac,If it fits...,,66,1240,2019-09-28,AAPL,0.05020845681428909,0.8408206105232239,0.1089709922671318
apple,"I made an app to help people get more points from their credit cards, and Apple is featuring it in the new App Store in watchOS 6; best week of my life!",,103,786,2019-09-28,AAPL,0.021920684725046158,0.7206820249557495,0.257397323846817
apple,Developer of Checkm8 explains why iDevice jailbreak exploit is a game changer,,163,755,2019-09-28,AAPL,0.03694646432995796,0.92853182554245,0.03452173247933388
mac,"After being an office rat for 10 years, finally quit from my job and starting my own business. This is my setup and wish me luck.",,46,721,2019-09-28,AAPL,0.0683092325925827,0.8354960680007935,0.09619469940662384
ios,"Is it just me or are 1, 2, 3, 7 and 0 not bold as the other numbers on iOS 13",,68,666,2019-09-28,AAPL,0.04241439327597618,0.8383690714836121,0.11921652406454086
apple,Apple isn't too happy about apps that secretly record your phone's screen,[deleted],372,6316,2019-09-29,AAPL,0.05117878317832947,0.9142139554023743,0.034607186913490295
mac,My original 1984 128k MacAquarium!,,101,3097,2019-09-29,AAPL,0.030692871659994125,0.9309602379798889,0.03834686800837517
AppleWatch,Nice.,,90,2047,2019-09-29,AAPL,0.03193225711584091,0.8903039693832397,0.07776374369859695
apple,Next year’s iPhone 4-like stainless steel edge design fit the current 3 camera module better. Here are some new renders,,441,1992,2019-09-29,AAPL,0.010953213088214397,0.28157761693000793,0.7074692249298096
mac,New setup (I know it’s old hardware but I’m only 15 and this is the best I could do),,175,1801,2019-09-29,AAPL,0.01245321799069643,0.8367108702659607,0.15083593130111694
iphone,Iphone 11 Pro camera on a Drone,"So, I strapped the Iphone 11 pro to my quad to try out the new camera wide lens and stabilization. Don't do this at home.

**EDIT**:  [https://youtu.be/iJix2UY3zEE](https://youtu.be/iJix2UY3zEE)4k@60 max bitrate

So the previous video was reencoded to 1080p and the bitrate was horrible. The image was very bad.   Here is the best posible version Youtube would alow me uploading at 4k 60fps.

&amp;#x200B;

https://preview.redd.it/eq84oqt7qip31.jpg?width=1280&amp;format=pjpg&amp;auto=webp&amp;s=7dc1f8719e2eebc8b9a99c659e044bb22d5decbb",208,1500,2019-09-29,AAPL,0.03928954154253006,0.8958399891853333,0.06487048417329788
ipad,"I've written over 100,000-words of a book in the past year on my iPad Mini. Having a beautiful writing environment lets me do my best writing.",,135,903,2019-09-29,AAPL,0.018614398315548897,0.8746466040611267,0.10673899203538895
AppleWatch,"First attempt at an Apple Watch game: ""Fish in a Watch""",,47,685,2019-09-29,AAPL,0.0234230924397707,0.9443479776382446,0.03222896158695221
AppleWatch,AW battery screen shows the battery % of connected speakers. I have no way to know the actual percentage of either of these on their own. Nice feature!,,67,636,2019-09-29,AAPL,0.027763592079281807,0.9072728753089905,0.06496354937553406
ipad,TIL you can resize the pip video,,91,613,2019-09-29,AAPL,0.035022083669900894,0.8779769539833069,0.08700099587440491
iphone,Sending my old phone in for a trade in. Hopefully I make someone laugh.,,217,5706,2019-09-30,AAPL,0.0464138463139534,0.7637845873832703,0.18980154395103455
apple,Spotify is getting Siri Integration,,450,5470,2019-09-30,AAPL,0.019207939505577087,0.9060393571853638,0.07475271821022034
apple,The iPhone 11 Glows,,297,3447,2019-09-30,AAPL,0.018814824521541595,0.8008742332458496,0.18031100928783417
apple,"Apple Releases iOS 13.1.2 and iPadOS 13.1.2 with Fixes for Camera, iCloud Backup, HomePod Shortcut, and Flashlight Bugs - MacRumors",,382,1304,2019-09-30,AAPL,0.034637194126844406,0.9159471988677979,0.049415625631809235
iphone,Had my first tumble with the 11 Pro,"So I just had my first tumble with my 11 Pro and I figured I’d share just so people can have some real world understanding of how sturdy the phone is. 

I took my phone out of its case cause there was a cat hair on the back glass and I could see it cause I have a clear otterbox. Once I have it out. Give it a good wipe down with the little cloth that comes with a screen protector. And the little fucker slips right out of my hand like a bar of soap. 

I was in my tile bathroom. The drop was maybe 3 or 4 feet but like I said it shot forward and then fell down. It looked and sounded like it hit the corner of the phone and then landed face down (which always fucking terrifies me, glad I also had a glass screen protector) but anyways I pick it up to examine, not a scratch or ding anywhere on the thing. Before it landed face down it tumbled a couple times so the back glass and camera housing glass definitely hit the tile. 

Anyways im super surprised and impressed. Apple built a mighty strong phone here. I’ve made similar mistakes before with an iPhone 5s and a 7 and the results weren’t as good trust me lmao (broken screen protector on one, broken screen on the other because I was between screen protectors). 

Tl;dr dropped my iPhone 11 pro on hard tile and it came out unscathed. Great job Apple.

Edit: of all my posts I’ve made on reddit, the one about me dropping my phone gets over 1k. This is how I’ll be remembered when I die lmao",226,1252,2019-09-30,AAPL,0.06013498827815056,0.9028105735778809,0.03705444931983948
mac,"After 13 Years of using Windows PCs, exclusively I was able to find a MacBook Pro 2014 for £350, took the plunge.",,116,1136,2019-09-30,AAPL,0.012535836547613144,0.8936132788658142,0.09385085105895996
apple,Kuo: High-End iPad and MacBook With Mini-LED Displays to Launch Between Late 2020 and Mid 2021,,205,1129,2019-09-30,AAPL,0.015470478683710098,0.9257088899612427,0.05882062390446663
AppleWatch,"Only learned today that the Watch has almost every kind of workout you could imagine, what is Fitness Gaming?",,295,1015,2019-09-30,AAPL,0.018960950896143913,0.9267891645431519,0.054249923676252365
apple,"The guy who ""leaked"" the notchless 2020 iPhone renders now says there's only a 20% chance of the notch going away next year.",,132,887,2019-09-30,AAPL,0.13970795273780823,0.8160414099693298,0.04425060376524925
AppleWatch,"This is so amazing, props to Apple.",[deleted],50,847,2019-09-30,AAPL,0.0256035216152668,0.8368996381759644,0.13749687373638153
