subreddit,title,selftext,num_comments,score,created_utc,stock/sector,neg,neu,pos
apple,Apple defends iPhone encryption against Senate Judiciary Committee threats,,215,1686,2019-12-12,AAPL,0.10983527451753616,0.8082519173622131,0.08191286772489548
AppleWatch,i kinda like red,,57,1503,2019-12-12,AAPL,0.02408953569829464,0.8784885406494141,0.09742197394371033
apple,This 2019 Mac Pro Review is Different... - Jonathan Morrison,,269,1145,2019-12-12,AAPL,0.02399851381778717,0.9250668287277222,0.050934676080942154
apple,Twitter will now let you post iOS Live Photos as GIFs,,42,921,2019-12-12,AAPL,0.031637001782655716,0.9433377385139465,0.02502530999481678
ios,iPhone's bar changes Pikachu face dramatically.,,24,732,2019-12-12,AAPL,0.05157388746738434,0.9001457095146179,0.04828045144677162
AppleWatch,These drawer organizers from IKEA are probably my favorite way to store bands.,,51,731,2019-12-12,AAPL,0.03227013722062111,0.9021382927894592,0.06559151411056519
iphone,The iPhone is now the internet’s preferred porn streaming device,,328,3351,2019-12-13,AAPL,0.014925491064786911,0.9084279537200928,0.07664661854505539
mac,So Microsoft just made a Minecraft Version of the Trashcan Mac Pro,,243,2556,2019-12-13,AAPL,0.020909784361720085,0.9331635236740112,0.045926693826913834
apple,Apple is offering free genetic tests to all its Silicon Valley employees,,291,1925,2019-12-13,AAPL,0.01253774669021368,0.8857043981552124,0.10175786912441254
AppleWatch,Don’t forget the reason for the season,,49,1113,2019-12-13,AAPL,0.03269655629992485,0.9069384932518005,0.060364920645952225
ipad,Won an iPad tonight at a Resident’s Christmas Party,,72,752,2019-12-13,AAPL,0.03815711289644241,0.9259697198867798,0.0358731634914875
apple,"iMac Pro Works With Apple's New Pro Display XDR, But Limited to 5K Resolution",,138,626,2019-12-13,AAPL,0.016678836196660995,0.9179394245147705,0.0653817430138588
AppleWatch,"Okay, controlling my Christmas tree lights from my watch with the help of a wemo outlet is pretty damn neat.",,57,551,2019-12-13,AAPL,0.026509558781981468,0.764365553855896,0.2091248482465744
apple,Cellular support for Apple Watch finally arrives in New Zealand,,33,428,2019-12-13,AAPL,0.016564974561333656,0.7209956645965576,0.2624393105506897
mac,"I love Macs, but what the hell",,37,417,2019-12-13,AAPL,0.021536214277148247,0.8833639621734619,0.09509981423616409
iphone,iPhone 11 Pro &amp; 11 Pro Max users: Are you happy with your battery life?,"There are rumors of larger batteries next year. This may be done to either lengthen battery life further (yey!) or because Apple cannot increase performance per watt.

So are you happy with the current battery life of your 11 Pro Max (3,969 mAh) or 11 Pro (3,110 mAh) or would you want something longer than what you are getting now?

iPad Mini battery (5124 mAh) in an iPhone 12 Max Pro would be awesome!",314,306,2019-12-13,AAPL,0.020441921427845955,0.846945583820343,0.13261255621910095
iphone,Will any other iPhone look as aesthetically pleasing as the iPhone 4 when it first came out?,,523,5858,2019-12-14,AAPL,0.011589514091610909,0.7384585738182068,0.24995191395282745
apple,The iPhone is now the internet's preferred porn streaming device,,330,4083,2019-12-14,AAPL,0.014925491064786911,0.9084279537200928,0.07664661854505539
apple,What the Pro Display XDR Looks Like in HDR,,271,2042,2019-12-14,AAPL,0.01455052848905325,0.9281908869743347,0.057258572429418564
AppleWatch,Apple Watch app layout,,120,1743,2019-12-14,AAPL,0.0276691485196352,0.9412908554077148,0.031040018424391747
mac,The real inspiration for the Xbox Series S new look (I knew I saw that design somewhere before...).,,82,1271,2019-12-14,AAPL,0.02017914690077305,0.9028835296630859,0.07693728804588318
iphone,Today I learned you can disable this annoying feature,,58,759,2019-12-14,AAPL,0.6120046973228455,0.25720924139022827,0.1307860165834427
apple,A terabyte of stuff on an old iPod? Here’s how.,,50,400,2019-12-14,AAPL,0.0313895083963871,0.894320547580719,0.07428991049528122
apple,iTunes Remote Version 4.5: Apple Finally Releases A New Version Of iTunes Remote App,,48,352,2019-12-14,AAPL,0.0260205939412117,0.937157154083252,0.036822233349084854
appletv,"Anyone else here annoyed at how the Apple TV app works? When clicking on it there is no distinction between paid movies, local catchup stations, Disney+ and for the life of me can’t even find where the Apple + subscription content is. Just random episodes all over the place.",,58,303,2019-12-14,AAPL,0.06179635226726532,0.9176956415176392,0.020508071407675743
ipad,Time Magazine declares Apple iPad the best widget of 2010s,[deleted],41,299,2019-12-14,AAPL,0.028817996382713318,0.7888551950454712,0.1823267936706543
iphone,Mom visiting for holidays. She pull out this classic to take pictures,[deleted],311,4410,2019-12-15,AAPL,0.04926962032914162,0.9147863984107971,0.03594397380948067
apple,"No, Apple's new Mac Pro isn't overpriced",,1198,1955,2019-12-15,AAPL,0.06133138760924339,0.8695667386054993,0.06910179555416107
apple,"The 10 Best Gadgets of the 2010s - iPad, Apple Watch and AirPods makes the list. - Time Magazine",,247,1267,2019-12-15,AAPL,0.030330264940857887,0.9140899181365967,0.055579785257577896
mac,I went to the Austrian lakes yesterday as a one-day fieldtrip. Ended up with my very own desktop picture that fits MacOS great.,[deleted],54,1128,2019-12-15,AAPL,0.025201115757226944,0.8987637758255005,0.07603511214256287
ipad,"Pro tip: When using steam link to stream games and your desktop to your iPad, set the resolution in Windows to match your iPad exactly. For this 12.9” 2018 iPP, I set it to 2732x2048. Not only does it perfectly match the unique aspect ratio of the iPad, it makes windows look perfectly sharp.",,77,928,2019-12-15,AAPL,0.010851351544260979,0.814241886138916,0.17490674555301666
AppleWatch,Literally the first time I dropped it wtf,,217,770,2019-12-15,AAPL,0.14529284834861755,0.7616007328033447,0.09310637414455414
ios,This is the kind of content I like to see on the Updates page,,30,632,2019-12-15,AAPL,0.030538301914930344,0.9406998157501221,0.028761813417077065
apple,Save thousands on 2019 Mac Pro RAM with DIY upgrade,,186,527,2019-12-15,AAPL,0.044850148260593414,0.8652037382125854,0.08994610607624054
iphone,Apple buys startup spectral edge to supercharge iPhone camera's,[deleted],72,449,2019-12-15,AAPL,0.010946872644126415,0.795890212059021,0.1931629180908203
MacOS,cursed_terminal,,23,391,2019-12-15,AAPL,0.06372881680727005,0.8696231842041016,0.06664802879095078
apple,"3D mask or photo fools airport face-recognition, but not Face ID - 9to5Mac",,163,2852,2019-12-16,AAPL,0.036801356822252274,0.9316574335098267,0.03154125064611435
iphone,"If you have the lyrics bubble selected in Apple Music and a song without lyrics comes up next, they keep the funky background. I wish this was a permanent feature, instead of just a glitch.",,103,2436,2019-12-16,AAPL,0.03595300018787384,0.9250260591506958,0.03902098536491394
mac,Never thought I would be playing Forza at 60 FPS on a Mac. This 16” truly is a beast.,,257,1802,2019-12-16,AAPL,0.030337292701005936,0.8869895339012146,0.08267311751842499
mac,Let's honour the fallen comrade. It served us well,,123,1407,2019-12-16,AAPL,0.01847289688885212,0.6176936030387878,0.363833487033844
apple,Apple pulls app that let you turn your phone into a virtual iPod with click wheel,,149,1403,2019-12-16,AAPL,0.08661459386348724,0.881608784198761,0.031776636838912964
AppleWatch,"My girlfriend asked for the Series 5 Apple Watch this year, and I’m super stoked to give it to her! I decided it would be more fun if she opens my “Refurbished” version first though.",,48,1222,2019-12-16,AAPL,0.019910022616386414,0.9216337203979492,0.05845627933740616
apple,"""When you sat in a meeting with Steve, he dominated, and he would tell you to shut up and let someone else talk. Tim was the complete opposite. He listened to everybody no matter what you had to say, and he would come back to challenge them on things. There was a lot more opennes and freedom""",[deleted],233,1207,2019-12-16,AAPL,0.027645858004689217,0.8810054659843445,0.09134869277477264
apple,Apple Releases New Firmware for AirPods 2 and AirPods Pro,,185,953,2019-12-16,AAPL,0.014123396016657352,0.9119472503662109,0.0739293098449707
AppleWatch,New list view app screen is so much better in the new update.,,107,900,2019-12-16,AAPL,0.013077113777399063,0.6975522041320801,0.28937065601348877
apple,Apple Arcade Now Available With $49.99/Year Subscription Option,,153,549,2019-12-16,AAPL,0.034129440784454346,0.93702632188797,0.028844209387898445
apple,"iFixit Mac Pro 2019 Teardown: “beautiful, amazingly well put together, and a masterclass in repairability”",,692,7236,2019-12-17,AAPL,0.0196642205119133,0.8629637360572815,0.117372065782547
mac,This looks like it could just slide off the desk,,220,1941,2019-12-17,AAPL,0.24798645079135895,0.6603748798370361,0.09163868427276611
iphone,"Apple Watch, AirPod And iPad Were Voted As The Best Devices Of The Decades By Time Magazine",[deleted],177,1495,2019-12-17,AAPL,0.025954464450478554,0.4803929626941681,0.4936526119709015
AppleWatch,I really should start listening...,,62,705,2019-12-17,AAPL,0.044470686465501785,0.912865936756134,0.042663417756557465
iphone,iOS 13.3.1 beta 1 is available now for iPhone and iPod touch.,[deleted],116,679,2019-12-17,AAPL,0.009635196067392826,0.7726232409477234,0.21774154901504517
apple,MKBHD's blind phone camera test,,250,671,2019-12-17,AAPL,0.02098720893263817,0.938915491104126,0.040097255259752274
apple,Studio ghibli movies available on iTunes digitally for the first time!,,119,631,2019-12-17,AAPL,0.017564168199896812,0.9322683811187744,0.05016746371984482
ipad,iPad + Raspberry pi 4,,78,627,2019-12-17,AAPL,0.04466859623789787,0.880917489528656,0.0744139552116394
apple,"Apple wins patent for under-display Touch ID, already uses tech in MBP 16",,164,521,2019-12-17,AAPL,0.014509476721286774,0.8812385201454163,0.10425198823213577
apple,Airpods Pro at Costco.com $234.99,,60,289,2019-12-17,AAPL,0.02571122720837593,0.9140579700469971,0.06023077294230461
apple,"Apple ships braided, black USB C to lightning cables with new Mac Pro",,474,3242,2019-12-18,AAPL,0.018098849803209305,0.8895887136459351,0.09231244772672653
apple,Taking picture of the Northern Lights with iPhone 11 Pro and Night Mode,"Hello everyone !  


Currently in North of Sweden, I've been wondering how well the new iPhone could capture the northern lights. Tonight, there were a lots of them (Kp 4,7), and I gave it a shot !   


I tried different exposure time, between 3 and 10 seconds. I was just holding it with my hand. 

&amp;#x200B;

The pictures are all unedited.  


Here's the result : [https://imgur.com/a/1wjoe31](https://imgur.com/a/1wjoe31)

&amp;#x200B;

It obviously not as good as an actual camera, but I'm still really impressed  !",156,3113,2019-12-18,AAPL,0.014712519012391567,0.8492149114608765,0.13607257604599
iphone,PSA: If you are a lazy sloth and put 20 alarms to wake up you don’t have to disable each alarm individually. You can save a lot of time by saying “Disable all alarms” to Siri,,128,1534,2019-12-18,AAPL,0.0775487944483757,0.8898643255233765,0.03258681297302246
mac,Found this in my basement. One of the best Apple products I’ve purchased. Hoping to refurb it and make it my secondary,,146,1364,2019-12-18,AAPL,0.022174082696437836,0.9181458353996277,0.059680067002773285
apple,"Amazon, Apple, Google, Zigbee Alliance and board members form working group to develop open standard for smart home devices",,156,1184,2019-12-18,AAPL,0.013652635738253593,0.8872272968292236,0.09912003576755524
ipad,Animated lightning bolt,,26,885,2019-12-18,AAPL,0.04406324028968811,0.9169344902038574,0.03900233656167984
apple,$43M fraud by Foxconn managers selling iPhones made from rejected parts.,[deleted],103,875,2019-12-18,AAPL,0.031223254278302193,0.923552930355072,0.04522387310862541
AppleWatch,Forgot my charger in a month long trip. How long will the watch last with power reserve? Buying a new charger is quite expensive. I’ve been for 4 days and still at 86%,,247,849,2019-12-18,AAPL,0.06664244085550308,0.8893468976020813,0.04401066526770592
ipad,The highlighter in Notability v9.2 now goes behind text!,,81,688,2019-12-18,AAPL,0.09660375863313675,0.8552938103675842,0.04810241982340813
apple,Extraodinarily Unpopular Opinion: Lightning is better than USB-C,"I own dozens of USB-C and lightning devices.

In half of my USB-C devices, like my macbook pro, ports have loosened to the point where cables don’t stay in, USBs and attachments have become wiggly, etc. USB-Ca design relies purely on friction, and when you use the ports frequently that friction slowly disappears. Plus, the ports are larger than lightning ports.

Lightning’s design causes it to snap into place because it has grooves that fit the cable tip, making it more secure, satisfying, and easy to use. I have never had an issue with a lighting port becoming loose, and I cannot break the inner port as easily as I can with USB-C. 

The fact that I have to carry around an extra cable does not bother me at all, it is a few extra ounces in my bag and I feel like detractors of lightning exaggerate the inconvenience of having another cable.

I hope Apple keeps the lightning port forever.",222,536,2019-12-18,AAPL,0.04901798814535141,0.9164451956748962,0.034536805003881454
apple,Prominent activist in Hong Kong was arrested in August. The cops accessed his messages on his iPhone XR without his password. Uncertain if it was through Cellebrite or other means.,,233,3731,2019-12-19,AAPL,0.15110673010349274,0.8219277858734131,0.026965545490384102
iphone,Looks like a new scam coming to town so watch out!,,135,2642,2019-12-19,AAPL,0.02355319634079933,0.8977441191673279,0.07870271801948547
apple,Apple open-sources HomeKit Accessory Development Kit to spur adoption and new standard,,108,1333,2019-12-19,AAPL,0.017043208703398705,0.9176162481307983,0.06534058600664139
mac,"System is taking up all of my space, is there any way I can fix this?",,155,869,2019-12-19,AAPL,0.0214566420763731,0.9034923315048218,0.07505110651254654
apple,"Apple Pro Display XDR: Why $5,000 is an insanely good deal and could change our future screens | This is not a successor to the Apple Cinema Display, it's a competitor to $30,000 monitors from Sony and Flanders Scientific.",,247,758,2019-12-19,AAPL,0.02453603595495224,0.9149063229560852,0.06055755913257599
AppleWatch,The Official Woven Nylon Orange Band,,23,742,2019-12-19,AAPL,0.04055333137512207,0.9270950555801392,0.032351668924093246
apple,"Apple Now Offering $2,600 8TB SSD Upgrade Option for Mac Pro",,129,636,2019-12-19,AAPL,0.014160117134451866,0.8978385329246521,0.08800128847360611
apple,"Twitter rolling out redesigned iPad interface with multiple columns, more",,46,506,2019-12-19,AAPL,0.03407057374715805,0.9328696131706238,0.03305982053279877
iphone,Daily Tech Support Thread - [December 19],"Welcome to the Daily Tech Support thread for /r/iphone. 

Have a question you need answered? Ask away! Please remember to adhere to our rules, which can be found in the sidebar. As usual, if you have a serious issue with the subreddit, please contact [the moderators directly.](https://www.reddit.com/message/compose?to=%2Fr%2Fiphone)

Please be informed that any questions about bypassing iCloud lock,  or anything similar that may infer that you are trying to get access to a locked iPhone, are no longer allowed and will be removed. Thank you.

Join our Discord room for support:

[Discord](https://discord.gg/iphone)

**Note: Comments are sorted by /new for your convenience.**

This is the previous [archive](https://www.reddit.com/r/iphone/search?q=title%3A%22Daily+Tech+Support+Thread%22+author%3A%22AutoModerator%22&amp;restrict_sr=on&amp;sort=new&amp;t=all) of all previous ""Daily Tech Support"" threads. This is best viewed on a browser. If on mobile, type on the searchbar [title:""Daily Tech Support Thread"" author:""AutoModerator""] (without the brackets, and including the quotation marks around the title and author.)   

Here is a previous [archive](https://www.reddit.com/r/iphone/search?q=title%3A%22Weekly+Tech+Support+Thread%22+author%3A%22AutoModerator%22&amp;restrict_sr=on&amp;sort=new&amp;t=all) of all previous ""Weekly Tech Support"" threads, which has now changed to Daily Tech Support Thread. This is best viewed on a browser. If on mobile, type on the searchbar [title:""Weekly Tech Support Thread"" author:""AutoModerator""] (without the brackets, and including the quotation marks around the title and author.)",294,436,2019-12-19,AAPL,0.05568651854991913,0.9196062684059143,0.0247072484344244
mac,I need your help. Is it worthy to update my hdd to ssd? I'm kinda short on cash to buy a new one. I work with graphics so PS and AI,[deleted],110,405,2019-12-19,AAPL,0.022295527160167694,0.9094592332839966,0.06824523210525513
apple,Apple earned 66% of the entire smartphone market's profits in 2019,,504,4497,2019-12-20,AAPL,0.13937599956989288,0.27869361639022827,0.5819303393363953
apple,Apple brings contactless student IDs on iPhone and Apple Watch to more universities,,200,2546,2019-12-20,AAPL,0.051568783819675446,0.9217148423194885,0.0267163272947073
AppleWatch,20 or so years later.,,42,2229,2019-12-20,AAPL,0.04213915765285492,0.9074862003326416,0.05037466436624527
apple,AirPods were a $6 billion business for Apple this year and will be even bigger next year - Toni Sacconaghi,,319,2145,2019-12-20,AAPL,0.015173465944826603,0.7713346481323242,0.21349194645881653
iphone,FCC Determines iPhone Radiation Doesn’t Exceed Safety Levels,[deleted],148,1508,2019-12-20,AAPL,0.03376729413866997,0.9339823126792908,0.03225037083029747
mac,Personally I've always loved the white macbook design. Still use it to this day.,,104,1028,2019-12-20,AAPL,0.022255489602684975,0.9193620681762695,0.05838244408369064
apple,Apple's bug bounty program now open to all; pays up to $1.5M,,54,939,2019-12-20,AAPL,0.05439498648047447,0.908677875995636,0.036927156150341034
ipad,When you dont have a Tesla,[deleted],42,710,2019-12-20,AAPL,0.048792336136102676,0.9015541672706604,0.049653537571430206
mac,Triple Pro Display XDR Setup looks good - Apple,,95,598,2019-12-20,AAPL,0.01052646804600954,0.5217714309692383,0.46770212054252625
AppleWatch,Today I fell flat forward,"I crossed the street then I hit the curb with the front of my shoe and before I realized it I was on the floor. One guy helped me up and I was so confused because everything happened so fast that when my watch started vibrating on my wrist my first thought was “who the heck is calling me at the wrong possible time?” 
It took me a few seconds to remember that it was the fall detecting feature!!! 
I’m so happy I caught it before it called 911 or something!!!

I hope series 6 would have a feature that opens up a parachute and keeps you from hitting the ground hahaha",59,535,2019-12-20,AAPL,0.04304424300789833,0.8849994540214539,0.0719563290476799
mac,It‘s even a mac (I think).,,59,2379,2019-12-21,AAPL,0.031720202416181564,0.9067838191986084,0.061495982110500336
apple,AirPods Pro and Bluetooth Latency,,255,1549,2019-12-21,AAPL,0.039940036833286285,0.8951209187507629,0.06493896245956421
apple,Ivan Krstić: Black Hat 2019 presentation: Behind the scenes of iOS and Mac Security,,76,1265,2019-12-21,AAPL,0.020506229251623154,0.9281182289123535,0.051375601440668106
apple,I Redesigned Apple Maps and Replicated an Apple Product Launch for it,"TL;DR: I took a lot of feedback (a lot from r/apple) and decided to redesign Apple Maps with features many have people have been requesting for years, plus a few that I think might add value. Check out my in-depth [case study blog post](https://medium.com/@aymanjaddaa/i-redesigned-apple-maps-and-replicated-an-apple-product-launch-for-it-468a03f10c92) or visit [aymanjaddaa.com](https://aymanjaddaa.com) to just see the visuals.

––

Over the past couple of months, I have been working on a project that I am finally ready to show to the world, and I’m really excited about it. I redesigned Apple Maps and came up with 2 potential apps Apple should consider developing - Apple Carrier, and Apple Authenticator. I'm posting this from my official account, I'm more active here on my throwaway account :)

For a long time, I’ve wanted to use Apple Maps more (and I'm sure you do too); the apps’ tight integration within the Apple ecosystem is something that I treasure, but I never really saw myself using it too much because using Google Maps was just so much easier, more reliable, and more fully-fledged. Things took a turn when iOS 13 came out this year, and my opinion took a 180° turn. I’ve been using Apple Maps much more often ever since, but I still found that it had a lot of missing features that many other navigation apps had implemented years ago, and I wasn’t alone in this; many other users also help this opinion. I thought to myself: “why not try designing a version of Apple Maps that many users have been asking for?” So I gave it a shot at designing what the future Apple Maps might look like. 

The main objectives of this project were to (1) incorporate all the feedback many Apple users (especially in r/apple) had for Apple Maps and come up with a viable solution, (2) showcase my product design skills, and (3) have fun with this process. 

Just to point out, this was all done in good faith; massive kudos to the Maps team for all their amazing work. All odds were against them since day 1, but they’re surely getting there. I really hope someone from the team sees my work and sees my ideas.

It was really exciting, eye-opening, and a lot of fun, and I’m so excited to finally have the world see my work. If you know anyone who would be interested in my skill sets, all I ask is if you have enjoyed my work (which I’m confident you will), to please share it with your friends, peers, co-workers, hell, even your dog (just kidding, of course).

Anyways, enough reading. Check out my Apple Maps Redesign case study on Medium by [clicking here.](https://medium.com/@aymanjaddaa/i-redesigned-apple-maps-and-replicated-an-apple-product-launch-for-it-468a03f10c92)

Once you’re done, be sure you take a look at the [Apple Carrier](https://aymanjaddaa.com/work/apple-carrier) MVP app and the [Apple Authenticator](https://aymanjaddaa.com/work/apple-authenticator) app concepts I’ve also been working on. They’re both on my portfolio at [aymanjaddaa.com](https://aymanjaddaa.com)

&amp;#x200B;

If you have any feedback, please let me know! I'm always trying to learn and really want to improve my craft.",110,916,2019-12-21,AAPL,0.0357338972389698,0.9193629622459412,0.04490317776799202
AppleWatch,Upgrades complete ✅ (Also gold really is underrated),,71,881,2019-12-21,AAPL,0.019880399107933044,0.18040721118450165,0.7997124195098877
mac,ANIMAIONIC - turns your Mac Mini into a Workstation (Now on Kickstarter),,91,849,2019-12-21,AAPL,0.03244895488023758,0.919609785079956,0.04794119670987129
ios,What The Fuck Siri?,,72,591,2019-12-21,AAPL,0.13156096637248993,0.8053072690963745,0.06313174962997437
apple,MKBHD's Current desktop setup | 2x Pro Display XDR | Mac Pro under the desk | Apollo Twin MKII | 2x Yamaha HS8 | 80TB Promise Pegasus | Having dual monitors again has made me sooooo happy,,290,454,2019-12-21,AAPL,0.016350960358977318,0.9072473645210266,0.07640164345502853
apple,MacBook Pro 16” review from a developer's perspective,,137,266,2019-12-21,AAPL,0.020086180418729782,0.9185259342193604,0.06138793006539345
ipad,New Ipad Setup!,,49,264,2019-12-21,AAPL,0.01662137545645237,0.8927479386329651,0.09063060581684113
iphone,This Apple Maps concept looks even better than Google Maps,,204,1513,2019-12-22,AAPL,0.011030206456780434,0.25898775458335876,0.7299820184707642
mac,I just finished building a Mac Mini / Powerbook frankenmac,,68,1433,2019-12-22,AAPL,0.015357724390923977,0.8972762823104858,0.08736605197191238
mac,Always wanted the 15” on release date. Waiting never felt so good on getting my 16”,,87,1008,2019-12-22,AAPL,0.07330764830112457,0.8714989423751831,0.055193398147821426
apple,The Perfect Bluetooth iPod Classic – by u/Dankmus,,85,1006,2019-12-22,AAPL,0.02092009223997593,0.8733487129211426,0.10573121905326843
iphone,iPhone Lesson Plans?,My grandma is in town for the holidays and I have some time to spend with her. She has requested iPhone lessons for her Christmas gift. As a millennial that’s used Apple products for 10+ years I don’t even know where to begin teaching an 80 yo. Does anyone know of a lesson plan out there (paid or free) that will give me a checklist of items to review with her?,100,624,2019-12-22,AAPL,0.047027040272951126,0.9261664152145386,0.026806553825736046
ipad,"The pencil can INDEED attach to the side of a regular iPad, take that athiests",,58,604,2019-12-22,AAPL,0.026721609756350517,0.917554497718811,0.05572386831045151
apple,Why is pasting at a certain spot in a sentence almost impossible in iOS 13?,"Without the magnifier cursor it’s so difficult. Am I missing something?

Example: 

Paste your copied text in these brackets: [ ] Great, now the text is pasted.",158,585,2019-12-22,AAPL,0.06565076112747192,0.8869849443435669,0.04736427590250969
AppleWatch,Can Apple Pay still be used on the watch if someone would chop off my arm?,"I was having a discussion about this with a friend, so me having to worry about my arm being chopped of is not the issue here.",136,516,2019-12-22,AAPL,0.26587435603141785,0.7060114145278931,0.028114262968301773
ipad,"This style is very new to me, I don’t usually play around with the watercolor brushes in procreate, but I think it turned out ok:)",,36,502,2019-12-22,AAPL,0.03247492387890816,0.9298822283744812,0.03764282166957855
apple,Jon Davis: New WebKit Features in Safari 13,,105,437,2019-12-22,AAPL,0.02271280810236931,0.9189409017562866,0.058346252888441086
