subreddit,title,selftext,num_comments,score,created_utc,stock/sector,neg,neu,pos
apple,Apple Watch Siri awkwardly interrupts on-air meteorologist and contradicts his forecast,,111,2964,2019-12-01,AAPL,0.04353537783026695,0.9129846692085266,0.04347996413707733
apple,Black Friday is the time Android fans need to swallow their pride and buy a $229 iPad,,803,2585,2019-12-01,AAPL,0.023047789931297302,0.9239278435707092,0.053024325519800186
mac,"Back in my day, there used to be the original Apple store in the 1980s. Even though businesses came &amp; went, the shades from that store remains...",,32,1495,2019-12-01,AAPL,0.02375219762325287,0.9069056510925293,0.06934211403131485
AppleWatch,"TIL when you use ‘play sound’ on your Apple Watch in Find My, the pulse light flashes to help you find your watch in the dark or if you are deaf.",,43,1136,2019-12-01,AAPL,0.020803485065698624,0.9243741035461426,0.05482243001461029
iphone,"TIL that you can press the scroll bar, and use it to quickly scroll through an app. This even works system wide!","It will give haptic feedback when you press it, after which you can start scrolling. Apparently this feature was added in iOS ~~13.2~~ 13.0!",83,1120,2019-12-01,AAPL,0.018427789211273193,0.9235979318618774,0.05797422304749489
iphone,Finally upgrading from the 6 to the XR,My wife and I are upgrading from the iPhone 6 to the iPhone XR this week; what features or upgrades should we be checking out first?,321,890,2019-12-01,AAPL,0.014548351988196373,0.8402321338653564,0.14521950483322144
AppleWatch,Walmart redeemed themselves with the series 3 black Friday sale!,,50,728,2019-12-01,AAPL,0.07157012820243835,0.8980129957199097,0.030416877940297127
AppleWatch,My favorite watchface.,,22,705,2019-12-01,AAPL,0.022810421884059906,0.9220521450042725,0.05513747036457062
apple,Express Mode is now available for London!,,110,692,2019-12-01,AAPL,0.02555948868393898,0.9398658275604248,0.0345747247338295
apple,Why the freak are the snooze button and stop button swapped on the alarm clock compared to the timer?,Anyone else annoyed by this? Have they addressed this in any way?,71,572,2019-12-01,AAPL,0.14167387783527374,0.8195599913597107,0.03876616805791855
apple,Apple December 2019 Event | Live Event Thread,"*Tim Cook voice*

&amp;#x200B;

**GOOD MORNING! GOOD MORNING! GOOD MORNING!**

&amp;#x200B;

\#Right now there is an Apple media event in NYC that started at 4pm EST.

&amp;#x200B;

&gt;Loved by millions. Created by the best.

&amp;#x200B;

Apple is honoring its **""favorite apps and games of 2019.""**

&amp;#x200B;

This event will NOT be live-streamed so we will need to rely on live-blogs and real-time tweeting from attendees.

&amp;#x200B;

This event is the first of it's kind, so we really don't know what to expect.

&amp;#x200B;

From MacRumors:

&amp;#x200B;

&gt;It's not clear if any hardware will be introduced at the event, but it seems unlikely given the clear wording of the media invites. We're still expecting Apple to release the Mac Pro and Pro Display XDR in December, so there could be a mention of an official launch date, but beyond that, no more hardware refreshes are rumored for this year.

&amp;#x200B;

From 9to5Mac:

&amp;#x200B;

&gt;It seems very unlikely but could Apple sneak in a “One more thing…” at the event as a holiday surprise and show off or announce AirTag or something else? Maybe some plugs or more details on the Mac Pro launch that’s slated for December?",1506,1506,2019-12-02,AAPL,0.02832694910466671,0.9250259399414062,0.04664713516831398
apple,"When Scott Forstall managed Mac OS X, at the end of a release everyone would get one month to work on whatever they wanted to. Out of it came a project that turned into Apple TV.",,267,1357,2019-12-02,AAPL,0.02370312437415123,0.9255965948104858,0.05070027336478233
apple,"PowerMac G4 detected as ""overtly sexual content"" by Facebook's automated filtering system",,73,1265,2019-12-02,AAPL,0.03138478100299835,0.940523087978363,0.02809217758476734
apple,Apple forced to face class action lawsuit over problematic butterfly keyboards,,221,1145,2019-12-02,AAPL,0.7844634652137756,0.17163993418216705,0.0438966304063797
apple,"Tim Cook on Twitter - ""Humanity has never faced a greater or more urgent threat than climate change — and it’s one we must face together. Apple will continue our work to leave the planet better than we found it and to make the tools that encourage others to do the same.""",,350,1098,2019-12-02,AAPL,0.0200349073857069,0.8092677593231201,0.1706973910331726
apple,A7: How Apple's custom 64-bit silicon embarrassed the industry,,298,1006,2019-12-02,AAPL,0.02478385716676712,0.9143370389938354,0.06087911128997803
iphone,Simply Check Battery Charge Cycle Count Directly from iPhone,"I know people use Macbooks or 3utools to check the battery charge cycle but if you don't have a Macbook, there is a simple way to check the battery count right from your phone.

Go to Settings - Privacy - Analytics &amp; Improvements

Make sure Share iPhone &amp; Watch Analytics is TURNED ON.

Click on Analytics Data

Scroll down to log-aggregated-2019-12-01-xxxxxx.ips (or whatever the latest date file is)

Select the entire text and copy to Notes app.

Save by clicking Done. Now click on the box with top arrow and click on “Find in Note"" and type ""BatteryCycleCount""

The number that's shows up is the battery charge cycle. 

Hope this helps. Attached is the screenshot of the screens. 


https://imgur.com/a/503afWY",256,905,2019-12-02,AAPL,0.025353558361530304,0.9386335015296936,0.03601297736167908
ios,Anyone else ever notice this?,,46,633,2019-12-02,AAPL,0.08817991614341736,0.8525179624557495,0.05930207669734955
mac,Got lucky on an ebay purchase,[deleted],47,514,2019-12-02,AAPL,0.016557494178414345,0.692895770072937,0.2905466556549072
AppleWatch,Barton Red Leather Band with Black Stainless S4,,34,498,2019-12-02,AAPL,0.02871161513030529,0.8667474389076233,0.10454097390174866
iphone,A bullet went through this iPhone 11 Pro Max and yet the display is still powered on.,,397,5704,2019-12-03,AAPL,0.014691135846078396,0.8166904449462891,0.16861844062805176
apple,Supply Chain Reports Back Rumors of MacBook Pro and iPad Pro With Mini-LED Displays in 2020,,274,1811,2019-12-03,AAPL,0.017869621515274048,0.9066197276115417,0.0755106583237648
apple,Apple announces first ever Apple Music Awards.,,282,1474,2019-12-03,AAPL,0.031699031591415405,0.9151340126991272,0.05316692590713501
AppleWatch,The original Apple Watch.,,41,1224,2019-12-03,AAPL,0.03739045187830925,0.9348101615905762,0.02779935859143734
AppleWatch,Pocket Watch,,91,1026,2019-12-03,AAPL,0.06280659139156342,0.9067484140396118,0.03044494055211544
iphone,2020 iPhone Rumored to Have Under-Display Ultrasonic Fingerprint Scanner Supplied by Qualcomm,,278,846,2019-12-03,AAPL,0.03987247869372368,0.9227256774902344,0.03740180283784866
apple,App of the year: Spectre Camera.,,163,479,2019-12-03,AAPL,0.05669412389397621,0.7686744928359985,0.17463137209415436
mac,HDMI port seems to be malfunctioning. Is there a fix?,,117,441,2019-12-03,AAPL,0.02991372160613537,0.9040614366531372,0.06602486968040466
apple,Mario Kart Tour was the most downloaded iPhone game of 2019,,95,386,2019-12-03,AAPL,0.017925173044204712,0.9083986282348633,0.0736762061715126
apple,Apple Calls New Russian Smartphone Sales Legislation 'Equivalent to Jailbreaking',,80,369,2019-12-03,AAPL,0.09323463588953018,0.847832977771759,0.05893239378929138
apple,BMW No Longer Charging Monthly Fee for CarPlay in Cars With Newest Software,,715,6270,2019-12-04,AAPL,0.019504239782691002,0.9127569794654846,0.06773883104324341
mac,2019 vs. 2009,,151,1665,2019-12-04,AAPL,0.07545646280050278,0.8588817715644836,0.06566175818443298
AppleWatch,The proper Christmas ready watch face,,58,1054,2019-12-04,AAPL,0.024794645607471466,0.9387427568435669,0.03646263852715492
iphone,Apple admits iPhone 11 Pro still collects location data even when told not to,,92,977,2019-12-04,AAPL,0.012388310395181179,0.8724923133850098,0.1151193231344223
ipad,Scanned in pages from my anatomy coloring book. Honestly looks better on the iPad.,,52,818,2019-12-04,AAPL,0.01313029695302248,0.48489198088645935,0.5019776821136475
mac,"Just got the base i9 16inch Pro and I'm so happy, can't wait to go through college and uni with this beast",,194,813,2019-12-04,AAPL,0.028878653421998024,0.907583475112915,0.06353788822889328
mac,"After 2 Weeks Waiting, It’s Finally Here!",,66,763,2019-12-04,AAPL,0.261563777923584,0.6957843899726868,0.04265184327960014
apple,Tim Cook was the only executive that Steve Jobs allowed to be on another company's board,,107,750,2019-12-04,AAPL,0.13969658315181732,0.767405092716217,0.09289833903312683
iphone,Your Apple Photoshop Blunder of the Day! (Take a look at the iPhone),,81,725,2019-12-04,AAPL,0.04205719009041786,0.9312520027160645,0.02669084258377552
iphone,Decided to have Christmas earlier. Glad to finally come back to the Apple family after owning a Samsung.,,121,484,2019-12-04,AAPL,0.017699560150504112,0.7619251608848572,0.22037528455257416
apple,"AirPlay 2 cracked, will allow multiroom play to non-supported speakers",,286,2854,2019-12-05,AAPL,0.029143525287508965,0.9291935563087463,0.04166289046406746
mac,Touchbar Pet - A tamagotchi for your touchbar,,61,2030,2019-12-05,AAPL,0.027052031829953194,0.9237749576568604,0.049173034727573395
iphone,iOS 13.3 beta 4 is available now for iPhone and iPod touch.,[deleted],141,755,2019-12-05,AAPL,0.010614789091050625,0.8882447481155396,0.10114052891731262
AppleWatch,"Chirp for Twitter 2.0 is out now! Now with live complications, true endless scrolling, a rewritten timeline, a way better video player, support for 13 new languages, and so much more!",,54,692,2019-12-05,AAPL,0.010795836336910725,0.7295123934745789,0.2596917748451233
apple,"Kuo: Apple to Launch Five iPhones in 2020, Including 5.4-Inch, Two 6.1-Inch, and 6.7-Inch Models",,377,680,2019-12-05,AAPL,0.016088422387838364,0.8434690833091736,0.14044250547885895
iphone,iPhone 11 Pro producing bad GPS data or is strava to blame?,,113,579,2019-12-05,AAPL,0.8120487332344055,0.16594752669334412,0.022003771737217903
apple,Apple buys first-ever carbon-free aluminum from Alcoa-Rio Tinto venture,,56,574,2019-12-05,AAPL,0.014367741532623768,0.8803848624229431,0.10524740070104599
ipad,Drawing in Art school with Procreate,,52,565,2019-12-05,AAPL,0.02731490693986416,0.9316028952598572,0.0410822369158268
ipad,Passing the time.,,113,479,2019-12-05,AAPL,0.09876023977994919,0.863604724407196,0.03763505816459656
AppleWatch,"Two days usage on my S4, battery is just never better than this",,115,474,2019-12-05,AAPL,0.08952472358942032,0.7637053728103638,0.14676986634731293
iphone,So I bought the Arnold case cover for iPhone 11 from Wish... never again.,,327,6404,2019-12-06,AAPL,0.015888776630163193,0.8886095881462097,0.09550154954195023
apple,Florida man who had ‘no idea what AFib was’ saved by Apple Watch during holiday travel,,217,3122,2019-12-06,AAPL,0.024126876145601273,0.8769143223762512,0.09895884245634079
AppleWatch,"Tim Cook emailed me back. Yesterday I hit a 1,250 day move goal, and wanted to share my success story with him. He emailed me back tonight!",,183,2125,2019-12-06,AAPL,0.02395019121468067,0.8763277530670166,0.09972208738327026
mac,My coworker needed a mouse this morning. I hooked him up.,,86,2065,2019-12-06,AAPL,0.10726858675479889,0.7131916880607605,0.17953969538211823
apple,"Apple Investigating 16-Inch MacBook Pro Popping Sound Issue, Fix Planned in Future Software Updates",,227,1700,2019-12-06,AAPL,0.025767328217625618,0.9356356263160706,0.038596976548433304
AppleWatch,Coffee time. This is the way. ☕️,,60,1026,2019-12-06,AAPL,0.06868430972099304,0.9018627405166626,0.02945289947092533
apple,iPhone SE 2 Might Actually Be Called the iPhone 9,,285,832,2019-12-06,AAPL,0.02344582974910736,0.9343926310539246,0.0421614833176136
AppleWatch,For anyone curious what the Series 5 titanium with the Apple link band looks like. Pretty good match I’d say.,,62,823,2019-12-06,AAPL,0.009133744984865189,0.6065603494644165,0.384305864572525
ipad,"David's hand, via procreate by me (it's so easy for me to multitask between drawing and writing notes during class, it's a game changer for me)",,12,411,2019-12-06,AAPL,0.032948046922683716,0.9223190546035767,0.04473293200135231
ios,"A little feature I discovered accidentally the other day, you can 3-D touch on the call button for extra call options on the dial pad.",,46,270,2019-12-06,AAPL,0.041226018220186234,0.9349664449691772,0.023807497695088387
apple,I made an app that informs you when someone is staring at your screen,,154,2095,2019-12-07,AAPL,0.16081444919109344,0.7953352332115173,0.04385032132267952
apple,I made an app that transforms Notification Center extensions into desktop widgets,,142,1489,2019-12-07,AAPL,0.017641257494688034,0.9254392385482788,0.056919459253549576
AppleWatch,Found my favourite watch face ⌚️,,49,1235,2019-12-07,AAPL,0.027416199445724487,0.8939153552055359,0.07866843044757843
mac,System 7 install disks,,50,1217,2019-12-07,AAPL,0.022359699010849,0.930586576461792,0.04705369472503662
iphone,Apple’s New Subscription Management Prompt Seems to Be Working,,34,591,2019-12-07,AAPL,0.013134783133864403,0.5702868103981018,0.41657838225364685
ipad,Here’s what’s in my iPad tech bag.,,77,528,2019-12-07,AAPL,0.018243707716464996,0.9183163046836853,0.06344002485275269
mac,Is this normal? Who would agree to this? Sorry for the terrible photo.,,54,447,2019-12-07,AAPL,0.4007066488265991,0.3686125576496124,0.23068074882030487
ios,Carrier documents confirm iOS 13.3 will be released next week,,105,270,2019-12-07,AAPL,0.019069984555244446,0.9518743753433228,0.029055697843432426
apple,I created an app to keep track of which shows I've seen or need to see called Television Time,,57,242,2019-12-07,AAPL,0.02069735899567604,0.929545521736145,0.04975716769695282
apple,"We make Spectre, this year's pick of iPhone App of the Year! To celebrate, we're giving away 50 promo codes + AMA about the Apple Event we attended this week! [Promo Saturday]","Hello all! I'm a huge fan of this community and the design half of the duo that makes [Spectre](http://spectre.cam) and [Halide](http://halide.cam/). 

This week we were in Apple where Apple held an event to announce we were one of the Apps of the Year! One day, you're sitting at home working on your little app, the next [you're standing next to Phil Schiller](https://miro.medium.com/max/2400/1*YnpTbEOrTmiVLUwN5AL2EQ.jpeg). Eek. 

To celebrate being the App of the Year for iPhone (we're still a bit speechless) we're giving away 50 promo codes to the app. Just DM me and I will send you one, first come, first serve. 

EDIT: The codes are now out, but I will distribute a few more tomorrow to be fair to everyone. Feel free to DM, we'll have a couple more to send out 😁

Ask us anything about the event and other stuff! [We have a post up here that talks a little bit about it](https://blog.halide.cam/spectre-is-apples-iphone-app-of-the-year-e4ec581b0dc1), with some photos, but we can also answer anything else about it, how we prepared for it, or general questions about our app. Feedback and suggestion are of course also always welcome!",85,229,2019-12-07,AAPL,0.03040100261569023,0.9417002201080322,0.0278987605124712
apple,Mac Pro and Pro Display XDR available to order from December 10th.,,770,2403,2019-12-08,AAPL,0.07886061072349548,0.8921902179718018,0.028949227184057236
apple,Even *I* Can’t Hate It – 16” Macbook Pro 2019 - LinusTechTips Review,,607,1898,2019-12-08,AAPL,0.03432657942175865,0.9209102392196655,0.04476316273212433
apple,‘Apple Card Monthly Installments’ offer 0% iPhone financing - 9to5Mac,,251,1791,2019-12-08,AAPL,0.026165207847952843,0.9136303067207336,0.060204531997442245
mac,Got some great Mac action going on!,,52,1336,2019-12-08,AAPL,0.014064334332942963,0.23178361356258392,0.7541520595550537
mac,This MacBook is pretty nice (16 inch),,107,1112,2019-12-08,AAPL,0.020637255162000656,0.5115257501602173,0.4678369462490082
iphone,Carrier information suggests iOS 13.3 and watchOS 6.1.1 will arrive next week.,[deleted],225,1109,2019-12-08,AAPL,0.0234636552631855,0.9202741384506226,0.05626215040683746
AppleWatch,Made a new strap for my Series 5,,71,949,2019-12-08,AAPL,0.019281607121229172,0.8925582766532898,0.08816016465425491
AppleWatch,Fall detect worked,"I was working on the farm the other day and found an alpaca with her head stuck in a fence. To free her I had to straddle her back as she was sitting down, I had to drag her body to release her long neck out of the fence.

Once her head was free she jumped to her feet and launched me in the air. My arms flailed around and I crashed to the ground.  The watch started its emergency sounds and was getting ready to call for help so I cancelled it.  The watch asked me to confirm it was a real fall and that I was ok.

It's nice to know it works.",61,608,2019-12-08,AAPL,0.049668602645397186,0.9073903560638428,0.04294101893901825
apple,"I just released a huge update to my free Apple Watch Twitter app. Now it's available in 14 languages, has complications, true endless scrolling, and way more! MacStories described it as ""leading the charge"" in full-featured Apple Watch apps!",,21,520,2019-12-08,AAPL,0.018549349159002304,0.9212164282798767,0.06023421511054039
mac,I think my old MacBook Pro 2010 needs a new battery!,,70,511,2019-12-08,AAPL,0.013917720876634121,0.8923044800758362,0.09377774596214294
mac,This is not a render nor is it edited. Plain iPhone XR camera with the native Camera app,,230,2796,2019-12-09,AAPL,0.024645276367664337,0.9423081278800964,0.033046625554561615
apple,"$73K in Apple products stolen from Target, iPad thief chased by 71-year-old on the Apple Crime Blotter",,294,2658,2019-12-09,AAPL,0.2606549561023712,0.704345166683197,0.034999873489141464
apple,Apple to Speak at CES Conference for First Time in Decades,,170,1624,2019-12-09,AAPL,0.019462917000055313,0.9100491404533386,0.07048796117305756
iphone,Want to thank Apple,"A couple of years ago, BatteryGate (is it called that?) made me switch away from the Apple ecosystem and on to Android. I bought a OnePlus that was cheaper, better camera, amazing battery etc etc.

Fast forward to a couple of weeks ago, and my work upgraded my work phone to an XR 64GB (yes, in end 2019).

Amazingly, I picked it up and turned it on, and completely fell in love with it. My OnePlus 6 bested the XR in literally every category on paper(more RAM, more megapixels, bigger battery, more space etc etc etc), but couldn’t come close to the sheer joy and beauty of using an iPhone.

I spent a week getting all my apps and photos back, setting up iCloud, buying an Apple Watch (going full Apple, basically), and haven’t looked back yet. I still get a little burst of happiness every time I look at my phone, which is several times an hour.

Just in case anyone’s thinking of making the jump from Android to Apple - and the XR is the lowest end model from a year ago...",503,1259,2019-12-09,AAPL,0.03009231761097908,0.9086291790008545,0.06127847731113434
iphone,r/iPhone Has Reached 2 Million Subscribers!,"On behalf of the entire r/iPhone moderation team, we would like to thank everyone who subscribed and to everyone who posts and comments here! 

Here's to the next million!",69,981,2019-12-09,AAPL,0.01514467690140009,0.9214498996734619,0.06340542435646057
apple,The Apple TV remote is so bad that a Swiss TV company developed a normal replacement,,361,779,2019-12-09,AAPL,0.01794491522014141,0.8339745402336121,0.14808058738708496
AppleWatch,FREE Apple Watch Games,"It's my birthday on December 11th, so I'm going to make all my games free for 48hrs. If you've never tried a game on your Apple Watch now's your chance. If you enjoy any of them please leave a review it would help me allot. Thanks!

Mini Watch Games 24-in-1 [https://apps.apple.com/us/app/id1062475106](https://apps.apple.com/us/app/id1062475106)

Spaceholes! [https://apps.apple.com/us/app/id1478542318](https://www.google.com/url?q=https%3A%2F%2Fapps.apple.com%2Fus%2Fapp%2Fid1478542318&amp;sa=D&amp;sntz=1&amp;usg=AFQjCNEE64BgzXtws3aUWIyOiKc3yQ1G2A)

Tube Twister [https://apps.apple.com/us/app/tube-twister/id1455709958](https://apps.apple.com/us/app/tube-twister/id1455709958)

Z Room [https://apps.apple.com/us/app/z-room/id1268376219](https://apps.apple.com/us/app/z-room/id1268376219)

Driftly [https://apps.apple.com/us/app/driftly/id1447996272](https://apps.apple.com/us/app/driftly/id1447996272)

Watch Wheels [https://apps.apple.com/us/app/watch-wheels/id1239156884](https://apps.apple.com/us/app/watch-wheels/id1239156884)

&amp;#x200B;

https://preview.redd.it/jbk6qfzlpk341.jpg?width=2100&amp;format=pjpg&amp;auto=webp&amp;s=3fc3cf846f68116ac89105cf5f9ee294f4a2c77e",312,773,2019-12-09,AAPL,0.01977095939218998,0.9087209105491638,0.07150816917419434
mac,"This is not a render, nor is it edited. Plain iPhone 8 camera with the native Camera app.",[deleted],100,746,2019-12-09,AAPL,0.02576754242181778,0.9426962733268738,0.03153618425130844
apple,Apple’s Safari privacy features are driving down prices for advertisers at the cost of accuracy,,118,530,2019-12-09,AAPL,0.032393988221883774,0.9312407970428467,0.036365166306495667
apple,"Analyst: Apple cutting iPhone 11 Pro production by 25%, consumers focused on 5G iPhone 12 lineup",,246,522,2019-12-09,AAPL,0.0958276093006134,0.7896222472190857,0.1145501360297203
apple,Mac Pro Unboxing &amp; Second Impressions: The Power is Back! - MKBHD,,1246,2811,2019-12-10,AAPL,0.021293357014656067,0.8613728880882263,0.11733375489711761
AppleWatch,Pyrrhic victory,,25,2682,2019-12-10,AAPL,0.0507204495370388,0.9151550531387329,0.034124407917261124
apple,Apple Card offers 6% cash back on Apple Store purchases until 12/31,,406,2385,2019-12-10,AAPL,0.015996042639017105,0.39090296626091003,0.5931009650230408
iphone,Apple Card's 24-Month Interest-Free iPhone Installment Plan Available Starting Today,,241,1175,2019-12-10,AAPL,0.01330901961773634,0.9305940866470337,0.05609685182571411
ipad,My wife’s work in progress.,,77,1161,2019-12-10,AAPL,0.03938409686088562,0.9044256806373596,0.05619015917181969
apple,Apple has more job openings right now than it ever has,,156,1115,2019-12-10,AAPL,0.09596475213766098,0.8274351358413696,0.07660005986690521
apple,"Apple releasing iOS 13.3, watchOS 6.1.1, and tvOS 13.3 today, here's what's new",,218,1044,2019-12-10,AAPL,0.02520301192998886,0.9263229966163635,0.048474013805389404
AppleWatch,My watch really wants to tell me that I’m going deaf,,67,1029,2019-12-10,AAPL,0.04144980013370514,0.8259279131889343,0.13262227177619934
mac,Who says you can’t easily and affordable upgrade your MBP storage...,,115,1023,2019-12-10,AAPL,0.02502225898206234,0.8908604383468628,0.0841173306107521
apple,Apple’s Pro Display XDR With Nano-Texture Can Only Be Cleaned With Special Apple-Provided Cloth,,153,507,2019-12-10,AAPL,0.01875166781246662,0.9215083122253418,0.05974000692367554
mac,Finally two chrome tabs,,82,3041,2019-12-11,AAPL,0.020943861454725266,0.8357973694801331,0.14325881004333496
apple,Apple accused of monitoring employee text messages in lawsuit against ex-chip exec - ex-Apple employee Gerard Williams argued Apple illegally collected his private messages to build its case against him,,344,2647,2019-12-11,AAPL,0.8380606174468994,0.14008456468582153,0.021854810416698456
iphone,"2G, 3G, 4, 5",,146,1975,2019-12-11,AAPL,0.03872862085700035,0.9170150756835938,0.04425638169050217
mac,"Today, got a promotion, pay-rise, and a new work Mac!",,118,1612,2019-12-11,AAPL,0.020028095692396164,0.7402414679527283,0.23973046243190765
apple,"thank you apple, you have great fucking security",i have 2fa and suddenly got [2 alerts](https://imgur.com/gallery/WRLMstp) of sign in requests from two different locations **at the same time.** i pressed dont allow on them and my account was locked. i verified myself and signed out from all my devices to ensure no one is in my account. in just 2 minutes i went from having a coordinated attack on my ass to having password changed and my account signed out of all devices. i was so shocked when i got the alerts but thankfully everything went well. i fucking love these security features. thank you apple.,202,1588,2019-12-11,AAPL,0.05571504309773445,0.9008554220199585,0.043429501354694366
AppleWatch,Stone Sport Band,[deleted],52,1106,2019-12-11,AAPL,0.04516665264964104,0.8923013806343079,0.06253202259540558
apple,"Celebrating the difficult; the release of CrossOver 19- Crossover 19 allows you to run 32-bit Windows programs on Catalina despite Catalina not supporting 32-bit programs by using a 64-bit wrapper with 32-bit code, which is really impressive.",,202,998,2019-12-11,AAPL,0.025010723620653152,0.910839319229126,0.06414999812841415
ios,"You’ve got to love this about Apple! Got my 5S five years back, and it still receives updates. Damn!",,109,720,2019-12-11,AAPL,0.03234795480966568,0.9269043803215027,0.04074767604470253
apple,Kuo: Next year’s 5G iPhones with redesigned metal frame won’t have major price increase,,195,591,2019-12-11,AAPL,0.015224012546241283,0.8608679175376892,0.12390800565481186
apple,Rewound is a new app that turns your iPhone into an iPod,,85,448,2019-12-11,AAPL,0.012660524807870388,0.8654832243919373,0.12185625731945038
apple,"AirPods to hit quarterly sales of $4B, surpassing peak iPod sales",,805,5802,2019-12-12,AAPL,0.05416543036699295,0.2925407886505127,0.653293788433075
mac,Mac Pro(fessional),,333,3073,2019-12-12,AAPL,0.04157153517007828,0.9130953550338745,0.045333102345466614
apple,Apple uses Micron’s Cheapest ECC RAM in the Mac Pro,,580,2180,2019-12-12,AAPL,0.030249999836087227,0.9410396218299866,0.028710365295410156
iphone,‘iPhone 11’ is the 5th most searched term globally on Google in 2019.,[deleted],165,1732,2019-12-12,AAPL,0.032983992248773575,0.8288071751594543,0.13820880651474
