subreddit,title,selftext,num_comments,score,created_utc,stock/sector,neg,neu,pos
medicine,Hospital food around the world.,,63,409,2014-09-01,PHARMA,0.03830825537443161,0.8854619264602661,0.07622983306646347
Health,"Drug company admits it concealed debilitating side effects, fatalities from government regulators",,14,92,2014-09-01,PHARMA,0.6210771203041077,0.3563472628593445,0.02257557585835457
medicine,"To save lives, let addicts inject: It's time for Supervised Injection Facilities (SIF) in the USA!",,66,87,2014-09-01,PHARMA,0.026130497455596924,0.930730938911438,0.04313858970999718
medicine,"What's the most advanced procedure you could perform with the materials you have in your home ""medicine cabinet""?",I was talking with some colleagues the other day and this topic came up.. Points for creativity!,48,54,2014-09-01,PHARMA,0.019193708896636963,0.903074324131012,0.0777318924665451
Health,Why Doctors Are Sick of Their Profession,,22,44,2014-09-01,PHARMA,0.9176036715507507,0.07079043239355087,0.011605869978666306
Health,A Call for a Low-Carb Diet,,30,44,2014-09-01,PHARMA,0.03608949854969978,0.9335504770278931,0.030359996482729912
Health,Best Snacks For Weight Loss - Healthy Snacks - Harper's BAZAAR Magazine,,5,36,2014-09-01,PHARMA,0.06711525470018387,0.8859091401100159,0.04697561636567116
Health,Gout &amp; Rickets on the Rise: Public health expert warns of rise in Tudor-era diseases in Britain due to poor diet,,1,20,2014-09-01,PHARMA,0.08959402143955231,0.8355317711830139,0.0748741552233696
medicine,Legal (board stuff) advice,"When I was younger (18 years old) I was charged with a felony for attempted promotion of a harmful drug. I hired the best lawyer I could get, and since the evidence against me was weak (I really hadn't done anything wrong) I was offered a deferred sentence with 5 years of probation. During that time, I did not even get pulled over once.
I live in the state of Hawaii and I am wanting to apply for medical school. I was always under the impression that because I completed the terms, the state dropped the charges, and I got my record expunged it was done and over with like it never happened.
I am very passionate about medicine and do really well in college, however I am now afraid that applying to medical school will be futile as I may never be able to get my DEA license?
Does anyone have any experience in this matter? I have a friend who swears his friend has a cocaine felony still on his record, but I find that hard to believe.
Any advice would be much appreciated, or any direction I could turn to for more advice",22,15,2014-09-01,PHARMA,0.058878496289253235,0.9017626047134399,0.03935891017317772
Health,A terrific web guide for avoiding toxic products by the Environmental Health Association of Nova Scotia.,,0,13,2014-09-01,PHARMA,0.042102962732315063,0.9224926233291626,0.03540442883968353
medicine,"People who avoid carbohydrates and eat more fat, even saturated fat, lose more body fat and have fewer cardiovascular risks than people who follow the low-fat diet",,89,202,2014-09-02,PHARMA,0.0567241832613945,0.9006803631782532,0.04259546846151352
Health,"How the Industrial Revolution Ended Naps - Believe it or not, before the Industrial Revolution, people used to take a ""1st sleep"" &amp; ""2nd sleep"" everyday.",,17,165,2014-09-02,PHARMA,0.045120179653167725,0.921074628829956,0.03380514308810234
Health,Drinking tea correlated with 24 percent reduction in non-cardiovascular mortality,,20,95,2014-09-02,PHARMA,0.06805653870105743,0.7301691770553589,0.20177428424358368
Health,We Live in a World Where Your Insurer Doesn’t Care That it Charges 2 Prices for 1 Drug,,5,45,2014-09-02,PHARMA,0.062846340239048,0.9106305241584778,0.026523170992732048
Health,"A Bionic Eye That Restores Sight - By bridging the gap between eye and brain, a new device has the capacity to help the blind regain their vision.",,1,44,2014-09-02,PHARMA,0.009938906878232956,0.6991474032402039,0.29091373085975647
Health,Men who exercise less are more likely to wake up to urinate,,10,42,2014-09-02,PHARMA,0.6690908670425415,0.3043036460876465,0.026605408638715744
Health,The Wealth Gap Between Rich And Poor Americans Is Affecting Our Diets,,1,41,2014-09-02,PHARMA,0.18999779224395752,0.7475190758705139,0.062483128160238266
medicine,The result of a 99 hour hack project. Using the FDA database to display adverse reactions to drugs split by sex.,,11,36,2014-09-02,PHARMA,0.01545633189380169,0.91703200340271,0.06751163303852081
Health,An hour of moderate exercise a day may decrease heart failure risk,,5,25,2014-09-02,PHARMA,0.8396653532981873,0.04561971500515938,0.11471494287252426
medicine,Rookie versus veteran doctors - heuristics used,"On KevinMD's blog, in an article titled ""Lying to receive pain medications hurts patients in true pain,"" Dr Kenneth Lin writes, ""My patients lie to me every day....""





Well, this morning someone tried to fake a disability and I totally missed it. I was in a rush. Luckily, a nurse caught my error - she has over 30 years nursing experience. Which leads me to wonder - 


 



  - What kind of ""disabilities"" easily fool rookies like myself but are difficult to get past physicians with considerable experience? What heuristics do such veteran doctors use to tell if an individual is faking a disability?




   -  Are there any articles that talk about how a physician can identify whether or not a patient is faking a disability?",21,24,2014-09-02,PHARMA,0.05833816155791283,0.9085773825645447,0.03308449685573578
Health,"CVS stops selling tobacco, offers quit-smoking programs",,52,265,2014-09-03,PHARMA,0.10353648662567139,0.8599486351013184,0.03651485592126846
medicine,"How they remove things from people's anus in the ER, plus slide show of the insane crap people put up there. (NSFW)",,51,165,2014-09-03,PHARMA,0.07230441272258759,0.906055212020874,0.021640390157699585
medicine,Sorry to the Orthos but this is hilarious,,24,131,2014-09-03,PHARMA,0.38115474581718445,0.5648784637451172,0.053966786712408066
medicine,Intensity of medical residency may affect future practice style: Residents that trained in a low intensity region were more likely to select the appropriately conservative and appropriately aggressive management.,,12,57,2014-09-03,PHARMA,0.051153797656297684,0.8826892375946045,0.06615697592496872
medicine,A Good Death -- Ebola and Sacrifice,,2,54,2014-09-03,PHARMA,0.05241907760500908,0.8722313046455383,0.07534962147474289
pharmacy,"CVS Stops Tobacco Sales Today, Changes Name To Reflect New Era",,39,42,2014-09-03,PHARMA,0.06491702795028687,0.9049065709114075,0.03017643466591835
Health,"Double mastectomies on the rise, but surgery doesn't boost breast cancer survival rate",,1,41,2014-09-03,PHARMA,0.018356701359152794,0.6145995855331421,0.36704370379447937
medicine,What is it like to practice in a rural community? How is it different from practicing in a suburban area?,"Hi everyone, 

1) what are the advantages/disadvantages to practicing in rural medicine?

2) What is your typical day as a doctor in a rural area like? How is it different from that of a city doctor?

3) Do you ever work ""on the field"" or is that something that is only reserved for 3rd world countries?

4) I have heard that rural docs are always on call and that ""you are the doc"" . .. meaning that you get to do many things. On the other hand, they say that rural medicine is a bit slower than city. Which one is true? Why?

5) What should I consider before considering going to a medical school in a rural area?

6) What specific book/article/website that would help me to better understand what the challenges/life of a rural docs?",15,38,2014-09-03,PHARMA,0.02030133455991745,0.9132654666900635,0.06643320620059967
Health,"The Austin, TX clock tower shooter left a suicide note saying he felt that there was something wrong with his brain as he knew what he was doing was wrong and couldn't stop it. An autopsy revealed a brain tumor pressing on the amygdala.",,3,31,2014-09-03,PHARMA,0.22078345715999603,0.7409149408340454,0.03830157220363617
Health,Taxes and subsidies could encourage healthier diet and lower healthcare costs: Researchers write that policies taxing nearly all packaged foods and subsidizing healthier foods could both help people make meaningful dietary changes and substantially reduce health care costs,,14,29,2014-09-03,PHARMA,0.012251065112650394,0.7427735328674316,0.24497537314891815
Health,Health Experts Are Worried That More Kids Are Heading Back To School Without Their Vaccines - The number of parents opting their kids out of vaccines is on the rise in several states.,,68,126,2014-09-04,PHARMA,0.3467699885368347,0.5919418334960938,0.061288099735975266
Health,"People who avoid carbohydrates and eat more fat, even saturated fat, lose more body fat and have fewer cardiovascular risks than people who follow the low-fat diet that health authorities have favored for decades, a major new study shows.",,12,100,2014-09-04,PHARMA,0.01579144224524498,0.7781071066856384,0.2061014473438263
medicine,Mental Healthcare: Time to End the Stigma,,4,91,2014-09-04,PHARMA,0.12953296303749084,0.8394050598144531,0.031062008813023567
Health,Woman Who's Just 12 Weeks Pregnant Charged with Child Endangerment - The case illustrates how states are blurring the lines about exactly when personhood begins in the eyes of the law.,,8,71,2014-09-04,PHARMA,0.07899463176727295,0.8905848264694214,0.03042057901620865
medicine,How long can a brain dead person's body be maintained on mechanical support?,"I was thinking about the Jahi McMath case from December where the girl was declared brain dead, but the family fought to keep her on mechanical support. As far as I can tell from her Facebook page and a Google news search, she is still on support as of a few weeks ago. What condition would her body be in? Would it be any different than a person in a persistent vegetative state?

Edit: I am aware of the Terry Shiavo case. She was in a persistent vegetative state, which is severe brain damage, but not brain dead. I was more interested in the physiologic changes that occur with complete loss of brain function.",17,47,2014-09-04,PHARMA,0.14585457742214203,0.8294395208358765,0.024705877527594566
Health,"More than 800,000 people each year worldwide commit suicide – around one person every 40 seconds - with many using poisoning, hanging or shooting to end their own lives, the World Health Organization (WHO) said on Thursday.",,0,47,2014-09-04,PHARMA,0.35959485173225403,0.6151800155639648,0.025225156918168068
Health,"Drinking as few as two sugary sodas per week can double your chances for pancreatic cancer, the deadliest of all cancers.",,5,41,2014-09-04,PHARMA,0.04756433516740799,0.9114274978637695,0.04100819677114487
Health,This Map Shows Why People are Freaking Out About Ebola's Arrival in Senegal - Deadly contagion + international transit hub = bad news.,,1,40,2014-09-04,PHARMA,0.7034167647361755,0.2742637097835541,0.022319495677947998
Health,Half of young British women can't locate vagina on a diagram: survey - NY Daily News,,10,40,2014-09-04,PHARMA,0.077508844435215,0.8776167035102844,0.044874489307403564
Health,"E-Cigs Could be a Gateway to Cocaine Addiction, Says Study that Misses the Point - This is the study politicians will turn to when they push for strict regulations on e-cigarettes.",,6,32,2014-09-04,PHARMA,0.11309995502233505,0.8172337412834167,0.06966626644134521
medicine,Go ahead....make me feel old.,"So a bright and shiny medical student on his first day of clerkship shows up in the emergency.
Last name looks familiar.  ""Any relation?"" I ask.   ""My dad"" he says.

So now I'm teaching my medical school classmate's children.  OK, I'm old.",62,211,2014-09-05,PHARMA,0.041498713195323944,0.8924747109413147,0.06602663546800613
Health,15 houseplants to improve indoor air quality.,,9,111,2014-09-05,PHARMA,0.014391486532986164,0.400613009929657,0.584995448589325
Health,Your Brain On Beer vs Coffee [infographic],,7,101,2014-09-05,PHARMA,0.019794819876551628,0.9095721244812012,0.07063311338424683
Health,When Feces Is the Best Medicine.,,20,57,2014-09-05,PHARMA,0.01784672774374485,0.7479044795036316,0.2342488020658493
Health,"Is Weed the Secret to Beating Opiate Addiction? - In the U.S., 46 people die each day from opioid overdose—&amp; that number isn’t doing anything but growing. Could marijuana be what’s missing from addicts’ recovery?",,26,52,2014-09-05,PHARMA,0.054015494883060455,0.8974400162696838,0.048544466495513916
Health,"Warnings over e-cigarettes are alarmist - and increasing their use could save many lives, researchers have said.",,2,47,2014-09-05,PHARMA,0.01785595901310444,0.7627525925636292,0.21939149498939514
Health,"Potassium-rich foods cut stroke, death risks among older women: Postmenopausal women who eat foods higher in potassium are less likely to have strokes and die than women who eat less potassium-rich foods, according to new research",,6,39,2014-09-05,PHARMA,0.025234486907720566,0.8902146220207214,0.08455094695091248
Health,Thousands Converge on U.S. Capitol to Demand Mental Health Care Reform - Advocates from across the country hope to reinvigorate the movement for mental health care reform.,,0,30,2014-09-05,PHARMA,0.016193455085158348,0.7774834036827087,0.20632314682006836
Health,Lack of sleep may not kill you but it might shrink your brain.,,2,27,2014-09-05,PHARMA,0.5777761936187744,0.26286670565605164,0.15935717523097992
Health,Study: Parents Increasingly Unable To Identify Obesity In Their Own Children,,2,23,2014-09-05,PHARMA,0.9162086844444275,0.07167194038629532,0.012119377963244915
medicine,Dr. Oz subway poster. Look closely for excellent graffiti.,,69,352,2014-09-06,PHARMA,0.02303261309862137,0.8653320074081421,0.11163539439439774
Health,Dissed by Her Doctor for Wanting HIV Protection - A pill that can give women control over their bodies &amp; sexual choice is coming under criticism for encouraging risky behavior. Sound familiar?,,21,107,2014-09-06,PHARMA,0.041714657098054886,0.7962573766708374,0.16202795505523682
medicine,"Doctors of Reddit, how much do you sleep?","There's this stereotype that doctors can't/don't sleep much because they're so busy and stressed.    
As a 1st year med student, I was wondering how much of it is true",152,86,2014-09-06,PHARMA,0.16668163239955902,0.7999119162559509,0.03340650349855423
Health,"The blood of patients who recover from Ebola should be used to treat others, the World Health Organization has announced.",,10,67,2014-09-06,PHARMA,0.022892676293849945,0.8749983310699463,0.10210903733968735
Health,"WHO: Halting Ebola Will Take 6 Months, $600 Million – UN's senior leadership on the Ebola virus disease say they can stop the outbreak in West Africa within 6-9 months, but only if a “massive” US$600 million global response is implemented.",,14,51,2014-09-06,PHARMA,0.036281242966651917,0.8957379460334778,0.0679808035492897
Health,"Ebola: How bad can it get? ""I've just projected about five weeks into the future and if current trends persist we would be seeing not hundreds of cases per week, but thousands of cases per week and that is terribly disturbing.” Dr Christopher Dye, WHO director of strategy, told the BBC",,2,50,2014-09-06,PHARMA,0.9022592306137085,0.07952740788459778,0.018213434144854546
Health,The ‘Angelina Jolie Effect’: More Women Now Considering Similar Steps to Prevent Breast Cancer - Genetic counseling among women doubled 6 months after actress Angelina Jolie wrote about her double mastectomy in a New York Times op-ed.,,8,34,2014-09-06,PHARMA,0.026364902034401894,0.9173742532730103,0.056260786950588226
pharmacy,"What is your biggest pharmacy ""pet peeve""?",,222,34,2014-09-06,PHARMA,0.013905475847423077,0.877704381942749,0.10839008539915085
Health,Illinois hospital tells children not to visit due to mystery virus | Daily Digest News,,0,30,2014-09-06,PHARMA,0.05330032482743263,0.9127130508422852,0.03398662060499191
Health,CNN's ranks world's 10 healthiest cities ... Havana made the list,,3,21,2014-09-06,PHARMA,0.027902573347091675,0.8852877616882324,0.08680964261293411
medicine,39 year old nursing aide and single mother gets 12 to 18 months in prison because she gave her daughter an abortion pill since the closest abortion clinic was too far away and her daughter did not have health insurance,,103,173,2014-09-07,PHARMA,0.41038548946380615,0.5430722236633301,0.04654228687286377
Health,Unidentified Respiratory Virus Likely to Hit Kids Across Country - ABC News,,10,71,2014-09-07,PHARMA,0.5101240873336792,0.45357951521873474,0.03629637882113457
pharmacy,ProAir ethanol content,"I walked into my pharmacy for my shift and the pharmacist and a technician asked me, based on a customer question earlier that they had said they'd have to get more information for, ""Do you think ProAir has enough alcohol in it to make someone fail a breathalyzer that they have to blow into to start their car?""

I was like, ""I don't think so,"" because I didn't think ProAir contained alcohol at all...the pharmacist and technician basically said ""That's what we thought, too"" but asked if I could look it up and check package inserts to be sure. 

Sure enough, I found out that ProAir does, in addition to its HFA propellant, contain ethanol. Is it enough to make someone fail an ignition interlock device breathalyzer, I have no idea.

A little while later, out of curiosity, I opened up the package insert for Ventolin, and found out that it was, in fact, alcohol-free. Its only excipient is the propellant. So, an interesting difference between ProAir and Ventolin is that Ventolin is alcohol-free but ProAir is not.

I thought this might be interesting to some of you, and wanted to see if any of you had heard of ProAir-breathalyzer ""interactions.""",9,49,2014-09-07,PHARMA,0.04344861954450607,0.9287189245223999,0.0278325192630291
Health,Meditation as immunostimulant,,2,28,2014-09-07,PHARMA,0.049429215490818024,0.9140214323997498,0.036549318581819534
Health,Research Finds No Association Between Wearing a Bra and Breast Cancer.,,6,28,2014-09-07,PHARMA,0.04646773636341095,0.8444003462791443,0.10913196951150894
pharmacy,The issue of retail pharmacies getting away with medical errors for speed and metrics.,"I've been working at a pharmacy long enough to realize that upper management encourages employees to work at dangerously high speeds that will (and does) result in medical errors.

Fortunately, many of these medical errors don't always cause harm to the patient in question and from what I can gather on the net, the individual must have been harmed for any legal action to be taken against the pharmacy.

Upon talking to several retail pharmacists, they said that the pharmacists never get in trouble because it has to be intentional and if they did know about it after the fact, they just have to report it and they will be in the clear.

So my issue is, senior management is pushing employees to work at ridiculous speeds *knowing* that they can get away with any mistakes because it was unintentional ...

Am I the only one who noticed this or have others been bothered by this too? A friend of mines said they have 9 seconds to approve or decline a script for accuracy at her company. That's not enough time to check patient profile for interactions, allergies, verify dangerous dosage with doctors, etc. It's madness.",29,23,2014-09-07,PHARMA,0.17463889718055725,0.8035156726837158,0.021845422685146332
pharmacy,BBC Reports: First arrest made over Massachusetts Compounding Pharmacy Meningitis Outbreak.,,1,9,2014-09-07,PHARMA,0.20530933141708374,0.7658711075782776,0.028819523751735687
pharmacy,Vitamin D supplementation: dosage effectiveness weekly vs. daily,"I'm trying to find information on dosage effectiveness for vitamin D supplementation, specifically whether there is a significant difference between a patient taking 50000iu/week in a single dose vs 50000iu/week split out evenly over 7 doses (1 dose per day). 

Google isn't getting me anything I'm finding useful. If you don't have a source but have search terms that might be helpful, please let me know.",21,8,2014-09-07,PHARMA,0.029335936531424522,0.9289201498031616,0.04174390062689781
medicine,"Why Doctors Are Sick of Their Profession American physicians are increasingly unhappy with their once-vaunted profession, and that malaise is bad for their patients",,5,8,2014-09-07,PHARMA,0.8612184524536133,0.12299739569425583,0.01578414812684059
pharmacy,"Retail Pharmacists, what tips can you give to help people to get their Flu shot?",I work at a Rite Aid and they have been pushing flu vaccines for the past month. they want us to give  at least 8 shots a day. Are there any tips you can give that could help make reaching the goal a little easier?,27,7,2014-09-07,PHARMA,0.01581967994570732,0.8258825540542603,0.15829777717590332
Health,Watch the U.S. quit smoking over 40 years,,25,118,2014-09-08,PHARMA,0.02721467986702919,0.9166897535324097,0.05609549582004547
Health,We need shrinks in hospital emergency rooms,,13,107,2014-09-08,PHARMA,0.1972207874059677,0.7624722123146057,0.04030701145529747
medicine,Something we don't talk about enough and as a trainee I myself have struggled in silence.,,11,82,2014-09-08,PHARMA,0.4250721335411072,0.34547051787376404,0.22945734858512878
Health,"Police are Failing America's Disabled - 15% of all 911 calls involve a person with physical or mental disability. For these people, unnecessary police violence is an all to frequent reality.",,8,77,2014-09-08,PHARMA,0.734912097454071,0.24536292254924774,0.019724968820810318
Health,Pennsylvania mother who gave daughter abortion pill gets prison,,1,44,2014-09-08,PHARMA,0.21202288568019867,0.6442661881446838,0.1437109112739563
Health,"Joan Rivers’ Death Raises Questions About Outpatient Care Centers - The comedien apparently went into cardiac arrest while undergoing a procedure at an outpatient center, &amp; had to be transported to a hospital for emergency care",,8,31,2014-09-08,PHARMA,0.24318628013134003,0.7337324619293213,0.023081202059984207
Health,Each Day Spent in Hospital Increases Drug-Resistant Infection Risk 1% - Longer hospital stays increase the risk of some nasty infections,,1,26,2014-09-08,PHARMA,0.6676559448242188,0.2627243101596832,0.06961972266435623
Health,Bottle feeding changes infant's immune system,,0,19,2014-09-08,PHARMA,0.20281237363815308,0.747820258140564,0.04936736449599266
Health,Don’t Take Your Vitamins,,13,19,2014-09-08,PHARMA,0.07261188328266144,0.8923760652542114,0.03501204028725624
Health,CDC Retesting Potential Ebola Case at Miami Hospital,,0,18,2014-09-08,PHARMA,0.030859393998980522,0.923804759979248,0.045335859060287476
Health,"Male Birth Control, Without Condoms, Will be Here by 2017 - Vasalgel, a reversible, non-hormonal polymer that blocks the vas deferens, is about to enter human trials.",,164,686,2014-09-09,PHARMA,0.020004481077194214,0.9039995670318604,0.07599598914384842
medicine,D.E.A. to Allow Return of Unused Pills to Pharmacies,,20,83,2014-09-09,PHARMA,0.032376278191804886,0.93438720703125,0.03323649987578392
pharmacy,CVS changed their name again?,,2,59,2014-09-09,PHARMA,0.1335616558790207,0.8356268405914307,0.030811507254838943
Health,Free HPV vaccine causes 61% drop in female genital warts in Australia,,0,37,2014-09-09,PHARMA,0.14763931930065155,0.8069024085998535,0.04545830562710762
medicine,What industry do you think healthcare stands to learn the most from?,"It seems things like lean six sigma (from manufacturing), checklists (from airlines), and customer experience (from Disney) have all been incorporated at this point. What other things from other industries do you think would benefit healthcare?",37,37,2014-09-09,PHARMA,0.012893184088170528,0.8724073171615601,0.11469950526952744
medicine,Here's a subtle indication of medical corruption,,22,34,2014-09-09,PHARMA,0.04350246861577034,0.827274739742279,0.1292228102684021
pharmacy,DEA to allow controls to be returned to pharmacies,,31,24,2014-09-09,PHARMA,0.03192661330103874,0.9094716310501099,0.05860178917646408
medicine,"ECG Response: September 9, 2014 -- 130 (11): 923 --",,2,15,2014-09-09,PHARMA,0.026880579069256783,0.9137716889381409,0.05934770405292511
medicine,Nice short clip showing how blood flows in one direction in veins,,0,14,2014-09-09,PHARMA,0.02219400741159916,0.9216600656509399,0.05614595487713814
medicine,"Docs who switched into another specialty, I need your help.","Docs of reddit, I am a PGY-1 in pathology, Ive realized I really miss patients and that I do not enjoy the reading in pathology like I thought I would. I am considering psychiatry. Do you have advice for me as to how to go about switching? Thank you.",8,13,2014-09-09,PHARMA,0.03713923692703247,0.9191409349441528,0.0437198132276535
medicine,"Terminally ill physician writes final, beautiful letter to his patients.",,28,680,2014-09-10,PHARMA,0.03973612189292908,0.8612738847732544,0.09898992627859116
pharmacy,Med student here. Our team rounded with the attending pharmacist for a week on the hospital floors,"And it was awesome. It was like he was the special guest star in a TV serial. It was great watching him and our team's attending interact and discuss the patients, watching both expertise levels complement each other and contribute the care of the patient. I have so much respect for your craft and knowledge, especially in  its contribution to hospital medicine.",24,215,2014-09-10,PHARMA,0.01588231883943081,0.8887284398078918,0.095389224588871
Health,Sleeping pills taken by millions linked to Alzheimer's,,26,154,2014-09-10,PHARMA,0.05379089340567589,0.7917347550392151,0.15447431802749634
medicine,Doctor Has Troubling Amount Of Available Appointment Slots (The Onion),,9,107,2014-09-10,PHARMA,0.03797293081879616,0.9330389499664307,0.028988173231482506
