subreddit,title,selftext,num_comments,score,created_utc,stock/sector,neg,neu,pos
pharmacy,Tell us what practicing pharmacy is like in your country,"One overwhelming impression that I have gotten from my short time on the subreddit is that practicing pharmacy GREATLY differs from country to country. 

In an effort to gain a little more understanding of our global colleagues, write a paragraph explaining what your role entails, including whether you're involved in a community/hospital/other area, clinical &amp; administrative responsibilities, community attitude towards your profession and any other things that you think others may find interesting.

Edit: There have been some great contributions- Thanks! It'd be great to hear more from Europe (especially places like France where there are so many pharmacies) and the UK!",20,26,2014-03-17,PHARMA,0.02491305023431778,0.9151414036750793,0.05994555354118347
Health,"Sugars Found In Tequila May Lower Blood Glucose Levels, Help People Lose Weight",,3,24,2014-03-17,PHARMA,0.057140279561281204,0.09444376826286316,0.8484159111976624
medicine,"""Swinging heart"" 2/2 pericardial effusion",,31,295,2014-03-18,PHARMA,0.019586646929383278,0.9084682464599609,0.07194507122039795
Health,"New study finds 45,000 deaths annually linked to lack of health coverage",,51,185,2014-03-18,PHARMA,0.31489020586013794,0.5877256989479065,0.09738407284021378
Health,Saturated Fats And Heart Disease: No Link Found,,30,82,2014-03-18,PHARMA,0.04380166530609131,0.8594793677330017,0.09671900421380997
medicine,Here's a thread for all us poor souls who didn't match and are now in the SOAP,"This sucks, but I figured this would happen. I'm a PGY2 looking for advanced positions, so yeah it is slim pickings. Tell your story, ask a SOAP related question, or just blow off steam here.",42,45,2014-03-18,PHARMA,0.04281986132264137,0.9175621271133423,0.03961799666285515
medicine,"""Obamacare enrollment tops 5 million""",,11,37,2014-03-18,PHARMA,0.025111360475420952,0.27116602659225464,0.7037225365638733
Health,"The Itch Nobody Can Scratch - A new disease is plaguing thousands, but experts are in conflict over its origins—&amp; whether it exists at all.",,15,37,2014-03-18,PHARMA,0.04831026494503021,0.904922604560852,0.04676717147231102
Health,"Junk food mind control: Researchers have found that if they can get people to pay more attention to a particular type of junk food, they will begin to prefer it—even weeks or months afterwards. Finding suggests a new way to manipulate our decisions and perhaps even encourage us to pick healthy foods",,2,26,2014-03-18,PHARMA,0.015606790781021118,0.8584558367729187,0.125937357544899
medicine,"Seat belts, brakes and tires: A vaccine story",,0,22,2014-03-18,PHARMA,0.04503259435296059,0.8855169415473938,0.06945046037435532
medicine,"Almost all acute respiratory infections have viral causes for which prescribing antibiotics is useless, BMJ study finds",,3,22,2014-03-18,PHARMA,0.034634578973054886,0.9359788298606873,0.02938663400709629
medicine,No evidence that eating saturated fat increased heart attacks and other cardiac events,,7,18,2014-03-18,PHARMA,0.7312381267547607,0.2283589243888855,0.04040294885635376
medicine,G lamblia has such an expressive little face,,11,186,2014-03-19,PHARMA,0.08684974908828735,0.8558211922645569,0.05732902139425278
Health,Your Fat Is Why You're Not As Bright As You Could Be - chemical produced by fat clouds cognitive abilities,,34,186,2014-03-19,PHARMA,0.09151343256235123,0.8588858842849731,0.04960070922970772
medicine,"Physicians now in hospital leadership, how did you get there and what were your motivations?","I've always thought it would be interesting to be a VP or CMO, etc. What are the best ways to go about achieving that goal. Is it worth it?",10,57,2014-03-19,PHARMA,0.015490408055484295,0.8853254914283752,0.09918408840894699
Health,Extended Sleeplessness Leads to Irreversible Brain Damage,,7,33,2014-03-19,PHARMA,0.45563849806785583,0.5192810297012329,0.025080526247620583
Health,"1/2 of Meat Product Samples Contained DNA of Wrong Animals, Council Finds - Leicester, England survey backs up results from other areas, reinforcing fears of widespread meat contamination &amp; mislabelling",,0,22,2014-03-19,PHARMA,0.42214706540107727,0.5419634580612183,0.03588945418596268
medicine,The First Match Screw-up of 2014,"Matched totally where I wanted to.  Didn't even need that little hiccup in the ""system"" to know.  However, I may be the first person in history to rack up a fuck up and violation so fast.  

The decision to work every so often as a paramedic has caught up with me.    


I knew I wasn't ""supposed"" to work even if only 2x a month on some weekend nights, but my Medical Director at my squad was just awesome, and understood how bad I was for cash.  I always got work a district of ours furthest away from the school.  Never in 4 years did I even come close to getting caught.  Until now.  

At least I get to stay in school and graduate, however, the price for that benefit is the *Powers That Be* will ""give a full update"" to where I matched, and let them know about my ""extra and obviously beneficial clinical experience"".  

Meaning because I never mentioned I have an additional 4 years experience as a paramedic during interviews, I'm fucked.  It's still up in the air whether I will add a nice little violation to my resume, however, either way, I'm fucked.  

At least no one in my school knows.  I can graduate sans public humiliation.",55,18,2014-03-19,PHARMA,0.0712948739528656,0.891905665397644,0.03679947927594185
Health,Tests of 25 Mainers find high levels of chemicals used in plastics,,1,18,2014-03-19,PHARMA,0.10218392312526703,0.7679762840270996,0.12983979284763336
Health,Gut bacteria turn dark chocolate 'healthy',,2,16,2014-03-19,PHARMA,0.09621550887823105,0.8717710971832275,0.032013338059186935
Health,Apple's Upcoming Health App Is the Start of Something Huge,,4,15,2014-03-19,PHARMA,0.01956585794687271,0.8765778541564941,0.10385627299547195
pharmacy,Any interest in a pre-pharmacy subreddit?,"I just wondered if there was anyone else out there wanting a pre-pharm subreddit. I don't want to inundate the seasoned RPh with redundancy, but I am trying to soak up any and all info I can get my hands on. I am hopefully applying this summer and would love to discuss things with people in the same situation.",16,15,2014-03-19,PHARMA,0.021176137030124664,0.9215987920761108,0.0572250597178936
medicine,The life of a pediatric resident last night in the United States.,,136,316,2014-03-20,PHARMA,0.04811316728591919,0.877529501914978,0.07435730844736099
Health,"Bill Clinton's doctor said ""his heart today is much younger than it was even 10 years ago” because of vegan lifestyle",,181,204,2014-03-20,PHARMA,0.023392900824546814,0.889271080493927,0.08733600378036499
Health,The EPA: Tobacco as a radiation source [Polonium-210 and Lead-210] - Radioactivity may be one of the key factors in lung cancer among smokers.,,5,96,2014-03-20,PHARMA,0.027423424646258354,0.9378949999809265,0.03468158841133118
pharmacy,Not a single spot on my shirt or tie.,,13,89,2014-03-20,PHARMA,0.027003170922398567,0.942692756652832,0.030304066836833954
medicine,Posting guidelines - please read first,,13,83,2014-03-20,PHARMA,0.023549184203147888,0.9474387764930725,0.02901199273765087
medicine,Wife wants to store toddler's daily vitamin in same daily pill container as the dog's anti-seizure meds. Please help in explaining why this is or isn't wrong.,"My wife wants to store the week's daily pills for my toddler's daily vitamin in the same compartment as the dog's semi-daily anti-seizure medications.  I outright objected to this plan, not only from the potential of mixing medications when giving them to eihter person, but more so for the fear there could be residual effects for different drugs being together.  She's placed the onous on me to prove her wrong with an online reference.  Outside of the general rule of thumb: ""don't take drugs out of their original containers"", I can't find anything.",80,50,2014-03-20,PHARMA,0.06725095957517624,0.9096084833145142,0.023140517994761467
medicine,IBM to set Watson loose on cancer genome data,,8,27,2014-03-20,PHARMA,0.01792774721980095,0.8857864141464233,0.09628590941429138
Health,"While escalating sex hormones during puberty increase the incidence of skin acne, declining hormonal levels with aging can accelerate skin deterioration. Using natural bioidentical hormone therapy to maintain hormones in a youthful range may be a potential strategy for combating skin aging.",,0,24,2014-03-20,PHARMA,0.029646744951605797,0.9117090702056885,0.05864420905709267
medicine,How do physicians with generalized anxiety disorder manage daily life?,"I was diagnosed with GAD back in November, been going to psych and taking meds since then. I will be retaking my first year in med school this coming July.

I was wondering whether any physicians or current students could give some advice.

----------------------------
**Edit:** thank you everyone for your replies and advice. I guess I was more asking on what physicians or med students do when they get an anxious day, how do you deal with it and keep going to classes/work or sitting down with the books/patients? Does the anxiety ever go away?",25,23,2014-03-20,PHARMA,0.0723692923784256,0.8910952806472778,0.036535389721393585
medicine,Simpler treatment for sepsis called just as effective,,8,19,2014-03-20,PHARMA,0.02639433555305004,0.8942463994026184,0.07935924828052521
medicine,Cerebellum,,26,265,2014-03-21,PHARMA,0.04490229859948158,0.90664142370224,0.04845626279711723
Health,Whooping Cough Outbreaks Tied to Parents Shunning Vaccines,,29,101,2014-03-21,PHARMA,0.2340834140777588,0.7363652586936951,0.02955133467912674
Health,STUDY: Cannabis Significantly Improves Parkinson's Symptoms (no side effects),,16,98,2014-03-21,PHARMA,0.034714777022600174,0.04160350561141968,0.9236816763877869
medicine,White Blood Cell Chases Bacteria,,14,88,2014-03-21,PHARMA,0.10802799463272095,0.8459633588790894,0.04600868374109268
Health,Two Local Mothers Whose Babies Nearly Died of Whooping Cough Share Their Stories,,8,55,2014-03-21,PHARMA,0.0853469967842102,0.8419035077095032,0.07274945825338364
medicine,Free medical assessment and quality talk show: Weird Medicine,,5,43,2014-03-21,PHARMA,0.031628310680389404,0.9252461194992065,0.043125588446855545
Health,Salt makes overweight people age faster,,4,35,2014-03-21,PHARMA,0.08461970835924149,0.8446480631828308,0.0707322359085083
pharmacy,Match Day!,"Match results have been released. I didn't match :\ but I'm okay with that.

Congratulations to the new pharmacy residents!! And good luck to those that will be scrambling (remaining positions get posted at noon EST today)!",14,27,2014-03-21,PHARMA,0.03581976518034935,0.9252802133560181,0.03890003636479378
Health,WATCH: Biologist explains how marijuana drives tumor cells to ‘suicide’,,1,26,2014-03-21,PHARMA,0.02955786883831024,0.9170437455177307,0.05339839681982994
pharmacy,New Nexium OTC,,20,23,2014-03-21,PHARMA,0.03954233601689339,0.9232667684555054,0.03719094768166542
Health,Shocking Facts &amp; Statistics About the Cleanliness of Hospitals,,15,54,2014-03-22,PHARMA,0.24017773568630219,0.7262020707130432,0.03362016752362251
Health,Asbestos Is Still Killing People.,,3,49,2014-03-22,PHARMA,0.6626349091529846,0.286847859621048,0.050517238676548004
medicine,"Is it true that when you die, you can donate your body to a medical school at no cost to you, thereby avoiding any burial expense? How would the school not be flooded with cheapskate dead?",,40,36,2014-03-22,PHARMA,0.03093356266617775,0.9118572473526001,0.05720914155244827
Health,Microbial Signature of Crohn's Disease Revealed: Gut bacteria may offer the key to diagnosing and treating this debilitating disorder,,0,31,2014-03-22,PHARMA,0.05376724153757095,0.9160338044166565,0.030198918655514717
medicine,Just matched into a surgical sub - looking for some reading suggestions,"As the title states, I matched into the surgical sub of my choice yesterday!  While I'm planning to generally take it as easy as possible for the next few months, I am looking for some reading suggestions or general topics I should brush up on.  Basically, I don't want to be completely incompetent when I start this summer, and I'd like to avoid killing my patients as much as possible.

Thanks!",25,27,2014-03-22,PHARMA,0.03281107917428017,0.9321320056915283,0.03505698963999748
pharmacy,Number of BPS certified specialists increased 21% in 2013. Ambulatory Care is the 2nd most sought after specialty.,,7,20,2014-03-22,PHARMA,0.014786110259592533,0.8404204249382019,0.14479346573352814
medicine,Help with referrals for junior medical staff,"Hey medditors,
I put together a few medical education resources for interns and junior medical staff at my shop, one of which is a little pocket-guide (available (here)[http://jakebarlow.me/gray-matter/pockethmo/] if you're interested).

I'm looking at adding a section on referrals, divided by specialty. The target audience is interns/junior HMOs referring to registrars (that's residents for those of you in the US). As you can see from the link, it should be concise and focused, and is more of a cognitive tool than a reference text.

It would be great if any of you who regularly take referrals could provide a list of the key pieces of information you want to know over the phone. I recognise this will vary depending on the CC, but I still think this could be useful for JMS to make sure they have the key pieces of info before they pick up the phone.

E.g. Orthopaedics for #s: Open or closed. Bone(s) and section of each bone. # patten (transverse/comminuted/segmental/intraarticular). Deflection/angulation. Displacement. NV status. Fasting status, antibiotics given if open, last ADT. Mechanism.",0,19,2014-03-22,PHARMA,0.031305186450481415,0.9400122165679932,0.028682563453912735
medicine,MD/PhD: Is it worth it if you don't want to be a principal investigator?,"I've been thinking about this program quite a bit lately. 

IS it worthwhile if you don't want to ever have your own lab? I would like to be involved in research but I don't want to run a lab, write grants and manage students. I'd rather spend most of my time in the clinic. However, I would love to be able to do research in whatever field I pursue, as well as teaching within the medical field as well.

I would ideally want to work at an academic center in a major city, as I'm a city girl born and raised. The main fields I'm currently interested in are general surgery, orthopedics and neurology (still exploring). Would an MD/PhD make sense in the surgical specialties?",22,19,2014-03-22,PHARMA,0.020519312471151352,0.910020112991333,0.06946060806512833
medicine,Best strategy for switching residency programs (anesthesiology)?,"Hi /r/medicine, 

I'm wondering what the options are and what the best strategy is for transferring residency programs, particularly in anesthesiology.

**Back Story:** I couples matched this year, and while we both got top programs and are very excited about the programs we landed in, unfortunately we're not in the same city.  This was a calculated risk given by how made our joint rank lists, but it is obviously less than ideal.  I matched in a surgical sub which will obviously be very difficult to transfer in, but my SO matched in anesthesiology and it seems like there are generally more options to move around given the larger size of the programs.  

My SO was an extremely competitive applicant (255+ step 1, good grades, no red flags) and matched into a categorical position.  We both agree that my SO would get outstanding training at the institution at which they matched, but we really don't want to be apart that much over the next four years.  With that said, here are my questions:

* will the intern year at a categorical program count in terms of completing a PGY-I year and permitting my SO to apply to the few advanced spots available in my city?  *I.e.,* will they be eligible to apply through the match for the physician track for advanced positions this fall?
* How feasible is it to transfer programs outside of the match, either now or anytime in the future?
* What is the best strategy for getting LORs from my SO's current program?  Obviously no program wants to lose a resident, so how does one go about getting support from their program to transfer without tanking their future career?
* Are there any options apart from taking a year off or not doing medicine that we're missing?

Thanks in advance for all help!

**tl;dr:** couples matched into good programs but not together, looking into best options for one of us transferring so we're not apart for four years.",13,18,2014-03-22,PHARMA,0.023725027218461037,0.9159947037696838,0.06028022989630699
Health,"Scough, a germ-fighting scarf embedded with technology called Filterwear",,0,12,2014-03-22,PHARMA,0.018660148605704308,0.9345548152923584,0.04678503796458244
medicine,For the love of all that is holy... be careful with needles/sharps.,"Yeah, so I'm not happy with life right now. Recently matched into the specialty of my choice (anesthesiology) and the location of my choice. I'm truly really lucky. But, here's how quickly happiness can turn to sadness.



We were starting a new art line in the ICU on a relatively stable patient. Cuz there was questions about the old one bla bla bla. So, I palpate the pulse and the M3 asked if they could do it. I was once in her shoes, so I of course said yeah, but the resident supervising needed to say yes. We look up, and the resident is cool with it.



So I show her how to palpate for the pulse, how to hold the A-line needle. Then the resident stops us and says, wait, let's use the ultrasound. Grabs the ultrasound. I push the wrist in a little more extension. We find the radial artery. All is good. M3 begins to place the a-line. She misses. The resident asks her to come back to the skin without removing the needle and try again. She removes the needle and is busy looking at the ultrasound instead of the effing needle and she pierces my glove and nicks the skin on my left hand. 



Best part? Patient is admitted for respiratory failure due to pneumonia. Patient has a history of IVDU. They haven't confirmed HIV yet... 



So, to wrap up my final rotation of 4th year... I spent it with the occ health nurse taking my blood and then I got post-exposure prophylaxis because of the risk factors of the patient. Here's to taking my Combivir for the next little while.


Moral of the story? I know the transmission rate of HIV from a needlestick is 0.03% and that I most probably don't have it. But, when you're working with any sharps, keep your eye on the sharp.",60,158,2014-03-23,PHARMA,0.04163755103945732,0.9175233840942383,0.040839098393917084
medicine,"Doctors, what is the most interesting off-duty emergency you've attended to?",,132,143,2014-03-23,PHARMA,0.17487868666648865,0.7753151655197144,0.04980608448386192
Health,The Ebola virus has been identified as the cause of an outbreak of haemorrhagic fever now believed to have killed nearly 60 people in southern Guinea (crosspost from /r/globalhealth),,15,110,2014-03-23,PHARMA,0.11229787021875381,0.858431339263916,0.02927081659436226
Health,New Drugs May Transform Down Syndrome - Recent breakthroughs may lead to pharmacological treatments for the chromosomal disorder,,11,99,2014-03-23,PHARMA,0.020812254399061203,0.9119518995285034,0.06723577529191971
medicine,Ebola Virus outbreak in Guinea...possibly spread to Sierra Leone,,2,78,2014-03-23,PHARMA,0.11055338382720947,0.8603670597076416,0.029079558327794075
Health,Drug company R&amp;D: Nowhere near $1 billion - How drug companies exaggerate research costs to justify absurd profits.,,5,65,2014-03-23,PHARMA,0.292572557926178,0.6818510293960571,0.025576386600732803
Health,Protein Protects Aging Brain. Study suggests that REST may be a key regulator of neuronal stress and could play a role in staving off neurodegenerative diseases like Alzheimer’s.,,2,45,2014-03-23,PHARMA,0.02876066416501999,0.9125953912734985,0.058643922209739685
medicine,Advice for easing the transition into intern year,"I just matched into a categorical Anesthesiology program which has a medicine intern year at a very busy university center. I'm actually pretty terrified because I haven't done any medicine floor work since my 3rd year and my electives have been very relaxed for the most part (my fault, I know). 

I didn't think that I was particularly efficient during my IM clerkship in the first place. I barely handled 2-3 patients with the help of my intern and now I'm going to be accountable for a census of 10 patients on my own. Is there anything that I can do as of now to ease the transition into intern year? I feel like I'm going into this totally clueless.

I've started some very light Step 3 reading and I've looked into that Intern Survival Guide that somebody else mentioned. I don't think I can do much in terms of increasing my efficiency at this point aside from doing the intern year itself, but any advice would be appreciated.",22,37,2014-03-23,PHARMA,0.03038409911096096,0.9132238626480103,0.05639196187257767
pharmacy,Why is Lacosamide a controlled substance?,,2,14,2014-03-23,PHARMA,0.04647943004965782,0.9310023784637451,0.02251814305782318
Health,Why almost everything you've been told about unhealthy foods is wrong,,1,12,2014-03-23,PHARMA,0.03339608758687973,0.9318405985832214,0.03476336598396301
Health,"Selling a Poison by the Barrel: Liquid Nicotine for E-Cigarettes - “E-liquids” used to refill e-cigarettes are potent, unregulated neurotoxins. Evidence of the potential dangers is already emerging.",,183,77,2014-03-24,PHARMA,0.11971832066774368,0.8393836617469788,0.04089801385998726
Health,Memory can be Improved 20% by Nature Walk,,3,62,2014-03-24,PHARMA,0.0182048249989748,0.15010212361812592,0.8316931128501892
medicine,Crowdsourcing medical decisions: Ethicists worry Josh Hardy case may set bad precedent,,8,52,2014-03-24,PHARMA,0.8991607427597046,0.08619987964630127,0.014639398083090782
Health,"Ebola Virus Just Killed 60 People in West Africa, But Don't Panic",,4,49,2014-03-24,PHARMA,0.5153282880783081,0.45227089524269104,0.03240083158016205
medicine,"Second consecutive year unmatched, what's next?","Hello,

I am an International Medical Graduate, and, unfortunately, for the second consecutive year I haven't been matched. 

My family is settled in the US and we would like to stay here in the medium-long term.

As the chances to get into a residency seem pretty slim at this point, I am considering an alternative career path. I am considering the possibility of earning a PhD, because I love clinical research. However, I am not a big fan of basic, animal-based research, and I have my doubts about getting into a program that may last for more than 4 years.
Other options seem viable (becoming a PA, or a nurse), but I would rather keep them as a last resource.

Does /r/medicine have any suggestion for an alternative career path to someone with my background? Any experience to share?",37,49,2014-03-24,PHARMA,0.018057363107800484,0.9086296558380127,0.07331297546625137
Health,"For Depression, Prescribing Exercise Before Medication",,2,38,2014-03-24,PHARMA,0.09120617061853409,0.8759385943412781,0.032855261117219925
medicine,Today is world TB day. Don't forget to sign the #TBManifesto! (xpost /r/doctorswithoutborders),,0,36,2014-03-24,PHARMA,0.07442370802164078,0.8899242877960205,0.03565194085240364
Health,Six party drugs that may have health benefits,,10,32,2014-03-24,PHARMA,0.3378525972366333,0.6195169687271118,0.04263044148683548
Health,"Minnesota company is recalling some of its peanut butter, cheese, salsa &amp; spreads distributed nationwide after authorities find listeria in samples",,0,21,2014-03-24,PHARMA,0.08657969534397125,0.7853261232376099,0.1280941665172577
medicine,Registration is now open for NHS Hack Day London,"Hello Meddit, I know this is usually a US-centric sub but I thought I'd post anyway.

NHS Hack Days are weekend events that brings together doctors, nurses, developers, designers, and other ""geeks who love the NHS"" to create disruptive solutions to problems in the health space. NHS Hack Days are ongoing and enjoy the support of prominent international health care and technology leaders.

The next NHS Hack Day will be at St.George's Students' Union, at SGUL in Tooting, South West London. 

You can find more information at www.nhshackday.com and I'm happy to answer any questions.

Here is a video of what was made at the previous NHS Hack Day in Cardiff https://www.youtube.com/watch?v=njavHxen_A0  (Sorry for the poor quality, was a last minute decision to stream the event)",6,15,2014-03-24,PHARMA,0.029611648991703987,0.9225056767463684,0.04788271337747574
medicine,They treated her for Tuberculosis for four months.,,63,312,2014-03-25,PHARMA,0.09241817891597748,0.8618391752243042,0.04574268311262131
Health,45 states get an “F” grade when it comes to monitoring health provider pricing,,25,184,2014-03-25,PHARMA,0.012751374393701553,0.7334765195846558,0.2537720799446106
Health,"Man critically ill in Saskatoon, Canada after travel to Africa - Ebola suspected",,39,149,2014-03-25,PHARMA,0.14591434597969055,0.7905882596969604,0.06349731981754303
pharmacy,2014 ASHP Match Statistics (PGY1 Residency Programs),,9,58,2014-03-25,PHARMA,0.023681066930294037,0.9206551313400269,0.05566387251019478
medicine,"3 studies with surprising results--rapid response teams, VTE, and gown &amp; glove rules",,15,35,2014-03-25,PHARMA,0.01897706463932991,0.8909825682640076,0.09004040062427521
Health,Sick man in Saskatoon tests negative for Ebola,,1,25,2014-03-25,PHARMA,0.6576216816902161,0.3020112216472626,0.040367018431425095
