subreddit,title,selftext,num_comments,score,created_utc,stock/sector,neg,neu,pos
Health,"US Senate Passes Bill for Better Sunscreen - While skin cancer is most common cancer US, 8 sunscreen ingredients have been pending in FDA backlog for yrs — some for over a decade — even while they've been used in Europe &amp; Asia for yrs.",,3,42,2014-09-18,PHARMA,0.017394298687577248,0.849274754524231,0.13333088159561157
Health,Americans endure unwanted care near death: IOM study,,2,36,2014-09-18,PHARMA,0.12569119036197662,0.8397403359413147,0.03456844389438629
Health,Why dentists are speaking out about the plastic beads in your toothpaste,,9,33,2014-09-18,PHARMA,0.0711807981133461,0.8935033679008484,0.03531589359045029
medicine,"UN Confuses Neuromuscular Relaxant Atracurium With Measles Vaccine, Accidentally Killing 15 Syrian Children During Vaccination Campaign In Northern Syria",,5,27,2014-09-18,PHARMA,0.26585209369659424,0.7065547704696655,0.027593176811933517
Health,A Blood Test For Depression Shows The Illness Is Not A Matter Of Will,,28,170,2014-09-19,PHARMA,0.6874296069145203,0.28183063864707947,0.03073972277343273
medicine,How to Discourage a Doctor,,30,139,2014-09-19,PHARMA,0.04207753390073776,0.8573058843612671,0.10061652958393097
medicine,How and When We Die - Death Rates from the Major Diseases of Aging,,34,70,2014-09-19,PHARMA,0.37409326434135437,0.6054885983467102,0.02041815035045147
Health,"Ebola could infect 500,000 by end of January, according to CDC projection",,1,67,2014-09-19,PHARMA,0.028543535619974136,0.9309426546096802,0.040513776242733
medicine,#FOAMed: The Internal Medicine Lecture Series,"I'm excited to share with /r/Medicine a new #FOAMed project we've been working on at the University of Louisville: [The Internal Medicine Lecture Series](https://www.youtube.com/user/UofLIM). We are recording all of the lectures given by faculty for resident education and board review and publishing the best online for free. 

We plan on releasing new lectures approximately every week during the academic year with the goal of creating a free, current, and great resource for anyone interested in topics related to internal medicine. Our lecturers are generally subspecialists in their field, and often division heads who have been specifically selected to give a lecture on a topic of their expertise. We plan on updating these lectures frequently, and although some lectures will need less updating than others, with some disease processes we will be updating the lectures as the evidence changes and evolves.

We would love any feedback you all have to make the project better.",16,58,2014-09-19,PHARMA,0.017404988408088684,0.9332981705665588,0.04929681494832039
Health,CDC: 90 percent of children who died from flu last year had not been vaccinated,,3,52,2014-09-19,PHARMA,0.23796047270298004,0.7106180191040039,0.05142148211598396
medicine,Oakland program trains troubled youth to become a healing presence in their communities as EMTs,,4,46,2014-09-19,PHARMA,0.01517909113317728,0.8427394032478333,0.14208146929740906
pharmacy,"""Can I speak with the other pharmacist instead...he looks smarter""",I came across this patient yesterday. Does anyone have any related stories? Have you ever been passed on for any reason?,49,36,2014-09-19,PHARMA,0.022630391642451286,0.8536659479141235,0.12370364367961884
Health,When Men Are Raped,,0,33,2014-09-19,PHARMA,0.17049653828144073,0.7969728112220764,0.032530706375837326
Health,"Why I'm Becoming a Primary-Care Doctor - The U.S. has a shortage of family physicians, but many med students avoid the specialty, stigmatizing it as uninteresting.",,2,33,2014-09-19,PHARMA,0.029371950775384903,0.9116556644439697,0.05897234380245209
medicine,The life cycle of a doctor,,37,237,2014-09-20,PHARMA,0.044126611202955246,0.9215709567070007,0.03430243209004402
Health,Early Deaths Could Fall by 40% in Next 20 Yrs - We’re doing a good job of reducing the number of premature deaths in people under 70. “We actually found that mortality is falling very rapidly.”,,10,87,2014-09-20,PHARMA,0.8523911237716675,0.09006691724061966,0.05754203721880913
medicine,Oppose Naturopathic Medicine,"Call for help...
OPEN LETTER TO OPPOSE ANYTHING NATUROPATHIC: 

I am writing to convey my deep interest that [representative title here] [surname] does not support H.R. 508 for ""Naturopathic Medicine Week"".
[Change intro sentence to reflect current bill in any legislature]

Naturopathic medicine is only licensed in 17 states, across which there are wide disparities in scope of practice and regulatory oversight. Naturopaths who graduate from one of the 4-year accredited universities are taught pseudoscience, and only a small portion of modern medical science. They use words like ""accredited"" and ""4-year doctoral program"" to describe their training, but these do not bear truth on the quality nor content of their education. Accreditation by the US Department of Education is through a proxy organization which is private and run by naturopaths. Thus accreditation does not mean that naturopathic medicine has a seal of government approval. Rather, accreditation means that the naturopathic colleges meet administrative, student judiciary, and accounting criteria. The content or validity of naturopathic education is not evaluated at this level. Naturopaths describe their accreditation as ""government approved, and this misrepresentation belies naturopathic medicine.

There are very lax entrance requirements for a student of naturopathic medicine: they are not required to take the MCAT and typically have lower GPAs than pre-medical students. This effect can be seen by looking at the percentage of student's accepted by naturopathic medical schools. Many are over 60%, which is a number that would make any real pre-medical student cringe given they are selected for very carefully by medical schools at high levels of scrutiny. I want to highlight that naturopaths are opposed by every major medical organization, and naturopaths largely oppose vaccination and practice psuedoscientifc treatment modalities that are shown to be ineffective or utterly implausible. Yet naturopaths consider these ""real"" medicine, i.e., homeopathy, hydrotherapy, iridology, and touchless energy medicine. Despite this, many naturopaths have very liberal drug prescriptive authority but not the coursework or clinical hours training needed to safely and effectively manage pharmaceutical drugs for simple or complex disease presentations.

Please understand that naturopaths should be examined under a very careful lens. Naturopaths try to claim that they have the
equivalent education as medical doctors, but this is not true. They are taught highly implausible treatment modalities like homeopathy and
hydrotherapy as their core philosophy. They are taught that ""natural"" is better and less dangerous.  They do not need to finish a medical residency before earning the right to practice ""medicine,"" and those that do naturopathic residencies are rare and take place in outpatient clinics where they have insufficient contact with the range and complexity of diseases needed to make them effective primary care physicians. Furthermore, their licensing exam is not made public for external review, and thus it is not known on what medical topics and at what level of rigor they are examined.

For comparison of training between MDs/DOs and naturopaths please refer to the American Academy of Family Physicians chart: http://www.aafp.org/dam/AAFP/documents/advocacy/workforce/gme/ES-FPvsNaturopaths-110810.pdf

Naturopaths circulate their own ""comparison"" which widely manipulates their courses and clinical hours. Basically, it includes their pseudoscientific training as medical school course hours, when in fact, such topics are irrelevant to the practice of medicine. Medical doctors need a multi-year residency in order to become primary care physicians and advance with additional specializations.

Please help the public good and the advancement of medical science by opposing Naturopathic Medicine week and rolling back licensing for
naturopaths.

I understand that most naturopaths are good people, but they have been misled by their professional organizations into thinking they can function as capable primary care physicians. Advancement of naturopathic medicine is a threat to public health, and therefore the practice of naturopathic medicine should not be considered safe, effective, or affordable health care.

Regards,

[sign your name]",78,57,2014-09-20,PHARMA,0.07631838321685791,0.900649905204773,0.023031702265143394
Health,"Scientists discover ""sleep node"" responsible for deep sleep",,5,57,2014-09-20,PHARMA,0.07611545920372009,0.8653101921081543,0.05857427790760994
Health,Sierra Leone imposes three-day lockdown in bid to halt Ebola,,0,56,2014-09-20,PHARMA,0.2598890960216522,0.7131649255752563,0.02694598399102688
medicine,Study shows one dose of antidepressants can change the brain structure immediately,,1,43,2014-09-20,PHARMA,0.11130496859550476,0.854482114315033,0.03421294689178467
medicine,Opinions on medical Marijuana?,^,61,36,2014-09-20,PHARMA,0.01709454134106636,0.9053842425346375,0.07752114534378052
Health,Sedentary lifestyle linked to depression,,9,30,2014-09-20,PHARMA,0.022899290546774864,0.9346328377723694,0.0424678735435009
Health,Sibling bullying ‘linked with later mental health disorders’: Being bullied by a sibling is a potential risk factor for depression and self-harm in early adulthood,,2,25,2014-09-20,PHARMA,0.5100065469741821,0.4664742946624756,0.023519115522503853
Health,Why Reducing Antibiotic Resistance is Harder than it Seems - Changing business models &amp; upping innovation may be part of the answer,,1,24,2014-09-20,PHARMA,0.01933598890900612,0.8082954287528992,0.17236852645874023
Health,"After Surgery, Surprise $117,000 Medical Bill From Doctor He Didn’t Know - NYTimes.com",,31,138,2014-09-21,PHARMA,0.03922125697135925,0.9281807541847229,0.032598040997982025
Health,Girl who was born with no blood has just started school.,,29,75,2014-09-21,PHARMA,0.06610141694545746,0.8825924396514893,0.05130608379840851
medicine,"UK doctor thinking about moving to USA: I have many questions, and would appreciate advice, especially from those who have done this.","Dear Doctors of Reddit.

I am looking for some advice as well as information about how the US healthcare system functions.  I have looked around reddit, but can’t find a straightforward answer to my questions.

I am a UK doctor in my second year of practice post graduation (in my second foundation year).  I also hold US citizenship, and although I left the US as a child, lately I have been thinking about coming back to the US to practice.  My partner of 8 yrs is a doctor at the same level as me, and a UK citizen.

My primary motivating factors are firstly, in either the East or North West coast where I would like to end up, the weather is much better than in Scotland where I am currently based.  There is also more scope for skiing and biking, which are my two main hobbies.  My second motivating factor is salary.  As far as I understand a starting resident’s salary is around $40k-50k, and tax is ?15-20% (not really sure about that).  Compare that to my starting salary last year of around £22-25K with tax of around 30%.

As I left the USA as a child, I have no idea how the health care system works.  For example in the UK, if someone becomes ill, they either go to the ED, or they go to the GP, who either sorts them out, or refers them to specialists at the local hospital.  I am working in a hospital at the moment, and we have the option of transferring patients to other hospitals, psychiatric hospitals etc based on their need and what can be provided on site.  Is this at all similar to the states? IE if someone presents to their GP who realises that they need to be referred to specialist care, does this happen, or does someone just present to, for example, a cardiologist, because they think they need one.

Then, how does the US system work for doctors? I think I want to be a medic, but still making up my mind as to speciality.  As far as I understand, after medical school, you become resident for X amount of years in your chosen residency.  What happens after that?  Is being a doctor akin to being a business person, in so far that you have to set up your own practice, find your own patients etc?  If I became a GP, who would my patients be, and what kind of salary could I expect?

Another big question I have is, are there UK trained doctors on reddit who have made this transition? If so, how did you do it?  How long does it take to do the whole process from starting to study for the USMLE, to starting your residency?  As I live in the UK, I can see a lot of time and money going into interviewing for residencies etc. (something which I don’t have too much of).  

As for me, I like working in UK hospitals and for the NHS.  I am familiar with it, and am comfortable with the options available to me.  I get &gt;28 days annual leave – is it around 15 days in the US for residents?

Anyhow, lots of questions, but I’m hoping I can get some answers here.  This is a really difficult decision that I am agonising over.

Ill be around for a while this evening to answer questions/ask more, as well as tomorrow evening.  Thanks!",71,63,2014-09-21,PHARMA,0.044833701103925705,0.9188134670257568,0.03635280579328537
medicine,"After Surgery, Surprise $117,000 Medical Bill From Doctor He Didn’t Know",,33,48,2014-09-21,PHARMA,0.06315571814775467,0.9075953364372253,0.029248904436826706
Health,The Fear That Killed 8 Ebola Workers - They were sent in to help educate villagers about how to ward off the lethal virus. Then fear took over &amp; the machetes came out.,,14,33,2014-09-21,PHARMA,0.1617586314678192,0.6892204880714417,0.14902091026306152
Health,"From toilet to table, overcoming the ‘yuk’ factor: How Haitians overcame the 'yuk' factor",,5,28,2014-09-21,PHARMA,0.0492812842130661,0.87369704246521,0.07702172547578812
medicine,"Meddit, what do you like to see in a referral letter from another doctor?","I'm taking part in a course right now which requires me to write a referral letter to a consultant about an imaginary patient with suspected deep vein thrombosis. My professor told me that the overwhelming majority of patient referral letters doctors receive are badly-written, so I don't want to fall into that trap!

If I were sending this letter to you, what sort of information would you like to see in it?",54,24,2014-09-21,PHARMA,0.16334539651870728,0.813175618648529,0.023478981107473373
medicine,Ig Nobel Prize 2014: Bacon Cured Pork Stopped Nosebleed (4Year old Pt. w/ Glanzmann thrombasthenia),,0,20,2014-09-21,PHARMA,0.03535206615924835,0.8938487768173218,0.07079913467168808
medicine,New study shows that the savings from 'tort reform' are mythical - LATimes,,5,20,2014-09-21,PHARMA,0.021665848791599274,0.8481119871139526,0.13022218644618988
Health,"Antibiotics are losing their effectiveness, threatening to make common infections deadly. Is the future of medicine lurking in the ice waters of Iceland?",,0,15,2014-09-21,PHARMA,0.9058722257614136,0.07758713513612747,0.016540605574846268
medicine,"Dear Meddit, I'm in a bit of a pickle. Any European medical practitioners / academics out there?","I’m a final year medical student from Australia. I had organised a 3 week elective term in the UK with a vascular surgeon at the end of this year, but this just fell through as that doctor had some unforeseen family commitments. 

The problem is that I have already paid the deposit on my flights. 

This is a desperate call, but are they any medical practitioners or medical academics willing to let me shadow them for a few weeks at the end of November / start of December this year? I’m interested in all things medical! I've recently developed a liking for surgery aswell. 

My university’s insurance provides indemnity cover if that is of concern. 

I know this is a desperate call but I thought I’d try!



tl;dr - Looking for someone or somewhere to do my elective term at the end of this year in Europe. 

**EDIT:** Thankyou so much for your respones Meddit. I ended up sorting it out with a Urological Surgeon in Amsterdam. Will be heading there in December. Thankyou again!",20,145,2014-09-22,PHARMA,0.05376579985022545,0.9046411514282227,0.041593097150325775
Health,"Peanut Butter Moguls Found Guilty of Knowingly Shipping Contaminated Food - Recall the big salmonella outbreak in peanut butter? No, not the 1 this yr or in 2012 or 2007, but in 2008, where peanut butter shipped from 'Peanut Corp of America' was linked to over 700 illnesses &amp; 9 known deaths.",,5,139,2014-09-22,PHARMA,0.7243282794952393,0.2505214214324951,0.025150299072265625
medicine,When all other therapies fail... (shamelessly stolen from the front page),,10,103,2014-09-22,PHARMA,0.10268404334783554,0.8644182085990906,0.03289779648184776
Health,The Distress of Waking Up Under Anesthesia - The largest report ever on the topic finds that half of patients who are accidentally aware during surgery suffer long-term psychological effects.,,19,64,2014-09-22,PHARMA,0.662406861782074,0.3106163442134857,0.026976794004440308
Health,Gut Bacteria May Play a Role in Autism: Evidence is mounting that intestinal microbes exacerbate or perhaps even cause some of autism's symptoms,,3,57,2014-09-22,PHARMA,0.05219245329499245,0.9144579172134399,0.033349648118019104
Health,Ebola: Even experienced international disaster responders are shocked at how bad it’s gotten.,,5,42,2014-09-22,PHARMA,0.5143217444419861,0.3169899582862854,0.16868829727172852
Health,700 babies exposed to tuberculosis at Texas hospital,,2,41,2014-09-22,PHARMA,0.7511663436889648,0.2315700501203537,0.017263565212488174
medicine,"Science, alone, cannot resolve the Ebola crisis: ""Maybe developed countries will only care about Ebola outbreak when it hits miners &amp; there ain't enough precious metals for the new iPhone.""",,21,32,2014-09-22,PHARMA,0.07939929515123367,0.8564773201942444,0.06412342190742493
Health,Almost half of cancer patients diagnosed too late - Time to unite and find new ways,,2,21,2014-09-22,PHARMA,0.026667337864637375,0.9043640494346619,0.06896860897541046
Health,"Big Data's Next Challenge: Heart Failure - Using sensors &amp; predictive analytics, data scientists are tackling one of America's biggest killers.",,3,21,2014-09-22,PHARMA,0.015240923501551151,0.8109371662139893,0.17382192611694336
medicine,Big dreams at the local Chinese take out,,64,455,2014-09-23,PHARMA,0.018607579171657562,0.8886662721633911,0.09272611886262894
Health,"Poultry Giant Ditches Antibiotics for Probiotics - Your chicken will be antibiotic-free, but rich in bacteria — &amp; that's a good thing, Perdue Farms says",,23,237,2014-09-23,PHARMA,0.01205696165561676,0.8410704731941223,0.14687253534793854
medicine,Using an MD degree outside of practicing medicine?,"I'm currently halfway through residency and have come to the slow conclusion that while medicine is an incredible profession it isn't for me. There are many facets of the field I still find enjoyable and would like to apply my training with my background in computer engineering. Does anyone have any friends who have leveraged their MD degree outside of the practice of medicine?

Edit: I appreciate everyone's responses as they've been both helpful and encouraging. I've sent PMs to several of you as well.",52,61,2014-09-23,PHARMA,0.03350919485092163,0.9070532321929932,0.05943754315376282
pharmacy,In Preparation for the October 6th rescheduling and subsequent inventory,,16,50,2014-09-23,PHARMA,0.058064501732587814,0.9111419916152954,0.03079356625676155
medicine,"Jehovah’s Witness patients presenting with ruptured ectopic pregnancies: two case reports [J Med Case Rep., Sept 2014 — abstract + free full-text .pdf as link]",,11,30,2014-09-23,PHARMA,0.03717898577451706,0.9372124075889587,0.02560853771865368
pharmacy,"What are your ""red flags"" when it comes to filling a prescription?",,48,28,2014-09-23,PHARMA,0.06258293986320496,0.7176616787910461,0.2197553664445877
medicine,World wakes up to Ebola as cases set to top 1 million - health - 23 September 2014 - New Scientist,,6,25,2014-09-23,PHARMA,0.030905812978744507,0.8621979355812073,0.1068962886929512
Health,"Large scale study says group nature walks linked with significantly lower depression and perceived stress, enhanced mental well-being",,1,20,2014-09-23,PHARMA,0.2517770826816559,0.11610956490039825,0.6321133971214294
pharmacy,"Walgreens Shootout Caught on Video Shows Pharmacist Fight Off 2 Robbers, But He’s Still Under Fire",,16,17,2014-09-23,PHARMA,0.03467615321278572,0.888186514377594,0.07713734358549118
VACCINES,Rob Schneider dropped from State Farm ads for anti-vaccination beliefs,,5,12,2014-09-23,PHARMA,0.40776583552360535,0.5675891041755676,0.024645017459988594
medicine,"Born today (24/09/1898) - Howard Florey, an Australian pharmacologist and pathologist who shared the Nobel Prize in Physiology or Medicine in 1945 for his role in the making of penicillin. Florey's discoveries are estimated to have saved over 82 million lives.",,4,152,2014-09-24,PHARMA,0.0180639810860157,0.8903520703315735,0.09158392995595932
Health,"Ebola cases could reach between 550,000 and 1.4 million by late January: CDC",,7,72,2014-09-24,PHARMA,0.040328264236450195,0.6751894354820251,0.28448233008384705
Health,Adults with autism locked out of health coverage due to age limits,,7,46,2014-09-24,PHARMA,0.3927660882472992,0.573698878288269,0.03353499248623848
Health,San Diego Researcher Crowdfunding Patent-Free Cancer Drug,,1,46,2014-09-24,PHARMA,0.02517499402165413,0.9306615591049194,0.044163480401039124
Health,Want to Find Out Where Your Fruit was Grown? Good Luck. - Big Ag considers the path from field to supermarket a trade secret.,,1,43,2014-09-24,PHARMA,0.0146130146458745,0.9115718007087708,0.07381517440080643
Health,A Mother in Jail for Helping Her Daughter Have an Abortion,,3,38,2014-09-24,PHARMA,0.3095662593841553,0.6097525954246521,0.08068115264177322
medicine,Modern pulmonary embolism treatment is still far from perfect. Here are some of the issues,,20,31,2014-09-24,PHARMA,0.021720126271247864,0.3292023539543152,0.6490774154663086
Health,Infant cooing and babbling are linked to hearing ability: Research shows that infant vocalizations are primarily motivated by infants’ ability to hear their own babbling; reinforces the importance of early hearing interventions,,1,20,2014-09-24,PHARMA,0.01745859533548355,0.8990224599838257,0.08351896703243256
pharmacy,Red Flags,,7,19,2014-09-24,PHARMA,0.34538742899894714,0.6169129014015198,0.037699613720178604
medicine,Navy vs. Army as a Military MD,"I (21F) am a senior pre-med student who is interested in doing the HPSP (Health Professions Scholarship Program) in the Navy. However I spoke with both a Naval recruiter and an Army Health Professions recruiter at a career expo at my college today and am now questioning my initial decision to go with the Navy (I have shadowed multiple former-Navy MD's in the past) because of points the Army recruiters brought up such as a gap between med school and residency in the Navy, which I had never heard about before. I am taking a gap year getting a masters degree (probably in Public Health, as that's my second major) and will be applying to med schools beginning next summer. I'm looking to see if any military or civilian MDs can offer me advice or give me some the pros and cons of each branch? Thanks, Meddit!

Edit: ""gap between med school and residency""= GMO Assignment, thanks for the clarification!",24,18,2014-09-24,PHARMA,0.032575707882642746,0.9185420274734497,0.04888230189681053
Health,Insurance Company Pulls Actor Rob Schneider’s Ads Over His Anti-Vaccine Views - Activists pointed out that someone who spreads dangerous information about vaccines isn't an appropriate spokesperson for a company that sells health insurance.,,25,197,2014-09-25,PHARMA,0.593002438545227,0.3871137499809265,0.019883856177330017
Health,"""Regular cannabis use during the teenage and young adult years is associated with poorer cognitive function (verbal memory, processing speed, cognitive inhibition, sustained attention),"" Krista Lisdahl, director of the brain imaging and neuropsychology lab at the University of Wisconsin at Milwaukee",,29,141,2014-09-25,PHARMA,0.08281988650560379,0.8915630578994751,0.025617022067308426
