subreddit,title,selftext,num_comments,score,created_utc,stock/sector,neg,neu,pos
medicine,"U.S. Doctors of Reddit, if you were an undergrad student right now considering the changes to the health care system, would you still go to medical school, or look elsewhere like PA school, etc.?","If a having to do it all over again, but starting in 2014, would you? Keep in mind such changes like code 10, and the high risk of malpractice lawsuits.",255,144,2014-03-09,PHARMA,0.025216100737452507,0.9306071400642395,0.044176723808050156
medicine,Patient interview by first year med student.,,11,112,2014-03-09,PHARMA,0.03354082256555557,0.9290940165519714,0.037365153431892395
medicine,"TIL: Once people admit they were wrong not to vaccinate their child, they are less likely to vaccinate future children because Americans are stubborn.",,12,86,2014-03-09,PHARMA,0.03975648805499077,0.9094850420951843,0.05075846612453461
Health,Blood test can predict Alzheimer's,,11,84,2014-03-09,PHARMA,0.14048559963703156,0.7358174920082092,0.12369689345359802
medicine,"Patient goes into V-fib after physician makes mistake on live broadcast. ""Defibrillation, defibrillation. Where's the defibrillator?""",,38,76,2014-03-09,PHARMA,0.10051396489143372,0.8779701590538025,0.02151588164269924
medicine,Celebrations at KNH after doctors discovered permanent cure for cervical cancer,,20,68,2014-03-09,PHARMA,0.017484895884990692,0.6697151064872742,0.31279996037483215
Health,"Feeding antibiotics to animals makes them large. Well, it makes us fat, too.",,3,50,2014-03-09,PHARMA,0.017001017928123474,0.7939509749412537,0.18904796242713928
pharmacy,We made some new signs for the dispensary today,,4,50,2014-03-09,PHARMA,0.018552090972661972,0.8270019292831421,0.15444600582122803
medicine,One of the privates likes to tell jokes when he admits his patients. (X-post /r/nursing),,4,37,2014-03-09,PHARMA,0.08053518831729889,0.8895191550254822,0.029945652931928635
medicine,What a face lift really looks like,,61,544,2014-03-10,PHARMA,0.013011094182729721,0.8156412243843079,0.1713477373123169
Health,Known link between Red Dye No. 3 and thyroid cancer but FDA has delayed action 26 times,,18,203,2014-03-10,PHARMA,0.26448842883110046,0.6984187364578247,0.03709285333752632
Health,Proposed USDA poultry regulations raise fears about food safety - Plan will reduce oversight &amp; increase production rates of poultry.,,2,95,2014-03-10,PHARMA,0.8842142820358276,0.045042768120765686,0.07074299454689026
Health,The Fat Drug: New evidence shows that America’s obesity epidemic may be connected to our high consumption of antibiotics.,,8,70,2014-03-10,PHARMA,0.30845004320144653,0.11256514489650726,0.5789847373962402
pharmacy,Whenever a patient calls to ask if their doctor approved their refill request,,10,57,2014-03-10,PHARMA,0.4561842978000641,0.5238763689994812,0.01993933506309986
Health,European Health Levels Suddenly Collapsed After 2003 And Nobody is Sure Why,,9,48,2014-03-10,PHARMA,0.630099892616272,0.31860876083374023,0.051291368901729584
medicine,"Emergency docs and docs who implement scribes, I'm curious what your thoughts on this article are: The disturbing confessions of a medical scribe",,16,38,2014-03-10,PHARMA,0.05982881784439087,0.8984114527702332,0.04175972566008568
medicine,When did this become how medicine is practiced?,"Let me describe an interaction I had with a nurse the other day. I'm a pharmacist and had called and asked the receptionist to have the nurse call me back regarding an interaction with my patients diazepam.

Nurse: This is xyz the interaction is fine

Pharmacist: ?, I never even told you guys what the second drug in the interaction is.

Nurse: I asked the doctor if anything he takes interacts with diazepam and he said no.

Pharmacist: I patient sees 3 doctors. I highly doubt you guys even know what all he takes. And yes there certainly is an interaction.

Nurse: Whatever, I asked the doctor and he said go ahead with diazepam.

Pharmacist:  I guess I don't understand why you are so defensive here. The patient has never used diazepam before and it interacts. He has taken lorazepam, it works for him, and it avoids the interaction. It seems an obvious choice.

Nurse: I already asked and the doctor wants to go ahead with the diazepam.

Pharmacist: Tell you what how about I ask the patient which one he wants.

Nurse: You can't do that!!!

Pharmacist: I can't change the prescription but I can certainly tell the patient that better alternatives exist. Then you can have a conversation with the patient over what the best medication is in this case since you appear to be unwilling to have that conversation with me.

Nurse: (in a voice that remained me of a three year old that didn't get their way) Fine! I'll ask the doctor if we can change it to lorazepam. *very loud hang up*

This type of do anything to avoid actually addressing the pharmacists concern seems common these days. I realize we are all busy. I guess I just missed the memo that that means we no longer need to look out for our patients best interest.",31,37,2014-03-10,PHARMA,0.06680544465780258,0.9051288366317749,0.028065795078873634
Health,The Fat Drug - drugs being given to animals so they can pack on the pounds with possible link to obesity in humans. NYTimes.com,,6,27,2014-03-10,PHARMA,0.035350099205970764,0.9148070812225342,0.049842823296785355
pharmacy,Is this a HIPAA violation?,"A store manager came up to the pharmacy and asked us why we didn't give a patient a coupon for transferring her prescriptions. We told her that the patient transferred a controlled substance so we could not give her the coupon. The patient then reported us to the BBB because we violated her HIPAA rights by telling the store manager we couldn't give her a coupon because it was a controlled substance.

I know it's a violation to tell them the specific drug but is the phrase ""controlled substance"" considered a violation?",34,21,2014-03-10,PHARMA,0.10350044071674347,0.8706979751586914,0.02580156922340393
medicine,Ureteral stones from hell,,53,230,2014-03-11,PHARMA,0.032622143626213074,0.920539140701294,0.046838775277137756
medicine,Poor gallbladder,,10,152,2014-03-11,PHARMA,0.25440487265586853,0.6999357342720032,0.04565941169857979
Health,A school dropout from a poor family in southern India has revolutionised menstrual health for rural women in developing countries,,1,64,2014-03-11,PHARMA,0.07410212606191635,0.8731499910354614,0.05274782329797745
Health,"Girls born unexpectedly small or underweight seem to be twice as likely to have fertility problems in adulthood as those of normal size at birth, suggests research",,4,57,2014-03-11,PHARMA,0.48828402161598206,0.453434020280838,0.05828200280666351
Health,Silent Killers of Your Metabolism,,15,42,2014-03-11,PHARMA,0.0799027755856514,0.8791041374206543,0.04099303483963013
pharmacy,Provider status bill introduced today in the House,,7,42,2014-03-11,PHARMA,0.016598692163825035,0.9362507462501526,0.04715057462453842
Health,"Glucosamine: No cure for knee pain or deterioration, study says - latimes.com",,5,41,2014-03-11,PHARMA,0.03414703533053398,0.9139737486839294,0.051879264414310455
Health,The Lure of Laziness | Psychology Today,,4,40,2014-03-11,PHARMA,0.044788382947444916,0.914596438407898,0.04061517119407654
Health,"Uninsurance Rate Falls As Millions Sign Up For Obamacare, Survey Finds - The U.S. uninsurance rate has hit yet another 5-year low as Americans continue signing up for health coverage during Obamacare's enrollment season.",,15,26,2014-03-11,PHARMA,0.8785626292228699,0.10130992531776428,0.020127449184656143
medicine,Choosing a specialty - practical considerations versus idealism,"Hey Meddit, I'm a second year medical student and I've come to the seemingly unavoidable conclusion that every specialty will be squeezed out of existence before I apply in a year and a half!

Excuse my sensationalism; allow me to explain. I've been involved with organized medicine quite a bit since I started medical school, which has made me much more aware of the political realities surrounding each specialty. For example, in California, doctors fight round after round of scope of practice battles and we lose as many as we ""win"" (meaning we've succeeded only in maintaining the status quo). For example, anesthesiologists have ceded some ground to a startlingly effective cRNA lobby, physical therapists can now diagnose and treat MSK conditions for a certain length of time, etc etc. Other specialties have other problems besides midlevels - pathologists face major consolidation of their practices from national labs, and radiologists face a massive graduating resident oversupply.

Now obviously I can't be worrying about the political prospects of multiple specialties; I'm an MS2 for chrissakes. However, I don't think anyone would disagree with me that it should factor into my decision somewhat - many people further on in their training have let me know that they wish they had been more aware of the practical considerations of their practice in medical school.

So, residents and doctors of Meddit, what do you suppose is the ideal balance? Should I choose a specialty that I'd love doing, even while knowing that it may be facing massive upheavals in their practice in the future? How do *you* continue to work knowing that certain stakes in the political/organizational game are stacked against you?

Thanks so much for your consideration!",9,23,2014-03-11,PHARMA,0.05355202779173851,0.9184511303901672,0.02799687348306179
Health,Poll Suggests Americans Think Sugar Is A Bigger Health Threat Than Marijuana.,,51,375,2014-03-12,PHARMA,0.4296594262123108,0.4659336507320404,0.10440699011087418
pharmacy,Something to show the haters,,16,66,2014-03-12,PHARMA,0.26831814646720886,0.6920138597488403,0.03966797888278961
medicine,FDA approves first medical device for migraine prevention,,10,65,2014-03-12,PHARMA,0.010575642809271812,0.5473490357398987,0.44207531213760376
medicine,Are We Trading Happy Physicians for Efficient Ones?,,16,55,2014-03-12,PHARMA,0.013627823442220688,0.8356748819351196,0.1506972759962082
Health,"Pharmaceutical company payments to health care professionals dropped between 2011 and 2012, driven in part by increased transparency",,8,52,2014-03-12,PHARMA,0.9654657244682312,0.015743030235171318,0.01879126764833927
Health,"Substance naturally found in humans effective in fighting brain damage from stroke: A molecular substance that occurs naturally in humans and rats was found to “substantially reduce” brain damage after an acute stroke and contribute to a better recovery, according to a newly released animal study",,3,50,2014-03-12,PHARMA,0.012804682366549969,0.7407807111740112,0.24641458690166473
Health,Silkworm-derived surgical devices may be superior to metal and synthetics-based plates and screws in bone,,0,44,2014-03-12,PHARMA,0.021514680236577988,0.9296717643737793,0.04881349578499794
medicine,Novel cancer vaccine holds promise against ovarian cancer,,4,32,2014-03-12,PHARMA,0.01360275223851204,0.827600359916687,0.15879689157009125
medicine,Engineer in Training looking to switch fields and into Gene Therapy/Engineering,"Hello redditors,

I recently graduated Materials Engineering a year ago, and am currently working at an engineering firm that does service work.

Anyways, I have always been very interested in medicine, and it was a close decision between engineering and medicine for me. At the end, I stuck with engineering. 

However, I still have a very strong passion for medicine and I would like to explore that side of me. I would like to know that considering my B.Sc in Engineering, what masters program in biology could I be doing through which I could directly contribute to Gene Therpay/Engineering? I am also great with programming, so something like Molecular simulations could also be possible. (In fact I am currently trying to simulate the interactions of a few molecules on my own time). 

As well, if there are any books that could be suggested, that would be great. This way I can read more about gene therapy/engineering.

Thanks Redditors.

Edit 1: I was just looking through more of this, and I would be highly interested in Genetic Engineering. Any specific universities you would recommend?",13,28,2014-03-12,PHARMA,0.01893780194222927,0.9302452802658081,0.050816893577575684
Health,Knee Pain May Not Be Helped by Glucosamine,,6,23,2014-03-12,PHARMA,0.2694149315357208,0.6572675108909607,0.07331755757331848
Health,It's Time to End All Drug Testing,,47,174,2014-03-13,PHARMA,0.03966033086180687,0.9286652207374573,0.03167439624667168
pharmacy,Sent my new lab coat off to be embroidered...,,8,132,2014-03-13,PHARMA,0.016367316246032715,0.764532744884491,0.21909992396831512
medicine,Patient Satisfaction Is Overrated,,39,108,2014-03-13,PHARMA,0.02701462060213089,0.7158408164978027,0.257144570350647
medicine,"The Bacterionomicon, a D&amp;Desque monster manual of antibiotics and bacteria",,1,76,2014-03-13,PHARMA,0.05986836180090904,0.9067845940589905,0.03334706649184227
medicine,Are new surgical residents under-trained?,"I was speaking with some buddies in surgery residency the other day, and they told me that - out of fear of lawsuits, was the reasoning they put forth - attendings have become too cautious to give them any real autonomy, and they're finishing their residencies without the set of skills, experience, and confidence that previous generations did. 

Does anyone have any knowledge/experience to shed light on this with? I'm not anywhere near surgery, and I was just curious whether this just happened to be a local culture thing or a growing trend.",66,43,2014-03-13,PHARMA,0.05000978708267212,0.8918861150741577,0.058104127645492554
Health,"One out of two parents of children with overweight feel that their child's weight is normal. Four out of ten parents of overweight or obese children are even worried that their child will get too thin. These are the findings of a European study of parents of more than 16,000 children",,4,38,2014-03-13,PHARMA,0.06946125626564026,0.8913753032684326,0.03916351497173309
medicine,"Case 8-2014 — A 29-Year-Old Man with Headache, Vomiting, and Diplopia",,13,31,2014-03-13,PHARMA,0.13380898535251617,0.819359302520752,0.04683172330260277
medicine,"Medditors, how do YOU feel when you find out a receptionist isn't putting a patient through to you (even via message/call back)","I have this particular doctors office I'm dealing with on a constant basis right now. It's for my daughters pending Cranial Vault Reconstruction/pressure probe placement. There seems to be miscommunication between two doctors and I'd love to get a message to him. 

I've called his office three times in the last 2 weeks, so I'm not being overly annoying to them, but at the same time this whole ""this surgeon's waiting on that surgeon, and that surgeon is waiting on this surgeon"" needs to be straitened out. 

The receptionist is VERY short with me. Today I didn't even ask for anything other than a call back from the nurse she won't even get a message through to him, OR a timeline (even a ""I'll call you back in 2 weeks"" would have been cool) 

So, of course, as a patient, I'm frustrated, but that makes me wonder how do you as doctors feel when you hear your receptionists do this? Is it her place to withhold messages to the doctor? I get that they need to filter the crap because you guys have a lot to do. However, I'm not talking a whiny mom wanting to fix teething. We're talking my daughters brain surgery...",10,30,2014-03-13,PHARMA,0.10290296375751495,0.8685140609741211,0.02858300507068634
medicine,Mix Of Gut Microbes May Play Role In Crohn's Disease : Shots,,0,26,2014-03-13,PHARMA,0.04189695417881012,0.9302679300308228,0.027835119515657425
medicine,"Lungs on a chip, 3-D printed hearts: The shape of medicine to come",,1,25,2014-03-13,PHARMA,0.019285138696432114,0.9318529963493347,0.04886186867952347
medicine,"Thanks, Anti-Vaxxers. You Just Brought Back Measles in NYC.",,39,284,2014-03-14,PHARMA,0.028761273249983788,0.8798285126686096,0.09141024202108383
Health,"America is Falling Out of Love With TV Dinners - Stouffer's mac &amp; cheese may be as delicious as ever, but consumers are turning away from pre-made, frozen meals.",,54,170,2014-03-14,PHARMA,0.056310735642910004,0.8753917813301086,0.06829746812582016
Health,"Despite their high fat content, research has found that almonds specifically were far superior to complex carbohydrates for losing weight, even when the calories were identical.",,34,136,2014-03-14,PHARMA,0.023539569228887558,0.03268444910645485,0.9437759518623352
medicine,Study finds 9/10 doctors unwilling to recommend health care as a profession,,36,116,2014-03-14,PHARMA,0.884200930595398,0.09149497747421265,0.024304045364260674
Health,"The Pesticide Industry vs. Consumers: Not a Fair Fight - By pouring money into politics, pesticide companies have beat back attempts to protect the public.",,12,83,2014-03-14,PHARMA,0.05935603380203247,0.819442629814148,0.12120138853788376
Health,Paris Makes Public Transport Free As Pollution Veils City Of Light,,2,55,2014-03-14,PHARMA,0.017037957906723022,0.8829917311668396,0.09997032582759857
pharmacy,Poll: Majority Of Chronic Pain Sufferers Feel Treated Like ‘Drug Addicts’ By Pharmacists,,67,46,2014-03-14,PHARMA,0.08182238787412643,0.8821771740913391,0.03600037470459938
medicine,"Surgical checklist, promoted by Atul Gawande and WHO, fails to show benefits at an Ontario hospital.",,3,28,2014-03-14,PHARMA,0.05765172839164734,0.9182128310203552,0.02413538098335266
medicine,Interested to know how those in or entering the medical profession feel regarding the barriers to entry described in this article.,,39,25,2014-03-14,PHARMA,0.019644789397716522,0.9410911798477173,0.03926409035921097
Health,New measles cases confirmed by health officials in New York City | 7online.com,,2,16,2014-03-14,PHARMA,0.08546412736177444,0.8817729949951172,0.03276285529136658
medicine,So THAT'S what it's for...,,25,373,2014-03-15,PHARMA,0.02253105863928795,0.8566404581069946,0.12082850933074951
Health,Growing Evidence Autism is Linked to Pollution,,43,172,2014-03-15,PHARMA,0.016981709748506546,0.36487361788749695,0.618144690990448
Health,I came across this in an anti-vaxxer-induced rage - CDC's: What would happen if we stopped vaccinating? Short answer: The Apocalypse.,,15,56,2014-03-15,PHARMA,0.06008981168270111,0.8870689272880554,0.05284130200743675
medicine,Kidney makes the pass,,6,51,2014-03-15,PHARMA,0.0310529638081789,0.8792756795883179,0.08967138081789017
Health,Revolutionary membrane can keep your heart beating perfectly forever,,2,38,2014-03-15,PHARMA,0.019155217334628105,0.8899593353271484,0.09088542312383652
Health,Big Waists Linked with Early Death Regardless of BMI,,1,36,2014-03-15,PHARMA,0.12378263473510742,0.8372798562049866,0.03893757238984108
Health,"Your Secrets, Medical Info &amp; Sexual Habits are Being Grabbed, Compiled &amp; Resold Online",,1,35,2014-03-15,PHARMA,0.0387856550514698,0.9240227341651917,0.037191685289144516
Health,Harvard Says Fluoridated Water is Causing Cognitive Disorders,,28,15,2014-03-15,PHARMA,0.42841193079948425,0.5460919737815857,0.025496087968349457
Health,Salt-Buster Drug Cuts Sodium Absorbed from Food - A drug that stops sodium getting into the blood could help people with kidney disease &amp; other disorders meet the low sodium targets doctors recommend,,4,15,2014-03-15,PHARMA,0.022239485755562782,0.8201736211776733,0.15758682787418365
Health,The Geography of Autism,,0,13,2014-03-15,PHARMA,0.041284818202257156,0.9303309321403503,0.028384221717715263
Health,Big Food is in wilful denial about the harm sugar does to our children,,23,132,2014-03-16,PHARMA,0.17148610949516296,0.7852204442024231,0.04329345375299454
Health,"According to a 15-year study, pesticides could be having a profound impact on the health and brain development of the children of farmworkers in the Salinas Valley",,0,111,2014-03-16,PHARMA,0.09774181246757507,0.8685153722763062,0.0337427593767643
medicine,Were you abused as a student or resident? What did you do about it? What do you wish you would have done about it?,"Pretty straightforward questions I guess.

I'm currently an EM resident outside of the US and I think I've had it pretty rough these first weeks, I'm unsure about what to do about it and would love to hear what other people in similar situations have done about it.

Thanks.",92,60,2014-03-16,PHARMA,0.02930774725973606,0.8518047332763672,0.11888747662305832
Health,The 50-Yr-Old Agreement Preventing Marijuana from Treating PTSD,,1,45,2014-03-16,PHARMA,0.049713317304849625,0.9031676054000854,0.04711903631687164
medicine,Maybe they are from Boston,,2,44,2014-03-16,PHARMA,0.05603111535310745,0.7581132650375366,0.1858556568622589
Health,Ear Wax: Recent research suggests it can indicate a build up of pollutants in the body - and it could even be used to diagnose certain conditions.,,0,34,2014-03-16,PHARMA,0.018224993720650673,0.9251638650894165,0.0566110759973526
medicine,How can 15% of 15 year olds be above the 90th percentile for weight?,"While going over some statistics for my pediatrics rotation I came across this fact. I am a little puzzled about how the percentile system is set up in this case. It would appear impossible that 15% of children are the top 10% for obesity. 

The source I read was Lissauer's Illustrated Textbook of Paediatrics.",9,33,2014-03-16,PHARMA,0.03991345316171646,0.9029869437217712,0.057099599391222
medicine,Midazolam vs Diazepam as Frontline Against Seizures,"I'm a paramedic. My protocol says to give Versed or Valium for seizures. I took PALS recently,  and in my practical exam said I would give Versed IN for the patient in apparent status epilepticus. The Instructor said no, Valium is our first choice, so I said fine let's do rectal Valium. I've done some research, and found at least a few studies saying that Versed is just as effective as Valium ([one example](http://www.bmj.com/content/321/7253/83), [A second, pdf](https://www.google.com/url?sa=t&amp;source=web&amp;rct=j&amp;ei=AfolU_TuPMTD2AWJzoDAAQ&amp;url=http://onlinelibrary.wiley.com/doi/10.1111/j.1553-2712.2010.00751.x/pdf&amp;cd=8&amp;ved=0CFAQFjAH&amp;usg=AFQjCNHDNcxhCg1wdjqF8la6gWLniRGhzA&amp;sig2=DzGcvTic-gM6ze7_Qp37kQ)).

So, what do you all think? If you were the receiving physician and I was bringing in a patient, would you rather I gave Versed or Valium?",46,22,2014-03-16,PHARMA,0.03047657199203968,0.9121027588844299,0.057420674711465836
Health,"Lessons In the Art of Dying -- In my dad’s day, doctors knew how to comfort the sick. I had to feel my way through his teachings.",,2,19,2014-03-16,PHARMA,0.081186443567276,0.8105589747428894,0.10825455188751221
Health,"Large waist linked to poor health, even among those in healthy body mass index ranges",,9,18,2014-03-16,PHARMA,0.8890467882156372,0.07922645658254623,0.03172669559717178
Health,US Government to Deregulate Meat Industry - Government is increasingly moving to prevent federal meat inspectors from exercising their authority at slaughter plants and instead allowing private industry to regulate itself,,25,242,2014-03-17,PHARMA,0.38413721323013306,0.5876204967498779,0.02824232168495655
medicine,Globalization at its best...,,5,157,2014-03-17,PHARMA,0.031177084892988205,0.9155724048614502,0.05325055122375488
Health,"Flu risk 'cut by vigorous exercise': Doing at least two and a half hours of vigorous exercise each week cuts the chance of developing flu, new data suggests.",,8,120,2014-03-17,PHARMA,0.26909080147743225,0.6861186027526855,0.04479062929749489
medicine,Good luck with the Match!,"Sending out good vibes to all of us who are finding out the results of The Match today.  I know I keep looking at the clock, and I drank way too much caffeine, which is making me about ten times more anxious.

May we all be lucky enough to be [this guy.](http://4.bp.blogspot.com/_e85U4QbYG7s/S1FEEWbzLnI/AAAAAAAACGo/GYGNTAQoT5s/s400/panel+4.jpg)",38,104,2014-03-17,PHARMA,0.050509534776210785,0.7029391527175903,0.24655131995677948
medicine,What do I do now? 2nd time not matching,"Current GS prelim resident. Last year applied to GS categorical community-type programs, got 10 interviews, didn't match. Received a GS prelim spot at a top-ranking CA surgery program during SOAP. Applied again this current ERAS cycle and received fewer interviews, plus applied to open positions outside of ERAS.

Now once again I am un-matched. OK, so the world has decided I can't do surgery, I'm coming to terms with that, but I'm more freaking out about being unemployed in 3 months once my current position ends.

So what can I do now? I'm not really sure what kind of options a PGY-1 has open at this point? I applied to SOAP, but it's pretty slim pickings this year.

Any advice appreciated at this point.",32,51,2014-03-17,PHARMA,0.029165292158722878,0.9127271771430969,0.05810758098959923
medicine,Cranial Nerves,,1,39,2014-03-17,PHARMA,0.03192180022597313,0.9112727046012878,0.05680547654628754
medicine,IAMA plastic surgery resident,Ask away. No identifiable info though. I am in an integrated program at a major US city.,43,37,2014-03-17,PHARMA,0.03951646760106087,0.9247631430625916,0.0357203483581543
medicine,Thought I'd share a little humor. Dr. Ken Jeong in Knocked Up...,,7,28,2014-03-17,PHARMA,0.04041620343923569,0.9019631147384644,0.05762066692113876
