subreddit,title,selftext,num_comments,score,created_utc,stock/sector,neg,neu,pos
medicine,"Meddit, I am confused about the medical profession.","Hey meddit,

I'm a young female doctor, based in Europe. I've been out of medical school for a year and some months, and have been on rotation in psych, internal med, and now surgery (for the next few months).  
  
My country (Norway) is facing some issues with:  
   **1.** unpaid overtime (about 800 full positions of unpaid overtime each year, estimated. in a country of 5 million, this is quite a lot.)  
   **2.** long working hours (my coworkers just had to accept a deal where they work 48 hr shifts where they are required to be physically at the hospital the entire shift, this was reduced from 72 hrs which was the original suggestion).  
   **3.** a lack of faith in my healthcare system.   

  Yes, yes, I know, it's one of the best in the world or something. But it seems like we strive for mediocrity. We aim to hit the baseline, nothing more. The focus is **always** on saving more money. More work, less people. This includes everything, and maybe especially the nursing staff suffers because of it. I've been living a life where I'm constantly fighting to cope with the work amount, but where I'm being governed by people unwilling to admit that we are overworked, and unwilling to pay for the extra time my coworkers and myself all put in because of it.

  Is this really my life? Is this what I chose? Is the medical profession so ""altruistic"" that it means I can't marry my (also a doctor) boyfriend because neither of us will ever, ever, EVER have the time to have kids, pick them up from school, help with homework? 

Is the sacrifice really this fucking high?

  I apologise. I am disillusioned and angry. People are treated like shit, and I don't understand why. Please help me understand why. 

**EDIT** Thank you so much for your input, everyone. I'm so torn between protecting myself and my future career, or taking a stand right now. I know I can deal with five more months of this, but I also know others are going to follow me. You've all given me a lot to think about.",59,128,2014-09-25,PHARMA,0.07746049761772156,0.8925032019615173,0.030036356300115585
pharmacy,"[The Onion] Pharmacists, one of the 12 top paying jobs in the US",,11,94,2014-09-25,PHARMA,0.0352550745010376,0.8758991360664368,0.08884573727846146
pharmacy,30 year collection in Fort Collins pharmacy [x-post /r/pics],,18,56,2014-09-25,PHARMA,0.033770181238651276,0.9154114127159119,0.050818346440792084
medicine,Wearable Dialysis Unit Starting Clinical Trial,,6,44,2014-09-25,PHARMA,0.021181002259254456,0.9248024225234985,0.054016564041376114
medicine,Anyone know of residency programs with an official paternity leave?,"Input from all countries welcome! 

My friend is a US med student editing an issue of a bioethics journal. We were looking for information about leave for parents during residency, and it seems like maternity leave is quite stigmatized (in the USA) and paternity leave doesn't seem to exist (Sweden, maybe?). She has tentatively contacted authors to write about these issues, but we haven't found any specific policies or articles about being a dad during residency.

Please let me know if you have any insight in these areas! Whether you are a bioethicist, a residenct mom/dad, or know one. :) Thank you!",48,30,2014-09-25,PHARMA,0.0329669713973999,0.9336789846420288,0.033354081213474274
pharmacy,Every time I'm trying to calculate the day supply for a medication.,,14,27,2014-09-25,PHARMA,0.05462485924363136,0.8896204233169556,0.055754758417606354
medicine,Face to face with Ebola- what it is like working in the Ebola outbreak,,0,27,2014-09-25,PHARMA,0.0312824584543705,0.9284741282463074,0.040243398398160934
Health,"Facebook's Mood Manipulation Experiment Might Have Been Illegal - Two University of Maryland law professors allege that the social network's experiments—and OkCupid’s—count as ""research,"" &amp; thus violate state statute.",,1,24,2014-09-25,PHARMA,0.44511425495147705,0.5360659956932068,0.018819838762283325
Health,"Why Don't We Treat Teeth Like the Rest of Our Bodies? - Dental care is excluded from most insurance plans for a bizarre &amp; antiquated reason, &amp; millions of people suffer as a result.",,82,628,2014-09-26,PHARMA,0.20031963288784027,0.7744389176368713,0.02524135448038578
medicine,"TIL: Despite his isolation of ATP, this Indian doctor was denied tenure at Harvard and remained without a green card throughout his life, though he would lead some of America's most important medical research during World War II",,18,253,2014-09-26,PHARMA,0.06420320272445679,0.806551992893219,0.12924474477767944
pharmacy,Sometimes work is bittersweet,,16,79,2014-09-26,PHARMA,0.12503983080387115,0.8428378105163574,0.03212236985564232
Health,"How did the 'Berlin patient' rid himself of HIV?: Researchers are closer to unraveling the mystery of how Timothy Ray Brown, the only human cured of HIV, defeated the virus, according to a new study",,3,32,2014-09-26,PHARMA,0.03572015464305878,0.8797739148139954,0.08450599014759064
medicine,Should We Eliminate the Handshake?,,9,27,2014-09-26,PHARMA,0.10279593616724014,0.8738461136817932,0.02335791289806366
medicine,The intersection of greed and medicine Why did Joan Rivers die? Let’s connect the dots..,"**The Intersection of Greed and Medicine**

Why did Joan Rivers die? Let’s connect the dots.

I loved Joan Rivers.  I never met her, but I loved listening to her on the Howard Stern show. She was an amazing guest. Listening to her over the years, I came to feel—as so many of her listeners did—that I actually did know her, that she had became almost a friend. I consider myself a humble but highly caring and ethical surgeon, and I cannot stop thinking about what killed Joan Rivers. I am convinced that she did not have to die. If things had been done in a proper and prudent fashion, she would still be alive and kicking.  

I had to try to figure out what went wrong in Joan’s care.

I think the answer is that the clinical decisions regarding her care were not made in her best interests.  Instead, her care was designed to make the most money for her doctors.  Gone are the days when I can say, “Trust me—I’m a doctor,” because too many of my fellow doctors can’t be trusted. Greed has warped their decision-making. Patients need to be better informed about how economic decisions affect their care.    

Dr. Karen Sibert has written an excellent analysis of the Joan Rivers case, “Anesthesiologist’s Review of the Facts in the Joan Rivers Case” (http://thehealthcareblog.com/blog/2014/09/15/an-anesthesiologists-review-of-the-facts-in-the-joan-rivers-case/). But what really happened is still a mystery. 

What follows includes some speculation, but it is my educated guess regarding what took place at Yorkville Endoscopy on 8/28/14 around 0930.  

Yorkville Endoscopy is in a miserable location on 2nd  Avenue in New York.  The construction of a new subway line is underway there. The subway construction and scaffolding erected at the entrance make it difficult to even get an emergency stretcher into the endoscopy suite!

Why did Joan have her procedure there?  Because Dr. Lawrence B. Cohen did not want to share his fees with Mount Sinai Hospital.  Joan’s procedure should have been done in the hospital, NOT in the ambulatory center.  She was old and fragile and precious.

Dr. Cohen is a super-smart doctor, but probably also an arrogant one.  By all accounts, he is a great gastroenterologist.  But he is also the main national proponent of having gastroenterologists capture the anesthesiology fees that would ordinarily—and properly—go to the anesthesiologist. These fees are a tempting target because the anesthesia provider will quite often be reimbursed at a higher rate than the gastroenterologist,.

Dr. David Dies has written a good analysis of Dr. Cohen’s effort to eliminate anesthesia personnel, “How Joan Rivers Might Save Your Life” (http://www.shreveporttimes.com/story/opinion/guest-columnists/2014/09/18/joan-rivers-might-save-life/15793599/ ). Dr. Dies understands Dr. Cohen’s mindset. 

Even though an MD anesthesiologist was in the room with Dr. Cohen during Joan’s entire procedure, that anesthesiologist was most likely an employee of Dr. Cohen’s and totally subservient to him.  In such a relationship, the anesthesiologist could not have any independent judgment and had to do whatever Dr. Cohen commanded.  The administration of anesthesia was a process owned by or dominated by Dr. Cohen. Therefore the anesthesiologist couldn’t cancel or reschedule the case.  

There may have a three-way decision (or conspiracy) among Dr. Cohen, Joan, and Joan’s good friend Dr. Gwen Korovin to have her vocal cords “checked out” while she was under anesthesia so that Joan would not feel any pain during the procedure. Dr. Korovin took a now-notorious selfie while Joan was under anesthesia. Why was Dr. Korovin even allowed to participate in the procedure? Well, Joan had given verbal consent to let her check out her raspy voice and to perform any indicated procedures.  No truly independent MD or Certified Registered Nurse Anesthetist (CRNA) would have permitted Gwen to take a selfie and then participate in the endoscopy. But there was no strong independent advocate for Joan at the head of the bed. 

From here on the rest of the story was inevitable.  Joan most likely had a vocal cord spasm that couldn’t be broken. The reason it couldn’t be broken might have been economic.

The only drug approved in the US to break a vocal cord spasm is an intravenous medication known as sux (*succinylcholine* or *suxamethonium chloride*).  Although sux itself it's not expensive, having sux available is expensive. If you buy sux, then you must also buy an antidote for a rare sux reaction termed *malignant hyperthermia* (MH).  An MH cart costs  about $2500 and is only good for 3 years.  My speculation is that Yorkville Endoscopy did not want to have sux in the building to save the MH cart costs.

But even without sux Joan could have been saved. 

If a simple tracheotomy or cricothyroidotomy had been performed quickly it could have saved her life—but neither procedure was performed, and Joan died. Why didn’t Dr. Korovin perform a tracheotomy or cricothyroidotomy? My speculation is that there may not have been enough equipment available in the ambulatory center to do either procedure and that Dr. Korovin became panic-stricken when Joan arrested. She probably wasn’t prepared for the crisis. In her panicked state she probably couldn’t think or function effectively. She may not have done a tracheotomy or cricothyroidotomy since her training days decades earlier. She was the ear, nose, and throat specialist to the stars, but she could not secure the airway of her brightest star patient.  

Joan probably consented to a very risky procedure. If so, her death was not really a case of “VIP syndrome” but rather an appalling lack of judgment on so many levels driven by greed and arrogance. Nobody had the courage or the incentive to stop the money train.  

Let’s make Joan’s death a teachable moment. There are several lessons to be learned from what happened to her.
Older and sicker patients should not be treated at an ambulatory endoscopy center. They should be taken care of in a hospital setting where there are abundant life-saving resources and there are always airway experts available within seconds.
 
Sux, an MH cart, and all possible life-saving equipment should be required and available whenever sedation is given for endoscopy or “minor procedures.”

The entrances and exits of any medical facility must accommodate an emergency stretcher.  

The standards of care for ambulatory anesthesia should be the same as that in the stringently regulated hospital environment.  When there are two highly qualified airway experts available to take care of you when you receive sedation (a board certified anesthesiologist and CRNA), then you are receiving true VIP care.

The anesthesiologist should be an independent and strong advocate for the patient and must be ever vigilant and stand up to a bullying or arrogant surgeon or gastroenterologist.  Joan was the victim of poor care and terrible judgment and she had nobody to protect her when she went to sleep for her last time.  

Rest in peace funny lady!  And Bababooey to you all! Tweet this if you find it interesting!",25,22,2014-09-26,PHARMA,0.06406076811254025,0.9079924821853638,0.02794671431183815
Health,Overworked and underpaid? You may be at greater risk of diabetes,,0,19,2014-09-26,PHARMA,0.12460247427225113,0.8225193023681641,0.05287826433777809
Health,"Wonder spice: According to a new research, A compound in turmeric, the key ingredient in most curries, may hold the key to repairing the brains of people with neurodegenerative diseases such as Alzheimer's.",,1,16,2014-09-26,PHARMA,0.019275115802884102,0.901404857635498,0.0793200135231018
medicine,Thoughts on cuban medicine,"The medicine in Cuba is quite a controversial topic of discussion. While some claim that it is an example of medical practice, which succeeds in disease prevention and health promotion, based upon equity, some others are firm on their beliefs that Cuban healthcare is far from what the propaganda shows, relying on a poor, limited medical practice. I'm a medical student from Brasil, and recently our government started importing doctors from Cuba. What caused revolt among the medical community is that the doctor that came through this program did not have to take the test to validate their diplomas, like every professional who graduated abroad has to. So, what do you, medical students and professionals have to say about that matter? Do you have any experience with cuban professionals or with their healthcare system? (Please, refrain from ideological debate. The goal is to discuss the quality of medical education, not politics)",4,14,2014-09-26,PHARMA,0.04543310031294823,0.9110269546508789,0.043539922684431076
Health,Sierra Leone widens Ebola quarantine to three more districts,,0,12,2014-09-26,PHARMA,0.03446359187364578,0.9140229225158691,0.05151350796222687
medicine,"A sobering blog about how when everything is done right, everything can still go wrong",,17,115,2014-09-27,PHARMA,0.09508519619703293,0.8465997576713562,0.05831507593393326
medicine,Penicillin,On this day (September 28) in 1928 Sir Alexander Fleming noticed a bacteria-killing mold growing in his laboratory &amp; discovered what would eventually be named Penicillin.,17,85,2014-09-27,PHARMA,0.014523289166390896,0.9048314094543457,0.08064526319503784
medicine,"Are we entering the era of ""Sugarcoating"" Medical records?",,54,80,2014-09-27,PHARMA,0.08859021961688995,0.8551562428474426,0.0562535896897316
Health,"Top third of population by protein intake have 40% lower hypertension risk, a condition predisposing to strokes/heart disease, shows first 11 yr longitudinal study of 1,361 adults and controlled for confounding variables. Author asks for reevaluation of optimal protein intake for heart health.",,7,60,2014-09-27,PHARMA,0.0484001487493515,0.9156887531280518,0.03591114655137062
Health,Apparent success against Ebola with HIV drug in Liberia,,3,59,2014-09-27,PHARMA,0.011475985869765282,0.3508031368255615,0.6377208232879639
medicine,Check out /r/FOAMED - A subreddit dedicated to free medical education resources,,0,38,2014-09-27,PHARMA,0.018540168181061745,0.936539351940155,0.04492047801613808
medicine,The Sorry State of Homebirth Midwifery in Oregon,,3,32,2014-09-27,PHARMA,0.1120658665895462,0.8617080450057983,0.026226066052913666
Health,"U.S. rate of Type 2 diabetes stabilizes, CDC reports -- Type 2 diabetes rate is stable overall, but is still on the rise for blacks, Latinos and younger Americans",,0,22,2014-09-27,PHARMA,0.08600909262895584,0.09888060390949249,0.8151102662086487
Health,Merck Has Some Explaining To Do Over Their MMR Vaccine Claims,,4,21,2014-09-27,PHARMA,0.016948537901043892,0.8905094861984253,0.09254200756549835
Health,"How plankton gets jet lagged - Evolutionary link between sleep and rhythmic swimming behaviour: Hormone that govern sleep and jet lag in humans also drives mass migration of plankton, scientists have found",,0,15,2014-09-27,PHARMA,0.023915795609354973,0.92873215675354,0.04735209047794342
Health,Study Links Anxiety Drugs to Alzheimer's Disease - NYTimes.com,,19,100,2014-09-28,PHARMA,0.05787641927599907,0.9075598120689392,0.0345638133585453
Health,How physical exercise protects the brain from stress-induced depression,,7,88,2014-09-28,PHARMA,0.027196785435080528,0.9277111291885376,0.04509204626083374
medicine,Hepatitis C outbreaks at three Toronto colonoscopy clinics kept secret,,6,86,2014-09-28,PHARMA,0.10926753282546997,0.8659365773200989,0.0247958954423666
Health,The Woman's Heart attack,,12,67,2014-09-28,PHARMA,0.3396608829498291,0.5948194861412048,0.06551958620548248
Health,"While American paediatricians warn sleep deprivation can stack the deck against teenagers, a new study reveals youth’s irritability and laziness aren’t down to attitude problems but lack of sleep.",,1,48,2014-09-28,PHARMA,0.06966153532266617,0.8905834555625916,0.03975502401590347
medicine,Project Marilyn aims to create an open-source anti-cancer drug,,11,46,2014-09-28,PHARMA,0.023432256653904915,0.9116315841674805,0.06493616849184036
Health,An interesting article on why home-cooked meals are difficult for many low- and middle-income families.,,0,37,2014-09-28,PHARMA,0.06631045043468475,0.8864374756813049,0.047252096235752106
medicine,Heroin Overdose and Confidentiality,"You overdosed on heroin 10 years ago, were tested for HIV and HepC multiple times and they always come back negative. You also haven't used since and got your life together.  

You are now a 3rd year medical student, do you tell a physician taking a history during a physical about your past?  What if you are doing rounds in the same hospital?  I know they can't really say anything, but I'd rather avoid the judgement.  What do you think?",8,26,2014-09-28,PHARMA,0.1198544055223465,0.851324200630188,0.028821464627981186
medicine,An electronic revolution in the doctor's bag,,7,19,2014-09-28,PHARMA,0.025222955271601677,0.9200329184532166,0.054744135588407516
Health,"Sticky Nanobeads that Can clean Bacteria, Viruses From Blood",,0,19,2014-09-28,PHARMA,0.026368053629994392,0.9316993355751038,0.041932620108127594
medicine,"Pediatricians Endorse IUDs, Implants for Teen Birth Control. They should be the ""first-line"" choices for teenage girls",,114,241,2014-09-29,PHARMA,0.029672546312212944,0.9288471341133118,0.04148036986589432
Health,"Walking is the superfood of fitness, experts say",,68,154,2014-09-29,PHARMA,0.02341676503419876,0.9048107266426086,0.07177247107028961
medicine,Men circumcised in childhood/adolescence are at substantially reduced risk of invasive penile cancer,,103,78,2014-09-29,PHARMA,0.024600479751825333,0.89500492811203,0.08039464801549911
medicine,Choosing the right surgical specialty.,,5,43,2014-09-29,PHARMA,0.021278802305459976,0.8980074524879456,0.08071379363536835
medicine,Michigan doctor admits to falsely diagnosing patients with cancer in order to profit from their unnecessary chemo treatments,,10,41,2014-09-29,PHARMA,0.6233998537063599,0.3477628529071808,0.028837282210588455
Health,"The World War II Campaign to Bring Organ Meats to the Dinner Table - As pork &amp; beef were shipped overseas to feed the soldiers, US govt enlisted Margaret Mead and a team of anthropologists make hearts, livers, &amp; kidneys a mainstream part of American dining. They succeeded, sort of.",,4,38,2014-09-29,PHARMA,0.018784478306770325,0.9107122421264648,0.07050322741270065
Health,"The Infant Mortality Rate in the US is too High - “The U.S. lags behind other developed countries because there remain significant gaps in access to and utilization of prenatal and preconception care,"" experts warn.",,6,37,2014-09-29,PHARMA,0.14674483239650726,0.7826883792877197,0.07056687772274017
medicine,Am I making the right decision?,"I'm red green colorblind and im planning to study medicine and i was wondering if was making the right call should I look for another career?. Would my vision deficiency present any major troubles? What areas of medicine would present the biggest troubles?
My biggest concern is badly hurting people",35,30,2014-09-29,PHARMA,0.054636839777231216,0.9036827087402344,0.0416804701089859
medicine,Vitamine D receptor activation leads to 57% increase in survival rate in animal model of pancreatic cancer,,0,28,2014-09-29,PHARMA,0.01450310181826353,0.5207613110542297,0.4647355377674103
medicine,"Quackademia update: The Cleveland Clinic, George Washington University, and the continued infiltration of quackery into medical academia",,0,28,2014-09-29,PHARMA,0.018735026940703392,0.9117171168327332,0.06954782456159592
Health,The Pharmacy School Bubble is About to Burst - One of America's most reliable professions is producing too many graduates &amp; not enough jobs,,64,240,2014-09-30,PHARMA,0.301639586687088,0.1568208932876587,0.5415395498275757
medicine,"Ebola diagnosed in Dallas, TX; first diagnosis in US.",,58,133,2014-09-30,PHARMA,0.0332195870578289,0.9163470268249512,0.05043341591954231
medicine,Doctor pleads guilty to ordering unnecessary chemotherapy and billing Medicare,,27,71,2014-09-30,PHARMA,0.8167635202407837,0.13705475628376007,0.046181775629520416
Health,CDC confirms first ebola case diagnosed in US,,19,71,2014-09-30,PHARMA,0.07233448326587677,0.7843242287635803,0.1433413326740265
pharmacy,Pharmacy School Crisis: Why the Good Jobs Are Drying Up,,97,49,2014-09-30,PHARMA,0.01978990249335766,0.6647288203239441,0.3154813051223755
Health,CDC has confirmed an Ebola case in Texas,,3,48,2014-09-30,PHARMA,0.7312445044517517,0.17188753187656403,0.09686799347400665
pharmacy,MRW a co-worker catches a patient lying about how frequently they fill a controlled substance,,9,48,2014-09-30,PHARMA,0.5734975337982178,0.399425208568573,0.02707727998495102
Health,"Standing Desks Are Coming To Schools, To Cure Obesity And Increase Attention Spans",,8,34,2014-09-30,PHARMA,0.016313940286636353,0.7492731809616089,0.23441283404827118
Health,First Ebola case diagnosed on US soil,,2,33,2014-09-30,PHARMA,0.02527373470366001,0.9098716378211975,0.06485461443662643
Health,US has first diagnosed case of Ebola in Dallas,,3,25,2014-09-30,PHARMA,0.05538463592529297,0.8848418593406677,0.05977347865700722
