subreddit,title,selftext,num_comments,score,created_utc,stock/sector,neg,neu,pos
medicine,IamA 40 year plus male who never went through puberty due to a medical condition called Kallmann Syndrome.,"**My short bio:**
I have Kallmann syndrome. It is a rare genetic condition that meant I did not go through puberty. I also do not have a sense of smell. After years of being dismissed as ""late developer"" or ""late bloomer"" I was not correctly diagnosed until I was 23.

Since I lack any testicular development I need to be on life long testosterone replacement therapy to give me normal male testosterone levels.

I am currently on another form of treatment, called gonadotropin therapy which should induce fertility.

I talk to a lot of fellow patients on-line and in person and I keep in touch with medical experts in this condition so I can try to help other people with it.

Late diagnosis is very common and we are often dismissed as late developers or late bloomers. The condition affects both men and women and has an incidence of around 1 in 50,000.

I am always happy to talk to other people about my condition.

**My Proof:** http://kallmannsyndrome.wordpress.com/",66,134,2014-03-01,PHARMA,0.04641395062208176,0.9153763651847839,0.03820963576436043
Health,"Don’t throw out old, sprouting garlic — it has heart-healthy antioxidants: “Sprouted” garlic is considered to be past its prime and usually ends up in the garbage can. But scientists report that this type of garlic has even more heart-healthy antioxidant activity than its fresher counterparts",,11,105,2014-03-01,PHARMA,0.05136265605688095,0.9146386384963989,0.0339987650513649
Health,"West Virginians Raise Alarm as Research Links Coal Mining to Cancer, Birth Defects",,6,92,2014-03-01,PHARMA,0.058767955750226974,0.8900911808013916,0.051140863448381424
medicine,Frustrates me every time,,20,85,2014-03-01,PHARMA,0.04933759942650795,0.9146561622619629,0.03600623458623886
medicine,Psychiatrists and neurologists of meddit: biggest misconceptions about your specialties,"Hi! I'm a US med student that will be making my 4th (final) year schedule in a few months, and although I've been drawn to each and every specialty during my 3rd year rotations, I'm terribly, terribly interested in the human brain. I might be putting a schedule together to direct myself to one of those specialties, so I've done a lot of reading and 'soul-searching,' but I'd also like to get a sense of what psychiatrists and neurologists RIGHT NOW think about their specialties.


Specifically, I'd like to know what 'bullshit' people might be telling me in the near future about the specialties so I can look out for it, if I do decide to go in one of those two directions. **What are the biggest misconceptions about your specialty, and what is the truth?**


If you have **any advice to give** regarding current and future trends for your specialty (especially if it gets me excited about it), that would be appreciated, as well!


Thanks!


Edit: so, mostly stuff about neurologists so far... any psychiatrists out there?",16,58,2014-03-01,PHARMA,0.026353349909186363,0.9332239031791687,0.04042269289493561
pharmacy,Clever.,,0,42,2014-03-01,PHARMA,0.043917275965213776,0.875625491142273,0.0804571881890297
Health,"UK researchers: ""Regular nightmares in childhood may be an early warning sign of psychotic disorders.""",,6,38,2014-03-01,PHARMA,0.8049536347389221,0.17327523231506348,0.02177114598453045
medicine,Please tell me it gets better.,"My boyfriend is in residency and he has been for our entire relationship (we met a few months into his intern year and we've been together for almost three years - he's a senior now). Right now he's exhausted 90% of the time, and his days largely consist of sleeping and working. Will it get better when he's done? Will he be able to start living his life again? Will he have the energy to have sex again? Will he have the motivation to go to the gym and have some hobbies again?

Did things get better for you after residency? What should we expect?

Some background: we're a gay couple, I'm a few years younger than he is, and he's in emergency medicine.",36,34,2014-03-01,PHARMA,0.027936246246099472,0.8702309727668762,0.10183276236057281
Health,"Vision improved by brain-training app: Test in baseball players led to fewer strikeouts, more runs and more wins",,1,26,2014-03-01,PHARMA,0.025963133201003075,0.7135356068611145,0.26050126552581787
Health,NPR: Why The 'Non-GMO' Label Is Organic's Frenemy,,0,22,2014-03-01,PHARMA,0.03312547504901886,0.9221065640449524,0.04476798698306084
Health,Seth Rogan publicly shames senators after they walk out on his testimony about Alzheimer's,,32,332,2014-03-02,PHARMA,0.12202007323503494,0.8136999011039734,0.06428004056215286
medicine,"FDA is allowing generic Plan B One-Step, morning-after pill, to be sold without proof of age &amp; prescription.",,112,305,2014-03-02,PHARMA,0.019930079579353333,0.919102668762207,0.060967184603214264
medicine,A colleague called him a sociopath and a “clear and present danger” to patients. Another doctor compared him to a serial killer.,,9,38,2014-03-02,PHARMA,0.6700385212898254,0.29353299736976624,0.0364285446703434
pharmacy,Or I draw a penis on the Viagra bottle.,,7,32,2014-03-02,PHARMA,0.02406107261776924,0.9425462484359741,0.03339267894625664
Health,Not Just a Stereotype: The Appalachian Area Dental Crisis,,0,24,2014-03-02,PHARMA,0.05881442502140999,0.9088123440742493,0.03237323462963104
Health,FDA Spies On Whistleblowers to Protect Big Pharma,,3,22,2014-03-02,PHARMA,0.0385332927107811,0.9208958745002747,0.04057079553604126
pharmacy,pharmacy hunchback,"so as a relatively new pharmacist i often see some of the more seasoned veterans with some really bad hunchbacks/posture. 

it's clearly from bending over and checking prescriptions all day. 

i am terrified of having this happen to me so i try to stretch whenever i can at work, but sometimes it slips my mind when things get busy

any tips for maintaining good posture and preventing this from happening?

thanks",28,19,2014-03-02,PHARMA,0.0673195868730545,0.8689344525337219,0.06374596059322357
medicine,"Help, Medditors . . . how do I learn how to code?","I'm a new family doc, finished residency last year.  Wasn't really taught how to bill in residency and now I need to figure it out on my own.  Do any of you know of good books, websites, etc. that I can read?  I know ICD-10 is coming, but I actually need to go over the basics.  Thank you!",15,17,2014-03-02,PHARMA,0.024194341152906418,0.9179896712303162,0.05781596526503563
medicine,Operating on terminal patients when the risks are high,"Sometimes a patient is terminal because the patient is inoperable. I have a few questions regarding this;

1: Does inoperable sometimes mean that the risks dont outweigh the benefits? 

2: If true then who decides this? And can the patient appeal?

3: Hypothetically, if a patient has roughly 6 weeks to live without surgery, and the surgery has a 99% mortality rate and a 1% chance of extending the patients lifespan by a mean of 5 years. Is this patient considered inoperable and thus terminal?

4: Are there guidelines and thresholds to decide when a patient is inoperable?

5: Are there surgians that specialize in operating unoperable patients?

Greetings from Holland.",11,12,2014-03-02,PHARMA,0.05055435746908188,0.9146441221237183,0.03480159491300583
medicine,Costly hepatitis drug Sovaldi rattles industry,,4,11,2014-03-02,PHARMA,0.04615633934736252,0.9170786142349243,0.036765050143003464
Health,FDA Expands Access to Generic Morning-After Pill - Cheaper alternatives to Plan B can now be sold over the counter without age restrictions,,4,157,2014-03-03,PHARMA,0.01311276014894247,0.8871462941169739,0.0997409000992775
medicine,The imposter syndrome: Maybe only undeserving students nudge their way into medical school?,,69,130,2014-03-03,PHARMA,0.03156895935535431,0.9165436625480652,0.05188744142651558
pharmacy,And then I was embarrassed of the adrenaline rush it gave me.,,15,109,2014-03-03,PHARMA,0.33748579025268555,0.4063493311405182,0.25616490840911865
pharmacy,Trazodone tower. just poured out that way,,11,79,2014-03-03,PHARMA,0.03914016857743263,0.9119315147399902,0.04892834275960922
Health,"Vaccination messages may backfire, study finds: Although public health researchers have worked to counter misinformation about vaccines and raise vaccination rates, a number of the methods they are using may be ineffective, according to a new study",,36,48,2014-03-03,PHARMA,0.028409739956259727,0.9011633396148682,0.07042685896158218
Health,NHS England patient data 'uploaded to Google servers',,0,25,2014-03-03,PHARMA,0.07003332674503326,0.9111475944519043,0.018819084390997887
pharmacy,I love being a pharmacist.,"I work at a hospital and it's exciting, I learn all the time, it's a decent amount of stress but not too much, and I just love the material. Anyone else love pharmacy?",10,21,2014-03-03,PHARMA,0.0373758003115654,0.9029189348220825,0.0597052238881588
medicine,Another blow to private practices -- NYT article on the ACA's pressures on independent docs.,,5,19,2014-03-03,PHARMA,0.029793495312333107,0.9070134162902832,0.06319308280944824
Health,"Doctors' Stethoscopes Can Transmit Bacteria As Easily As Unwashed Hands - New research shows that the instruments could be a vector for bacterial infections—a concern, as they're infrequently sterilized",,1,17,2014-03-03,PHARMA,0.01512442622333765,0.8540918231010437,0.1307837963104248
Health,More dangerous chemicals in everyday life: Now experts warn against nanosilver,,2,16,2014-03-03,PHARMA,0.09889508038759232,0.8670688271522522,0.03403612598776817
medicine,Your Doctor Is Probably Not Fat-Shaming You,,145,187,2014-03-04,PHARMA,0.23214660584926605,0.7292259335517883,0.038627494126558304
Health,"A Better Way to Go? LSD, Reconsidered for Therapy for People Nearing End of Life",,30,187,2014-03-04,PHARMA,0.05743543803691864,0.890487790107727,0.052076712250709534
medicine,Belgium permits euthanasia for terminally ill kids of any age,,32,136,2014-03-04,PHARMA,0.025341760367155075,0.9107593297958374,0.0638989508152008
Health,Anti-Vaccination Parents Dig in Heels Even After Receiving Medical Info: Parents were less likely to think vaccines caused autism but strangely less likely to want their children to be vaccinated after being educated about the lack of a vaccine-autism link,,56,81,2014-03-04,PHARMA,0.08559984713792801,0.8791986107826233,0.035201530903577805
Health,"Are Any Plastics Safe? Industry Tries to Hide Scary New Evidence on BPA-Free Bottles, Containers",,9,33,2014-03-04,PHARMA,0.061590250581502914,0.8859392404556274,0.05247046798467636
medicine,"Human Longevity Inc. founded by J Craig Venter &amp; Peter Diamandis, launched today, with the explicit goal of extending lifespan.",,4,29,2014-03-04,PHARMA,0.012252685613930225,0.9081994891166687,0.07954783737659454
medicine,Being a doctor was once a job with great purpose. Now it's just a business - The Guardian,,2,24,2014-03-04,PHARMA,0.029941875487565994,0.9251207113265991,0.04493739455938339
Health,Physicians have devised a way to treat atrial fibrillation by adding a little alcohol to minimally invasive therapies that target a cluster of misbehaving nerves known to trigger arrhythmia,,2,19,2014-03-04,PHARMA,0.03487202152609825,0.901275098323822,0.06385291367769241
medicine,ABBVIE Hep-C Regimen Demonstrates ~99% 12 Week Sustained Virologic Response Rates,"[The results](http://www.fiercebiotech.com/press-releases/abbvie-present-late-breaker-pearl-iii-study-patients-chronic-hepatitis-c-21-0)  

I've been following this field for a while, and Gilead, ABBVIE, and BMS have posted impressive results.  

However, pricing is still going to be an issue, but it's hard to argue that from an R&amp;D perspective when you've sunk over $200 million into clinical development for just one drug, and you have a pipeline of drugs that all need support.  The R&amp;D of these new Hep-C molecules was supported by existing product sales, which when they were in development, were supported by now generic meds.  

It's good to see that there are still some leadership left in Pharma that didn't kill these in early-stage development in favor of another antipsychotic or interferon injection...",6,19,2014-03-04,PHARMA,0.02042166329920292,0.803416907787323,0.17616136372089386
Health,Study: Doctors are fueling prescription-drug addictions,,3,15,2014-03-04,PHARMA,0.03900178521871567,0.9237416386604309,0.03725651279091835
medicine,Help cure a fatal genetic disease,"Reddit,

I have a incurable muscle wasting disorder called Duchenne Muscular Dystrophy. It's a rapidly progressive disease and 100% fatal. 1 in 3500 male children are born with it. People suffering from this disorder lose the ability to run, walk, and move. Breathing becomes extremely difficult and most will lose their lives due to respiratory failure. All become dependent on ventilators, and still die in their 20s and 30s from heart failure.

Time is running out, for me, for all of my fellow sufferers. If ever there was a glimmer of hope, the time is now. Recent advances in an experimental exon skipping drug, Eteplirsen, have shown signs of slowing muscle degeneration. This drug has shown no serious side effects, but the FDA is dragging their feet. 

I'm not asking for donations. I'm asking for you to upvote this. I'm asking you to sign this White House petition. Link is at bottom of my post. Please also share this to your social networks. Love you guys and thank you.



https://petitions.whitehouse.gov/petition/urge-fda-say-yes-accelerated-approval-safe-effective-therapies-children-duchenne/qtRww0rN#thank-you=p


This is a [serious] post.",27,219,2014-03-05,PHARMA,0.05635146051645279,0.9032607674598694,0.04038780555129051
medicine,"Google autocomplete on ""Doctors are"" is pretty hostile",,119,208,2014-03-05,PHARMA,0.028137492015957832,0.8989567756652832,0.07290570437908173
Health,"Meet Lammily, the ""Normal Barbie"" doll that looks like a real, healthy woman with normal dimensions",,50,171,2014-03-05,PHARMA,0.01755165122449398,0.8921613693237305,0.09028694033622742
Health,Only 5% of Calories Should Be From Sugar says World Health Organization,,21,91,2014-03-05,PHARMA,0.03261454030871391,0.8928372859954834,0.07454816997051239
Health,Ricki Lake &amp; the Rise of the Birth Control Truthers - The former talk show host is producing a new documentary warning women about the risks of taking the pill. Is there any basis to her claims?,,54,72,2014-03-05,PHARMA,0.029696082696318626,0.8735619187355042,0.09674201160669327
Health,"Kroger, Safeway join trend away from GMO food: Largest U.S. grocery stores will not sell genetically engineered salmon",,2,60,2014-03-05,PHARMA,0.01728537306189537,0.9208694696426392,0.06184519827365875
Health,FOIA documents reveal that the USDA warned the egg industry that saying eggs are nutritious or safe violates rules against false and misleading advertising,,15,38,2014-03-05,PHARMA,0.14547324180603027,0.8285079598426819,0.026018818840384483
medicine,"Introducing /r/medlabprofessionals, a subreddit for the largely overlooked but nevertheless hugely important profession of medical laboratory professionals. Come say hi, ask questions, whatever!",,2,38,2014-03-05,PHARMA,0.017947090789675713,0.914944052696228,0.06710879504680634
medicine,third year medical student interested in pathology. any advice from residents?,"Any pathology residents on here... Looking for advice on residency programs, and also interested to know what it's like being in pathology. What programs did you like when you were on the interview trail and why? I'm a little concerned that the job market is challenging right now. Can anyone speak to this? 

Still deciding exactly what I want to purse. Thinking about IM too. Like  the medicine stuff a lot but the social issues and discharge planning are kind of boring to me. 

Have been interested in pathology since first and second year but will not get to do a rotation in it until this summer, so it's still kind of up in the air as to whether or not it will fit me. Appreciate anything you all can share with me though.",20,32,2014-03-05,PHARMA,0.0353025421500206,0.9245761036872864,0.040121328085660934
Health,"Fracking health risks must be established now, before the industry grows",,0,30,2014-03-05,PHARMA,0.18666192889213562,0.7616629004478455,0.05167514085769653
medicine,"With 2+ feet of titanium along my spine, I feel bionic!",,81,184,2014-03-06,PHARMA,0.012428274378180504,0.8258457779884338,0.16172587871551514
Health,Alzheimer’s Estimated to Be No. 3 Killer Disease in U.S.,,16,128,2014-03-06,PHARMA,0.2024717628955841,0.7591382265090942,0.03839002549648285
Health,A third of nursing home patients harmed by their treatment,,8,57,2014-03-06,PHARMA,0.9411342144012451,0.04408411309123039,0.014781654812395573
medicine,Mount Sinai Cath Lab Takes NYC Heart Emergencies by Appointment,,10,51,2014-03-06,PHARMA,0.08563573658466339,0.8562626838684082,0.058101508766412735
Health,US Health Czar Shows Amazing Ignorance About Marijuana Facts - You'd think the director of NIH would know a thing or 2 about the science of cannabis. You'd be wrong.,,2,29,2014-03-06,PHARMA,0.01699460856616497,0.9136460423469543,0.0693594291806221
medicine,2015 Obama budget guts PAYE and PSLF loan repayment programs for doctors (xpost from r/medicalschool),,14,21,2014-03-06,PHARMA,0.046544112265110016,0.9042262434959412,0.049229614436626434
Health,"High Phthalate Levels in Males Delays Pregnancy in Partners – Women whose male partners have high concentrations of 3 common phthalates, chemicals found in 100s of consumer products, take longer to become pregnant than women in couples where the male doesn't have high concentrations.",,2,21,2014-03-06,PHARMA,0.0371040441095829,0.9127956032752991,0.05010039731860161
medicine,That about sums up surgery rotation,,10,15,2014-03-06,PHARMA,0.19178980588912964,0.7292170524597168,0.07899320870637894
Health,Top 10 Toxic Ingredients Used In The Fossil Fuel Industries | PlanetSave,,2,15,2014-03-06,PHARMA,0.06729810684919357,0.6637781858444214,0.26892367005348206
pharmacy,TEDxJJ Talk Alissa Lynch and Dr. Zane Gates on the healthcare industry,,0,13,2014-03-06,PHARMA,0.024913575500249863,0.9358214735984802,0.039264969527721405
Health,Second baby born with HIV now clear of virus,,4,183,2014-03-07,PHARMA,0.12056213617324829,0.7883991599082947,0.09103872627019882
medicine,"A year ago I posted some of my medical illustrations. Here are some new ones! What do you think, meddit?",,27,158,2014-03-07,PHARMA,0.025859786197543144,0.8780085444450378,0.09613160789012909
Health,"As consumers became more concerned about the amount of fat in their food, manufacturers went out of their way to make low-fat items - often substituting sugar to preserve the taste. New proposed sugar guidelines equals to less than a soda a day",,22,126,2014-03-07,PHARMA,0.22035180032253265,0.7411288619041443,0.03851931169629097
medicine,Pfizer recalls Effexor XR and Venlafaxine HCI extended-release antidepressants fearing that there may have been the wrong drug in the bottle: Use of Tikosyn (antiarrhythmic drug) by an Effexor/Venlafaxine patient potentially could cause serious adverse health consequences that could be fatal.,,15,77,2014-03-07,PHARMA,0.526565670967102,0.4527535140514374,0.020680835470557213
medicine,"Retain the Public Service Loan Forgiveness Program, which reduces student debt and encourages careers in public service, academic, and primary care",,1,30,2014-03-07,PHARMA,0.028880536556243896,0.8282209038734436,0.1428985893726349
pharmacy,When running an interaction check on a list of meds that includes warfarin...,,4,27,2014-03-07,PHARMA,0.09794382750988007,0.8604384660720825,0.0416177473962307
medicine,Gabapentin abuse?,"I recently had a chronic pain patient go through a 3 months supply of gabapentin 800mg in 2 weeks. The patient paid cash instead of using their insurance and picked up the rx in gaps, 40 pills one day, 60 pills a few days later. They did not pick up the 100mg gabapentin tablets I had also rx. I can only suspect they are selling it or abusing somehow... But... Why?",21,24,2014-03-07,PHARMA,0.028560319915413857,0.9300110936164856,0.041428595781326294
pharmacy,"I know such a therapy should go without saying, but finally making this happen was a big deal to me as a student pharmacist.",,6,17,2014-03-07,PHARMA,0.020116567611694336,0.9103201031684875,0.06956327706575394
pharmacy,Skills For Different Pharmacy Fields (Hospital vs. Retail vs. Industry vs. Nuclear vs. Managed Care),"What would you say is the most important knowledge base needed for each of these specialties?

I would imagine a strong knowledge of Top 200 drugs is very important for retail, along with familiarity with dosage forms and strengths. I can't imagine that being the same for industry.

I would also imagine that a clinical pharmacist would face a steep learning curve if switching to nuclear. 

Any info you have would be really helpful.",5,16,2014-03-07,PHARMA,0.011786418035626411,0.8227963447570801,0.16541726887226105
pharmacy,Why would you use Narcan for a non overdose situation?,"I'm a bit confused about the following situation.

A 58 year old woman has been in the ICU for a week and she came in with sepsis, pancreatitis, colitis, and a handful of other issues. Her hemoglobin had been dropping over the last few days so they decided to do a colonoscopy. During the colonoscopy, her breathing dropped and her sats went into the 80s. They were about to intubate, but instead the doctor gave Narcan and the patient came back and they quit the procedure. The only medication given was propofol. 

Now, it was my understanding that Narcan is used to reverse opioid overdose by blocking the μ-opioid receptors. So I am a bit confused on why the doctor thought it was a good idea. I have a few scenarios but I don't know which is the most likely.


* Did he think the sedation for the colonoscopy might have been too much and he used Narcan to combat that?

* Or can it be used to treat respiratory depression, even without opiate use?

I know for a fact the reason isn't a suspicion of actual opiate misuse.

Any thoughts on those? Or am I missing another indication?",20,13,2014-03-07,PHARMA,0.1457310914993286,0.8232442140579224,0.031024718657135963
Health,"Vitamin D increases breast cancer patient survival, study shows: Breast cancer patients with high levels of vitamin D in their blood are twice as likely to survive the disease as women with low levels of this nutrient, report researchers",,11,112,2014-03-08,PHARMA,0.06727679818868637,0.8806101083755493,0.05211314558982849
medicine,"Doctors in Congress, 17 in the House, 3 in the Senate",,56,87,2014-03-08,PHARMA,0.06208807975053787,0.9064720869064331,0.031439851969480515
Health,"Higher levels of omega-3 in diet are associated with better sleep, study shows: A randomised placebo-controlled study suggests that higher levels of omega-3 DHA, the group of long-chain fatty acids found in algae and seafood, are associated with better sleep",,2,80,2014-03-08,PHARMA,0.021638644859194756,0.7307561039924622,0.24760526418685913
pharmacy,One of these things is not like the others...,,9,43,2014-03-08,PHARMA,0.026300713419914246,0.9174304604530334,0.05626879259943962
medicine,Manu Prakash: A 50-cent microscope that folds like origami,,2,31,2014-03-08,PHARMA,0.03114735521376133,0.9098323583602905,0.05902029573917389
medicine,Patient Privacy and Pathology Images,Hi everyone. I take a lot of photos of neat specimens and slides at work and would love to share them with people here for interest/education. There is no patient identifying information included in the photos. Would it be okay to post them here with a description of the disease process? Or would I need to get the patient's permission to do so? What if the patient is deceased? Does the 2 volume 4000 page pathology textbook get the permission of every patient to print photos of their tumors and diseases? I really believe in the internet as a teaching tool but there are lots of interesting ethical questions involved.,14,30,2014-03-08,PHARMA,0.03341171145439148,0.9341459274291992,0.03244233503937721
Health,"WHO urging people to limit sugar calories to below 10%, below 5% if possible",,0,23,2014-03-08,PHARMA,0.04300852119922638,0.9082443118095398,0.04874713718891144
Health,"Doctors are top source of prescription drugs for chronic abusers: Results of federal study show more focus is needed on doctors who are 'problem prescribers.' Prescription drugs contribute to more than 16,000 fatal overdoses a year.",,4,22,2014-03-08,PHARMA,0.10849779099225998,0.8200682997703552,0.07143396139144897
Health,"Do You Have Computer Vision Syndrome? - Those of us who spend 2 or more continuous hours at a computer most days are, the American Optometric Association says, at risk for eye problems. Here are some things to do to avoid the specter of Computer Vision Syndrome (CVS).",,3,21,2014-03-08,PHARMA,0.10680489987134933,0.8600453734397888,0.03314976394176483
Health,"Energy drinks linked to teen health risks: The uplifting effects of energy drinks are well advertised, but a new report finds consumption among teenagers may be linked with poor mental health and substance use",,2,21,2014-03-08,PHARMA,0.5980332493782043,0.2855217754840851,0.11644493788480759
Health,Chemists have discovered a new class of antibiotics to fight bacteria such as methicillin-resistant Staphylococcus aureus (MRSA) and other drug-resistant bacteria that threaten public health,,23,144,2014-03-09,PHARMA,0.015491386875510216,0.9169296622276306,0.06757891923189163
