subreddit,title,selftext,num_comments,score,created_utc,stock/sector,neg,neu,pos
Health,"Americans Can Now Drop Off Their Unused Prescription Drugs at Pharmacies - It's a new strategy for trying to crack down on prescription drug abuse, since nearly 40% of teens get their pills from family medicine cabinets.",,6,64,2014-09-10,PHARMA,0.071673683822155,0.7632269859313965,0.1650993525981903
Health,"No Association Between Salt And Blood Pressure, Study Finds",,8,52,2014-09-10,PHARMA,0.0822487398982048,0.835459291934967,0.08229193836450577
Health,"How quickly viruses contaminate buildings: Using tracer viruses, researchers found that contamination of a single doorknob or table top can spread viruses throughout office buildings, hotels, and health care facilities. Within 2 to 4 hours, virus could be detected on 40%-60% of workers and visitors",,2,24,2014-09-10,PHARMA,0.18841885030269623,0.7796334624290466,0.03194773197174072
Health,"OB-GYNs Warn Candidates Against Pretending to Support Birth Control for Political Gain - The American Congress of Obstetricians &amp; Gynecologists doesn't want Republicans to use contraception as a ""political tool""",,1,23,2014-09-10,PHARMA,0.05964875593781471,0.9071170687675476,0.0332341194152832
Health,Obesity Alters Chemistry in Brain,,1,23,2014-09-10,PHARMA,0.03621118888258934,0.9140132665634155,0.04977554827928543
pharmacy,Can people with pharmD call themselves Dr?,"Im a pharmacist from the uk, whos been using this sub for a while (btw, situation in UK is just as bad as the US) and so I was just wondering about this.

In context, in the uk, only doctors dentists vets and phds can call themselves dr. Although, none of them would refer to themselves as Dr ____ outside of their practice, theyd just get labelled as a ******.Also, doctors vets and dentists are not given 'doctorate' degrees - they're called bachelor degrees. 

Also, how does it work with the older pharmacists who dont have a pharmd?",89,18,2014-09-10,PHARMA,0.05388892814517021,0.9203805923461914,0.02573048509657383
medicine,Bones: An Orthopedic Surgeon,,48,219,2014-09-11,PHARMA,0.08872824162244797,0.87581467628479,0.0354570671916008
Health,"People who Live Near Fracking More Likely to Become Sick, Study Finds",,8,88,2014-09-11,PHARMA,0.9013174176216125,0.08417074382305145,0.01451191958039999
Health,Vaccination doubters are endangering more than their own children,,38,85,2014-09-11,PHARMA,0.17070363461971283,0.801272988319397,0.028023339807987213
Health,"Why Your Doctor Feels Like a ‘Beaten Dog’ - Assembly-line patient visits, poor care for the chronically ill, stacks of paperwork, &amp; endless red tape: this is the life of the American physician.",,10,57,2014-09-11,PHARMA,0.10415211319923401,0.8630198240280151,0.03282807394862175
Health,Why sugar is worse than fat,,15,31,2014-09-11,PHARMA,0.30363836884498596,0.48230424523353577,0.2140573114156723
Health,"Stop Claiming Vaccine Denial is a Liberal Disease - Research shows that conservatives are just as likely to distrust life-saving vaccines. And they don't like GMOs, either.",,6,29,2014-09-11,PHARMA,0.118983693420887,0.8469751477241516,0.034041084349155426
medicine,"Rich, educated and stupid parents are driving the vaccination crisis (x-post r/HealthySkepticism)",,23,26,2014-09-11,PHARMA,0.05501934513449669,0.9062533378601074,0.038727328181266785
Health,Artificially Sweetened Beverages May Cause Neurologic Processes That Lead to Further Weight Gain,,2,19,2014-09-11,PHARMA,0.11518167704343796,0.8640313148498535,0.020787017419934273
Health,"Some Things You Can Do In Your Sleep, Literally",,1,17,2014-09-11,PHARMA,0.11397691816091537,0.8295432329177856,0.05647982656955719
Health,"The Rich Are Eating Richer, the Poor Are Eating Poorer",,1,15,2014-09-11,PHARMA,0.14808471500873566,0.8019468784332275,0.049968402832746506
medicine,"Residents, nurses, attendings, etc...if you had a bad day at work watch this.",,21,184,2014-09-12,PHARMA,0.5721254944801331,0.40798744559288025,0.01988709159195423
Health,Birth Control For Men Is Doing Well In Testing And Will Be Available By 2017,,26,176,2014-09-12,PHARMA,0.017417076975107193,0.9064844250679016,0.07609842717647552
medicine,Only one percent of people who start Weight Watchers maintain their goal weight after five years,,27,84,2014-09-12,PHARMA,0.030708499252796173,0.9218350648880005,0.04745642468333244
Health,Ebola is ‘devouring everything in its path.’ Could it lead to Liberia’s collapse?,,17,35,2014-09-12,PHARMA,0.017862871289253235,0.8683485984802246,0.11378847062587738
Health,"Neurochemical imbalance in schizophrenia discovered: Using human induced pluripotent stem cells (hiPSCs), researchers have discovered that neurons from patients with schizophrenia secrete higher amounts of three neurotransmitters broadly implicated in a range of psychiatric disorders",,1,34,2014-09-12,PHARMA,0.04768900200724602,0.9201016426086426,0.03220932185649872
Health,"Ebola Cases Rise Rapidly in Congo: The number of Ebola cases in the Democratic Republic of Congo doubled over the past week to 62, the World Health Organization reported Thursday, and more than half the afflicted patients have died.",,0,32,2014-09-12,PHARMA,0.4063066244125366,0.34528693556785583,0.24840642511844635
Health,"30 Percent of NFL Players Will Get Dementia, According to the NFL",,3,32,2014-09-12,PHARMA,0.041624411940574646,0.9251545667648315,0.033220984041690826
medicine,A Tale of 2 Countries: The Cost of My Mother’s Cardiac Care in the United States and India,,49,29,2014-09-12,PHARMA,0.2823927700519562,0.677152693271637,0.04045454412698746
Health,Only one percent of people who start Weight Watchers maintain their goal weight after five years,,11,28,2014-09-12,PHARMA,0.030708499252796173,0.9218350648880005,0.04745642468333244
Health,"""The current Ebola virus’s hyper-evolution is unprecedented; there has been more human-to-human transmission in the past four months than most likely occurred in the last 500 to 1,000 years.""",,2,22,2014-09-12,PHARMA,0.06489347666501999,0.9106363654136658,0.02447023242712021
Health,Why The U.S. Chills Its Eggs And Most Of The World Doesn't,,34,127,2014-09-13,PHARMA,0.056006401777267456,0.8935048580169678,0.050488706678152084
Health,Americans are Being Exposed to Harmful Level of Antibiotics,,5,83,2014-09-13,PHARMA,0.25595715641975403,0.7005757689476013,0.04346710070967674
Health,"Research Shows Frightening Correlation Between Fracking and Rates of Illness-- Respiratory and skin issues likely caused by air or groundwater contamination as a result of natural gas drilling, says new study",,1,76,2014-09-13,PHARMA,0.267040878534317,0.6991737484931946,0.033785466104745865
Health,Japanese woman is first recipient of next-generation stem cells: Surgeons implanted retinal tissue created after reverting the patient's own cells to 'pluripotent' state.,,2,73,2014-09-13,PHARMA,0.018777092918753624,0.9241241216659546,0.057098839432001114
Health,"How Superbugs Hitch a Ride From Hog Farms Into Your Community - New study finds antibiotic-resistant staph strains are common &amp; ""persistent"" in factory farm workers.",,0,38,2014-09-13,PHARMA,0.030788933858275414,0.8975140452384949,0.07169701159000397
Health,"The Horrible Anger You Feel at Hearing Someone Chewing is Called Misophonia - A rarely diagnosed, potentially debilitating condition pushes toward widespread recognition within psychiatry.",,12,37,2014-09-13,PHARMA,0.08338873833417892,0.5784029960632324,0.33820822834968567
medicine,10 things you need to give up to become a doctor - How much do you relate with?,"http://forum.facmedicine.com/threads/10-things-you-need-to-give-up-to-become-a-doctor.16769/

Having just started medical school, this list scared me a bit to be honest, but I can't help but think it's a bit pessimistic.     



The things on this list that I would definitely not want to be true are number 8 (losing all creativity) and number 6 to a certain extent. 

I know that being a doctor puts a toll on your relationships, but how doable would you say it is to have friends who aren't your coworkers? Or to maintain a healthy love life?",51,33,2014-09-13,PHARMA,0.032160863280296326,0.9073272347450256,0.06051183491945267
pharmacy,Novo Nordisk's Diabetes Drug Victoza on Track for Approval from FDA for a new Indication: Obesity [x-post from r/Drugs_and_Devices],,9,26,2014-09-13,PHARMA,0.02094646356999874,0.8885236978530884,0.09052985161542892
pharmacy,British Medical Journal on Benzodiazepine use and risk of Alzheimer's disease increased.,,10,21,2014-09-13,PHARMA,0.17254622280597687,0.7991611361503601,0.028292696923017502
medicine,"Nature, not nurture, holds key to gut bacteria",,1,19,2014-09-13,PHARMA,0.022252092137932777,0.859311044216156,0.11843689531087875
medicine,UCLA med student steals iPad from dying cancer patient,,115,240,2014-09-14,PHARMA,0.3120964467525482,0.6151347756385803,0.07276876270771027
Health,"Monsanto's ""Roundup"" deadly to human cells (since 2009)",,45,153,2014-09-14,PHARMA,0.13345880806446075,0.8307594060897827,0.035781752318143845
Health,"Ebola death toll rises to at least 2,296: WHO",,2,59,2014-09-14,PHARMA,0.21852166950702667,0.6753352284431458,0.10614308714866638
Health,Airborne Ebola is Extremely Unlikely,,14,43,2014-09-14,PHARMA,0.14327967166900635,0.7307282090187073,0.12599213421344757
Health,One Way to Cut Back on Expensive Ambulance Rides - A Colorado town is minimizing ER visits with an urgent-care clinic on wheels.,,4,31,2014-09-14,PHARMA,0.048858750611543655,0.8939043879508972,0.05723680928349495
Health,Hallucinogen in ‘magic mushrooms’ might have helped smokers quit,,1,29,2014-09-14,PHARMA,0.02264971286058426,0.9141714572906494,0.0631788894534111
Health,Engineering Mosquitoes to Spread Health - The promise of transforming flying vectors of dengue fever into preventive-medicine tools,,1,24,2014-09-14,PHARMA,0.024698946624994278,0.9036582708358765,0.07164283841848373
medicine,Penicillin (PCN),On this day (September 15) in 1923 Alexander Fleming discovered penicillin.,16,21,2014-09-14,PHARMA,0.03879174962639809,0.9137352108955383,0.047473084181547165
medicine,Last Day!! Essentials of Point-of-Care Ultrasound free on iBooks,"Hi All,

We are very excited to announce that our e-book titled “Essentials of Point-of-Care Ultrasound” will be free on the iBooks Store during the first 2 weeks of September.

Since 2001, The Emergency Department Echo Course and The EDE 2 Course have taught EDE (pronounced “Eddie”) to over 10,000 physicians worldwide, including over half of the Canadian emergency medicine workforce. The most distinctive aspect of the EDE courses has been the focus on image generation. When clinicians first began investigating the possibility of using ultrasound themselves, a big secret was concealed from them: image interpretation is easy. The real challenge is image generation: putting the image on the screen. Before the EDE courses, physicians learned image generation mostly by trial and error. EDE brought a rigorous methodology to the scanning of each area of the body, dramatically reducing the time needed to master this new skill.

“Essentials of Point-of-Care Ultrasound” combines the EDE course manuals which have been written and rewritten for over a decade to give health-care providers the clearest and most concise approach to bedside ultrasound. This “how-to” guide contains over 700 illustrations, photos, and ultrasound images, 40+ videos, slideshows, quizzes, reference hyperlinks to Pub Med, links to EDE blog content, an interactive glossary, chapter summaries, study cards and reader-defined notes.

Click here for more information about the e-book on The EDE blog. Click here for more information about the e-book on iTunes.

Please consider forwarding this to your fellow students, residents, other trainees, and faculty. We believe they will find our e-book useful. We will announce free updates (new chapters, added functionalities, etc.) on Twitter (@EDE_blog) and on our blog at http://edeblog.com/.

With kind regards,

Steve Socransky, MD, FRCPC, DABEM

Course Director, The EDE 2 Course

www.ede2course.com

pocusbook@gmail.com",0,15,2014-09-14,PHARMA,0.0435844250023365,0.9295002818107605,0.026915257796645164
Health,Should We All Take a Bit of Lithium?,,1,15,2014-09-14,PHARMA,0.05956297367811203,0.895179033279419,0.045257970690727234
medicine,"Teach a Medical student, ""Explain your condition/disease/ailment to me""","I am a medical student in my second year currently studying pathology of the body. 
In my experience I can increase my learning of a concept by making a social connection to it. (Example: I had a friend who had Guillain–Barré syndrome and I can always remember it because I connect it with him. I also believe that I am more conscious of the way the syndrome affects patient's lives because I saw how it affected him. 

It would be great if you could explain your condition to the best of your understanding and write a little bit about how it affects your life day to day. If you have any pictures of it that would be great too.

I think this could be really helpful in making me and other med students see not just the disease but the patient and person. 

I got this idea when I saw this post: http://www.reddit.com/r/pics/comments/2ghkwa/xrays_of_my_metal_arm/

we had just been talking about mafucci's and enchondromas, seeing this post really cemented it in my mind.",229,248,2014-09-15,PHARMA,0.02951289527118206,0.9222243428230286,0.04826270043849945
Health,"Study suggests ""Happy Wife, Happy Life"" maxim is true for better longer healthy lives of couples",,29,121,2014-09-15,PHARMA,0.02304418571293354,0.6831690073013306,0.2937868535518646
medicine,"USC Med Student believed to be alive. Meddit, do you have any insight? We've released all the evidence",,6,97,2014-09-15,PHARMA,0.015622712671756744,0.8914050459861755,0.09297223389148712
medicine,Who picks up the tab if someone comes to the ER without insurance?,"I've been working in the ER as a scribe for a few months now. The area I work in is somewhat impoverished and low income, and we often see people with low acuity complaints who obviously don't have health insurance.

As I'm filling out these patients charts, I'm able to see that they have been to the ER 5,10, maybe even 20 times within the past few years. I understand that they are coming to the ER because they probably don't have a primary care doctor, but how on earth are they able to afford these visits?

If a patient does NOT have health insurance, but gets treatment in the ER, who picks up the bill? The patients are obviously not paying for it, as they certainly would be bankrupt by their 2nd ER visit. Even if they were on medicaid, I'd think there would be more strict requirements for ER visits. Can someone please explain? Thanks",51,45,2014-09-15,PHARMA,0.07834026217460632,0.8918856382369995,0.029774107038974762
medicine,"Dear r/medicine, Ebola is spreading, and here are two calls for assistance, most notably to help address the gap in trained clinicians","[One by PIH and it's affiliates Last Mile Health in Liberia and Wellbody Alliance in Sierra Leone](http://ch.tbe.taleo.net/CH01/ats/careers/requisition.jsp?org=PIH&amp;cws=38&amp;rid=883)

[One by CUGH linking to MSF and USAID avenues for support](http://campaign.r20.constantcontact.com/render?ca=abfb955e-e9d7-4158-84a0-1d4969649427&amp;c=3a386530-7df9-11e3-b206-d4ae529a8250&amp;ch=3bb95fe0-7df9-11e3-b24c-d4ae529a8250)",2,40,2014-09-15,PHARMA,0.018780959770083427,0.8804807662963867,0.10073821991682053
Health,"A Terrifying Dilemma - The choice is difficult: to be depressed during pregnancy, with troubling consequences, or to be on medication, with unclear ramifications.",,11,37,2014-09-15,PHARMA,0.17437994480133057,0.7907496094703674,0.034870460629463196
medicine,Artificial spleen cleans up blood: A device inspired by the spleen can quickly clean blood of everything from Escherichia coli to Ebola (x-post from /r/science),,4,32,2014-09-15,PHARMA,0.017737817019224167,0.9230446815490723,0.05921747535467148
medicine,Ebola claims fourth doctor in Sierra Leone after WHO refuses transport to Germany,,1,26,2014-09-15,PHARMA,0.5160630941390991,0.40887823700904846,0.07505862414836884
pharmacy,Are there any fun pharmacy books to read?,Does anyone here know of any books that are written in a fun way but are still educational? I read a lot on the bus...,15,20,2014-09-15,PHARMA,0.03634652495384216,0.9194228649139404,0.044230636209249496
Health,Another Look At Why Alcohol May Be More Dangerous Than Heroin,,2,19,2014-09-15,PHARMA,0.21705204248428345,0.6680118441581726,0.11493613570928574
Health,"Wealthy L.A. Schools' Vaccination Rates Are as Low as South Sudan's: Hollywood parents say not vaccinating makes ""instinctive"" sense. Now their kids have whooping cough.",,85,240,2014-09-16,PHARMA,0.03929946571588516,0.8942075967788696,0.0664929524064064
medicine,An epiphany about medicine.,"I'll preface this with the fact that I'm a 4th year medical student in the UK.

Today, I had an epiphany about myself and medicine that I feel has been a long time coming. I thought others might appreciate what dawned on me.


I don't want to be a doctor, in the conventional sense. By that I mean, I do not want to work as a clinician in a hospital or as a general practitioner/family doctor. For the most part, I have not really enjoyed the placements I have had over the past 2 years. I find myself incredibly bored in clinics, wards and surgery, and am becoming increasingly frustrated at how much you have to sacrifice to be a conventional doctor. On further thought, I've yet to meet a doctor who I found to be an inspiration to me, or who I consider a role model.

 I have always struggled when I have been asked what I want to specialise in, though I now realise that's because no specialty really pulls me toward it. I thoroughly enjoyed the first 2 years of study because they were university based with occasional placements, rather than solely placement based. Now that I have realised this, I feel like there's a lingering dread that's been lifted. I hope now to finish medical school and then find an alternative career that involves more of the academic side of medicine.

If anyone else has had a similar experience, I'd love to hear what your thoughts are, and how you came to realise that being a clinician wasn't for you.",66,61,2014-09-16,PHARMA,0.04303009808063507,0.908320426940918,0.048649441450834274
Health,Schizophrenia is a Hybrid of 8 Disorders - Discovery can lead to enhanced &amp; targeted treatment,,1,58,2014-09-16,PHARMA,0.011580430902540684,0.7811463475227356,0.2072731852531433
medicine,Suicide and the Young Physician.,,7,58,2014-09-16,PHARMA,0.3314266502857208,0.5731189846992493,0.09545435756444931
Health,Reuters - Farmaceuticals: the drugs fed to farm animals,,0,21,2014-09-16,PHARMA,0.029839467257261276,0.9313560128211975,0.03880457580089569
medicine,"Need perspective on death, thanks.","I'm having a particularly hard time dealing with the pregnancy and labor of a friend. She's been under the care of a midwife throughout the pregnancy, has lost two pregnancies prior, and had moderate oligohydraminos and had a transverse positioning though this pregnancy. She's been very resistant to c sections and inductions and has sought care from a chiropractor for manipulations and turning. At 42 weeks she still hadn't had any sign of contractions so the midwife attempted to induce. At some point the heart rate of the baby dropped significantly and by the time she got to the hospital the doctor couldn't section her fast enough and the heart stopped entirely before she was opened. 

I'm so angry and I feel guilty for not talking her out of this. Now people are talking about God calling back another angel and it infuriates me. I never said anything initially because I didn't want her to react poorly to me and take it out on the doctors involved. I assumed the midwife would at least know when to call it quits and take her in but I also thought that would have happened before 42 weeks. 

I'm a third year med student and I obviously don't have all the answers but this seems unreasonable. Things happen and people make mistakes and you can't make decisions for people but all of this seems so preventable. I need perspective on this and how to deal with it professionally too. The doctor is going to have to account for this at some point and I can't help but wonder how much they're going to be responsible for. 

Thank you for listening to this wall of text.",5,10,2014-09-16,PHARMA,0.2161802351474762,0.7593640685081482,0.02445579506456852
Health,Hitchcock Thriller Reveals Busy Mind in 'Vegetative' Man - Brain scans from a man who's been in a vegetative state for 16 yrs show activity similar to that of healthy viewers. Study suggests that plot structure had an impact on him.,,2,10,2014-09-16,PHARMA,0.018194181844592094,0.8992423415184021,0.08256354928016663
pharmacy,Current Trends in the Pharmacy Job Market,,15,10,2014-09-16,PHARMA,0.2426188886165619,0.7183850407600403,0.038996122777462006
Health,When You Can't Afford Sleep - Many low-income workers get just 4 or 5 hrs of rest each day. Research shows their bodies might never recover.,,0,9,2014-09-16,PHARMA,0.11878710985183716,0.835375964641571,0.0458369217813015
Health,How the American Egg Board designs misleading studies,,2,9,2014-09-16,PHARMA,0.5322918891906738,0.4296877086162567,0.03802037611603737
Health,"Study: Artificial sweeteners may exacerbate, rather than prevent, metabolic disorders such as Type 2 diabetes",,61,193,2014-09-17,PHARMA,0.03417652100324631,0.9347993731498718,0.03102409839630127
medicine,"Medicine is so awesome. My father in law has a 83 year old kidney, he's 59 and doing well","Isn't it incredible that an organ can live on for so long? this is just a shout-out to modern medicine, and to the old dude that gave up his body for the needing. Science rocks!",13,113,2014-09-17,PHARMA,0.03754569590091705,0.9082883596420288,0.05416599661111832
medicine,Wealthy L.A. Schools' Vaccination Rates Are as Low as South Sudan's,,20,93,2014-09-17,PHARMA,0.16758394241333008,0.7293636798858643,0.10305234789848328
medicine,San Francisco Could Be First City In The World To Provide Free HIV Prevention Pill To Residents,,10,77,2014-09-17,PHARMA,0.008557664230465889,0.6327939033508301,0.3586484491825104
Health,"Schizophrenia is eight different diseases, not one: New research shows that schizophrenia is not a single disease, but a group of eight distinct disorders, each caused by changes in clusters of genes that lead to different sets of symptoms",,2,76,2014-09-17,PHARMA,0.05500932037830353,0.9150258898735046,0.029964717105031013
medicine,I'm an emergency medical pilot in east Africa. We're trying to prepare for possible Ebola patients but have received conflicting info...,"So we are the only emergency medical air transport service in Tanzania. We have recently been discussing the possibility of Ebola showing up in our area. The information we have found on the CDC website is disappointing and contrary to information we've found elsewhere. We are trying to determine the best way to protect ourselves while handling &amp; transporting patients in a small aircraft as well as try to determine beforehand the likelihood of a patient being infected with Ebola (as opposed to yellow fever or malaria). 

We've discussed:

* How to protect against transmission during the evac

* Proper handling attire: a gown tucked in to gloves, mask, wrap around glasses

* Always using an oxygen mask on the patient to protect against oral transmission

* Whether Ebola is a virus with an envelope that can be killed with alcohol or the amount of time the virus can survive in the airplane before cleaning (we've been told 24 hours)

We are frustrated by the info provided by the CDC compared to that which doctors from Europe have given us that seem to conflict. If the virus has already spread enough to become an issue here, we don't want to further increase the spread thru improper protocols as well as keep ourselves safe from contracting. If anyone has some solid advice or sources online to check out. It would be much appreciated.",23,59,2014-09-17,PHARMA,0.05620473623275757,0.8923462629318237,0.051448989659547806
Health,U.S. painkiller deaths jumped 400 percent between 1999 and 2011,,14,57,2014-09-17,PHARMA,0.04233025014400482,0.8770065307617188,0.08066324889659882
pharmacy,After filling my 5th Rx for Fluconazole 150mg in a row...,,6,37,2014-09-17,PHARMA,0.03356435149908066,0.9149317145347595,0.05150391906499863
Health,​Big increase in deaths from narcotic painkiller overdoses: Accidental overdose rate quadrupled in the last decade; what can doctors do to turn it around?,,9,28,2014-09-17,PHARMA,0.03081751987338066,0.8637347221374512,0.10544773936271667
Health,Artificial sweeteners may be linked to diabetes: study,,7,26,2014-09-17,PHARMA,0.030648216605186462,0.9130886197090149,0.056263186037540436
medicine,"$208,223 in med school loans, today was a big day for me",,194,793,2014-09-18,PHARMA,0.1452331840991974,0.8036677241325378,0.05109906196594238
pharmacy,DIFLUUUUUUUUCAN!!!,,10,139,2014-09-18,PHARMA,0.04110505431890488,0.9196793437004089,0.03921559453010559
Health,Crest removing controversial microbeads from toothpaste after outcry,,15,117,2014-09-18,PHARMA,0.048203568905591965,0.8987665772438049,0.0530298687517643
Health,Diet Soda May Alter Our Gut Microbes And The Risk Of Diabetes,,29,114,2014-09-18,PHARMA,0.4187961518764496,0.5297805070877075,0.05142330750823021
pharmacy,Freshly organized shelves!!!,,25,67,2014-09-18,PHARMA,0.02142997831106186,0.8743981122970581,0.10417189449071884
Health,Study: Placebo statistically as effective as Zoloft and St. John's Wort for depression,,6,62,2014-09-18,PHARMA,0.03320959210395813,0.9166830778121948,0.05010738968849182
