subreddit,title,selftext,num_comments,score,created_utc,stock/sector,neg,neu,pos
Health,Decreased cardiac blood flow in those eating low-carb diets could explain their shortened lifespans,,25,17,2014-03-25,PHARMA,0.7225539088249207,0.2374810129404068,0.03996504470705986
Health,"Vancouver: Giving junkies a fix to keep them off the street: Heroin maintenance, as this sort of therapy is known, falls into a category of public health policies called harm reduction, a bold strategy that Vancouver has long championed",,1,14,2014-03-25,PHARMA,0.04889148846268654,0.9093560576438904,0.04175245761871338
Health,"Seven million people died as a result of air pollution in 2012, the World Health Organization estimates.",,0,13,2014-03-25,PHARMA,0.5095603466033936,0.46799930930137634,0.022440334782004356
Health,Number of patients admitted with antibiotic-resistant infections is rising,,0,12,2014-03-25,PHARMA,0.07066838443279266,0.8965704441070557,0.03276115655899048
medicine,Wikipedia founder calls alt-medicine practitioners “lunatic charlatans”,,76,213,2014-03-26,PHARMA,0.057996008545160294,0.9099294543266296,0.03207452595233917
Health,Cook County Sheriff Rips Mental Health Cuts: ‘We Have Criminalized Mental Illness In This Country’,,8,161,2014-03-26,PHARMA,0.6549769639968872,0.32004785537719727,0.02497514709830284
Health,"Doctors raise blood pressure in patients: Doctors routinely record significantly higher blood pressure levels than by nurses, the first thorough analysis of scientific data has revealed. This phenomenon, “white coat effect”, may result from patient’s physical response to being assessed by a doctor",,37,139,2014-03-26,PHARMA,0.7523574233055115,0.043382056057453156,0.20426045358181
Health,"Merck has known for a decade that its mumps vaccine is ""far less effective"" than it tells the government, and it falsified test results and sold millions of doses of ""questionable efficacy,"" flooding and monopolizing the market, a primary caregiver claims in a federal antitrust class action.",,25,114,2014-03-26,PHARMA,0.2050984501838684,0.7472086548805237,0.04769296199083328
medicine,How did you decide your specialty?,"I'm caught between two very different specialties and the time to make my decision before scheduling fourth year is running out. How did you all decide? How did you factor in your passion, lifestyle, salary, and career-specific concerns? Each field has its pros and cons and I can't pick one over the other.",99,81,2014-03-26,PHARMA,0.024018967524170876,0.9314044117927551,0.044576674699783325
Health,"Double Dip: Doctors Paid To Advise, Promote Drug Companies That Fund Their Research",,1,58,2014-03-26,PHARMA,0.027496350929141045,0.9254907965660095,0.04701278358697891
Health,The Toxins That Threaten Our Brains - Leading scientists recently identified a dozen chemicals as being responsible for widespread behavioral and cognitive problems.,,2,47,2014-03-26,PHARMA,0.01787628047168255,0.6210728287696838,0.36105090379714966
Health,"Cannabinoids, like those found in marijuana, occur naturally in human breast milk",,4,40,2014-03-26,PHARMA,0.04411691799759865,0.9327408671379089,0.023142151534557343
Health,22 Year Old Receives Complete 3D Printed Cranium Replacement,,3,39,2014-03-26,PHARMA,0.022132808342576027,0.9208807945251465,0.05698637291789055
pharmacy,When the production tech doesn't put away their stock bottles.,,12,32,2014-03-26,PHARMA,0.12693193554878235,0.8460015654563904,0.027066541835665703
Health,Breakthrough in obesity study: scientists discovers very clear links between bile acids and maintaining weight loss.,,43,116,2014-03-27,PHARMA,0.015609725378453732,0.5800817608833313,0.4043084383010864
medicine,"To surgeons on Reddit, Do your jobs include a lot of risks?","I want do become a surgeon, but I'm afraid that I will screw it up once in my life. Severely damage, or even kill a person. Is this a risk that you guys take everyday?

Sorry for my english, I'm from Norway :-)",92,85,2014-03-27,PHARMA,0.3482408821582794,0.624045729637146,0.02771339938044548
Health,How ''Extreme Levels'' of Monsanto's Herbicide Roundup in Food Became the Industry Norm,,5,83,2014-03-27,PHARMA,0.03265981003642082,0.9200320839881897,0.04730811342597008
medicine,Join Doctors Without Borders to Ask Us Anything about drug-resistant tuberculosis (DR-TB) @ 2pm EDT April 3 (xpost /r/doctorswithoutborders),,0,80,2014-03-27,PHARMA,0.03651438280940056,0.9051771759986877,0.0583084300160408
medicine,"Gunshot &amp; Stabbing Victims to be Suspended Between Life &amp; Death - Doctors will try to save 10 patients with knife or gunshot wounds. Neither dead or alive, they'll be cooled down &amp; placed in suspended animation later this month as a groundbreaking technique tested for 1st time. [x-post r/science]",,15,72,2014-03-27,PHARMA,0.024723591282963753,0.888349711894989,0.08692675828933716
Health,Autism 'begins long before birth': Scientists say they have new evidence that autism begins in the womb.,,11,62,2014-03-27,PHARMA,0.0518837571144104,0.731494128704071,0.21662212908267975
Health,Researchers find treatment that kills every kind of cancer tumor (in mice),,5,59,2014-03-27,PHARMA,0.02369450032711029,0.8927434086799622,0.08356214314699173
medicine,3-D printed skull.,,2,56,2014-03-27,PHARMA,0.017449477687478065,0.9379967451095581,0.04455376788973808
Health,"1 in 8 deaths linked to air pollution, World Health Organization says",,2,49,2014-03-27,PHARMA,0.6006101369857788,0.3766191303730011,0.02277076616883278
pharmacy,A single Costco in California is being investigated by the DEA for dispensing 5 MILLION hydrocodone units per year for the past few years.,,29,45,2014-03-27,PHARMA,0.03657511994242668,0.9140657186508179,0.04935910925269127
medicine,Don’t shorten medical school: Shorten undergraduate training instead,,125,278,2014-03-28,PHARMA,0.0443732850253582,0.9335595965385437,0.02206706441938877
Health,Man who raised money for organ donation dies: He's rejected as organ donor because he was gay,,34,143,2014-03-28,PHARMA,0.04089980572462082,0.9085465669631958,0.05055359750986099
medicine,Alternative Medicine Parody,,7,123,2014-03-28,PHARMA,0.030287055298686028,0.9339614510536194,0.035751547664403915
Health,"Warnings that obesity is becoming normalised! Being overweight is becoming normalised as most of the adult population in England is overweight or obese, said the Department of Health’s chief medical officer Dame Sally Davies today",,14,100,2014-03-28,PHARMA,0.0769386887550354,0.8554161190986633,0.06764523684978485
medicine,After the Match: Doctors Waiting Tables?,,62,95,2014-03-28,PHARMA,0.07600106298923492,0.8692089915275574,0.05478998273611069
Health,"Public smoking bans linked with rapid fall in preterm births and child hospital visits for asthma: Analysis of studies on 2.5 million births and 250,000 asthma flare ups showed, rates of both preterm births and hospital visits were reduced by 10% within a year of smoke-free laws coming into effect",,8,88,2014-03-28,PHARMA,0.1895047128200531,0.7493623495101929,0.061132900416851044
Health,Dementia Village: Holland’s civilized approach to treating the elderly,,6,61,2014-03-28,PHARMA,0.010451622307300568,0.7857758402824402,0.20377251505851746
Health,"A Quiet `Sea Change' in Medicare: It has been standard that patients are discontinued from therapy services because they are ""not improving."" No more. Medicare now will pay for physical therapy, nursing care and other services to maintain condition and prevent deterioration.",,5,56,2014-03-28,PHARMA,0.051086656749248505,0.8489571809768677,0.09995614737272263
Health,"Why heroin is spreading in America's suburbs. The drug has followed prescription painkillers into new neighborhoods, forcing police and parents to confront an unexpected problem.",,12,48,2014-03-28,PHARMA,0.4248603582382202,0.5406602025032043,0.03447940573096275
Health,Disturbing New Report: Air Pollution Killed 7 Million People in 2012—About 1 in 8 Premature Deaths,,4,36,2014-03-28,PHARMA,0.5796992778778076,0.39320242404937744,0.027098264545202255
Health,"Underweight people at as high risk of dying as obese people, new study finds: Connection between underweight and higher death risk is true for both adults and foetuses, even when factors like smoking, alcohol use or lung disease are considered, or adults with chronic or terminal illness are excluded",,20,84,2014-03-29,PHARMA,0.06806431710720062,0.8992011547088623,0.03273449093103409
medicine,"Nitroglycerin, a Staple of Emergency Rooms, Is in Short Supply",,22,72,2014-03-29,PHARMA,0.16301487386226654,0.8149938583374023,0.021991228684782982
pharmacy,"""I've been out for a few days and need this right away!""",,25,50,2014-03-29,PHARMA,0.03954065963625908,0.9122554659843445,0.04820382595062256
Health,How Being Ignored Helped Mary-Claire King Discover The Breast Cancer Gene. King says obscurity gave her the freedom to spend years looking for breast cancer genes.,,0,44,2014-03-29,PHARMA,0.01957227848470211,0.8930560946464539,0.0873715803027153
pharmacy,Thought of this when we dispensed brand name cozaar today,,20,43,2014-03-29,PHARMA,0.024479901418089867,0.9278466701507568,0.04767343029379845
Health,"An answer to the perennial question - Is it safe to pee in pool?: Sanitary-minded pool-goers who preach “no peeing in the pool,” now have scientific evidence to back up their concern. Researchers report that when mixed, urine and chlorine can form substances that can cause potential health problems",,8,42,2014-03-29,PHARMA,0.28304532170295715,0.6982399821281433,0.01871463656425476
medicine,Update on my HIV exposure,"Hi everyone! I just wanted to give an update on my exposure I posted about last week, and what is going on now. At 15 days post exposure, I had an HIV-1 RNA, QN RT-PCR test which came back negative yesterday (that means &lt;20 HIV1 copies/ml = undetected, and &lt;1.30 HIV1 log copies/ml = also not detected)...

I know that during acute infection, HIV copies are through the roof. I also know that though there is a higher rate of false positives, false negatives seem to be less likely? Just curious how conclusive these results are. Should I stop freaking out? Is it rare to have a positive antibody test after this?",15,38,2014-03-29,PHARMA,0.15306518971920013,0.7716420292854309,0.07529275864362717
Health,"TV linked to poor snacking habits, cardiovascular risk: Middle school kids who spend two hours or more in front of TV daily are more likely to eat junk food and have risk factors for cardiovascular disease, even compared to those who spend an equal amount of time on computer or playing video games",,0,26,2014-03-29,PHARMA,0.126023530960083,0.8252448439598083,0.04873162508010864
Health,"Quality early childhood programs help prevent adult chronic disease, research shows: High-quality early childhood development programs with health care and nutritional components can help prevent or delay the onset of adult chronic disease, according to a new study",,1,23,2014-03-29,PHARMA,0.012612797319889069,0.8617881536483765,0.12559901177883148
pharmacy,Thinking of being a pharmacy tech,"Here's my situation: I'm currently a stay-at-home dad but my son is getting older and I need to find something. I LOVE learning about medications, how they work, what they do, interactions, etc. I'm always on Google looking up different meds.

My community college offers a tech program that's pretty affordable. Is it worth it? I've heard some programs are a rip off. 

Also, what's the job market like for techs (I'm in the Chicago area if it makes a difference)?

Thanks in advance for your advice!",51,17,2014-03-29,PHARMA,0.013309689238667488,0.8633731603622437,0.12331712245941162
Health,"West Virginia Gov. Earl Ray Tomblin vetoed a bill late that would have banned abortions of fetuses after 20 weeks gestation. The governor called the bill unconstitutional and a ""detriment"" to women's health.",,39,136,2014-03-30,PHARMA,0.37448224425315857,0.5909888744354248,0.034528862684965134
medicine,How to call for a consult?,"I often see physicians get bent out of shape about getting called for inappropriate consults, consults without the necessary workup, or getting called by someone sounds disorganized over the phone.  What is your specialty and what advice do you have for someone seeking you for a consult?",75,80,2014-03-30,PHARMA,0.16179053485393524,0.8148662447929382,0.023343201726675034
medicine,New Blood Pressure Guidelines May Take Millions of Americans Off Meds,,21,53,2014-03-30,PHARMA,0.21904824674129486,0.7015118598937988,0.0794399082660675
Health,"Daylight saving impacts the timing of heart attacks: Setting clocks ahead 1 hour may accelerate cardiac events in some, a large study shows",,7,53,2014-03-30,PHARMA,0.07942894846200943,0.8894625902175903,0.031108420342206955
pharmacy,My friend reacts to someone complaining about waiting on medicine.,"Someone said, ""Why does it take so long to put a few pills in bottles? You make us wait on purpose so I am forced to buy stuff.
Her reaction it's worth the read.
---""Say you want those 30 pills covered by insurance. There are five people that have just dropped off multiple prescriptions each, and want them NOW or 5 minutes ago, or yesterday as if it's funny. You say you have filled here before, and we have your card on file, but you haven't and it's not and you've already walked away. We call your alternate pharmacy to get the info from your card. We create a new profile for you, and there's a new senior employee who is the opposite of computer savvy and struggling. Meanwhile, you're on hold with the insurance company, because the correct information is not even close to what is on the actual card. We verify our information and your name and information to 3 different agents before hanging up in frustration. Your next customer wants their kid's medicine flavored, and we have to stop working on yours, because the kid is crying as loud as they can, so you mix 3 individual bottles by hand to get them out of the store as fast as humanly possible before developing a migraine. The next customer wants to buy a basket full of groceries while a line forms behind them. Going back to you, we then notice the doctor had not written the directions correctly, so we have to call the doctors office to clarify but they are on lunch so we are at their mercy until they call back with the correct directions. Pharmacist verifies everything about your Rx is FLAWLESS, while answering random questions, giving advice and leaving the pharmacy to show someone where the vitamins are (the aisle that says VITAMINS) Rx is then counted and verified again. The drive through goes off and you have a convoy of people who call the store from outside the building to find out what the hold up is. The phone never stops ringing. A new person walks up and makes you check the prices on 6 different medications, then says they are cheaper at walmart and walk away, oblivious to the time they have just wasted. You come back to pick up your prescription, we need five more minutes and we are angrily glared at from all sides like we're  fish in an aquarium. We go to check you out, you pay, we complete transaction and say have a nice day. And then you mention you have a coupon card for said drug and we die a little inside. Everything has to be rebilled again and verified again. THAT is why it takes ""so long"" to ""put 30 pills in a bottle."" Just because there is no one standing in line does not mean we are just standing around doing nothing. These are just some of the real situations that happen every day. We understand you don't feel well, and neither so we, but we must smile while you talk into your cell phone, barely making eye contact, as if we aren't members of the same society. Please Please...don't take pharmacy employees for granted. Be patient. When we say thirty minutes, it's not because there's some sort of conspiracy to force you to open your wallet, it's because we need thirty minutes. Oh, and pharmacists make so much because they spend 6 years gaining the knowledge to make sure your laundry list of meds don't interact with each other and kill you. But, if none of that bothers you, I can close my eyes and throw 30 random pills in a bottle for you, without caring or knowing if it's right or not. /rant.""",50,45,2014-03-30,PHARMA,0.06842302531003952,0.9051521420478821,0.026424773037433624
Health,Researchers are giving psychedelics to cancer patients to help alleviate their despair — and it's working,,3,44,2014-03-30,PHARMA,0.02768820710480213,0.5505306124687195,0.42178118228912354
Health,"Stigmas, once evolutionarily sound, are now bad health strategies: Stigmatization may have once served to protect early humans from infectious diseases, but that strategy may do more harm than good for modern humans, according to researchers",,1,32,2014-03-30,PHARMA,0.15648962557315826,0.8173871636390686,0.026123205199837685
medicine,Your tricks for pain control during minor procedures?,"My question is just like the title. Besides general/local pharmacologic pain control, what tricks do you use with your patients, especially peds, to control their pain during procedures (suturing, I&amp;D of abscess, removing packing from abscesses, etc)? 
If its a short procedure, like I&amp;D, I usually have people take a deep breath and blow out slowly as I make my incision. I know there must be a million little tricks, any of you care to share your secrets?",25,29,2014-03-30,PHARMA,0.0430615171790123,0.9259904623031616,0.030948009341955185
medicine,There’s a pill to bring your brain back to its childhood,,2,14,2014-03-30,PHARMA,0.057895760983228683,0.7381435036659241,0.20396074652671814
Health,Researchers develop device that simulates gastro-intestinal tract: New device simulates the gastro-intestinal tract and how it absorbs medication,,0,11,2014-03-30,PHARMA,0.009053696878254414,0.856102705001831,0.13484357297420502
Health,9 private NYC schools have measles vaccination rates that rank lower than the world's poorest countries.,,24,148,2014-03-31,PHARMA,0.5620430111885071,0.3898615539073944,0.04809547960758209
medicine,"""Patient Satisfaction Is Overrated"" 03/06/14 MedScape article (x-post r/nursing)","MedScape requires you to make an account to view this article, so I have copied it below. However, it you want to see the original article written by William Sonnenberg, MD, you may find it [here.](http://www.medscape.com/viewarticle/821288?src=stfb?src=stfb)

&gt;I recently was at the Scientific Assembly of the American Academy of Family Physicians (AAFP) in San Diego, giving a lecture to a large audience of Academy members on respiratory syncytial virus (RSV) bronchiolitis. I mentioned why I thought identifying the RSV virus was important. I stated that if you tell the family the infant has RSV and that there is the expectation that cough will last 1-2 months, this may forestall them going to the ER or urgent care center. In those assembly lines of healthcare, they will be told that their child has ""bronchitis"" and will receive the inevitable azithromycin script. This will make the parents happy, free the healthcare provider of the need for further explanations, and result in a satisfying visit for the administrators of that facility. The trouble, of course, is that an antibiotic has again been used to treat a self-limited viral infection.

&gt;A physician came up to me afterwards and agreed with me but said that he had no choice. He works in one of those venues and is subject to surveys to measure ""quality."" For him, quality is measured in 2 ways: The first is by getting the patient door-to-door in 45 minutes, and the second is by a Press Ganey survey to see if the patient was happy. Because of these measures, he is forced to abandon his role as a responsible steward of antibiotic use to keep his job and get a bonus.

&gt;Another physician in the audience told the crowd that he was able to increase his satisfaction score by 7% simply by prescribing an antibiotic to all patients who call with a complaint of cough, sore throat, or sinus headache. One doctor reported to the media that he had to give Dilaudid® for minor pain because his Press Ganey score was low the previous month.

&gt;I believe that this little-known company, Press Ganey, from South Bend, Indiana, has become a bigger threat to the practice of good medicine than trial lawyers. They are the leading provider of patient satisfaction surveys for hospitals and physicians. For the past decade, the government and healthcare administrators have embraced the ""patient is always right"" model and will punish providers that fail to rate well in these surveys. Press Ganey's CEO, Patrick Ryan, said, ""Nobody wants to be evaluated; it's a tough thing to see a bad score, but when I meet with physician groups I tell them the train has left the station. Measurement is going to occur.""[1] Obamacare has budgeted $850 million in reduced Medicare reimbursement for hospitals with lower scores.

&gt;The mandate is simple: Never deny a request for an antibiotic, an opioid pain medication, a scan, or an admission. One emergency room with poor survey scores started offering hydrocodone ""goody bags"" to discharged patients in order to improve their ratings. And doctors face the reality that uncomfortable discussions on behavioral topics -- say, smoking or obesity -- come with the risk of a pay cut. If you tell a patient that their knee pain is related to weight, that their smoking is worsening their child's asthma, or that they can't lose weight because of French fries and not a glandular problem, your ratings and pay will take a hit.

&gt;Satisfied patients are not healthy patients. In a paper published in 2012, researchers at the University of California, Davis, using data from nearly 52,000 adults, found that the most satisfied patients spent the most on healthcare and prescription drugs.[2] They were 12% more likely to be admitted to the hospital and accounted for 9% more in total healthcare costs. Strikingly, they were also the ones more likely to die.

&gt;Overtreatment is a silent killer. We can overtreat and overprescribe. The patients will be happy, give us good ratings, yet be worse off. We must have the ability to deny treatment for a patient's own good. Patients aren't the best judge of what is best for them. Several years ago, an elderly female patient wanted me to write a prescription for tamsulosin because she got a coupon in the mail. It did not matter that she lacked a prostate.

&gt;We should try to be kind to our patients and take time to understand them, but we must resist these misguided pressures and do the right thing. Sometimes patients have to be told ""no,"" and the leadership in healthcare must understand this. Take heart in the words of Mark Twain: ""Always do what is right. It will gratify half of mankind and astound the other.""",57,148,2014-03-31,PHARMA,0.053285205736756325,0.8851956427097321,0.06151914596557617
Health,"Why mentally ill people should have access to E-cigarettes: People with mental illnesses have a unique, intense relationship with smoking, which can ease distress as well as kill. Now that a much safer version of the habit is available, it’s no time for the anti-smoking lobby to play Nurse Ratched",,50,110,2014-03-31,PHARMA,0.04623107984662056,0.916580319404602,0.037188570946455
medicine,The next big thing in medicine?,,8,63,2014-03-31,PHARMA,0.03571576625108719,0.9151844382286072,0.04909982904791832
Health,Genetic study supports link between carbohydrate digestion and obesity: New research indicates that obesity in the general population may be genetically linked to how our bodies digest carbohydrates,,8,52,2014-03-31,PHARMA,0.013180216774344444,0.841456949710846,0.14536283910274506
medicine,"JAMA: Mindfulness-Based Relapse Prevention Beats CBT and 12-Step -- ""people who received mindfulness-based training had “31 percent fewer drug use days and a significantly higher probability of not engaging in any heavy drinking,” a year removed from the end of inpatient treatment.",,3,40,2014-03-31,PHARMA,0.0674273744225502,0.8427421450614929,0.08983054757118225
Health,“Sell By” And “Best By” Dates on Food Are Basically Made Up—But Hard to Get Rid Of,,1,32,2014-03-31,PHARMA,0.029250461608171463,0.9247866272926331,0.04596295207738876
Health,Can you die of a broken heart? Yes,,1,30,2014-03-31,PHARMA,0.30719950795173645,0.589637041091919,0.10316351056098938
Health,"Children who grew up poor but participated in an intensive, 5-year day care program are significantly healthier in their mid-30s than similarly impoverished children who did not receive the same care",,0,26,2014-03-31,PHARMA,0.032151490449905396,0.8660849928855896,0.10176356136798859
pharmacy,Military Pharmacists what is your average day like?,"I am planning on joining the Air Force after I graduate pharmacy school and am curious what I would be doing. I imagine it would be kind of like a retail setting, but I have no idea really.",20,23,2014-03-31,PHARMA,0.014116664417088032,0.9194627404212952,0.0664205476641655
