subreddit,title,selftext,num_comments,score,created_utc,stock/sector,neg,neu,pos
Health,"We Need to Talk More about Physician Burnout - Addressing it might call for the foundation of a new culture in medicine that allows for the space, connection and inspiration required for all clinicians to be healers",,4,110,2018-03-22,PHARMA,0.018659640103578568,0.8990180492401123,0.08232229202985764
Health,"Published this week in the International Journal of Obesity, the study suggests that parents who underestimate the sugar content of everyday foods and beverages commonly included in children’s diets are exposing their children to an increased risk of obesity or overweight.",,9,107,2018-03-22,PHARMA,0.07311665266752243,0.8650254011154175,0.061857905238866806
medicine,"New patient took adhd medication as a child, off for some time, wants to be restarted",[deleted],67,87,2018-03-22,PHARMA,0.025800619274377823,0.8294695615768433,0.144729882478714
medicine,What are some well-validated physical exam findings?,"I'm a prelim PGY-1 at the moment so I was hoping to learn some decently sensitive and specific exam findings that would be helpful in narrowing a differential diagnosis. 

Thanks!",121,86,2018-03-22,PHARMA,0.014382634311914444,0.8366872668266296,0.14893007278442383
medicine,Introducing /r/JuniorDoctorsUK a sub for UK doctors to talk.,"Hello /r/Medicine

Medical training in the UK is different from most places on earth. It requires frequent relocations, applications, exams and interviews, multiple memberships with different bodies and it is much longer than other places with many of us being ""Junior Doctors"" sometimes for 15 years post-qualification.
The UK is also currently in massive political turmoil affecting many doctors, between the new Junior Doctor contract, the looming Brexit, progressive NHS privatization, and Junior Doctors being struck off.

For all those reasons and many others, Doctors in the UK need a place to talk.
Facebook used to be this place. But with lack of anonymity and frequent reports of GMC investigations over seemingly benign Facebook posts, we need a new home.

**Introducing /r/JuniorDoctorsUK**

A place where doctors can share:


* Their workplace experience.

* Career progression and applications advice.

* Opinions on policies that affect their working lives.

* Interesting research and audits.

* Opportunities.

* Funny and relatable posts.

* or anything else...

I also hope for/r/JuniorDoctorsUK to become a sort of crowd-sourced ultimate resource for people in our profession with our growing [Wiki page](https://www.reddit.com/r/JuniorDoctorsUK/wiki/index) that is/will be covering aspects specific to our lives nowhere to be found online. 
I also expect that new opportunities will be created (nation-wide research/audits, multi-center collaborations, community projects/research/polls etc..), and that long lasting change will start here (policies, frameworks, ideas..).


This subreddit is brand new and mostly empty, and UK doctors are notoriously rare on reddit and shy online, for fear of repercussions. Please consider joining and spreading the word to your colleagues to help our community grow and make its way online to a place we can express ourselves freely, and turn it into something awesome.

Hey, if you’re not a doctor, or not from the UK you’re more than welcome to join us, share your opinions, or ask questions! 

PS: I have gotten Mod approval before posting here

tl;dr: UK doctors need a place to talk.",36,56,2018-03-22,PHARMA,0.05917961895465851,0.9117522239685059,0.029068171977996826
pharmacy,AMA survey says prior authorizations hurting clinical outcomes,,33,53,2018-03-22,PHARMA,0.3111787736415863,0.4582085907459259,0.2306126207113266
Health,“Legs-up-the-wall” is the best Yoga pose for sleep you can Literally do in Bed. No fancy Yoga mat required.,,3,41,2018-03-22,PHARMA,0.016848964616656303,0.9010642170906067,0.08208675682544708
Health,"Poll: Both parties need to do more on drug prices. An overwhelming majority, 80%, said drug costs are unreasonable, and about half said passing legislation to bring down prescription costs should be a “top priority”. 72% think pharmaceutical companies have too much influence in Washington.",,39,497,2018-03-23,PHARMA,0.019659511744976044,0.8877125978469849,0.09262791275978088
medicine,iCOMPARE Study Published: Unchanged work hours but decreased satisfaction,,143,177,2018-03-23,PHARMA,0.9567095041275024,0.02551126666367054,0.017779124900698662
Health,"Plant Fats Are Healthier Than Animal Fats, Study Says",,20,110,2018-03-23,PHARMA,0.025515597313642502,0.9292107224464417,0.045273683965206146
medicine,Looking for a new hobby....,"So, now that residency is manageable and I'm actually having at least a little of free time... I have no idea what to do with myself. Prior to medical school, just like all of you, I had many things I enjoyed doing before school. Then grad school and med school and that became my life.

I'm a guy who likes projects. Built computers for years, got my pilot's license, built a motorcycle, built a server, learned to code, stuff like that. I like working with my hands and I miss it. I'm a better person, better husband, better dad, when I have a project to focus on.

So, I figured I'd ask here and see what kind of hobbies you guys got into and how you found them :)",115,104,2018-03-23,PHARMA,0.02871372178196907,0.9138493537902832,0.057436954230070114
pharmacy,We need to teach a class on how insurance works,"This has now happened to both my Australian born roommate and one of my HIV patients at the pharmacy.  When HR sends out the email to pick out insurance, anyone with a middle class income gravitates towards the cheapest plan possible.  No one reads what it means to have a bottom tier plan, all they see is how much per month they have to pay.  My HIV patient had a Bronze level plan that gave him a $4000 deductible and 10% copay after that.  So when I ran his medications, there was nothing under $200, with several being over $1000. Needless to say, he was shocked.  My roommate had it even worse, as it was a minimal basic plan that did not cover any meds and only covered $100 on any other issue.  And she wound up with cysts that required an $80k surgery.  She had to go back to Australia for the surgery.  If someone had just explained to either one of these people how deductibles and a percentage based copay works, there's no way that plan would be chosen.

Instead, I have to sit down with this poor HIV patient and tell him he needs to tell his HR rep that this insurance plan will destroy his income, which means he may have to disclose his HIV status.  And explain why a generic cholesterol medication, when it doesn't go through insurance, is $15 and when it does, is $57.  Felt so bad for the guy.

Tl;dr: read the fine print, Jesus fucking christ.",17,99,2018-03-23,PHARMA,0.045199181884527206,0.9257264137268066,0.029074406251311302
Health,"Western diet depletes artery-protecting immune cells - ""People think atherosclerosis is about cholesterol, diet, and exercise, but it's an immune disease... The blockage of arteries is due to the immune system reacting to excess cholesterol and lipids in the walls of blood vessels."" says Dr. Gaddis",,12,99,2018-03-23,PHARMA,0.03431970998644829,0.9275521039962769,0.03812818229198456
pharmacy,Kroger Pharmacies removing all assistant pharmacy manager positions. Deducting pay by 21%,All assistant pharmacy manager positions are being terminated and are now being renamed as staff pharmacist with home stores; same amount of responsibilities but taking a 21% pay cut. Seems ridiculous but I guess this was bound to happen eventually.,57,78,2018-03-23,PHARMA,0.9354805946350098,0.055290527641773224,0.009228864684700966
medicine,Did measles and diphtheria start reaccuring in your area in any significant numbers?,"Here in our city hospital we have somewhere around 50 measles patients and 2 deaths due to measles, both in adults. Diphteria and scarlarina, to me at least, seems like a diseases that will spring up next. So, I was wondering what's going on in different parts of the world?",31,46,2018-03-23,PHARMA,0.07703924924135208,0.8943888545036316,0.02857191301882267
Health,"Four in 10 cancer cases could be prevented by lifestyle changes - Actions like drinking less alcohol and keeping weight down could help prevent 2,500 cases a week, figures show",,1,42,2018-03-23,PHARMA,0.03490135446190834,0.6630531549453735,0.3020454943180084
Health,Doctors have restored the sight of two people in a monumental world first,,1,42,2018-03-23,PHARMA,0.19321413338184357,0.7020035982131958,0.10478226095438004
Health,Government Gives Stamp of Approval to More Salt In School Lunches and Less Nutrition Info On Menus,,59,608,2018-03-24,PHARMA,0.02409430406987667,0.9181908369064331,0.05771488696336746
medicine,"Labwork recommended and done by pharmacy, wanted my interpretation",[deleted],45,130,2018-03-24,PHARMA,0.03435783460736275,0.8897773027420044,0.07586485147476196
medicine,Can any Paediatric docs here comment on chiropractic-related injuries in children?,"I was recently talking to a friend who's doing an EM residency in a large paediatric hospital, and he was telling me that he's seen a ""fair number"" of children with neck injuries related to chiropractic - no dissections though. I've heard about this before,  but unfortunately that profession doesn't exactly keep good track of these sorts of things, so I have no idea how common this really is.

Could anyone comment? I'm not looking for solid data, just personal opinions.

**EDIT:** Alright I've read through the comments and I'm pretty disturbed.

**EDIT 2:** In case anyone is still checking this, /u/itsfaygopop who is a chiropractor has a comment claiming that paediatric chiro has evidence of being quite safe. When I asked him for some sources, this is the message I got: 

&gt;You asked about research that distinguishes benefit between manipulation and other therapies specifically. Admittedly, other research combines adjustments w/ other physical therapies and thus there is not a lot out there. Maybe part of it is that manipulation on its own really doesn't hold up (which I generally agree with), and its benefit is not on its own, but usually when paired with other treatments it acts synergistic effect. 

&gt; Anyway, a good place to start is [Bronfort et al.](https://www.ncbi.nlm.nih.gov/pubmed/18164469).  The examiners compared 24 different interventionsI believe the link i have for you is in reference to only one of the parts. They found that manipulation alone was superior to placebo, superior to NSAIDS, similar to NSAIDS + exercise. Which presents us one of your follow up questions, of risk vs benefit. To me the net gain is there since NSAIDS carry their own risks which also range from minor to fatal, which I'm sure your aware of as pharmD. 

&gt; For pediatric research; good research is really rare. There is a lot of safety research, suggesting that pediatric adjusting is extremely safe, such as Vohra et al.. However clinical efficacy research is largely practice based research which usually lacks repeat-ability and suffers from bias. Here is the first study that to me finally looks like a solid [randomized trials](https://www.ncbi.nlm.nih.gov/pmc/articles/PMC4730742/), but they haven't published their data yet.

&gt; In all, lack of research is a major problem that I see with my profession, and to get a sizable amount of good data and research is considerably costly, thus its slow to occur. In general only the chiropractic colleges can really afford to do so and the political fighting that occurs within these organizations makes it even harder. So instead most ""research"" are really just case reviews or small scale CBR. Both can easily create bias to either opinion. 

&gt; I'm happy to answer any other questions you may have, even about the profession in general. A lack of understanding and communication between the traditional medical community and chiropractic I believe has created a lot of fear on both sides and causes patients to ultimately be the victims. Unfortunately generally the largest voices in the Chiropractic community usually represents a very small but vocal group that generally runs against the profession's attempts to modernize and integrate.

I haven't read through the sources yet. But it's here in case anyone wants to look at them.",72,126,2018-03-24,PHARMA,0.07089511305093765,0.9022141098976135,0.026890810579061508
pharmacy,Stopped Clinical (movie) in the first 2 minutes because...,"Movie summary on Netflix: A psychiatrist is plagued by flashbacks to a terrifying attack as she treats a new patient who was horribly disfigured in an accident. The first lines of the movie were

Hello this is Dr. Jane Mathis. I'm calling in a prescription for Nora Green. Yes, no ""E"" DOB 2/2/1998. Yes calling in for Risperdal (pronounced ROSperdal) 125mg. Sig one tablet PO BIO. Distribute 60-plus one refill. My phone number's 610-555-7682. DEA B4758491. NPI 13663. Great, thank you so much, bye bye.

That is verbatim word for word.. Sorry, I have no pharmacy peeps that I can rant to at this hour, but 125mg of risperdal BID?? Haha, that's taking 60 tabs a day...",34,75,2018-03-24,PHARMA,0.06990817189216614,0.8989760279655457,0.031115829944610596
Health,Head of FDA blames Pharma for ‘Kabuki drug-pricing’,,3,57,2018-03-24,PHARMA,0.03800884634256363,0.9267017245292664,0.03528936207294464
pharmacy,"For minor issues, do you hunt down the offender or fix it and move on?","I'm about to finish pharmacy school and have noticed that there seem to be two schools of thought on handling minor issues such as crooked labels, bottles not being Xed, typos in sigs, etc.  Some pharmacists try to figure out the specific technician who did whatever the offensive thing was and some will just make a blanket announcement like ""hey guys please be remember to X the bottles"" and ask the nearest technician to fix the issue.  

My thought is that unless it's a potentially serious problem like a misfill then I don't really need to know specifically who did it.  As an intern and tech I never really minded recounting something or fixing a crooked label or or retyping a garbled sig even if I wasn't the one who messed up.  I can see why figuring out the offender would be helpful if it became clear that one person was consistently doing something wrong, but I figure everyone puts a label on crooked or types ""daily"" as ""dialy"" every once in a while and it's not a huge deal.

How do you handle this in your pharmacy?",42,15,2018-03-24,PHARMA,0.12403900176286697,0.8494345545768738,0.026526393368840218
medicine,"Can someone give a breakdown of hospital income based on sources (specialties, e.g. trauma/neuro/gen surg, IMED, etc) (self.medicine)","I'm curious what percent of hospital income comes from different specialties.

I'm sure this depends on the hospital and what they focus on (rehab hospital vs rural hospital vs urban hospital) but any general, specific, or anecdotal thoughts would be helpful!",18,12,2018-03-24,PHARMA,0.023559223860502243,0.9317465424537659,0.04469425976276398
pharmacy,What are your pharmacy hours?,"Just curious after reading that Kroger thread. My store is open 78 hours a week but we’re both salaried at 40 hours so we have 2 hours overlap every week. Personally, I think 9-7 is too long on a Saturday and wouldn’t mind taking a cut to see some daylight. But obviously I’m thankful for what I’ve got.",31,12,2018-03-24,PHARMA,0.03417203575372696,0.915108859539032,0.050719063729047775
pharmacy,CVS: How do I switch districts?,I'm a new hire in California and I'm not getting enough hours. How easy is it to transfer to another district? Will I have to go through an interview process ?,8,11,2018-03-24,PHARMA,0.046518534421920776,0.9172860980033875,0.03619540482759476
pharmacy,Billing coupons for Medicare/Medicaid patients EILI5,"Are we allowed to use coupon cards for medications if a patient has medicare/Medicaid? In which situations?

I get so scared to do it sometimes that I would rather just not even try to run the coupon card, but that isn't ethical either.

I work for a big chain. Our manager says ""if it [our computer system] lets you do it, then its legal"" He also said something like ""if it covers 100% of the cost, then its fine""

I see pots on here asking about coupon billing from time to time and I'm just so confused. I don't see how its a big deal if a person has state/federally funded insurance, and a coupon pays for one of their prescriptions...",46,11,2018-03-24,PHARMA,0.05106968432664871,0.9176079630851746,0.031322333961725235
Health,Medical students say they currently learn almost nothing about the way diet and lifestyle affect health,,134,1103,2018-03-25,PHARMA,0.04561477154493332,0.9125946164131165,0.04179063066840172
Health,"Canada wants clearer warnings on junk food. The US is using NAFTA to stop them. Canada is poised to be the first high-income country to put warning labels on foods high in salt, sugar, and fat.",,43,477,2018-03-25,PHARMA,0.09805253893136978,0.8580436706542969,0.043903812766075134
medicine,What are your thoughts on people protesting in their scrubs/white coats?,,329,458,2018-03-25,PHARMA,0.3147692084312439,0.6329664587974548,0.05226434767246246
medicine,Passive Detection of Atrial Fibrillation Using a Commercially Available Smartwatch,,17,131,2018-03-25,PHARMA,0.014556221663951874,0.9275853633880615,0.057858385145664215
medicine,IV Fluid references,"Hey everyone,

I've always struggled with finding adequate references on the use of IV fluids, and how to give them in a more scientific way than ""I'll just give this solution because that's what we usually use"". What are your references for IV fluid prescription ? What helped you understand the physiology behind prescribing fluids ?

Thanks for your insight !

EDIT: Thanks everyone for all your insightful comments !",34,55,2018-03-25,PHARMA,0.015368121676146984,0.8694689869880676,0.1151629164814949
Health,"As we get older, our endurance declines. An MIT-led research team has now found that it can reverse this age-related endurance loss in mice by treating them with a compound that promotes new blood vessel growth.",,2,54,2018-03-25,PHARMA,0.043682653456926346,0.713700532913208,0.24261674284934998
medicine,Question regarding what is typical of a practice,"This is from a throwaway account.

I'm a subspecialty ICU physician and started my first job in 8/2016.  I'm currently at the largest hospital in my state.  It's a private hospital.  It's on the east coast.

I'm frustrated because my colleagues are just lazy.  Physicians will typically leave the unit and likely the hospital after rounding very superficially.  APC's are frustrated as well as they're left to run an ICU.  I'm constantly playing clean-up...with families and with practicing medicine.  There is very little attempt to diagnose patients that require more than five minutes of thought, but more a push to support vital signs until they can be moved to our associate floor service.  Diltiazem gtt's are started because ""fast HR = dilt gtt"" rather than ever bothering to question what the rhythm is or if the pt is septic.  Relationships with pt's families are dismal and other physicians are generally annoyed by them - palliative care consults are usually placed to even have the discussion that a family member is going to die.  Other physicians would wait on the door from the parking lot into the hospital to tell me ""nothing new with anyone, goodbye!"" so they could leave faster and I would generally be greeted by frustrated nurses and chaos.

My concern is that I've spoken to multiple more experienced travel nurses and have been told that most private hospitals are some degree of this bad.  I went to a well-regarded residency and fellowship program and have options open...however, I don't want to get suckered into something again.  2/3rds of my shifts have been moved to the night shift - at first, I thought I was helping out because our unit director has meetings during the day, but later found it's because they're getting paid x2 for (poorly) covering our service #1 (primary) and #2 (stepdown, new pt's, outliers).  My spending habits haven't changed since fellowship.  Is this really true of other practices?  How do I spot poor places?  When I interviewed, where I'm at looked great.  Is there a way to fix the program I'm at?  I really like the rest of the hospital and am afraid I'll burn everyone else in my group by trying to fix this - which might be justified, but still I need to get a job somewhere else.  I love what I do, but it's getting hard to come into work because I get to start each shift with a couple hours of family updates after trying to fix what was missed during the day.  Our MD's are generally looked down upon by our surgical counterparts because others are not trustworthy.

I'm 35.  I want to plant myself somewhere that I and my family (I have kids) can grow and want to move as little as possible.  Does ""better"" than where I'm at exist?  How do I find out if it's really better?",14,53,2018-03-25,PHARMA,0.07632501423358917,0.8935850858688354,0.030089832842350006
medicine,Moving cross country,How do people move cross country between residency ending on 6/30 and fellowship starting 7/1? How do you get your car to your new location?,26,41,2018-03-25,PHARMA,0.0681159645318985,0.9026530981063843,0.02923097088932991
pharmacy,"CVstress pharmacists, is there still a way to manipulate adherence outreach call scores?",Just curious.. cause you know... all the scores usually need a little gaming.,41,39,2018-03-25,PHARMA,0.02951904572546482,0.9283834099769592,0.042097508907318115
medicine,What do you think the most effective way physicians can advocate for change in society?,"As a medical student, this is something I struggle with. It seems to me that the most common ""attempt"" is posting on social media with an MD after your username. The second most common action, as someone in another thread inquired about, is going to a protest in a white coat and then, subsequently, posting a picture about it on social media.

Personally, I think both don't really do that much. I feel like physicians should be able to do much more.  

I am interested in people who have experience working in legislature, hospital administrations, etc. Any other ideas? 

I entered medical school hoping to help change things, and I am scared of being worn down and becoming complacent.",22,33,2018-03-25,PHARMA,0.023180577903985977,0.9101646542549133,0.0666547566652298
medicine,"After 3 Physician Suicides, Mount Sinai Is Increasing Rent on Resident Housing By 40%",,203,950,2018-03-26,PHARMA,0.020534588024020195,0.8047813177108765,0.17468416690826416
Health,"Sugary drinks are linked to a risk of dying early, according to a study of more than 17,000 people",,55,301,2018-03-26,PHARMA,0.03889257088303566,0.8910444378852844,0.07006291300058365
Health,"Back in 2015, a team of scientists discovered a new antibiotic called teixobactin, the first novel antibiotic isolated from bacteria in over 30 years. Now researchers have, for the first time, successfully synthesized the compound and used it to treat MRSA and VRE superbug infections in mice.",,8,259,2018-03-26,PHARMA,0.013845962472259998,0.8632655143737793,0.12288855016231537
pharmacy,Walked into my pharmacy after new cabinet doors above sink were installed and found this note.,,24,213,2018-03-26,PHARMA,0.016684439033269882,0.7756906747817993,0.20762494206428528
medicine,"""direct"" speech after death of loved ones","a few weeks ago I had an interesting talk with the head of the icu (internal medicine) from my department about communication with relative after the death of a loved one.
the question comes  routinely from absolutely every relative every time
""did he/she have a peaceful death?"" or ""did he/she suffer?""
the attending who it seems is a big fan of buddhism and quotes buddha all the time and said that he is a big proponent of the concept of ""direct speech"", so more or less telling things how they are, bare of emotions and truthfully(no euphemisms etc.). but he said this is the only question where he says ""yes, he/she died peacfully in their sleep"" no matter how it really was.
this took me by surprise because like him or maybe even more, I always was unknowling a big proponent of direct speech and even took pride in being know for frank and authentic conversations with my patients.  but this conversation got me thinking. what good does it do especially in the described situation to tell them how it really was. it will change nothing for the dead patient who i want to be truthful for but everything for the relative.

i don't know exactly what i want with this post. I just enjoy the different insights i got from this subreddit and thought that maybe there are some interesting perspectives to this!",43,147,2018-03-26,PHARMA,0.0321284718811512,0.9232972860336304,0.044574275612831116
pharmacy,Seen in r/showerthoughts 🙄,,16,63,2018-03-26,PHARMA,0.05537789314985275,0.8946020007133484,0.05002013221383095
medicine,Synthesized antibiotic successfully treats infections for the first time,,12,53,2018-03-26,PHARMA,0.009423889219760895,0.4571487605571747,0.533427357673645
