subreddit,title,selftext,num_comments,score,created_utc,stock/sector,neg,neu,pos
medicine,Primary care MD here. The anxiety is becoming overwhelming.,"I practice as a primary care physician in a group, two years out of residency. I am a top producer here, seeing 40+ patients per day. I have always had some tendencies toward anxiety, and probably some GAD, but I have kept a handle on it, even through residency. I have kept it buried well.

It is taking over now. Anxiety about demanding and entitled patients, patients constantly threatening this or that because a refill wasn't addressed instantaneously, even trivial little things. I work in my sleep. I feel dread when my alarm clock wakes me in the morning. I had my first panic attack over the weekend - at least I hope it was just panic and not angina. It absolutely has not affected my patient care, but I worry it will could eventually. (My friend knows and is keeping an eye on that). I can only hold things together by will for so long though.

Medicine is a hugely stressful field, with zero tolerance for mistakes in one of the most complex professions one can follow, with demanding and entitled patients, and with many other issues.  How do you cope with it? I'm looking for a way to continue on.",123,479,2018-03-01,PHARMA,0.16652622818946838,0.8029232621192932,0.030550517141819
medicine,"An illustrated guide to the H’s &amp; T’s, AKA reversible causes of cardiac arrest",,11,234,2018-03-01,PHARMA,0.1584283411502838,0.814690887928009,0.026880798861384392
Health,"A strain of a common human skin bacteria is found to protect against skin cancers, by producing a molecule that inhibits tumors in a mouse model. This bacteria strain is found in healthy human subjects, suggesting that the microbiome of some individuals may confer protection against skin cancer.",,6,226,2018-03-01,PHARMA,0.017966855317354202,0.9137883186340332,0.06824475526809692
medicine,Today is the Match Day in Canada!,Good luck everyone and you will all be great doctors no matter the specialty!,26,187,2018-03-01,PHARMA,0.014611548744142056,0.8526479601860046,0.13274045288562775
Health,"Introducing Uber Health, Removing Transportation as a Barrier to Care",,12,141,2018-03-01,PHARMA,0.021966243162751198,0.9050304889678955,0.07300333678722382
pharmacy,Crazy situation in the pharmacy tonight -- advice wanted,[deleted],37,114,2018-03-01,PHARMA,0.04719196632504463,0.8913682699203491,0.061439815908670425
Health,"Yes, bacon really is killing us",,35,101,2018-03-01,PHARMA,0.14942048490047455,0.6540950536727905,0.1964845061302185
Health,"Supplementation with probiotics during late pregnancy and breastfeeding may reduce risk of eczema, and fish oil supplementation during pregnancy and breastfeeding may reduce risk of sensitisation to food allergens, finds new systematic review and meta-analysis.",,1,97,2018-03-01,PHARMA,0.01152022834867239,0.8156081438064575,0.1728716343641281
pharmacy,Don’t you just love when a customer opens a 30ct bottle to look at the color of the tablet when it’s pictured on the label and then tells you it’s not the one they prefer?,,40,96,2018-03-01,PHARMA,0.02527081035077572,0.9188771843910217,0.055852022022008896
Health,The Benefits of Walking 10 Thousand Steps a Day,,21,78,2018-03-01,PHARMA,0.031010830774903297,0.8781530857086182,0.09083613753318787
Health,"Scientists say diabetes is five separate diseases, and treatment could be tailored to each form, finds new study published in The Lancet Diabetes and Endocrinology.",,38,400,2018-03-02,PHARMA,0.02219095453619957,0.9106394052505493,0.06716964393854141
medicine,"Diabetes is actually five separate diseases, research suggests",,50,272,2018-03-02,PHARMA,0.05734913423657417,0.9155893921852112,0.027061447501182556
medicine,Misrepresentation of being a doctor?,"This is random, but I work in the mental health field as a counselor. In my city there is a psychiatric mental health nurse practitioner with a doctorate in some area of research. He refers to himself as Dr. Lastname. As a counselor, I think it is best for my clients to see board certified psychiatrists. I respect that an NP degree is a challenging thing to receive and that he does have a legitimate phd, however these families see his title of Dr. and go to him, thinking he's a psychiatrist when he's not. He does sometimes list himself as ""Dr. Lastname, PMHNP-BC"" but it still seems really unethical. 

Would you all if you know please fill me in on if there is anything out there that prohibits someone in the medical field with a doctorate in another field from referring to themselves as a Doctor?",274,238,2018-03-02,PHARMA,0.03110204078257084,0.929706335067749,0.03919162601232529
medicine,There's a shortage of opioids where they're needed most - in hospitals,,33,97,2018-03-02,PHARMA,0.14368881285190582,0.8228838443756104,0.03342733159661293
medicine,How a push to cut costs and boost profits at surgery centers led to a trail of death,,63,92,2018-03-02,PHARMA,0.08731526136398315,0.07323389500379562,0.8394508361816406
pharmacy,Risks of pharmacist working for a medical marijuana dispensary?,"I have a phone interview for a position as a pharmacist at a medical marijuana dispensary.  It's definitely something I'm interested in, but I'm a little wary of any potential implications of working there.

First off, are there any legal risks?  It's (obviously) legal in my state (requiring a registered pharmacist to dispense), but still being schedule 1 federally, what risks are there?  If the DEA decides to crack down, could they just come in and arrest everyone working there?  Things like that?

Second off, anyone have any idea how this could impact me for any future job prospects in a more traditional setting?  I have a feeling that a lot of places (retail, hospital, etc.) would immediately toss my resume in the trash if they saw I ever worked for a dispensary.",30,51,2018-03-02,PHARMA,0.15606631338596344,0.8218356370925903,0.022098015993833542
Health,How being overweight causes cancer,,8,50,2018-03-02,PHARMA,0.31578001379966736,0.6482542753219604,0.035965695977211
pharmacy,UPDATE to the crazy pharmacy story from last night,[deleted],6,37,2018-03-02,PHARMA,0.04468396678566933,0.9260967969894409,0.02921922877430916
medicine,What are your thoughts on maggot debridement therapy (especially US physicians)?,"I have been working on an undergraduate project concerning maggot debridement therapy (MDT), and would like to know your opinions/experiences with MDT. If you aren't familiar/haven't used MDT, what do you think of it? All and any opinions of MDT are welcome, I put the qualifier of ""US-based physicians"" in the title because my project analyzes why MDT use in the US is so low compared to other countries.",20,31,2018-03-02,PHARMA,0.030288873240351677,0.930628776550293,0.03908226266503334
medicine,How do you keep going when you're just spent?,"I'm a fellow now eight months into my first year.  I had always planned to do this fellowship and was fortunate to match at a great institution.  However, I'm not really sure I can do this anymore.  This year is entirely clinical and I am essentially the only contact person for our service.  Which means I have to be constantly available and tied to my phone.  Additionally, they made changes in the fellowship after the first of the year that took away almost all of my admin time.  I still have the same responsibilities, just no time to do it--and thanks to an ancient EMR at one of our hospitals, these things can only be accomplished while on campus, yet I now spend most of my time at the other hospital.  Not to mention I'm the one that has to cover everyone's clinics when they're on vacation or at conferences, while still doing all the prep and follow-up for mine even the rare times I am away.  Etc., etc.

Not to mention I moved over 1000 miles away from all my family and friends to do this fellowship.  I'm always working and on call, so I have no friends in my new city and spend what little free time I have in my tiny apartment staring at the TV.  I'm exhausted and at the end of the rope.  Simply put, I'm just spent.  The idea of four more months of this seems unimaginable.  The difference from residency is that I have a feasible fallback option.  I could just move back home and be a generalist in my field.  I'm at the point where the long term effects of that choice really don't matter to me and it seems like a better option with every successive day.

All this rambling leads me to one question.  How do you keep going when you're just spent?  I'm just done and struggling to keep going.  Thanks for your thoughts.",9,29,2018-03-02,PHARMA,0.026186715811491013,0.9175166487693787,0.05629659816622734
medicine,How have you stayed happy as a hospitalist?,"I've been a hospitalist at a busy metro trauma center for about 6 years now. I have already dropped to part time because I enjoy my life so much more than my career. I am angry most of the time while at work. 

How have other hospitalists avoided burnout? Is it just my hospital or is this way of practicing medicine evolving into a forced death march everywhere?",52,199,2018-03-03,PHARMA,0.12016800791025162,0.8506143093109131,0.029217656701803207
pharmacy,40% of pharmacy residents reported to have moderate to severe depression by March in a survey of 700 PGY-1s and PGY-2s,,94,191,2018-03-03,PHARMA,0.48653754591941833,0.445370078086853,0.06809233129024506
medicine,Japanese ads for psychotropics,,13,179,2018-03-03,PHARMA,0.042439427226781845,0.9222642183303833,0.03529641777276993
medicine,Doctor in Kenya performs brain surgery on the wrong person,,66,168,2018-03-03,PHARMA,0.8332720398902893,0.1456269472837448,0.021100999787449837
Health,Researchers are developing a camera that can see through skin - The technology could change the way a number of health conditions are diagnosed.,,5,140,2018-03-03,PHARMA,0.07682637125253677,0.8510031700134277,0.07217049598693848
medicine,What's your income from your job?,[deleted],316,110,2018-03-03,PHARMA,0.07506728172302246,0.8861610889434814,0.03877166658639908
Health,"How a society gala was used to sell young-blood transfusions to baby boomers desperate to cheat death - “People considering enrolling said they had been told they would have to pay $285,000.“",,7,94,2018-03-03,PHARMA,0.03395848721265793,0.9095250964164734,0.056516408920288086
Health,Melon listeria kills three in Australia,,0,56,2018-03-03,PHARMA,0.1836475431919098,0.7691637873649597,0.04718868061900139
pharmacy,How Bad Did I Fuck Up?,"New pharmacist here. About 5 months under my belt. I've been really struggling with insurance and I've been relying on our seasoned tech for all the billing. A few days ago, this bit me in the ass. We just hired 3 new techs with no pharmacy experience. It was just me and one other tech in the pharmacy when the incident happened. Essentially, it was the blind leading the blind.

My perspective:
A lady drops off a script with the new tech for Tamiflu. The tech inputs it and can't process the claim because we don't have insurance information. (New tech didn't think to ask. Of course the patient doesn't tell us). Lady comes back to pick up the Tamiflu and its not ready. When I ask her for her insurance information she said something like ""Why didn't you call me? My son is sick."" I didn't know what to say so I said ""I should have"" even though I've literally never seen anyone in the pharmacy call a patient if we didn't have insurance information. She was pretty pissed and gave her insurance card and left.

We only have brand name Tamiflu (suspension) in stock (anyone else in this boat btw?), so her copay was like $60. I called the insurance company and they wouldn't budge. I called her to tell her and she's like ""My son is sick. I'll pay whatever I have to. Have it ready in 20 minutes."" So we got it ready. When she tried to pay, her HSA card wouldn't work. I'm new. I have no idea wtf is going on. I paged the store manager to help and she couldn't figure it out. The lady got super mad and started dropping the f bomb and telling the new tech that she hopes she can't sleep at night. I didn't know what to do and I sheepishly just kept checking other prescriptions. She eventually paid with her credit card and filed a complaint. Our PIC is really mad.

What our PIC said I should have done:
When we found out we didn't have information, we should have searched for it using a search system thing. I'll admit, he did show it to me before, but I've always relied on our techs for that and I completely forgot about it. I apparently should have called a different insurance company to ask for the override? I still don't understand the whole insurance world. I just called the number that was provided under our ""agency help"" tab, which was for express scripts. He wrote down the ""correct"" number for us (he had it memorized) which wasn't even for express scripts (we used the ""correct number"" the next day for a tamilflu script btw and they gave us an override). As far as the HSA malfunction goes, apparently our pharmacy has an issue accepting some HSA cards. There was an email sent out with directions to work around it literally 2 hours before the incident (I didn't see the email because I was busy working).

In short, if our seasoned tech was there, this never would have happened. If I would have thought to search for her insurance and called the correct number for the override, this never would have happened.

I feel really bad. This whole insurance world is just overwhelming to me. I spent 6 years learning the clinical side of pharmacy and that isn't enough to do the job, apparently. I have had literally no training with insurance. I actually asked our district manager for additional training after the incident, but we'll see if that ever happens. I feel like I've been only doing and was prepared for only 50% of the job and now I feel overwhelmed. Fuck. Someone hands me an insurance card and I basically shit my pants now.

Anyway, I guess that was my first official complaint after 5 months. Its a learning experience for sure. Best believe I'll be using that search function and calling the correct number from now on. The thing is, suppose someone has something other than express scripts? I still have no idea wtf to do then.

On a scale of 1-10, how bad did I fuck up?

Side note: Tamiflu is essentially garbage, right?",58,48,2018-03-03,PHARMA,0.10800179839134216,0.8680065274238586,0.02399168536067009
pharmacy,Shingrix reconstitution,,24,47,2018-03-03,PHARMA,0.04008142277598381,0.9266611933708191,0.033257316797971725
Health,Australia on track to become first country to completely eliminate cervical cancer,,15,632,2018-03-04,PHARMA,0.01927841827273369,0.7608489990234375,0.2198725938796997
medicine,This NYC Hospital Has A Physician Suicide Problem It Doesn't Want You To Know About,,87,624,2018-03-04,PHARMA,0.43549662828445435,0.5404500365257263,0.024053359404206276
medicine,A newbie's guide to how to work night shifts published in the BMJ,,71,276,2018-03-04,PHARMA,0.032699067145586014,0.9197170734405518,0.04758387431502342
Health,No-frills micro hospitals with as few as 8 rooms emerge as a new way to cut health-care costs,,20,204,2018-03-04,PHARMA,0.023246001452207565,0.7843502759933472,0.19240371882915497
medicine,Does the concentration of IV epinephrine change the pharmacologic effects in cardiac arrest?,"On more than one occasion there has been heated debate about giving IV/IO epi in cardiac arrest as 1mg in 10 ml vs 1 mg in one ml. General consensus is that ACLS guidelines recommend the 1:10 concentration, and several people are questioning it with the argument of, ""1mg is 1mg no matter how you give it.""",18,54,2018-03-04,PHARMA,0.041056569665670395,0.9263995289802551,0.0325438492000103
medicine,My colleague created visual abstracts and infographics of recent landmark clinical trials!,,6,42,2018-03-04,PHARMA,0.012318728491663933,0.8498613834381104,0.1378198117017746
Health,"Ketamine could be the new drug for depression that researchers have been looking for - Some researchers have called the drug ""the most important discovery in half a century.""",,2,35,2018-03-04,PHARMA,0.01309118140488863,0.8260396122932434,0.16086922585964203
medicine,Blame anaesthesia,,53,24,2018-03-04,PHARMA,0.12453858554363251,0.8302117586135864,0.04524967446923256
pharmacy,PGY-2 rank list due in two days - might be getting cold feet.,"So my main concern is that I'll be too over-specialized if I get the PGY-2 in emergency medicine that I interviewed for. 

My plan after PGY-2 is to move to Chicago (no choice in location due to spouse's job) which reduces my flexibility. I enjoy emergency medicine but I don't want to pigeonhole myself into just one specialty when I have also enjoyed my other experiences as a resident. 

Will I be able to get an inpatient job with just a PGY-1 in Chicago? 

Will doing a PGY-2 limit my options?

I would love some input. Thank you in advance.",11,16,2018-03-04,PHARMA,0.0214847382158041,0.9001220464706421,0.07839324325323105
pharmacy,What pay rates are recent graduates getting offered and from where?,"I’d like to see if anything changed in the community or stayed the same?  Are you graduating soon? What year did you graduate, and how long did it take you to receive and accept an offer? For who? And what’s the rate? I think this would be helpful for onlookers and those involved in the field now.",8,13,2018-03-04,PHARMA,0.019582564011216164,0.9104806780815125,0.06993675231933594
Health,Minnesota Health Department finds drastic drop in opioid usage following registration with medical cannabis program,,10,389,2018-03-05,PHARMA,0.8753979802131653,0.10842049866914749,0.01618148572742939
medicine,This ad in an orthopedic magazine.,,97,328,2018-03-05,PHARMA,0.050657548010349274,0.916984498500824,0.03235793858766556
Health,Nanobots kill off cancerous tumours as fiction becomes reality - Researchers inject tiny devices into the bloodstream to deliver drugs with precision,,5,140,2018-03-05,PHARMA,0.017945244908332825,0.9206687808036804,0.06138600781559944
pharmacy,Working my first shift as a pharmacist tomorrow!,"And I am super excited!!! 

Just wanted to share. 😁

Edit: IT WAS AWESOME! Thanks everyone! Let’s see how long this excitement lasts 😎",33,131,2018-03-05,PHARMA,0.015859359875321388,0.8749588131904602,0.10918182879686356
Health,Women who used the most cleaning chemicals twice as likely to get breast cancer as those who used the least. My question is: What other everyday items do we use that have hidden health consequences?,,47,106,2018-03-05,PHARMA,0.17959365248680115,0.7973268628120422,0.023079536855220795
medicine,Primary care coding opportunities,"In outpatient primary care, we need to catch every possible coding opportunity to keep up our current productivity as compensation decreases and busy work increases. I am going to list some common codes I use on top of your typical 99212-5/99202-5. Please list any you use as well.


Medicare wellness - G0438 or G0439
Don’t forget if a problem is addressed at this visit, you can do two notes essentially on one patient and get paid for an E&amp;M visit and the wellness. The copay May be required though 


Transitional care management 99495 or 99496
For patients discharged from the hospital and seeing you afterwards


Home health certification and recertification 
G0180 or G0179


Chronic care management 99490 - this one has proven to be much harder to set up a system for me


Advanced care planning 99497 and 99498
End of life discussions 


Non face to face services
* need a separate documentation/encounter
* document the time spent, what you are doing, and what E/M it is related to or coming up
* Example: review a stack of records before they come. Not on the date of E/M service
* 99358 - 30min to 1st hour on a single date
* 99359 - each additional 30 minutes 


Cognitive and Functional Assessment
    * G0505 - I haven’t done this one yet if someone can explain it to me


Smoking cessation 
99406 or 99407
I’ve had good luck with these


Metered dose inhaler teaching
94664
Teach a patient how to use an inhaler 


I have been told you can code for doing mental health screening such as PHQ9, GAD7, etc but I have not been able to find out much about this. If someone has had luck please give some insight. 


Then of course the common procedures:
Joint aspiration or injections
Skin tag removals
Punch biopsy
Shave biopsy
Destruction of lesions 
Abscess incision and drainage 
Trigger point injections 


Any other opportunities please give your insights.",12,51,2018-03-05,PHARMA,0.037043001502752304,0.9277113080024719,0.035245705395936966
Health,"This nation pioneered modern life. Now epic numbers of Americans are killing themselves with opioids to escape it. No other developed country is as devoted to the poppy as America. (We consume 99 percent of the world’s hydrocodone, 81 percent of its oxycodone.)",,3,44,2018-03-05,PHARMA,0.028528155758976936,0.9173554182052612,0.054116472601890564
Health,"Average desk contains 400 times more germs than a toilet seat, new research reveals - Average work space has tens of thousands of bacteria",,7,27,2018-03-05,PHARMA,0.016583152115345,0.9001902341842651,0.08322659879922867
medicine,The Price They Pay,,20,19,2018-03-05,PHARMA,0.06581557542085648,0.8883057832717896,0.045878637582063675
medicine,UKMLA starts in 2022 - global licensing exam for any doctors wishing to practice in the UK after this date,,21,15,2018-03-05,PHARMA,0.042525626718997955,0.9243479371070862,0.03312649577856064
medicine,"The ""Real Reason"" You Have to Wait So Long at the Doctor's Office (video)",,78,478,2018-03-06,PHARMA,0.060862839221954346,0.9084299802780151,0.030707141384482384
pharmacy,Alright. Which one of you did this??,,11,368,2018-03-06,PHARMA,0.023909974843263626,0.8981705904006958,0.07791947573423386
Health,Vaccines won’t overload your child’s immune system—or increase their risk of other infections,,53,351,2018-03-06,PHARMA,0.069780632853508,0.8814976811408997,0.048721689730882645
medicine,"So, we met with the Patient Experience Coach today ...","He will follow all MD/DO/APC's into exam rooms and will observe how we interact with the patients to help improve the patient experience. 

Anyone else met their coach yet? Ours was so professional, he described one doctor that he worked with as ""Uber, uber smart."" So that was fun.",119,154,2018-03-06,PHARMA,0.01832302287220955,0.8584888577461243,0.12318815290927887
Health,"Children are suffering worse injuries at public trampoline parks than when using trampolines in private gardens, a hospital audit has found.",,14,154,2018-03-06,PHARMA,0.21579167246818542,0.7511427998542786,0.03306550905108452
pharmacy,Walgreens Outage Day 2,"I walked in to 55 Drug Utilization Reviews from yesterday, almost everything is still timed out, and we literally have to manual check interactions for every single medication I'm filling. 

I can't delete/modify/out of stock/change manufacturers at all and tomorrow we might get a foot of snow so every narcotic patient is stopping in early to say hello.

Life is good, how are all of you doing?",33,97,2018-03-06,PHARMA,0.037610914558172226,0.9211294651031494,0.04125962406396866
medicine,"In a recent small study 18 random 100 U/mL insulin vials bought in US pharmacies, all 18 had low insulin concentration (14-94 U/mL, mean 40 U/mL, minimum standard 95+ U/mL). Thoughts?",,21,76,2018-03-06,PHARMA,0.022227689623832703,0.9058176875114441,0.071954645216465
pharmacy,Pretty sure I can have this ready in 15 minutes or less...,,6,69,2018-03-06,PHARMA,0.024559903889894485,0.9301461577415466,0.04529387876391411
Health,Fasting diet 'regenerates diabetic pancreas',,1,35,2018-03-06,PHARMA,0.024829857051372528,0.9196620583534241,0.055508118122816086
pharmacy,So I was just asked to go back to retail...,"After far too long in retail, I finally left late last year to be a technician at a LTC pharmacy, and it has changed my life. It’s relaxing, the pay is better and, (for the most part) the other techs and pharmacists actually treat each other nicely and with respect.

On the other hand, the retail store I left is not doing too good. Got a call from one of the former staff pharmacists, now PIC. Asking me to come back. Couldn’t meet or exceed my current pay, but there was a bright side they said:

Unlimited overtime.

Edit: just to make it clear I have no intention of ever going back to this store or retail in general. It just made me laugh.",13,26,2018-03-06,PHARMA,0.03933505713939667,0.9019991159439087,0.05866582691669464
