subreddit,title,selftext,num_comments,score,created_utc,stock/sector,neg,neu,pos
medicine,What are your thoughts on Cyclic vomiting syndrome brought on by chronic cannabis use?,"So Im an ER RN, I was caring for my patient and assessing them while the MD had already seen them and she told me on another occasion that she uses cannabis every day during my initial intake assessment. She told me that she took 6 showers during that day alone. This patient presented to the ED with N/V/D for past week. I immediately think back to mental health nursing and think of cyclic vomiting syndrome from cannabis use and went to inform the MD of what I had further assessed. The MD had no idea about the frequent showering for relief of nausea and looked at me like I was an idiot. She said we weren't going to get the urine drug screen that I suggested and made me feel like I was stupid in front of all my co-workers like that wasn't a real thing. What and why do you think the MD did that and why wouldn't she order the urine drug screen? This patient has been held at other hospitals in the area for the same problem and discharged with a generic gastroenteritis bc this is not very well known and a relatively newer syndrome, I figured I was helping her put a diagnosis with this patients problem. Let me know your thoughts!",54,45,2018-03-11,PHARMA,0.11980873346328735,0.8485372066497803,0.031654130667448044
Health,"Knitting should be prescribed on NHS to lower blood pressure, reduce depression and slow dementia",,6,42,2018-03-11,PHARMA,0.07194670289754868,0.608024001121521,0.32002928853034973
medicine,Can medicine be profitable and charitable?,"I work in a very large private practice, about 30 years old. There are 15 practicing physicians across 5 locations. We have our own cath lab, our own outpatient surgical center, our own cardiac monitoring center, our own research department, etc, etc. Lately the problem has become that we cannot keep our offices staffed, either with front desk staff or with RN’s. At full staff we have 20 front desk staff and 10 RN’s; we currently have 12 front desk staff and 5 RN’s. 6 people have quit in the past 30 days. 

I say all of this because I believe that there is an issue with company culture. The president of the company can be quite callous and, while I’ve never seen him sacrifice patient care for the bottom line, makes comments that indicate he prioritizes the cash over the wellbeing of at least his employees. 

So, HCP’s of Reddit: can a private practice turn a profit while still doing what is best for the patient, and not for the bottom line?",18,34,2018-03-11,PHARMA,0.11898291110992432,0.8585754036903381,0.022441625595092773
Health,"Hearts Get 'Younger,' Even At Middle Age, With Exercise: “We took these 50-year-old hearts and turned the clock back to 30- or 35-year-old hearts”",,12,469,2018-03-12,PHARMA,0.038334764540195465,0.8922240734100342,0.06944111734628677
medicine,What’s so funny??,,22,389,2018-03-12,PHARMA,0.06491629034280777,0.9006558656692505,0.03442781791090965
medicine,Case #2 - My heel hurts,"25yo male presents with a few weeks of worsening left heel pain. He’s had some intermittent fevers and trouble ambulating. He states that a month or so back he was treated for pneumonia but his cough has persisted. Plain film of the foot shows some soft tissue swelling over the calcaneous. He also notes a new spot that popped up on his left arm.  Heel is noted to have a large bullae over it. 

What further history, physical, labs, imaging do you want?",25,165,2018-03-12,PHARMA,0.29834896326065063,0.6542535424232483,0.04739746078848839
medicine,How involved do you get in the medical care of your family?,"So my mother went to her PCP complaining of UTI symptoms and I'm a little annoyed that she was given a five day course of Cipro. She has no medication allergies, and there was no reason to throw a fluoroquinolone at an uncomplicated UTI. She's in her early 60's so hasn't needed me as a health advocate too much up to this point, but I can't help but think there will be times as she gets older when I disagree with some of her providers. Plus I am also very passionate about antibiotic resistance so this annoys me for multiple reasons. I have no plans on saying anything, as I don't want to be that annoying family member, but I was just curious if any of you ever speak up? I feel like it's one thing if she was hospitalized  and I mentioned it when getting a daily update on her status, but it's a whoooole other thing to call someone's office and say, ""Hey, why did you order that?"" when it really isn't too much of a big deal. In general, when a provider makes a call that you're not too keen on, but it's nothing particularly serious, do you just let it go, or does anyone actually say anything about it?",61,78,2018-03-12,PHARMA,0.04948222264647484,0.9225825071334839,0.02793526090681553
medicine,Do you hold beta blockers when a patient is admitted for sepsis?,"This is a multi-part sort of question based on  a case I recently had. 

This is something I've seen get done fairly regularly at my hospital, though I can't find evidence to support it. When I look, I see mostly ""promising"" studies about possibly *initiating* beta blockers for septic shock, but there really isn't any guidance on what to do with them -if anything- if a person is already on them at home., and then they show up iseptic.

The second overall question is, let's say a person is on beta blockers for paroxysmal a fib and comes to the hospital in sinus rhythm. Can the discontinuation of the beta blocker result in the patient converting back to a fib? The way I understand it, beta blockers are NOT rhythm control drugs and therefore wouldn't be able to convert people into sinus rhythm when they are in fib. So I extend that to also mean that their discontinuation shouldn't result in people converting OUT of sinus either. Is there any information on this?",35,66,2018-03-12,PHARMA,0.03279385715723038,0.931416928768158,0.035789258778095245
pharmacy,PBM blames health care workers for rising drug costs.,"This add is infuriating. I hope sheeple don't start to believe this.

https://m.youtube.com/watch?v=nazo4LMu6j4&amp;feature=youtu.be",25,55,2018-03-12,PHARMA,0.16939473152160645,0.7531803846359253,0.07742490619421005
pharmacy,"""Don't worry we already did strongpak this week.""",,25,36,2018-03-12,PHARMA,0.029915494844317436,0.8720505237579346,0.09803397208452225
medicine,"If physicians had an effective lobbying group, what do you believe should be their top agenda?",What do you believe should be the main goal in current political climates to protect the interests of physicians in the USA?,73,33,2018-03-12,PHARMA,0.010542964562773705,0.7961716651916504,0.19328539073467255
medicine,Whats your system for retaining medical knowledge?,"Clinical clerk here. As I rotate through specialties, especially those that I'm considering interesting, I'm coming across so much new information that I'm sure to forget in the future. At the same time, taking notes seems inefficient and I wonder if taking notes throughout medical school &amp; residency will result in a textbook size worth of information that's difficult to parse. 

Do you have any systems, techniques, tools you use to learn, review, and store the volumes of information you learned in medical school, residency, and practice? Any tips for how to build a system that is practical?",19,32,2018-03-12,PHARMA,0.019896334037184715,0.9209371209144592,0.0591665543615818
medicine,"Panic, chronic anxiety and burnout: doctors at breaking point",,3,22,2018-03-12,PHARMA,0.40080487728118896,0.5526039004325867,0.04659126326441765
pharmacy,This doctor is very confident in the efficacy of Diflucan...,,11,262,2018-03-13,PHARMA,0.027370866388082504,0.9215294718742371,0.05109970644116402
Health,Why Our Ancestors Were Protected From Alzheimer’S - A pair of Harvard researchers is challenging what we think we understood about Alzheimer’s—&amp; might have stumbled on a big clue for a cure.,,18,247,2018-03-13,PHARMA,0.014451340772211552,0.850443422794342,0.13510523736476898
medicine,There remains a fundamental gap between the aims of hospital design and the final user experience,,45,229,2018-03-13,PHARMA,0.1821165233850479,0.7874013781547546,0.030482133850455284
Health,"US deaths from lead exposure 10 times higher than thought, study suggests",,8,219,2018-03-13,PHARMA,0.07768606394529343,0.025627462193369865,0.8966864943504333
Health,"Report: Big tobacco is targeting the world's most vulnerable to increase profits - The tobacco industry is increasingly targeting vulnerable populations in emerging markets, such as Africa, Asia, and the Middle East, where people are not protected by strong tobacco control regulations.",,1,98,2018-03-13,PHARMA,0.013894227333366871,0.57841956615448,0.40768617391586304
Health,Study: Eating Highly Processed Foods Linked to Increased Cancer Risk,,11,92,2018-03-13,PHARMA,0.5179381370544434,0.07485271990299225,0.4072091281414032
medicine,Doctors/PAs working in urgent care... Is amount of patients per day dependent on the demographic area?... new grad can't tell if im being bullshitted,[deleted],38,75,2018-03-13,PHARMA,0.03813525289297104,0.9206487536430359,0.04121600463986397
Health,Adolescent cannabis use is associated with increased risk of psychosis,,5,47,2018-03-13,PHARMA,0.28222382068634033,0.6369612812995911,0.08081487566232681
medicine,What fancy new (or old) therapies/drugs are a pain to deal with?,"As an example, monoclonal antibodies as cancer drugs are obviously a good thing, but when they're panreactive with every cell we put the patient's plasma on, it's an arduous process to remove them (bonus, which process we use changes depending on which mab they're on). 

Are there similar sorts of annoyances for other medical professionals? Not for the mabs in particular, just things that are helpful to the patient, but a pain for you to do your job around.",61,32,2018-03-13,PHARMA,0.0208361204713583,0.9256791472434998,0.05348474532365799
Health,"Bill and Melinda Gates think a weaponized disease may be the biggest threat to humanity - “A bioterrorist event could spread so quickly, and we are so unprepared for it”",,0,26,2018-03-13,PHARMA,0.03978860750794411,0.8856455683708191,0.0745658129453659
medicine,"Theranos chief executive Elizabeth Holmes charged with ""massive"" fraud",,90,363,2018-03-14,PHARMA,0.7116483449935913,0.2533903121948242,0.03496142476797104
Health,NHS homeopathy ending in London - A major centre of homeopathy will no longer be able to spend NHS money on the controversial practice.,,12,216,2018-03-14,PHARMA,0.22716094553470612,0.7411314845085144,0.03170756623148918
Health,U.S. healthcare spending twice as high other high-income nations,,45,207,2018-03-14,PHARMA,0.07878165692090988,0.4080299139022827,0.5131884813308716
medicine,"TIL that chewable Viagra is a thing in Mexico, Canada and Europe. What is your surprising medical ""TIL"" you picked up in the course of your work?",,87,122,2018-03-14,PHARMA,0.015270068310201168,0.8454647064208984,0.13926519453525543
medicine,"If atrial repolarization is masked by ventricular depolarization in EKG, why we cant see it in heart block type 2?",,12,121,2018-03-14,PHARMA,0.029946334660053253,0.9177424907684326,0.05231111869215965
medicine,Can neurologists or other well-versed parties weigh in on this nice summary of the controversial evidence base for tPA in acute ischemic stroke?,,100,115,2018-03-14,PHARMA,0.03329204022884369,0.911403238773346,0.055304788053035736
medicine,"The first doctors to feel the effects of automation might be surgeons, not radiologists",,28,99,2018-03-14,PHARMA,0.03946785628795624,0.918135941028595,0.042396217584609985
medicine,Dealing with a difficult Co-Resident,"Question for co Meddit folks

I am chief of a surgical service right now and having issues with a mid-level resident. Would love some advice!

Resident has a family with kids, and he has had some health issues in the past. He has done training elsewhere prior to joining our program and is in fact PGY level two years above me however is four years behind me in our training. He is more than adequate with floor work, surgery, consults, and all clinical medicine.

The ISSUE is he is an awful teammate. He has over 10-15 call requests per month for family issues. He leaves every day as soon as his cases are done without helping the team. He is completely incapable of taking any feedback or instruction from me as the chief of service. Any time I ask him to stay later, perform a task or see a consult I get a TON of attitude or it is thrown right back at me to do it myself. Finally, and what bothers me the most is that he undermines me to the rest of our largish team (7 people). He questions my management and tries to change the plans the attending surgeons have TOLD ME to implement. He also mocks me to the other residents (behind my back of course).

I am very non-confrontational and nice, have never had an issue like this in seven years of training. I tried to discuss the issues with him in a non-aggressive manner and he implied I was targeting him and reported it to staff who asked me to just drop it. They indicated they know he is an issue, but has been involved with HR and they do not want to push it and risk HR violation or lawsuit. 

I feel like I am on constant egg shells with this person and I genuinely think they are a good doctor! I really just want a harmonious workplace and this person seems to be just completely out for themselves.

Has anyone else dealt with a similar person and is there good advice to handle it in a safe way?

I am graduating soon and have a great job lined up. I am confident in my abilities both clinically and technically with absolutely no fear of starting practice but this is making my last few months just miserable. 

Thanks",102,95,2018-03-14,PHARMA,0.06932927668094635,0.8985609412193298,0.03210984915494919
pharmacy,Ohio Legislators looking into CVS Caremark billing practices,,22,81,2018-03-14,PHARMA,0.04484755918383598,0.9260227084159851,0.029129713773727417
medicine,Why is insurance requiring me to write the number of headaches that a patient has per month on triptan scripts?,"It seems like insurance companies keep putting more and more barriers in the way of me caring for my patients. It used to just be putting a diagnosis of diabetes on diabetic supply scripts. The latest is that as of today, I have to document the number of headaches that a patient has per month on his sumatriptan prescription. They already had a 9 or 10 tablet per month limit. Why are they stopping my patient from getting his medication and making me spend time to send them a new script?!",43,67,2018-03-14,PHARMA,0.04814479127526283,0.9122315645217896,0.03962356597185135
Health,‘I would not have survived’: Stephen Hawking lived long life thanks to NHS - Scientist was defender of health service and attacked Jeremy Hunt for privatisation plans,,13,471,2018-03-15,PHARMA,0.022272590547800064,0.8661268949508667,0.11160047352313995
Health,Tests on major brands of bottled water have found that nearly all of them contained tiny particles of plastic.,,20,402,2018-03-15,PHARMA,0.2952188551425934,0.6653589010238647,0.039422281086444855
pharmacy,When you’re super behind and the patient asks why it’s not ready yet,,25,204,2018-03-15,PHARMA,0.027074353769421577,0.9128075242042542,0.060118138790130615
medicine,Doctors with hypochondriasis?,How common is hypochondria among medical professionals? I know this is extremely common among medical students who are learning about new diseases all the time. But how commonly do seasoned attendings suffer from this?,88,124,2018-03-15,PHARMA,0.02458922378718853,0.9095844626426697,0.06582629680633545
pharmacy,Even superheroes need their prescriptions,,12,94,2018-03-15,PHARMA,0.03281804919242859,0.9211735725402832,0.04600845277309418
medicine,Anybody have first hand experience treating patients with exposure to nerve agents?,"Seeing as it's in the news. Anybody with first hand experience of cases where your patient was either exposed to a nerve agent or suspected to have been exposed?

Any stories regarding outcomes and long term effects of the exposure?",48,77,2018-03-15,PHARMA,0.03715895488858223,0.9348956942558289,0.027945345267653465
medicine,Improving office workflows,"While it is a giant problem ""fixing healthcare"" everything starts with little steps. So what are things that should be working better from your perspective in terms of billing, insurance, scheduling, patient interaction etc? What have you thought ""man why doesnt someone just create XYZ so we could do things better?""

To start off: why is scheduling a patient's visit so 1950? Why can't/isnt there a good service like opentable where I can see an open slot and book it? Theres some companies out there working to fix this issue and will become hopefully the standard in a couple years.

So please list some griefs?!

edit: english typos, more fixing for clarity",36,49,2018-03-15,PHARMA,0.023191401734948158,0.9245518445968628,0.05225673317909241
Health,"FDA Moves To Cut Nicotine In Cigarettes, Helping Smokers Kick Habit",,7,25,2018-03-15,PHARMA,0.11095162481069565,0.8170685172080994,0.07197986543178558
Health,"In 2010 scientists discovered that platypus milk contained unique antibacterial properties that could be used to fight superbugs. Now researchers have replicated a special protein contained in platypus milk in a laboratory setting, bringing it one step closer to being used to save lives.",,2,22,2018-03-15,PHARMA,0.012074115686118603,0.839792788028717,0.14813309907913208
pharmacy,New to r/Pharmacy; advice for a prospective Pharm.D. student starting to have doubts?,"Hey everyone,

So I graduated from TCU with a degree in biochemistry, decent-ish GPA (3.3). I didn't really know what I wanted to do from there and it seemed like graduate school was the only option. I've always been interested in drugs and how they work, so I thought maybe pharmacy school would be a good idea.

So, I took the PCAT and scored in the 99th percentile (was unaware that I was that smart/well prepared). I got into a few schools here in Texas but was turned down by UT, which was a huge disappointment.  

In the meantime, I took a job as a pharm tech trainee at a Wal-Mart pharmacy, and it really turned me off to the profession. I know it was retail, and probably not the best example of retail, but I started getting really depressed and am wondering if I even want to do this at all. I didn't realize how repetitive the job was; it felt like I was working on an assembly line. I quit after about 4 months and am tutoring for now.

On top of that, I'm increasingly getting the vibe that most of the pharm school students I talk to are kind of miserable. They all talk about how they have no time/money and how tough the courses are. I'm considering taking a job for a medical technology company in Wisconsin instead and foregoing this whole thing.

In short, I'm wondering what advice you would give me, what makes the job satisfying to you, what other areas of pharmacy might be more hands-on and less repetitive labor-wise, and maybe what made you want to go to pharmacy school. I would love the salary they make, but I wouldn't love getting yelled at by customers/doctors and doing the same couple tasks over and over and over all day long.

Hopefully I didn't bum any of y'all out too much. I'd appreciate any advice.",50,21,2018-03-15,PHARMA,0.22713811695575714,0.7489948868751526,0.02386702597141266
Health,The White House is putting the finishing touches on a long-promised plan to combat the opioid crisis. One of the measures would be to give drug dealers who sold opioids the death penalty.,,108,396,2018-03-16,PHARMA,0.1280585527420044,0.8442882895469666,0.027653157711029053
medicine,My favorite chief complaint ever.,,154,377,2018-03-16,PHARMA,0.029353413730859756,0.9192482233047485,0.051398344337940216
medicine,4 NY doctors indicted for getting paid to write fentanyl spray,,79,322,2018-03-16,PHARMA,0.19704288244247437,0.704022228717804,0.09893482178449631
Health,"Physically fit women nearly 90 percent less likely to develop dementia, according to a study published the current issue of Neurology.",,7,254,2018-03-16,PHARMA,0.03284898400306702,0.9170998930931091,0.050051137804985046
medicine,I think being attacked by patients is becoming an occupational hazard to doctors nowadays.,,71,129,2018-03-16,PHARMA,0.05798178166151047,0.9050335884094238,0.0369846448302269
medicine,"Hi, I am Dr. Mai Khanh Tran and I am running for Congress in California's 39th District! (crosspost)",,2,59,2018-03-16,PHARMA,0.02211461402475834,0.9084314703941345,0.06945385783910751
medicine,Hospital ends nearly 40 year contract with anesthesiology group in alleged effort to increase mid-level involvement,,57,48,2018-03-16,PHARMA,0.1459241360425949,0.7446569800376892,0.10941886901855469
Health,"Can You Be Obese But Heart-Healthy? No, Says Study",,8,39,2018-03-16,PHARMA,0.0424271821975708,0.9023113250732422,0.05526150017976761
medicine,What helps you get through long shifts?,"Everyone is different obviously, so I'm wondering, what helps you guys and gals get through those long shifts? Especially night shifts? 

What do you do to stay awake and sharp? What do you do in the little down time you have if you aren't sleeping? How do you avoid burnout (especially you interns and residents)? For those of you who are really busy most days of the week how do you manage to exercise enough and spend time with your family or significant other? 

For those of you who do lots of overnights especially, what do you take besides coffee or energy drinks to not crash? 

I'm curious to know what is done and the variety of what is done to get through long shifts and long busy weeks.",44,33,2018-03-16,PHARMA,0.078739695250988,0.8764822483062744,0.04477810487151146
Health,"Chinese takeaway meals from restaurants and supermarkets should carry health warnings because they are often high in salt, a campaign group says.",,5,23,2018-03-16,PHARMA,0.541638195514679,0.41419559717178345,0.04416617751121521
Health,A new kind of doctor's office that doesn't take insurance and charges a monthly fee is 'popping up everywhere' — and that could change how we think about healthcare,,65,460,2018-03-17,PHARMA,0.31045618653297424,0.6614481210708618,0.028095735237002373
medicine,My Baby's Life: Who Decides?,,37,124,2018-03-17,PHARMA,0.05198610946536064,0.9039092659950256,0.04410463944077492
pharmacy,APhA fought against pay increases for residents,,14,86,2018-03-17,PHARMA,0.611599326133728,0.18334542214870453,0.20505523681640625
pharmacy,Apparently pharmacy schools are starting to combat the saturation by cutting class sizes.,Good news. Some state schools are implementing this now to combat poor applicant pools and saturation. Anyone else here heard of this in their area?,40,68,2018-03-17,PHARMA,0.10360391438007355,0.8351473212242126,0.06124873459339142
medicine,Ward skills: efficiency and accuracy,"I think medical school, surprisingly, taught me a lot about good medicine.

But good medicine is often not very practical medicine or efficient medicine.

As a junior Doctor, the most important skill I have to learn will probably be accuracy and efficiency. And I’m awfully lacking in those now. It’s only now that I’m starting to understand why we are called “Clerks”. 90% of the skills I need are more secretarial than anything.

Somehow it seems some people are born knowing where to look things up, who to call for this and that, what order to do your work in. But I was born with none of that.

I’m a big self-improvement/ self-help geek so I would love it if you guys could share what tips you have for being the fastest doctor on the team. What simple tips you have that save you time and gives you an edge over your colleagues. Or for those who started like me not knowing where to find stuff or how to do stuff, what the major problems were and how you solved them.",38,57,2018-03-17,PHARMA,0.05341770127415657,0.9109841585159302,0.03559812158346176
Health,"Seven diagnosed with measles in Johnson, Miami counties. Aldi, YMCA among risk sites",,2,27,2018-03-17,PHARMA,0.23991034924983978,0.7070578932762146,0.053031694144010544
Health,Is 60 the New 50? Older Americans are experiencing ‘delayed aging’ — and better health: Americans may be aging more slowly than they were two decades ago.,,6,25,2018-03-17,PHARMA,0.19124868512153625,0.7338160872459412,0.07493524998426437
pharmacy,Costco under investigation by Ontario forensic team over drug company payments,,10,20,2018-03-17,PHARMA,0.056225504726171494,0.9192832112312317,0.024491265416145325
pharmacy,five docs charged with taking kickbacks,"subsys prescribers charged with taking kickbacks

https://www.nytimes.com/2018/03/16/nyregion/fentanyl-subsys-drug-kickbacks.html?smid=tw-nytimes&amp;smtyp=cur",2,20,2018-03-17,PHARMA,0.036414287984371185,0.9217033386230469,0.04188239201903343
pharmacy,Has walgreens changed their hiring policies?,"I had one last hope at a grad intern position. The front store manager I had a scheduled interview with emailed me this morning saying hiring practices had changed and had to cancel my interview.

Feels like i'm royally screwed at this point :/.",25,13,2018-03-17,PHARMA,0.18919304013252258,0.7775769829750061,0.033229995518922806
medicine,“It felt good”,,147,936,2018-03-18,PHARMA,0.02843436785042286,0.6142157912254333,0.35734981298446655
Health,The US spends twice as much on healthcare as other developed nations and gets worse outcomes — and the reasons why show what it’s going to take to reform healthcare,,27,314,2018-03-18,PHARMA,0.4813486933708191,0.35692813992500305,0.16172313690185547
