subreddit,title,selftext,num_comments,score,created_utc,stock/sector,neg,neu,pos
Health,"Hot dogs &amp; beef jerky have been linked to mania in a study - Chemical used to cure meat has been linked to a symptom of mental illness, researchers at Johns Hopkins Medicine find. Nitrates can contribute to mania, a state of heightened mood, energy &amp; arousal lasting a few weeks to months.",,8,23,2018-07-18,PHARMA,0.0672335997223854,0.8942631483078003,0.038503196090459824
medicine,"Doctors, hospitals sue patients posting negative online comments",,109,299,2018-07-19,PHARMA,0.9491369128227234,0.04144721478223801,0.009415879845619202
Health,"More Americans are drinking themselves to death, study suggests",,50,279,2018-07-19,PHARMA,0.5562638640403748,0.4095604419708252,0.03417573124170303
Health,"How disgraced anti-vaxxer Andrew Wakefield was embraced by Trump's America: Twenty years after his discredited paper linked autism to the MMR jab, the doctor – who was struck off the medical register in the UK – has become a leading light in the US and frighteningly influential worldwide",,34,205,2018-07-19,PHARMA,0.01760837994515896,0.8630284667015076,0.11936316639184952
medicine,Effects of aspirin on risks of vascular events and cancer according to bodyweight and dose: analysis of individual patient data from randomised trials,,21,168,2018-07-19,PHARMA,0.03475850075483322,0.9394512176513672,0.025790290907025337
Health,A Spike In Liver Disease Deaths Among Young Adults Fueled By Alcohol,,12,116,2018-07-19,PHARMA,0.8024382591247559,0.12903882563114166,0.0685228705406189
Health,"High fruit and vegetable consumption may reduce risk of breast cancer, especially aggressive tumors",,9,97,2018-07-19,PHARMA,0.12826508283615112,0.2736145555973053,0.598120391368866
pharmacy,Update: on new pharmacist needing advice on how to speed up,"So after reading all the advices you guys gave me yesterday on my post, I went into my 12 hour shift determined to change some of the things that I used to do. First off, I went 30 mins earlier than opening. I typed all prescriptions that were in data entry. I then printed labels and grabbed the bottle from the shelf and started counting. After opening, I continued to count and minimized my cashiering as much as possible. Picked up most of the phone calls. 

By the end of the 12 hour shift I got caught up and filled 210 Rx. I feel like this is working for me better now, and would love to get more input from you guys on here because they're all very helpful.",31,92,2018-07-19,PHARMA,0.04698001220822334,0.8952519297599792,0.057768091559410095
pharmacy,"""CVS fires two employees who were filmed calling 911 on a black woman""",,48,72,2018-07-19,PHARMA,0.8835210204124451,0.10122254490852356,0.015256333164870739
Health,"Pet therapy for senior citizens has been shown to improve social interaction, appetite, and brain stimulation",,0,70,2018-07-19,PHARMA,0.01141267828643322,0.09748561680316925,0.8911017179489136
pharmacy,"‘Forcibly taken away’: UGA grad missing in Loganville, believed to be abducted",,32,67,2018-07-19,PHARMA,0.07046527415513992,0.8786478042602539,0.050886884331703186
Health,"The 5,000% price hike that made Martin Shkreli infamous is no longer paying off - The company lost more than $1M in first quarter of 2018 amid waning sales of $750 pill.",,46,536,2018-07-20,PHARMA,0.794117271900177,0.028244664892554283,0.17763802409172058
Health,"On average, patients get about 11 seconds to explain the reasons for their visit before they are interrupted by their doctors. Only 1 in 3 doctors provides their patients with adequate opportunity to describe their situation, and specialists rush more than primary care doctors, finds a new study.",,47,487,2018-07-20,PHARMA,0.022140324115753174,0.8774455189704895,0.1004142016172409
medicine,What is the rarest diagnosis you have made?,,401,287,2018-07-20,PHARMA,0.0970783457159996,0.8556174635887146,0.04730416461825371
pharmacy,Customer brought us a snap cap tool he made that doesn't suck,,52,236,2018-07-20,PHARMA,0.01922389678657055,0.8995972871780396,0.08117884397506714
medicine,A transgender woman says a pharmacist refused to fill her hormone prescription,,101,144,2018-07-20,PHARMA,0.067296601831913,0.8771366477012634,0.05556672438979149
Health,"Suicides Increase During Heat Waves - for every 1’C increase in temperature, the risk of suicide also increased by 1% to 37%.",,5,60,2018-07-20,PHARMA,0.03512898087501526,0.745723307132721,0.2191477119922638
pharmacy,CNN: A trans woman says a pharmacist refused to fill her hormone prescription.,,86,50,2018-07-20,PHARMA,0.039497315883636475,0.8879867792129517,0.07251584529876709
Health,The Birth Control Device Harming Countless Women - The award-winning filmmakers behind Netflix documentary ‘The Bleeding Edge’ on what they’ve discovered about Bayer’s controversial birth control device Essure.,,5,43,2018-07-20,PHARMA,0.015486589632928371,0.7290244102478027,0.2554890513420105
Health,"Processed meats associated with manic episodes - An analysis of more than 1,000 people with and without psychiatric disorders found that nitrates, chemicals used to cure meats such as hot dogs and other processed meats, may contribute to mania, characterized by hyperactivity, euphoria and insomnia.",,2,33,2018-07-20,PHARMA,0.04468986764550209,0.9232862591743469,0.03202388063073158
pharmacy,PillPack calling to request entire profile transfers?,Anyone else getting non-stop calls from PillPack requesting profile transfers without patients being informed? Is this legal?,39,28,2018-07-20,PHARMA,0.07894695550203323,0.9023293852806091,0.018723608925938606
Health,"Doctors rely on more than just data for medical decision making - A new study from MIT computer scientists suggests that human doctors’ “gut feelings” provide a dimension that, as yet, artificial intelligence does not.",,37,304,2018-07-21,PHARMA,0.022820156067609787,0.876057505607605,0.1011224016547203
medicine,"Hospital identifies doctor shot, killed while riding bike in Medical Center",,71,294,2018-07-21,PHARMA,0.37054675817489624,0.5742600560188293,0.05519316717982292
Health,Sleep Scientist Warns Against Walking Through Life 'In An Underslept State' - “Human beings are the only species that deliberately deprive themselves of sleep for no apparent gain”,,13,175,2018-07-21,PHARMA,0.037821970880031586,0.921451210975647,0.04072686284780502
medicine,"Crosspost from MaliciousCompliance - medical transportation employees ""quit"" job for 10 minutes then get ""rehired"" to get around Medicaid rule",,17,142,2018-07-21,PHARMA,0.7213537693023682,0.2624542713165283,0.01619199849665165
pharmacy,Look what came in Cardinal!!,,33,120,2018-07-21,PHARMA,0.038150083273649216,0.8338740468025208,0.12797588109970093
pharmacy,"Coming to your local pharmacy, as seen on FB...",,24,120,2018-07-21,PHARMA,0.018569307401776314,0.8497656583786011,0.13166503608226776
medicine,Fabulously wealthy ophthalmologists? What gives?,"If you look at any salary survey anywhere, they generally have ops as being in the upper 200'-mid-300s, usually below most of the medical and surgical specialties (but above primary care). What gives? Is ophthalmology too saturated? Are the salary surveys whack?",20,37,2018-07-21,PHARMA,0.03383169323205948,0.9262982606887817,0.039870090782642365
medicine,Ophthalmology Functions Taken Over by Optometrists,"I heard from a relatively reputable source that 30%-50% of general ophthalmology work could be performed by optometrists. Do you guys agree with this assessment? If this is the case, what are the future ramifications for ophthalmologists given a trend in the US towards more efficient, cost-effective healthcare delivery?

Thank you for your thoughts!",58,30,2018-07-21,PHARMA,0.016850218176841736,0.8975235819816589,0.08562619239091873
pharmacy,Question for physicians and other prescribers: why are you adding this to the bottom of your electronic prescriptions?,,21,24,2018-07-21,PHARMA,0.06556972861289978,0.9044725298881531,0.02995772659778595
medicine,Question for physicians and other prescribers: why are you adding this to the bottom of your electronic prescriptions?,,234,16,2018-07-21,PHARMA,0.06556972861289978,0.9044725298881531,0.02995772659778595
Health,Small village in mexico with over 30% diabetic still believe coca cola heals their illness,,41,349,2018-07-22,PHARMA,0.017002882435917854,0.8553354740142822,0.1276615709066391
Health,I was diagnosed with AIDS in 1986 and I'm still around,,6,317,2018-07-22,PHARMA,0.6600319147109985,0.29007455706596375,0.04989349842071533
medicine,Medicine dad jokes,"We haven't had a joke thread in a while, so I'll start:

Hey babe, is your heart racing or are you just happy to see me?

Nah, it's rapid AF",107,311,2018-07-22,PHARMA,0.06398925930261612,0.8286491632461548,0.10736154764890671
medicine,"What exactly does the ""higher standard"" we are held to entail?","Who officially coined this term? Is there any literature -- particularly a mission statement or manifesto-type document of an official governing body -- where the terms of this ""higher standard"" that physicians are held to are concretely spelled out, with examples? I'm sure there are plenty of opinion or editorial pieces by respected physicians in respected medical publications over the years that preach about this concept. But is there anything approaching *law* about exactly what it entails?

As anyone who knows me either on Reddit or IRL would suspect, I am very much a freethinker when it comes to the world of medicine, and as such approach the notion of a ""higher standard"" with a healthy skepticism. If this higher standard involves being unusually compassionate, I'm all for it. But I've seen this phrase trotted out to justify (IMHO) unjustifiable levels of corporate compliance, obedience to the hierarchy, overwork, workplace abuse, and tolerance of treatment and conditions no human being should be suspected to. In short, I think abuse of this nebulous cultural artifact of ""we're held to a higher standard"" is directly responsible for the immense rate of burnout and physicians leaving the profession. As I said, the only higher standard I care to be held to is one of great compassion. Other than that, I want to be treated, and expected to act, like a regular guy, and I think there is nothing unreasonable about this.",101,145,2018-07-22,PHARMA,0.03883611038327217,0.9294077754020691,0.03175605461001396
medicine,How do pharmacy discount cards (GoodRx) work?,"I was reading through another thread here in which a pharmacist was very upset about the use of drug discount cards.  Prior to that point, I only though briefly about them and assumed that the cards were some sort of scheme to negotiate in bulk on behalf of patients without insurance coverage and/or make money selling PHI.  

It appears that these companies are actually somehow forcing pharmacies to sell drugs below wholesale and then charge a service fee to the pharmacy.  If that's actually true, how is that legal?  Why can't pharmacists decline to honor the cards?  

The American healthcare system is just so fascinating; I keep learning new things about how it works and I marvel at the sheer ingenuity of human beings to invent new ways of turning a profit.",22,84,2018-07-22,PHARMA,0.017805935814976692,0.9170300960540771,0.06516392529010773
Health,"Chemicals in beef jerky and hot dogs linked to mania; a state of elevated mood, arousal, and energy that lasts weeks to months, is generally seen in people with bipolar disorder",,10,72,2018-07-22,PHARMA,0.4873829483985901,0.4688182771205902,0.04379875212907791
Health,How the EPA and the Pentagon Downplayed a Growing Toxic Threat,,0,40,2018-07-22,PHARMA,0.7496370077133179,0.22770076990127563,0.022662241011857986
pharmacy,Rite Aid Pharmacy: Tampering with graphs,"I was watching the video that Rite Aid posted where the CEO was encouraging investors to vote to make the Rite Aid-Albertsons merger happen. 

[Link to video](https://www.riteaid-albertsons.com/?utm_source=LinkedIn&amp;utm_medium=PSocial&amp;utm_campaign=RAD&amp;utm_content=Post1)

In the video they have [this graph.](https://i.imgur.com/zuqA9Vg.png)

I drew a rectangle between the bar height differences between Rite Aid/Albertson and Target, which have an $11 difference between them, and [this was the rectangle size.](https://i.imgur.com/bAbtQBj.png)

Now I moved the same rectangle to another two bars that have an $11 difference between them (Kroger and Walgreens). Then I extrapolated the top of the rectangle to show you where the bar should have ended (excluding the circle that has the monetary value), [this was the result.](https://i.imgur.com/yrrFlTG.png)

**Conclusion**: Rite Aid intentionally played with the Rite Aid bar to make it look bigger than it actually should be which is essentially fraud against their shareholders.   

Please correct me if I'm wrong with anything that I posted, this is just my modest effort.",11,33,2018-07-22,PHARMA,0.06690791249275208,0.8966988921165466,0.03639327362179756
medicine,Does anyone of you ever saw a precordial thump work? Tell me your experiences,,39,28,2018-07-22,PHARMA,0.045346859842538834,0.9173653721809387,0.037287790328264236
pharmacy,Just took the NAPLEX and am utterly disgusted with myself,[deleted],36,27,2018-07-22,PHARMA,0.5689290165901184,0.36607471108436584,0.06499628722667694
medicine,Something to get off my chest,"I was in the ICU. There was a patient transferred in who was afraid of doctors. Not in the angry way, not in the angry because scared way, but just in the scared way.

He was in his 60s. Someone thought he had a blood cancer so he was transferred in. Hypoxemic resp failure. Requiring more and more O2. He would whimper, literally whimper anytime someone came in to do a blood gas, or a venipuncture for blood, or even a physical exam. 

He had no family, no friends. Only a cousin across the country. He seemed like a normal guy, but his fear of not only us but the unknown thing going on inside him was always obvious. 

A CT scan showed diffuse metastatic disease. Not a blood cancer, but definitely some kind of solid malignancy. There's no way he was asymptomatic until the day of his admission. He simply waited until his breathing became affected. 

One of the fellows belittled him a bit for his whimpering. I wasn't there to see it, I only heard it. To his face, though, while doing some sort of blood draw. Something along the lines of, Stop it, it's not that bad. But a little worse. Avoiding specifics here.

He was intubated maybe the second day because he couldn't maintain his sats. He was so, so afraid. We told him it would be okay, that it was to help his breathing. He required more sedation than some other people, even for a smaller guy. That's how anxious he was.

I left for the night. When I came back, I learned the team withdrew care and he passed away. His cousin who was his POA had apparently found some advanced directive from decades ago that said he wouldn't want life support if he had an irreversible condition. 

My problem, aside from his crass treatment, is that we didn't have a diagnosis. We didn't have pathology. No primary. My bigger problem is that despite his maybe childlike affect, he was never confused and had never given any indication he couldn't make his own decision. He could have said no to intubation. But he just whimpered, looking terrified. 

One minute he was being put to sleep, and by that night he was gone. He had no time to say goodbye to life. No time to reflect. No explanation as to why this was happening to him. No chance for me, or one of us, to sit with him and listen so he wouldn't be alone. 

One part of me knows that he would have been a difficult extubation. That maybe he would never have really had the kind of time -lucid mentality time- to digest what was happening. There would only be sedation on the vent. But my immediate response on hearing the news the next morning was anger. It was all too quick, I felt. I feel like the fellow, the team was so jaded by all these people who are kept alive by machine and medicine for weeks without hope that they jumped at the chance to put this man to sleep quickly. I get the mercy angle. But I still feel like it was wrong. 

He had this tiny teddy bear with him. It's been sticking with me, this image of the sick scared man with his little teddy bear and no one else except a distant family member miles away. I knew he was going to die, but I didn't want him to die alone. In a selfish way I guess I feel like I was also robbed of my chance to at least fix that aspect of this scenario. 

I don't know. Perspectives appreciated.",119,881,2018-07-23,PHARMA,0.10639568418264389,0.8643280267715454,0.029276307672262192
Health,"A startup backed by Peter Thiel has churned out 20,000 doses of magic mushrooms, and is making more - Compass Pathways, an under-the-radar company with scientific oversight from esteemed scientists, is cranking out psilocybin to study the compound in people with depression.",,15,301,2018-07-23,PHARMA,0.020687522366642952,0.9168245196342468,0.062487900257110596
Health,"Cancer takes an enormous toll financially, and patients feel their doctors’ offices aren’t adequately addressing these concerns. 14% reported losing more than 10% of household income due to missed work, and 17% spent more than 10% of household income on out-of-pocket medical expenses (N=2,502).",,19,300,2018-07-23,PHARMA,0.9053500890731812,0.08272918313741684,0.011920740827918053
medicine,Hats... er... hospital gowns off to the company who kept US hospitals outfitted with coin-op CRT TVs well into the 2010s!,"I posted this originally as a reply to the thread in r/TIL about companies that work to perpetuate the problem they sell a solution to. But it got buried and was, after all, a bit tangential to that discussion. My curiosity has not been satisfied: who *is* this company? How did they get away with their abomination of a service for so long? Do they still exist and ply their shtik in backwater hospitals? I figured someone in r/medicine has worked in enough hospitals long enough to know something about this phenomenon:

Many American hospitals I've worked at, up until relatively recently, had CRT televisions padlocked to some lunky looking swivel arm, with either a coin box or a key-operated power switch. Each and every morning, each inpatient would be greeted by a surly employee, often only slightly healthier than him/her, of this private company which owned and operated these televisions. The employee would either empty the coin box or collect a relatively exorbitant amount of money for one day's worth of a selection of ~13 channels -- cash only either way -- and then lumber up onto a rickety hospital chair and turn the TV on with their key. Or off if it was already on and you either didn't have the money or didn't want to pay it. It must have taken some serious business acumen, plus or minus a great asshole lawyer, a strong union, or some other kind of major ""in"", to wrangle these hospital administrators into multi-decade binding contracts with the provider of a technology -- particularly one for nothing but entertainment -- long after the technology's obsolescence and failure as a viable pay-per-use business plan. The employee would always barge in, without fail, when I was bathing or wiping a patient's ass as a nurse's aide, zero fucks given.",16,93,2018-07-23,PHARMA,0.0801565870642662,0.8963636159896851,0.02347983419895172
pharmacy,When you get Shingrix in but it didn't arrive within the allotted 2 day timeframe so all you can do is look at it before sending it back.,,27,86,2018-07-23,PHARMA,0.0731051042675972,0.8962228298187256,0.030672045424580574
medicine,"Dear new resident, from a nurse","I've asked something like this before, but it wasn't as focused to new residents. 

What's going well with nurses? What do you think could go better? What more information to you want when you get calls? Basically, how can we help? My brand new doctors are awesome, but we have a ton of brand new nurses and brand new doctors, so nobody really knows what the hospital wants. Any general things that could help?",33,57,2018-07-23,PHARMA,0.027538739144802094,0.8976672291755676,0.07479400932788849
medicine,"Proposed change to Medicare payments: one fee for new patients, one for established, irrespective of complexity.",[deleted],23,47,2018-07-23,PHARMA,0.025541508570313454,0.9284079670906067,0.04605047404766083
Health,Night Sweats Causes In Women &amp; Men? Menopause And More - Health and Food Magazine,,2,37,2018-07-23,PHARMA,0.028916513547301292,0.929449200630188,0.04163428768515587
Health,A Move to Undermine Women’s Reproductive Health - The Dept of Health &amp; Human Services proposes a binding rule that'd require doctors to withhold info in clinics that receive federal public family planning money.,,1,32,2018-07-23,PHARMA,0.0447915755212307,0.8723012804985046,0.08290718495845795
pharmacy,Any ottawa pharmacists here,Hey guys and gals. It looks like I will be moving to ottawa in the fall. Just wondering if there are any ottawa pharmacists out here to give me some info on the job market and pay ranges so I know what I should be looking at budget wise for apartments or condos. Thanks,2,27,2018-07-23,PHARMA,0.02344326302409172,0.9031521081924438,0.07340463995933533
Health,"Monsanto's 'cancer-causing' weedkiller destroyed my life, dying man tells court - Testifying in landmark trial, former school groundskeeper describes suffering allegedly caused by company’s chemicals",,183,696,2018-07-24,PHARMA,0.23578864336013794,0.7343427538871765,0.029868625104427338
pharmacy,I'm concerned for our fax machine,,20,364,2018-07-24,PHARMA,0.04474983364343643,0.9158033728599548,0.03944677859544754
medicine,Higher temperatures increase suicide rates in the United States and Mexico,,50,325,2018-07-24,PHARMA,0.6059864163398743,0.3197166323661804,0.07429701089859009
medicine,Dutch trial investigating use of Sildenafil for placental malperfusion stopped after 11 reported deaths of newborns due to lung disease.,,26,173,2018-07-24,PHARMA,0.4545511305332184,0.5082663893699646,0.037182532250881195
pharmacy,Why no pride?,"Throw away account because I feel this going to be downvoted. 

Why does it honestly seem we have absolutely no pride in what we do? Seriously, I can understand letting newcomers know about the job market and the disadvantages that come with being a pharmacist, but holy sh*t seeing other pharmacist actively talk down our profession, saying it’s the worst thing anyone could ever do, etc. just pisses me off. I believe that is the biggest problem that faces this profession. Seriously, whenever I hear other people talk about pharmacists (aside from drug addicts and general assholes) it’s nothing but good things. I’ve also seen IN PERSON at my Pharmacy a patient talking about how noble being a pharmacist was and then the f*cking pharmacist shot her down. 

Wanna know who I honestly believe are actively holding the profession back? Most definitely pharmacists.",118,117,2018-07-24,PHARMA,0.09037116169929504,0.8815011382102966,0.02812766470015049
pharmacy,Did someone say Shingrix?,,13,78,2018-07-24,PHARMA,0.11430864781141281,0.8063134551048279,0.07937789708375931
Health,"“I tried ketamine to treat my depression. Within a day, I felt relief.” How the veterinary anesthetic and recreational drug saved me from suicidal thoughts.",,8,54,2018-07-24,PHARMA,0.027012407779693604,0.6449921727180481,0.32799550890922546
pharmacy,New-grad job search is finally over,"Inspired from (while not as neat and clean) [this post on r/dataisbeautiful](https://www.reddit.com/r/dataisbeautiful/comments/8juu3x/7_months_of_job_hunting_with_no_luck_yet_oc/?utm_content=comments&amp;utm_medium=user&amp;utm_source=reddit&amp;utm_name=u_lucas322)

New grad with three years of hospital experience. I didn't want to do residency but wanted to work in a hospital after graduation. I started applying for open positions in early April on Glassdoor, Indeed, and Google.

I excluded jobs that specifically preferred residency/board certs. Roughly 60% of the jobs preferred 1 year of hospital experience while the rest either didn't specify or were truly entry level jobs. I did apply to 1-2 jobs that were most likely out of reach but worst case they said ""no thanks."" I am very happy to have the position in rural GA that I was offered and couldn't be happier. The market is really quite rough though. Needless to say I'm glad the process is over.

https://i.redd.it/wnhvak9wmsb11.png",23,41,2018-07-24,PHARMA,0.06072637811303139,0.8801422715187073,0.05913138762116432
medicine,"When ‘Concierge Medicine’ Came to Town, I Had Some Questions. I Still Do.",,25,37,2018-07-24,PHARMA,0.06509578227996826,0.8815582990646362,0.05334597826004028
Health,"The noise on children's medical wards at night exceeds the maximum limit recommended by the World Health Organization (WHO), and is significantly louder than in their bedrooms at home, finds a new study. Parents and children get over an hour less sleep in hospital than when sleeping at home.",,2,36,2018-07-24,PHARMA,0.09084583073854446,0.8574422001838684,0.05171195790171623
pharmacy,Choose your starter Pokémon!,,30,560,2018-07-25,PHARMA,0.031781312078237534,0.9335501194000244,0.03466852754354477
Health,"Facebook Won’t Stop Dangerous Anti-Vaccine Hoaxes From Spreading - Russians promoting fake news is bad enough, but pages claiming vaccines harm children is outright dangerous—&amp; the company is doing nothing to stop them.",,61,525,2018-07-25,PHARMA,0.38676443696022034,0.5949172377586365,0.01831824891269207
medicine,Metformin reduces morphine tolerance by inhibiting microglial-mediated neuro-inflammation [through increasing AMPK phosphorylation] (2016),,52,407,2018-07-25,PHARMA,0.03320694714784622,0.920163094997406,0.04662994667887688
