subreddit,title,selftext,num_comments,score,created_utc,stock/sector,neg,neu,pos
medicine,Exclusion criteria for treating hepatitis C?,"Treating hepatitis C ... what are your exclusion criteria?

Hi, I have recently begun treating my own patients for hepatitis C. From a medical perspective, it is a relatively simple protocol-driven process ([http://www.hcvguidelines.org](http://www.hcvguidelines.org)). I can not seem to get any of my office colleagues to treat their patients for hepatitis C, so with their blessing I am looking into doing so, about 50 in all. Doing so is a medical ""no brainer"" - 90-95&amp;#37; cure rate for a potentially fatal illness.

However, given the cost of some of these medications, there are ethical issues. For example, most of these patients are on Medicaid. As a taxpayer myself, I would have a real problem asking my fellow tax payers to pay $94,000 to treat someone for hepatitis C while they continue to drink a case of beer daily, or continue to do IV drugs.

Those are some of my personal exclusion criteria to treat hepatitis C. Some of my GI colleagues are overly stringent ... they won't treat people with depression without a psychiatrist involved (current wait is &gt;12 months).

IDSA weighs in thusly: ""Treatment is recommended for all patients with chronic HCV infection, except those with a short life expectancy that cannot be remediated by HCV therapy, liver transplantation, or another directed therapy. Patients with a short life expectancy owing to liver disease should be managed in consultation with an expert.""",23,32,2018-07-11,PHARMA,0.05973402410745621,0.9135881066322327,0.026677818968892097
medicine,Medical errors may stem more from physician burnout than other unsafe health care setting conditions,,160,779,2018-07-12,PHARMA,0.7460776567459106,0.2348669320344925,0.019055357202887535
Health,Seattle seniors choosing cannabis over opioids for pain,,12,418,2018-07-12,PHARMA,0.0284089595079422,0.939286470413208,0.0323045440018177
Health,"Enjoying full-fat milk, yogurt, cheese and butter is unlikely to send people to an early grave, according to new research, which found no significant link between dairy fats, and heart disease and stroke. Certain types of dairy fat may even help guard against having a severe stroke.",,162,335,2018-07-12,PHARMA,0.024845998734235764,0.5961604118347168,0.37899351119995117
pharmacy,one MILLION dollar deductible,,28,190,2018-07-12,PHARMA,0.027949785813689232,0.8999020457267761,0.0721481591463089
Health,Lawsuits alleging weed killer Roundup caused cancer given green light by San Francisco judge,,1,79,2018-07-12,PHARMA,0.19179369509220123,0.7103142142295837,0.09789201617240906
pharmacy,[Request] How to quickly get over the shakes from beratement from an angry customer.,"I don't know if it's just me, but when I am being absolutely berated by an irate customer I get the shakes and can't exactly think straight for a while (rest of the day and will obsess over for months depending how wrong/ignorant they were). Doesn't matter if it had nothing to do with me or was entirely my fault, being screamed at like that is never fun (retail btw if that wasn't crazy obvious). 

Does anyone have any tips on getting over these feelings once the customer has gone and now you've got the heebie jeebies, but still a million things to do, and are put behind even further because of it?",53,40,2018-07-12,PHARMA,0.20820921659469604,0.7678148746490479,0.023975927382707596
Health,Washing hands can save lives - a simple and effective solution for reducing deaths from diarrhoea,,0,26,2018-07-12,PHARMA,0.019349239766597748,0.8324663639068604,0.1481843888759613
Health,"Half Of Americans Are Trying To Lose Weight, Including Many Who Are Not Overweight, CDC Reports",,2,15,2018-07-12,PHARMA,0.2576862871646881,0.706203043460846,0.036110710352659225
medicine,"A Parallel Universe of Clinical Trials (NEJM, 2018)",,8,15,2018-07-12,PHARMA,0.032110314816236496,0.929859459400177,0.038030289113521576
pharmacy,IL Mandatory Counseling &amp; The New RPh Barcodes,"I know we aren't the first state to have this happen. What are some pro's &amp; cons anyone has noticed with this process, in IL or any state really. I've only worked one shift since they went into effect yesterday. I'm hoping to gather some benefits, concerns, &amp; best practices until I'm on my own as the only RPh on duty the next 4 days (we already have reduced tech help on top of that). TIA!",18,15,2018-07-12,PHARMA,0.0690525621175766,0.8864611983299255,0.04448624327778816
Health,Johnson &amp; Johnson has been ordered to pay $4.7bn (£3.6bn) in damages to 22 women who alleged that its talc products caused them to develop ovarian cancer.,,38,557,2018-07-13,PHARMA,0.9070905447006226,0.07933197915554047,0.013577425852417946
medicine,Spinal Echinococcus granulosus found as cause of nerve pain in French woman,,34,312,2018-07-13,PHARMA,0.11898183822631836,0.8526673316955566,0.028350848704576492
pharmacy,These are next to each other on the shelves 😡,,63,216,2018-07-13,PHARMA,0.06980685889720917,0.9023826718330383,0.027810461819171906
medicine,The Strange and Curious Case of the Deadly Superbug Yeast,,9,67,2018-07-13,PHARMA,0.09586746990680695,0.8603478074073792,0.04378470778465271
pharmacy,Any PICs had to deal with techs stealing?,"How did you catch the tech? 

&amp;nbsp;

I'm missing some controlled drugs per the Sunday red-flag report (at the 3-letter) and can't seem to figure out who it is. A 106 has been submitted and I'm worried the Board of Pharmacy will come and be on my ass",52,26,2018-07-13,PHARMA,0.022949328646063805,0.9115752577781677,0.0654754638671875
medicine,HHS Plans to Delete 20 Years of Critical Medical Guidelines Next Week,,7,25,2018-07-13,PHARMA,0.04291378706693649,0.924235463142395,0.03285076841711998
medicine,Two or three tier Well’s scores,"What is the general consensus when deciding which Well’s scores for DVT/PE to use?

I tend to use the modified DVT criteria with a binary cut-off and the three tier score for PE so that I can use the PERC rule. Is that what everybody else is doing?

I only ask because a resident I was teaching the other day used MDCalc for Well’s DVT and it includes the “old” three tier score.",24,24,2018-07-13,PHARMA,0.03746530041098595,0.9298884272575378,0.03264627605676651
Health,NY health regulators want to legalize recreational marijuana,,1,24,2018-07-13,PHARMA,0.04046866297721863,0.9216629266738892,0.03786839172244072
Health,Trump's EPA Puts Our Health at Risk - The agency’s proposed new rule would allow it to ignore the best available science,,1,20,2018-07-13,PHARMA,0.010630883276462555,0.8857625722885132,0.10360653698444366
pharmacy,RPH's w/ shitty work hours: How do you keep home life happy?,"I'm a new grad that will be moving in with my partner of 2 years. I've accepted a float position in a ridiculously large district. My commute will be 1-2 hours each way. If I have to work at certain stores I may even have to get a  company provided hotel. My goal is to find a position closer to our home base; but who knows how long that will take.

My partner will be working full time as well and have a 45 minute commute. 

I gotta be honest; I'm really terrified our relationship is going to be tested here. How do you guys handle keeping home life happy with these shitty schedules?",15,17,2018-07-13,PHARMA,0.028351662680506706,0.9214731454849243,0.050175171345472336
Health,"New York Health Officials See Marijuana as an Alternative to Opioids - New York should legalize recreational marijuana to temper the harm of opioid addiction, end racial disparity in enforcement and boost tax revenue, state health officials said.",,20,615,2018-07-14,PHARMA,0.09311121702194214,0.8834975957870483,0.023391157388687134
Health,How People Die in America: “the people who die from having no insurance are not around to tell their stories.”,,6,111,2018-07-14,PHARMA,0.0937892273068428,0.8727381229400635,0.03347260132431984
Health,"The inconvenient truth about cancer and mobile phones - On 28 March this year, the scientific peer review of a landmark United States government study concluded that there is “clear evidence” that radiation from mobile phones causes cancer",,45,84,2018-07-14,PHARMA,0.02713865041732788,0.34112098813056946,0.631740391254425
medicine,"Rapper Cleavon Gilman, MD remixes the news and drops the beats to catch you up with what's going down in health policy news.",,6,72,2018-07-14,PHARMA,0.05155235528945923,0.9163478016853333,0.03209981322288513
medicine,New ME/CFS Web Content for Healthcare Providers | CDC Online Newsroom,,33,51,2018-07-14,PHARMA,0.03229726105928421,0.9414819478988647,0.026220746338367462
pharmacy,Another similar drug error waiting to happen,,11,34,2018-07-14,PHARMA,0.6111572980880737,0.34467923641204834,0.04416346922516823
pharmacy,"Liability when another pharmacist performs ""pre-verification""","At my pharmacy, the workflow has a ""pre-verificafion"" step where a pharmacist reviews what the tech types in for a prescription.  (Walgreens calls this the review step)

I'm worried that I will be held accountable for someone else's mistake.

I did the visual verification and counseled the patient. The drug was supposed to be trazodone, but the tech typed in tramadol. The other pharmacist apparently just blew through it quickly and approved it. When I counseled the patient I mentioned that it's used for pain and can cause drowsiness. He said he knew all about it.

How does liability work in this situation? I'm in California if that matters.",50,29,2018-07-14,PHARMA,0.16463246941566467,0.8115485906600952,0.023818856105208397
pharmacy,Hate this company’s opposition to overtime pay...,"Of course I am not going to post the name of the company I work for, but let’s just say there’s a lot of stores nationwide and you’d think they have enough revenue to reward employees that **want** to go above and beyond. 

I work 40 hours a week as a tech and am proud to say I take part time classes in preparation to apply to pharmacy school. Unfortunately my hourly pay just isn’t enough for me to gross $1,000 in two weeks. So for a while I was able to travel to another store the next city over and work 1-2 days of overtime per pay period and I would magically make like $1,300 that check. That was working swimmingly for me as it provided just enough income to pay rent, bills, and not have to do meal prep thru Food Lion for lunch and breakfast every damn day. 

Suddenly overtime store gets in trouble with corporate for handing out so much overtime pay (which as far as I’m aware the pharmacy manager had been provided in his budget.) Mind you this store is notorious for high turnover in techs and is also high-volume itself. Needless to say the hours I spent there each month busting my ass/ putting on my cheery customer service face and generally contributing to stock and prescription maintenance (and even making insurance co. and doctor calls when time allowed) went greatly appreciated. So now this time is cut and every store I approach in my area immediately turns me down when I mention any time work would be overtime.

I know I could just ask for a raise, but I’m not sure that would be approved and it feels petty given the fact that I just got one about 6 months ago. However biannual performance reviews are in the works so who knows. It just irks me that this company would rather point the finger at pharmacy managers for supposed incompetence in training their permanent staff rather than allow an existing employee help pick up the slack and do a damn good job of it too. Granted I won’t be in this situation forever... hopefully I’ll be in school full time soon. But damn if a little extra money from the very company that helped inspire me to go into this field wouldn’t help...",47,25,2018-07-14,PHARMA,0.05918899551033974,0.909574568271637,0.031236466020345688
medicine,Have any of you ever gotten paid for completing an online medical survey?,"Actual question.  I receive survey offers in my inbox on a regular basis and I've tried participating dozens of times.  Out of those attempts, almost all result in a ""sorry but you don't meet the criteria for our current survey.""

Sometimes this happens after one or two demographics questions.  I can understand that; they have a target population to screen for.  However, the majority of these surveys string me along for question after question, sometimes including free text answer boxes, before telling me that I don't qualify and offering no reimbursement.  It would be understandable if these questions were simply collecting demographic data, but I've participated in upwards of ten to fifteen minutes of answering actual survey questions before being disqualified.

It honestly feels like a scam.  The survey creators get plenty of data from me without having to honor their promise of compensation.  I've since unsubscribed from every survey mailing list that manages to find my email address because I'm fed up with being manipulated.

I'm curious if anyone else here has had a similar experience.  Or have any of you actually received the promised honorarium for completing a survey?",11,14,2018-07-14,PHARMA,0.03584147244691849,0.9325540661811829,0.031604476273059845
pharmacy,Switching epilepsy drugs,[deleted],16,13,2018-07-14,PHARMA,0.046105530112981796,0.9246624708175659,0.029232049360871315
Health,"HPV vaccine eliminates skin cancer in 97-year-old, doctors report in a new paper in JAMA Dermatology. The woman had developed a severe case of squamous cell carcinoma, and chemotherapy and surgery were ruled out as treatments. Each tumor was injected with Gardasil, and all of them disappeared.",,26,725,2018-07-15,PHARMA,0.027187390252947807,0.9133726358413696,0.05943991616368294
medicine,"'See ya later, suckas!': Iowa family writes unique obituary for 5-year-old cancer victim",,41,385,2018-07-15,PHARMA,0.04669848084449768,0.8993178009986877,0.053983744233846664
medicine,Neutralization of the Plasmodium- encoded MIF ortholog confers protective immunity against malaria infection,,1,84,2018-07-15,PHARMA,0.0453936867415905,0.9113284349441528,0.04327786713838577
pharmacy,What is the most potent drug in the US Pharmacopeia?,[deleted],45,49,2018-07-15,PHARMA,0.022328253835439682,0.9318175315856934,0.04585422948002815
medicine,Excessive Daytime Sleepiness and β-Amyloid Accumulation in Elderly Persons Without Dementia,,3,23,2018-07-15,PHARMA,0.1356840580701828,0.8405818939208984,0.023734066635370255
pharmacy,Literally just started at 3letter. Quitting for grocery chain offer?,"So I was a grad intern for 3letter. Got licensed 2weeks ago and literally just started working as a pharmacist (3 shifts in).

I sent out some emails to some district leader contacts at various chains to let them know i'm licsensed and to update my resume. One of the grocery chains in my state got back to me and told me several RPH's quit and would love to have me.

So... where do i go from here? He says he can hire me ASAP. Do I just email my 3letter surpervisor and tell her I'm done? Do I wait until i'm fully hired by the grocery chain? Any repercussions w/ 3letter to just straight up leave? Do I need a 2 weeks?",28,20,2018-07-15,PHARMA,0.042198438197374344,0.9231101274490356,0.03469147905707359
pharmacy,What are some business certificates I can get to advance my career?,"Good morning everyone. 

So. I'm a pharmacist that kind of wants to slide a bit toward the business and management side if pharmacy rather than the clinical side. 

I plan on getting an MBA in the future. 

But I was wondering if there are any suggestion for certificates I can study for and obtain in the mean time to jumpstart my career shift. 

Thank you all for your time!",6,10,2018-07-15,PHARMA,0.02449384145438671,0.919971764087677,0.05553438141942024
pharmacy,Workplace drama. Who has experienced it? How do you deal with it?,"Throwaway account for best measure.

I work in a relatively busy pharmacy with several staff. I am a pharmacist. I get the impression that two other pharmacists at my store really do not like me. This is fine, but I feel like it is making me very critical of myself which is impacting my ability to work.

I often get stuck in a pattern of over-analyzing my decisions and second guessing everything I do. I feel like this negatively impacts my other coworkers as they get stuck with extra work because of it and it wastes time.

I have only been practicing for a couple years so I do not have a ton of confidence in myself, but I feel like all this negativity has really pushed me back a fair bit, to the point where I am considering looking for employment elsewhere.

How do you guys deal with drama at work? I understand that it happens everywhere. I have just never experienced it like this.",25,8,2018-07-15,PHARMA,0.29877206683158875,0.6725280284881592,0.02869993820786476
pharmacy,Can the DWO be the sole prescription with Part B for diabetic supplies? And can we fill in the blanks and just have the prescriber sign and date?,"Retail of course. Big chain in particular. Can't get anyone to clarify this and it's a shitshow to get prescribers to fill these out at all, much less correctly.",3,7,2018-07-15,PHARMA,0.06506207585334778,0.9099563956260681,0.024981535971164703
biotech,Working with HIV in BSL2?,"Is working with HIV in BSL2 safe and optimal?

What are the condition and protocols of BSL2?

I recently have an offer at this new start up lab and their protocols and protections for BSL2 look rather primitive. There are a 2nd room before entering the lab, 2 different suits to put on, diff sets of goggles and cover shoes.

I dont know what to expect since I never worked with BSL2 or this kind of virus before. Just looking to compare notes of BSL2 and HIV working environment",16,5,2018-07-15,PHARMA,0.024855827912688255,0.9187554121017456,0.056388817727565765
medicine,Gardasil vaccine for HPV-driven multifocal squamous cell cancer of skin in non-operable 97 year old clears all tumors,,65,530,2018-07-16,PHARMA,0.02636776864528656,0.9198546409606934,0.05377761647105217
medicine,NIH shuts down the $100 million Moderate Alcohol and Cardiovascular Health Trial (MACH15) due to inappropriate interactions between the alcohol industry and the National Institute on Alcohol Abuse and Alcoholism,,35,455,2018-07-16,PHARMA,0.5323188304901123,0.44218429923057556,0.025496922433376312
Health,"Doctor burnout in small practices is dramatically lower than the national average, new study concludes. Physicians who work in small, independent primary care practices report dramatically lower levels of burnout than the national average (13.5 percent versus 54.4 percent).",,12,322,2018-07-16,PHARMA,0.9070577621459961,0.04691470414400101,0.0460275337100029
Health,"A bad marriage can seriously damage your health, say scientists",,10,227,2018-07-16,PHARMA,0.9160753488540649,0.06836496293544769,0.015559756197035313
medicine,"I dislike the word ""provider"" and every time anyone uses it I cringe.",[deleted],101,77,2018-07-16,PHARMA,0.12887750566005707,0.84935063123703,0.021771909669041634
pharmacy,Building a Pharmacy from an empty room - How do I do this?,"So I was recently hired on as PIC for a brand new clinic.  It's actually a really nice building, but the pharmacy is literally empty besides the sink, counter, and windows (drop off, pick up).

I'm excited about opening the pharmacy, but I've never done anything like this before.  My boss has given me somebody who will guide me through the process of daily operations.... but they are licensed in a totally different state.

What will be expected of me regarding actually building this pharmacy from scratch?  They don't have a licensed pharmacist to do anything.  I will literally be the only pharmacy staff member.",20,54,2018-07-16,PHARMA,0.027746837586164474,0.9196880459785461,0.05256512388586998
Health,"Million-dollar health bills have spiked, and expensive drugs are playing a major role: The number of patients whose medical care cost at least a million dollars over the course of a year rose by nearly 90% between 2014 and 2017, according to a new report",,3,53,2018-07-16,PHARMA,0.03869820386171341,0.04920937120914459,0.9120924472808838
pharmacy,Hospital Pharmacists,"-What does a day at work consist of for you? 

-How much do you interact with other medical professionals and patients?

-Do you enjoy your job? 

-Do you have any regrets?",28,47,2018-07-16,PHARMA,0.02898363396525383,0.9162452220916748,0.054771117866039276
medicine,What medically-related books would you recommend?,"Are there any books you could recommend reading, or are generally recommended, to people in the medical field? What are some of the top-rated books?

I've just got a vacation and I usually always read some books over the summer and would appreciate some help!",37,37,2018-07-16,PHARMA,0.025264881551265717,0.9034372568130493,0.07129793614149094
pharmacy,Staff cuts,[deleted],38,34,2018-07-16,PHARMA,0.9540179371833801,0.03640751540660858,0.009574517607688904
medicine,"PSA: NEJM has a YouTube channel with high quality content, but nobody's watching",,33,767,2018-07-17,PHARMA,0.014796742238104343,0.9048609137535095,0.08034239709377289
Health,Bill Gates and a group of investors are backing a $30 million 'venture philanthropy' fund to tackle Alzheimer's,,35,642,2018-07-17,PHARMA,0.014528149738907814,0.840344250202179,0.1451275646686554
pharmacy,Everything that is wrong with retail pharmacy in one screenshot,,132,388,2018-07-17,PHARMA,0.21361039578914642,0.749234676361084,0.03715496137738228
Health,"Scientists Have Discovered The Earliest Evidence of Bread, And It's Much Older Than We Expected",,27,160,2018-07-17,PHARMA,0.029189299792051315,0.823186993598938,0.14762374758720398
pharmacy,Today was fun,,13,116,2018-07-17,PHARMA,0.04268566519021988,0.8779076933860779,0.07940667122602463
pharmacy,We got a box of shingrix in this morning!,,14,106,2018-07-17,PHARMA,0.03214647248387337,0.9178603291511536,0.04999328777194023
medicine,It’s 4 A.M. The Baby’s Coming. But the Hospital Is 100 Miles Away.,,63,80,2018-07-17,PHARMA,0.06859339773654938,0.8514905571937561,0.0799160972237587
Health,"1 in 5 cancer deaths in the US - 134,000 lives in 2018 alone -could be prevented by adoption of known cancer preventive behaviors and broader access to high‐quality cancer care. No new treatments necessary, just ensuring that everyone can and does access the treatments we already have.",,3,56,2018-07-17,PHARMA,0.01247439906001091,0.7858757376670837,0.20164987444877625
medicine,How does everyone feel about publicly disseminating doctor’s home addresses while calling them “murderers”?,,56,55,2018-07-17,PHARMA,0.17761407792568207,0.7819309234619141,0.04045500606298447
medicine,Should I be palming my surgical instruments?,"OB/GYN PGY-1 here. Should I be palming my instruments, like when suturing for example? I did my general surgery rotations in medical school with a very skilled old school CV surgeon and he explained that I would have much better dexterity and ROM if I palmed instead of inserting my fingers into the instruments. I've always practiced suturing while palming and I think I'm as proficient at it as a 3 week old PGY-1 could be expected to be (i.e. not an expert) What do you think? Should I continue to practice like this? Is there a time where not palming the instrument is needed? Do I really need that much practice suturing with inserting my fingers in the instruments?",33,38,2018-07-17,PHARMA,0.029415691271424294,0.9132333397865295,0.05735096335411072
Health,"“An almond doesn’t lactate:” FDA to crack down on use of the word “milk” - FDA head says current products don't meet labeling standards, guidance coming soon.",,156,626,2018-07-18,PHARMA,0.465787798166275,0.5094131827354431,0.024799009785056114
medicine,Metformin reverses established lung fibrosis in a bleomycin model (July 2018 paper),,85,378,2018-07-18,PHARMA,0.036920491605997086,0.9292523264884949,0.03382714465260506
medicine,Routine treatment for cardiac arrest doubles risk of brain damage – study | Science,,79,188,2018-07-18,PHARMA,0.09079128503799438,0.8839712738990784,0.025237442925572395
medicine,FDA asks 3 drug companies to recall their products containing Valsartan and Valsartan/HCTZ due to carcinogenic impurities,,17,174,2018-07-18,PHARMA,0.20004108548164368,0.7781283259391785,0.021830588579177856
medicine,When Genetic Diseases Threaten Patient Privacy (Does your duty of care require counseling patients to inform their families of heritable illness?),,31,173,2018-07-18,PHARMA,0.1662444919347763,0.8127884268760681,0.020967060700058937
Health,Low-Dose Ketamine May Be an Effective Alternative to Opioids - Opioids are commonly prescribed in the emergency department (ED). A new Academic Emergency Medicine meta-analysis found that low-dose ketamine is as effective as opioids for the control of acute pain in the ED.,,7,128,2018-07-18,PHARMA,0.05699362978339195,0.9135493040084839,0.0294570904225111
Health,Trump Just Nominated a Pesticide Exec to Oversee Science at the USDA,,5,84,2018-07-18,PHARMA,0.021784622222185135,0.8714291453361511,0.10678619891405106
Health,Health Insurers Are Using Your Online Shopping Cart &amp; Zip Code to Determine Your Rates - “We have a health privacy machine that’s in crisis.”,,4,74,2018-07-18,PHARMA,0.02027546800673008,0.9446853995323181,0.035039085894823074
pharmacy,What household/over the counter drugs could I use to block an antipsychotic drug?,"Fiction writer here. I'm writing a book set in a nursing home where they use liberal amounts of anti psychotics to manage the residents. Is there something my character could feasibly use in order to block their effect?

Thanks in advance for any help.",24,38,2018-07-18,PHARMA,0.03139756619930267,0.9317303895950317,0.0368720144033432
