subreddit,title,selftext,num_comments,score,created_utc,stock/sector,neg,neu,pos
Health,"Could psychedelics transform mental health? A number of small studies have found psychedelics to show promise in treating mental health disorders like depression, addiction and post-traumatic stress disorder, often where other treatments have failed.",,31,394,2018-07-01,PHARMA,0.034935906529426575,0.8686609268188477,0.09640313684940338
Health,Seeing the same doctor over time 'lowers death rates',,21,168,2018-07-01,PHARMA,0.04501049593091011,0.6984495520591736,0.2565400004386902
pharmacy,"If we suddenly entered the zombie apocalypse, what meds would you grab from the pharmacy shelves first?",,99,146,2018-07-01,PHARMA,0.1884305328130722,0.7764038443565369,0.035165634006261826
pharmacy,Finally got out of retail. If I can do it you can too.,[deleted],34,88,2018-07-01,PHARMA,0.03195502609014511,0.6315475702285767,0.33649736642837524
Health,"Adolescent drinking is associated with changes in the metabolite profile, with some of these changes correlating with reduced brain grey matter volume, especially in young women who are heavy drinkers, finds a new study.",,5,65,2018-07-01,PHARMA,0.040860243141651154,0.8288044333457947,0.13033531606197357
pharmacy,"“I saw a product for _____ on TV last night, and I’m trying to find it...”","Not sure if anyone has dealt with this lately, but within the past few months, I’ve had many customers tell me that they saw an ad for either an OTC weight loss medication, leg cramp pill, etc on TV the previous day or recently.

And then they proceed to ask me if I know what product they’re talking about....? To help me out, they even say “It says you guys sell it.” 

Meanwhile, they never have any idea what it’s called. Ever. Likely can’t even give me the first letter. 

This has only been happening lately (for me) for some reason, but I guess maybe we should take a CE on mind-reading now too? And know every infomercial that’s released all the time? 😂

I love our customers, but some people seem to want to make our jobs more difficult than they need to be...",38,57,2018-07-01,PHARMA,0.06421640515327454,0.8946696519851685,0.041113924235105515
biotech,I started a biotechnology YouTube-channel. All feedback is more than welcome. Three videos done so far.,[removed],25,37,2018-07-01,PHARMA,0.05165399610996246,0.8971392512321472,0.051206812262535095
Health,Medicare spent $2 billion for one drug as the manufacturer paid doctors millions,,1,35,2018-07-01,PHARMA,0.03828579932451248,0.868499219417572,0.09321504831314087
Health,Intermittent fasting: Surprising update - Harvard Health Blog,,9,20,2018-07-01,PHARMA,0.04318499192595482,0.8984807729721069,0.05833432078361511
pharmacy,P3 saturation/ career change,"First time posting, Ive thought about this for sometime and asked family/friends, but wanting some insight from other pharmacy students. Starting P3 year soon, not much work experience (so I'm having difficult time getting jobs in tech/intern bc of inexperience), and TBH hating it. My family refuses to understand about the saturation and forced me into pharm school, Ive always been an A-student etc. Have a Bio/Psy degree from undergrad, hated the thought of touching patients/blood so didn't consider medical school. Pharm school seemed reasonable at the time, now going into 3rd year I dont think I can take it any longer. Im clueless at rotations, and school seems pointless. I have decent grades, Im just not motivated to learn about drugs so much. However, I have 2 more years to go, and my family thinks its stupid to give up on a career now. *I think since Im 25, its now or never. I dont want to add on 100+ more loans for next 2 years, and then end up not being able to find jobs. Am I being foolish at giving up something that I have 2 years left in finishing? Has anyone experience anything similar?* If I do withdraw from school, there aren't many jobs that I can earn as much as a pharmacist with a bio/psych degree. *Should I go back to school and get CS degree, or work on certifications? Im just so lost*",46,11,2018-07-01,PHARMA,0.04125631973147392,0.9059588313102722,0.05278490111231804
medicine,"""We are not authorized to consider for admission a member of the Negro race."" [Emory, 1959]",,159,473,2018-07-02,PHARMA,0.022417448461055756,0.9363212585449219,0.041261300444602966
Health,Doctors have made an “artificial ovary” from human tissue and eggs in a bid to help women have children after cancer treatment and other therapies that can damage female fertility. The team showed that a lab-made ovary could keep human eggs alive for weeks at a time.,,13,286,2018-07-02,PHARMA,0.014697146601974964,0.878775954246521,0.1065269485116005
pharmacy,Thank you for not letting my Dr. kill me,"I passed out &amp; my heart rate is low (cause to be determined).  Because I’m bradycardic, I’m symptomatic &amp; got a script for Zofran.  I take Lexepro daily.  Who knew that combo could widen my QRS complex???
Kelly, my Pharmacist, that’s freaking who!",68,179,2018-07-02,PHARMA,0.019933799281716347,0.8884341716766357,0.09163203090429306
Health,Why tanning beds are more dangerous than the sun | Miami Herald,,8,145,2018-07-02,PHARMA,0.07230273634195328,0.8926482796669006,0.035048939287662506
medicine,Narcan - Thoughts on equipping untrained laypeople with narcan in areas which are NOT prone to opioid overdose?,"Recently I've been hearing from a hospital pharmacist that she was asked to help distribute several large orders of narcan to some community organisations in my area. I was somewhat disturbed at this development given the (quite large) rural area I work in has essentially no opiate addiction problems. 'Ice' aka meth is more of a problem but narcan doesn't help with that. 

Any of you guys from the US got thoughts on this?",71,107,2018-07-02,PHARMA,0.05981406569480896,0.8834644556045532,0.05672149732708931
pharmacy,We don’t get enough of this here. But I just wanted to say...I’m very proud to be a pharmacists and kudos to those of you here who are practicing as well.,[deleted],11,87,2018-07-02,PHARMA,0.02709653042256832,0.8845285773277283,0.08837488293647766
Health,"Bystanders To Fatal Overdoses Increasingly Becoming Criminal Defendants. ""It really misplaces the blame for their loved one's death on another person who really has no more culpability than the one who died.""",,5,52,2018-07-02,PHARMA,0.3488503694534302,0.6272231936454773,0.02392641082406044
medicine,Frustrating encounters with outpatient docs who prescribe expensive meds without considering cost.,"I'll preface this with the fact that I'm a PICU NP. I don't do outpatient, and I could be better about considering costs when discussing medications or therapies, but often my patients are so sick there aren't really alternatives.  I know healthcare costs are a big point of discussion in this group. I got a phone call from my sister (26 years old, no PMH/PSH, very healthy), crying because she's had this mild persistent stomach pain with textbook GERD/chronic gastritis symptoms (very likely gastritis from NSAID/stress) for a while and finally went to a doc about it. 

This doc told her she needed an ultrasound, labs, *colonoscopy and endoscopy* to rule out stomach cancer (?!) and also here take this super fancy PPI (dexlansoprazole). She called me because she has basically no disposable income to pay for the copays on these things, and her PPI was going to cost her $200/mo out of pocket. 

In contrast, when I went to my own PCP with my stress induced chronic gastritis, he tested me for H pylori, did some routine labs, then put me on omeprazole for a month and tapered off. Boom, fixed. 

It was so frustrating that this doc had scared her into thinking that she needed all these invasive tests prior to even trialing any kind of medication. And prescribed her something expensive. If I hadn't been there to recommend something else she just wouldn't have been able to take the original one and would have continued to be in pain until her next doc appt in 4 weeks or so. 

Why would someone prescribe a prescription only PPI when over the counter with maybe higher doses under the direction of a doctor works?",77,51,2018-07-02,PHARMA,0.0667865201830864,0.9047460556030273,0.02846750244498253
medicine,Patient recorded and transcribed visits; Patient Empowerment or Medical Liability?,,19,36,2018-07-02,PHARMA,0.07250174880027771,0.8923025131225586,0.035195767879486084
pharmacy,Do you find throwing away expired meds to be heavy on your soul?,I am a hospital pharmacy technician who refills pyxis machines. Today When I looked at a particular pyxis machine I found that 502 influenza vaccines just expired.,20,35,2018-07-02,PHARMA,0.047992125153541565,0.9022804498672485,0.04972735047340393
medicine,"Nurses quit NHS to work in Lidl [Supermarket] because pay, hours and benefits better",,150,372,2018-07-03,PHARMA,0.8880603909492493,0.0950055867433548,0.016933927312493324
Health,"Operations went more smoothly, with less yelling and other forms of conflict, when the surgeon was female or when male surgeons were surrounded by mostly women, finds new research by anthropologists in PNAS. “And it makes a lot sense. … Men see each other as rivals.”",,44,333,2018-07-03,PHARMA,0.03693953529000282,0.9044589400291443,0.058601513504981995
medicine,Neuro Case Tuesday,"Social media in medicine has a mixed reputation but I've certainly learned some bits and networked with neurosurgeons, neurointerventionalists and neuroradiologists on Twitter, LinkedIn and Instagram and really enjoy seeing other people's cases and their thoughts. There's no doubt there's a success bias and there's only so much you can communicate in 280 characters but I think online cases have a real educational value.

So I've started posting some to those platforms but I thought Reddit might be a good place as well to discuss some neuro cases. If things go well, maybe a couple times a month I'll post something new.

\---------------------

26 y/o M without significant history with several weeks of headache and ""blurry"" vision. Optometrist actually notices papilledema and sends him to the ER. Honestly, kudos to his eye doctor.

Social etoh and tobacco and marijuana

Non focal on bedside testing

Right handed

https://i.redd.it/f5qpgvytxs711.jpg

https://i.redd.it/1re78jruxs711.jpg

https://i.redd.it/ifpujhvvxs711.jpg

https://i.redd.it/giuymhkxxs711.jpg

**What's the MRI show? What's your initial differential?**

&gt;!The non contrast T1 (which I didn't show) doesn't show the tumor as bright. So what we have is a homogenously, avidly enhancing about 2.5cm mass that appears to be intraventricular. Its at the junction of the atrium and the temporal horn on the right. It results in an outflow obstruction and ""traps"" the temporal horn as best seen on the T2 image (image #3). There's extensive FLAIR signal through the right frontal, parietal and temporal lobes reflecting probably mostly vasogenic edema and this results in significant brain compression and nearly 1 cm of right to left midline shift.!&lt;

&gt;!An enhancing intraventricular mass like this should give concern for a choroid plexus papilloma or (considering all the edema what I was worried about) a choroid plexus carcinoma.  Although his age doesn't fit. The differential also must include a meningioma, ependymoma or, less likely considering his lack of systemic disease and history, but not impossible, metastatic diseases.!&lt;

**What's the next step in management? Any other studies?**

&gt;!I'm not sure we need much more in terms of work up. The treatment for this, as even a layperson might deduce, is surgery. There's nothing amongst the differential diagnoses where gross total resection would not be a our goal. He has considerable associated edema and mass effect which he's tolerating well but could certainly cause issues if progressive and so something like a biopsy and then consideration for non surgical control treatment, like radiation, would not be appropriate. I'm not sure we need to subject him to, say, a metastatic work up, preoperatively. The pathology from the operative specimen will tell us the diagnosis and if it is metastatic we can go looking for the primary afterwards. !&lt;

**Any anatomic considerations during treatment?**

&gt;!This is almost certainly on the non-dominant side in this patient. Even if we were on the left side we will be safely away from major cortical structures of concern, namely !&lt;[the language areas](https://en.wikipedia.org/wiki/Wernicke%27s_area#/media/File:BrocasAreaSmall.png)&gt;!. But it is good to be cognizant of them. More importantly will probably be the white matter tracts we're going to violate on our way to the lateral ventricle. Namely !&lt;[the optic radiations](https://www.ncbi.nlm.nih.gov/pubmed/18981826)&gt;!. You may be able to limit this disruption by splitting the sylvian fissure and coming from above. We went through the middle temporal gyrus and limited the size of our working corridor and used no fixed retraction in taking this out. Disruption of this white matter pathway along the lateral wall of the lateral ventricle may give you !&lt;[a superior quadrantanopia](https://www.semanticscholar.org/paper/Disorders-of-the-optic-tract%2C-radiation%2C-and-lobe.-Fraser-Newman/6273cb2620588412a53288a0c8689814b6bb8231/figure/0)&gt;!, in this case left. !&lt;

**EDIT:** [Here's the ""answer"" to this case](https://www.reddit.com/r/medicine/comments/8w1el9/neuro_case_tuesday_conclusion/)",48,276,2018-07-03,PHARMA,0.05232519656419754,0.9164369106292725,0.031237876042723656
medicine,Should I start lying about my hours?,"First week as an intern. I'm scheduled for 82hrs. I'll have that many by, oh, halfway through the day on Friday and I'm scheduled to work through Saturday morning. In theory it will average out next week because I'm on nights/24hr, but in practice the other people are staying here &gt;80 a week as well. 

Should I lie? Putting in hours is pretty much on the honor system. Was the administration full of crap when they told us not to lie about our hours? Or was that the kind of thing  a company says just to look good and punishes you for doing later.",243,244,2018-07-03,PHARMA,0.03602490946650505,0.9249139428138733,0.03906107693910599
Health,Gov. Matt Bevin’s administration is cutting dental and vision coverage for nearly a half-million Kentuckians after his Medicaid overhaul plan was rejected in court,,33,219,2018-07-03,PHARMA,0.7214137315750122,0.24541641771793365,0.03316990286111832
Health,"Drinking coffee, even decaf or instant, may help you live longer: A new study of more than half a million Brits shows your morning elixir may add to your lifespan.",,51,205,2018-07-03,PHARMA,0.01390798483043909,0.8011481165885925,0.18494392931461334
Health,"Pfizer raises prices on 100 drugs—again—despite backlash from public, lawmakers",,11,193,2018-07-03,PHARMA,0.021945085376501083,0.8938276171684265,0.08422734588384628
Health,Healthcare groups want California voters to tax soda,,51,163,2018-07-03,PHARMA,0.07902216166257858,0.8530593514442444,0.06791848689317703
pharmacy,If you were unsure of what the most up to date 1st letter of the DEA number stands for:,,4,107,2018-07-03,PHARMA,0.03971830755472183,0.9401099681854248,0.020171670243144035
Health,Ayahuasca Works Against Severe Depression,,5,77,2018-07-03,PHARMA,0.5738722085952759,0.3887297213077545,0.03739805892109871
pharmacy,What working as a pharmacist on 4th of July looks like,[deleted],37,456,2018-07-04,PHARMA,0.028654372319579124,0.8994988799095154,0.07184676080942154
Health,"People with exposure to paint or other solvents are 50% more likely to develop multiple sclerosis (MS) than people with no exposure. People with exposure to solvents who also carry the genes that make them more susceptible to MS are nearly 7 times as likely to develop the disease, finds new study.",,15,400,2018-07-04,PHARMA,0.07865143567323685,0.8894389867782593,0.0319095104932785
medicine,Neuro Case Tuesday Conclusion,"As a reminder we had [a 26 year old man with a right sided intraventricular tumor](https://www.reddit.com/r/medicine/comments/8vw30g/neuro_case_tuesday/).

We took the patient the day after admission and went via the middle temporal gyrus and resected the tumor.

https://i.redd.it/2idz7askex711.jpg

https://i.redd.it/y1dhx3zlex711.jpg

It was a gross total resection. The patient did well. He probably has a left superior quadrantanopia on chairside testing. He has not been through formal visual field testing and like a lot of patient's with this he himself doesn't really appreciate it in everyday life. But otherwise he's recovered great.

Now the important thing, the pathology turned out to be [meningioma, grade II, chordoid](http://www.pathologyoutlines.com/topic/cnstumorchordoidmeningioma.html). There is [considerable variability in the behavior of these](https://www.ncbi.nlm.nih.gov/pubmed/23617629).  This apparently, histologically, didn't look very aggressive. But there was considerable edema. Intraoperatively, grossly the tumor actually appeared to respect the ependyma but the edema may speak otherwise to that. **Edit:** While there remains some debate over the role of adjuvant radiotherapy, [best evidence seems to be pointing towards RT](https://academic.oup.com/neuro-oncology/article-abstract/19/suppl_6/vi133/4590717?redirectedFrom=fulltext) even in GTR for &gt;= grade II meningiomas.

There is an [association](https://link.springer.com/article/10.1007%2Fs11060-010-0483-3) [with](http://thejns.org/doi/abs/10.3171/jns.2005.102.4.0733?url_ver=Z39.88-2003&amp;rfr_id=ori:rid:crossref.org&amp;rfr_dat=cr_pub%3dpubmed) [Castleman disease](https://www.cancer.org/cancer/castleman-disease/about/what-is-castleman-disease.html). But our patient doesn't have any evidence of hematological disease or malignancy.",19,272,2018-07-04,PHARMA,0.05826958268880844,0.9102912545204163,0.03143911063671112
Health,First ads banned under new junk food rules,,12,126,2018-07-04,PHARMA,0.35404467582702637,0.6210160851478577,0.024939250200986862
pharmacy,Tips for working up patients in hospital more efficiently?,"What’s your process like? Do you write notes or type them out? Printed rounding sheet or have your own personal form?  
  
Also does anybody know a pneumonic for general medical/surgical patients (similar to FASTHUG BID for ICU patients?)",12,41,2018-07-04,PHARMA,0.03637494519352913,0.9345670938491821,0.02905791439116001
Health,Mixed surgical teams lead to less medical error,,3,37,2018-07-04,PHARMA,0.3157229721546173,0.6116436123847961,0.07263340055942535
pharmacy,"$200,000+ debt?","Hi,

I'm curious if anyone in this subreddit came out with $200,000 or more in student loans after school. Were you able to pay it off, or how are you tackling your situation? I'm a second year student, looking to prevent that, but I want to be prepared for the situation.",118,35,2018-07-04,PHARMA,0.2313215434551239,0.728352963924408,0.04032547399401665
pharmacy,Tips on collaborative physician- pharmacist agreement,"As a part of pilot program, I'm in charge of developing and implementing collaborative agreements. I want to start off with no more than 3 disease states and will be utilizing ""incident to"" billing codes for Medicare patients.

I would love to hear from anyone on this sub who can share their experiences/examples/troubleshooting issues etc

Edit: this will be non institution setting.",11,26,2018-07-04,PHARMA,0.019215382635593414,0.935135006904602,0.045649658888578415
pharmacy,How to Handle a Domestic Abuse Victim,"Hi all, I am a pharmacist at a popular chain. Tonight my last patient was a woman who was visibly relieved that we had her difficult-to-come-by medicine in stock. The first thing I noticed about her was the amount of mascara it looked like she had on and the fact that it had obviously been wet at some point recently. While we filled her medication, she rambled nervously the whole time and mentioned some disturbing things: her husband doesn’t let her drive, keeps the SIM card out of her phone, has broken her ribs before, was yelling at her about having to drive to multiple pharmacies to find it, to name a few.

I felt so much for this woman and looked up a local domestic abuse help center. I wrote down the phone number on the small Rx verbal pad sheet so she could fold it and hide it easily. I said, “hey, maybe it’s none of my business but if you give these people a call, they may be able to help you.” Her: “Domestic abuse?” “Yes”

She took the slip and thanked me and left. That was the end of a 12 hour shift, and also the closest I’VE ever come to tears at work. Upon leaving, I am now wondering what more I could have done for her. I want to help her. I know it’s difficult for abuse survivors to even pick up the phone since they live in a constant state of fear. I wish I’d given her my personal number, or offered to drive her, or just told her to wait and took her to my place and then drove her to the center in the morning. It was severe, y’all. I have never seen anything like this. I know there’s a professional line and I’m sure “kidnapping” her so I could help her get the help she needs is probably crossing it.

What would you do?",9,24,2018-07-04,PHARMA,0.06723929941654205,0.8994938135147095,0.03326692804694176
pharmacy,4th of July Annoyance,"Phone Rings.... “Are You Open?” 
Me: 🤦‍♂️",10,24,2018-07-04,PHARMA,0.10786832869052887,0.8258301615715027,0.06630142778158188
medicine,"Tired of boring old VAS pain scales? Try this new, trendy ""Visual Neymar Scale""!",,48,1175,2018-07-05,PHARMA,0.030718762427568436,0.8554549813270569,0.1138262078166008
medicine,"First photograph of a bacterium (anthrax), taken by Robert Koch in 1877",,30,713,2018-07-05,PHARMA,0.031917572021484375,0.9427046179771423,0.02537786215543747
Health,"Hospital Evacuated After Tuberculosis Sample Accidentally Released - This afternoon, the Johns Hopkins Hospital in Baltimore, Maryland reported that a small amount of the infectious germ was potentially released in its facilities while being transported.",,16,329,2018-07-05,PHARMA,0.9302899837493896,0.05660901591181755,0.013100962154567242
Health,UK's top surgeon calls for new procedures to undergo clinical trials. The move would bring surgical innovation more closely in line with the way new drugs are introduced.,,11,188,2018-07-05,PHARMA,0.00834602490067482,0.18736295402050018,0.8042910099029541
medicine,New tooth colony.,,16,110,2018-07-05,PHARMA,0.060151632875204086,0.8101696968078613,0.12967871129512787
medicine,Only in Pakistan - Cat in Operating Room,,23,104,2018-07-05,PHARMA,0.026681890711188316,0.8877052068710327,0.0856129378080368
Health,"(Dis)Trust in Science - The rise of the internet and, more recently, social media is key to explaining the declining public confidence in expert opinion. Unfortunately, research shows that people lack the skills for differentiating misinformation from true information.",,13,86,2018-07-05,PHARMA,0.3197295069694519,0.6554884314537048,0.024782005697488785
pharmacy,Is it a good idea to skip Calculus in college?,[removed],33,25,2018-07-05,PHARMA,0.026500223204493523,0.8859906196594238,0.08750910311937332
Health,"Coffee drinkers are more likely to live longer, according to study of half a million people",,13,21,2018-07-05,PHARMA,0.021486209705471992,0.8628286123275757,0.1156851127743721
medicine,Unknown medical object- found at our old mental health hospital in the UK. An open topped glass container with an indent in the side- large enough to fit a few fingers in. Any idea what it was for?,,9,14,2018-07-05,PHARMA,0.025308016687631607,0.8991796374320984,0.07551229000091553
Health,"Scientists have created a new drug that hunts down and eliminates deadly antibiotic-resistant bacteria by engaging the body’s natural defences. The “immunobiotic” targets a range of bacteria responsible for diseases, including those that often become resistant to last-resort antibiotics.",,15,365,2018-07-06,PHARMA,0.01946374401450157,0.8990100622177124,0.08152619749307632
medicine,“Will you forgive me for saving you?” A perspective article in the NEJM by Torree McGowan,,48,339,2018-07-06,PHARMA,0.03953886404633522,0.9211820363998413,0.039279088377952576
pharmacy,"Idaho pharmacists can now prescribe meds for the flu, strep, UTI, cold sores, asthma, and statins",,99,321,2018-07-06,PHARMA,0.05853044241666794,0.9053164720535278,0.03615311533212662
Health,"New research has found the natural vibrations of cars make people sleepier, affecting concentration and alertness levels just 15 minutes after drivers get behind the wheel.",,20,229,2018-07-06,PHARMA,0.07235069572925568,0.9013918042182922,0.026257513090968132
pharmacy,I got my tech a cake for her last day. She always wanted one of the cards that “make everything free”,,17,110,2018-07-06,PHARMA,0.03031495027244091,0.9278573393821716,0.04182763770222664
medicine,"State Prisons Fail to Offer Cure to 144,000 Inmates With Deadly Hepatitis C",,76,36,2018-07-06,PHARMA,0.6840784549713135,0.29515475034713745,0.020766843110322952
Health,Hidden conflicts? Pharma payments to FDA advisers after drug approvals spark ethical concerns,,2,33,2018-07-06,PHARMA,0.04594656825065613,0.8964210748672485,0.057632382959127426
medicine,Your favorite way to use CME benefits?,I have $1500 and 5 days of CME I need to use before the end of the year. What would be a good way to use it? This is my first CME rodeo so I’m not too familiar with it,34,30,2018-07-06,PHARMA,0.01686323992908001,0.9215670228004456,0.06156972423195839
Health,We Have No Idea How Bad the US Tick Problem Is,,14,29,2018-07-06,PHARMA,0.4228910803794861,0.5273380279541016,0.04977085813879967
